description,price,website,search_term,scrape_timestamp
Garbanzos Cuisine & Co 500g,S/ 5.40,wong,GARBANZO,2024-12-07 17:51:59.944871
Garbanzo Costeño 500g,S/ 6.80,wong,GARBANZO,2024-12-07 17:51:59.944871
Garbanzos en Conserva Essential Everyday 425g,S/ 12.00,wong,GARBANZO,2024-12-07 17:51:59.944871
Garbanzos Tesoro Del Campo Bolsa 500 g,S/ 7.40,wong,GARBANZO,2024-12-07 17:51:59.944871
Garbanzos Bolsa 500 g,S/ 7.90,wong,GARBANZO,2024-12-07 17:51:59.944871
Garbanzos en Salmuera Cuisine & Co 425g,S/ 8.80,wong,GARBANZO,2024-12-07 17:51:59.944871
Garbanzo Frito Salado x kg,S/ 48.50 x kg,wong,GARBANZO,2024-12-07 17:51:59.944871
Garbanzos Horneados Salados Gozana 90g,S/ 11.00,wong,GARBANZO,2024-12-07 17:51:59.944871
Garbanzos Horneados Ajo y Cebolla Gozana 90g,S/ 11.00,wong,GARBANZO,2024-12-07 17:51:59.944871
Garbanzo Precocido Guva 500g,S/ 6.49,wong,GARBANZO,2024-12-07 17:51:59.944871
Garbanzo Picante x kg,S/ 52.00 x kg,wong,GARBANZO,2024-12-07 17:51:59.944871
Garbanzos Horneados Picantes Gozana 90g,S/ 11.00,wong,GARBANZO,2024-12-07 17:51:59.944871
Garbanzos Casa Verde 340g,S/ 7.50,wong,GARBANZO,2024-12-07 17:51:59.944871
Garbanzos Lorenzo 425g,S/ 8.80,wong,GARBANZO,2024-12-07 17:51:59.944871
Lenteja Bebé Cuisine & Co 500g,S/ 5.70,wong,GARBANZO,2024-12-07 17:51:59.944871
Lenteja Costeño 500g,S/ 5.40,wong,GARBANZO,2024-12-07 17:51:59.944871
Quinua Cuisine & Co 500g,S/ 9.30,wong,GARBANZO,2024-12-07 17:51:59.944871
Lenteja Bebé Tesoro Del Campo Bolsa 500 g,S/ 5.50,wong,GARBANZO,2024-12-07 17:51:59.944871
Quinua Costeño 500g,S/ 9.89,wong,GARBANZO,2024-12-07 17:51:59.944871
Trigo Mote Tesoro Del Campo Bolsa 500 g,S/ 3.90,wong,GARBANZO,2024-12-07 17:51:59.944871
Trigo Mote Costeño 500g,S/ 4.60,wong,GARBANZO,2024-12-07 17:51:59.944871
Quinua Tesoro Del Campo Bolsa 500 g,S/ 10.25,wong,GARBANZO,2024-12-07 17:51:59.944871
Pallar Cuisine & Co Bolsa 500 gr,S/ 6.90,wong,GARBANZO,2024-12-07 17:51:59.944871
Quinua Perlada Selecta Incasur Bolsa 250 gr,S/ 11.20,wong,GARBANZO,2024-12-07 17:51:59.944871
Lenteja Cuisine & Co 500g,S/ 5.70,wong,GARBANZO,2024-12-07 17:51:59.944871
Pallar Costeño 500g,S/ 7.20,wong,GARBANZO,2024-12-07 17:51:59.944871
Lentejas Bebé Bolsa 500 g,S/ 6.50,wong,GARBANZO,2024-12-07 17:51:59.944871
Crunch Garbanzo Cheddar Bolsa 100 g,S/ 7.60,wong,GARBANZO,2024-12-07 17:51:59.944871
Quinua Perlada Superior Incasur Bolsa 250 gr,S/ 9.50,wong,GARBANZO,2024-12-07 17:51:59.944871
Quinua Tricolor Orgánica Vidaandina Bolsa 454 g,S/ 19.50,wong,GARBANZO,2024-12-07 17:51:59.944871
Quinua Perlada Nativa Incasur Bolsa 250 gr,S/ 11.90,wong,GARBANZO,2024-12-07 17:51:59.944871
Trigo Mote Cuisine & Co 500g,S/ 3.90,wong,GARBANZO,2024-12-07 17:51:59.944871
Quinua Blanca Orgánica Vidandina Doypack 454 g,S/ 19.50,wong,GARBANZO,2024-12-07 17:51:59.944871
Pallar Tesoro Del Campo Bolsa 500 g,S/ 8.20,wong,GARBANZO,2024-12-07 17:51:59.944871
Quinua tricolor Vida & Quinua Bolsa 454 g,S/ 15.50,wong,GARBANZO,2024-12-07 17:51:59.944871
Lenteja Tesoro Del Campo Bolsa 500 g,S/ 5.85,wong,GARBANZO,2024-12-07 17:51:59.944871
Cereal de Garbanzo Sabor Chocolate Brownie Dyfferent 210g,S/ 13.80,wong,GARBANZO,2024-12-07 17:51:59.944871
Crunch Garbanzo Bbq Bolsa 100 g,S/ 7.60,wong,GARBANZO,2024-12-07 17:51:59.944871
Morón Costeño 500g,S/ 5.30,wong,GARBANZO,2024-12-07 17:51:59.944871
Cereal de Garbanzo Sabor Cinnamon Roll Dyfferent 210g,S/ 13.80,wong,GARBANZO,2024-12-07 17:51:59.944871
Quinua Blanca Vidandina Doypack 454 g,S/ 15.50,wong,GARBANZO,2024-12-07 17:51:59.944871
Lentejón Cuisine & Co 500g,S/ 5.70,wong,GARBANZO,2024-12-07 17:51:59.944871
Quinua Roja Vidandina Doypack 454 g,S/ 13.30,wong,GARBANZO,2024-12-07 17:51:59.944871
Quinua Perlada Gourmet Incasur Bolsa 250 gr,S/ 11.90,wong,GARBANZO,2024-12-07 17:51:59.944871
Lentejón Costeño 500g,S/ 6.90,wong,GARBANZO,2024-12-07 17:51:59.944871
Maíz Mote Sierra Exportadora Desgranado Bolsa 425 g,S/ 14.90,wong,GARBANZO,2024-12-07 17:51:59.944871
Maíz Chulpi Desgranado Kuski Bolsa 425 g,S/ 16.30,wong,GARBANZO,2024-12-07 17:51:59.944871
Quinua Negra Vidandina Doypack 454 g,S/ 15.50,wong,GARBANZO,2024-12-07 17:51:59.944871
Hamburguesa Vegetariana de Garbanzo Della Natura 400g,S/ 19.90,wong,GARBANZO,2024-12-07 17:51:59.944871
Quinua Orgánica Ecoandino 200g,S/ 15.40,wong,GARBANZO,2024-12-07 17:51:59.944871
Lenteja Valle Norte Bolsa 500 g,S/ 6.30,wong,GARBANZO,2024-12-07 17:51:59.944871
Crema de Garbanzo Valle Fertil Hummus Dip Tradicional Frasco 240 g,S/ 22.30,wong,GARBANZO,2024-12-07 17:51:59.944871
Cereal de Garbanzo Sabor Miel Vainilla Dyfferent 210g,S/ 13.80,wong,GARBANZO,2024-12-07 17:51:59.944871
Lentejón Tesoro Del Campo Bolsa 500 g,S/ 6.40,wong,GARBANZO,2024-12-07 17:51:59.944871
Chuño Blanco Kuski Bolsa 425 g,S/ 17.90,wong,GARBANZO,2024-12-07 17:51:59.944871
Crunch Garbanzo Sal Bolsa 100 g,S/ 7.60,wong,GARBANZO,2024-12-07 17:51:59.944871
Mini Hamburguesas de Garbanzos y Espinaca Sanúa 10un,S/ 22.40,wong,GARBANZO,2024-12-07 17:51:59.944871
Quinua Roja Orgánica Vidaandina Bolsa 454 g,S/ 19.50,wong,GARBANZO,2024-12-07 17:51:59.944871
Maíz Cancha Sierra Exportadora Desgranado Bolsa 425 g,S/ 11.30,wong,GARBANZO,2024-12-07 17:51:59.944871
Crema de Garbanzo Valle Fertil Hummus Dip con Alcachofa Frasco 240 g,S/ 22.30,wong,GARBANZO,2024-12-07 17:51:59.944871
Crema de Garbanzo Valle Fertil Hummus Dip con Ajo Frasco 240 g,S/ 22.30,wong,GARBANZO,2024-12-07 17:51:59.944871
Quinua Negra Orgánica Vidaandina Bolsa 454 g,S/ 19.50,wong,GARBANZO,2024-12-07 17:51:59.944871
Palitos de Quinua y Garbanzo con Finas Hierbas Q Sticks Wasi Bolsa 30 g,S/ 4.10,wong,GARBANZO,2024-12-07 17:51:59.944871
Quinua Roja Orgánica Tiyapuy Doypack 340 g,S/ 8.80,wong,GARBANZO,2024-12-07 17:51:59.944871
Burger de Garbanzos Della Natura 100g,S/ 7.90,wong,GARBANZO,2024-12-07 17:51:59.944871
Quinua Blanca Orgánica Tiyapuy Doypack 340 g,S/ 8.80,wong,GARBANZO,2024-12-07 17:51:59.944871
Quinua Tricolor Orgánica Tiyapuy Doypack 340 g,S/ 8.80,wong,GARBANZO,2024-12-07 17:51:59.944871
Quinua Blanca Incatrail 100g,S/ 5.80,wong,GARBANZO,2024-12-07 17:51:59.944871
Quinua Blanca en Granos América Orgánica 340g,S/ 20.90,wong,GARBANZO,2024-12-07 17:51:59.944871
Quinua Tricolor Orgánica América Orgánica 340g,S/ 19.90,wong,GARBANZO,2024-12-07 17:51:59.944871
