description,price,website,search_term,scrape_timestamp,cantidad,unidad,description_no_unit,price_numeric
Albahaca Ecologic 120g,S/ 4.80,metro,ALBAHACA,2024-12-05 16:31:30.029414,120.0,g,Albahaca Ecologic,4.8
Albahaca Hidropónica 80g,S/ 3.00,metro,ALBAHACA,2024-12-05 16:31:30.029414,80.0,g,Albahaca Hidropónica,3.0
Albahaca Fresca Verde Puro 120g,S/ 5.50,metro,ALBAHACA,2024-12-05 16:31:30.029414,120.0,g,Albahaca Fresca Verde Puro,5.5
Concentrado de Espinaca y Albahaca Pomarola 110g,S/ 3.50,metro,ALBAHACA,2024-12-05 16:31:30.029414,110.0,g,Concentrado de Espinaca y Albahaca Pomarola,3.5
Nachos Horneados Sanissimo Sabor Tomate y Albahaca 160g,S/ 9.90,metro,ALBAHACA,2024-12-05 16:31:30.029414,160.0,g,Nachos Horneados Sanissimo Sabor Tomate y Albahaca,9.9
Palitos con Albahaca Edith 55g,S/ 3.30,metro,ALBAHACA,2024-12-05 16:31:30.029414,55.0,g,Palitos con Albahaca Edith,3.3
"Papa en Hojuelas Inka Chips Tomate, Albahaca y Oliva 115g",S/ 8.10,metro,ALBAHACA,2024-12-05 16:31:30.029414,115.0,g,"Papa en Hojuelas Inka Chips Tomate, Albahaca y Oliva",8.1
