description,price,website,search_term,scrape_timestamp,cantidad,unidad,description_no_unit,price_numeric
Arándanos Extra Wong 500g,S/ 19.50,wong,ARÁNDANOS,2024-12-06 14:03:14.238077,500.0,g,Arándanos Extra Wong,19.5
Arándano Hortifrut 300g,S/ 10.99,wong,ARÁNDANOS,2024-12-06 14:03:14.238077,300.0,g,Arándano Hortifrut,10.99
Arándanos Wong 200g,S/ 7.99,wong,ARÁNDANOS,2024-12-06 14:03:14.238077,200.0,g,Arándanos Wong,7.99
Arándano Blueberry 500 g,S/ 15.99,wong,ARÁNDANOS,2024-12-06 14:03:14.238077,500.0,g,Arándano Blueberry,15.99
Arándano Entero Congelado El Frutero 1kg,S/ 20.99,wong,ARÁNDANOS,2024-12-06 14:03:14.238077,1.0,kg,Arándano Entero Congelado El Frutero,20.99
"Arándanos, Zarzamoras y Frambuesas Congeladas Berries Del Perú Bolsa 350 g",S/ 13.03,wong,ARÁNDANOS,2024-12-06 14:03:14.238077,350.0,g,"Arándanos, Zarzamoras y Frambuesas Congeladas Berries Del Perú Bolsa",13.03
"Arándanos, Fresas, Zarzamoras, Cerezas y Frambuesas Congeladas Berries Del Perú Bolsa 350 g",S/ 13.52,wong,ARÁNDANOS,2024-12-06 14:03:14.238077,350.0,g,"Arándanos, Fresas, Zarzamoras, Cerezas y Frambuesas Congeladas Berries Del Perú Bolsa",13.52
Arándanos Congelados Berries del Perú 1kg,S/ 19.68,wong,ARÁNDANOS,2024-12-06 14:03:14.238077,1.0,kg,Arándanos Congelados Berries del Perú,19.68
"Arándanos, Fresas, Zarzamoras y Cerezas Congeladas Berries Del Perú Bolsa 350 g",S/ 12.72,wong,ARÁNDANOS,2024-12-06 14:03:14.238077,350.0,g,"Arándanos, Fresas, Zarzamoras y Cerezas Congeladas Berries Del Perú Bolsa",12.72
Arándanos Congelados Berries Del Perú Bolsa 350g,S/ 11.11,wong,ARÁNDANOS,2024-12-06 14:03:14.238077,350.0,g,Arándanos Congelados Berries Del Perú Bolsa,11.11
Arándano Deshidratado Apecánate 100g,S/ 6.50,wong,ARÁNDANOS,2024-12-06 14:03:14.238077,100.0,g,Arándano Deshidratado Apecánate,6.5
Arándanos Congelados Fest 500g,S/ 9.99,wong,ARÁNDANOS,2024-12-06 14:03:14.238077,500.0,g,Arándanos Congelados Fest,9.99
Arándanos Hortifrut 125g,S/ 5.99,wong,ARÁNDANOS,2024-12-06 14:03:14.238077,125.0,g,Arándanos Hortifrut,5.99
Arándanos con Cobertura de Chocolate Amaru Superfoods Chococranberry 120g,S/ 18.90,wong,ARÁNDANOS,2024-12-06 14:03:14.238077,120.0,g,Arándanos con Cobertura de Chocolate Amaru Superfoods Chococranberry,18.9
Arándanos Liofilizados DJ&A 25g,S/ 19.90,wong,ARÁNDANOS,2024-12-06 14:03:14.238077,25.0,g,Arándanos Liofilizados DJ&A,19.9
Arándanos Deshidratados Nature's Heart 250g,S/ 19.20,wong,ARÁNDANOS,2024-12-06 14:03:14.238077,250.0,g,Arándanos Deshidratados Nature's Heart,19.2
Yogurt Vakimu +Pro Arándano 500g,S/ 11.92,wong,ARÁNDANOS,2024-12-06 14:03:14.238077,500.0,g,Yogurt Vakimu +Pro Arándano,11.92
Yogurt Vakimu +Pro Arándano 160g,S/ 4.88,wong,ARÁNDANOS,2024-12-06 14:03:14.238077,160.0,g,Yogurt Vakimu +Pro Arándano,4.88
Yogurt Griego Descremado con Arándano Danlac Frasco 900g,S/ 16.90,wong,ARÁNDANOS,2024-12-06 14:03:14.238077,900.0,g,Yogurt Griego Descremado con Arándano Danlac Frasco,16.9
Yogurt Griego Vakimu Arándano 1 Kg,S/ 13.44,wong,ARÁNDANOS,2024-12-06 14:03:14.238077,1.0,kg,Yogurt Griego Vakimu Arándano,13.44
"Mix de Arándano, Fresa y Frambuesa El Frutero 1kg",S/ 16.79,wong,ARÁNDANOS,2024-12-06 14:03:14.238077,1.0,kg,"Mix de Arándano, Fresa y Frambuesa El Frutero",16.79
Mix de Frutos Secos con Arándanos Granuts 180g,S/ 9.50,wong,ARÁNDANOS,2024-12-06 14:03:14.238077,180.0,g,Mix de Frutos Secos con Arándanos Granuts,9.5
Bebida de Arándanos Light Ocean Spray Botella 1.89L,S/ 35.50,wong,ARÁNDANOS,2024-12-06 14:03:14.238077,1.89,l,Bebida de Arándanos Light Ocean Spray Botella,35.5
Barra de Cereal Cereal Bar Arándanos 12un,S/ 6.90,wong,ARÁNDANOS,2024-12-06 14:03:14.238077,12.0,un,Barra de Cereal Cereal Bar Arándanos,6.9
Galletas Baby Mum-Mum Arándano Caja 50 gr,S/ 14.10,wong,ARÁNDANOS,2024-12-06 14:03:14.238077,50.0,g,Galletas Baby Mum-Mum Arándano Caja r,14.1
Yogurt Batido con Trozos de Arándano Laive Griego 120g,S/ 2.50,wong,ARÁNDANOS,2024-12-06 14:03:14.238077,120.0,g,Yogurt Batido con Trozos de Arándano Laive Griego,2.5
Bebida de Arándano Ocean Spray Botella 1.89L,S/ 35.50,wong,ARÁNDANOS,2024-12-06 14:03:14.238077,1.89,l,Bebida de Arándano Ocean Spray Botella,35.5
Yogurt Griego Vakimu Arándano 160g,S/ 4.40,wong,ARÁNDANOS,2024-12-06 14:03:14.238077,160.0,g,Yogurt Griego Vakimu Arándano,4.4
"Jugo de Arándano, Uva y Manzana Bio Botella 300ml",S/ 3.80,wong,ARÁNDANOS,2024-12-06 14:03:14.238077,300.0,ml,"Jugo de Arándano, Uva y Manzana Bio Botella",3.8
"Yogurt Griego con Arándano, Chía y Granola Tigo Premium 175g",S/ 5.70,wong,ARÁNDANOS,2024-12-06 14:03:14.238077,175.0,g,"Yogurt Griego con Arándano, Chía y Granola Tigo Premium",5.7
Yogurt Griego Descremado con Arándano Danlac Frasco 420g,S/ 11.90,wong,ARÁNDANOS,2024-12-06 14:03:14.238077,420.0,g,Yogurt Griego Descremado con Arándano Danlac Frasco,11.9
Agua de Piña con Arándanos Light Golden 1L,S/ 11.99,wong,ARÁNDANOS,2024-12-06 14:03:14.238077,1.0,l,Agua de Piña con Arándanos Light Golden,11.99
Mermelada de Arándano Light Casa Verde 180g,S/ 13.40,wong,ARÁNDANOS,2024-12-06 14:03:14.238077,180.0,g,Mermelada de Arándano Light Casa Verde,13.4
Muesli con Arándanos Kellogg's 275g,S/ 25.90,wong,ARÁNDANOS,2024-12-06 14:03:14.238077,275.0,g,Muesli con Arándanos Kellogg's,25.9
Mermelada de Arándanos Dalfour Frasco 284 gr,S/ 19.90,wong,ARÁNDANOS,2024-12-06 14:03:14.238077,284.0,g,Mermelada de Arándanos Dalfour Frasco r,19.9
Mermelada Diet Arándanos Sin Gluten Helios Frasco 280 g,S/ 22.90,wong,ARÁNDANOS,2024-12-06 14:03:14.238077,280.0,g,Mermelada Diet Arándanos Sin Gluten Helios Frasco,22.9
Yogurt Griego Tigo Con Arándano y Chía Balde 1 Kg,S/ 18.30,wong,ARÁNDANOS,2024-12-06 14:03:14.238077,1.0,kg,Yogurt Griego Tigo Con Arándano y Chía Balde,18.3
Compota Smiley Kids Manzana + Plátano + Arándano 90g,S/ 4.90,wong,ARÁNDANOS,2024-12-06 14:03:14.238077,90.0,g,Compota Smiley Kids Manzana + Plátano + Arándano,4.9
Puré de Frutas Orgánico Manzana y Arándano AMA Pouch 90 g,S/ 4.90,wong,ARÁNDANOS,2024-12-06 14:03:14.238077,90.0,g,Puré de Frutas Orgánico Manzana y Arándano AMA Pouch,4.9
Mermelada de Arándano y Mango Casa Verde 210g,S/ 9.30,wong,ARÁNDANOS,2024-12-06 14:03:14.238077,210.0,g,Mermelada de Arándano y Mango Casa Verde,9.3
Yogurt Smoothie Arándano Chía Cuisine & Co Botella 980g,S/ 11.40,wong,ARÁNDANOS,2024-12-06 14:03:14.238077,980.0,g,Yogurt Smoothie Arándano Chía Cuisine & Co Botella,11.4
Yogurt Bebible Tigo Griego Arándano con Chía 1.6kg,S/ 17.90,wong,ARÁNDANOS,2024-12-06 14:03:14.238077,1.6,kg,Yogurt Bebible Tigo Griego Arándano con Chía,17.9
Avena Instantánea con Arándano Sin Gluten Dyfferent Pote 65 g,S/ 5.20,wong,ARÁNDANOS,2024-12-06 14:03:14.238077,65.0,g,Avena Instantánea con Arándano Sin Gluten Dyfferent Pote,5.2
Galletas de Chocolate Blanco y Arándanos Rojos Merba Bolsa 200 g,S/ 9.90,wong,ARÁNDANOS,2024-12-06 14:03:14.238077,200.0,g,Galletas de Chocolate Blanco y Arándanos Rojos Merba Bolsa,9.9
Galleta Digestive Arándano 0 % Azúcar Santiveri Paquete 190 g,S/ 19.90,wong,ARÁNDANOS,2024-12-06 14:03:14.238077,190.0,g,Galleta Digestive Arándano 0 % Azúcar Santiveri Paquete,19.9
Jugo Ama Manzana Arándano Tetra 200ml,S/ 6.60,wong,ARÁNDANOS,2024-12-06 14:03:14.238077,200.0,ml,Jugo Ama Manzana Arándano Tetra,6.6
Mermelada Kusi Fresa Arándano y Zarzamora Frasco 230 gr,S/ 14.40,wong,ARÁNDANOS,2024-12-06 14:03:14.238077,230.0,g,Mermelada Kusi Fresa Arándano y Zarzamora Frasco r,14.4
Mermelada de Arándanos y Yacá Ecoandino 240g,S/ 16.30,wong,ARÁNDANOS,2024-12-06 14:03:14.238077,240.0,g,Mermelada de Arándanos y Yacá Ecoandino,16.3
Yogurt Gloria Actibio Sabor Pitahaya Mango y Arándano Botella 950ml,S/ 6.70,wong,ARÁNDANOS,2024-12-06 14:03:14.238077,950.0,ml,Yogurt Gloria Actibio Sabor Pitahaya Mango y Arándano Botella,6.7
Snack Rice Puff Baby Mum Mum Fresa y Arándanos 50g,S/ 15.90,wong,ARÁNDANOS,2024-12-06 14:03:14.238077,50.0,g,Snack Rice Puff Baby Mum Mum Fresa y Arándanos,15.9
Jabón Líquido Family Care Arándano y Yogurt 400ml,S/ 9.50,wong,ARÁNDANOS,2024-12-06 14:03:14.238077,400.0,ml,Jabón Líquido Family Care Arándano y Yogurt,9.5
Tripack Agua de Piña Light con Arándanos Golden Botella 485ml,S/ 13.00,wong,ARÁNDANOS,2024-12-06 14:03:14.238077,485.0,ml,Tripack Agua de Piña Light con Arándanos Golden Botella,13.0
Yogurt Tipo Griego con Arándano & Chía Tigo 160g,S/ 5.20,wong,ARÁNDANOS,2024-12-06 14:03:14.238077,160.0,g,Yogurt Tipo Griego con Arándano & Chía Tigo,5.2
Gin Andean Gin Arándanos Botella 700ml,S/ 85.90,wong,ARÁNDANOS,2024-12-06 14:03:14.238077,700.0,ml,Gin Andean Gin Arándanos Botella,85.9
Jugo de Arándanos Kedem Botella 1.89L,S/ 18.90,wong,ARÁNDANOS,2024-12-06 14:03:14.238077,1.89,l,Jugo de Arándanos Kedem Botella,18.9
"Pulpa Congelada de Acaí, Arándano y Mango Berries del Perú 200g",S/ 10.96,wong,ARÁNDANOS,2024-12-06 14:03:14.238077,200.0,g,"Pulpa Congelada de Acaí, Arándano y Mango Berries del Perú",10.96
Yogurt Bebible Tigo Griego Arándano con Chía Botella 285g,S/ 4.10,wong,ARÁNDANOS,2024-12-06 14:03:14.238077,285.0,g,Yogurt Bebible Tigo Griego Arándano con Chía Botella,4.1
Yogurt Griego Vakimu Arándanos y Granola 178g,S/ 5.28,wong,ARÁNDANOS,2024-12-06 14:03:14.238077,178.0,g,Yogurt Griego Vakimu Arándanos y Granola,5.28
Chocolate Oscuro 70% Cacao Arándanos Domenico Tableta 70 g,S/ 17.00,wong,ARÁNDANOS,2024-12-06 14:03:14.238077,70.0,g,Chocolate Oscuro 70% Cacao Arándanos Domenico Tableta,17.0
Mermelada Kusi Arándano con Chía y Stevia Frasco 230 gr,S/ 14.40,wong,ARÁNDANOS,2024-12-06 14:03:14.238077,230.0,g,Mermelada Kusi Arándano con Chía y Stevia Frasco r,14.4
"Pulpa Congelada de Acaí, Arándano y Piña Golden Berries del Perú 200g",S/ 10.96,wong,ARÁNDANOS,2024-12-06 14:03:14.238077,200.0,g,"Pulpa Congelada de Acaí, Arándano y Piña Golden Berries del Perú",10.96
Yogurt Bebible Ecologic Sabor Arándano 1L,S/ 10.70,wong,ARÁNDANOS,2024-12-06 14:03:14.238077,1.0,l,Yogurt Bebible Ecologic Sabor Arándano,10.7
Mezcla de Arándanos Cuisine&Co Pote 200 g,S/ 9.52,wong,ARÁNDANOS,2024-12-06 14:03:14.238077,200.0,g,Mezcla de Arándanos Cuisine&Co Pote,9.52
Bebida de Jugo de Arándano L'Onda Botella 500ml,S/ 5.50,wong,ARÁNDANOS,2024-12-06 14:03:14.238077,500.0,ml,Bebida de Jugo de Arándano L'Onda Botella,5.5
Vinagre de Sidra de Manzana con Miel y Arándanos Botella 500 ml,S/ 19.90,wong,ARÁNDANOS,2024-12-06 14:03:14.238077,500.0,ml,Vinagre de Sidra de Manzana con Miel y Arándanos Botella,19.9
Yogurt Bebible Tigo Sabor Arándano con Chía Botella 800g,S/ 9.90,wong,ARÁNDANOS,2024-12-06 14:03:14.238077,800.0,g,Yogurt Bebible Tigo Sabor Arándano con Chía Botella,9.9
Compota de Arándano con Quinua Casa Verde 120g,S/ 4.99,wong,ARÁNDANOS,2024-12-06 14:03:14.238077,120.0,g,Compota de Arándano con Quinua Casa Verde,4.99
Bebida Pulp Tetra Arándano 1L,S/ 3.90,wong,ARÁNDANOS,2024-12-06 14:03:14.238077,1.0,l,Bebida Pulp Tetra Arándano,3.9
Bebida con Arándano y Té Verde Londa Botella1L,S/ 9.40,wong,ARÁNDANOS,2024-12-06 14:03:14.238077,1.0,l,Bebida con Arándano y Té Verde Londa Botella,9.4
Yogurt Tipo Griego Tigo Arándano con Chía 500g,S/ 11.10,wong,ARÁNDANOS,2024-12-06 14:03:14.238077,500.0,g,Yogurt Tipo Griego Tigo Arándano con Chía,11.1
Helado para Perros Sabor Arándanos y Sandía Yogy 100g,S/ 6.99,wong,ARÁNDANOS,2024-12-06 14:03:14.238077,100.0,g,Helado para Perros Sabor Arándanos y Sandía Yogy,6.99
Bebida de Jugo de Arándano y Manzana Ocean Spray 1.89L,S/ 34.90,wong,ARÁNDANOS,2024-12-06 14:03:14.238077,1.89,l,Bebida de Jugo de Arándano y Manzana Ocean Spray,34.9
Pulpa de Arándano Congelada Natifut 250g,S/ 11.80,wong,ARÁNDANOS,2024-12-06 14:03:14.238077,250.0,g,Pulpa de Arándano Congelada Natifut,11.8
Helado Vegano Atelier Arándanos 350g,S/ 37.90,wong,ARÁNDANOS,2024-12-06 14:03:14.238077,350.0,g,Helado Vegano Atelier Arándanos,37.9
Helado con Stevia Atelier Arándanos 85g,S/ 12.50,wong,ARÁNDANOS,2024-12-06 14:03:14.238077,85.0,g,Helado con Stevia Atelier Arándanos,12.5
Compota de Arándanos Fondo Montebello 40g,S/ 14.90,wong,ARÁNDANOS,2024-12-06 14:03:14.238077,40.0,g,Compota de Arándanos Fondo Montebello,14.9
Sixpack Bebida Pulp Arándano Uva Botella 250ml,S/ 8.10,wong,ARÁNDANOS,2024-12-06 14:03:14.238077,250.0,ml,Sixpack Bebida Pulp Arándano Uva Botella,8.1
Infusión de Arándano y Sábila Bigelow Caja 18 unid,S/ 26.80,wong,ARÁNDANOS,2024-12-06 14:03:14.238077,18.0,un,Infusión de Arándano y Sábila Bigelow Caja,26.8
Paté De Pato con Arándanos Imperia Lata 70 g,S/ 34.50,wong,ARÁNDANOS,2024-12-06 14:03:14.238077,70.0,g,Paté De Pato con Arándanos Imperia Lata,34.5
Helado de Arándanos y Camu Camu Sanúa 133ml,S/ 9.50,wong,ARÁNDANOS,2024-12-06 14:03:14.238077,133.0,ml,Helado de Arándanos y Camu Camu Sanúa,9.5
Mermelada Light de Arándano y Granada D' Marco 210g,S/ 15.20,wong,ARÁNDANOS,2024-12-06 14:03:14.238077,210.0,g,Mermelada Light de Arándano y Granada D' Marco,15.2
Barras de Quinua Qfoods Chocolate con Arándano 8un,S/ 16.90,wong,ARÁNDANOS,2024-12-06 14:03:14.238077,8.0,un,Barras de Quinua Qfoods Chocolate con Arándano,16.9
Torta Naked de Arándanos 6 Porciones,S/ 21.90,wong,ARÁNDANOS,2024-12-06 14:03:14.238077,6.0,un,Torta Naked de Arándanos,21.9
Torta Naked Arándanos 10 Porciones,S/ 49.90,wong,ARÁNDANOS,2024-12-06 14:03:14.238077,10.0,un,Torta Naked Arándanos,49.9
Helado de Arándanos y Camu Camu Sanúa 473ml,S/ 29.90,wong,ARÁNDANOS,2024-12-06 14:03:14.238077,473.0,ml,Helado de Arándanos y Camu Camu Sanúa,29.9
Pulpa de Arándanos Agroselva Doypack 250g,S/ 12.99,wong,ARÁNDANOS,2024-12-06 14:03:14.238077,250.0,g,Pulpa de Arándanos Agroselva Doypack,12.99
Cerveza Kunstmann Arándano Botella 330ml,S/ 13.90,wong,ARÁNDANOS,2024-12-06 14:03:14.238077,330.0,ml,Cerveza Kunstmann Arándano Botella,13.9
Dulce Untable de Arándanos 200g,S/ 9.90,wong,ARÁNDANOS,2024-12-06 14:03:14.238077,200.0,g,Dulce Untable de Arándanos,9.9
Mermelada de Arandano Diet Crema & Nata frasco 330 g,S/ 34.90,wong,ARÁNDANOS,2024-12-06 14:03:14.238077,330.0,g,Mermelada de Arandano Diet Crema & Nata frasco,34.9
