brand,description,price,website,search_term,scrape_timestamp,cantidad,unidad,description_no_unit,price_numeric
LAIVE,Leche fresca de 900 mL,S/ 3.90,tottus,LECHE FRESCA PASTEURIZADA,2024-12-04 13:19:25.625957,900.0,ml,Leche fresca de,3.9
GLORIA,Leche Fresca Uht Entera 1 L,S/ 6.10,tottus,LECHE FRESCA PASTEURIZADA,2024-12-04 13:19:25.625957,1.0,l,Leche Fresca Uht Entera,6.1
DANLAC,LECHE PASTEURIZADA SABOR CHOCO X 250 ML,S/ 3.20,tottus,LECHE FRESCA PASTEURIZADA,2024-12-04 13:19:25.625957,250.0,ml,LECHE PASTEURIZADA SABOR CHOCO X,3.2
DANLAC,LECHE PASTEURIZADA SABOR CHOCO X 900 ML,S/ 7.80,tottus,LECHE FRESCA PASTEURIZADA,2024-12-04 13:19:25.625957,900.0,ml,LECHE PASTEURIZADA SABOR CHOCO X,7.8
GLORIA,Tripack Leche Uht Slim Triple Zero 1 L,S/ 16.40,tottus,LECHE FRESCA PASTEURIZADA,2024-12-04 13:19:25.625957,1.0,l,Tripack Leche Uht Slim Triple Zero,16.4
GLORIA,Leche Uht Slim Triple Zero 1 L,S/ 6.20,tottus,LECHE FRESCA PASTEURIZADA,2024-12-04 13:19:25.625957,1.0,l,Leche Uht Slim Triple Zero,6.2
