description,price,website,search_term,scrape_timestamp
Té Negro Lipton Yellow Label 20un,S/ 6.70,wong,TÉ NEGRO FILTRANTE,2024-12-06 14:57:48.035921
Té Negro Hornimans Caja 25 Unid,S/ 3.90,wong,TÉ NEGRO FILTRANTE,2024-12-06 14:57:48.035921
Té Negro en Hojas Naturandes 50g,S/ 8.50,wong,TÉ NEGRO FILTRANTE,2024-12-06 14:57:48.035921
Té Negro Bigelow English Breakfast 18un,S/ 26.90,wong,TÉ NEGRO FILTRANTE,2024-12-06 14:57:48.035921
Té Negro Twinings English Breakfast 50 un,S/ 85.90,wong,TÉ NEGRO FILTRANTE,2024-12-06 14:57:48.035921
Té Negro Revolution Sweet Ginger Peach Caja 20 Sobres,S/ 49.50,wong,TÉ NEGRO FILTRANTE,2024-12-06 14:57:48.035921
Té Negro Revolution Earl Grey Lavanda Caja 20 Sobres,S/ 49.50,wong,TÉ NEGRO FILTRANTE,2024-12-06 14:57:48.035921
Infusión de Té Negro y Frutos Rojos Twinings Caja 10 unid,S/ 19.90,wong,TÉ NEGRO FILTRANTE,2024-12-06 14:57:48.035921
