description,price,website,search_term,scrape_timestamp
Albahaca x atado,S/ 2.39,wong,ALBAHACA,2024-12-06 14:37:39.013573
Albahaca Ecologic 120g,S/ 4.80,wong,ALBAHACA,2024-12-06 14:37:39.013573
Albahaca Fresca Verde Puro 120g,S/ 7.10,wong,ALBAHACA,2024-12-06 14:37:39.013573
Albahaca Hidropónica 80g,S/ 3.00,wong,ALBAHACA,2024-12-06 14:37:39.013573
Albahaca Deshojada Línea Verde,S/ 6.69,wong,ALBAHACA,2024-12-06 14:37:39.013573
Albahaca Morada La Huerta 160g,S/ 6.19,wong,ALBAHACA,2024-12-06 14:37:39.013573
Palitos con Albahaca Edith 55g,S/ 3.30,wong,ALBAHACA,2024-12-06 14:37:39.013573
Aceite Esencial Hana Albahaca 10ml,S/ 57.00,wong,ALBAHACA,2024-12-06 14:37:39.013573
