description,price,website,search_term,scrape_timestamp
Refresco Instantáneo Umsha Frutísimos Sabor Chicha Morada 20g,S/ 1.60,wong,REFRESCO ENVASADO (FLUIDO),2024-12-06 15:05:17.945768
Refresco Instantáneo Sabores de Mi Tierra Chicha Morada Sobre 15 g,S/ 1.20,wong,REFRESCO ENVASADO (FLUIDO),2024-12-06 15:05:17.945768
Refresco Instantáneo Toronja Clight Sobre Doble 14 g,S/ 2.30,wong,REFRESCO ENVASADO (FLUIDO),2024-12-06 15:05:17.945768
Refresco Instantáneo Umsha Frutísimos Sabor Maracuyá 20g,S/ 1.60,wong,REFRESCO ENVASADO (FLUIDO),2024-12-06 15:05:17.945768
Refresco Instantáneo Sabor Maracuyá Sobre 15 g,S/ 1.20,wong,REFRESCO ENVASADO (FLUIDO),2024-12-06 15:05:17.945768
Refresco Instantáneo Sabores de Mi Tierra Mango Criollo Sobre 15 g,S/ 1.20,wong,REFRESCO ENVASADO (FLUIDO),2024-12-06 15:05:17.945768
Refresco Instantáneo Sabor Naranja Sobre 15 g,S/ 1.20,wong,REFRESCO ENVASADO (FLUIDO),2024-12-06 15:05:17.945768
Refresco Instantáneo Sabor Piña Sobre 15 g,S/ 1.20,wong,REFRESCO ENVASADO (FLUIDO),2024-12-06 15:05:17.945768
Refresco Instantáneo Sabores de Mi Tierra Limonada Sobre 15 g,S/ 1.20,wong,REFRESCO ENVASADO (FLUIDO),2024-12-06 15:05:17.945768
Refresco Instantáneo Umsha Frutísimos Sabor Naranja 20g,S/ 1.60,wong,REFRESCO ENVASADO (FLUIDO),2024-12-06 15:05:17.945768
Refresco Instantáneo Sabores de Mi Tierra Emoliente Sobre 15 g,S/ 1.20,wong,REFRESCO ENVASADO (FLUIDO),2024-12-06 15:05:17.945768
Refresco Instantáneo Umsha Frutísimos Sabor Piña 20g,S/ 1.60,wong,REFRESCO ENVASADO (FLUIDO),2024-12-06 15:05:17.945768
Fluido Facial Día Nivea Luminous 630° Anti Manchas FPS50 40ml,S/ 54.54,wong,REFRESCO ENVASADO (FLUIDO),2024-12-06 15:05:17.945768
Fluido Luminoso FPS 50 Azelac Ru Sesderma Frasco 50 ml,S/ 199.00,wong,REFRESCO ENVASADO (FLUIDO),2024-12-06 15:05:17.945768
Fluido Luminoso C-Vit Radiance Sesderma Frasco 50 ml,S/ 199.00,wong,REFRESCO ENVASADO (FLUIDO),2024-12-06 15:05:17.945768
Salsa de Ají Amarillo Envasado 550 g,S/ 18.10,wong,REFRESCO ENVASADO (FLUIDO),2024-12-06 15:05:17.945768
Chicha Morada Naturale Botella 1.9 L,S/ 13.90,wong,REFRESCO ENVASADO (FLUIDO),2024-12-06 15:05:17.945768
Concentrado de Chicha Morada Naturale 250ml,S/ 4.80,wong,REFRESCO ENVASADO (FLUIDO),2024-12-06 15:05:17.945768
Chicha Morada Naturale Botella 1 L,S/ 7.90,wong,REFRESCO ENVASADO (FLUIDO),2024-12-06 15:05:17.945768
Tripack Bebida Instantánea Clight Sin Calorías Sabor Piña 14g,S/ 5.00,wong,REFRESCO ENVASADO (FLUIDO),2024-12-06 15:05:17.945768
Tripack Bebida Instantánea Clight Sin Calorías Sabor Mandarina 14g,S/ 5.00,wong,REFRESCO ENVASADO (FLUIDO),2024-12-06 15:05:17.945768
Tripack Bebida Instantánea Clight Sin Calorías Sabor Fresa 14g,S/ 5.00,wong,REFRESCO ENVASADO (FLUIDO),2024-12-06 15:05:17.945768
Ajo en Pasta Envasado 550 g,S/ 31.90,wong,REFRESCO ENVASADO (FLUIDO),2024-12-06 15:05:17.945768
Tripack Bebida Instantánea Clight Sin Calorías Sabor Limón 14g,S/ 5.00,wong,REFRESCO ENVASADO (FLUIDO),2024-12-06 15:05:17.945768
Tripack Bebida Instantánea Clight Sin Calorías Sabor Naranja 14g,S/ 5.00,wong,REFRESCO ENVASADO (FLUIDO),2024-12-06 15:05:17.945768
Jugo de Naranja Florida's Nature Lata 340ml,S/ 5.90,wong,REFRESCO ENVASADO (FLUIDO),2024-12-06 15:05:17.945768
Concentrado de Emoliente Naturale 250ml,S/ 4.80,wong,REFRESCO ENVASADO (FLUIDO),2024-12-06 15:05:17.945768
Tripack Bebida Instantánea Clight Sin Calorías Sabor Toronja 14g,S/ 5.00,wong,REFRESCO ENVASADO (FLUIDO),2024-12-06 15:05:17.945768
Bebida en Polvo Clight Sin Calorías Sabor Piña 14g,S/ 2.30,wong,REFRESCO ENVASADO (FLUIDO),2024-12-06 15:05:17.945768
Chicha Morada Gloria Botella 3 L,S/ 8.20,wong,REFRESCO ENVASADO (FLUIDO),2024-12-06 15:05:17.945768
Bebida en Polvo Clight Sin Calorías Sabor Naranja 14g,S/ 2.30,wong,REFRESCO ENVASADO (FLUIDO),2024-12-06 15:05:17.945768
Salsa Culantrito con Espinaca Envasado 550 g,S/ 15.20,wong,REFRESCO ENVASADO (FLUIDO),2024-12-06 15:05:17.945768
Bebida en Polvo Clight Sin Calorías Sabor Limón 14g,S/ 2.30,wong,REFRESCO ENVASADO (FLUIDO),2024-12-06 15:05:17.945768
Jugo de Manzana Florida's Nature Lata 340ml,S/ 5.90,wong,REFRESCO ENVASADO (FLUIDO),2024-12-06 15:05:17.945768
Chicha Morada Cuisine & Co 1L,S/ 5.90,wong,REFRESCO ENVASADO (FLUIDO),2024-12-06 15:05:17.945768
Chicha Morada Naturale Botella 500 ml,S/ 4.80,wong,REFRESCO ENVASADO (FLUIDO),2024-12-06 15:05:17.945768
Gelatina Bebible Umsha Frutísimos Sabor Fresa 20g,S/ 1.60,wong,REFRESCO ENVASADO (FLUIDO),2024-12-06 15:05:17.945768
Bebida en Polvo Clight Sin Calorías Sabor Mandarina 14g,S/ 2.30,wong,REFRESCO ENVASADO (FLUIDO),2024-12-06 15:05:17.945768
Chicha Morada Selva Botella 900ml,S/ 7.20,wong,REFRESCO ENVASADO (FLUIDO),2024-12-06 15:05:17.945768
Gelatina Bebible Umsha Frutísimos Sabor Piña 20g,S/ 1.60,wong,REFRESCO ENVASADO (FLUIDO),2024-12-06 15:05:17.945768
Bebida en Polvo Clight Sin Calorías Sabor Fresa 14g,S/ 2.30,wong,REFRESCO ENVASADO (FLUIDO),2024-12-06 15:05:17.945768
Bebida Casera Gloria Chicha Morada Botella 320ml,S/ 1.90,wong,REFRESCO ENVASADO (FLUIDO),2024-12-06 15:05:17.945768
Bebida Chicha Morada Don Fidel 1.9L,S/ 14.90,wong,REFRESCO ENVASADO (FLUIDO),2024-12-06 15:05:17.945768
Chicha Morada Cuisine & Co 500ml,S/ 3.90,wong,REFRESCO ENVASADO (FLUIDO),2024-12-06 15:05:17.945768
Chicha Morada Gloria Botella 400 ml,S/ 1.80,wong,REFRESCO ENVASADO (FLUIDO),2024-12-06 15:05:17.945768
Bebida Instantánea Umsha Chicha Morada 13g,S/ 1.00,wong,REFRESCO ENVASADO (FLUIDO),2024-12-06 15:05:17.945768
Chicha Morada Selva Botella 300ml,S/ 4.40,wong,REFRESCO ENVASADO (FLUIDO),2024-12-06 15:05:17.945768
Sixpack Concentrado de Chicha Morada Naturale 250ml,S/ 26.99,wong,REFRESCO ENVASADO (FLUIDO),2024-12-06 15:05:17.945768
Casas&Cosas Cuchara para Refresco 30 cm,S/ 11.99,wong,REFRESCO ENVASADO (FLUIDO),2024-12-06 15:05:17.945768
Jugo de Frutas Florida's Premium Fruit Splash Lata 340ml,S/ 5.90,wong,REFRESCO ENVASADO (FLUIDO),2024-12-06 15:05:17.945768
Sixpack Concentrado de Emoliente Naturale 250ml,S/ 26.99,wong,REFRESCO ENVASADO (FLUIDO),2024-12-06 15:05:17.945768
Bebida Instantánea Umsha Fresa 13g,S/ 1.00,wong,REFRESCO ENVASADO (FLUIDO),2024-12-06 15:05:17.945768
Bebida Chicha Morada Don Fidel 500ml,S/ 4.90,wong,REFRESCO ENVASADO (FLUIDO),2024-12-06 15:05:17.945768
Bebida Frugos del Valle Chicha Morada Botella 1L,S/ 4.00,wong,REFRESCO ENVASADO (FLUIDO),2024-12-06 15:05:17.945768
Filete de Salmón Fresco x kg,S/ 72.50 x kg,wong,REFRESCO ENVASADO (FLUIDO),2024-12-06 15:05:17.945768
Queso Fresco Bonlé x kg,S/ 36.50 x kg,wong,REFRESCO ENVASADO (FLUIDO),2024-12-06 15:05:17.945768
Queso Fresco Light Cuisine & Co x kg,S/ 37.00 x kg,wong,REFRESCO ENVASADO (FLUIDO),2024-12-06 15:05:17.945768
Queso Fresco Laive x kg,S/ 37.90 x kg,wong,REFRESCO ENVASADO (FLUIDO),2024-12-06 15:05:17.945768
Queso Fresco Cuisine & Co x kg,S/ 37.00 x kg,wong,REFRESCO ENVASADO (FLUIDO),2024-12-06 15:05:17.945768
Queso Fresco Gloria Molde 400 g,S/ 37.90 x kg,wong,REFRESCO ENVASADO (FLUIDO),2024-12-06 15:05:17.945768
Queso Fresco Sin Lactosa Laive x kg,S/ 38.90 x kg,wong,REFRESCO ENVASADO (FLUIDO),2024-12-06 15:05:17.945768
Pollo Fresco Sin Menudencia Artisan Libre de Antibióticos x kg,S/ 16.50 x kg,wong,REFRESCO ENVASADO (FLUIDO),2024-12-06 15:05:17.945768
Queso Mozzarella en Tajadas Braedt 180g,S/ 12.50,wong,REFRESCO ENVASADO (FLUIDO),2024-12-06 15:05:17.945768
Queso Fresco Laive Sbelt Laive x kg,S/ 38.90 x kg,wong,REFRESCO ENVASADO (FLUIDO),2024-12-06 15:05:17.945768
Queso Mozzarella Laive Light 250g,S/ 12.50,wong,REFRESCO ENVASADO (FLUIDO),2024-12-06 15:05:17.945768
Queso Fresco Andino Plusa x kg,S/ 43.80 x kg,wong,REFRESCO ENVASADO (FLUIDO),2024-12-06 15:05:17.945768
Pollo Fresco con Menudencia San Fernando x Kg,S/ 8.70 x kg,wong,REFRESCO ENVASADO (FLUIDO),2024-12-06 15:05:17.945768
Queso Mozzarella Laive 250g,S/ 12.50,wong,REFRESCO ENVASADO (FLUIDO),2024-12-06 15:05:17.945768
Queso Cottage Plusa pote 225 g,S/ 11.80,wong,REFRESCO ENVASADO (FLUIDO),2024-12-06 15:05:17.945768
Queso Mozzarella Bonlé bola 250 g,S/ 13.00,wong,REFRESCO ENVASADO (FLUIDO),2024-12-06 15:05:17.945768
Detergente en Polvo Sapolio Aros de Poder Fresco Limón 2kg,S/ 18.90,wong,REFRESCO ENVASADO (FLUIDO),2024-12-06 15:05:17.945768
Queso Fresco Mozzarella Duman Molde 240 gr,S/ 14.32,wong,REFRESCO ENVASADO (FLUIDO),2024-12-06 15:05:17.945768
Aguaymanto Fresco Pelado 200g,S/ 3.59,wong,REFRESCO ENVASADO (FLUIDO),2024-12-06 15:05:17.945768
Queso Mozzarella Light Duman Bola 200g,S/ 11.68,wong,REFRESCO ENVASADO (FLUIDO),2024-12-06 15:05:17.945768
Queso Fresco Burrata Fior Di Latte Duman Doypack 200 gr,S/ 26.72,wong,REFRESCO ENVASADO (FLUIDO),2024-12-06 15:05:17.945768
Queso Mozzarella Ligth Cuisine & Co Rallado 200g,S/ 15.10,wong,REFRESCO ENVASADO (FLUIDO),2024-12-06 15:05:17.945768
Queso Fresco de Cabra Duman x Kg,S/ 78.96 x kg,wong,REFRESCO ENVASADO (FLUIDO),2024-12-06 15:05:17.945768
Queso Fresco Light Laive Sbelt x kg,S/ 38.50 x kg,wong,REFRESCO ENVASADO (FLUIDO),2024-12-06 15:05:17.945768
Queso Mozzarella Cuisine & Co Rallado 200g,S/ 15.10,wong,REFRESCO ENVASADO (FLUIDO),2024-12-06 15:05:17.945768
Queso Cabaña Light Piamonte Pote 250 gr,S/ 16.00,wong,REFRESCO ENVASADO (FLUIDO),2024-12-06 15:05:17.945768
Queso Fresco Mozzarella Fior di Latte Duman Doypack 250 gr,S/ 17.68,wong,REFRESCO ENVASADO (FLUIDO),2024-12-06 15:05:17.945768
Queso Fresco Bocconcini Fior di Latte Duman Doypack 250 gr,S/ 17.84,wong,REFRESCO ENVASADO (FLUIDO),2024-12-06 15:05:17.945768
Queso Fresco De Vaca Light Duman x kg,S/ 53.04 x kg,wong,REFRESCO ENVASADO (FLUIDO),2024-12-06 15:05:17.945768
Toallitas Desinfectantes Clorox Expert Aroma Fresco 60un,S/ 20.20,wong,REFRESCO ENVASADO (FLUIDO),2024-12-06 15:05:17.945768
Queso Feta LeFromelier x kg,S/ 119.50 x kg,wong,REFRESCO ENVASADO (FLUIDO),2024-12-06 15:05:17.945768
Queso Mozzarella Rallada Duman Bolsa 250 g,S/ 16.16,wong,REFRESCO ENVASADO (FLUIDO),2024-12-06 15:05:17.945768
Queso Fresco Artesanal Laive x kg,S/ 41.60 x kg,wong,REFRESCO ENVASADO (FLUIDO),2024-12-06 15:05:17.945768
Queso Mozzarella Sin Lactosa Light Duman 200g,S/ 11.68,wong,REFRESCO ENVASADO (FLUIDO),2024-12-06 15:05:17.945768
Trucha Deshuesada Corte Mariposa x kg,S/ 29.90 x kg,wong,REFRESCO ENVASADO (FLUIDO),2024-12-06 15:05:17.945768
Palitos de Queso Mozzarella Delice 180g,S/ 16.40,wong,REFRESCO ENVASADO (FLUIDO),2024-12-06 15:05:17.945768
Queso Fresco Floralp Molde 500 gr,S/ 21.90,wong,REFRESCO ENVASADO (FLUIDO),2024-12-06 15:05:17.945768
Queso Mozzarella en Tajadas Laive 180g,S/ 9.90,wong,REFRESCO ENVASADO (FLUIDO),2024-12-06 15:05:17.945768
Queso Ricotta Duman 250g,S/ 7.44,wong,REFRESCO ENVASADO (FLUIDO),2024-12-06 15:05:17.945768
Queso Fresco Pasteurizado Laive x kg,S/ 38.45 x kg,wong,REFRESCO ENVASADO (FLUIDO),2024-12-06 15:05:17.945768
Queso Cottage Cuisine & Co 227g,S/ 11.50,wong,REFRESCO ENVASADO (FLUIDO),2024-12-06 15:05:17.945768
Bonito Entero x kg,S/ 7.90 x kg,wong,REFRESCO ENVASADO (FLUIDO),2024-12-06 15:05:17.945768
Queso Fresco de Vaca Sin Gluten Duman x Kg / Paquete 400 g aprox,S/ 45.44 x kg,wong,REFRESCO ENVASADO (FLUIDO),2024-12-06 15:05:17.945768
Queso Cottage Delice 227g,S/ 13.20,wong,REFRESCO ENVASADO (FLUIDO),2024-12-06 15:05:17.945768
Queso Maduro Mozzarella Rallado Crystal Farms Bolsa 226 gr,S/ 15.90,wong,REFRESCO ENVASADO (FLUIDO),2024-12-06 15:05:17.945768
Queso Mozzarella Plusa x kg,S/ 79.90 x kg,wong,REFRESCO ENVASADO (FLUIDO),2024-12-06 15:05:17.945768
Queso Mozzarella Cuisine & Co Tajadas 150g,S/ 8.50,wong,REFRESCO ENVASADO (FLUIDO),2024-12-06 15:05:17.945768
Queso Mozzarella Delice Bocconcini Fior di Latte 530g,S/ 18.20,wong,REFRESCO ENVASADO (FLUIDO),2024-12-06 15:05:17.945768
Queso Maduro Mozzarella en Palitos Bolsa 283 gr,S/ 21.04,wong,REFRESCO ENVASADO (FLUIDO),2024-12-06 15:05:17.945768
Romero Fresco Ecologic 30g,S/ 3.30,wong,REFRESCO ENVASADO (FLUIDO),2024-12-06 15:05:17.945768
Queso Mozzarella Laive x kg,S/ 57.90 x kg,wong,REFRESCO ENVASADO (FLUIDO),2024-12-06 15:05:17.945768
Tofu de seda firme Morinaga caja 349 g,S/ 12.90,wong,REFRESCO ENVASADO (FLUIDO),2024-12-06 15:05:17.945768
Lenguado Entero x kg,S/ 53.90 x kg,wong,REFRESCO ENVASADO (FLUIDO),2024-12-06 15:05:17.945768
Queso Mozzarella y Cheddar en Palitos Bolsa 283 gr,S/ 21.44,wong,REFRESCO ENVASADO (FLUIDO),2024-12-06 15:05:17.945768
Queso de Soya Wong Tofu Pote 500 g,S/ 21.90,wong,REFRESCO ENVASADO (FLUIDO),2024-12-06 15:05:17.945768
Queso Bocconcini Mini Fior di Latte Duman Doypack 125 g,S/ 10.16,wong,REFRESCO ENVASADO (FLUIDO),2024-12-06 15:05:17.945768
Queso Cabaña Piamonte Pote 250 gr,S/ 16.00,wong,REFRESCO ENVASADO (FLUIDO),2024-12-06 15:05:17.945768
Corvina Entera,S/ 49.90 x kg,wong,REFRESCO ENVASADO (FLUIDO),2024-12-06 15:05:17.945768
Chorizo Parrillero Fresco Braedt Paquete 500 g,S/ 15.50,wong,REFRESCO ENVASADO (FLUIDO),2024-12-06 15:05:17.945768
Queso Fresco Sin Lactosa Light Duman x kg,S/ 49.60 x kg,wong,REFRESCO ENVASADO (FLUIDO),2024-12-06 15:05:17.945768
Pejerrey Limpio x kg,S/ 33.90 x kg,wong,REFRESCO ENVASADO (FLUIDO),2024-12-06 15:05:17.945768
Jabón Líquido Antibacterial Aval Fresco Eucalipto 800ml,S/ 13.20,wong,REFRESCO ENVASADO (FLUIDO),2024-12-06 15:05:17.945768
Trucha Entera Extra Eviscerada x kg,S/ 28.90 x kg,wong,REFRESCO ENVASADO (FLUIDO),2024-12-06 15:05:17.945768
Queso de Cabra Fresco Berd Milch 250g,S/ 18.50,wong,REFRESCO ENVASADO (FLUIDO),2024-12-06 15:05:17.945768
Jabón Líquido Antibacterial Aval Fresco Eucalipto 1L,S/ 15.90,wong,REFRESCO ENVASADO (FLUIDO),2024-12-06 15:05:17.945768
Cojinova Entera x kg,S/ 30.90 x kg,wong,REFRESCO ENVASADO (FLUIDO),2024-12-06 15:05:17.945768
