description,price,website,search_term,scrape_timestamp
Tomate Italiano x kg,S/ 6.29 x kg,wong,TOMATE ITALIANO O MARSANO,2024-12-06 14:14:00.523823
Tomate Saladette Hidropónico de Invernadero Ecologic Bolsa,S/ 4.60,wong,TOMATE ITALIANO O MARSANO,2024-12-06 14:14:00.523823
Tomate Redondo Hidropónico de Invernadero Ecologic Bolsa,S/ 4.90,wong,TOMATE ITALIANO O MARSANO,2024-12-06 14:14:00.523823
Tomate Cherry Baby Hidropónico de Invernadero Ecologic Bandeja 300g,S/ 6.30,wong,TOMATE ITALIANO O MARSANO,2024-12-06 14:14:00.523823
Tomate Cherry La Huerta 300g,S/ 12.00,wong,TOMATE ITALIANO O MARSANO,2024-12-06 14:14:00.523823
Tomate Cherry Cuisine & Co 200g,S/ 5.00,wong,TOMATE ITALIANO O MARSANO,2024-12-06 14:14:00.523823
Tomate Cherry Cuisine & Co 600g,S/ 11.50,wong,TOMATE ITALIANO O MARSANO,2024-12-06 14:14:00.523823
Tomate Cherry Hidropónico de Invernadero Don Miguel Bandeja 300 g,S/ 7.50,wong,TOMATE ITALIANO O MARSANO,2024-12-06 14:14:00.523823
Tomate Cherry de Invernadero Don Miguel x Bandeja,S/ 9.00,wong,TOMATE ITALIANO O MARSANO,2024-12-06 14:14:00.523823
Tomate Picado La Molisana 400g,S/ 6.90,wong,TOMATE ITALIANO O MARSANO,2024-12-06 14:14:00.523823
Tomate en Cuadros The Fresh Market 794g,S/ 10.90,wong,TOMATE ITALIANO O MARSANO,2024-12-06 14:14:00.523823
Tomate Pelado La Molisana 400g,S/ 6.90,wong,TOMATE ITALIANO O MARSANO,2024-12-06 14:14:00.523823
Tomate en Cuadros The Fresh Market 411g,S/ 6.90,wong,TOMATE ITALIANO O MARSANO,2024-12-06 14:14:00.523823
Tomates Enteros The Fresh Market 794g,S/ 10.90,wong,TOMATE ITALIANO O MARSANO,2024-12-06 14:14:00.523823
Tomates Cortados The Fresh Market Bajo en Sodio 411g,S/ 6.90,wong,TOMATE ITALIANO O MARSANO,2024-12-06 14:14:00.523823
Tomates en Cubos Del Monte Lata 411 g,S/ 12.10,wong,TOMATE ITALIANO O MARSANO,2024-12-06 14:14:00.523823
Tomates Cortados The Fresh Market 411g,S/ 6.90,wong,TOMATE ITALIANO O MARSANO,2024-12-06 14:14:00.523823
Tomate Triturado Colavita 400g,S/ 10.90,wong,TOMATE ITALIANO O MARSANO,2024-12-06 14:14:00.523823
Pimiento x kg,S/ 8.99 x kg,wong,TOMATE ITALIANO O MARSANO,2024-12-06 14:14:00.523823
Zapallito Italiano x un,S/ 2.79,wong,TOMATE ITALIANO O MARSANO,2024-12-06 14:14:00.523823
Salsa de Tomate Pomarola 145g,S/ 1.90,wong,TOMATE ITALIANO O MARSANO,2024-12-06 14:14:00.523823
Pasta de Tomate Cuisine & Co Doypack 100 g,S/ 1.70,wong,TOMATE ITALIANO O MARSANO,2024-12-06 14:14:00.523823
Concentrado de Tomate Molitalia 110g,S/ 1.80,wong,TOMATE ITALIANO O MARSANO,2024-12-06 14:14:00.523823
Salsa de Tomate Cuisine & Co Doypack 380 g,S/ 4.90,wong,TOMATE ITALIANO O MARSANO,2024-12-06 14:14:00.523823
Salsa de Tomate Don Italo 250g,S/ 10.99,wong,TOMATE ITALIANO O MARSANO,2024-12-06 14:14:00.523823
Salame Italiano Loncheado Zimmermann Paquete 100 g,S/ 13.52,wong,TOMATE ITALIANO O MARSANO,2024-12-06 14:14:00.523823
Puré de Tomate Gourmet117 680g,S/ 18.90,wong,TOMATE ITALIANO O MARSANO,2024-12-06 14:14:00.523823
Salsa de Tomate y Albahaca Orgánica The Fresh Market 709g,S/ 23.90,wong,TOMATE ITALIANO O MARSANO,2024-12-06 14:14:00.523823
Aderezo de Tomate Harmless Ketchup 352g,S/ 29.80,wong,TOMATE ITALIANO O MARSANO,2024-12-06 14:14:00.523823
Passata de Tomate Clásico La Molisana 690g,S/ 11.90,wong,TOMATE ITALIANO O MARSANO,2024-12-06 14:14:00.523823
Salsa de Tomate Estilo Casero Sin Gluten Helios Frasco 300 g,S/ 15.90,wong,TOMATE ITALIANO O MARSANO,2024-12-06 14:14:00.523823
Britvic Jugo de Tomate Vidrio 200ml,S/ 6.90,wong,TOMATE ITALIANO O MARSANO,2024-12-06 14:14:00.523823
Salsa para Pastas Filippo Berio Tomate Pesto Frasco 190 g,S/ 13.90,wong,TOMATE ITALIANO O MARSANO,2024-12-06 14:14:00.523823
Nachos Horneados Sanissimo Sabor Tomate y Albahaca 160g,S/ 8.90,wong,TOMATE ITALIANO O MARSANO,2024-12-06 14:14:00.523823
Salsa de Tomate The Fresh Market 794g,S/ 9.90,wong,TOMATE ITALIANO O MARSANO,2024-12-06 14:14:00.523823
Antipasto Italiano La Genovesa 200g,S/ 39.50,wong,TOMATE ITALIANO O MARSANO,2024-12-06 14:14:00.523823
Chorizo Italiano Paquete 220 g,S/ 12.90,wong,TOMATE ITALIANO O MARSANO,2024-12-06 14:14:00.523823
Salsa de Tomate Colavita 680g,S/ 14.90,wong,TOMATE ITALIANO O MARSANO,2024-12-06 14:14:00.523823
Mini Tostada Il Pastificio Tomate y Orégano 100g,S/ 9.90,wong,TOMATE ITALIANO O MARSANO,2024-12-06 14:14:00.523823
"Papa en Hojuelas Inka Chips Tomate, Albahaca y Oliva 115g",S/ 8.20,wong,TOMATE ITALIANO O MARSANO,2024-12-06 14:14:00.523823
Chorizo Artesanal OSSO Italiano Caja 4 unid (560 g),S/ 32.22,wong,TOMATE ITALIANO O MARSANO,2024-12-06 14:14:00.523823
"Bruschetas Chips Maretti Tomate, Aceituna y Orégano 70g",S/ 6.10,wong,TOMATE ITALIANO O MARSANO,2024-12-06 14:14:00.523823
Mondonguito Italiano Schilcayo 1kg,S/ 17.90,wong,TOMATE ITALIANO O MARSANO,2024-12-06 14:14:00.523823
Galletas de Arroz Costeño Tomate Intenso Doypack 150 g,S/ 7.10,wong,TOMATE ITALIANO O MARSANO,2024-12-06 14:14:00.523823
Frijoles con Tocino Valle Fértil Salsa de Tomate VF 454 g,S/ 9.70,wong,TOMATE ITALIANO O MARSANO,2024-12-06 14:14:00.523823
"Triple de Palta, Tomate y Huevo x un",S/ 8.90,wong,TOMATE ITALIANO O MARSANO,2024-12-06 14:14:00.523823
Bruschetta con Tomate y Orégano La Mole 150g,S/ 24.80,wong,TOMATE ITALIANO O MARSANO,2024-12-06 14:14:00.523823
"Dip Vegetariano Delice Champiñones, berenjena y tomate seco Pote 140 g",S/ 15.90,wong,TOMATE ITALIANO O MARSANO,2024-12-06 14:14:00.523823
Pimiento Cherry Ecologic 300g,S/ 6.80,wong,TOMATE ITALIANO O MARSANO,2024-12-06 14:14:00.523823
Organizador para Vegetales Tomate Bynd,S/ 8.39,wong,TOMATE ITALIANO O MARSANO,2024-12-06 14:14:00.523823
Queso De Oveja Con Tomate y Orégano La Leyenda x 150 g,S/ 31.90,wong,TOMATE ITALIANO O MARSANO,2024-12-06 14:14:00.523823
Queso Crema Gourmet Delice Italiano Molde 150 g,S/ 21.10,wong,TOMATE ITALIANO O MARSANO,2024-12-06 14:14:00.523823
Jugo de Tomate Amo Botella 500 ml,S/ 7.90,wong,TOMATE ITALIANO O MARSANO,2024-12-06 14:14:00.523823
Jugo de Tomate Campbell's Lata 162ml,S/ 8.90,wong,TOMATE ITALIANO O MARSANO,2024-12-06 14:14:00.523823
Salsa Agri-Dulce Tomate Chile Mackays Frasco 225 g,S/ 22.20,wong,TOMATE ITALIANO O MARSANO,2024-12-06 14:14:00.523823
Pimiento Justo al Día 700g,S/ 15.90,wong,TOMATE ITALIANO O MARSANO,2024-12-06 14:14:00.523823
Langostino Chico Pelado Azul Marino Bolsa 400 g,S/ 21.50,wong,TOMATE ITALIANO O MARSANO,2024-12-06 14:14:00.523823
Conchas de Abanico Media Valva Parmesana Azul Marino 6un,S/ 22.50,wong,TOMATE ITALIANO O MARSANO,2024-12-06 14:14:00.523823
Mixtura de Mariscos Congelada 400g,S/ 14.90,wong,TOMATE ITALIANO O MARSANO,2024-12-06 14:14:00.523823
Fuet Espectec Extra Enrique Tomas 170g,S/ 23.50,wong,TOMATE ITALIANO O MARSANO,2024-12-06 14:14:00.523823
Jamón Serrano Enrique Tomás Gran Reserva 80g,S/ 31.88,wong,TOMATE ITALIANO O MARSANO,2024-12-06 14:14:00.523823
Tote Bag para Pintar Sew Star,S/ 16.90,wong,TOMATE ITALIANO O MARSANO,2024-12-06 14:14:00.523823
Langostino Chico Pelado Azul Marino Bolsa 240 g,S/ 11.90,wong,TOMATE ITALIANO O MARSANO,2024-12-06 14:14:00.523823
Pulpa de Cangrejo congelada Don Marino Bolsa 200 g,S/ 32.90,wong,TOMATE ITALIANO O MARSANO,2024-12-06 14:14:00.523823
Langostino Extra Grande con cáscara Azul Marino Bolsa 400 g,S/ 27.50,wong,TOMATE ITALIANO O MARSANO,2024-12-06 14:14:00.523823
Chocolate Oscuro Orgánico 70% Cacao Piura Maraná Tableta 70 g,S/ 23.50,wong,TOMATE ITALIANO O MARSANO,2024-12-06 14:14:00.523823
Whisky Tomatin 12 Años Botella 700ml,S/ 379.90,wong,TOMATE ITALIANO O MARSANO,2024-12-06 14:14:00.523823
Langostinos Precocidos Congelados Azul Marino Bolsa 200 g,S/ 14.50,wong,TOMATE ITALIANO O MARSANO,2024-12-06 14:14:00.523823
Mate de Coca Sunka Caja 100 Sobres,S/ 23.80,wong,TOMATE ITALIANO O MARSANO,2024-12-06 14:14:00.523823
Enrique Tomás Tabla Sevillana 120g,S/ 59.00,wong,TOMATE ITALIANO O MARSANO,2024-12-06 14:14:00.523823
Enrique Tomás Tabla de Quesos Gourmet 120g,S/ 49.00,wong,TOMATE ITALIANO O MARSANO,2024-12-06 14:14:00.523823
Chocolate Oscuro Orgánico 70% Cacao Cusco Maraná Tableta 70 g,S/ 23.50,wong,TOMATE ITALIANO O MARSANO,2024-12-06 14:14:00.523823
Queso de Cabra Semi Curado Enrique Tomas 150g,S/ 29.00,wong,TOMATE ITALIANO O MARSANO,2024-12-06 14:14:00.523823
Jamón Bellota Premium Enrique Tomas 80g,S/ 104.55,wong,TOMATE ITALIANO O MARSANO,2024-12-06 14:14:00.523823
Whisky Tomatin Legacy Botella 700ml,S/ 209.90,wong,TOMATE ITALIANO O MARSANO,2024-12-06 14:14:00.523823
Chorizo Ibérico Enrique Tomás 80g,S/ 19.13,wong,TOMATE ITALIANO O MARSANO,2024-12-06 14:14:00.523823
Chocolate Oscuro Orgánico 80% Cacao San Martín Maraná Tableta 70 g,S/ 23.50,wong,TOMATE ITALIANO O MARSANO,2024-12-06 14:14:00.523823
Enrique Tomás Tabla de Cata Selecta de Embutidos 120g,S/ 39.00,wong,TOMATE ITALIANO O MARSANO,2024-12-06 14:14:00.523823
Chocolate Oscuro Orgánico 80% Cacao Cusco Maraná Tableta 70 g,S/ 23.50,wong,TOMATE ITALIANO O MARSANO,2024-12-06 14:14:00.523823
Jamón Ibérico de Campo Enrique Tomas 80g,S/ 71.83,wong,TOMATE ITALIANO O MARSANO,2024-12-06 14:14:00.523823
Queso de Oveja Curado Reserva Enrique Tomás 150g,S/ 32.20,wong,TOMATE ITALIANO O MARSANO,2024-12-06 14:14:00.523823
Queso de Oveja Semi Curado Enrique Tomás 150g,S/ 25.50,wong,TOMATE ITALIANO O MARSANO,2024-12-06 14:14:00.523823
Set de Peine y Cepillo Tommee Tippee,S/ 29.90,wong,TOMATE ITALIANO O MARSANO,2024-12-06 14:14:00.523823
Enrique Tomás Tabla Hispana 80g,S/ 39.00,wong,TOMATE ITALIANO O MARSANO,2024-12-06 14:14:00.523823
Tommee Tippee Biberón Closer To Nature 9 oz,S/ 57.90,wong,TOMATE ITALIANO O MARSANO,2024-12-06 14:14:00.523823
Lomo Gran Reserva Enrique Tomás 80g,S/ 28.90,wong,TOMATE ITALIANO O MARSANO,2024-12-06 14:14:00.523823
Choritos Enteros Precocidos Vadimar 500g,S/ 11.50,wong,TOMATE ITALIANO O MARSANO,2024-12-06 14:14:00.523823
Salchichón Ibérico Enrique Tomas 80g,S/ 18.90,wong,TOMATE ITALIANO O MARSANO,2024-12-06 14:14:00.523823
Mate Digestivo Horniman's Caja 25 Unidades,S/ 10.00,wong,TOMATE ITALIANO O MARSANO,2024-12-06 14:14:00.523823
Queso de Oveja Curado Enrique Tomás 150g,S/ 32.20,wong,TOMATE ITALIANO O MARSANO,2024-12-06 14:14:00.523823
Mantequilla de Ajo Italian Rose 198g,S/ 20.20,wong,TOMATE ITALIANO O MARSANO,2024-12-06 14:14:00.523823
Corta Uñas Tommee Tippee,S/ 29.90,wong,TOMATE ITALIANO O MARSANO,2024-12-06 14:14:00.523823
Toma Olla Print Krea,S/ 2.00,wong,TOMATE ITALIANO O MARSANO,2024-12-06 14:14:00.523823
Marcadores Paper Mate x12,S/ 35.40,wong,TOMATE ITALIANO O MARSANO,2024-12-06 14:14:00.523823
Queso de Mezcla Semi Curado Enrique Tomas 150g,S/ 28.40,wong,TOMATE ITALIANO O MARSANO,2024-12-06 14:14:00.523823
Lapicero Inkjoy Paper Mate Ballpoint Pack 4 unid,S/ 5.81,wong,TOMATE ITALIANO O MARSANO,2024-12-06 14:14:00.523823
Jamón Serrano Enrique Tomas Reserva x kg,S/ 204.50 x kg,wong,TOMATE ITALIANO O MARSANO,2024-12-06 14:14:00.523823
Rotulador Punta Media Vintage Paper Mate Flair 24un,S/ 59.75,wong,TOMATE ITALIANO O MARSANO,2024-12-06 14:14:00.523823
Lapicero Kilométrico Inkjoy Paper Mate Pack 3 unid,S/ 3.78,wong,TOMATE ITALIANO O MARSANO,2024-12-06 14:14:00.523823
Patitas Picantes Sin Pollo Marciano Vegano 200g,S/ 7.70,wong,TOMATE ITALIANO O MARSANO,2024-12-06 14:14:00.523823
Paper Mate Lapiceros Punta Media Flair Candy Pop! Pack 24 unid,S/ 59.75,wong,TOMATE ITALIANO O MARSANO,2024-12-06 14:14:00.523823
Tommee Tippee Tetina Anticólico Avanzado Flujo Lento,S/ 11.92,wong,TOMATE ITALIANO O MARSANO,2024-12-06 14:14:00.523823
Marcadores Paper Mate x6 Card Asst,S/ 19.67,wong,TOMATE ITALIANO O MARSANO,2024-12-06 14:14:00.523823
Italian Seasoning Mccormick 177g,S/ 41.90,wong,TOMATE ITALIANO O MARSANO,2024-12-06 14:14:00.523823
Marcadores Paper Mate x6,S/ 19.67,wong,TOMATE ITALIANO O MARSANO,2024-12-06 14:14:00.523823
Paper Mate Lapiceros Punta Media Flair Clásicos Pack 4 unid,S/ 12.77,wong,TOMATE ITALIANO O MARSANO,2024-12-06 14:14:00.523823
Marcadores Paper Mate x12 Card Asst,S/ 35.40,wong,TOMATE ITALIANO O MARSANO,2024-12-06 14:14:00.523823
Vino Tinto Carmenere Estate De Martino Botella 750 ml,S/ 66.90,wong,TOMATE ITALIANO O MARSANO,2024-12-06 14:14:00.523823
Vino Blanco Sauvignon Blanc Estate De Martino Botella 750 ml,S/ 66.90,wong,TOMATE ITALIANO O MARSANO,2024-12-06 14:14:00.523823
Vino Tinto Carmenere Legado De Martino Botella 750 ml,S/ 85.90,wong,TOMATE ITALIANO O MARSANO,2024-12-06 14:14:00.523823
Vino Tinto Cabernet Sauvignon Estate De Martino Botella 750 ml,S/ 66.90,wong,TOMATE ITALIANO O MARSANO,2024-12-06 14:14:00.523823
Chocolate Oscuro Orgánico 80% Cacao Piura Maraná Tableta 70 g,S/ 23.50,wong,TOMATE ITALIANO O MARSANO,2024-12-06 14:14:00.523823
Pisco Mosto Verde Italia Portón Botella 750ml,S/ 80.90,wong,TOMATE ITALIANO O MARSANO,2024-12-06 14:14:00.523823
Ensalada Italiana Mattson 300g,S/ 20.50,wong,TOMATE ITALIANO O MARSANO,2024-12-06 14:14:00.523823
Yerba Mate Taragüi 500g,S/ 26.40,wong,TOMATE ITALIANO O MARSANO,2024-12-06 14:14:00.523823
Mondongo Picado a La Italiana x kg,S/ 17.50 x kg,wong,TOMATE ITALIANO O MARSANO,2024-12-06 14:14:00.523823
Vaso Descartable Murano 350 ml Paquete 12 unid,S/ 9.59,wong,TOMATE ITALIANO O MARSANO,2024-12-06 14:14:00.523823
Aceite Oleico de Carmano 946ml,S/ 42.90,wong,TOMATE ITALIANO O MARSANO,2024-12-06 14:14:00.523823
Basurero Metal Pedal 3 Lt Cuadrado Negro Mate,S/ 42.69,wong,TOMATE ITALIANO O MARSANO,2024-12-06 14:14:00.523823
Pisco Puro Italia Cuatro Gallos Botella 1.75L,S/ 84.90,wong,TOMATE ITALIANO O MARSANO,2024-12-06 14:14:00.523823
