description,price,website,search_term,scrape_timestamp
Leche Entera Pasteurizada Danlac Botella 900ml,S/ 7.60,wong,YOGUR DE LECHE ENTERA,2024-12-06 13:41:19.265990
Yogurt Griego Vakimu Original 1 Kg,S/ 13.44,wong,YOGUR DE LECHE ENTERA,2024-12-06 13:41:19.265990
Yogurt Natural SKYR Plusa 500g,S/ 14.90,wong,YOGUR DE LECHE ENTERA,2024-12-06 13:41:19.265990
Yogurt Griego Descremado Danlac Sabor Natural Frasco 900g,S/ 16.90,wong,YOGUR DE LECHE ENTERA,2024-12-06 13:41:19.265990
Yogurt Griego Vakimu Frutos del Bosque 1 Kg,S/ 13.44,wong,YOGUR DE LECHE ENTERA,2024-12-06 13:41:19.265990
Yogurt Gloria Battimix Vainilla 146g,S/ 2.99,wong,YOGUR DE LECHE ENTERA,2024-12-06 13:41:19.265990
Leche Condensada Nestlé Lata 393g,S/ 6.20,wong,YOGUR DE LECHE ENTERA,2024-12-06 13:41:19.265990
Yogurt Gloria Griego Sabor Frutos Rojos 120g,S/ 2.20,wong,YOGUR DE LECHE ENTERA,2024-12-06 13:41:19.265990
Yogurt Vakimu +Pro Fresa 160g,S/ 4.79,wong,YOGUR DE LECHE ENTERA,2024-12-06 13:41:19.265990
Leche Deslactosada Danlac Light Botella 900ml,S/ 8.30,wong,YOGUR DE LECHE ENTERA,2024-12-06 13:41:19.265990
Yogurt Descremado Vakimu Quark 500g,S/ 11.76,wong,YOGUR DE LECHE ENTERA,2024-12-06 13:41:19.265990
Yogurt Bebible Gloria Fresa Galonera 1.7kg,S/ 9.20,wong,YOGUR DE LECHE ENTERA,2024-12-06 13:41:19.265990
Leche Reconstituida Gloria Lata 390g,S/ 4.30,wong,YOGUR DE LECHE ENTERA,2024-12-06 13:41:19.265990
Leche Fresca Piamonte Bolsa 950 ml,S/ 7.40,wong,YOGUR DE LECHE ENTERA,2024-12-06 13:41:19.265990
Yogurt Bebible Laive Sbelt Sabor Vainilla Francesa 1.7kg,S/ 11.90,wong,YOGUR DE LECHE ENTERA,2024-12-06 13:41:19.265990
Yogurt Vakimu +Pro Arándano 500g,S/ 11.92,wong,YOGUR DE LECHE ENTERA,2024-12-06 13:41:19.265990
Yogurt Bebible Yo Most Fresa Pack 6 Unid x 180 ml,S/ 13.10,wong,YOGUR DE LECHE ENTERA,2024-12-06 13:41:19.265990
Leche Light Laive Sin Lactosa Botella 390g,S/ 4.90,wong,YOGUR DE LECHE ENTERA,2024-12-06 13:41:19.265990
Yogurt Bebible Gloria Vainilla Galonera 1.7kg,S/ 9.20,wong,YOGUR DE LECHE ENTERA,2024-12-06 13:41:19.265990
Yogurt Vakimu +Pro Arándano 160g,S/ 4.88,wong,YOGUR DE LECHE ENTERA,2024-12-06 13:41:19.265990
Yogurt Entero Danlac Sabor Natural Botella 900g,S/ 9.90,wong,YOGUR DE LECHE ENTERA,2024-12-06 13:41:19.265990
Yogurt Vakimu +Pro Fresa 500g,S/ 12.16,wong,YOGUR DE LECHE ENTERA,2024-12-06 13:41:19.265990
Yogurt Bebible Laive Sbelt Sabor Fresa 1.7kg,S/ 11.90,wong,YOGUR DE LECHE ENTERA,2024-12-06 13:41:19.265990
Leche Reconstituida Gloria Light Lata 390g,S/ 4.50,wong,YOGUR DE LECHE ENTERA,2024-12-06 13:41:19.265990
Yogurt Griego Mango con Fresa Pote 1 Kg,S/ 13.44,wong,YOGUR DE LECHE ENTERA,2024-12-06 13:41:19.265990
Leche Concentrada Sin Lactosa Laive Botella 390g,S/ 4.50,wong,YOGUR DE LECHE ENTERA,2024-12-06 13:41:19.265990
Leche Semidescremada UHT Laive Sin Lactosa Caja 946ml,S/ 6.10,wong,YOGUR DE LECHE ENTERA,2024-12-06 13:41:19.265990
Yogurt Griego Descremado con Arándano Danlac Frasco 900g,S/ 16.90,wong,YOGUR DE LECHE ENTERA,2024-12-06 13:41:19.265990
Yogurt Batishake Gloria Vainilla Vaso 120 g,S/ 1.70,wong,YOGUR DE LECHE ENTERA,2024-12-06 13:41:19.265990
Yogurt Griego Vakimu Arándano 1 Kg,S/ 13.44,wong,YOGUR DE LECHE ENTERA,2024-12-06 13:41:19.265990
Yogurt Frutado con Fresa Danlac Botella 900g,S/ 9.90,wong,YOGUR DE LECHE ENTERA,2024-12-06 13:41:19.265990
Yogurt Griego Danlac Sabor Natural Frasco 420g,S/ 11.90,wong,YOGUR DE LECHE ENTERA,2024-12-06 13:41:19.265990
Yogurt Bebible Laive Sin Lactosa Sabor Vainilla Francesa 946g,S/ 5.90,wong,YOGUR DE LECHE ENTERA,2024-12-06 13:41:19.265990
Yogurt Bebible Gloria Fresa Botella 180 g,S/ 2.20,wong,YOGUR DE LECHE ENTERA,2024-12-06 13:41:19.265990
Yogurt Gloria Griego con Miel 120g,S/ 2.20,wong,YOGUR DE LECHE ENTERA,2024-12-06 13:41:19.265990
Yogurt Bebible Gloria Slim Vainilla Galonera 1.7kg,S/ 9.20,wong,YOGUR DE LECHE ENTERA,2024-12-06 13:41:19.265990
Yogurt Sin Lactosa Danlac Line Piña Pitahaya 900g,S/ 10.50,wong,YOGUR DE LECHE ENTERA,2024-12-06 13:41:19.265990
Leche Parcialmente Descremada Gloria Sabor Chocolate Caja 1L,S/ 7.00,wong,YOGUR DE LECHE ENTERA,2024-12-06 13:41:19.265990
Leche Semidescremada UHT Laive Sin Lactosa Light Caja 946ml,S/ 6.10,wong,YOGUR DE LECHE ENTERA,2024-12-06 13:41:19.265990
Yogurt Bebible Gloria Vainilla Botella 180 g,S/ 2.20,wong,YOGUR DE LECHE ENTERA,2024-12-06 13:41:19.265990
Leche UHT Sin Lactosa Gloria Zero Lacto Caja 1L,S/ 6.30,wong,YOGUR DE LECHE ENTERA,2024-12-06 13:41:19.265990
Suplemento Nutricional Vainilla PediaSure 1.6kg,S/ 169.90,wong,YOGUR DE LECHE ENTERA,2024-12-06 13:41:19.265990
Yogurt Gloria Griego Sabor Frutos Rojos 800g,S/ 6.90,wong,YOGUR DE LECHE ENTERA,2024-12-06 13:41:19.265990
Leche Ultrafiltrada Sin Lactosa Gloria Zero Lacto Lata 390g,S/ 4.50,wong,YOGUR DE LECHE ENTERA,2024-12-06 13:41:19.265990
Leche Entera UHT Laive 900ml,S/ 4.40,wong,YOGUR DE LECHE ENTERA,2024-12-06 13:41:19.265990
Yogurt Griego La Abuela Natural 1 kg,S/ 19.90,wong,YOGUR DE LECHE ENTERA,2024-12-06 13:41:19.265990
Yogurt Bebible Gloria Slim Fresa Galonera 1.7kg,S/ 9.20,wong,YOGUR DE LECHE ENTERA,2024-12-06 13:41:19.265990
Yogurt Gloria Griego Sabor Mango 120g,S/ 2.20,wong,YOGUR DE LECHE ENTERA,2024-12-06 13:41:19.265990
Yogurt Battimix Gloria Vainilla C/Hojuelas Azucaradas Vaso 125 g,S/ 2.99,wong,YOGUR DE LECHE ENTERA,2024-12-06 13:41:19.265990
Yogurt Gloria Griego Sabor Natural 800g,S/ 6.90,wong,YOGUR DE LECHE ENTERA,2024-12-06 13:41:19.265990
Yogurt Griego Sin Azúcar Tigo Premium 1kg,S/ 18.10,wong,YOGUR DE LECHE ENTERA,2024-12-06 13:41:19.265990
Leche Entera Pasteurizada Danlac Sabor Chocolate Botella 900ml,S/ 8.80,wong,YOGUR DE LECHE ENTERA,2024-12-06 13:41:19.265990
Leche Uht Vigor Bolsa 800ml,S/ 3.50,wong,YOGUR DE LECHE ENTERA,2024-12-06 13:41:19.265990
Yogurt Bebible Laive Sin Lactosa Fresa 946g,S/ 5.90,wong,YOGUR DE LECHE ENTERA,2024-12-06 13:41:19.265990
Yogurt Battishake Gloria Fresa Vaso 120 g,S/ 1.70,wong,YOGUR DE LECHE ENTERA,2024-12-06 13:41:19.265990
Leche Entera UHT Gloria Caja 1L,S/ 6.40,wong,YOGUR DE LECHE ENTERA,2024-12-06 13:41:19.265990
Yogurt Griego Danlac Sabor Natural Frasco 160g,S/ 4.90,wong,YOGUR DE LECHE ENTERA,2024-12-06 13:41:19.265990
Leche Concentrada Laive Botella 390g,S/ 4.40,wong,YOGUR DE LECHE ENTERA,2024-12-06 13:41:19.265990
Yogurt Frutado con Fresa Danlac 160g,S/ 4.90,wong,YOGUR DE LECHE ENTERA,2024-12-06 13:41:19.265990
Yogurt Griego Descremado con Mango Danlac Frasco 900g,S/ 16.90,wong,YOGUR DE LECHE ENTERA,2024-12-06 13:41:19.265990
Yogurt Bebible Laive Sbelt Sabor Vainilla Francesa 946g,S/ 5.90,wong,YOGUR DE LECHE ENTERA,2024-12-06 13:41:19.265990
Yogurt Gloria Batti Mix Mini Cookies 138g,S/ 2.99,wong,YOGUR DE LECHE ENTERA,2024-12-06 13:41:19.265990
Pack x2 Suplemento Nutricional Vainilla Ensure Advance: 850g + 400g,S/ 160.00,wong,YOGUR DE LECHE ENTERA,2024-12-06 13:41:19.265990
Yogurt Bebible Laive Sbelt Sabor Mora 946g,S/ 5.90,wong,YOGUR DE LECHE ENTERA,2024-12-06 13:41:19.265990
Yogurt Frutado Danlac Maracumango 900g,S/ 9.90,wong,YOGUR DE LECHE ENTERA,2024-12-06 13:41:19.265990
Yogurt Griego 0% Grasas Tigo Premium 1kg,S/ 18.10,wong,YOGUR DE LECHE ENTERA,2024-12-06 13:41:19.265990
Yogurt Frutado con Frutos del Bosque Danlac Botella 900g,S/ 9.90,wong,YOGUR DE LECHE ENTERA,2024-12-06 13:41:19.265990
Yogurt Batido Sabor Fresa con Bolitas de Chocolate Gloria Batti Mix 146g,S/ 2.99,wong,YOGUR DE LECHE ENTERA,2024-12-06 13:41:19.265990
Yogurt Bebible Piamonte Natural sin Azúcar Botella 946 ml,S/ 8.00,wong,YOGUR DE LECHE ENTERA,2024-12-06 13:41:19.265990
Yogurt Bebible Laive Sabor Vainilla Francesa 1.7kg,S/ 11.50,wong,YOGUR DE LECHE ENTERA,2024-12-06 13:41:19.265990
Yogurt Griego Bajo en Grasa La Abuela Natural 1 Kg,S/ 19.90,wong,YOGUR DE LECHE ENTERA,2024-12-06 13:41:19.265990
Suplemento Nutricional Vainilla Ensure Advance 850g,S/ 117.00,wong,YOGUR DE LECHE ENTERA,2024-12-06 13:41:19.265990
Yogurt Frutado Gloria Durazno Vaso 120 g,S/ 1.90,wong,YOGUR DE LECHE ENTERA,2024-12-06 13:41:19.265990
Leche Parcialmente Descremada Gloria Light Caja 1L,S/ 6.20,wong,YOGUR DE LECHE ENTERA,2024-12-06 13:41:19.265990
Leche Descremada UHT Laive Sbelt Caja 946ml,S/ 6.20,wong,YOGUR DE LECHE ENTERA,2024-12-06 13:41:19.265990
Yogurt Griego La Abuela Vainilla Francesa Bajo en Grasa 150g,S/ 6.90,wong,YOGUR DE LECHE ENTERA,2024-12-06 13:41:19.265990
Yogurt Bebible Laive Sbelt Natural 946g,S/ 5.90,wong,YOGUR DE LECHE ENTERA,2024-12-06 13:41:19.265990
Yogurt Bebible Laive Sbelt Sabor Lúcuma 946g,S/ 5.90,wong,YOGUR DE LECHE ENTERA,2024-12-06 13:41:19.265990
Leche Sabor Chocolate Laive Caja 946ml,S/ 6.50,wong,YOGUR DE LECHE ENTERA,2024-12-06 13:41:19.265990
Yogurt Frutado Gloria Fresa Vaso 120 g,S/ 1.90,wong,YOGUR DE LECHE ENTERA,2024-12-06 13:41:19.265990
Leche Fresca Piamonte Botella 950 ml,S/ 11.20,wong,YOGUR DE LECHE ENTERA,2024-12-06 13:41:19.265990
Yogurt Laive Protein Sabor Vainilla Botella 800g,S/ 11.90,wong,YOGUR DE LECHE ENTERA,2024-12-06 13:41:19.265990
Yogurt Bebible Gloria Lúcuma Galonera 1.7kg,S/ 9.20,wong,YOGUR DE LECHE ENTERA,2024-12-06 13:41:19.265990
Yogurt Bebible Gloria Durazno Galonera 1.7kg,S/ 9.20,wong,YOGUR DE LECHE ENTERA,2024-12-06 13:41:19.265990
Yogurt Batido Laive Griego Sabor Frutos Rojos 800g,S/ 8.50,wong,YOGUR DE LECHE ENTERA,2024-12-06 13:41:19.265990
Yogurt Bebible Gloria Fresa Botella 1kg,S/ 5.90,wong,YOGUR DE LECHE ENTERA,2024-12-06 13:41:19.265990
Yogurt Gloria Griego Sabor Maracuyá 120g,S/ 2.20,wong,YOGUR DE LECHE ENTERA,2024-12-06 13:41:19.265990
Yogurt Batido Natural Laive Griego Botella 800g,S/ 8.50,wong,YOGUR DE LECHE ENTERA,2024-12-06 13:41:19.265990
Yogurt Gloria Griego Sabor Natural 120g,S/ 2.20,wong,YOGUR DE LECHE ENTERA,2024-12-06 13:41:19.265990
Yogurt Bebible Gloria Sabor Fresa y Plátano 180g,S/ 2.20,wong,YOGUR DE LECHE ENTERA,2024-12-06 13:41:19.265990
Leche Condensada Gloria 393g,S/ 6.50,wong,YOGUR DE LECHE ENTERA,2024-12-06 13:41:19.265990
Leche Descremada UHT Gloria Slim Triple Zero Caja 1L,S/ 6.50,wong,YOGUR DE LECHE ENTERA,2024-12-06 13:41:19.265990
Leche UHT Vigor Light Bolsa 800ml,S/ 3.20,wong,YOGUR DE LECHE ENTERA,2024-12-06 13:41:19.265990
Yogurt Frutado Danlac Maracumango 160g,S/ 4.90,wong,YOGUR DE LECHE ENTERA,2024-12-06 13:41:19.265990
Yogurt Frutado con Fresa Danlac Line Botella 900g,S/ 10.50,wong,YOGUR DE LECHE ENTERA,2024-12-06 13:41:19.265990
Yogurt Bebible Laive Sbelt Sabor Durazno 1.7kg,S/ 11.90,wong,YOGUR DE LECHE ENTERA,2024-12-06 13:41:19.265990
Yogurt Bebible Laive con Fresa 1.7kg,S/ 11.50,wong,YOGUR DE LECHE ENTERA,2024-12-06 13:41:19.265990
Yogurt Bebible Gloria Durazno Botella 180 g,S/ 2.20,wong,YOGUR DE LECHE ENTERA,2024-12-06 13:41:19.265990
Alimento Lácteo Enfagrow Premium Promental Natural 2.2kg,S/ 201.40,wong,YOGUR DE LECHE ENTERA,2024-12-06 13:41:19.265990
Yogurt Griego Vakimu Frutos del Bosque 160g,S/ 4.40,wong,YOGUR DE LECHE ENTERA,2024-12-06 13:41:19.265990
Yogurt Bebible Gloria Slim Frutos Rojos Galonera 1.7kg,S/ 9.20,wong,YOGUR DE LECHE ENTERA,2024-12-06 13:41:19.265990
Leche Entera UHT Laive Caja 946ml,S/ 6.10,wong,YOGUR DE LECHE ENTERA,2024-12-06 13:41:19.265990
Yogurt Bebible Laive Sbelt Sabor Fresa 946g,S/ 5.90,wong,YOGUR DE LECHE ENTERA,2024-12-06 13:41:19.265990
Alimento Lácteo Enfagrow Premium Promental Vainilla 2.2kg,S/ 201.40,wong,YOGUR DE LECHE ENTERA,2024-12-06 13:41:19.265990
Yogurt Frutado con Frutos del Bosque Danlac 160g,S/ 4.90,wong,YOGUR DE LECHE ENTERA,2024-12-06 13:41:19.265990
Yogurt Bebible Laive Fresa Botella 180g,S/ 2.10,wong,YOGUR DE LECHE ENTERA,2024-12-06 13:41:19.265990
Yogurt Kéfir Duman 500g,S/ 14.90,wong,YOGUR DE LECHE ENTERA,2024-12-06 13:41:19.265990
Leche Parcialmente Descremada Gloria Light Bolsa 900ml,S/ 5.10,wong,YOGUR DE LECHE ENTERA,2024-12-06 13:41:19.265990
Yogurt Gloria Slim Sabor Fresa 120g,S/ 2.00,wong,YOGUR DE LECHE ENTERA,2024-12-06 13:41:19.265990
Yogurt Griego Vakimu Fresa 500g,S/ 7.92,wong,YOGUR DE LECHE ENTERA,2024-12-06 13:41:19.265990
Yogurt Bebible Gloria Fresa Plátano Galonera 1.7kg,S/ 9.20,wong,YOGUR DE LECHE ENTERA,2024-12-06 13:41:19.265990
Yogurt Premium Tigo Light Fresa Vaso 160 g,S/ 5.20,wong,YOGUR DE LECHE ENTERA,2024-12-06 13:41:19.265990
Yogurt Premium Tigo Light Natural Vaso 160 g,S/ 5.20,wong,YOGUR DE LECHE ENTERA,2024-12-06 13:41:19.265990
Yogurt Deslactosado Yoleit Griego Sabor Natural Pote 950g,S/ 14.20,wong,YOGUR DE LECHE ENTERA,2024-12-06 13:41:19.265990
Yogurt Bebible Gloria Natural Botella 1kg,S/ 5.90,wong,YOGUR DE LECHE ENTERA,2024-12-06 13:41:19.265990
Yogurt Bebible Sin Lactosa Yoleit Frutos del Bosque 1.6kg,S/ 8.90,wong,YOGUR DE LECHE ENTERA,2024-12-06 13:41:19.265990
Yogurt Laive Sin Lactosa Fresa 1.7kg,S/ 12.70,wong,YOGUR DE LECHE ENTERA,2024-12-06 13:41:19.265990
Yogurt Gloria Zero Lacto Fresa 1kg,S/ 6.70,wong,YOGUR DE LECHE ENTERA,2024-12-06 13:41:19.265990
Yogurt Bebible Gloria Vainilla Botella 1kg,S/ 5.90,wong,YOGUR DE LECHE ENTERA,2024-12-06 13:41:19.265990
Yogurt Griego Tigo Natural con Fresas y Granola Vaso 155 g,S/ 5.70,wong,YOGUR DE LECHE ENTERA,2024-12-06 13:41:19.265990
