description,price,website,search_term,scrape_timestamp
Tocino cocido Ahumado Casa Europa paquete 200 g,S/ 16.90,wong,TOCINO AHUMADO,2024-12-05 18:05:04.184547
Tocino Ahumado Zimmermann Paquete 200 g,S/ 14.32,wong,TOCINO AHUMADO,2024-12-05 18:05:04.184547
Tocino Ahumado Braedt Paquete 200 g,S/ 18.30,wong,TOCINO AHUMADO,2024-12-05 18:05:04.184547
Tocino Natural Ahumado Cuisine & Co 200g,S/ 10.90,wong,TOCINO AHUMADO,2024-12-05 18:05:04.184547
Tocino Natural Ahumado Salchichería Alemana 200g,S/ 14.90,wong,TOCINO AHUMADO,2024-12-05 18:05:04.184547
Tocino Ahumado Otto Kunz 150g,S/ 13.30,wong,TOCINO AHUMADO,2024-12-05 18:05:04.184547
Tocino Ahumado Suiza 200g,S/ 15.50,wong,TOCINO AHUMADO,2024-12-05 18:05:04.184547
Tocino Ahumado Oregon Foods 200g,S/ 17.90,wong,TOCINO AHUMADO,2024-12-05 18:05:04.184547
Galletas Filetitos Yamis Sabor Tocino Ahumado,S/ 7.00,wong,TOCINO AHUMADO,2024-12-05 18:05:04.184547
