description,price,website,search_term,scrape_timestamp
Hamburguesas Parrilleras Oregon Foods 4un,S/ 32.90,wong,HAMBURGUESA,2024-12-05 18:07:05.955778
Hamburguesas Angus Oregon Foods 4un,S/ 61.90,wong,HAMBURGUESA,2024-12-05 18:07:05.955778
Hamburguesas Parrilleras Wong Caja 4un,S/ 26.90,wong,HAMBURGUESA,2024-12-05 18:07:05.955778
Hamburguesas de Res Oregon Foods 8un,S/ 28.50,wong,HAMBURGUESA,2024-12-05 18:07:05.955778
Mini Burgers Angus Oregon Foods 12un,S/ 59.90,wong,HAMBURGUESA,2024-12-05 18:07:05.955778
Hamburguesa de Res Otto Kunz 8un,S/ 28.90,wong,HAMBURGUESA,2024-12-05 18:07:05.955778
Mini Burger de Res Argentina Cuisine & Co 12un,S/ 27.00,wong,HAMBURGUESA,2024-12-05 18:07:05.955778
Hamburguesa Angus Osso 4un,S/ 52.90,wong,HAMBURGUESA,2024-12-05 18:07:05.955778
Hamburguesa de Res de la Casa Wong 6un,S/ 29.90 x kg,wong,HAMBURGUESA,2024-12-05 18:07:05.955778
Albóndigas de Res Oregon Foods 15un,S/ 25.90,wong,HAMBURGUESA,2024-12-05 18:07:05.955778
Hamburguesas Premium Los Hierros 4un,S/ 33.90,wong,HAMBURGUESA,2024-12-05 18:07:05.955778
Hamburguesa de Res Argentina Cuisine & Co Burger 4un,S/ 39.90,wong,HAMBURGUESA,2024-12-05 18:07:05.955778
Hamburguesa de Pollo Avinka 4un,S/ 17.90,wong,HAMBURGUESA,2024-12-05 18:07:05.955778
Hamburguesa de Ternero Wong Gourmet 4un,S/ 30.90,wong,HAMBURGUESA,2024-12-05 18:07:05.955778
Hamburguesa San Fernando La Super Rica 14un,S/ 12.45,wong,HAMBURGUESA,2024-12-05 18:07:05.955778
Hamburguesa Parrillera de Pollo Oregon Foods 4un,S/ 25.40,wong,HAMBURGUESA,2024-12-05 18:07:05.955778
Hamburguesas de Pollo Redondos 14un,S/ 13.50,wong,HAMBURGUESA,2024-12-05 18:07:05.955778
Hamburguesa de Perico Umi Foods Caja 500 g,S/ 22.50,wong,HAMBURGUESA,2024-12-05 18:07:05.955778
Hamburguesas Angus Bon Beef Caja 4 Unid,S/ 52.90,wong,HAMBURGUESA,2024-12-05 18:07:05.955778
Hamburguesa de Res Otto Kunz Bolsa 4 unid,S/ 15.90,wong,HAMBURGUESA,2024-12-05 18:07:05.955778
Nuggets de Tilapia Marina Santa Priscila 454g,S/ 20.50,wong,HAMBURGUESA,2024-12-05 18:07:05.955778
Mini Hamburguesas Angus Bon Beef Caja 8 Unid,S/ 37.90,wong,HAMBURGUESA,2024-12-05 18:07:05.955778
Hamburguesa Parrillera de Res Otto Kunz 4un,S/ 29.90,wong,HAMBURGUESA,2024-12-05 18:07:05.955778
Hamburguesa de Pollo Oregon Foods 8un,S/ 25.00,wong,HAMBURGUESA,2024-12-05 18:07:05.955778
Hamburguesa Vegana Flexfood Flex Burger 2un,S/ 19.90,wong,HAMBURGUESA,2024-12-05 18:07:05.955778
Hamburguesas de Pollo x kg,S/ 17.75 x kg,wong,HAMBURGUESA,2024-12-05 18:07:05.955778
Hamburguesa Parrillera de Pollo Finas Hierba Redondos 4un,S/ 19.90,wong,HAMBURGUESA,2024-12-05 18:07:05.955778
Hamburguesas de Pavita San Fernando 6un,S/ 21.40,wong,HAMBURGUESA,2024-12-05 18:07:05.955778
Hamburguesa de Salmón Nutritiva 360g,S/ 17.50,wong,HAMBURGUESA,2024-12-05 18:07:05.955778
Hamburguesa de Carne de Res Americana Certified Angus Beef 4un,S/ 70.00,wong,HAMBURGUESA,2024-12-05 18:07:05.955778
Hamburguesas Parrilleras Los Hierros 4un,S/ 29.90,wong,HAMBURGUESA,2024-12-05 18:07:05.955778
Hamburguesa Parrillera de Pollo Redondos 600g,S/ 19.90,wong,HAMBURGUESA,2024-12-05 18:07:05.955778
Hamburguesa Vegana Notburger 95g,S/ 10.90,wong,HAMBURGUESA,2024-12-05 18:07:05.955778
Hamburguesa de Trucha Piscis Bolsa 500 g,S/ 20.50,wong,HAMBURGUESA,2024-12-05 18:07:05.955778
Hamburguesa Angus Rellena de Cheddar Bon Beef 4un,S/ 55.90,wong,HAMBURGUESA,2024-12-05 18:07:05.955778
Hamburguesa Vegetariana de Lentejas Della Natura 400g,S/ 20.90,wong,HAMBURGUESA,2024-12-05 18:07:05.955778
Hamburguesas de Lentejas y Champiñones Sanúa 5un,S/ 23.20,wong,HAMBURGUESA,2024-12-05 18:07:05.955778
Hamburguesa de Res Osso 4un,S/ 46.90,wong,HAMBURGUESA,2024-12-05 18:07:05.955778
Hamburguesa Angus con Sal de Maras Otto Kunz Caja 4 unid,S/ 59.90,wong,HAMBURGUESA,2024-12-05 18:07:05.955778
Hamburguesa San Fernando La Casera 14un,S/ 14.10,wong,HAMBURGUESA,2024-12-05 18:07:05.955778
Mini Hamburguesa Parrillera Otto Kunz 600g,S/ 31.90,wong,HAMBURGUESA,2024-12-05 18:07:05.955778
Hamburguesa de Carne de Res Wong Gourmet 4un,S/ 39.90,wong,HAMBURGUESA,2024-12-05 18:07:05.955778
Hamburguesa Not Chicken Crispy 95g,S/ 10.70,wong,HAMBURGUESA,2024-12-05 18:07:05.955778
Hamburguesa Vegetariana de Garbanzo Della Natura 400g,S/ 19.90,wong,HAMBURGUESA,2024-12-05 18:07:05.955778
Hamburguesa de Carne Angus Terraza Grill 4un 800g,S/ 57.90,wong,HAMBURGUESA,2024-12-05 18:07:05.955778
Mix de Hamburguesas Vegetarianas Sanúa 5un,S/ 23.20,wong,HAMBURGUESA,2024-12-05 18:07:05.955778
Hamburguesas de Pollo Redondos 6un,S/ 6.80,wong,HAMBURGUESA,2024-12-05 18:07:05.955778
Porciones de Perico Empanizado Seafrost 500g,S/ 22.50,wong,HAMBURGUESA,2024-12-05 18:07:05.955778
Hamburguesas Vegetarianas Della Natura Sabor Ahumado 400g,S/ 20.90,wong,HAMBURGUESA,2024-12-05 18:07:05.955778
Nuggets de Pescado Empanizado Seafrost 500g,S/ 20.50,wong,HAMBURGUESA,2024-12-05 18:07:05.955778
Hamburguesas de Pollo San Fernando 6un,S/ 21.50,wong,HAMBURGUESA,2024-12-05 18:07:05.955778
Mini Hamburguesas de Lentejas y Champiñones Sanúa 10un,S/ 22.40,wong,HAMBURGUESA,2024-12-05 18:07:05.955778
Hamburguesa Vegetariana de Quinua Della Natura 400g,S/ 22.90,wong,HAMBURGUESA,2024-12-05 18:07:05.955778
Hamburguesa Vegetariana de Soya Kartriso Bandeja 500 g,S/ 18.60,wong,HAMBURGUESA,2024-12-05 18:07:05.955778
Trilogía de Mini Burgers Vegetarianas Della Natura 12un,S/ 16.90,wong,HAMBURGUESA,2024-12-05 18:07:05.955778
Hamburguesa de Cerdo Finas Hierbas Terraza Grill 4un,S/ 33.90,wong,HAMBURGUESA,2024-12-05 18:07:05.955778
Mini Hamburguesas de Garbanzos y Espinaca Sanúa 10un,S/ 22.40,wong,HAMBURGUESA,2024-12-05 18:07:05.955778
Hamburguesa Angus Rellena Terraza Grill 4un,S/ 58.90,wong,HAMBURGUESA,2024-12-05 18:07:05.955778
Mini Hamburguesas de Quinua y Chía Sanúa 10un,S/ 22.40,wong,HAMBURGUESA,2024-12-05 18:07:05.955778
Hamburguesa de Langostino Santa Priscila 4un.,S/ 31.50,wong,HAMBURGUESA,2024-12-05 18:07:05.955778
Burger de Quinua Della Natura 100g,S/ 7.90,wong,HAMBURGUESA,2024-12-05 18:07:05.955778
Mini Hamburguesas de Camote y Frijoles Negros Sanúa 10un,S/ 22.40,wong,HAMBURGUESA,2024-12-05 18:07:05.955778
Hamburguesas Vegetarianas Finas Hierbas Della Natura 400g,S/ 20.90,wong,HAMBURGUESA,2024-12-05 18:07:05.955778
Hamburguesas de Camote y Frijoles Negros Sanúa 5un,S/ 23.20,wong,HAMBURGUESA,2024-12-05 18:07:05.955778
Filete de Merluza Empanizada Seafrost 500g,S/ 21.90,wong,HAMBURGUESA,2024-12-05 18:07:05.955778
Hamburguesa de Cordero y Res Terraza Grill Caja 4un 800g,S/ 56.90,wong,HAMBURGUESA,2024-12-05 18:07:05.955778
Mini Hamburguesas Wong Gourmet 10un,S/ 39.90,wong,HAMBURGUESA,2024-12-05 18:07:05.955778
Hamburguesa de Pollo La Magnífica 14un,S/ 12.49,wong,HAMBURGUESA,2024-12-05 18:07:05.955778
Hamburguesa al Guanciale La Genovesa 2un,S/ 32.90,wong,HAMBURGUESA,2024-12-05 18:07:05.955778
Hamburguesa de Vegetales Syfferent Smash Burger 4un,S/ 36.90,wong,HAMBURGUESA,2024-12-05 18:07:05.955778
Porciones de Merluza Empanizada Congelada Seafrost Bolsa 1 Kg,S/ 27.90,wong,HAMBURGUESA,2024-12-05 18:07:05.955778
Burger de Garbanzos Della Natura 100g,S/ 7.90,wong,HAMBURGUESA,2024-12-05 18:07:05.955778
Mini Hamburguesas de Frijol Negro y Quinua Sanúa 10un,S/ 22.40,wong,HAMBURGUESA,2024-12-05 18:07:05.955778
Hamburguesa al Tartufo La Genovesa 2un,S/ 56.50,wong,HAMBURGUESA,2024-12-05 18:07:05.955778
Hamburguesa a la Gorgonzola La Genovesa 2un,S/ 37.90,wong,HAMBURGUESA,2024-12-05 18:07:05.955778
Hamburguesa de Res La Segoviana Bolsa 14un,S/ 19.90,wong,HAMBURGUESA,2024-12-05 18:07:05.955778
American Angus Beef Chuck Burger Porthos Caja 4 Unid / 760 g,S/ 58.90,wong,HAMBURGUESA,2024-12-05 18:07:05.955778
Hamburguesa de Cordero La Genovesa 2un,S/ 27.50,wong,HAMBURGUESA,2024-12-05 18:07:05.955778
Carbon Vegetal Arizona x 5 Kg,S/ 25.49,wong,HAMBURGUESA,2024-12-05 18:07:05.955778
Carbón Vegetal Beef Maker 5kg,S/ 25.43,wong,HAMBURGUESA,2024-12-05 18:07:05.955778
Carbón Vegetal Beef Maker 3kg,S/ 19.43,wong,HAMBURGUESA,2024-12-05 18:07:05.955778
Tizón Especial Arizona Bolsa 5 Kg,S/ 34.49,wong,HAMBURGUESA,2024-12-05 18:07:05.955778
Hamburguesas de Pollo Natural Home 600g,S/ 12.99,wong,HAMBURGUESA,2024-12-05 18:07:05.955778
Hamburguesas de Pavo Natural Home 600g,S/ 15.99,wong,HAMBURGUESA,2024-12-05 18:07:05.955778
Hamburguesa de Carne x un,S/ 7.20,wong,HAMBURGUESA,2024-12-05 18:07:05.955778
Pan para Hamburguesa Brioche Don Mamino 600g,S/ 13.30,wong,HAMBURGUESA,2024-12-05 18:07:05.955778
Pan Hamburguesa Brioche Wong 4un,S/ 8.50,wong,HAMBURGUESA,2024-12-05 18:07:05.955778
Pan para Hamburguesa Bimbo Bolsa 8 unid,S/ 11.50,wong,HAMBURGUESA,2024-12-05 18:07:05.955778
Pan para Hamburguesa 5un,S/ 3.00,wong,HAMBURGUESA,2024-12-05 18:07:05.955778
Pan para Hamburguesa Cuisine & Co 400g,S/ 6.90,wong,HAMBURGUESA,2024-12-05 18:07:05.955778
Alimento para Perros Natural Home Hamburguesa de Res 600g,S/ 14.99,wong,HAMBURGUESA,2024-12-05 18:07:05.955778
Pan para Hamburguesa Sin Gluten Molinos del Mundo Bolsa 300 g,S/ 16.50,wong,HAMBURGUESA,2024-12-05 18:07:05.955778
Juguete Pets Fun Goma Hamburguesa,S/ 3.99,wong,HAMBURGUESA,2024-12-05 18:07:05.955778
Pan Hamburguesa con Tinta de Calamar Wong 4un,S/ 16.90,wong,HAMBURGUESA,2024-12-05 18:07:05.955778
Pan Hamburguesa Suprema Cuisine & Co,S/ 8.90,wong,HAMBURGUESA,2024-12-05 18:07:05.955778
Queso para Hamburguesa President en Tajadas 200g,S/ 13.20,wong,HAMBURGUESA,2024-12-05 18:07:05.955778
Wayu Prensa para Hamburguesas 2 Piezas,S/ 42.32,wong,HAMBURGUESA,2024-12-05 18:07:05.955778
