unit,description,price,website,search_term,scrape_timestamp
Lata 140g,Filete de Atún en Aceite Vegetal FLORIDA Lata ...,S/ 5.90 un,plaza_vea,BEBIDA ENERGIZANTE (FLUIDA),2024-12-05 16:07:20.863211
Lata 150g,Filete de Atún FLORIDA en Agua 110kcal Lata 15...,S/ 5.90 un,plaza_vea,BEBIDA ENERGIZANTE (FLUIDA),2024-12-05 16:07:20.863211
Lata 170g,Cebada Instantánea ECCO Lata 170g,S/ 10.90 un,plaza_vea,BEBIDA ENERGIZANTE (FLUIDA),2024-12-05 16:07:20.863211
Paquete 2un,Bebida de Almendra LAIVE Vio Caja 946ml Paquet...,S/ 18.50 un,plaza_vea,BEBIDA ENERGIZANTE (FLUIDA),2024-12-05 16:07:20.863211
Caja 946ml,Bebida de Almendra NATURE'S HEART Sin Azúcar C...,S/ 10.50 un,plaza_vea,BEBIDA ENERGIZANTE (FLUIDA),2024-12-05 16:07:20.863211
Paquete 6un,Bebida de Almendra NATURE'S HEART sin Azúcar 9...,S/ 47.90 un,plaza_vea,BEBIDA ENERGIZANTE (FLUIDA),2024-12-05 16:07:20.863211
Doypack 250g,Bebida Instantánea de Cebada ECCO Doypack 250g,S/ 16.90 un,plaza_vea,BEBIDA ENERGIZANTE (FLUIDA),2024-12-05 16:07:20.863211
Lata 140g,Filete de Atún FLORIDA en Aceite Girasol Lata ...,S/ 5.90 un,plaza_vea,BEBIDA ENERGIZANTE (FLUIDA),2024-12-05 16:07:20.863211
Pack 3un,Filete de Atún en Aceite Vegetal FLORIDA Lata ...,S/ 13 un,plaza_vea,BEBIDA ENERGIZANTE (FLUIDA),2024-12-05 16:07:20.863211
Bolsa 800ml,Bebida de Leche Chocolatada LA PREFERIDA Bolsa...,S/ 2.90 un,plaza_vea,BEBIDA ENERGIZANTE (FLUIDA),2024-12-05 16:07:20.863211
Paquete 1un,Hierba Luisa x unidad,S/ 1.29 un,plaza_vea,BEBIDA ENERGIZANTE (FLUIDA),2024-12-05 16:07:20.863211
Paquete 6un,Bebida Rehidratante SPORADE Sabores Surtidos B...,S/ 9.90 un,plaza_vea,BEBIDA ENERGIZANTE (FLUIDA),2024-12-05 16:07:20.863211
Botella 625ml,Vinagre Blanco FLORIDA Botella 625ml,S/ 3.50 un,plaza_vea,BEBIDA ENERGIZANTE (FLUIDA),2024-12-05 16:07:20.863211
Paquete 6un,Bebida Rehidratante GATORADE Tropical Fruit Bo...,S/ 10.90 un,plaza_vea,BEBIDA ENERGIZANTE (FLUIDA),2024-12-05 16:07:20.863211
Paquete 6un,Bebida FRUGOS DEL VALLE Manzana Caja 235ml Six...,S/ 7.90 un,plaza_vea,BEBIDA ENERGIZANTE (FLUIDA),2024-12-05 16:07:20.863211
Tetrapack 946ml,Bebida de Coco LAIVE Vio Tetrapack 946ml,S/ 9.90 un,plaza_vea,BEBIDA ENERGIZANTE (FLUIDA),2024-12-05 16:07:20.863211
Bolsa 800ml,Bebida de Leche UHT BONLÉ Chocolatada Bolsa 80...,S/ 3 un,plaza_vea,BEBIDA ENERGIZANTE (FLUIDA),2024-12-05 16:07:20.863211
Lata 140g,Trozos de Atún FLORIDA en Aceite Vegetal Lata ...,S/ 5.80 un,plaza_vea,BEBIDA ENERGIZANTE (FLUIDA),2024-12-05 16:07:20.863211
Caja 1L,Bebida GLORIA Maracuyá Caja 1L,S/ 3.90 un,plaza_vea,BEBIDA ENERGIZANTE (FLUIDA),2024-12-05 16:07:20.863211
Caja 1L,Bebida GLORIA Piña Caja 1L,S/ 3.90 un,plaza_vea,BEBIDA ENERGIZANTE (FLUIDA),2024-12-05 16:07:20.863211
Caja 1L,Bebida GLORIA Naranja Caja 1L,S/ 3.90 un,plaza_vea,BEBIDA ENERGIZANTE (FLUIDA),2024-12-05 16:07:20.863211
Paquete 6un,Bebida Rehidratante GATORADE Sabores Surtidos ...,S/ 10.90 un,plaza_vea,BEBIDA ENERGIZANTE (FLUIDA),2024-12-05 16:07:20.863211
Caja 1L,Bebida de Soya UHT SOY VIDA Caja 1L,S/ 6 un,plaza_vea,BEBIDA ENERGIZANTE (FLUIDA),2024-12-05 16:07:20.863211
Paquete 4un,Bebida de Soya LAIVE Vio Caja 946ml Paquete 4u...,S/ 25.30 un,plaza_vea,BEBIDA ENERGIZANTE (FLUIDA),2024-12-05 16:07:20.863211
Caja 946ml,Bebida de Coco NATURE'S HEART Caja 946ml,S/ 10.50 un,plaza_vea,BEBIDA ENERGIZANTE (FLUIDA),2024-12-05 16:07:20.863211
Caja 25un,Infusión de Hierba Luisa HORNIMANS Caja 25un,S/ 3.90 un,plaza_vea,BEBIDA ENERGIZANTE (FLUIDA),2024-12-05 16:07:20.863211
Caja 1L,Bebida GLORIA Mango Caja 1L,S/ 3.90 un,plaza_vea,BEBIDA ENERGIZANTE (FLUIDA),2024-12-05 16:07:20.863211
Paquete 6un,Bebida FRUGOS DEL VALLE Mango Caja 235ml Six P...,S/ 7.90 un,plaza_vea,BEBIDA ENERGIZANTE (FLUIDA),2024-12-05 16:07:20.863211
Tetrapack 946ml,Bebida de Almendra LAIVE Vio sin Endulzante Te...,S/ 9.90 un,plaza_vea,BEBIDA ENERGIZANTE (FLUIDA),2024-12-05 16:07:20.863211
Caja 1L,Bebida GLORIA Durazno Caja 1L,S/ 3.90 un,plaza_vea,BEBIDA ENERGIZANTE (FLUIDA),2024-12-05 16:07:20.863211
Tetrapack 946ml,Bebida de Coco LAIVE Vio sin Endulzante Tetrap...,S/ 9.90 un,plaza_vea,BEBIDA ENERGIZANTE (FLUIDA),2024-12-05 16:07:20.863211
Caja 100un,Hierba Luisa BELL'S Caja 100un,S/ 11.50 un,plaza_vea,BEBIDA ENERGIZANTE (FLUIDA),2024-12-05 16:07:20.863211
Paquete 12un,Bebida Rehidratante SPORADE Tropical Paquete 5...,S/ 19.50 un,plaza_vea,BEBIDA ENERGIZANTE (FLUIDA),2024-12-05 16:07:20.863211
Botella 3L,Bebida FRUGOS Citrus Fresh Naranja Botella 3L,S/ 5.90 un,plaza_vea,BEBIDA ENERGIZANTE (FLUIDA),2024-12-05 16:07:20.863211
Paquete 2un,Bebida de Almendra sin Azúcar NATURES HEART Ca...,S/ 18.50 un,plaza_vea,BEBIDA ENERGIZANTE (FLUIDA),2024-12-05 16:07:20.863211
Caja 100un,Hierba Luisa MC COLIN'S Caja 100un,S/ 12.40 un,plaza_vea,BEBIDA ENERGIZANTE (FLUIDA),2024-12-05 16:07:20.863211
Paquete 6un,Bebida de Soya SOY VIDA Lata 390g Paquete 6un,S/ 15 un,plaza_vea,BEBIDA ENERGIZANTE (FLUIDA),2024-12-05 16:07:20.863211
Caja 20un,Hierba Luisa BELL'S Caja 20un,S/ 3.20 un,plaza_vea,BEBIDA ENERGIZANTE (FLUIDA),2024-12-05 16:07:20.863211
Paquete 12un,Filete de Atún FLORIDA en Agua Paquete 12un,S/ 70.80 un,plaza_vea,BEBIDA ENERGIZANTE (FLUIDA),2024-12-05 16:07:20.863211
Caja 25un,Hierba Luisa MC COLIN'S Caja 25un,S/ 4.20 un,plaza_vea,BEBIDA ENERGIZANTE (FLUIDA),2024-12-05 16:07:20.863211
Botella 500ml,Bebida Rehidratante GATORADE Mandarina Botella...,S/ 2 un,plaza_vea,BEBIDA ENERGIZANTE (FLUIDA),2024-12-05 16:07:20.863211
Sobre 14g,Bebida Instantánea en Polvo CLIGHT Sin Caloría...,S/ 2.30 un,plaza_vea,BEBIDA ENERGIZANTE (FLUIDA),2024-12-05 16:07:20.863211
Tetrapack 946ml,Bebida de Almendra LAIVE Vio Tetrapack 946ml,S/ 9.90 un,plaza_vea,BEBIDA ENERGIZANTE (FLUIDA),2024-12-05 16:07:20.863211
Paquete 12un,Bebida PULP Durazno Forti Hierro Caja 145ml Pa...,S/ 8.90 un,plaza_vea,BEBIDA ENERGIZANTE (FLUIDA),2024-12-05 16:07:20.863211
Caja 946ml,Bebida de Coco y Vainilla NATURE'S HEART sin A...,S/ 10.99 un,plaza_vea,BEBIDA ENERGIZANTE (FLUIDA),2024-12-05 16:07:20.863211
Sobre 15g,Bebida Instantánea en Polvo ZUKO Sabores de mi...,S/ 1.20 un,plaza_vea,BEBIDA ENERGIZANTE (FLUIDA),2024-12-05 16:07:20.863211
,Caja China Mediana con Parrilla MR. GRILL + F...,S/ 319 un,plaza_vea,BEBIDA ENERGIZANTE (FLUIDA),2024-12-05 16:07:20.863211
Caja 946ml,Bebida de Almendra NATURE'S HEART Vainilla Sin...,S/ 10.99 un,plaza_vea,BEBIDA ENERGIZANTE (FLUIDA),2024-12-05 16:07:20.863211
Paquete 4un,Bebida Rehidratante SUEROX Surtido Botella 630...,S/ 19.50 un,plaza_vea,BEBIDA ENERGIZANTE (FLUIDA),2024-12-05 16:07:20.863211
Botella 3.03L,Bebida CIFRUT Citrus Punch Botella 3L,S/ 5.90 un,plaza_vea,BEBIDA ENERGIZANTE (FLUIDA),2024-12-05 16:07:20.863211
Doypack 100g,Cebada Instantánea KIMBO Doypack 100g,S/ 5.90 un,plaza_vea,BEBIDA ENERGIZANTE (FLUIDA),2024-12-05 16:07:20.863211
Botella 1.5L,Bebida Rehidratante SPORADE Tropical Electroli...,S/ 5.50 un,plaza_vea,BEBIDA ENERGIZANTE (FLUIDA),2024-12-05 16:07:20.863211
Botella 625ml,Vinagre Tinto FLORIDA Botella 625ml,S/ 3.50 un,plaza_vea,BEBIDA ENERGIZANTE (FLUIDA),2024-12-05 16:07:20.863211
,Bloqueador UV Defender L'ORÉAL Fluido Invisibl...,S/ 57.90 un,plaza_vea,BEBIDA ENERGIZANTE (FLUIDA),2024-12-05 16:07:20.863211
Botella 3.03L,Bebida CIFRUT Fruit Punch Botella 3L,S/ 5.90 un,plaza_vea,BEBIDA ENERGIZANTE (FLUIDA),2024-12-05 16:07:20.863211
Bolsa 1Kg,Bebida Fortificante CHOCOLISTO Chocolate Bolsa...,S/ 31.90 un,plaza_vea,BEBIDA ENERGIZANTE (FLUIDA),2024-12-05 16:07:20.863211
Tetrapack 946ml,Bebida de Soya LAIVE Vio Tetrapack 946ml,S/ 7.60 un,plaza_vea,BEBIDA ENERGIZANTE (FLUIDA),2024-12-05 16:07:20.863211
Paquete 6un,Bebida Láctea BONLÉ Defensis Lata 390g Paquete...,S/ 15 un,plaza_vea,BEBIDA ENERGIZANTE (FLUIDA),2024-12-05 16:07:20.863211
Paquete 6un,Bebida PULP Durazno Caja 315ml Paquete 6un,S/ 8.90 un,plaza_vea,BEBIDA ENERGIZANTE (FLUIDA),2024-12-05 16:07:20.863211
Botella 3L,Bebida FRUGOS DEL VALLE Fruit Punch Botella 3L,S/ 5.90 un,plaza_vea,BEBIDA ENERGIZANTE (FLUIDA),2024-12-05 16:07:20.863211
Frasco 164g,Cebada Instantánea KIMBO Frasco 164g,S/ 9.10 un,plaza_vea,BEBIDA ENERGIZANTE (FLUIDA),2024-12-05 16:07:20.863211
Botella 0.95L,Bebida de Coco NATURES HEART sin Azúcar Botell...,S/ 10.50 un,plaza_vea,BEBIDA ENERGIZANTE (FLUIDA),2024-12-05 16:07:20.863211
Bolsa 900ml,Bebida de Leche Chocolatada LAIVE Bolsa 900ml,S/ 5.50 un,plaza_vea,BEBIDA ENERGIZANTE (FLUIDA),2024-12-05 16:07:20.863211
Botella 625ml,Bebida SAN LUIS Sin Gas Sabor Piña y Kión Bote...,S/ 2.20 un,plaza_vea,BEBIDA ENERGIZANTE (FLUIDA),2024-12-05 16:07:20.863211
Caja 1L,Bebida FRUGOS Mango y Fresa Caja 1L,S/ 4.50 un,plaza_vea,BEBIDA ENERGIZANTE (FLUIDA),2024-12-05 16:07:20.863211
Caja 970ml,Bebida FRUGOS Sabor a Mango Caja 970ml,S/ 3.90 un,plaza_vea,BEBIDA ENERGIZANTE (FLUIDA),2024-12-05 16:07:20.863211
Botella 500ml,Bebida Rehidratante GATORADE Tropical Fruit Bo...,S/ 2 un,plaza_vea,BEBIDA ENERGIZANTE (FLUIDA),2024-12-05 16:07:20.863211
Sobre 15g,Bebida Instantánea en Polvo ZUKO Naranja Sobre...,S/ 1.20 un,plaza_vea,BEBIDA ENERGIZANTE (FLUIDA),2024-12-05 16:07:20.863211
Paquete 6un,Bebida Energizante VOLT Ginseng Botella 300ml ...,S/ 9.90 un,plaza_vea,BEBIDA ENERGIZANTE (FLUIDA),2024-12-05 16:07:20.863211
Botella 500ml,Bebida Rehidratante GATORADE Apple Ice Botella...,S/ 2 un,plaza_vea,BEBIDA ENERGIZANTE (FLUIDA),2024-12-05 16:07:20.863211
Caja 946ml,Bebida Vegetal NATURE'S HEART Origen Caja 946m...,S/ 10.99 un,plaza_vea,BEBIDA ENERGIZANTE (FLUIDA),2024-12-05 16:07:20.863211
Sobre 15g,Bebida Instantánea en Polvo ZUKO Piña Sobre 15...,S/ 1.20 un,plaza_vea,BEBIDA ENERGIZANTE (FLUIDA),2024-12-05 16:07:20.863211
Lata 140g,Solido de Atún FLORIDA Lata 140g,S/ 6.50 un,plaza_vea,BEBIDA ENERGIZANTE (FLUIDA),2024-12-05 16:07:20.863211
Botella 300ml,Bebida Aloe KERO Uva Botella 300ml,S/ 3.10 un,plaza_vea,BEBIDA ENERGIZANTE (FLUIDA),2024-12-05 16:07:20.863211
Paquete 4un,Bebida Rehidratante SUEROX Fresa Botella 630ml...,S/ 19.50 un,plaza_vea,BEBIDA ENERGIZANTE (FLUIDA),2024-12-05 16:07:20.863211
Botella 300ml,Bebida Aloe KERO Piña Botella 300ml,S/ 3.10 un,plaza_vea,BEBIDA ENERGIZANTE (FLUIDA),2024-12-05 16:07:20.863211
Caja 946ml,Bebida de Almendra SILK sin Azúcar Caja 946ml,S/ 16.90 un,plaza_vea,BEBIDA ENERGIZANTE (FLUIDA),2024-12-05 16:07:20.863211
Lata 250ml,Bebidas Energizantes RED BULL Ambar Edition La...,S/ 6 un,plaza_vea,BEBIDA ENERGIZANTE (FLUIDA),2024-12-05 16:07:20.863211
Bolsa 150g,Infusiones RENACER Cebada Tostada Bolsa 150g,S/ 6.80 un,plaza_vea,BEBIDA ENERGIZANTE (FLUIDA),2024-12-05 16:07:20.863211
Botella 1L,Bebida BELL'S Cranberry Bajo en Calorías Botel...,S/ 8.50 un,plaza_vea,BEBIDA ENERGIZANTE (FLUIDA),2024-12-05 16:07:20.863211
Caja 1L,Bebida FRUGOS Piña y Mandarina Caja 1L,S/ 4.50 un,plaza_vea,BEBIDA ENERGIZANTE (FLUIDA),2024-12-05 16:07:20.863211
Caja 1.5L,Bebida de Naranja GLORIA Caja 1.5L,S/ 5 un,plaza_vea,BEBIDA ENERGIZANTE (FLUIDA),2024-12-05 16:07:20.863211
Sobre 15g,Bebida Instantánea en Polvo ZUKO Fresa Sobre 1...,S/ 1.20 un,plaza_vea,BEBIDA ENERGIZANTE (FLUIDA),2024-12-05 16:07:20.863211
Caja 2910ml,Bebida FRUGOS Sabor a Durazno Paquete 1un + Be...,S/ 12.30 un,plaza_vea,BEBIDA ENERGIZANTE (FLUIDA),2024-12-05 16:07:20.863211
Caja 946ml,Bebida de Almendra NATURE'S HEART Caja 946ml,S/ 10.50 un,plaza_vea,BEBIDA ENERGIZANTE (FLUIDA),2024-12-05 16:07:20.863211
Paquete 4un,Bebida Energizante RED BULL Sugarfree Lata 250...,S/ 28.50 un,plaza_vea,BEBIDA ENERGIZANTE (FLUIDA),2024-12-05 16:07:20.863211
Lata 250ml,Bebida energizante RED BULL Lata 250Ml,S/ 6 un,plaza_vea,BEBIDA ENERGIZANTE (FLUIDA),2024-12-05 16:07:20.863211
Sobre 15g,Bebida Instantánea en Polvo ZUKO Limonada Sobr...,S/ 1.20 un,plaza_vea,BEBIDA ENERGIZANTE (FLUIDA),2024-12-05 16:07:20.863211
Paquete 4un,Bebida Rehidratante SUEROX Mora Botella 630ml ...,S/ 19.50 un,plaza_vea,BEBIDA ENERGIZANTE (FLUIDA),2024-12-05 16:07:20.863211
Botella 1.5L,Bebida FRUGOS Fresh Citrus Naranja Botella 1.5...,S/ 3.90 un,plaza_vea,BEBIDA ENERGIZANTE (FLUIDA),2024-12-05 16:07:20.863211
Botella 390g,Bebida de Almendras Concentrada LAIVE Botella ...,S/ 6.50 un,plaza_vea,BEBIDA ENERGIZANTE (FLUIDA),2024-12-05 16:07:20.863211
Lata 250ml,Bebida Energizante RED BULL Red Edition Lata 2...,S/ 6 un,plaza_vea,BEBIDA ENERGIZANTE (FLUIDA),2024-12-05 16:07:20.863211
Botella 300ml,Bebida Natural BIO Arándano con Uva y Manzana ...,S/ 3.50 un,plaza_vea,BEBIDA ENERGIZANTE (FLUIDA),2024-12-05 16:07:20.863211
,Fluido Día FPS50 Antimanchas NIVEA Cellular Lu...,S/ 63.50 un,plaza_vea,BEBIDA ENERGIZANTE (FLUIDA),2024-12-05 16:07:20.863211
Botella 500ml,Bebida Rehidratante GATORADE Cool Blue Botella...,S/ 2 un,plaza_vea,BEBIDA ENERGIZANTE (FLUIDA),2024-12-05 16:07:20.863211
Paquete 6un,Bebida Energizante RED BULL Paquete 6un Lata 2...,S/ 39.50 un,plaza_vea,BEBIDA ENERGIZANTE (FLUIDA),2024-12-05 16:07:20.863211
Caja 1L,Bebida de Avena ORASI Caja 1L,S/ 14.60 un,plaza_vea,BEBIDA ENERGIZANTE (FLUIDA),2024-12-05 16:07:20.863211
Botella 1L,Bebida Rehidratante GATORADE Frutos Tropicales...,S/ 3.60 un,plaza_vea,BEBIDA ENERGIZANTE (FLUIDA),2024-12-05 16:07:20.863211
Caja 1ml,Bebida de Almendra NATURE'S HEART Almendra y C...,S/ 10.99 un,plaza_vea,BEBIDA ENERGIZANTE (FLUIDA),2024-12-05 16:07:20.863211
Botella 500ml,Bebida Rehidratante sin Azúcar SPORADE Apple I...,S/ 2.40 un,plaza_vea,BEBIDA ENERGIZANTE (FLUIDA),2024-12-05 16:07:20.863211
