description,brand,price,website,search_term,scrape_timestamp,cantidad,unidad,description_no_unit,price_numeric
Hamburguesa Casera Ref LA FLORENCIA x kg,LA FLORENCIA,S/ 20.90,vivanda,HAMBURGUESA,2024-12-04 17:30:35.099051,1.0,kg,Hamburguesa Casera Ref LA FLORENCIA,20.9
Hamburguesa de Carne La Casera SAN FERNANDO Bolsa 910g,SAN FERNANDO,S/ 12.60,vivanda,HAMBURGUESA,2024-12-04 17:30:35.099051,910.0,g,Hamburguesa de Carne La Casera SAN FERNANDO Bolsa,12.6
Hamburguesa OTTO KUNZ Premium de Res Bolsa 8un,OTTO KUNZ,S/ 28.00,vivanda,HAMBURGUESA,2024-12-04 17:30:35.099051,8.0,un,Hamburguesa OTTO KUNZ Premium de Res Bolsa,28.0
Hamburguesa de Garbanzos y Espinacas SANÚA Caja 5un,SANUA,S/ 28.00,vivanda,HAMBURGUESA,2024-12-04 17:30:35.099051,5.0,un,Hamburguesa de Garbanzos y Espinacas SANÚA Caja,28.0
Hamburguesa de Res OREGON Foods Bolsa 8un,OREGON FOODS,S/ 26.90,vivanda,HAMBURGUESA,2024-12-04 17:30:35.099051,8.0,un,Hamburguesa de Res OREGON Foods Bolsa,26.9
Hamburguesa de Lentejas y Champiñones SANÚA Caja 5un,SANUA,S/ 28.00,vivanda,HAMBURGUESA,2024-12-04 17:30:35.099051,5.0,un,Hamburguesa de Lentejas y Champiñones SANÚA Caja,28.0
Hamburguesa de Salmón UMI Bolsa 360g,UMIFOODS,S/ 18.40,vivanda,HAMBURGUESA,2024-12-04 17:30:35.099051,360.0,g,Hamburguesa de Salmón UMI Bolsa,18.4
Hamburguesa BEST MEATS Carne Angus Caja 4un,BEST MEATS,S/ 60.00,vivanda,HAMBURGUESA,2024-12-04 17:30:35.099051,4.0,un,Hamburguesa BEST MEATS Carne Angus Caja,60.0
Hamburguesa OTTO KUNZ Parrillera de Res Bolsa 4un,OTTO KUNZ,S/ 29.00,vivanda,HAMBURGUESA,2024-12-04 17:30:35.099051,4.0,un,Hamburguesa OTTO KUNZ Parrillera de Res Bolsa,29.0
Hamburguesa Mixta SANÚA Caja 5un,SANUA,S/ 28.00,vivanda,HAMBURGUESA,2024-12-04 17:30:35.099051,5.0,un,Hamburguesa Mixta SANÚA Caja,28.0
Hamburguesa BEST MEATS Parrillera de Pollo Caja 4un,BEST MEATS,S/ 24.60,vivanda,HAMBURGUESA,2024-12-04 17:30:35.099051,4.0,un,Hamburguesa BEST MEATS Parrillera de Pollo Caja,24.6
Hamburguesa de pollo REDONDOS Bolsa 14un,REDONDOS,S/ 11.99,vivanda,HAMBURGUESA,2024-12-04 17:30:35.099051,14.0,un,Hamburguesa de pollo REDONDOS Bolsa,11.99
Hamburguesa BEST MEATS Parrillera Novillo Caja 4un,BEST MEATS,S/ 32.90,vivanda,HAMBURGUESA,2024-12-04 17:30:35.099051,4.0,un,Hamburguesa BEST MEATS Parrillera Novillo Caja,32.9
Hamburguesa de Pollo OREGON FOODS Bolsa 8un,OREGON FOODS,S/ 25.90,vivanda,HAMBURGUESA,2024-12-04 17:30:35.099051,8.0,un,Hamburguesa de Pollo OREGON FOODS Bolsa,25.9
Hamburguesa OTTO KUNZ Premium de Res Bolsa 4un,OTTO KUNZ,S/ 15.40,vivanda,HAMBURGUESA,2024-12-04 17:30:35.099051,4.0,un,Hamburguesa OTTO KUNZ Premium de Res Bolsa,15.4
Hamburguesa BEST MEATS Bife Caja 4un,BEST MEATS,S/ 56.70,vivanda,HAMBURGUESA,2024-12-04 17:30:35.099051,4.0,un,Hamburguesa BEST MEATS Bife Caja,56.7
Hamburguesa Parrillera BON BEEF Caja 4un,BON BEEF,S/ 34.90,vivanda,HAMBURGUESA,2024-12-04 17:30:35.099051,4.0,un,Hamburguesa Parrillera BON BEEF Caja,34.9
Hamburguesa Parrillera BELL'S SELECCIÓN Paquete 4un,BELL'S SELECCIÓN,S/ 22.90,vivanda,HAMBURGUESA,2024-12-04 17:30:35.099051,4.0,un,Hamburguesa Parrillera BELL'S SELECCIÓN Paquete,22.9
Hamburguesa de Carne La Super SAN FERNANDO Bolsa 850g,SAN FERNANDO,S/ 12.70,vivanda,HAMBURGUESA,2024-12-04 17:30:35.099051,850.0,g,Hamburguesa de Carne La Super SAN FERNANDO Bolsa,12.7
Hamburguesa Angus BON BEEF Caja 4un,BON BEEF,S/ 51.90,vivanda,HAMBURGUESA,2024-12-04 17:30:35.099051,4.0,un,Hamburguesa Angus BON BEEF Caja,51.9
Hamburguesa Angus BELL'S SELECCIÓN Paquete 4un,BELL'S SELECCIÓN,S/ 40.90,vivanda,HAMBURGUESA,2024-12-04 17:30:35.099051,4.0,un,Hamburguesa Angus BELL'S SELECCIÓN Paquete,40.9
Hamburguesa Gluten Free FLEXFOOD Caja 240g,FLEXFOOD,S/ 20.50,vivanda,HAMBURGUESA,2024-12-04 17:30:35.099051,240.0,g,Hamburguesa Gluten Free FLEXFOOD Caja,20.5
Hamburguesa de Garbanzos DELLANATURA Caja 400g,DELLANATURA,S/ 16.90,vivanda,HAMBURGUESA,2024-12-04 17:30:35.099051,400.0,g,Hamburguesa de Garbanzos DELLANATURA Caja,16.9
Hamburguesa de Quinua DELLANATURA Caja 400g,DELLANATURA,S/ 22.90,vivanda,HAMBURGUESA,2024-12-04 17:30:35.099051,400.0,g,Hamburguesa de Quinua DELLANATURA Caja,22.9
Hamburguesa Veggie BON BEEF Caja 600g,BON BEEF,S/ 23.90,vivanda,HAMBURGUESA,2024-12-04 17:30:35.099051,600.0,g,Hamburguesa Veggie BON BEEF Caja,23.9
Hamburguesa de Pescado BELL'S Caja 500g,BELL'S,S/ 17.40,vivanda,HAMBURGUESA,2024-12-04 17:30:35.099051,500.0,g,Hamburguesa de Pescado BELL'S Caja,17.4
Hamburguesa Premium Cong LA FLORENCIA x kg,LA FLORENCIA,S/ 27.20,vivanda,HAMBURGUESA,2024-12-04 17:30:35.099051,1.0,kg,Hamburguesa Premium Cong LA FLORENCIA,27.2
Hamburguesa Parrillera de Pollo AVINKA Caja 4un,AVINKA,S/ 20.40,vivanda,HAMBURGUESA,2024-12-04 17:30:35.099051,4.0,un,Hamburguesa Parrillera de Pollo AVINKA Caja,20.4
Hamburguesa de Lentejas DELLANATURA Caja 400g,DELLANATURA,S/ 20.90,vivanda,HAMBURGUESA,2024-12-04 17:30:35.099051,400.0,g,Hamburguesa de Lentejas DELLANATURA Caja,20.9
Hamburguesa Angus Rellena de Queso Cheddar BON BEFF Paquete 4un,BON BEEF,S/ 54.90,vivanda,HAMBURGUESA,2024-12-04 17:30:35.099051,4.0,un,Hamburguesa Angus Rellena de Queso Cheddar BON BEFF Paquete,54.9
Pan Hamburguesa Brioche DON MAMINO 600g,DON MAMINO,S/ 12.90,vivanda,HAMBURGUESA,2024-12-04 17:30:35.099051,600.0,g,Pan Hamburguesa Brioche DON MAMINO,12.9
Pan Hamburguesa Brioche LA FLORENCIA Bolsa 340g,LA FLORENCIA,S/ 9.10,vivanda,HAMBURGUESA,2024-12-04 17:30:35.099051,340.0,g,Pan Hamburguesa Brioche LA FLORENCIA Bolsa,9.1
Mix Mini Hamburguesas SANÚA Caja 500g,SANUA,S/ 21.19,vivanda,HAMBURGUESA,2024-12-04 17:30:35.099051,500.0,g,Mix Mini Hamburguesas SANÚA Caja,21.19
Pan Hamburguesa BIMBO Bolsa 8un,BIMBO,S/ 10.50,vivanda,HAMBURGUESA,2024-12-04 17:30:35.099051,8.0,un,Pan Hamburguesa BIMBO Bolsa,10.5
Pan Hamburguesa BIMBO Artesano Brioche Bolsa 360g,BIMBO,S/ 10.60,vivanda,HAMBURGUESA,2024-12-04 17:30:35.099051,360.0,g,Pan Hamburguesa BIMBO Artesano Brioche Bolsa,10.6
Pan con Hamburguesa Queso y Tocino x un,VIVANDA,S/ 7.90,vivanda,HAMBURGUESA,2024-12-04 17:30:35.099051,1.0,un,Pan con Hamburguesa Queso y Tocino,7.9
Pan Hamburguesa LA FLORENCIA Bolsa 405g,LA FLORENCIA,S/ 5.00,vivanda,HAMBURGUESA,2024-12-04 17:30:35.099051,405.0,g,Pan Hamburguesa LA FLORENCIA Bolsa,5.0
Mini Hamburguesas BEST MEATS Carne Angus Caja 600g,BEST MEATS,S/ 58.10,vivanda,HAMBURGUESA,2024-12-04 17:30:35.099051,600.0,g,Mini Hamburguesas BEST MEATS Carne Angus Caja,58.1
Mini Hamburguesa Parrillera OTTO KUNZ Caja 600g,OTTO KUNZ,S/ 30.90,vivanda,HAMBURGUESA,2024-12-04 17:30:35.099051,600.0,g,Mini Hamburguesa Parrillera OTTO KUNZ Caja,30.9
Papas Peruanas INKA CHIPS Bembos Hamburguesa Bolsa 120g,INKA CHIPS,S/ 8.30,vivanda,HAMBURGUESA,2024-12-04 17:30:35.099051,120.0,g,Papas Peruanas INKA CHIPS Bembos Hamburguesa Bolsa,8.3
Mini Hamburguesa Angus BON BEEF Caja 8un,BON BEEF,S/ 36.80,vivanda,HAMBURGUESA,2024-12-04 17:30:35.099051,8.0,un,Mini Hamburguesa Angus BON BEEF Caja,36.8
Rodajas de Pepinillo en Conserva HENGSTENBERG Para Hamburguesas Frasco 330g,HENGSTENBERG,S/ 33.80,vivanda,HAMBURGUESA,2024-12-04 17:30:35.099051,330.0,g,Rodajas de Pepinillo en Conserva HENGSTENBERG Para Hamburguesas Frasco,33.8
Mini Hamburguesa Angus BELL'S SELECCIÓN Paquete 10un,BELL'S SELECCIÓN,S/ 30.90,vivanda,HAMBURGUESA,2024-12-04 17:30:35.099051,10.0,un,Mini Hamburguesa Angus BELL'S SELECCIÓN Paquete,30.9
Queso para Hamburguesa en Tajadas PRESIDENT 200g,PRESIDENT,S/ 16.90,vivanda,HAMBURGUESA,2024-12-04 17:30:35.099051,200.0,g,Queso para Hamburguesa en Tajadas PRESIDENT,16.9
