unit,description,price,website,search_term,scrape_timestamp,cantidad,unidad,description_no_unit,price_numeric
Bolsa 900g,Avena QUAKER Tradicional Bolsa 900g,S/ 14.50 un,plaza_vea,AVENA ENVASADA,2024-12-04 12:57:59.634534,900.0,g,Avena QUAKER Tradicional Bolsa,14.5
Pack 660g,Jabón en Barra Antibacterial PROTEX Avena 6x11...,S/ 19.90 un,plaza_vea,AVENA ENVASADA,2024-12-04 12:57:59.634534,660.0,g,Jabón en Barra Antibacterial PROTEX Avena 6x11,19.9
Bolsa 540g,Pan de Molde UNIÓN Multisemillas y Avena Bolsa...,S/ 10.89 un,plaza_vea,AVENA ENVASADA,2024-12-04 12:57:59.634534,540.0,g,Pan de Molde UNIÓN Multisemillas y Avena Bolsa,10.89
Bolsa 900g,Avena Clásica 3 OSITOS Premium Bolsa 900g,S/ 10.90 un,plaza_vea,AVENA ENVASADA,2024-12-04 12:57:59.634534,900.0,g,Avena Clásica 3 OSITOS Premium Bolsa,10.9
Bolsa 10Kg,Arena para Gatos KLINKAT 100% Natural Bolsa 10...,S/ 24.90 un,plaza_vea,AVENA ENVASADA,2024-12-04 12:57:59.634534,10.0,kg,Arena para Gatos KLINKAT 100% Natural Bolsa 10,24.9
Paquete 360g,Jabón en Barra PALMOLIVE Avena y Azucar 3x120g,S/ 9.90 un,plaza_vea,AVENA ENVASADA,2024-12-04 12:57:59.634534,360.0,g,Jabón en Barra PALMOLIVE Avena y Azucar 3x,9.9
Bolsa 900g,Avena Natural SANTA CATALINA Bolsa 900g,S/ 9.50 un,plaza_vea,AVENA ENVASADA,2024-12-04 12:57:59.634534,900.0,g,Avena Natural SANTA CATALINA Bolsa,9.5
Doypack 750ml,Jabón Líquido BALLERINA Avena Doypack 750ml,S/ 10.90 un,plaza_vea,AVENA ENVASADA,2024-12-04 12:57:59.634534,750.0,ml,Jabón Líquido BALLERINA Avena Doypack,10.9
110g,Jabón en Barra PROTEX Avena 3x110g,S/ 10.90 un,plaza_vea,AVENA ENVASADA,2024-12-04 12:57:59.634534,110.0,g,Jabón en Barra PROTEX Avena 3x,10.9
Bolsa 1kg,Avena Precocida BELL'S Bolsa 1Kg,S/ 9.20 un,plaza_vea,AVENA ENVASADA,2024-12-04 12:57:59.634534,1.0,kg,Avena Precocida BELL'S Bolsa,9.2
Bolsa 900g,Quinua Avena 3 OSITOS Bolsa 900g,S/ 11.90 un,plaza_vea,AVENA ENVASADA,2024-12-04 12:57:59.634534,900.0,g,Quinua Avena 3 OSITOS Bolsa,11.9
Pack 500g,Ensalada Jardinera BELL'S Bolsa 500g,S/ 5.50 un,plaza_vea,AVENA ENVASADA,2024-12-04 12:57:59.634534,500.0,g,Ensalada Jardinera BELL'S Bolsa,5.5
Paquete 3un,Jabón de Tocador JOHNSONS Almendra y Avena Bar...,S/ 11.80 un,plaza_vea,AVENA ENVASADA,2024-12-04 12:57:59.634534,3.0,un,Jabón de Tocador JOHNSONS Almendra y Avena Bar,11.8
Bolsa 500g,Avena QUAKER Tradicional Bolsa 500g,S/ 8.30 un,plaza_vea,AVENA ENVASADA,2024-12-04 12:57:59.634534,500.0,g,Avena QUAKER Tradicional Bolsa,8.3
Bolsa 500g,Avena Integral GRANO DE ORO Bolsa 500g,S/ 5.50 un,plaza_vea,AVENA ENVASADA,2024-12-04 12:57:59.634534,500.0,g,Avena Integral GRANO DE ORO Bolsa,5.5
Bolsa 1kg,Avena GRANO DE ORO Bolsa 1Kg,S/ 10.50 un,plaza_vea,AVENA ENVASADA,2024-12-04 12:57:59.634534,1.0,kg,Avena GRANO DE ORO Bolsa,10.5
Doypack 1L,Jabón Líquido Antibacterial BACTERION Avena y ...,S/ 14.60 un,plaza_vea,AVENA ENVASADA,2024-12-04 12:57:59.634534,1.0,l,Jabón Líquido Antibacterial BACTERION Avena y,14.6
Bolsa 850g,Avena con Quinua QUAKER Bolsa 850g,S/ 14.50 un,plaza_vea,AVENA ENVASADA,2024-12-04 12:57:59.634534,850.0,g,Avena con Quinua QUAKER Bolsa,14.5
Bolsa 500g,Avena SANTA CATALINA Natural Bolsa 500g,S/ 4.99 un,plaza_vea,AVENA ENVASADA,2024-12-04 12:57:59.634534,500.0,g,Avena SANTA CATALINA Natural Bolsa,4.99
Bolsa 235g,Tornillo Especial MOLITALIA Pasta para Ensalad...,S/ 3.10 un,plaza_vea,AVENA ENVASADA,2024-12-04 12:57:59.634534,235.0,g,Tornillo Especial MOLITALIA Pasta para Ensalad,3.1
Paquete 120g,Jabón en Barra PALMOLIVE Avena y Azúcar 6x120g,S/ 19.20 un,plaza_vea,AVENA ENVASADA,2024-12-04 12:57:59.634534,120.0,g,Jabón en Barra PALMOLIVE Avena y Azúcar 6x,19.2
800ml,Jabón Liquido PROTEX Avena 800ml,S/ 14.90 un,plaza_vea,AVENA ENVASADA,2024-12-04 12:57:59.634534,800.0,ml,Jabón Liquido PROTEX Avena,14.9
Bolsa 250gun,Ensalada Col Zanahoria BELL'S FRESCOS Bolsa 25...,S/ 4.69 un,plaza_vea,AVENA ENVASADA,2024-12-04 12:57:59.634534,250.0,g,Ensalada Col Zanahoria BELL'S FRESCOS Bolsa 25,4.69
Caja 330g,Jabón Tocador REXONA Antibacterial Avena 110g ...,S/ 8.90 un,plaza_vea,AVENA ENVASADA,2024-12-04 12:57:59.634534,330.0,g,Jabón Tocador REXONA Antibacterial Avena,8.9
Bolsa 1Kg,Avena BELL'S Bolsa 1Kg,S/ 9.20 un,plaza_vea,AVENA ENVASADA,2024-12-04 12:57:59.634534,1.0,kg,Avena BELL'S Bolsa,9.2
Bolsa 500g,Ensalada Jardinera Precocida BELL'S Bolsa 500g,S/ 8.90 un,plaza_vea,AVENA ENVASADA,2024-12-04 12:57:59.634534,500.0,g,Ensalada Jardinera Precocida BELL'S Bolsa,8.9
Bolsa 5Kg,Arena para Gatos KLINKATBolsa 5Kg,S/ 15.90 un,plaza_vea,AVENA ENVASADA,2024-12-04 12:57:59.634534,5.0,kg,Arena para Gatos KLINKATBolsa,15.9
Bolsa 280g,Avena SANTA CATALINA con Quinua Bolsa 280g,S/ 5.60 un,plaza_vea,AVENA ENVASADA,2024-12-04 12:57:59.634534,280.0,g,Avena SANTA CATALINA con Quinua Bolsa,5.6
Bolsa 150gun,Ensalada Mix BELL'S FRESCOS Bolsa 150g,S/ 6.59 un,plaza_vea,AVENA ENVASADA,2024-12-04 12:57:59.634534,150.0,g,Ensalada Mix BELL'S FRESCOS Bolsa,6.59
Bolsa 280g,Maca Avena SANTA CATALINA Bolsa 280g,S/ 5.60 un,plaza_vea,AVENA ENVASADA,2024-12-04 12:57:59.634534,280.0,g,Maca Avena SANTA CATALINA Bolsa,5.6
Bolsa 500gun,Ensalada Americana BELL'S FRESCOS Bolsa 500g,S/ 6.99 un,plaza_vea,AVENA ENVASADA,2024-12-04 12:57:59.634534,500.0,g,Ensalada Americana BELL'S FRESCOS Bolsa,6.99
Bolsa 180g,Avena de Chocolate 3 OSITOS Bolsa 180g,S/ 5.40 un,plaza_vea,AVENA ENVASADA,2024-12-04 12:57:59.634534,180.0,g,Avena de Chocolate 3 OSITOS Bolsa,5.4
Bolsa 270g,Avena con Cereales Andinos Premium 3 OSITOS Bo...,S/ 5.60 un,plaza_vea,AVENA ENVASADA,2024-12-04 12:57:59.634534,270.0,g,Avena con Cereales Andinos Premium 3 OSITOS Bo,5.6
Bolsa 5Kg,Arena para Gatos COOL CAT Bolsa 5Kg,S/ 11.50 un,plaza_vea,AVENA ENVASADA,2024-12-04 12:57:59.634534,5.0,kg,Arena para Gatos COOL CAT Bolsa,11.5
Caja 946ml,Bebida de Avena NATURE'S HEART Caja 946ml,S/ 10.99 un,plaza_vea,AVENA ENVASADA,2024-12-04 12:57:59.634534,946.0,ml,Bebida de Avena NATURE'S HEART Caja,10.99
Bolsa 400g,Avena Integral MI TIERRA sin Gluten Bolsa 400g,S/ 11.30 un,plaza_vea,AVENA ENVASADA,2024-12-04 12:57:59.634534,400.0,g,Avena Integral MI TIERRA sin Gluten Bolsa,11.3
Bolsa 370g,Quinua Avena GRANO DE ORO Hojuelas Precocidas ...,S/ 4.50 un,plaza_vea,AVENA ENVASADA,2024-12-04 12:57:59.634534,370.0,g,Quinua Avena GRANO DE ORO Hojuelas Precocidas,4.5
Bolsa 270g,Quinua Avena Premium 3 OSITOS Bolsa 270g,S/ 5.60 un,plaza_vea,AVENA ENVASADA,2024-12-04 12:57:59.634534,270.0,g,Quinua Avena Premium 3 OSITOS Bolsa,5.6
Bolsa 350g,Cereal ÁNGEL Trigo Integral de Avena y Maíz Sa...,S/ 15.70 un,plaza_vea,AVENA ENVASADA,2024-12-04 12:57:59.634534,350.0,g,Cereal ÁNGEL Trigo Integral de Avena y Maíz Sa,15.7
Bolsa 400g,Harina de Avena MI TIERRA Sin Gluten Bolsa 400...,S/ 9.90 un,plaza_vea,AVENA ENVASADA,2024-12-04 12:57:59.634534,400.0,g,Harina de Avena MI TIERRA Sin Gluten Bolsa 400,9.9
Bolsa 370g,Maca Avena GRANO DE ORO Hojuelas Precocidas Bo...,S/ 4.50 un,plaza_vea,AVENA ENVASADA,2024-12-04 12:57:59.634534,370.0,g,Maca Avena GRANO DE ORO Hojuelas Precocidas Bo,4.5
Bolsa 280g,Kiwicha Avena SANTA CATALINA Bolsa 280g,S/ 5.60 un,plaza_vea,AVENA ENVASADA,2024-12-04 12:57:59.634534,280.0,g,Kiwicha Avena SANTA CATALINA Bolsa,5.6
Bolsa 370g,Kiwicha Avena GRANO DE ORO Hojuelas Precocidas...,S/ 4.50 un,plaza_vea,AVENA ENVASADA,2024-12-04 12:57:59.634534,370.0,g,Kiwicha Avena GRANO DE ORO Hojuelas Precocidas,4.5
Bolsa 840g,Cereal ÁNGEL Trigo y Avena Frutas Doypack 840g,S/ 21.90 un,plaza_vea,AVENA ENVASADA,2024-12-04 12:57:59.634534,840.0,g,Cereal ÁNGEL Trigo y Avena Frutas Doypack,21.9
Bolsa 500g,Avena BELL'S Bolsa 500g,S/ 4.70 un,plaza_vea,AVENA ENVASADA,2024-12-04 12:57:59.634534,500.0,g,Avena BELL'S Bolsa,4.7
Paquete 330g,Jabón Bebé JOHNSON'S Avena Tripack 330g,S/ 17.40 un,plaza_vea,AVENA ENVASADA,2024-12-04 12:57:59.634534,330.0,g,Jabón Bebé JOHNSON'S Avena Tripack,17.4
Bolsa 330g,Avena QUAKER con Maca Bolsa 330g,S/ 8.50 un,plaza_vea,AVENA ENVASADA,2024-12-04 12:57:59.634534,330.0,g,Avena QUAKER con Maca Bolsa,8.5
Bandeja 500g,Ensalada Rusa BELL'S Bandeja 500g,S/ 9.49 un,plaza_vea,AVENA ENVASADA,2024-12-04 12:57:59.634534,500.0,g,Ensalada Rusa BELL'S Bandeja,9.49
Bolsa 100g,Galletas DEL PARAISO Avena & Manzana 100g,S/ 2.89 un,plaza_vea,AVENA ENVASADA,2024-12-04 12:57:59.634534,100.0,g,Galletas DEL PARAISO Avena & Manzana,2.89
Bolsa 250g,Avena Clásica 3 OSITOS Bolsa 250g,S/ 5.90 un,plaza_vea,AVENA ENVASADA,2024-12-04 12:57:59.634534,250.0,g,Avena Clásica 3 OSITOS Bolsa,5.9
Bandeja 500g,Ensalada Mixta BELL'S Bandeja 500g,S/ 10.99 un,plaza_vea,AVENA ENVASADA,2024-12-04 12:57:59.634534,500.0,g,Ensalada Mixta BELL'S Bandeja,10.99
Bolsa 150g,Avena con Manzana SANTA CATALINA Bolsa 150g,S/ 5.80 un,plaza_vea,AVENA ENVASADA,2024-12-04 12:57:59.634534,150.0,g,Avena con Manzana SANTA CATALINA Bolsa,5.8
Bolsa 200g,Avena QUAKER Tradicional Bolsa 200g,S/ 4.80 un,plaza_vea,AVENA ENVASADA,2024-12-04 12:57:59.634534,200.0,g,Avena QUAKER Tradicional Bolsa,4.8
Bolsa 400g,Mix Ensalada Precocida Congelada GREEN FOOD Bo...,S/ 8.20 un,plaza_vea,AVENA ENVASADA,2024-12-04 12:57:59.634534,400.0,g,Mix Ensalada Precocida Congelada GREEN FOOD Bo,8.2
Bolsa 330g,Avena QUAKER con Chía y Algarrobo Bolsa 330g,S/ 8.50 un,plaza_vea,AVENA ENVASADA,2024-12-04 12:57:59.634534,330.0,g,Avena QUAKER con Chía y Algarrobo Bolsa,8.5
Bolsa 370g,Chía Avena GRANO DE ORO Hojuelas Precocidas Bo...,S/ 4.50 un,plaza_vea,AVENA ENVASADA,2024-12-04 12:57:59.634534,370.0,g,Chía Avena GRANO DE ORO Hojuelas Precocidas Bo,4.5
Caja 253g,Cereal en Barra NATURA VALLEY Crunchy Miel y A...,S/ 22.30 un,plaza_vea,AVENA ENVASADA,2024-12-04 12:57:59.634534,253.0,g,Cereal en Barra NATURA VALLEY Crunchy Miel y A,22.3
Pote 1.5Kg,Avena con Hojuela sin Gluten LA PURITA Frasco ...,S/ 29.90 un,plaza_vea,AVENA ENVASADA,2024-12-04 12:57:59.634534,1.5,kg,Avena con Hojuela sin Gluten LA PURITA Frasco,29.9
Bolsa 20g,Cereal de Avena Maíz y Trigo ÁNGEL Meli Bolsa ...,S/ 15.70 un,plaza_vea,AVENA ENVASADA,2024-12-04 12:57:59.634534,20.0,g,Cereal de Avena Maíz y Trigo ÁNGEL Meli Bolsa,15.7
Caja 350g,Avena QUAKER Hojuelas de Avena Instantánea Caj...,S/ 9.29 un,plaza_vea,AVENA ENVASADA,2024-12-04 12:57:59.634534,350.0,g,Avena QUAKER Hojuelas de Avena Instantánea Caj,9.29
Bolsa 330g,Avena con Quinua QUAKER Bolsa 330g,S/ 8.90 un,plaza_vea,AVENA ENVASADA,2024-12-04 12:57:59.634534,330.0,g,Avena con Quinua QUAKER Bolsa,8.9
Frasco 400ml,Jabón para Bebé JOHNSON'S BABY Baño Líquido Av...,S/ 31.70 un,plaza_vea,AVENA ENVASADA,2024-12-04 12:57:59.634534,400.0,ml,Jabón para Bebé JOHNSON'S BABY Baño Líquido Av,31.7
Bolsa 350g,Cereal ÁNGEL Trigo Integral de Avena y Maíz Sa...,S/ 15.70 un,plaza_vea,AVENA ENVASADA,2024-12-04 12:57:59.634534,350.0,g,Cereal ÁNGEL Trigo Integral de Avena y Maíz Sa,15.7
Frasco 221ml,Jabón Líquido Antibacterial PROTEX Avena 221ml,S/ 8.30 un,plaza_vea,AVENA ENVASADA,2024-12-04 12:57:59.634534,221.0,ml,Jabón Líquido Antibacterial PROTEX Avena,8.3
Bolsa 270g,Avena Instantánea Regular BELL'S Bolsa 270g,S/ 3.20 un,plaza_vea,AVENA ENVASADA,2024-12-04 12:57:59.634534,270.0,g,Avena Instantánea Regular BELL'S Bolsa,3.2
Bolsa 150g,Galletas Integrales LIGERITAS de Avena Bolsa 1...,S/ 6.90 un,plaza_vea,AVENA ENVASADA,2024-12-04 12:57:59.634534,150.0,g,Galletas Integrales LIGERITAS de Avena Bolsa 1,6.9
Bolsa 270g,Maca Avena Premium 3 OSITOS Bolsa 270g,S/ 5.60 un,plaza_vea,AVENA ENVASADA,2024-12-04 12:57:59.634534,270.0,g,Maca Avena Premium 3 OSITOS Bolsa,5.6
Paquete 880g,Jabón en Barra PROTEX Avena + Prebiótico 8x110...,S/ 28 un,plaza_vea,AVENA ENVASADA,2024-12-04 12:57:59.634534,880.0,g,Jabón en Barra PROTEX Avena + Prebiótico 8x110,28.0
Bolsa 400g,Ensalada Rusa Precocida GREEN FOOD Bolsa 400g,S/ 7.60 un,plaza_vea,AVENA ENVASADA,2024-12-04 12:57:59.634534,400.0,g,Ensalada Rusa Precocida GREEN FOOD Bolsa,7.6
Bolsa 280g,Avena SANTA CATALINA Algarrobina Bolsa 280g,S/ 5.60 un,plaza_vea,AVENA ENVASADA,2024-12-04 12:57:59.634534,280.0,g,Avena SANTA CATALINA Algarrobina Bolsa,5.6
Bolsa 420g,Cereal ÁNGEL Maíz Trigo y Avena Sabor a Frutas...,S/ 15.70 un,plaza_vea,AVENA ENVASADA,2024-12-04 12:57:59.634534,420.0,g,Cereal ÁNGEL Maíz Trigo y Avena Sabor a Frutas,15.7
Doypack 800g,Avena con Hojuela sin Gluten LA PURITA Bolsa 8...,S/ 18 un,plaza_vea,AVENA ENVASADA,2024-12-04 12:57:59.634534,800.0,g,Avena con Hojuela sin Gluten LA PURITA Bolsa 8,18.0
Doypack 300g,Harina de Avena Integral LA CASA MARIMIEL Doyp...,S/ 13.90 un,plaza_vea,AVENA ENVASADA,2024-12-04 12:57:59.634534,300.0,g,Harina de Avena Integral LA CASA MARIMIEL Doyp,13.9
Bolsa 370g,Avena GRANO DE ORO Hojuelas Precocidas Bolsa 3...,S/ 4.19 un,plaza_vea,AVENA ENVASADA,2024-12-04 12:57:59.634534,370.0,g,Avena GRANO DE ORO Hojuelas Precocidas Bolsa 3,4.19
Táper 150gun,Ensalada Mix Primavera BELL'S FRESCOS Táper 15...,S/ 7.49 un,plaza_vea,AVENA ENVASADA,2024-12-04 12:57:59.634534,150.0,g,Ensalada Mix Primavera BELL'S FRESCOS Táper 15,7.49
Doypack 400g,Avena Mix Canela y Berries AMARU Superfood Doy...,S/ 9.90 un,plaza_vea,AVENA ENVASADA,2024-12-04 12:57:59.634534,400.0,g,Avena Mix Canela y Berries AMARU Superfood Doy,9.9
Bolsa 100g,Avena Clásica 3 OSITOS Bolsa 100g,S/ 1.50 un,plaza_vea,AVENA ENVASADA,2024-12-04 12:57:59.634534,100.0,g,Avena Clásica 3 OSITOS Bolsa,1.5
Bolsa 500g,Avena Clásica 3 OSITOS Bolsa 500g,S/ 9.30 un,plaza_vea,AVENA ENVASADA,2024-12-04 12:57:59.634534,500.0,g,Avena Clásica 3 OSITOS Bolsa,9.3
Bolsa 290g,Avena QUAKER con sabor a Chocolate Bolsa 290g,S/ 8.90 un,plaza_vea,AVENA ENVASADA,2024-12-04 12:57:59.634534,290.0,g,Avena QUAKER con sabor a Chocolate Bolsa,8.9
Bolsa 150g,Avena con Chocolate SANTA CATALINA Bolsa 150g,S/ 5.80 un,plaza_vea,AVENA ENVASADA,2024-12-04 12:57:59.634534,150.0,g,Avena con Chocolate SANTA CATALINA Bolsa,5.8
Bolsa 420g,Cereal ÁNGEL Maíz Trigo y Avena Sabor a Chocol...,S/ 15.70 un,plaza_vea,AVENA ENVASADA,2024-12-04 12:57:59.634534,420.0,g,Cereal ÁNGEL Maíz Trigo y Avena Sabor a Chocol,15.7
Caja 1L,Bebida de Avena ORASI Caja 1L,S/ 14.60 un,plaza_vea,AVENA ENVASADA,2024-12-04 12:57:59.634534,1.0,l,Bebida de Avena ORASI Caja,14.6
Frasco 600ml,Gel de Baño Avena BABARIA Frasco 600ml,S/ 20.90 un,plaza_vea,AVENA ENVASADA,2024-12-04 12:57:59.634534,600.0,ml,Gel de Baño Avena BABARIA Frasco,20.9
Bolsa 100g,Avena SANTA CATALINA Bolsa 100g,S/ 1.30 un,plaza_vea,AVENA ENVASADA,2024-12-04 12:57:59.634534,100.0,g,Avena SANTA CATALINA Bolsa,1.3
Pote 900g,Avena Integral GRANO DE ORO Hoja Gruesa Pote 9...,S/ 17.50 un,plaza_vea,AVENA ENVASADA,2024-12-04 12:57:59.634534,900.0,g,Avena Integral GRANO DE ORO Hoja Gruesa Pote 9,17.5
