description,brand,price,website,search_term,scrape_timestamp
Té Negro FREE TEA Frutos Rojos Botella 500ml,FREE TEA,S/ 2.60,vivanda,TÉ NEGRO FILTRANTE,2024-12-04 02:12:40.510054
Té Negro TWININGS English Breakfast Caja 10un,TWININGS,S/ 19.30,vivanda,TÉ NEGRO FILTRANTE,2024-12-04 02:12:40.510054
Té Negro NATURE'S HEART Chai con Especias Caja 20un,NATURE'S HEART,S/ 11.80,vivanda,TÉ NEGRO FILTRANTE,2024-12-04 02:12:40.510054
Té Negro FREE TEA Durazno Botella 500ml,FREE TEA,S/ 2.60,vivanda,TÉ NEGRO FILTRANTE,2024-12-04 02:12:40.510054
Té Negro LA FIDELIA Rey Eterno Caja 15un,LA FIDELIA,S/ 39.90,vivanda,TÉ NEGRO FILTRANTE,2024-12-04 02:12:40.510054
Té Negro TWININGS Frutos Rojos Caja 10un,TWININGS,S/ 19.30,vivanda,TÉ NEGRO FILTRANTE,2024-12-04 02:12:40.510054
Té Verde MC COLIN'S Caja 25un,MC COLIN'S,S/ 12.80,vivanda,TÉ NEGRO FILTRANTE,2024-12-04 02:12:40.510054
Té Canela y Clavo MC COLIN'S Caja 100un,MC COLIN S,S/ 13.70,vivanda,TÉ NEGRO FILTRANTE,2024-12-04 02:12:40.510054
Té Verde de Menta y Limón SAINT GOTTARD Matcha Caja 20un,SAINT GOTTARD,S/ 9.80,vivanda,TÉ NEGRO FILTRANTE,2024-12-04 02:12:40.510054
Té Puro MC COLIN'S Caja 25un,MC COLIN S,S/ 4.80,vivanda,TÉ NEGRO FILTRANTE,2024-12-04 02:12:40.510054
Té Verde STASH TEA Frambuesa y Granada Caja 18un,STASH,S/ 32.50,vivanda,TÉ NEGRO FILTRANTE,2024-12-04 02:12:40.510054
Té MC COLIN'S Naranja Caja 25un,MC COLIN S,S/ 4.80,vivanda,TÉ NEGRO FILTRANTE,2024-12-04 02:12:40.510054
Té STASH Hibisco de Frambuesa Salvaje Caja 20un,STASH,S/ 32.50,vivanda,TÉ NEGRO FILTRANTE,2024-12-04 02:12:40.510054
Té Verde SUNKA Diet Caja 50un,SUNKA,S/ 18.90,vivanda,TÉ NEGRO FILTRANTE,2024-12-04 02:12:40.510054
Té Canela y Clavo BELL'S Caja 20un,BELL'S,S/ 3.20,vivanda,TÉ NEGRO FILTRANTE,2024-12-04 02:12:40.510054
Té Canela y Clavo BELL'S Caja 100un,BELL'S,S/ 11.50,vivanda,TÉ NEGRO FILTRANTE,2024-12-04 02:12:40.510054
Té Verde LA FIDELIA Divina Amazona Caja 10un,LA FIDELIA,S/ 33.30,vivanda,TÉ NEGRO FILTRANTE,2024-12-04 02:12:40.510054
Té Verde Puro WAWASANA Caja 50g,WAWASANA,S/ 16.90,vivanda,TÉ NEGRO FILTRANTE,2024-12-04 02:12:40.510054
Té Mix 5 Sabores NATURE'S HEART Caja 20un,NATURE'S HEART,S/ 9.90,vivanda,TÉ NEGRO FILTRANTE,2024-12-04 02:12:40.510054
Té TWININGS Limón Jengibre Caja 10un,TWININGS,S/ 19.30,vivanda,TÉ NEGRO FILTRANTE,2024-12-04 02:12:40.510054
Té verde SCHAGREEM a Granel Caja 100g,SCHAGREEN,S/ 13.00,vivanda,TÉ NEGRO FILTRANTE,2024-12-04 02:12:40.510054
Té Canela y Clavo HORNIMAN´S Display 100un,HORNIMAN S,S/ 11.20,vivanda,TÉ NEGRO FILTRANTE,2024-12-04 02:12:40.510054
Té Líquido LEAF TEA Sabor Limón Botella 400ml,LEAF TEA,S/ 1.70,vivanda,TÉ NEGRO FILTRANTE,2024-12-04 02:12:40.510054
Té Verde FREE TEA Light Sabor Limón Botella 450ml,FREE,S/ 2.60,vivanda,TÉ NEGRO FILTRANTE,2024-12-04 02:12:40.510054
Té Verde Bebible HORNIMANS Frutos Rojos Botella 300ml,HORNIMANS,S/ 2.50,vivanda,TÉ NEGRO FILTRANTE,2024-12-04 02:12:40.510054
Té Verde SUNKA Caja 50un,SUNKA,S/ 18.90,vivanda,TÉ NEGRO FILTRANTE,2024-12-04 02:12:40.510054
Té Verde & Piña BELL'S Caja 20un,BELL'S,S/ 8.59,vivanda,TÉ NEGRO FILTRANTE,2024-12-04 02:12:40.510054
Té Puro BELL'S Caja 20un,BELL'S,S/ 3.20,vivanda,TÉ NEGRO FILTRANTE,2024-12-04 02:12:40.510054
Té Verde BELL'S Caja 20un,BELL'S,S/ 7.69,vivanda,TÉ NEGRO FILTRANTE,2024-12-04 02:12:40.510054
Té Verde FREE TEA Sabor Limón Botella 450ml,FREE,S/ 2.60,vivanda,TÉ NEGRO FILTRANTE,2024-12-04 02:12:40.510054
Té Verde HORNIMANS Listo para Tomar Botella 300ml,HORNIMANS,S/ 2.50,vivanda,TÉ NEGRO FILTRANTE,2024-12-04 02:12:40.510054
Té Verde FREE TEA Limón Botella 500ml,FREE TEA,S/ 2.60,vivanda,TÉ NEGRO FILTRANTE,2024-12-04 02:12:40.510054
Té STASH Peppermint Caja 20un,STASH,S/ 32.50,vivanda,TÉ NEGRO FILTRANTE,2024-12-04 02:12:40.510054
Té STASH Limón Jengibre Caja 20un,STASH,S/ 32.50,vivanda,TÉ NEGRO FILTRANTE,2024-12-04 02:12:40.510054
Aditivo de Lavado DR BECKMANN Negros Intensos Caja 8un,DR. BECKMANN,S/ 23.10,vivanda,TÉ NEGRO FILTRANTE,2024-12-04 02:12:40.510054
Bebida de Arándanos L'ONDA con Té Verde Botella 1L,L ONDA,S/ 8.99,vivanda,TÉ NEGRO FILTRANTE,2024-12-04 02:12:40.510054
Frijol Negro COSTEÑO Bolsa 500g,COSTENO,S/ 6.99,vivanda,TÉ NEGRO FILTRANTE,2024-12-04 02:12:40.510054
Frijoles Negros LORENZO Doypack 425g,LORENZO,S/ 8.20,vivanda,TÉ NEGRO FILTRANTE,2024-12-04 02:12:40.510054
Freidora de Aire BLACKLINE 9L Digital Doble DF-2109D Negro,BLACKLINE,S/ 799.00,vivanda,TÉ NEGRO FILTRANTE,2024-12-04 02:12:40.510054
Betún Líquido Negro SANTIAGO Frasco 60ml,SANTIS,S/ 6.80,vivanda,TÉ NEGRO FILTRANTE,2024-12-04 02:12:40.510054
Infusiones BIGELOW Té de Hierbas Caja 20un,BIGELOW,S/ 26.10,vivanda,TÉ NEGRO FILTRANTE,2024-12-04 02:12:40.510054
Freidora de Aire BLACKLINE TXG-DT12A Negro/Gris,BLACKLINE,S/ 309.00,vivanda,TÉ NEGRO FILTRANTE,2024-12-04 02:12:40.510054
Silla Ergonómica VIVA HOME 8003 Negro,VIVA HOME,S/ 199.00,vivanda,TÉ NEGRO FILTRANTE,2024-12-04 02:12:40.510054
Air Fryer Digital BLACKLINE 5.5L TXG-S5T2 Negro,BLACKLINE,S/ 699.00,vivanda,TÉ NEGRO FILTRANTE,2024-12-04 02:12:40.510054
Combo BLACKLINE Batidora Manual 8222 Negro,BLACKLINE,S/ 249.00,vivanda,TÉ NEGRO FILTRANTE,2024-12-04 02:12:40.510054
Afeitadora SIEGEN SG-7250 Negro,SIEGEN,S/ 199.00,vivanda,TÉ NEGRO FILTRANTE,2024-12-04 02:12:40.510054
Silla Ergonómica VIVA HOME 9050 Negro,VIVA HOME,S/ 199.00,vivanda,TÉ NEGRO FILTRANTE,2024-12-04 02:12:40.510054
Tostadora BLACKLINE HBT-1613A Negro,BLACKLINE,S/ 89.00,vivanda,TÉ NEGRO FILTRANTE,2024-12-04 02:12:40.510054
Silla Ergonómica VIVA HOME 828 Negro,VIVA HOME,S/ 199.00,vivanda,TÉ NEGRO FILTRANTE,2024-12-04 02:12:40.510054
Refrigeradora BLACKLINE 518L No Frost SBS BI Negro,BLACKLINE,"S/ 3,199.00",vivanda,TÉ NEGRO FILTRANTE,2024-12-04 02:12:40.510054
Torre de Sonido SAMSUNG MX-T40 Negro,SAMSUNG,S/ 799.00,vivanda,TÉ NEGRO FILTRANTE,2024-12-04 02:12:40.510054
Impresora Multifuncional EPSON L3210 Negro,EPSON,S/ 859.00,vivanda,TÉ NEGRO FILTRANTE,2024-12-04 02:12:40.510054
Sartén C/Antiadherente VIVA HOME 28cm Negro,VIVA HOME,S/ 24.90,vivanda,TÉ NEGRO FILTRANTE,2024-12-04 02:12:40.510054
Cava FREIXENET Cordón Negro Botella 750ml,FREIXENET,S/ 61.70,vivanda,TÉ NEGRO FILTRANTE,2024-12-04 02:12:40.510054
Set Combinado de Pesas Mancuernas MU GROUP Negro,MU GROUP,S/ 189.00,vivanda,TÉ NEGRO FILTRANTE,2024-12-04 02:12:40.510054
Espumante FREIXENET Cordon Negro Botella 750ml + Copa,FREIXENET,S/ 49.90,vivanda,TÉ NEGRO FILTRANTE,2024-12-04 02:12:40.510054
Sopa de Frejoles Negros GOYA Lata 425g,GOYA,S/ 16.90,vivanda,TÉ NEGRO FILTRANTE,2024-12-04 02:12:40.510054
Cocina Eléctrica IMACO 2 Quemadores HP1400 Negro,IMACO,S/ 99.90,vivanda,TÉ NEGRO FILTRANTE,2024-12-04 02:12:40.510054
Tinte para Cabello LIFE FOR MEN Negro Tubo 150ml,LIFE FOR MEN,S/ 25.90,vivanda,TÉ NEGRO FILTRANTE,2024-12-04 02:12:40.510054
Tinte Capilar Garnier NUTRISSE Oleos 1.0 Negro Caja 1un,NUTRISSE,S/ 24.90,vivanda,TÉ NEGRO FILTRANTE,2024-12-04 02:12:40.510054
Set de Bowls de Aperitivo WAYU Negro y Madera Paquete 3un,WAYU,S/ 45.90,vivanda,TÉ NEGRO FILTRANTE,2024-12-04 02:12:40.510054
Corta Cabello WAHL Easy Cut 09314-3218 Negro,WAHL,S/ 49.90,vivanda,TÉ NEGRO FILTRANTE,2024-12-04 02:12:40.510054
Chocolate LA IBÉRICA CORAZÓN Negro en forma de corazón Caja 80g,LA IBERICA,S/ 19.00,vivanda,TÉ NEGRO FILTRANTE,2024-12-04 02:12:40.510054
Tinte para Cabello JUST FOR MEN Negro Caja 28g,JUST FOR MEN,S/ 49.09,vivanda,TÉ NEGRO FILTRANTE,2024-12-04 02:12:40.510054
Infusiones SUNKA Té Sueños Profundos Caja 20un,SUNKA,S/ 5.50,vivanda,TÉ NEGRO FILTRANTE,2024-12-04 02:12:40.510054
Tinte para Cabello en Shampoo JUST FOR MEN Negro Caja 1un,JUST FOR MEN,S/ 49.09,vivanda,TÉ NEGRO FILTRANTE,2024-12-04 02:12:40.510054
Tine Express Hombre SCHWARZKOPF Negro Natural 90 Caja 40ml,SCHWARZKOPF,S/ 43.00,vivanda,TÉ NEGRO FILTRANTE,2024-12-04 02:12:40.510054
Cocina Empotrable INDURAMA 4 Quemadores EGASI-604CGNE Negro,INDURAMA,"S/ 1,459.00",vivanda,TÉ NEGRO FILTRANTE,2024-12-04 02:12:40.510054
Kit Tinte para Cabello PLACENTA LIFE Naturals Negro 20/200,PLACENTA LIFE,S/ 25.90,vivanda,TÉ NEGRO FILTRANTE,2024-12-04 02:12:40.510054
Afeitadora PHILIPS Multigroom MG5730 Negro 11 Accesorios,PHILIPS,S/ 299.00,vivanda,TÉ NEGRO FILTRANTE,2024-12-04 02:12:40.510054
Set de Salero y Pimentero WAYU Parrillero Negro,WAYU,S/ 34.90,vivanda,TÉ NEGRO FILTRANTE,2024-12-04 02:12:40.510054
Infusión Té Verde con Limón BELL'S Caja 20un,BELL'S,S/ 8.59,vivanda,TÉ NEGRO FILTRANTE,2024-12-04 02:12:40.510054
Infusión Té Verde WAWASANA Limón Caja 50un,WAWASANA,S/ 16.90,vivanda,TÉ NEGRO FILTRANTE,2024-12-04 02:12:40.510054
Infusiones WAWASANA Té verde Caja 20un,WAWASANA,S/ 9.60,vivanda,TÉ NEGRO FILTRANTE,2024-12-04 02:12:40.510054
Bandeja y Tabla de Aperitivo WAYU Negro y Madera,WAYU,S/ 69.90,vivanda,TÉ NEGRO FILTRANTE,2024-12-04 02:12:40.510054
Infusiones WAWASANA Té verde limón Caja 20Un,WAWASANA,S/ 9.60,vivanda,TÉ NEGRO FILTRANTE,2024-12-04 02:12:40.510054
Cable para iPhone USAMS US-SJ371 1m Negro,USAMS,S/ 24.90,vivanda,TÉ NEGRO FILTRANTE,2024-12-04 02:12:40.510054
Infusiones XIN TAN Té Verde y Magnolia Caja 25un,XINTAN,S/ 7.90,vivanda,TÉ NEGRO FILTRANTE,2024-12-04 02:12:40.510054
Olla Arrocera OSTER 1.8L CKSTRC1700B053 Negro,OSTER,S/ 139.00,vivanda,TÉ NEGRO FILTRANTE,2024-12-04 02:12:40.510054
Espátula de Torta VIVA HOME Mango Silicona Negro,VIVA HOME,S/ 6.50,vivanda,TÉ NEGRO FILTRANTE,2024-12-04 02:12:40.510054
Tinta en Botella EPSON 504 Negro,EPSON,S/ 42.90,vivanda,TÉ NEGRO FILTRANTE,2024-12-04 02:12:40.510054
Cuchillo WAYU Santoku Negro,WAYU,S/ 44.90,vivanda,TÉ NEGRO FILTRANTE,2024-12-04 02:12:40.510054
Pinza de Cocina VIVA HOME Negro,VIVA HOME,S/ 7.90,vivanda,TÉ NEGRO FILTRANTE,2024-12-04 02:12:40.510054
Plumón Indeleble ARTESCO OHP CD Max Negro Blíster 1un,ARTESCO,S/ 2.90,vivanda,TÉ NEGRO FILTRANTE,2024-12-04 02:12:40.510054
Plato DARNEL Pet 18cm Negro,DARNEL,S/ 5.30,vivanda,TÉ NEGRO FILTRANTE,2024-12-04 02:12:40.510054
Plato DARNEL Pet 15.5cm Negro,DARNEL,S/ 3.80,vivanda,TÉ NEGRO FILTRANTE,2024-12-04 02:12:40.510054
Esponja Limpia Calzado Negro YAK Caja 1un,YAK,S/ 15.40,vivanda,TÉ NEGRO FILTRANTE,2024-12-04 02:12:40.510054
Botella de Tinta CANON Gi-11 Negro,CANON,S/ 54.90,vivanda,TÉ NEGRO FILTRANTE,2024-12-04 02:12:40.510054
Waflera BLACKLINE WF-906 Negro,BLACKLINE,S/ 149.00,vivanda,TÉ NEGRO FILTRANTE,2024-12-04 02:12:40.510054
Colador TRAMONTINA 9cm Utilita Negro,TRAMONTINA,S/ 35.90,vivanda,TÉ NEGRO FILTRANTE,2024-12-04 02:12:40.510054
Licuadora BLACKLINE 1.5L 2816P Negro,BLACKLINE,S/ 119.00,vivanda,TÉ NEGRO FILTRANTE,2024-12-04 02:12:40.510054
Headset Gamer Over Ear TURTLE BEACH RECON 50P Negro,TURTLE BEACH,S/ 139.00,vivanda,TÉ NEGRO FILTRANTE,2024-12-04 02:12:40.510054
Vaporizador BLACKLINE BG560A Blanco y Negro,BLACKLINE,S/ 179.00,vivanda,TÉ NEGRO FILTRANTE,2024-12-04 02:12:40.510054
Hervidor BLACKLINE 1.7L FK-1702A-J Negro,BLACKLINE,S/ 139.00,vivanda,TÉ NEGRO FILTRANTE,2024-12-04 02:12:40.510054
Hervidor BLACKLINE 1.7L FK-1719 Negro,BLACKLINE,S/ 179.00,vivanda,TÉ NEGRO FILTRANTE,2024-12-04 02:12:40.510054
Escritorio VIVA HOME Bronx Madera Con Negro,VIVA HOME,S/ 369.00,vivanda,TÉ NEGRO FILTRANTE,2024-12-04 02:12:40.510054
Exprimidor BLACKLINE 8121P Negro,BLACKLINE,S/ 109.00,vivanda,TÉ NEGRO FILTRANTE,2024-12-04 02:12:40.510054
Cortador de Cabello SIEGEN SG-8550 Negro,SIEGEN,S/ 229.00,vivanda,TÉ NEGRO FILTRANTE,2024-12-04 02:12:40.510054
Parlante Inalámbrico LG XBOOM GO XG9 Negro C/Luces Escénicas,LG,"S/ 2,299.00",vivanda,TÉ NEGRO FILTRANTE,2024-12-04 02:12:40.510054
Botella de Tinta CANON GI-10 Negro,CANON,S/ 54.90,vivanda,TÉ NEGRO FILTRANTE,2024-12-04 02:12:40.510054
Grill Panini BLACKLINE HB-215 Negro,BLACKLINE,S/ 99.00,vivanda,TÉ NEGRO FILTRANTE,2024-12-04 02:12:40.510054
Licuadora BLACKLINE 1.5L 8305B Negro,BLACKLINE,S/ 199.00,vivanda,TÉ NEGRO FILTRANTE,2024-12-04 02:12:40.510054
Alisadora de Cabello GA.MA Elegance Bella Tourmaline 220 Negro,GAMA,S/ 129.00,vivanda,TÉ NEGRO FILTRANTE,2024-12-04 02:12:40.510054
Exprimidor BLACKLINE 3375 Negro,BLACKLINE,S/ 209.00,vivanda,TÉ NEGRO FILTRANTE,2024-12-04 02:12:40.510054
Nutrimixer BLACKLINE 901 Negro,BLACKLINE,S/ 249.00,vivanda,TÉ NEGRO FILTRANTE,2024-12-04 02:12:40.510054
Alisadora de Cabello GAMA BECHS0000002339 Negro,GAMA,S/ 139.00,vivanda,TÉ NEGRO FILTRANTE,2024-12-04 02:12:40.510054
Parlante AIWA AWKF4B Negro,AIWA,S/ 229.00,vivanda,TÉ NEGRO FILTRANTE,2024-12-04 02:12:40.510054
Licuadora THOMAS 1.5L TH-320V Negro/Rojo,THOMAS,S/ 179.00,vivanda,TÉ NEGRO FILTRANTE,2024-12-04 02:12:40.510054
Ondulador SIEGEN Prostillo SG 2503 Negro con Rosado,SIEGEN,S/ 169.00,vivanda,TÉ NEGRO FILTRANTE,2024-12-04 02:12:40.510054
Cortador de Pelo SIEGEN SG-8410 Negro,SIEGEN,S/ 159.00,vivanda,TÉ NEGRO FILTRANTE,2024-12-04 02:12:40.510054
Aspiradora de Arrastre THOMAS ASP TH-2230 Negro,THOMAS,S/ 559.00,vivanda,TÉ NEGRO FILTRANTE,2024-12-04 02:12:40.510054
Refrigeradora LG 679L No Frost LM85SXD Negro,LG,"S/ 14,049.00",vivanda,TÉ NEGRO FILTRANTE,2024-12-04 02:12:40.510054
CAMPANA Extractora INDURAMA CEI-602NE 60cm Negro,INDURAMA,S/ 459.00,vivanda,TÉ NEGRO FILTRANTE,2024-12-04 02:12:40.510054
Aspiradora TAURUS Megane Negro,TAURUS,S/ 419.90,vivanda,TÉ NEGRO FILTRANTE,2024-12-04 02:12:40.510054
Sartén C/Antiadherente VIVA HOME 18cm Negro,VIVA HOME,S/ 12.90,vivanda,TÉ NEGRO FILTRANTE,2024-12-04 02:12:40.510054
Conservador Vertical OSTER 226L OS-PVSC226 Negro,OSTER,"S/ 2,199.00",vivanda,TÉ NEGRO FILTRANTE,2024-12-04 02:12:40.510054
Ventilador 3en1 AIR MONSTER M1860 Negro,AIR MONSTER,S/ 269.00,vivanda,TÉ NEGRO FILTRANTE,2024-12-04 02:12:40.510054
Equipo de Sonido AIWA AWPOK6LD Negro,AIWA,S/ 799.00,vivanda,TÉ NEGRO FILTRANTE,2024-12-04 02:12:40.510054
Sartén Antiadherente VIVA HOME 28cm Negro,VIVA HOME,S/ 38.90,vivanda,TÉ NEGRO FILTRANTE,2024-12-04 02:12:40.510054
Sartén Antiadherente VIVA HOME 22cm Negro,VIVA HOME,S/ 29.90,vivanda,TÉ NEGRO FILTRANTE,2024-12-04 02:12:40.510054
Refrigeradora SAMSUNG 685L No Frost RS27T5561B1/PE Negro,SAMSUNG,"S/ 9,299.00",vivanda,TÉ NEGRO FILTRANTE,2024-12-04 02:12:40.510054
Afilador de Cuchillos TRAMONTINA 22969/108 Negro,TRAMONTINA,S/ 31.90,vivanda,TÉ NEGRO FILTRANTE,2024-12-04 02:12:40.510054
Cocina a Gas Empotrada INDURAMA EGI-604VDEG 4 Hornillas Negro,INDURAMA,S/ 999.00,vivanda,TÉ NEGRO FILTRANTE,2024-12-04 02:12:40.510054
Sartén Antiadherente VIVA HOME 18cm Negro,VIVA HOME,S/ 21.90,vivanda,TÉ NEGRO FILTRANTE,2024-12-04 02:12:40.510054
Cocina a Gas Empotrada INDURAMA EGI-905VDEG 5 Hornillas Negro,INDURAMA,"S/ 1,149.00",vivanda,TÉ NEGRO FILTRANTE,2024-12-04 02:12:40.510054
Campana Extractora INDURAMA CEI-902NE 90cm Negro,INDURAMA,S/ 589.00,vivanda,TÉ NEGRO FILTRANTE,2024-12-04 02:12:40.510054
"Bolígrafo TRIMAX GL-32M Azul, Negro y Rojo Blister 3un",ARTESCO,S/ 2.60,vivanda,TÉ NEGRO FILTRANTE,2024-12-04 02:12:40.510054
Pack Voto Tampón Dactilar ARTESCO Negro + Bolígrafo TRIM35F Azul,ARTESCO,S/ 19.90,vivanda,TÉ NEGRO FILTRANTE,2024-12-04 02:12:40.510054
Lavaseca LG Carga Frontal 12Kg/7Kg WD12BVC2S6C Negro Acero,LG,"S/ 2,749.00",vivanda,TÉ NEGRO FILTRANTE,2024-12-04 02:12:40.510054
Horno Microondas LG 25L MS2596DIR Negro,LG,S/ 499.00,vivanda,TÉ NEGRO FILTRANTE,2024-12-04 02:12:40.510054
"Bolígrafo ARTESCO CR-31 Azul, Negro y Rojo Blister 6un",ARTESCO,S/ 4.00,vivanda,TÉ NEGRO FILTRANTE,2024-12-04 02:12:40.510054
Bolígrafo ARTESCO Retro Ball-M Negro Blíster 1un,ARTESCO,S/ 1.90,vivanda,TÉ NEGRO FILTRANTE,2024-12-04 02:12:40.510054
Sandwichera IMACO IST1004S Negro,IMACO,S/ 99.90,vivanda,TÉ NEGRO FILTRANTE,2024-12-04 02:12:40.510054
Catálogo VINIFAN A4 C/Fundas Negro Paquete 40un,VINIFAN,S/ 12.40,vivanda,TÉ NEGRO FILTRANTE,2024-12-04 02:12:40.510054
Plancha Convencional IMACO I1700 Negro,IMACO,S/ 79.90,vivanda,TÉ NEGRO FILTRANTE,2024-12-04 02:12:40.510054
Colador TRAMONTINA 17cm Utilita Negro,TRAMONTINA,S/ 59.90,vivanda,TÉ NEGRO FILTRANTE,2024-12-04 02:12:40.510054
Abrelatas TRAMONTINA Utilita Negro,TRAMONTINA,S/ 99.90,vivanda,TÉ NEGRO FILTRANTE,2024-12-04 02:12:40.510054
Espátula TRAMONTINA Nylon Utilita Negro,TRAMONTINA,S/ 15.90,vivanda,TÉ NEGRO FILTRANTE,2024-12-04 02:12:40.510054
Batidor Manual TRAMONTINA Utilita Negro,TRAMONTINA,S/ 52.90,vivanda,TÉ NEGRO FILTRANTE,2024-12-04 02:12:40.510054
Espumadera TRAMONTINA Utilita Negro,TRAMONTINA,S/ 17.90,vivanda,TÉ NEGRO FILTRANTE,2024-12-04 02:12:40.510054
Rallador TRAMONTINA Utilita Negro,TRAMONTINA,S/ 19.90,vivanda,TÉ NEGRO FILTRANTE,2024-12-04 02:12:40.510054
Infusiones WAWASANA Té verde piña Caja 20Un,WAWASANA,S/ 9.60,vivanda,TÉ NEGRO FILTRANTE,2024-12-04 02:12:40.510054
Cuerda para Saltar BELL'S Negro,MU GROUP,S/ 9.90,vivanda,TÉ NEGRO FILTRANTE,2024-12-04 02:12:40.510054
Soporte para Push-Up BELL'S Negro 2un,MU GROUP,S/ 9.90,vivanda,TÉ NEGRO FILTRANTE,2024-12-04 02:12:40.510054
Cuchillo WAYU Parrillero Madera y Negro,WAYU,S/ 64.90,vivanda,TÉ NEGRO FILTRANTE,2024-12-04 02:12:40.510054
Hacha WAYU Parrillero Madera y Negro,WAYU,S/ 52.90,vivanda,TÉ NEGRO FILTRANTE,2024-12-04 02:12:40.510054
Marcador SHARPIE Negro T Blíster 1un,SHARPIE,S/ 4.50,vivanda,TÉ NEGRO FILTRANTE,2024-12-04 02:12:40.510054
Sartén Wok RECORD N°30 Fierro Negro,RECORD,S/ 104.90,vivanda,TÉ NEGRO FILTRANTE,2024-12-04 02:12:40.510054
Sartén Wok RECORD N°26 Fierro Negro,RECORD,S/ 84.90,vivanda,TÉ NEGRO FILTRANTE,2024-12-04 02:12:40.510054
Sartén Wok RECORD N°28 Fierro Negro,RECORD,S/ 94.90,vivanda,TÉ NEGRO FILTRANTE,2024-12-04 02:12:40.510054
Cocina a Gas SOLE 5 Quemadores 3120SOLCO041 Negro,SOLE,"S/ 1,975.00",vivanda,TÉ NEGRO FILTRANTE,2024-12-04 02:12:40.510054
Kit LOGITECH Teclado + Mouse MK470 Negro,LOGITECH,S/ 199.00,vivanda,TÉ NEGRO FILTRANTE,2024-12-04 02:12:40.510054
Combo Kit CANON Cabezal Negro + Botella GI-190 Negro,CANON,S/ 219.00,vivanda,TÉ NEGRO FILTRANTE,2024-12-04 02:12:40.510054
Audífonos OverEar VIVITAR LU731 Negro,VIVITAR,S/ 79.00,vivanda,TÉ NEGRO FILTRANTE,2024-12-04 02:12:40.510054
Mouse LOGITECH M190 Negro,LOGITECH,S/ 56.90,vivanda,TÉ NEGRO FILTRANTE,2024-12-04 02:12:40.510054
Kit LOGITECH Teclado + Mouse MK295 Negro,LOGITECH,S/ 149.00,vivanda,TÉ NEGRO FILTRANTE,2024-12-04 02:12:40.510054
Tinte para Cabello LIFE FOR MEN 01 Negro Caja 7un,LIFE FOR MEN,S/ 24.90,vivanda,TÉ NEGRO FILTRANTE,2024-12-04 02:12:40.510054
Cuchillo Santoku VIVA HOME Negro,VIVA HOME,S/ 12.90,vivanda,TÉ NEGRO FILTRANTE,2024-12-04 02:12:40.510054
Cacerola VIVA HOME C188-18SP 18cm Negro,VIVA HOME,S/ 23.90,vivanda,TÉ NEGRO FILTRANTE,2024-12-04 02:12:40.510054
Set de Cacerolas VIVA HOME Negro 3pzas,VIVA HOME,S/ 49.90,vivanda,TÉ NEGRO FILTRANTE,2024-12-04 02:12:40.510054
Olla VIVA HOME C188-18CA 18cm Negro,VIVA HOME,S/ 25.90,vivanda,TÉ NEGRO FILTRANTE,2024-12-04 02:12:40.510054
Set de Cucharas de Té VIVA HOME Tradicionales 3pzas,VIVA HOME,S/ 5.90,vivanda,TÉ NEGRO FILTRANTE,2024-12-04 02:12:40.510054
Sacacorcho VIVA HOME Clásico Negro,VIVA HOME,S/ 9.90,vivanda,TÉ NEGRO FILTRANTE,2024-12-04 02:12:40.510054
Cuchillo Chef VIVA HOME Negro,VIVA HOME,S/ 12.90,vivanda,TÉ NEGRO FILTRANTE,2024-12-04 02:12:40.510054
Bolígrafo PILOT BPS-GP Blíster Azul 2un + Negro + Rojo,PILOT,S/ 20.90,vivanda,TÉ NEGRO FILTRANTE,2024-12-04 02:12:40.510054
Secadora de Cabello GA.MA BECHD0000001635 Negro,GAMA,S/ 149.00,vivanda,TÉ NEGRO FILTRANTE,2024-12-04 02:12:40.510054
Sacacorcho Doble Palanca ILKO Negro,ILKO,S/ 29.90,vivanda,TÉ NEGRO FILTRANTE,2024-12-04 02:12:40.510054
Bolígrafo PILOT BPS-GP Azul/Negro/Rojo/Verde Blíster 4un,PILOT,S/ 20.90,vivanda,TÉ NEGRO FILTRANTE,2024-12-04 02:12:40.510054
Cuchillo De Cocina 8'' Mango Negro,TRAMONTINA,S/ 14.90,vivanda,TÉ NEGRO FILTRANTE,2024-12-04 02:12:40.510054
Cuchillo De Cocina 6'' Mango Negro,TRAMONTINA,S/ 12.90,vivanda,TÉ NEGRO FILTRANTE,2024-12-04 02:12:40.510054
Cucharita de Té FACUSA Semieco 3pzas,FACUSA,S/ 4.90,vivanda,TÉ NEGRO FILTRANTE,2024-12-04 02:12:40.510054
Cargador USB USAMS para Auto 2.4 Negro,USAMS,S/ 24.90,vivanda,TÉ NEGRO FILTRANTE,2024-12-04 02:12:40.510054
Mouse Inalámbrico LOGITECH M170 Negro,LOGITECH,S/ 44.90,vivanda,TÉ NEGRO FILTRANTE,2024-12-04 02:12:40.510054
Bolígrafos STABILO Excell Azul Negro Rojo Blíster 3un,STABILO,S/ 5.90,vivanda,TÉ NEGRO FILTRANTE,2024-12-04 02:12:40.510054
Audífonos in Ear SKULLCANDY S2DUYK 343 Negro,SKULLCANDY,S/ 49.90,vivanda,TÉ NEGRO FILTRANTE,2024-12-04 02:12:40.510054
Lápices FABER CASTELL Titan 2B Negro Caja 12un,FABER CASTELL,S/ 6.50,vivanda,TÉ NEGRO FILTRANTE,2024-12-04 02:12:40.510054
Botella de Tinta HP GT53 Negro,HP,S/ 41.00,vivanda,TÉ NEGRO FILTRANTE,2024-12-04 02:12:40.510054
Tinta EPSON Negro L3110 T544120 Botella 1un,EPSON,S/ 39.90,vivanda,TÉ NEGRO FILTRANTE,2024-12-04 02:12:40.510054
Tinta en Botella CANON GI-190 Negro,CANON,S/ 45.00,vivanda,TÉ NEGRO FILTRANTE,2024-12-04 02:12:40.510054
Soporte de Celular para Auto USAMS Negro/Gris,USAMS,S/ 24.90,vivanda,TÉ NEGRO FILTRANTE,2024-12-04 02:12:40.510054
Cera para Autos SONAX Negro Frasco 500ml,SONAX,S/ 47.90,vivanda,TÉ NEGRO FILTRANTE,2024-12-04 02:12:40.510054
Tinte para Cabello CASTING Creme Gloss 200 Negro Caja 1un,CASTING,S/ 32.90,vivanda,TÉ NEGRO FILTRANTE,2024-12-04 02:12:40.510054
Infusiones SUNKA Dieta Té Verde Caja 21un,SUNKA,S/ 9.90,vivanda,TÉ NEGRO FILTRANTE,2024-12-04 02:12:40.510054
Olla Multiusos OSTER 2.6L Negro,OSTER,S/ 309.00,vivanda,TÉ NEGRO FILTRANTE,2024-12-04 02:12:40.510054
Plancha Convencional Oster GCSTBV-4119-053 Negro,OSTER,S/ 119.00,vivanda,TÉ NEGRO FILTRANTE,2024-12-04 02:12:40.510054
Hervidor Eléctrico OSTER 1.7L 2143573 Negro,OSTER,S/ 65.00,vivanda,TÉ NEGRO FILTRANTE,2024-12-04 02:12:40.510054
Freidora de Aire OSTER 1.8L Digital Negro,OSTER,S/ 279.00,vivanda,TÉ NEGRO FILTRANTE,2024-12-04 02:12:40.510054
Freidora de Aire OSTER 4L Digital Negro,OSTER,S/ 589.00,vivanda,TÉ NEGRO FILTRANTE,2024-12-04 02:12:40.510054
Tine Express Hombre SCHWARZKOPF Castaño Negro Natural 80 Caja 40ml,SCHWARZKOPF,S/ 43.00,vivanda,TÉ NEGRO FILTRANTE,2024-12-04 02:12:40.510054
Mug GO BARMAN Cocktail Negro,GO BARMAN,S/ 49.90,vivanda,TÉ NEGRO FILTRANTE,2024-12-04 02:12:40.510054
Set de Mugs GO BARMAN Cocktail Negro Paquete 2un,GO BARMAN,S/ 89.90,vivanda,TÉ NEGRO FILTRANTE,2024-12-04 02:12:40.510054
Tinte Capilar Permanente EXCELLENCE Sin Amoníaco 1U Negro Caja 1un,EXCELLENCE,S/ 35.50,vivanda,TÉ NEGRO FILTRANTE,2024-12-04 02:12:40.510054
Audífonos In Ear JBL JBLW300TWSBLK Negro,JBL,S/ 299.00,vivanda,TÉ NEGRO FILTRANTE,2024-12-04 02:12:40.510054
Cocina Empotrable INDURAMA 5 Quemadores EGASI-905CGNE Negro,INDURAMA,"S/ 1,659.00",vivanda,TÉ NEGRO FILTRANTE,2024-12-04 02:12:40.510054
Bolígrafo ARTESCO Trimax 35 F Azul/Negro/Rojo,ARTESCO,S/ 3.80,vivanda,TÉ NEGRO FILTRANTE,2024-12-04 02:12:40.510054
Bolígrafo PILOT BPGP-10R Negro,PILOT,S/ 11.50,vivanda,TÉ NEGRO FILTRANTE,2024-12-04 02:12:40.510054
Audífonos On Ear PHILIPS TAH1205BK Negro,PHILIPS,S/ 149.00,vivanda,TÉ NEGRO FILTRANTE,2024-12-04 02:12:40.510054
Bolígrafo PILOT BP1RT Negro y Rojo,PILOT,S/ 11.60,vivanda,TÉ NEGRO FILTRANTE,2024-12-04 02:12:40.510054
Minicomponente SONY V13D Bluetooth Karaoke Negro,SONY,S/ 999.00,vivanda,TÉ NEGRO FILTRANTE,2024-12-04 02:12:40.510054
Audífonos In Ear SONY WF-LS900N Negro,SONY,"S/ 1,099.00",vivanda,TÉ NEGRO FILTRANTE,2024-12-04 02:12:40.510054
Betún Pasta Negro SANTIAGO Pote 90ml,SANTIS,S/ 3.90,vivanda,TÉ NEGRO FILTRANTE,2024-12-04 02:12:40.510054
Control ROKU Express 4K Negro,ROKU,S/ 259.00,vivanda,TÉ NEGRO FILTRANTE,2024-12-04 02:12:40.510054
Control ROKU Express HD Negro,ROKU,S/ 199.00,vivanda,TÉ NEGRO FILTRANTE,2024-12-04 02:12:40.510054
Control ROKU Streaming Stick 4K Negro,ROKU,S/ 319.00,vivanda,TÉ NEGRO FILTRANTE,2024-12-04 02:12:40.510054
Infusión Té Verde WAWASANA Naranja Caja 50un,WAWASANA,S/ 16.90,vivanda,TÉ NEGRO FILTRANTE,2024-12-04 02:12:40.510054
"Smartphone VIVO V21 6.4"" 8GB 128GB Triple 64MP+8MP+2MP Negro Crepúsculo",VIVO,"S/ 2,299.00",vivanda,TÉ NEGRO FILTRANTE,2024-12-04 02:12:40.510054
Cortador de Pizza ILKO New Line Negro,ILKO,S/ 19.90,vivanda,TÉ NEGRO FILTRANTE,2024-12-04 02:12:40.510054
"Smartphone REALME C21Y 6.5"" 64GB 256GB Triple 13+2+2 MP Negro",REALME,S/ 699.00,vivanda,TÉ NEGRO FILTRANTE,2024-12-04 02:12:40.510054
Súper Mesa Cuadrada POLINPLAST 73x73cm Inka Negro,POLINPLAST,S/ 61.90,vivanda,TÉ NEGRO FILTRANTE,2024-12-04 02:12:40.510054
Freidora de Aire OSTER 4L 2138253 Negro,OSTER,S/ 499.00,vivanda,TÉ NEGRO FILTRANTE,2024-12-04 02:12:40.510054
Cuchara para Helado FACUSA Elegant Mp/Negro,FACUSA,S/ 13.50,vivanda,TÉ NEGRO FILTRANTE,2024-12-04 02:12:40.510054
Olla TRAMONTINA 20cm Paris Negro,TRAMONTINA,S/ 99.90,vivanda,TÉ NEGRO FILTRANTE,2024-12-04 02:12:40.510054
Olla TRAMONTINA 24cm Paris Negro,TRAMONTINA,S/ 118.90,vivanda,TÉ NEGRO FILTRANTE,2024-12-04 02:12:40.510054
Cacerola TRAMONTINA 18cm Paris Negro,TRAMONTINA,S/ 79.90,vivanda,TÉ NEGRO FILTRANTE,2024-12-04 02:12:40.510054
Olla Alta TRAMONTINA 24cm Paris Negro,TRAMONTINA,S/ 138.90,vivanda,TÉ NEGRO FILTRANTE,2024-12-04 02:12:40.510054
Olla TRAMONTINA 26cm Paris Negro,TRAMONTINA,S/ 148.90,vivanda,TÉ NEGRO FILTRANTE,2024-12-04 02:12:40.510054
Cable Tipo C USAMS US-SJ372 1m Negro,USAMS,S/ 24.90,vivanda,TÉ NEGRO FILTRANTE,2024-12-04 02:12:40.510054
Cable MicroUSB USAMS US-SJ373 1m Negro,USAMS,S/ 21.90,vivanda,TÉ NEGRO FILTRANTE,2024-12-04 02:12:40.510054
Headset Gaming HP H360 Negro,HP,S/ 99.00,vivanda,TÉ NEGRO FILTRANTE,2024-12-04 02:12:40.510054
Impresora Multifuncional CANON Pixma G4110 Negro,CANON,"S/ 1,069.00",vivanda,TÉ NEGRO FILTRANTE,2024-12-04 02:12:40.510054
Témpera Negro CLASS&WORK KR971883 300ml,CLASS & WORK,S/ 3.50,vivanda,TÉ NEGRO FILTRANTE,2024-12-04 02:12:40.510054
Cartucho para Impresora HP 667 Negro,HP,S/ 57.00,vivanda,TÉ NEGRO FILTRANTE,2024-12-04 02:12:40.510054
Cafetera OSTER 12 Tazas BVSTDCS12B-053 Negro,OSTER,S/ 189.00,vivanda,TÉ NEGRO FILTRANTE,2024-12-04 02:12:40.510054
