description,brand,price,website,search_term,scrape_timestamp
Papa Amarilla Tumbay,VIVANDA,S/ 7.49,vivanda,PAPA HUAYRO,2024-12-04 01:19:56.603072
Papa Blanca Yungay x kg,VIVANDA,S/ 4.39,vivanda,PAPA HUAYRO,2024-12-04 01:19:56.603072
Papa Blanca BELL'S,VIVANDA,S/ 3.69,vivanda,PAPA HUAYRO,2024-12-04 01:19:56.603072
Papa Amarilla Peruanita,VIVANDA,S/ 7.49,vivanda,PAPA HUAYRO,2024-12-04 01:19:56.603072
Papas INKA CHIPS con Sal de Mar Bolsa 135g,INKA CHIPS,S/ 7.80,vivanda,PAPA HUAYRO,2024-12-04 01:19:56.603072
Papa Amarilla Cocktail,VIVANDA,S/ 3.69,vivanda,PAPA HUAYRO,2024-12-04 01:19:56.603072
Papa Huamantanga,VIVANDA,S/ 6.69,vivanda,PAPA HUAYRO,2024-12-04 01:19:56.603072
Papa Rellena LA FLORENCIA 450g,LA FLORENCIA,S/ 12.10,vivanda,PAPA HUAYRO,2024-12-04 01:19:56.603072
Papas LAY'S Ondas Clásicas Bolsa 140g,LAY'S,S/ 5.50,vivanda,PAPA HUAYRO,2024-12-04 01:19:56.603072
Papa Blanca Cocktail,VIVANDA,S/ 1.80,vivanda,PAPA HUAYRO,2024-12-04 01:19:56.603072
Papa Amarilla Tumbay FEST Prefrita Congelada Doypack 1Kg,FEST,S/ 16.50,vivanda,PAPA HUAYRO,2024-12-04 01:19:56.603072
Papa Blanca Andina,VIVANDA,S/ 4.99,vivanda,PAPA HUAYRO,2024-12-04 01:19:56.603072
Papas LAY'S Clásicas Bolsa 150g,LAY'S,S/ 5.40,vivanda,PAPA HUAYRO,2024-12-04 01:19:56.603072
Papas Prefritas Rizadas AVIKO Bolsa 750g,AVIKO,S/ 13.49,vivanda,PAPA HUAYRO,2024-12-04 01:19:56.603072
Papa Rellena x un,VIVANDA,S/ 4.00,vivanda,PAPA HUAYRO,2024-12-04 01:19:56.603072
Papa Seca COSTEÑO Bolsa 500g,COSTENO,S/ 8.10,vivanda,PAPA HUAYRO,2024-12-04 01:19:56.603072
Papa Prefrita Congelada AVIKO Bolsa 1kg,AVIKO,S/ 10.90,vivanda,PAPA HUAYRO,2024-12-04 01:19:56.603072
Papas INKA CHIPS BBQ & Cebolla Bolsa 135g,INKA CHIPS,S/ 7.80,vivanda,PAPA HUAYRO,2024-12-04 01:19:56.603072
Papa Canchan Prefrita con Cascara Congelada BELL'S Bolsa 500g,BELL'S,S/ 7.90,vivanda,PAPA HUAYRO,2024-12-04 01:19:56.603072
Papas Fritas BELL'S Sabor Crema y Cebolla Lata 150g,BELL'S,S/ 6.10,vivanda,PAPA HUAYRO,2024-12-04 01:19:56.603072
Papa Sazonada en Gajos AVIKO Bolsa 500g,AVIKO,S/ 9.90,vivanda,PAPA HUAYRO,2024-12-04 01:19:56.603072
Papas LAY'S Artesanas Sal Marina Bolsa 135g,LAY'S,S/ 6.50,vivanda,PAPA HUAYRO,2024-12-04 01:19:56.603072
Papas LAY'S Clásicas Bolsa 36g,LAY'S,S/ 2.70,vivanda,PAPA HUAYRO,2024-12-04 01:19:56.603072
Papas Nativas Mixtas TIYAPUY Bolsa 142g,TIYAPUY,S/ 7.60,vivanda,PAPA HUAYRO,2024-12-04 01:19:56.603072
Papas PRINGLES Original Lata 104g,PRINGLES,S/ 8.50,vivanda,PAPA HUAYRO,2024-12-04 01:19:56.603072
Papa Tradicional Congelada BEM BRASIL Bolsa 1.05kg,BEM BRASIL,S/ 11.90,vivanda,PAPA HUAYRO,2024-12-04 01:19:56.603072
Papas PRINGLES Crema y Cebolla Lata 109g,PRINGLES,S/ 8.50,vivanda,PAPA HUAYRO,2024-12-04 01:19:56.603072
Papas PRINGLES Queso Lata 109g,PRINGLES,S/ 8.50,vivanda,PAPA HUAYRO,2024-12-04 01:19:56.603072
Papas al Hilo BELL'S Bolsa 125g,BELL'S,S/ 4.20,vivanda,PAPA HUAYRO,2024-12-04 01:19:56.603072
Papa Super Crunch AVIKO Bolsa 750g,AVIKO,S/ 10.90,vivanda,PAPA HUAYRO,2024-12-04 01:19:56.603072
Papas INKA CHIPS Jalapeños Bolsa 135g,INKA CHIPS,S/ 7.80,vivanda,PAPA HUAYRO,2024-12-04 01:19:56.603072
Papas Peruanas INKA CHIPS Bembos Hamburguesa Bolsa 120g,INKA CHIPS,S/ 8.30,vivanda,PAPA HUAYRO,2024-12-04 01:19:56.603072
Papas Fritas BELL'S Sabor Original Lata 60g,BELL'S,S/ 3.70,vivanda,PAPA HUAYRO,2024-12-04 01:19:56.603072
Papas Fritas INKA CHIPS Finas Hierbas Bolsa y Lima 115g,INKA CHIPS,S/ 8.20,vivanda,PAPA HUAYRO,2024-12-04 01:19:56.603072
Papa Crinkle Congelada BEM BRASIL Bolsa 1.05kg,BEM BRASIL,S/ 12.49,vivanda,PAPA HUAYRO,2024-12-04 01:19:56.603072
Papas PRINGLES Sabor Original 37g,PRINGLES,S/ 6.00,vivanda,PAPA HUAYRO,2024-12-04 01:19:56.603072
Papas LAY'S Ondas Picantes 140g + Piqueo SNAX Original 200g,LAY'S,S/ 13.50,vivanda,PAPA HUAYRO,2024-12-04 01:19:56.603072
Papas PRINGLES Habaneras Lata 158g,PRINGLES,S/ 13.90,vivanda,PAPA HUAYRO,2024-12-04 01:19:56.603072
Papas Artesanales LAYS Sal Marina Bolsa 34g,LAY'S,S/ 2.49,vivanda,PAPA HUAYRO,2024-12-04 01:19:56.603072
Papas LAY'S Clásicas Bolsa 70g,LAY'S,S/ 4.00,vivanda,PAPA HUAYRO,2024-12-04 01:19:56.603072
Papas Artesanales LAYS BBQ Bolsa 34g,LAY'S,S/ 2.49,vivanda,PAPA HUAYRO,2024-12-04 01:19:56.603072
Papa Prefrita BELL'S Bolsa 1Kg,BELL'S,S/ 10.49,vivanda,PAPA HUAYRO,2024-12-04 01:19:56.603072
Papas PRINGLES Adobada Lata 158g,PRINGLES,S/ 13.90,vivanda,PAPA HUAYRO,2024-12-04 01:19:56.603072
Papas Onduladas INKA CHIPS Búfalo Bolsa 115g,INKA CHIPS,S/ 8.20,vivanda,PAPA HUAYRO,2024-12-04 01:19:56.603072
Papas LAY'S Ondas Picante Bolsa 140g,LAY'S,S/ 5.50,vivanda,PAPA HUAYRO,2024-12-04 01:19:56.603072
Papas Nativas TIYAPUY Mixtas Sabor a Jalapeño Bolsa 142g,TIYAPUY,S/ 9.90,vivanda,PAPA HUAYRO,2024-12-04 01:19:56.603072
Papas Ondas LAY'S con Mayonesa Bolsa 140g,LAY'S,S/ 5.50,vivanda,PAPA HUAYRO,2024-12-04 01:19:56.603072
Papas Nativas TIYAPUY Mixtas Sabor a Limón y Pimienta Bolsa 142g,TIYAPUY,S/ 9.90,vivanda,PAPA HUAYRO,2024-12-04 01:19:56.603072
Papa Seca BELL'S Bolsa 400g,BELL'S,S/ 5.60,vivanda,PAPA HUAYRO,2024-12-04 01:19:56.603072
Papas Fritas BELL'S Sabor Pizza Lata 150g,BELL'S,S/ 6.10,vivanda,PAPA HUAYRO,2024-12-04 01:19:56.603072
Papas LAY'S Artesanas Alitas BBQ Bolsa 130g,LAY'S,S/ 6.50,vivanda,PAPA HUAYRO,2024-12-04 01:19:56.603072
Puré de Papa KNORR Bolsa 125g,KNORR,S/ 4.80,vivanda,PAPA HUAYRO,2024-12-04 01:19:56.603072
Pollo Rostizado + Papas Fritas,VIVANDA,S/ 31.90,vivanda,PAPA HUAYRO,2024-12-04 01:19:56.603072
Combo Pollo Rostizado + Papas Fritas + Chicha NATURALE 1L,VIVANDA,S/ 35.80,vivanda,PAPA HUAYRO,2024-12-04 01:19:56.603072
Hojuelas de Papas Nativas TIYAPUY Mix Fritas Bolsa 40g,TIYAPUY,S/ 2.90,vivanda,PAPA HUAYRO,2024-12-04 01:19:56.603072
Puré BELL'S Papas Bolsa 125g,BELL'S,S/ 3.90,vivanda,PAPA HUAYRO,2024-12-04 01:19:56.603072
Pack Papas LAY´S Clásicas Bolsa 150g + PIQUEO SNAX Bolsa 200g Paquete 2un,LAY'S,S/ 13.50,vivanda,PAPA HUAYRO,2024-12-04 01:19:56.603072
2 Pollos Rostizados + 2 Papas Fritas,VIVANDA,S/ 54.90,vivanda,PAPA HUAYRO,2024-12-04 01:19:56.603072
Snacks de Papa Maíz y Trigo PIQUEO SNAX Bolsa 200g,FRITO LAY,S/ 9.00,vivanda,PAPA HUAYRO,2024-12-04 01:19:56.603072
Pack Papas LAY´S Clásicas Bolsa 150g + DORITOS Queso Atrevido 190g Paquete 2un,LAY'S,S/ 13.50,vivanda,PAPA HUAYRO,2024-12-04 01:19:56.603072
Piqueo BELL'S Papas al hilo Bolsa 220Gr,BELL'S,S/ 8.29,vivanda,PAPA HUAYRO,2024-12-04 01:19:56.603072
Pack Pollo Rostizado x2 + Papas Fritas x2 + Gaseosa INCA KOLA 1.5L,VIVANDA,S/ 58.90,vivanda,PAPA HUAYRO,2024-12-04 01:19:56.603072
1/4 Pollo Rostizado + Papas Fritas,VIVANDA,S/ 10.90,vivanda,PAPA HUAYRO,2024-12-04 01:19:56.603072
Pack Pollo Rostizado + Papas Fritas + Cerveza CUSQUEÑA Malta 310ml paquete 6un,VIVANDA,S/ 50.90,vivanda,PAPA HUAYRO,2024-12-04 01:19:56.603072
Porción de Papas Fritas,VIVANDA,S/ 8.20,vivanda,PAPA HUAYRO,2024-12-04 01:19:56.603072
Piqueo VILLA NATURA Papas fritas al hilo Bolsa 150Gr,VILLA NATURA,S/ 5.00,vivanda,PAPA HUAYRO,2024-12-04 01:19:56.603072
Snacks de Papa Maíz y Trigo PIQUEO SNAX Bolsa 260g,FRITO LAY,S/ 11.00,vivanda,PAPA HUAYRO,2024-12-04 01:19:56.603072
Gnocchi de Papa Amarilla IL PASTIFICIO Bandeja 500g,IL PASTIFICIO,S/ 24.99,vivanda,PAPA HUAYRO,2024-12-04 01:19:56.603072
"Snack de Papa, Maíz y Trigo PIQUEO SNAX Bolsa 55g",FRITO LAY,S/ 2.70,vivanda,PAPA HUAYRO,2024-12-04 01:19:56.603072
Piqueo BELL'S Papas fritas sabor original Lata 150Gr,BELL'S,S/ 6.10,vivanda,PAPA HUAYRO,2024-12-04 01:19:56.603072
Prensa Papas FACUSA,FACUSA,S/ 69.90,vivanda,PAPA HUAYRO,2024-12-04 01:19:56.603072
Piqueo BELL'S Papas camotes y plátanos fritos Bolsa 220Gr,BELL'S,S/ 7.40,vivanda,PAPA HUAYRO,2024-12-04 01:19:56.603072
Prensa Papas VIVA HOME Grande,VIVA HOME,S/ 26.90,vivanda,PAPA HUAYRO,2024-12-04 01:19:56.603072
Prensador De Papa Surtido,BASA,S/ 28.90,vivanda,PAPA HUAYRO,2024-12-04 01:19:56.603072
Piqueo BELL'S Papas Bolsa 185Gr + Piqueo varios Bolsa 230Gr,BELL'S,S/ 12.40,vivanda,PAPA HUAYRO,2024-12-04 01:19:56.603072
Hojuelas de Papas Fritas BELL'S Bolsa 150g,BELL'S,S/ 5.99,vivanda,PAPA HUAYRO,2024-12-04 01:19:56.603072
Juguete POTATO HEAD Señor Cara de Papa F3244,MR POTATO HEAD,S/ 54.90,vivanda,PAPA HUAYRO,2024-12-04 01:19:56.603072
Hojuelas de Papas Fritas BELL'S Onduladas Bolsa 150g,BELL'S,S/ 5.50,vivanda,PAPA HUAYRO,2024-12-04 01:19:56.603072
Pasas Morenas BELL'S Bolsa 180g,BELL'S,S/ 4.50,vivanda,PAPA HUAYRO,2024-12-04 01:19:56.603072
Pasas Rubias VILLA NATURA Bolsa 150g,VILLA NATURA,S/ 8.90,vivanda,PAPA HUAYRO,2024-12-04 01:19:56.603072
Pasas Morenas VALLEALTO Doypack 250g,VALLEALTO,S/ 8.00,vivanda,PAPA HUAYRO,2024-12-04 01:19:56.603072
Galletas con Cobertura de Chocolate DOÑA PEPA Display 30un,FIELD DOÑA PEPA,S/ 28.00,vivanda,PAPA HUAYRO,2024-12-04 01:19:56.603072
Pasas Morenas BELL'S Táper 250g,BELL'S,S/ 7.50,vivanda,PAPA HUAYRO,2024-12-04 01:19:56.603072
Pisco CUATRO GALLOS Quebranta Botella 700ml,CUATRO GALLOS,S/ 42.90,vivanda,PAPA HUAYRO,2024-12-04 01:19:56.603072
Vino Tinto TAPAS Botella 750ml,TAPAS,S/ 24.90,vivanda,PAPA HUAYRO,2024-12-04 01:19:56.603072
Pasas Morenas VILLA NATURA Bolsa 150g,VILLA NATURA,S/ 5.00,vivanda,PAPA HUAYRO,2024-12-04 01:19:56.603072
Miel de Abeja CALLEJÓN DE HUAYLAS Floración Silvestre Frasco 300g,CALLEJON DE HUAYLAS,S/ 22.10,vivanda,PAPA HUAYRO,2024-12-04 01:19:56.603072
Pasas Rubias BELL'S Táper 150g,BELL'S,S/ 8.49,vivanda,PAPA HUAYRO,2024-12-04 01:19:56.603072
Vino Rosado TAPAS Botella 750ml,TAPAS,S/ 24.90,vivanda,PAPA HUAYRO,2024-12-04 01:19:56.603072
Pack Pisco Quebranta CUATRO GALLOS Botella 700ml + Gaseosa Nórdica Botella 1.5L + Vaso + Dados,CUATRO GALLOS,S/ 61.99,vivanda,PAPA HUAYRO,2024-12-04 01:19:56.603072
Pisco CUATRO GALLOS Puro Acholado Botella 700ml,CUATRO GALLOS,S/ 42.90,vivanda,PAPA HUAYRO,2024-12-04 01:19:56.603072
Pisco Mosto Verde Torontel CUATRO GALLOS Colección de Artistas Botella 750ml,CUATRO GALLOS,S/ 89.90,vivanda,PAPA HUAYRO,2024-12-04 01:19:56.603072
Pisco Mosto Verde Quebranta CUATRO GALLOS Colección de Artistas Botella 750ml,CUATRO GALLOS,S/ 89.90,vivanda,PAPA HUAYRO,2024-12-04 01:19:56.603072
Pisco CUATRO GALLOS Puro Italia Botella 700ml,CUATRO GALLOS,S/ 42.90,vivanda,PAPA HUAYRO,2024-12-04 01:19:56.603072
Pisco Mosto Verde Acholado CUATRO GALLOS Colección de Artistas Botella 750ml,CUATRO GALLOS,S/ 89.90,vivanda,PAPA HUAYRO,2024-12-04 01:19:56.603072
Pisco Mosto Verde Italia CUATRO GALLOS Colección de Artistas Botella 750ml,CUATRO GALLOS,S/ 89.90,vivanda,PAPA HUAYRO,2024-12-04 01:19:56.603072
Miel de Abejas CALLEJÓN DE HUAYLAS Floración Eucalipto Frasco 500g,CALLEJON DE HUAYLAS,S/ 40.50,vivanda,PAPA HUAYRO,2024-12-04 01:19:56.603072
Vino Blanco TAPAS Botella 750ml,TAPAS,S/ 24.90,vivanda,PAPA HUAYRO,2024-12-04 01:19:56.603072
Vino PATA NEGRA Reserva Tempranillo Botella 750ml,PATA NEGRA,S/ 61.50,vivanda,PAPA HUAYRO,2024-12-04 01:19:56.603072
Miel de Abeja CALLEJÓN DE HUAYLAS Floración Silvestre Frasco 500g,CALLEJON DE HUAYLAS,S/ 36.50,vivanda,PAPA HUAYRO,2024-12-04 01:19:56.603072
Pasas Morenas VALLEALTO Bolsa 150g,VALLEALTO,S/ 4.90,vivanda,PAPA HUAYRO,2024-12-04 01:19:56.603072
Tapa Empanada BELL'S Paquete 12un,BELL'S,S/ 6.90,vivanda,PAPA HUAYRO,2024-12-04 01:19:56.603072
Pasas Morenas VILLA NATURA Bolsa 250g,VILLA NATURA,S/ 8.90,vivanda,PAPA HUAYRO,2024-12-04 01:19:56.603072
Miel de Abeja CALLEJÓN DE HUAYLAS Silvestre Frasco 1.1Kg,CALLEJON DE HUAYLAS,S/ 62.50,vivanda,PAPA HUAYRO,2024-12-04 01:19:56.603072
Uva Verde sin Pepa x Kg,VIVANDA,S/ 14.99,vivanda,PAPA HUAYRO,2024-12-04 01:19:56.603072
Galleta Doña Pepa FIELD Paquete 6un,FIELD,S/ 4.90,vivanda,PAPA HUAYRO,2024-12-04 01:19:56.603072
Cereal UNIÓN Granola Pasas y Almendras Doypack 400g,UNIÓN,S/ 16.49,vivanda,PAPA HUAYRO,2024-12-04 01:19:56.603072
Aceituna Negra con Pepa BELL'S Táper 280g,BELL'S FRESCOS,S/ 11.50,vivanda,PAPA HUAYRO,2024-12-04 01:19:56.603072
Aceituna Negra sin Pepa EL OLIVAR Bolsa 240g,EL OLIVAR,S/ 9.50,vivanda,PAPA HUAYRO,2024-12-04 01:19:56.603072
Guindón sin Pepa VALLEALTO Bolsa 150g,VALLEALTO,S/ 9.60,vivanda,PAPA HUAYRO,2024-12-04 01:19:56.603072
Piqueo BELL'S Guindones medianos sin pepa Bolsa 180Gr,BELL'S,S/ 9.50,vivanda,PAPA HUAYRO,2024-12-04 01:19:56.603072
Pepinillo sin Pepas VIVA Bandeja x un,VIVA,S/ 8.90,vivanda,PAPA HUAYRO,2024-12-04 01:19:56.603072
Turrón SAN JOSÉ de Doña Pepa Paquete 500g,SAN JOSE,S/ 18.30,vivanda,PAPA HUAYRO,2024-12-04 01:19:56.603072
Agua sin Gas CIELO Tapa Sport Botella 1L,CIELO,S/ 2.40,vivanda,PAPA HUAYRO,2024-12-04 01:19:56.603072
Barra de Cereal Q FOODS Quinoa Pasas y Chocolate Caja 6un,Q FOODS,S/ 20.90,vivanda,PAPA HUAYRO,2024-12-04 01:19:56.603072
Aceituna Negra sin Pepa BELL'S Táper 260g,BELL'S FRESCOS,S/ 11.90,vivanda,PAPA HUAYRO,2024-12-04 01:19:56.603072
Aceituna Verde sin Pepa HUERTO MEJÍA Paquete 230g,HUERTO MEJÍA,S/ 11.50,vivanda,PAPA HUAYRO,2024-12-04 01:19:56.603072
Guindones sin Pepa BELL'S Táper 250g,BELL'S,S/ 13.60,vivanda,PAPA HUAYRO,2024-12-04 01:19:56.603072
Salchicha de Huacho CASA EUROPA Paquete 150g,CASA EUROPA,S/ 7.30,vivanda,PAPA HUAYRO,2024-12-04 01:19:56.603072
Piqueo VILLA NATURA Pasas Maní Almendra Pecanas y Nueces Táper 250g,VILLA NATURA,S/ 12.90,vivanda,PAPA HUAYRO,2024-12-04 01:19:56.603072
Aceitunas Negras EL OLIVAR con Pepa Bolsa 240g,EL OLIVAR,S/ 8.50,vivanda,PAPA HUAYRO,2024-12-04 01:19:56.603072
Chocolate 2 CERRITOS con Pasas Bolsa 125g,NURIA,S/ 10.10,vivanda,PAPA HUAYRO,2024-12-04 01:19:56.603072
Turrón de Doña Pepa BELL'S Caja 1Kg,BELL'S,S/ 21.90,vivanda,PAPA HUAYRO,2024-12-04 01:19:56.603072
Canister con Tapa VIVA HOME Pajarito 17cm,VIVA HOME,S/ 9.90,vivanda,PAPA HUAYRO,2024-12-04 01:19:56.603072
Agua Mineral EVIAN sin Gas Botella con Tapa Sport 750ml,EVIAN,S/ 13.50,vivanda,PAPA HUAYRO,2024-12-04 01:19:56.603072
Turrón de Doña Pepa CRISTO MORADO Caja 500g,CRISTO MORADO,S/ 18.50,vivanda,PAPA HUAYRO,2024-12-04 01:19:56.603072
Mix Tapas Españolas CASA EUROPA Paquete 120g,CASA EUROPA,S/ 25.90,vivanda,PAPA HUAYRO,2024-12-04 01:19:56.603072
Turrón de Doña Pepa BELL'S Caja 500g,BELL'S,S/ 11.80,vivanda,PAPA HUAYRO,2024-12-04 01:19:56.603072
Salchicha de Huacho SALCHICHERÍA ALEMANA Paquete 150g,SALCHICHERÍA ALEMANA,S/ 6.50,vivanda,PAPA HUAYRO,2024-12-04 01:19:56.603072
Canister de Vidrio VIVA HOME con Tapa de Madera 700ml,VIVA HOME,S/ 13.90,vivanda,PAPA HUAYRO,2024-12-04 01:19:56.603072
Panetón con Pasas y Frutas Confitadas TODINNITO Caja 85g,TODINNO,S/ 4.60,vivanda,PAPA HUAYRO,2024-12-04 01:19:56.603072
Chocolate Milky LA IBÉRICA Pecanas y Pasas Caja 100g,LA IBERICA,S/ 20.20,vivanda,PAPA HUAYRO,2024-12-04 01:19:56.603072
Pisco INCA Huaco Botella 750ml,INCA,S/ 49.90,vivanda,PAPA HUAYRO,2024-12-04 01:19:56.603072
Cánister de Vidrio VIVA HOME C/Tapa de Madera 500ml,VIVA HOME,S/ 12.90,vivanda,PAPA HUAYRO,2024-12-04 01:19:56.603072
Aceitunas Verdes EL OLIVAR sin Pepa Bolsa 240g,EL OLIVAR,S/ 7.90,vivanda,PAPA HUAYRO,2024-12-04 01:19:56.603072
Cereal ANGEL Capas de trigo con chocolate Bolsa 380Gr,ANGEL,S/ 16.10,vivanda,PAPA HUAYRO,2024-12-04 01:19:56.603072
Chocolate DOÑA PEPA Galleta con Cobertura Paquete 23g,NABISCO,S/ 1.20,vivanda,PAPA HUAYRO,2024-12-04 01:19:56.603072
Piqueo BELL'S Maní con pasas Bolsa 180Gr,BELL'S,S/ 5.70,vivanda,PAPA HUAYRO,2024-12-04 01:19:56.603072
Caja C/Tapa DURAPLAST Mónaco G N°2 6L,DURAPLAST,S/ 9.80,vivanda,PAPA HUAYRO,2024-12-04 01:19:56.603072
Cuaderno Espiral DGNOTTAS A6 Tapa Dura Pastel,DGNOTTAS,S/ 10.90,vivanda,PAPA HUAYRO,2024-12-04 01:19:56.603072
Granola BELL'S Coco y Pasas Doypack 350g,BELL'S,S/ 9.90,vivanda,PAPA HUAYRO,2024-12-04 01:19:56.603072
Comida para Perros RAMBALA Adulto Patas de Pollo Doypack 10un,RAMBALA,S/ 11.20,vivanda,PAPA HUAYRO,2024-12-04 01:19:56.603072
Canister con Tapa VIVA HOME Pajarito 22cm,VIVA HOME,S/ 10.90,vivanda,PAPA HUAYRO,2024-12-04 01:19:56.603072
Canister Vidrio Tapa Madera VIVA HOME 1L,VIVA HOME,S/ 14.90,vivanda,PAPA HUAYRO,2024-12-04 01:19:56.603072
Piqueo VILLA NATURA Pasas Almendras Pecanas Nueces y Anacardos Táper 250g,VILLA NATURA,S/ 19.00,vivanda,PAPA HUAYRO,2024-12-04 01:19:56.603072
Aceitunas Verdes EL OLIVAR con Pepa Bolsa 240g,EL OLIVAR,S/ 7.50,vivanda,PAPA HUAYRO,2024-12-04 01:19:56.603072
Chocolate en Barra LA IBÉRICA Milky Pecanas y Pasas Paquete 50g,LA IBERICA,S/ 8.50,vivanda,PAPA HUAYRO,2024-12-04 01:19:56.603072
Ensal Pina Sand Pap BELL'S FRESCOS Bandeja 300g,BELL'S FRESCOS,S/ 5.69,vivanda,PAPA HUAYRO,2024-12-04 01:19:56.603072
"Yogurt GLORIA ActiBio con Linaza Sabor a Higo, Guindón y Pasas Galonera 1.7Kg",GLORIA,S/ 10.90,vivanda,PAPA HUAYRO,2024-12-04 01:19:56.603072
Comida para Perros RAMBALA Adulto Patas de Pollo Doypack 20un,RAMBALA,S/ 20.90,vivanda,PAPA HUAYRO,2024-12-04 01:19:56.603072
Olla Pulida Con Tapa De Vidrio N° 18 Festejo,RECORD,S/ 99.90,vivanda,PAPA HUAYRO,2024-12-04 01:19:56.603072
Alimento Húmero para Gatos FANCY FEAST Casserole Sabor Atún y Salmón en Lata de 85gr,ONE,S/ 187.50,vivanda,PAPA HUAYRO,2024-12-04 01:19:56.603072
Set de Refractarios PYREX Redondo 3un C/Tapa,PYREX,S/ 139.90,vivanda,PAPA HUAYRO,2024-12-04 01:19:56.603072
Jarra PASABAHCE Niagara 2.3L C/Tapa,PASABAHCE,S/ 42.90,vivanda,PAPA HUAYRO,2024-12-04 01:19:56.603072
Colado HEINZ Ciruela y Pasas Frasco 113g,HEINZ,S/ 5.60,vivanda,PAPA HUAYRO,2024-12-04 01:19:56.603072
Cuaderno Espiral DGNOTTAS A6 Tapa Dura Snoopy,DGNOTTAS,S/ 10.90,vivanda,PAPA HUAYRO,2024-12-04 01:19:56.603072
Chocolate 2 CERRITOS Relleno de pasas Bolsa 125g,2 CERRITOS,S/ 10.10,vivanda,PAPA HUAYRO,2024-12-04 01:19:56.603072
Molde OCUISINE Rectangular 4.3L Con Tapa,OCUISINE,S/ 69.90,vivanda,PAPA HUAYRO,2024-12-04 01:19:56.603072
Set de Tápers VIVA HOME Tapa Pastel 3un,VIVA HOME,S/ 10.90,vivanda,PAPA HUAYRO,2024-12-04 01:19:56.603072
Bacín Didáctico REY Hippo C/Tapa Niña,REY,S/ 29.90,vivanda,PAPA HUAYRO,2024-12-04 01:19:56.603072
Bacín Didáctico REY Hippo C/Tapa Niño,REY,S/ 29.90,vivanda,PAPA HUAYRO,2024-12-04 01:19:56.603072
Jarra Tivoli con tapa LUMINARC 1.6L,LUMINARC,S/ 19.90,vivanda,PAPA HUAYRO,2024-12-04 01:19:56.603072
Jarra Octime con Tapa LUMINARC 1.6L,LUMINARC,S/ 21.90,vivanda,PAPA HUAYRO,2024-12-04 01:19:56.603072
Jarra Quadro LUMINARC 0.5L,LUMINARC,S/ 21.90,vivanda,PAPA HUAYRO,2024-12-04 01:19:56.603072
Exprimidor Gigante con Tapa REY,REYPLAST,S/ 12.90,vivanda,PAPA HUAYRO,2024-12-04 01:19:56.603072
Jarra BASA 4.50 L Transparente Con Tapa Color Surtido,BASA,S/ 16.50,vivanda,PAPA HUAYRO,2024-12-04 01:19:56.603072
Vaso Con Tapa Hermética 0.44 L Transparente,BASA,S/ 6.90,vivanda,PAPA HUAYRO,2024-12-04 01:19:56.603072
Vaso de Entrenamiento DISNEY Mickey con Tapa Giratoria 9Oz,DISNEY,S/ 22.90,vivanda,PAPA HUAYRO,2024-12-04 01:19:56.603072
Cuaderno Espiralado DGNOTTAS A4 Tapa Dura Pastel Work Hard,DGNOTTAS,S/ 33.90,vivanda,PAPA HUAYRO,2024-12-04 01:19:56.603072
Olla Pulida Con Tapa De Vidrio N° 20 Festejo,RECORD,S/ 116.90,vivanda,PAPA HUAYRO,2024-12-04 01:19:56.603072
Olla Pulida Con Tapa De Vidrio N° 26 Festejo,RECORD,S/ 159.90,vivanda,PAPA HUAYRO,2024-12-04 01:19:56.603072
Olla Pulida Con Tapa De Vidrio N° 22 Festejo,RECORD,S/ 126.90,vivanda,PAPA HUAYRO,2024-12-04 01:19:56.603072
Sartén de Cerámica RECORD con Tapa 24cm Rojo,RECORD,S/ 129.90,vivanda,PAPA HUAYRO,2024-12-04 01:19:56.603072
Vaso Entrenamiento DISNEY Minnie con Tapa Giratoria Doble 9Oz,DISNEY,S/ 22.90,vivanda,PAPA HUAYRO,2024-12-04 01:19:56.603072
Cuaderno Espiralado DGNOTTAS Disney A-5 Tapa Dura,DGNOTTAS,S/ 25.90,vivanda,PAPA HUAYRO,2024-12-04 01:19:56.603072
Cuaderno Espiralado DGNOTTAS Disney A-4 Tapa Dura,DGNOTTAS,S/ 36.90,vivanda,PAPA HUAYRO,2024-12-04 01:19:56.603072
Cereal MCCALLUM'S Multicereal con Pasas Caja 350g,MCCALLUM S,S/ 13.90,vivanda,PAPA HUAYRO,2024-12-04 01:19:56.603072
Jarra Arc Sin Tapa LUMINARC 500ml,LUMINARC,S/ 14.90,vivanda,PAPA HUAYRO,2024-12-04 01:19:56.603072
Jarra con Mezclador BASA 3.50L Transparente Con Tapa Color Surtido,BASA,S/ 17.50,vivanda,PAPA HUAYRO,2024-12-04 01:19:56.603072
Jarra BASA 3.50 L Transparente Con Tapa Color Surtido,BASA,S/ 15.50,vivanda,PAPA HUAYRO,2024-12-04 01:19:56.603072
Didácticos ARTI CREATIVO Mapa del Perú,ARTICREATIVO,S/ 6.40,vivanda,PAPA HUAYRO,2024-12-04 01:19:56.603072
Piqueo BELL'S Maní con Pasas Táper 140g,BELL'S,S/ 4.30,vivanda,PAPA HUAYRO,2024-12-04 01:19:56.603072
"Yogurt GLORIA ActiBio con Linaza Sabor a Higo, Guindón y Pasas Botella 950g",GLORIA,S/ 7.50,vivanda,PAPA HUAYRO,2024-12-04 01:19:56.603072
Ensal Pap Sand Mel BELL'S FRESCOS Bandeja 300g,BELL'S FRESCOS,S/ 5.69,vivanda,PAPA HUAYRO,2024-12-04 01:19:56.603072
Cuaderno MINERVA Cuadriculado Anillado Universitario 6DV Tapa Dura,MINERVA,S/ 34.90,vivanda,PAPA HUAYRO,2024-12-04 01:19:56.603072
Cacerola ARCUISINE C/Tapa Roja 2L,ARCUISINE,S/ 39.90,vivanda,PAPA HUAYRO,2024-12-04 01:19:56.603072
