description,brand,price,website,search_term,scrape_timestamp
Cucharitas de Té FACUSA M460 Blíster 3un,FACUSA,S/ 8.90,vivanda,TÉ NEGRO FILTRANTE,2024-12-04 02:12:40.510054
Vino PATA NEGRA Reserva Tempranillo Botella 750ml,PATA NEGRA,S/ 61.50,vivanda,TÉ NEGRO FILTRANTE,2024-12-04 02:12:40.510054
Bolsa para Basura VIRUTEX Negra 35L Planas,VIRUTEX,S/ 7.90,vivanda,TÉ NEGRO FILTRANTE,2024-12-04 02:12:40.510054
Bolsa para Basura VIRUTEX Negra 50L Planas,VIRUTEX,S/ 10.00,vivanda,TÉ NEGRO FILTRANTE,2024-12-04 02:12:40.510054
Bolsa para Basura VIRUTEX Negra 75L Planas,VIRUTEX,S/ 14.90,vivanda,TÉ NEGRO FILTRANTE,2024-12-04 02:12:40.510054
Aceituna Negra Deshuesada OLIVALLE Balde 350g,OLIVALLE,S/ 18.20,vivanda,TÉ NEGRO FILTRANTE,2024-12-04 02:12:40.510054
Aceituna Negra con Pepa BELL'S Táper 280g,BELL'S FRESCOS,S/ 11.50,vivanda,TÉ NEGRO FILTRANTE,2024-12-04 02:12:40.510054
Aceituna Negra sin Pepa EL OLIVAR Bolsa 240g,EL OLIVAR,S/ 9.50,vivanda,TÉ NEGRO FILTRANTE,2024-12-04 02:12:40.510054
Pimienta BADIA Negra molida Frasco 56.7Gr,BADIA,S/ 9.90,vivanda,TÉ NEGRO FILTRANTE,2024-12-04 02:12:40.510054
Aceituna Negra Entera OLIVALLE Balde 400g,OLIVALLE,S/ 16.00,vivanda,TÉ NEGRO FILTRANTE,2024-12-04 02:12:40.510054
Pimienta Negra Molida BELL'S Sobre 15g,BELL'S,S/ 2.50,vivanda,TÉ NEGRO FILTRANTE,2024-12-04 02:12:40.510054
Pimienta KARIÑO Negra molida Frasco 40Gr,KARINO,S/ 6.99,vivanda,TÉ NEGRO FILTRANTE,2024-12-04 02:12:40.510054
Aceituna Negra sin Pepa BELL'S Táper 260g,BELL'S FRESCOS,S/ 11.90,vivanda,TÉ NEGRO FILTRANTE,2024-12-04 02:12:40.510054
Cerveza CUSQUEÑA Negra Botella 310ml Paquete 6un,CUSQUEÑA,S/ 23.90,vivanda,TÉ NEGRO FILTRANTE,2024-12-04 02:12:40.510054
Bolsa para Basura VIRUTEX Negra 140L Planas,VIRUTEX,S/ 16.90,vivanda,TÉ NEGRO FILTRANTE,2024-12-04 02:12:40.510054
Bolsa para Basura VIRUTEX Negra 220L Planas,VIRUTEX,S/ 11.50,vivanda,TÉ NEGRO FILTRANTE,2024-12-04 02:12:40.510054
Pimienta Negra Molida 4 ESTACIONES Frasco 35g,4ESTACIONES,S/ 4.99,vivanda,TÉ NEGRO FILTRANTE,2024-12-04 02:12:40.510054
Aceitunas Negras EL OLIVAR con Pepa Bolsa 240g,EL OLIVAR,S/ 8.50,vivanda,TÉ NEGRO FILTRANTE,2024-12-04 02:12:40.510054
Aceituna Negra HUERTO MEJÍA Paquete 250g,HUERTO MEJÍA,S/ 12.50,vivanda,TÉ NEGRO FILTRANTE,2024-12-04 02:12:40.510054
Torta Selva Negra Mediana LA FLORENCIA 1un,LA FLORENCIA,S/ 60.90,vivanda,TÉ NEGRO FILTRANTE,2024-12-04 02:12:40.510054
Chía Negra en Granos Orgánico ECOANDINO Doypack 250g,ECOANDINO,S/ 15.60,vivanda,TÉ NEGRO FILTRANTE,2024-12-04 02:12:40.510054
Pimienta Negra BADIA en Polvo Frasco 198.4g,BADIA,S/ 29.90,vivanda,TÉ NEGRO FILTRANTE,2024-12-04 02:12:40.510054
Pimienta BELL'S Negra Entera Sobre 15g,BELL'S,S/ 2.50,vivanda,TÉ NEGRO FILTRANTE,2024-12-04 02:12:40.510054
Cera líquida autobrillante TEKNO Negra Doypack 330Ml,TEKNO,S/ 9.90,vivanda,TÉ NEGRO FILTRANTE,2024-12-04 02:12:40.510054
Acondicionador SUMAQ Quinua Negra Frasco 500ml,SUMAQ,S/ 38.90,vivanda,TÉ NEGRO FILTRANTE,2024-12-04 02:12:40.510054
Cerveza Negra CUSQUEÑA Lata 355ml Paquete 6un,CUSQUEÑA,S/ 28.90,vivanda,TÉ NEGRO FILTRANTE,2024-12-04 02:12:40.510054
Aceituna Negra Deshuesada OLIVALLE Balde 700g,OLIVALLE,S/ 30.50,vivanda,TÉ NEGRO FILTRANTE,2024-12-04 02:12:40.510054
Pimienta KARIÑO Negra molida Sobre 18Gr,KARINO,S/ 5.10,vivanda,TÉ NEGRO FILTRANTE,2024-12-04 02:12:40.510054
Shampoo SUMAQ Quinua Negra Frasco 500ml,SUMAQ,S/ 38.90,vivanda,TÉ NEGRO FILTRANTE,2024-12-04 02:12:40.510054
Polvo Instantáneo de Tarwi TAURI con Maca Negra Doypack 250g,TAURI,S/ 21.90,vivanda,TÉ NEGRO FILTRANTE,2024-12-04 02:12:40.510054
Pimienta Negra MARAS GOURMET Bolsa 30g,MARAS GOURMET,S/ 5.40,vivanda,TÉ NEGRO FILTRANTE,2024-12-04 02:12:40.510054
Pimienta Negra Molida MARAS GOURMET Frasco 60g,MARAS GOURMET,S/ 14.90,vivanda,TÉ NEGRO FILTRANTE,2024-12-04 02:12:40.510054
Pisco PORTON Negra Criolla Botella 750ml,PORTON,S/ 89.90,vivanda,TÉ NEGRO FILTRANTE,2024-12-04 02:12:40.510054
Crema Tratamiento para Cabello Tinturado SUMAQ Quinua Negra Tubo 250g,SUMAQ,S/ 36.90,vivanda,TÉ NEGRO FILTRANTE,2024-12-04 02:12:40.510054
Pisco BIONDI Puro Negra Mollar Botella 500ml,BIONDI,S/ 63.90,vivanda,TÉ NEGRO FILTRANTE,2024-12-04 02:12:40.510054
Pimienta 4 ESTACIONES Negra molida Sobre 60Gr,4ESTACIONES,S/ 7.50,vivanda,TÉ NEGRO FILTRANTE,2024-12-04 02:12:40.510054
Aceituna Negra Entera OLIVALLE Balde 750g,OLIVALLE,S/ 29.00,vivanda,TÉ NEGRO FILTRANTE,2024-12-04 02:12:40.510054
Pimienta KARIÑO Negra entera Sobre 17Gr,KARINO,S/ 3.70,vivanda,TÉ NEGRO FILTRANTE,2024-12-04 02:12:40.510054
Pimienta 4 ESTACIONES Negra molida Sobre 15Gr,4ESTACIONES,S/ 4.70,vivanda,TÉ NEGRO FILTRANTE,2024-12-04 02:12:40.510054
Bolígrafos FABER CASTELL 035-M 2Azules/2Rojos/2Negros Bolsa 6un,FABER CASTELL,S/ 4.90,vivanda,TÉ NEGRO FILTRANTE,2024-12-04 02:12:40.510054
Tinta EPSON T664120 Negra,EPSON,S/ 39.90,vivanda,TÉ NEGRO FILTRANTE,2024-12-04 02:12:40.510054
Pimienta Negra BELL'S Paquete 6un,BELL'S,S/ 3.90,vivanda,TÉ NEGRO FILTRANTE,2024-12-04 02:12:40.510054
