description,price,website,search_term,scrape_timestamp,cantidad,unidad,description_no_unit,price_numeric
Maíz Gigante Original Inka Corn Doypack 500 g,S/ 24.50,metro,MAÍZ REVENTÓN (POP CORN),2024-12-06 17:26:38.499632,500.0,g,Maíz Gigante Original Inka Corn Doypack,24.5
Maíz Gigante Inka Corn Original 100g,S/ 5.99,metro,MAÍZ REVENTÓN (POP CORN),2024-12-06 17:26:38.499632,100.0,g,Maíz Gigante Inka Corn Original,5.99
Maiz Gigante con Chocolate Inka Corn 100g,S/ 11.90,metro,MAÍZ REVENTÓN (POP CORN),2024-12-06 17:26:38.499632,100.0,g,Maiz Gigante con Chocolate Inka Corn,11.9
Maíz Pop Corn Costeño 500g,S/ 4.00,metro,MAÍZ REVENTÓN (POP CORN),2024-12-06 17:26:38.499632,500.0,g,Maíz Pop Corn Costeño,4.0
Maíz Morado Metro x kg,S/ 9.79 x kg,metro,MAÍZ REVENTÓN (POP CORN),2024-12-06 17:26:38.499632,1.0,kg,Maíz Morado Metro,9.79
Maíz Pop Corn Cuisine & Co 500g,S/ 3.50,metro,MAÍZ REVENTÓN (POP CORN),2024-12-06 17:26:38.499632,500.0,g,Maíz Pop Corn Cuisine & Co,3.5
Maíz Pop Corn Bolsa 350 g,S/ 3.80,metro,MAÍZ REVENTÓN (POP CORN),2024-12-06 17:26:38.499632,350.0,g,Maíz Pop Corn Bolsa,3.8
Maíz Pop Corn Máxima 500g,S/ 4.30,metro,MAÍZ REVENTÓN (POP CORN),2024-12-06 17:26:38.499632,500.0,g,Maíz Pop Corn Máxima,4.3
Maíz Dulce en Granos Fruto de Oro 425g,S/ 6.90,metro,MAÍZ REVENTÓN (POP CORN),2024-12-06 17:26:38.499632,425.0,g,Maíz Dulce en Granos Fruto de Oro,6.9
Maíz con Miel Vita Pluss Bolsa 140 g,S/ 3.90,metro,MAÍZ REVENTÓN (POP CORN),2024-12-06 17:26:38.499632,140.0,g,Maíz con Miel Vita Pluss Bolsa,3.9
Maíz Pop Corn Tesoro Del Campo Bolsa 500 g,S/ 4.95,metro,MAÍZ REVENTÓN (POP CORN),2024-12-06 17:26:38.499632,500.0,g,Maíz Pop Corn Tesoro Del Campo Bolsa,4.95
Maíz Pop Corn Valle Norte Bolsa 500 g,S/ 5.80,metro,MAÍZ REVENTÓN (POP CORN),2024-12-06 17:26:38.499632,500.0,g,Maíz Pop Corn Valle Norte Bolsa,5.8
Maíz Atómico Andino con Maca Forte Golpe 125g,S/ 3.70,metro,MAÍZ REVENTÓN (POP CORN),2024-12-06 17:26:38.499632,125.0,g,Maíz Atómico Andino con Maca Forte Golpe,3.7
Maíz Chulpi Desgranado Kuski Bolsa 425 g,S/ 14.90,metro,MAÍZ REVENTÓN (POP CORN),2024-12-06 17:26:38.499632,425.0,g,Maíz Chulpi Desgranado Kuski Bolsa,14.9
Maiz Pop Corn Paisana Bolsa 500 g,S/ 4.40,metro,MAÍZ REVENTÓN (POP CORN),2024-12-06 17:26:38.499632,500.0,g,Maiz Pop Corn Paisana Bolsa,4.4
Pop Corn Chicken Avinka 350g,S/ 13.99,metro,MAÍZ REVENTÓN (POP CORN),2024-12-06 17:26:38.499632,350.0,g,Pop Corn Chicken Avinka,13.99
Pop Corn Natural Act II Bolsa 80 g,S/ 4.60,metro,MAÍZ REVENTÓN (POP CORN),2024-12-06 17:26:38.499632,80.0,g,Pop Corn Natural Act II Bolsa,4.6
Chupete Globo Pop Surtido 24un,S/ 8.00,metro,MAÍZ REVENTÓN (POP CORN),2024-12-06 17:26:38.499632,24.0,un,Chupete Globo Pop Surtido,8.0
Pop Corn para Microondas Act II Sabor Mantequilla 91g,S/ 4.60,metro,MAÍZ REVENTÓN (POP CORN),2024-12-06 17:26:38.499632,91.0,g,Pop Corn para Microondas Act II Sabor Mantequilla,4.6
Chupete Globo Pop Neon Renovado Bolsa 24 Unidades,S/ 8.00,metro,MAÍZ REVENTÓN (POP CORN),2024-12-06 17:26:38.499632,24.0,un,Chupete Globo Pop Neon Renovado Bolsa ades,8.0
Pop Corn Butter Extra Act II 91g,S/ 4.60,metro,MAÍZ REVENTÓN (POP CORN),2024-12-06 17:26:38.499632,91.0,g,Pop Corn Butter Extra Act II,4.6
Chupetín Globo Pop Sabor Maracuyá 24un,S/ 8.00,metro,MAÍZ REVENTÓN (POP CORN),2024-12-06 17:26:38.499632,24.0,un,Chupetín Globo Pop Sabor Maracuyá,8.0
Pop Corn Natural Act II Pack 3 Unid,S/ 14.70,metro,MAÍZ REVENTÓN (POP CORN),2024-12-06 17:26:38.499632,3.0,un,Pop Corn Natural Act II Pack,14.7
Maiz Cuzco Frito y Salado Cuisine&Co Bolsa 100 g,S/ 4.70,metro,MAÍZ REVENTÓN (POP CORN),2024-12-06 17:26:38.499632,100.0,g,Maiz Cuzco Frito y Salado Cuisine&Co Bolsa,4.7
Pop Corn Butter Act II Pack 3 Unid,S/ 10.90,metro,MAÍZ REVENTÓN (POP CORN),2024-12-06 17:26:38.499632,3.0,un,Pop Corn Butter Act II Pack,10.9
Pop Corn Butter Light Act II Pack 3 Unid,S/ 10.90,metro,MAÍZ REVENTÓN (POP CORN),2024-12-06 17:26:38.499632,3.0,un,Pop Corn Butter Light Act II Pack,10.9
Chupete Globo Pop Fresa Bolsa 24 Undiades,S/ 8.00,metro,MAÍZ REVENTÓN (POP CORN),2024-12-06 17:26:38.499632,24.0,un,Chupete Globo Pop Fresa Bolsa diades,8.0
Chupete Globo Pop Leche y Chocolate Bolsa 24 Unidades,S/ 8.00,metro,MAÍZ REVENTÓN (POP CORN),2024-12-06 17:26:38.499632,24.0,un,Chupete Globo Pop Leche y Chocolate Bolsa ades,8.0
Chupete Globo Pop Yogurt Surtido Bolsa 24 Unidades,S/ 8.00,metro,MAÍZ REVENTÓN (POP CORN),2024-12-06 17:26:38.499632,24.0,un,Chupete Globo Pop Yogurt Surtido Bolsa ades,8.0
Chupetes Globo Pop Cereza Acida Bolsa 24 Unidades,S/ 8.00,metro,MAÍZ REVENTÓN (POP CORN),2024-12-06 17:26:38.499632,24.0,un,Chupetes Globo Pop Cereza Acida Bolsa ades,8.0
Chupete Globo Pop Maracuyá 25un,S/ 8.00,metro,MAÍZ REVENTÓN (POP CORN),2024-12-06 17:26:38.499632,25.0,un,Chupete Globo Pop Maracuyá,8.0
Chupete Globo Pop XXL 180 g,S/ 13.90,metro,MAÍZ REVENTÓN (POP CORN),2024-12-06 17:26:38.499632,1.0,l,Chupete Globo Pop X,13.9
Chupete Globo Pop Shake 24un.,S/ 7.80,metro,MAÍZ REVENTÓN (POP CORN),2024-12-06 17:26:38.499632,24.0,un,Chupete Globo Pop Shake .,7.8
Galletas de Maíz Horneadas Salmas 144g,S/ 8.50,metro,MAÍZ REVENTÓN (POP CORN),2024-12-06 17:26:38.499632,144.0,g,Galletas de Maíz Horneadas Salmas,8.5
Hojuelas de Maíz Kellogg's Corn Flakes 410g,S/ 13.00,metro,MAÍZ REVENTÓN (POP CORN),2024-12-06 17:26:38.499632,410.0,g,Hojuelas de Maíz Kellogg's Corn Flakes,13.0
Aceite de Canola Cuisine & Co Botella 1 lt,S/ 11.90,metro,MAÍZ REVENTÓN (POP CORN),2024-12-06 17:26:38.499632,1.0,l,Aceite de Canola Cuisine & Co Botella,11.9
Galletas de Maíz Horneadas Sin Gluten Salmas Sanissimo Caja 360 g,S/ 22.90,metro,MAÍZ REVENTÓN (POP CORN),2024-12-06 17:26:38.499632,360.0,g,Galletas de Maíz Horneadas Sin Gluten Salmas Sanissimo Caja,22.9
Aceite Girasol Huerto Alamein 900ml,S/ 12.80,metro,MAÍZ REVENTÓN (POP CORN),2024-12-06 17:26:38.499632,900.0,ml,Aceite Girasol Huerto Alamein,12.8
Twelvepack Galletas de Maíz Salmas Horneadas 18g,S/ 14.90,metro,MAÍZ REVENTÓN (POP CORN),2024-12-06 17:26:38.499632,18.0,g,Twelvepack Galletas de Maíz Salmas Horneadas,14.9
Cereal de Maíz Corn Flakes 405g,S/ 13.90,metro,MAÍZ REVENTÓN (POP CORN),2024-12-06 17:26:38.499632,405.0,g,Cereal de Maíz Corn Flakes,13.9
Aceite de Girasol Mucho Gussto 900ml,S/ 7.90,metro,MAÍZ REVENTÓN (POP CORN),2024-12-06 17:26:38.499632,900.0,ml,Aceite de Girasol Mucho Gussto,7.9
Galletas de Maíz Horneadas Salmas Granos y Semillas 126g,S/ 8.50,metro,MAÍZ REVENTÓN (POP CORN),2024-12-06 17:26:38.499632,126.0,g,Galletas de Maíz Horneadas Salmas Granos y Semillas,8.5
Tortillas de Maíz Saniito 12un,S/ 10.60,metro,MAÍZ REVENTÓN (POP CORN),2024-12-06 17:26:38.499632,12.0,un,Tortillas de Maíz Saniito,10.6
Galletas de Maíz Horneadas Salmitas Caja 80 g,S/ 5.20,metro,MAÍZ REVENTÓN (POP CORN),2024-12-06 17:26:38.499632,80.0,g,Galletas de Maíz Horneadas Salmitas Caja,5.2
Palitos de Maíz Cheese Tris Cheetos 120g,S/ 5.20,metro,MAÍZ REVENTÓN (POP CORN),2024-12-06 17:26:38.499632,120.0,g,Palitos de Maíz Cheese Tris Cheetos,5.2
Tortillas de Maíz Clásica Cuisine & Co Bolsa 150 g,S/ 4.90,metro,MAÍZ REVENTÓN (POP CORN),2024-12-06 17:26:38.499632,150.0,g,Tortillas de Maíz Clásica Cuisine & Co Bolsa,4.9
Galletas de Maíz Horneadas Salmas Maíz Morado 126g,S/ 8.50,metro,MAÍZ REVENTÓN (POP CORN),2024-12-06 17:26:38.499632,126.0,g,Galletas de Maíz Horneadas Salmas Maíz Morado,8.5
Aceite de Girasol Cuisine & Co 900ml,S/ 12.90,metro,MAÍZ REVENTÓN (POP CORN),2024-12-06 17:26:38.499632,900.0,ml,Aceite de Girasol Cuisine & Co,12.9
Aceite De Canola Borges Botella 1 Litro,S/ 16.50,metro,MAÍZ REVENTÓN (POP CORN),2024-12-06 17:26:38.499632,1.0,l,Aceite De Canola Borges Botella itro,16.5
Twopack Aceite de Girasol Monteagle 900ml,S/ 29.00,metro,MAÍZ REVENTÓN (POP CORN),2024-12-06 17:26:38.499632,900.0,ml,Twopack Aceite de Girasol Monteagle,29.0
Galletas de Maíz Horneadas Sin Gluten Salmas Sanissimo Caja 90 g,S/ 8.30,metro,MAÍZ REVENTÓN (POP CORN),2024-12-06 17:26:38.499632,90.0,g,Galletas de Maíz Horneadas Sin Gluten Salmas Sanissimo Caja,8.3
Harina de Maíz Amarillo P.A.N 1kg,S/ 8.50,metro,MAÍZ REVENTÓN (POP CORN),2024-12-06 17:26:38.499632,1.0,kg,Harina de Maíz Amarillo P.A.N,8.5
Aceite De Canola Borges Botella 2 Litros,S/ 28.50,metro,MAÍZ REVENTÓN (POP CORN),2024-12-06 17:26:38.499632,2.0,l,Aceite De Canola Borges Botella itros,28.5
Tortillas de Maíz Picante Cuisine & Co Bolsa 150 g,S/ 4.90,metro,MAÍZ REVENTÓN (POP CORN),2024-12-06 17:26:38.499632,150.0,g,Tortillas de Maíz Picante Cuisine & Co Bolsa,4.9
Tortilla de Maíz Tía Rosa 10un.,S/ 9.50,metro,MAÍZ REVENTÓN (POP CORN),2024-12-06 17:26:38.499632,10.0,un,Tortilla de Maíz Tía Rosa .,9.5
Hojuelas de Maíz Azucaradas Kellogg's Zucaritas 420g,S/ 16.90,metro,MAÍZ REVENTÓN (POP CORN),2024-12-06 17:26:38.499632,420.0,g,Hojuelas de Maíz Azucaradas Kellogg's Zucaritas,16.9
Hojuelas de Maíz Corn Flakes Kellogg's 200g,S/ 10.00,metro,MAÍZ REVENTÓN (POP CORN),2024-12-06 17:26:38.499632,200.0,g,Hojuelas de Maíz Corn Flakes Kellogg's,10.0
Hojuelas de Maíz Corn Flakes Cuisine & Co Caja 500 g,S/ 12.90,metro,MAÍZ REVENTÓN (POP CORN),2024-12-06 17:26:38.499632,500.0,g,Hojuelas de Maíz Corn Flakes Cuisine & Co Caja,12.9
"Aros de Maíz, Trigo y Avena Froot Loops Kellogg's 200g",S/ 11.90,metro,MAÍZ REVENTÓN (POP CORN),2024-12-06 17:26:38.499632,200.0,g,"Aros de Maíz, Trigo y Avena Froot Loops Kellogg's",11.9
Tortillas de Maíz Saniito 8un,S/ 11.60,metro,MAÍZ REVENTÓN (POP CORN),2024-12-06 17:26:38.499632,8.0,un,Tortillas de Maíz Saniito,11.6
Hojuelas de Maíz Azucaradas Kellogg's Zucaritas 260g,S/ 12.90,metro,MAÍZ REVENTÓN (POP CORN),2024-12-06 17:26:38.499632,260.0,g,Hojuelas de Maíz Azucaradas Kellogg's Zucaritas,12.9
Aceite Original Mazola Spray Lata 142 g,S/ 24.80,metro,MAÍZ REVENTÓN (POP CORN),2024-12-06 17:26:38.499632,142.0,g,Aceite Original Mazola Spray Lata,24.8
Tamal de Maíz Casa Verde 180g,S/ 5.70,metro,MAÍZ REVENTÓN (POP CORN),2024-12-06 17:26:38.499632,180.0,g,Tamal de Maíz Casa Verde,5.7
Hojuelas de Maíz Corn Flakes Cuisine & Co 200g,S/ 6.90,metro,MAÍZ REVENTÓN (POP CORN),2024-12-06 17:26:38.499632,200.0,g,Hojuelas de Maíz Corn Flakes Cuisine & Co,6.9
"Aros de Maíz, Trigo y Avena Froot Loops Kellogg's 350g",S/ 16.90,metro,MAÍZ REVENTÓN (POP CORN),2024-12-06 17:26:38.499632,350.0,g,"Aros de Maíz, Trigo y Avena Froot Loops Kellogg's",16.9
Talco Dr Zaidman Con Almidón de Maíz Talquera 600 g,S/ 34.20,metro,MAÍZ REVENTÓN (POP CORN),2024-12-06 17:26:38.499632,600.0,g,Talco Dr Zaidman Con Almidón de Maíz Talquera,34.2
Cereal de Maíz Azucarado Cuisine & Co Reggae Flakes 480g,S/ 10.90,metro,MAÍZ REVENTÓN (POP CORN),2024-12-06 17:26:38.499632,480.0,g,Cereal de Maíz Azucarado Cuisine & Co Reggae Flakes,10.9
Tortillas de Maíz Clásica Cuisine & Co Bolsa 65 g,S/ 2.80,metro,MAÍZ REVENTÓN (POP CORN),2024-12-06 17:26:38.499632,65.0,g,Tortillas de Maíz Clásica Cuisine & Co Bolsa,2.8
Aceite de Canola Wesson 1.18L,S/ 38.70,metro,MAÍZ REVENTÓN (POP CORN),2024-12-06 17:26:38.499632,1.18,l,Aceite de Canola Wesson,38.7
Cerveza Artesanal 7 Vidas Maíz Morado Pale Ale Botella 340ml,S/ 8.00,metro,MAÍZ REVENTÓN (POP CORN),2024-12-06 17:26:38.499632,340.0,ml,Cerveza Artesanal 7 Vidas Maíz Morado Pale Ale Botella,8.0
Palitos de Maíz Cheese Tris Cheetos 44g,S/ 2.50,metro,MAÍZ REVENTÓN (POP CORN),2024-12-06 17:26:38.499632,44.0,g,Palitos de Maíz Cheese Tris Cheetos,2.5
Talco Dr Zaidman Con Almidón de Maíz Talquera 200 g,S/ 16.30,metro,MAÍZ REVENTÓN (POP CORN),2024-12-06 17:26:38.499632,200.0,g,Talco Dr Zaidman Con Almidón de Maíz Talquera,16.3
Palitos de Maíz Cheese Tris 42g,S/ 2.70,metro,MAÍZ REVENTÓN (POP CORN),2024-12-06 17:26:38.499632,42.0,g,Palitos de Maíz Cheese Tris,2.7
Harina de Maíz Blanco Precocida Doñarepa 1kg,S/ 9.80,metro,MAÍZ REVENTÓN (POP CORN),2024-12-06 17:26:38.499632,1.0,kg,Harina de Maíz Blanco Precocida Doñarepa,9.8
Barra Energética Siete Dragones Aguaymanto & Maíz Morado 5un,S/ 19.90,metro,MAÍZ REVENTÓN (POP CORN),2024-12-06 17:26:38.499632,5.0,un,Barra Energética Siete Dragones Aguaymanto & Maíz Morado,19.9
Sixpack Cerveza de Maíz Tres Cruces Pum Pum Lata 310ml,S/ 17.90,metro,MAÍZ REVENTÓN (POP CORN),2024-12-06 17:26:38.499632,310.0,ml,Sixpack Cerveza de Maíz Tres Cruces Pum Pum Lata,17.9
Palitos de Maíz Cuisine & Co 180g,S/ 5.50,metro,MAÍZ REVENTÓN (POP CORN),2024-12-06 17:26:38.499632,180.0,g,Palitos de Maíz Cuisine & Co,5.5
Tortillas de Maíz Picante Cuisine & Co Bolsa 65 g,S/ 2.80,metro,MAÍZ REVENTÓN (POP CORN),2024-12-06 17:26:38.499632,65.0,g,Tortillas de Maíz Picante Cuisine & Co Bolsa,2.8
Jarabe de Maíz Glucofácil Spitze Botella 680 g,S/ 25.12,metro,MAÍZ REVENTÓN (POP CORN),2024-12-06 17:26:38.499632,680.0,g,Jarabe de Maíz Glucofácil Spitze Botella,25.12
Tortilla de Maíz Cuisine & Co Torti Hot 200g,S/ 8.90,metro,MAÍZ REVENTÓN (POP CORN),2024-12-06 17:26:38.499632,200.0,g,Tortilla de Maíz Cuisine & Co Torti Hot,8.9
Pack x2 Tortilla de Maíz Tía Rosa Paquete 255g,S/ 23.40,metro,MAÍZ REVENTÓN (POP CORN),2024-12-06 17:26:38.499632,255.0,g,Pack x2 Tortilla de Maíz Tía Rosa Paquete,23.4
Pack x4 Sixpack Cerveza de Maíz Tres Cruces Pum Pum Lata 310ml,S/ 66.90,metro,MAÍZ REVENTÓN (POP CORN),2024-12-06 17:26:38.499632,310.0,ml,Pack x4 Sixpack Cerveza de Maíz Tres Cruces Pum Pum Lata,66.9
Cereal de Maíz Trix 90g,S/ 5.00,metro,MAÍZ REVENTÓN (POP CORN),2024-12-06 17:26:38.499632,90.0,g,Cereal de Maíz Trix,5.0
Aceite De Girasol Borges Botella 1 L,S/ 14.50,metro,MAÍZ REVENTÓN (POP CORN),2024-12-06 17:26:38.499632,1.0,l,Aceite De Girasol Borges Botella,14.5
Pack x4 Sixpack Cerveza de Maíz Pum Pum Lata 473ml,S/ 92.90,metro,MAÍZ REVENTÓN (POP CORN),2024-12-06 17:26:38.499632,473.0,ml,Pack x4 Sixpack Cerveza de Maíz Pum Pum Lata,92.9
Tortillas de Maíz Cuisine & Co Sabor Queso 180g,S/ 7.90,metro,MAÍZ REVENTÓN (POP CORN),2024-12-06 17:26:38.499632,180.0,g,Tortillas de Maíz Cuisine & Co Sabor Queso,7.9
Sopa de Maíz Dulce Auga 430g,S/ 19.50,metro,MAÍZ REVENTÓN (POP CORN),2024-12-06 17:26:38.499632,430.0,g,Sopa de Maíz Dulce Auga,19.5
Aceite de Girasol Monteagle 900ml,S/ 9.90,metro,MAÍZ REVENTÓN (POP CORN),2024-12-06 17:26:38.499632,900.0,ml,Aceite de Girasol Monteagle,9.9
Harina de Maiz Blanco Precocida P.A.N Contenido 1 kg,S/ 8.50,metro,MAÍZ REVENTÓN (POP CORN),2024-12-06 17:26:38.499632,1.0,kg,Harina de Maiz Blanco Precocida P.A.N Contenido,8.5
Cereal Fruta Aros Maiz Cereal Angel Bolsa 420 g,S/ 13.50,metro,MAÍZ REVENTÓN (POP CORN),2024-12-06 17:26:38.499632,420.0,g,Cereal Fruta Aros Maiz Cereal Angel Bolsa,13.5
Papa Blanca Yungay Metro x kg,S/ 2.99 x kg,metro,MAÍZ REVENTÓN (POP CORN),2024-12-06 17:26:38.499632,1.0,kg,Papa Blanca Yungay Metro,2.99
Papa Amarilla Peruanita Procesada Metro x kg,S/ 8.49 x kg,metro,MAÍZ REVENTÓN (POP CORN),2024-12-06 17:26:38.499632,1.0,kg,Papa Amarilla Peruanita Procesada Metro,8.49
Papa Amarilla Huamantanga Metro x kg,S/ 6.99 x kg,metro,MAÍZ REVENTÓN (POP CORN),2024-12-06 17:26:38.499632,1.0,kg,Papa Amarilla Huamantanga Metro,6.99
Papa Canchán Procesada Especial x kg,S/ 3.29 x kg,metro,MAÍZ REVENTÓN (POP CORN),2024-12-06 17:26:38.499632,1.0,kg,Papa Canchán Procesada Especial,3.29
Papa Amarilla Tumbay Procesada x kg,S/ 8.09 x kg,metro,MAÍZ REVENTÓN (POP CORN),2024-12-06 17:26:38.499632,1.0,kg,Papa Amarilla Tumbay Procesada,8.09
Camote Morado Metro x kg,S/ 2.79 x kg,metro,MAÍZ REVENTÓN (POP CORN),2024-12-06 17:26:38.499632,1.0,kg,Camote Morado Metro,2.79
Camote Morado Meza x kg,S/ 2.79 x kg,metro,MAÍZ REVENTÓN (POP CORN),2024-12-06 17:26:38.499632,1.0,kg,Camote Morado Meza,2.79
