description,brand,price,website,search_term,scrape_timestamp,cantidad,unidad,description_no_unit,price_numeric
Carne Molida Light EL BUEN CORTE x kg,EL BUEN CORTE,S/ 36.50,vivanda,CARNE PARA GUISO DE VACUNO,2024-12-05 21:40:20.776598,1.0,kg,Carne Molida Light EL BUEN CORTE,36.5
Carne Molida EL BUEN CORTE x kg,EL BUEN CORTE,S/ 25.00,vivanda,CARNE PARA GUISO DE VACUNO,2024-12-05 21:40:20.776598,1.0,kg,Carne Molida EL BUEN CORTE,25.0
Carne para Lomo Saltado EL BUEN CORTE x kg,EL BUEN CORTE,S/ 45.00,vivanda,CARNE PARA GUISO DE VACUNO,2024-12-05 21:40:20.776598,1.0,kg,Carne para Lomo Saltado EL BUEN CORTE,45.0
Carne Molida de Pavita x 500g,VIVANDA,S/ 15.90,vivanda,CARNE PARA GUISO DE VACUNO,2024-12-05 21:40:20.776598,500.0,g,Carne Molida de Pavita x,15.9
Guiso EL BUEN CORTE x kg,EL BUEN CORTE,S/ 34.50,vivanda,CARNE PARA GUISO DE VACUNO,2024-12-05 21:40:20.776598,1.0,kg,Guiso EL BUEN CORTE,34.5
Carne Molida de Cerdo SAN FERNANDO Paquete 500g,SAN FERNANDO,S/ 15.50,vivanda,CARNE PARA GUISO DE VACUNO,2024-12-05 21:40:20.776598,500.0,g,Carne Molida de Cerdo SAN FERNANDO Paquete,15.5
Guiso EL BUEN CORTE x kg,EL BUEN CORTE,S/ 41.90,vivanda,CARNE PARA GUISO DE VACUNO,2024-12-05 21:40:20.776598,1.0,kg,Guiso EL BUEN CORTE,41.9
Guiso Especial FRIGON x Kg,FRIGON,S/ 36.60,vivanda,CARNE PARA GUISO DE VACUNO,2024-12-05 21:40:20.776598,1.0,kg,Guiso Especial FRIGON,36.6
Lunch Picante de Carne con Arroz LA FLORENCIA 450g,LA FLORENCIA,S/ 10.90,vivanda,CARNE PARA GUISO DE VACUNO,2024-12-05 21:40:20.776598,450.0,g,Lunch Picante de Carne con Arroz LA FLORENCIA,10.9
Empanada de Carne LA FLORENCIA Paquete 4un,LA FLORENCIA,S/ 13.20,vivanda,CARNE PARA GUISO DE VACUNO,2024-12-05 21:40:20.776598,4.0,un,Empanada de Carne LA FLORENCIA Paquete,13.2
Hamburguesa de Carne La Casera SAN FERNANDO Bolsa 910g,SAN FERNANDO,S/ 12.60,vivanda,CARNE PARA GUISO DE VACUNO,2024-12-05 21:40:20.776598,910.0,g,Hamburguesa de Carne La Casera SAN FERNANDO Bolsa,12.6
Salsa de Carne DON ITALO Pote 250g,DON ITALO,S/ 19.70,vivanda,CARNE PARA GUISO DE VACUNO,2024-12-05 21:40:20.776598,250.0,g,Salsa de Carne DON ITALO Pote,19.7
Ravioles de Carne y Verdura BELL'S Paquete 500g,BELL'S,S/ 10.90,vivanda,CARNE PARA GUISO DE VACUNO,2024-12-05 21:40:20.776598,500.0,g,Ravioles de Carne y Verdura BELL'S Paquete,10.9
Caldo en cubitos MAGGI Sabor carne Caja 75.2Gr,MAGGI,S/ 4.50,vivanda,CARNE PARA GUISO DE VACUNO,2024-12-05 21:40:20.776598,75.2,g,Caldo en cubitos MAGGI Sabor carne Caja r,4.5
Caldo de Carne DOÑA GUSTA Concentrado en Polvo Caja 42g,DOÑA GUSTA,S/ 2.20,vivanda,CARNE PARA GUISO DE VACUNO,2024-12-05 21:40:20.776598,42.0,g,Caldo de Carne DOÑA GUSTA Concentrado en Polvo Caja,2.2
Empanada de Carne LA FLORENCIA 1un,LA FLORENCIA,S/ 3.70,vivanda,CARNE PARA GUISO DE VACUNO,2024-12-05 21:40:20.776598,1.0,un,Empanada de Carne LA FLORENCIA,3.7
Sopa Instántanea AJINOMEN Sabor a Carne Bolsa 80g,AJINOMEN,S/ 1.60,vivanda,CARNE PARA GUISO DE VACUNO,2024-12-05 21:40:20.776598,80.0,g,Sopa Instántanea AJINOMEN Sabor a Carne Bolsa,1.6
Caldo MAGGI Cubito Sabor Carne 100g Paquete 25un,MAGGI,S/ 5.50,vivanda,CARNE PARA GUISO DE VACUNO,2024-12-05 21:40:20.776598,100.0,g,Caldo MAGGI Cubito Sabor Carne  Paquete,5.5
Comida para Perros DOG CHOW Adultos razas Pequeñas Carne y Pollo Bolsa 8kg,DOG CHOW,S/ 120.10,vivanda,CARNE PARA GUISO DE VACUNO,2024-12-05 21:40:20.776598,8.0,kg,Comida para Perros DOG CHOW Adultos razas Pequeñas Carne y Pollo Bolsa,120.1
Hamburguesa BEST MEATS Carne Angus Caja 4un,BEST MEATS,S/ 60.00,vivanda,CARNE PARA GUISO DE VACUNO,2024-12-05 21:40:20.776598,4.0,un,Hamburguesa BEST MEATS Carne Angus Caja,60.0
Ravioles de Carne LA FLORENCIA 24un,LA FLORENCIA,S/ 14.20,vivanda,CARNE PARA GUISO DE VACUNO,2024-12-05 21:40:20.776598,24.0,un,Ravioles de Carne LA FLORENCIA,14.2
Lasagna DON ITALO de Carne Caja 1Kg,DON ITALO,S/ 58.20,vivanda,CARNE PARA GUISO DE VACUNO,2024-12-05 21:40:20.776598,1.0,kg,Lasagna DON ITALO de Carne Caja,58.2
Ravioles DON ITALO De carne Bandeja 500Gr,DON ITALO,S/ 32.50,vivanda,CARNE PARA GUISO DE VACUNO,2024-12-05 21:40:20.776598,500.0,g,Ravioles DON ITALO De carne Bandeja r,32.5
Sopa Ramen NISSIN Sabor Carne Bolsa 85g,NISSIN,S/ 2.20,vivanda,CARNE PARA GUISO DE VACUNO,2024-12-05 21:40:20.776598,85.0,g,Sopa Ramen NISSIN Sabor Carne Bolsa,2.2
Menestrón con Carne de Res en Semiconserva 750g,LA FLORENCIA,S/ 12.90,vivanda,CARNE PARA GUISO DE VACUNO,2024-12-05 21:40:20.776598,750.0,g,Menestrón con Carne de Res en Semiconserva,12.9
Sopa Instantánea AJINOMEN sabor a Carne Vaso 51g,AJINOMEN,S/ 3.50,vivanda,CARNE PARA GUISO DE VACUNO,2024-12-05 21:40:20.776598,51.0,g,Sopa Instantánea AJINOMEN sabor a Carne Vaso,3.5
Snacks para Perros DOGUITOS Medallones de Carne Pouch 65g,DOGUITOS,S/ 8.50,vivanda,CARNE PARA GUISO DE VACUNO,2024-12-05 21:40:20.776598,65.0,g,Snacks para Perros DOGUITOS Medallones de Carne Pouch,8.5
"Comida para Perros DOG CHOW Adultos todos los tamaños Carne, Pollo y Pescado Bolsa 8kg",DOG CHOW,S/ 124.80,vivanda,CARNE PARA GUISO DE VACUNO,2024-12-05 21:40:20.776598,8.0,kg,"Comida para Perros DOG CHOW Adultos todos los tamaños Carne, Pollo y Pescado Bolsa",124.8
Comida para Perros DOG CHOW Adultos razas Medianas y Grandes Carne y Pollo Bolsa 8kg,DOG CHOW,S/ 120.10,vivanda,CARNE PARA GUISO DE VACUNO,2024-12-05 21:40:20.776598,8.0,kg,Comida para Perros DOG CHOW Adultos razas Medianas y Grandes Carne y Pollo Bolsa,120.1
Comida para Perros DOG CHOW Adultos todos los tamaños Carne y Pollo Bolsa 3kg,DOG CHOW,S/ 44.60,vivanda,CARNE PARA GUISO DE VACUNO,2024-12-05 21:40:20.776598,3.0,kg,Comida para Perros DOG CHOW Adultos todos los tamaños Carne y Pollo Bolsa,44.6
"Comida para Perros DOG CHOW Cachorros Medianos y Grandes Carne, Pollo, Verduras y Leche Bolsa 3kg",DOG CHOW,S/ 44.60,vivanda,CARNE PARA GUISO DE VACUNO,2024-12-05 21:40:20.776598,3.0,kg,"Comida para Perros DOG CHOW Cachorros Medianos y Grandes Carne, Pollo, Verduras y Leche Bolsa",44.6
Sopa de Carne BELL'S Vaso 65g,BELL'S,S/ 1.90,vivanda,CARNE PARA GUISO DE VACUNO,2024-12-05 21:40:20.776598,65.0,g,Sopa de Carne BELL'S Vaso,1.9
Sopa Instántanea de Carne AJINOMEN Vaso 51g,AJINOMEN,S/ 3.50,vivanda,CARNE PARA GUISO DE VACUNO,2024-12-05 21:40:20.776598,51.0,g,Sopa Instántanea de Carne AJINOMEN Vaso,3.5
Mini Hamburguesas BEST MEATS Carne Angus Caja 600g,BEST MEATS,S/ 58.10,vivanda,CARNE PARA GUISO DE VACUNO,2024-12-05 21:40:20.776598,600.0,g,Mini Hamburguesas BEST MEATS Carne Angus Caja,58.1
Lasagna de Carne IL PASTIFICIO Bandeja 380g,IL PASTIFICIO,S/ 17.99,vivanda,CARNE PARA GUISO DE VACUNO,2024-12-05 21:40:20.776598,380.0,g,Lasagna de Carne IL PASTIFICIO Bandeja,17.99
Hamburguesa de Carne La Super SAN FERNANDO Bolsa 850g,SAN FERNANDO,S/ 12.70,vivanda,CARNE PARA GUISO DE VACUNO,2024-12-05 21:40:20.776598,850.0,g,Hamburguesa de Carne La Super SAN FERNANDO Bolsa,12.7
Lasagna de Carne IL PASTIFICIO Bandeja 500g,IL PASTIFICIO,S/ 30.90,vivanda,CARNE PARA GUISO DE VACUNO,2024-12-05 21:40:20.776598,500.0,g,Lasagna de Carne IL PASTIFICIO Bandeja,30.9
Chifles Cancha y Carne Seca EL ARTESANO Artichay Bolsa 250g,EL ARTESANO,S/ 16.00,vivanda,CARNE PARA GUISO DE VACUNO,2024-12-05 21:40:20.776598,250.0,g,Chifles Cancha y Carne Seca EL ARTESANO Artichay Bolsa,16.0
Ravioles de Carne DELLA NONA Bolsa 500g,DELLA NONNA,S/ 21.50,vivanda,CARNE PARA GUISO DE VACUNO,2024-12-05 21:40:20.776598,500.0,g,Ravioles de Carne DELLA NONA Bolsa,21.5
Lasagna de Carne EL FIORENTINO Bandeja 500g,EL FIORENTINO,S/ 21.40,vivanda,CARNE PARA GUISO DE VACUNO,2024-12-05 21:40:20.776598,500.0,g,Lasagna de Carne EL FIORENTINO Bandeja,21.4
"Alimento para Perros PURINA ONE Adultos Carne, Pollo y Cordero Doypack 85g",PURINA ONE,S/ 7.80,vivanda,CARNE PARA GUISO DE VACUNO,2024-12-05 21:40:20.776598,85.0,g,"Alimento para Perros PURINA ONE Adultos Carne, Pollo y Cordero Doypack",7.8
Comida para gatos RICOCAT Gatitos carne pescado y leche Bolsa 1Kg,RICOCAT,S/ 14.50,vivanda,CARNE PARA GUISO DE VACUNO,2024-12-05 21:40:20.776598,1.0,kg,Comida para gatos RICOCAT Gatitos carne pescado y leche Bolsa,14.5
Comida para Gatitos PURINA ONE Toda Razas Carne Bolsa 2Kg,PURINA ONE,S/ 78.80,vivanda,CARNE PARA GUISO DE VACUNO,2024-12-05 21:40:20.776598,2.0,kg,Comida para Gatitos PURINA ONE Toda Razas Carne Bolsa,78.8
Tuco con Carne B&D Frasco 230g,B&D,S/ 7.30,vivanda,CARNE PARA GUISO DE VACUNO,2024-12-05 21:40:20.776598,230.0,g,Tuco con Carne B&D Frasco,7.3
Comida para Perros PURINA ONE Cachorros Toda Razas Pollo Carne Bolsa 2Kg,PURINA ONE,S/ 61.10,vivanda,CARNE PARA GUISO DE VACUNO,2024-12-05 21:40:20.776598,2.0,kg,Comida para Perros PURINA ONE Cachorros Toda Razas Pollo Carne Bolsa,61.1
Comida para Gatos FELIX Sensaciones de Carne en Salsa Pouch 85g,FELIX,S/ 4.80,vivanda,CARNE PARA GUISO DE VACUNO,2024-12-05 21:40:20.776598,85.0,g,Comida para Gatos FELIX Sensaciones de Carne en Salsa Pouch,4.8
Sopa instantánea MARUCHAN Carne Bolsa 85g,MARUCHAN,S/ 3.40,vivanda,CARNE PARA GUISO DE VACUNO,2024-12-05 21:40:20.776598,85.0,g,Sopa instantánea MARUCHAN Carne Bolsa,3.4
