description,price,website,search_term,scrape_timestamp,cantidad,unidad,description_no_unit,price_numeric
Gallina Entera Con Menudencia Importada x Kg,S/ 8.90 x kg,metro,GALLINA EVISCERADA,2024-12-07 19:53:52.019970,1.0,kg,Gallina Entera Con Menudencia Importada,8.9
Cubito Sazonador Gallina Blanca Caldo Vegetal 8un,S/ 6.50,metro,GALLINA EVISCERADA,2024-12-07 19:53:52.019970,8.0,un,Cubito Sazonador Gallina Blanca Caldo Vegetal,6.5
Salsa Bechamel Instantánea Gallina Blanca 39g,S/ 5.60,metro,GALLINA EVISCERADA,2024-12-07 19:53:52.019970,39.0,g,Salsa Bechamel Instantánea Gallina Blanca,5.6
Caldo Casero de Verduras Gallina Blanca 1L,S/ 12.90,metro,GALLINA EVISCERADA,2024-12-07 19:53:52.019970,1.0,l,Caldo Casero de Verduras Gallina Blanca,12.9
Salsa de Champiñones Instantánea Gallina Blanca 24g,S/ 9.60,metro,GALLINA EVISCERADA,2024-12-07 19:53:52.019970,24.0,g,Salsa de Champiñones Instantánea Gallina Blanca,9.6
Caldo de Pollo Gallina Blanca 1L,S/ 9.30,metro,GALLINA EVISCERADA,2024-12-07 19:53:52.019970,1.0,l,Caldo de Pollo Gallina Blanca,9.3
Caldo para Paella de Mariscos Gallina Blanca 1L,S/ 19.50,metro,GALLINA EVISCERADA,2024-12-07 19:53:52.019970,1.0,l,Caldo para Paella de Mariscos Gallina Blanca,19.5
Sopa de Verduras Instantánea Gallina Blanca 51g,S/ 8.40,metro,GALLINA EVISCERADA,2024-12-07 19:53:52.019970,51.0,g,Sopa de Verduras Instantánea Gallina Blanca,8.4
Crema de Espárragos Instantánea Gallina Blanca 70g,S/ 8.40,metro,GALLINA EVISCERADA,2024-12-07 19:53:52.019970,70.0,g,Crema de Espárragos Instantánea Gallina Blanca,8.4
Crema de Champiñones Instantánea Gallina Blanca 62g,S/ 8.40,metro,GALLINA EVISCERADA,2024-12-07 19:53:52.019970,62.0,g,Crema de Champiñones Instantánea Gallina Blanca,8.4
Caldo de Pescado Gallina Blanca 1L,S/ 14.90,metro,GALLINA EVISCERADA,2024-12-07 19:53:52.019970,1.0,l,Caldo de Pescado Gallina Blanca,14.9
Cubito Sazonador Gallina Blanca Caldo de Pescado 8un,S/ 7.50,metro,GALLINA EVISCERADA,2024-12-07 19:53:52.019970,8.0,un,Cubito Sazonador Gallina Blanca Caldo de Pescado,7.5
Caldo de Carne Gallina Blanca 1L,S/ 9.30,metro,GALLINA EVISCERADA,2024-12-07 19:53:52.019970,1.0,l,Caldo de Carne Gallina Blanca,9.3
Salsa Roquefort Instantánea Gallina Blanca 23g,S/ 11.70,metro,GALLINA EVISCERADA,2024-12-07 19:53:52.019970,23.0,g,Salsa Roquefort Instantánea Gallina Blanca,11.7
Pack Gallina Pintadita: Shampoo 300ml + Colonia 120ml + Jabón 85g,S/ 23.90,metro,GALLINA EVISCERADA,2024-12-07 19:53:52.019970,300.0,ml,Pack Gallina Pintadita: Shampoo  + Colonia  + Jabón,23.9
Huevos Gallinas Libres 12un,S/ 15.90,metro,GALLINA EVISCERADA,2024-12-07 19:53:52.019970,12.0,un,Huevos Gallinas Libres,15.9
Concentrado en Polvo Doña Gusta Sabor Gallina 6un,S/ 2.20,metro,GALLINA EVISCERADA,2024-12-07 19:53:52.019970,6.0,un,Concentrado en Polvo Doña Gusta Sabor Gallina,2.2
Sopa Instantánea Ajinomen Sabor Gallina 80g,S/ 1.60,metro,GALLINA EVISCERADA,2024-12-07 19:53:52.019970,80.0,g,Sopa Instantánea Ajinomen Sabor Gallina,1.6
Trucha Entera Eviscerada x kg,S/ 18.90 x kg,metro,GALLINA EVISCERADA,2024-12-07 19:53:52.019970,1.0,kg,Trucha Entera Eviscerada,18.9
Sopa Instantánea Ajinomen Sabor Gallina Picante 80g,S/ 1.60,metro,GALLINA EVISCERADA,2024-12-07 19:53:52.019970,80.0,g,Sopa Instantánea Ajinomen Sabor Gallina Picante,1.6
Cubito Sazonador Maggi Sabor Gallina 8un,S/ 4.50,metro,GALLINA EVISCERADA,2024-12-07 19:53:52.019970,8.0,un,Cubito Sazonador Maggi Sabor Gallina,4.5
Cubito Sazonador Maggi Sabor Gallina 25un,S/ 5.60,metro,GALLINA EVISCERADA,2024-12-07 19:53:52.019970,25.0,un,Cubito Sazonador Maggi Sabor Gallina,5.6
Sopa de Gallina Criolla con Fideos Ajinomen Sobre 80 g,S/ 1.60,metro,GALLINA EVISCERADA,2024-12-07 19:53:52.019970,80.0,g,Sopa de Gallina Criolla con Fideos Ajinomen Sobre,1.6
Sopa Instantánea Sabor a Gallina Ajinomen Vaso 51 g,S/ 3.50,metro,GALLINA EVISCERADA,2024-12-07 19:53:52.019970,51.0,g,Sopa Instantánea Sabor a Gallina Ajinomen Vaso,3.5
Trucha Entera Eviscerada Cuisine & Co 700g,S/ 22.90,metro,GALLINA EVISCERADA,2024-12-07 19:53:52.019970,700.0,g,Trucha Entera Eviscerada Cuisine & Co,22.9
Sopa con Fideos Instantánea Ajinomen Sabor Gallina Light 80g,S/ 1.60,metro,GALLINA EVISCERADA,2024-12-07 19:53:52.019970,80.0,g,Sopa con Fideos Instantánea Ajinomen Sabor Gallina Light,1.6
Sopa Instantánea Sabor a Gallina Picante Ajinomen Vaso 51 g,S/ 3.50,metro,GALLINA EVISCERADA,2024-12-07 19:53:52.019970,51.0,g,Sopa Instantánea Sabor a Gallina Picante Ajinomen Vaso,3.5
Base para Ají de Gallina Provenzal Sobre 100 g,S/ 8.99,metro,GALLINA EVISCERADA,2024-12-07 19:53:52.019970,100.0,g,Base para Ají de Gallina Provenzal Sobre,8.99
Sopa Instantánea Maggi Sopa Criolla Sabor Gallina con Fideos 60g,S/ 3.80,metro,GALLINA EVISCERADA,2024-12-07 19:53:52.019970,60.0,g,Sopa Instantánea Maggi Sopa Criolla Sabor Gallina con Fideos,3.8
Tilapia Entera Eviscerada Sin Escamas x kg,S/ 16.90 x kg,metro,GALLINA EVISCERADA,2024-12-07 19:53:52.019970,1.0,kg,Tilapia Entera Eviscerada Sin Escamas,16.9
Sopa Instantánea Sabor Gallina Maruchan 64g,S/ 4.50,metro,GALLINA EVISCERADA,2024-12-07 19:53:52.019970,64.0,g,Sopa Instantánea Sabor Gallina Maruchan,4.5
Aji de gallina con arroz Nadú Caja 340 g,S/ 14.90,metro,GALLINA EVISCERADA,2024-12-07 19:53:52.019970,340.0,g,Aji de gallina con arroz Nadú Caja,14.9
Ají de Gallina con Arroz Blanco Cuisine & Co 400g,S/ 12.50,metro,GALLINA EVISCERADA,2024-12-07 19:53:52.019970,400.0,g,Ají de Gallina con Arroz Blanco Cuisine & Co,12.5
Cubo Sabor Gallina Maggi 18.8g,S/ 18.80,metro,GALLINA EVISCERADA,2024-12-07 19:53:52.019970,18.8,g,Cubo Sabor Gallina Maggi,18.8
Trucha Entera Extra Eviscerada x kg,S/ 24.50 x kg,metro,GALLINA EVISCERADA,2024-12-07 19:53:52.019970,1.0,kg,Trucha Entera Extra Eviscerada,24.5
Galletas San Jorge Soda Pack 7un,S/ 3.90,metro,GALLINA EVISCERADA,2024-12-07 19:53:52.019970,7.0,un,Galletas San Jorge Soda Pack,3.9
Galletas de Maíz Horneadas Salmas 144g,S/ 8.50,metro,GALLINA EVISCERADA,2024-12-07 19:53:52.019970,144.0,g,Galletas de Maíz Horneadas Salmas,8.5
Galletas Danesas Christmas Special Lata 340g,S/ 12.90,metro,GALLINA EVISCERADA,2024-12-07 19:53:52.019970,340.0,g,Galletas Danesas Christmas Special Lata,12.9
Galletas Saladitas Cuisine & Co Pack 6un 46g,S/ 3.95,metro,GALLINA EVISCERADA,2024-12-07 19:53:52.019970,6.0,un,Galletas Saladitas Cuisine & Co Pack,3.95
Galletas Animalitos Vainilla Bolsa 500 g,S/ 5.50,metro,GALLINA EVISCERADA,2024-12-07 19:53:52.019970,500.0,g,Galletas Animalitos Vainilla Bolsa,5.5
Galletas de Maíz Horneadas Sin Gluten Salmas Sanissimo Caja 360 g,S/ 22.90,metro,GALLINA EVISCERADA,2024-12-07 19:53:52.019970,360.0,g,Galletas de Maíz Horneadas Sin Gluten Salmas Sanissimo Caja,22.9
Galleta Soda Gourmet San Jorge Paquete 41.6 g Pack 6 unid,S/ 3.50,metro,GALLINA EVISCERADA,2024-12-07 19:53:52.019970,41.6,g,Galleta Soda Gourmet San Jorge Paquete  Pack,3.5
Galletas Vainiya Costa Pack 6 Unid x 32 g,S/ 4.10,metro,GALLINA EVISCERADA,2024-12-07 19:53:52.019970,6.0,un,Galletas Vainiya Costa Pack  x,4.1
Galletas de Arroz Clásicas Sin Gluten Costeño Doypack 150 g,S/ 6.90,metro,GALLINA EVISCERADA,2024-12-07 19:53:52.019970,150.0,g,Galletas de Arroz Clásicas Sin Gluten Costeño Doypack,6.9
Galletas Field Sabor Vainilla Family Size 148g,S/ 2.60,metro,GALLINA EVISCERADA,2024-12-07 19:53:52.019970,148.0,g,Galletas Field Sabor Vainilla Family Size,2.6
Galletas Saladitas Integrales Cuisine & Co Pack 6un 46g,S/ 3.95,metro,GALLINA EVISCERADA,2024-12-07 19:53:52.019970,6.0,un,Galletas Saladitas Integrales Cuisine & Co Pack,3.95
Galletas Integrackers Integrackers Miel 30g 9un,S/ 7.50,metro,GALLINA EVISCERADA,2024-12-07 19:53:52.019970,30.0,g,Galletas Integrackers Integrackers Miel,7.5
Galletas Soda Cuisine & Co Pack 6 unid 40 gr,S/ 3.95,metro,GALLINA EVISCERADA,2024-12-07 19:53:52.019970,6.0,un,Galletas Soda Cuisine & Co Pack  r,3.95
Galletas Saladas Cream Crackers 258g,S/ 6.60,metro,GALLINA EVISCERADA,2024-12-07 19:53:52.019970,258.0,g,Galletas Saladas Cream Crackers,6.6
Galletas Frac Costa Clásica Pack 6 Unid x 45.5 g,S/ 4.60,metro,GALLINA EVISCERADA,2024-12-07 19:53:52.019970,6.0,un,Galletas Frac Costa Clásica Pack  x,4.6
Galletas Sabor Vainilla Munición Bolsa 450 g,S/ 6.70,metro,GALLINA EVISCERADA,2024-12-07 19:53:52.019970,450.0,g,Galletas Sabor Vainilla Munición Bolsa,6.7
Galletas con Quinua y Frutos Rojos Incasur Caja 6 unid Bolsa 30 gr,S/ 7.90,metro,GALLINA EVISCERADA,2024-12-07 19:53:52.019970,6.0,un,Galletas con Quinua y Frutos Rojos Incasur Caja  Bolsa r,7.9
Galletas Morochas Fiesta 20un,S/ 8.90,metro,GALLINA EVISCERADA,2024-12-07 19:53:52.019970,20.0,un,Galletas Morochas Fiesta,8.9
Galletas Salmas Camote y Zanahoria 126g,S/ 8.50,metro,GALLINA EVISCERADA,2024-12-07 19:53:52.019970,126.0,g,Galletas Salmas Camote y Zanahoria,8.5
Galletas Animalitos 60g,S/ 1.00,metro,GALLINA EVISCERADA,2024-12-07 19:53:52.019970,60.0,g,Galletas Animalitos,1.0
Galletas Saladas Jamón Ahumado Crackelet Costa Bolsa 150 gr,S/ 3.90,metro,GALLINA EVISCERADA,2024-12-07 19:53:52.019970,150.0,g,Galletas Saladas Jamón Ahumado Crackelet Costa Bolsa r,3.9
Galletas de Mantequilla Cuisine & Co 340g,S/ 12.90,metro,GALLINA EVISCERADA,2024-12-07 19:53:52.019970,340.0,g,Galletas de Mantequilla Cuisine & Co,12.9
Galletas Dulces Chaplin 90g,S/ 3.70,metro,GALLINA EVISCERADA,2024-12-07 19:53:52.019970,90.0,g,Galletas Dulces Chaplin,3.7
Galletas Soda San Jorge Paquete 75 g,S/ 1.80,metro,GALLINA EVISCERADA,2024-12-07 19:53:52.019970,75.0,g,Galletas Soda San Jorge Paquete,1.8
Galletas Surtidas Colombina Feliz Navidad 150g Surtido,S/ 4.00,metro,GALLINA EVISCERADA,2024-12-07 19:53:52.019970,150.0,g,Galletas Surtidas Colombina Feliz Navidad  Surtido,4.0
Galletas Ricocrack Multisabores Adultos 500g,S/ 14.50,metro,GALLINA EVISCERADA,2024-12-07 19:53:52.019970,500.0,g,Galletas Ricocrack Multisabores Adultos,14.5
Galletas de Maíz Horneadas Salmas Granos y Semillas 126g,S/ 8.50,metro,GALLINA EVISCERADA,2024-12-07 19:53:52.019970,126.0,g,Galletas de Maíz Horneadas Salmas Granos y Semillas,8.5
Galletas Agua Line 200g,S/ 3.20,metro,GALLINA EVISCERADA,2024-12-07 19:53:52.019970,200.0,g,Galletas Agua Line,3.2
Galletas Danesas Love Theme Lata 340g,S/ 12.90,metro,GALLINA EVISCERADA,2024-12-07 19:53:52.019970,340.0,g,Galletas Danesas Love Theme Lata,12.9
Galletas Salvado con Ajonjolí Bolsa 70 g,S/ 2.90,metro,GALLINA EVISCERADA,2024-12-07 19:53:52.019970,70.0,g,Galletas Salvado con Ajonjolí Bolsa,2.9
Galletas con Grageas Chips Fiesta Paquete 36 g Pack 6 unid,S/ 4.40,metro,GALLINA EVISCERADA,2024-12-07 19:53:52.019970,36.0,g,Galletas con Grageas Chips Fiesta Paquete  Pack,4.4
Galletas Saladas Ritz Mini 50g,S/ 1.50,metro,GALLINA EVISCERADA,2024-12-07 19:53:52.019970,50.0,g,Galletas Saladas Ritz Mini,1.5
Galletas Animalitos Vainilla Bolsa 150 g,S/ 2.10,metro,GALLINA EVISCERADA,2024-12-07 19:53:52.019970,150.0,g,Galletas Animalitos Vainilla Bolsa,2.1
Galletas de Maíz Horneadas Salmitas Caja 80 g,S/ 5.20,metro,GALLINA EVISCERADA,2024-12-07 19:53:52.019970,80.0,g,Galletas de Maíz Horneadas Salmitas Caja,5.2
Galletas con Crema Oreo Original Pack Familiar 324g,S/ 7.60,metro,GALLINA EVISCERADA,2024-12-07 19:53:52.019970,324.0,g,Galletas con Crema Oreo Original Pack Familiar,7.6
Galletas Ricocrack Multisabores Cachorros 200g,S/ 8.50,metro,GALLINA EVISCERADA,2024-12-07 19:53:52.019970,200.0,g,Galletas Ricocrack Multisabores Cachorros,8.5
Galletas Saladas Ducales 241g,S/ 5.70,metro,GALLINA EVISCERADA,2024-12-07 19:53:52.019970,241.0,g,Galletas Saladas Ducales,5.7
Galletas Colombina Navideñas 200g,S/ 6.90,metro,GALLINA EVISCERADA,2024-12-07 19:53:52.019970,200.0,g,Galletas Colombina Navideñas,6.9
Galletas Danesas Primavera Rosa Lata 340g,S/ 12.90,metro,GALLINA EVISCERADA,2024-12-07 19:53:52.019970,340.0,g,Galletas Danesas Primavera Rosa Lata,12.9
Galletas de Agua San Jorge Nubbe Bolsa 110 g,S/ 2.30,metro,GALLINA EVISCERADA,2024-12-07 19:53:52.019970,110.0,g,Galletas de Agua San Jorge Nubbe Bolsa,2.3
Galletas Chips Ahoy Mini Original 50g,S/ 1.90,metro,GALLINA EVISCERADA,2024-12-07 19:53:52.019970,50.0,g,Galletas Chips Ahoy Mini Original,1.9
Galletas Travesuras 50g,S/ 1.90,metro,GALLINA EVISCERADA,2024-12-07 19:53:52.019970,50.0,g,Galletas Travesuras,1.9
Galletas Saladas Doré Paquete 24 g Pack 6 unid,S/ 5.80,metro,GALLINA EVISCERADA,2024-12-07 19:53:52.019970,24.0,g,Galletas Saladas Doré Paquete  Pack,5.8
Galletas Danesas Castillos Famosos 340g,S/ 12.90,metro,GALLINA EVISCERADA,2024-12-07 19:53:52.019970,340.0,g,Galletas Danesas Castillos Famosos,12.9
Galletas de Maíz Horneadas Salmas Maíz Morado 126g,S/ 8.50,metro,GALLINA EVISCERADA,2024-12-07 19:53:52.019970,126.0,g,Galletas de Maíz Horneadas Salmas Maíz Morado,8.5
Galletas De Arroz Cuisine & Co Doypack 120 g,S/ 6.80,metro,GALLINA EVISCERADA,2024-12-07 19:53:52.019970,120.0,g,Galletas De Arroz Cuisine & Co Doypack,6.8
Galletas Ricocrack Cordero Adultos 500g,S/ 14.50,metro,GALLINA EVISCERADA,2024-12-07 19:53:52.019970,500.0,g,Galletas Ricocrack Cordero Adultos,14.5
Galletas Danesas Winter Season Lata 340g,S/ 12.90,metro,GALLINA EVISCERADA,2024-12-07 19:53:52.019970,340.0,g,Galletas Danesas Winter Season Lata,12.9
Galletas Saladas Ritz Original 52.5g,S/ 1.90,metro,GALLINA EVISCERADA,2024-12-07 19:53:52.019970,52.5,g,Galletas Saladas Ritz Original,1.9
Galletas Field Sabor Chocovainilla 75.6g,S/ 7.50,metro,GALLINA EVISCERADA,2024-12-07 19:53:52.019970,75.6,g,Galletas Field Sabor Chocovainilla,7.5
Galletas Integrales con Salvado de Trigo Bolsa 250 g,S/ 3.99,metro,GALLINA EVISCERADA,2024-12-07 19:53:52.019970,250.0,g,Galletas Integrales con Salvado de Trigo Bolsa,3.99
Galletas Salvado con Orégano Fibra Light Bolsa 70 g,S/ 2.90,metro,GALLINA EVISCERADA,2024-12-07 19:53:52.019970,70.0,g,Galletas Salvado con Orégano Fibra Light Bolsa,2.9
Galletas de Maíz Horneadas Sin Gluten Salmas Sanissimo Caja 90 g,S/ 8.30,metro,GALLINA EVISCERADA,2024-12-07 19:53:52.019970,90.0,g,Galletas de Maíz Horneadas Sin Gluten Salmas Sanissimo Caja,8.3
Galleta de Arroz Baby Mum-Mum Manzana Caja 50 gr,S/ 13.95,metro,GALLINA EVISCERADA,2024-12-07 19:53:52.019970,50.0,g,Galleta de Arroz Baby Mum-Mum Manzana Caja r,13.95
Galletas de Soda Paquete 500 g,S/ 6.20,metro,GALLINA EVISCERADA,2024-12-07 19:53:52.019970,500.0,g,Galletas de Soda Paquete,6.2
Galletas de Arroz Costeño Clásica 50g,S/ 2.00,metro,GALLINA EVISCERADA,2024-12-07 19:53:52.019970,50.0,g,Galletas de Arroz Costeño Clásica,2.0
Galletas Rellenas Oreo Bañadas Lata 328g,S/ 19.90,metro,GALLINA EVISCERADA,2024-12-07 19:53:52.019970,328.0,g,Galletas Rellenas Oreo Bañadas Lata,19.9
Galletas Danesas The Big City 340g Surtido,S/ 12.90,metro,GALLINA EVISCERADA,2024-12-07 19:53:52.019970,340.0,g,Galletas Danesas The Big City  Surtido,12.9
Galletas Saladas Doré 230g,S/ 6.00,metro,GALLINA EVISCERADA,2024-12-07 19:53:52.019970,230.0,g,Galletas Saladas Doré,6.0
Galletas Integrackers Integrackers Salvado de Trigo 30g 9un,S/ 7.50,metro,GALLINA EVISCERADA,2024-12-07 19:53:52.019970,30.0,g,Galletas Integrackers Integrackers Salvado de Trigo,7.5
Galletas Integrales Cracknel Integral Paquete 175 g,S/ 3.00,metro,GALLINA EVISCERADA,2024-12-07 19:53:52.019970,175.0,g,Galletas Integrales Cracknel Integral Paquete,3.0
Galleta con Quinua y Ajonjolí Incasur Caja 6 unid Bolsa 30 gr,S/ 7.90,metro,GALLINA EVISCERADA,2024-12-07 19:53:52.019970,6.0,un,Galleta con Quinua y Ajonjolí Incasur Caja  Bolsa r,7.9
Galletas de Avena con Castaña Nancy Natur 110g,S/ 8.90,metro,GALLINA EVISCERADA,2024-12-07 19:53:52.019970,110.0,g,Galletas de Avena con Castaña Nancy Natur,8.9
Galletas de Arroz Dulce Sin Gluten Costeño Doypack 150 g,S/ 6.90,metro,GALLINA EVISCERADA,2024-12-07 19:53:52.019970,150.0,g,Galletas de Arroz Dulce Sin Gluten Costeño Doypack,6.9
Galletas Nutritivas Nutri Deli Algarrobina 50g,S/ 3.10,metro,GALLINA EVISCERADA,2024-12-07 19:53:52.019970,50.0,g,Galletas Nutritivas Nutri Deli Algarrobina,3.1
Galletas para Bebés Gerber 70g,S/ 12.40,metro,GALLINA EVISCERADA,2024-12-07 19:53:52.019970,70.0,g,Galletas para Bebés Gerber,12.4
Galletas de Agua 220g,S/ 4.72,metro,GALLINA EVISCERADA,2024-12-07 19:53:52.019970,220.0,g,Galletas de Agua,4.72
Galleta Pícaras Mini La Clásica 50g,S/ 2.30,metro,GALLINA EVISCERADA,2024-12-07 19:53:52.019970,50.0,g,Galleta Pícaras Mini La Clásica,2.3
Galletas Baby Mum-Mum Arándano Caja 50 gr,S/ 13.95,metro,GALLINA EVISCERADA,2024-12-07 19:53:52.019970,50.0,g,Galletas Baby Mum-Mum Arándano Caja r,13.95
Galletas Surtidas Colombina Feliz Navidad 220g,S/ 5.90,metro,GALLINA EVISCERADA,2024-12-07 19:53:52.019970,220.0,g,Galletas Surtidas Colombina Feliz Navidad,5.9
Galletas Rellenas Nestlé Choco Cookies Crema de Avellana 120g,S/ 7.50,metro,GALLINA EVISCERADA,2024-12-07 19:53:52.019970,120.0,g,Galletas Rellenas Nestlé Choco Cookies Crema de Avellana,7.5
Galletas Fruta Mixta Bolsa 450 g,S/ 7.00,metro,GALLINA EVISCERADA,2024-12-07 19:53:52.019970,450.0,g,Galletas Fruta Mixta Bolsa,7.0
Galletas Animalitos San Jorge Bolsa 1 Kg,S/ 8.50,metro,GALLINA EVISCERADA,2024-12-07 19:53:52.019970,1.0,kg,Galletas Animalitos San Jorge Bolsa,8.5
Galleta de Arroz Toddler Mum-Mum Fresa Caja 50 gr,S/ 14.95,metro,GALLINA EVISCERADA,2024-12-07 19:53:52.019970,50.0,g,Galleta de Arroz Toddler Mum-Mum Fresa Caja r,14.95
Galletas Doña Pepa 23g,S/ 1.30,metro,GALLINA EVISCERADA,2024-12-07 19:53:52.019970,23.0,g,Galletas Doña Pepa,1.3
Galletas Salvado de Trigo Fibra Light Bolsa 70 g,S/ 2.90,metro,GALLINA EVISCERADA,2024-12-07 19:53:52.019970,70.0,g,Galletas Salvado de Trigo Fibra Light Bolsa,2.9
Galletas Surtidas Colombina Merry Christmas 200g,S/ 6.90,metro,GALLINA EVISCERADA,2024-12-07 19:53:52.019970,200.0,g,Galletas Surtidas Colombina Merry Christmas,6.9
Galletas Rellenas Nestlé Choco Trio Cookies and Cream 90g,S/ 12.50,metro,GALLINA EVISCERADA,2024-12-07 19:53:52.019970,90.0,g,Galletas Rellenas Nestlé Choco Trio Cookies and Cream,12.5
Galleta de Arroz Toddler Mum-Mum Banana Caja 50 gr,S/ 14.95,metro,GALLINA EVISCERADA,2024-12-07 19:53:52.019970,50.0,g,Galleta de Arroz Toddler Mum-Mum Banana Caja r,14.95
Galletas Sabor a Limón Colombina Casita de Navidad 50g Surtido,S/ 5.40,metro,GALLINA EVISCERADA,2024-12-07 19:53:52.019970,50.0,g,Galletas Sabor a Limón Colombina Casita de Navidad  Surtido,5.4
Galletas Ricocrack Original Cachorros 200g,S/ 8.50,metro,GALLINA EVISCERADA,2024-12-07 19:53:52.019970,200.0,g,Galletas Ricocrack Original Cachorros,8.5
