brand,description,price,website,search_term,scrape_timestamp,cantidad,unidad,description_no_unit,price_numeric
Sol Del Cuzco,Chocolate para Taza SOL DEL CUZCO con Clavo y Canela Tableta 90g Display 12u,S/ 28.80,vega,JAMÓN DEL PAÍS,2024-12-04 13:29:12.075828,90.0,g,Chocolate para Taza SOL DEL CUZCO con Clavo y Canela Tableta  Display 12u,28.8
Sol Del Cuzco,Chocolate para Taza SOL DEL CUZCO con Clavo y Canela Tableta 90gr,S/ 2.60,vega,JAMÓN DEL PAÍS,2024-12-04 13:29:12.075828,90.0,g,Chocolate para Taza SOL DEL CUZCO con Clavo y Canela Tableta r,2.6
Del Valle,Infusiones DEL VALLE Te Canela Clavo Caja 25 un,S/ 1.70,vega,JAMÓN DEL PAÍS,2024-12-04 13:29:12.075828,25.0,un,Infusiones DEL VALLE Te Canela Clavo Caja,1.7
Del Valle,Infusiones DEL VALLE Manzanilla Caja 25 un,S/ 1.70,vega,JAMÓN DEL PAÍS,2024-12-04 13:29:12.075828,25.0,un,Infusiones DEL VALLE Manzanilla Caja,1.7
Del Valle,Infusiones DEL VALLE Anís Caja 25 un,S/ 1.70,vega,JAMÓN DEL PAÍS,2024-12-04 13:29:12.075828,25.0,un,Infusiones DEL VALLE Anís Caja,1.7
Sol Del Cuzco,Chocolate para Taza SOL DEL CUZCO Tradicional Tableta 90gr,S/ 2.60,vega,JAMÓN DEL PAÍS,2024-12-04 13:29:12.075828,90.0,g,Chocolate para Taza SOL DEL CUZCO Tradicional Tableta r,2.6
Sol Del Cuzco,Chocolate para Taza SOL DEL CUZCO con Clavo y Canela Tableta 90g,S/ 2.60,vega,JAMÓN DEL PAÍS,2024-12-04 13:29:12.075828,90.0,g,Chocolate para Taza SOL DEL CUZCO con Clavo y Canela Tableta,2.6
Del Valle,Infusiones DEL VALLE Anís Caja 100 un,S/ 6.40,vega,JAMÓN DEL PAÍS,2024-12-04 13:29:12.075828,100.0,un,Infusiones DEL VALLE Anís Caja,6.4
Huerto Del Eden,Infusiones Manzanilla HUERTO Caja 25 un,S/ 2.20,vega,JAMÓN DEL PAÍS,2024-12-04 13:29:12.075828,25.0,un,Infusiones Manzanilla HUERTO Caja,2.2
