brand,description,price,website,search_term,scrape_timestamp,cantidad,unidad,description_no_unit,price_numeric
Universal,Gelatina UNIVERSAL Sabor a Naranja Bolsa 130g,S/ 3.50 8%,vega,NARANJA DE JUGO,2024-12-04 13:51:50.866862,130.0,g,Gelatina UNIVERSAL Sabor a Naranja Bolsa,3.5
Gloria,Bebida GLORIA Naranja Caja 1L,S/ 4.00,vega,NARANJA DE JUGO,2024-12-04 13:51:50.866862,1.0,l,Bebida GLORIA Naranja Caja,4.0
Gloria,Bebida GLORIA Sabor a Naranja Caja 1.5L x 3u,S/ 17.40,vega,NARANJA DE JUGO,2024-12-04 13:51:50.866862,1.5,l,Bebida GLORIA Sabor a Naranja Caja  x 3u,17.4
Zuko,Refresco instantáneo ZUKO de Naranja Display 12u Sobre 15gr,S/ 14.40,vega,NARANJA DE JUGO,2024-12-04 13:51:50.866862,15.0,g,Refresco instantáneo ZUKO de Naranja Display 12u Sobre r,14.4
Gloria,"Bebida GLORIA Naranja Caja 1,5L",S/ 5.00,vega,NARANJA DE JUGO,2024-12-04 13:51:50.866862,5.0,l,"Bebida GLORIA Naranja Caja 1,",5.0
