brand,description,price,website,search_term,scrape_timestamp
Sedal,Shampoo SEDAL Células Madre Frasco 340ml,S/ 13.50,vega,ZAPALLO MACRE,2024-12-06 12:07:54.899385
Axe,Desodorante en Aerosol AXE Body Apollo Frasco 150 ml,S/ 13.50,vega,ZAPALLO MACRE,2024-12-06 12:07:54.899385
NUTRIBELA,Tratamiento Para el Cabello NUTRIBELA Células Madre Sachet 27ml,S/ 1.50,vega,ZAPALLO MACRE,2024-12-06 12:07:54.899385
Sedal,Shampoo SEDAL Células Madre Frasco 650ml,S/ 22.50,vega,ZAPALLO MACRE,2024-12-06 12:07:54.899385
Sedal,Crema para Peinar SEDAL Células Madre Frasco 300ml,S/ 13.20,vega,ZAPALLO MACRE,2024-12-06 12:07:54.899385
Sedal,Acondicionador SEDAL Células Madre Frasco 340ml,S/ 13.50,vega,ZAPALLO MACRE,2024-12-06 12:07:54.899385
Sedal,Acondicionador SEDAL Células Madre Frasco 340ml x 2u,S/ 27.00,vega,ZAPALLO MACRE,2024-12-06 12:07:54.899385
Sedal,Shampoo SEDAL Células Madre Frasco 340ml x 2u,S/ 27.00,vega,ZAPALLO MACRE,2024-12-06 12:07:54.899385
