description,price,website,search_term,scrape_timestamp
Uva Sultana Nacional Metro x kg,S/ 13.23 x kg,metro,UVA NEGRA,2024-12-04 21:35:11.895425
Uva Verde Sin Semilla 900g,S/ 14.59,metro,UVA NEGRA,2024-12-04 21:35:11.895425
Uva Red Globe Metro x kg,S/ 9.49 x kg,metro,UVA NEGRA,2024-12-04 21:35:11.895425
Vino Tinto Tempranillo Pata Negra Roble Botella 750ml,S/ 46.50,metro,UVA NEGRA,2024-12-04 21:35:11.895425
Paté a La Pimienta Pata Negra Frasco 110 g,S/ 14.40,metro,UVA NEGRA,2024-12-04 21:35:11.895425
Vino Tinto Tempranillo Gran Reserva Pata Negra Botella 750ml,S/ 114.90,metro,UVA NEGRA,2024-12-04 21:35:11.895425
Aceituna Negra Deshuesada Cuisine & Co 260g,S/ 14.90,metro,UVA NEGRA,2024-12-04 21:35:11.895425
Papa Negra Andina Procesada Metro x kg,S/ 4.49 x kg,metro,UVA NEGRA,2024-12-04 21:35:11.895425
Pimienta Negra Molida Sibarita Sobre 6 Unid,S/ 4.30,metro,UVA NEGRA,2024-12-04 21:35:11.895425
Torta Selva Negra 20 Porciones,S/ 53.18,metro,UVA NEGRA,2024-12-04 21:35:11.895425
Pimienta Negra Molida Cuisine & Co 18g,S/ 3.20,metro,UVA NEGRA,2024-12-04 21:35:11.895425
Sixpack Cerveza Cusqueña Negra Botella 310ml,S/ 21.90,metro,UVA NEGRA,2024-12-04 21:35:11.895425
Papa Negra Comcen x kg,S/ 4.49 x kg,metro,UVA NEGRA,2024-12-04 21:35:11.895425
Aceituna Negra Entera Olivalle 180g,S/ 4.10,metro,UVA NEGRA,2024-12-04 21:35:11.895425
Chía Negra Orgánica Ecoandino 250g,S/ 17.90,metro,UVA NEGRA,2024-12-04 21:35:11.895425
Torta Selva Negra Cuisine & Co 16 Porciones,S/ 45.68,metro,UVA NEGRA,2024-12-04 21:35:11.895425
Pimienta Negra Molida Badia Frasco 2 Onzas,S/ 9.90,metro,UVA NEGRA,2024-12-04 21:35:11.895425
Aceitunas Negras Deshuesadas 350g,S/ 19.90,metro,UVA NEGRA,2024-12-04 21:35:11.895425
Maleta Krea Rígida 360 19 Negra 8 Ruedas,S/ 99.95,metro,UVA NEGRA,2024-12-04 21:35:11.895425
Sixpack Cerveza Cusqueña Negra Lata 355ml,S/ 25.90,metro,UVA NEGRA,2024-12-04 21:35:11.895425
Aceituna Negra Entera Cocktail Cuisine & Co 280g,S/ 11.50,metro,UVA NEGRA,2024-12-04 21:35:11.895425
Aceitunas Negras Botija Extra 400g,S/ 20.70,metro,UVA NEGRA,2024-12-04 21:35:11.895425
Aceituna Negra Entera Extra Cuisine & Co 280g,S/ 14.90,metro,UVA NEGRA,2024-12-04 21:35:11.895425
Gelatina Universal de Uva Sobre 130g,S/ 3.99,metro,UVA NEGRA,2024-12-04 21:35:11.895425
Torta Rectangular Selva Negra 7 Porciones,S/ 15.92,metro,UVA NEGRA,2024-12-04 21:35:11.895425
Torta Tres Leches Selva Negra Cuisine & Co 12 Porciones,S/ 43.92,metro,UVA NEGRA,2024-12-04 21:35:11.895425
Papa Negra Andina Agro Selecto 1Kg,S/ 5.50,metro,UVA NEGRA,2024-12-04 21:35:11.895425
"Jugo de Arándano, Uva y Manzana Bio Botella 300ml",S/ 3.60,metro,UVA NEGRA,2024-12-04 21:35:11.895425
Bebida Bio Aloe Uva Botella 500ml,S/ 3.70,metro,UVA NEGRA,2024-12-04 21:35:11.895425
Aceitunas Negras Deshuesadas 700g,S/ 33.40,metro,UVA NEGRA,2024-12-04 21:35:11.895425
Pimienta Negra Molida Sibarita 40g,S/ 10.90,metro,UVA NEGRA,2024-12-04 21:35:11.895425
Aceitunas Negras Deshuesadas 220g,S/ 9.52,metro,UVA NEGRA,2024-12-04 21:35:11.895425
Pimienta Negra Entera Sibarita Sobre 15 g,S/ 2.90,metro,UVA NEGRA,2024-12-04 21:35:11.895425
Block Cartulina Negra Justus 20 Hojas,S/ 3.70,metro,UVA NEGRA,2024-12-04 21:35:11.895425
Bebida Kero Aloe Vera Sabor Uva Botella 300ml,S/ 3.10,metro,UVA NEGRA,2024-12-04 21:35:11.895425
Gelatina Umsha Sabor Uva 120g,S/ 3.50,metro,UVA NEGRA,2024-12-04 21:35:11.895425
Aceituna Negra en rodajas Olivalle Doy pack 160 g,S/ 5.10,metro,UVA NEGRA,2024-12-04 21:35:11.895425
Pimienta Negra Entera Maras Gourmet con Molinillo 60g,S/ 14.90,metro,UVA NEGRA,2024-12-04 21:35:11.895425
Aceitunas Negras Botija Extra 750g,S/ 31.90,metro,UVA NEGRA,2024-12-04 21:35:11.895425
Torta Selva Negra con Durazno 16 Porciones,S/ 63.90,metro,UVA NEGRA,2024-12-04 21:35:11.895425
Chupetin Mister Pops Pintalengua Sabor Uva 432g,S/ 6.50,metro,UVA NEGRA,2024-12-04 21:35:11.895425
Maca Negra en Polvo Inkaforest Orgánica 200g,S/ 23.50,metro,UVA NEGRA,2024-12-04 21:35:11.895425
Maleta American Tourister Luxor Cabina Negra,,metro,UVA NEGRA,2024-12-04 21:35:11.895425
Torta Selva Negra 10 Porciones,S/ 46.90,metro,UVA NEGRA,2024-12-04 21:35:11.895425
Pimienta Negra Molida Badia Sobre 0.5 Onzas,S/ 4.30,metro,UVA NEGRA,2024-12-04 21:35:11.895425
Maca Negra en Polvo Ecoandino Orgánico 200g,S/ 27.20,metro,UVA NEGRA,2024-12-04 21:35:11.895425
Layconsa Cartulina 180g Negra 50 x 70 cm,S/ 2.80,metro,UVA NEGRA,2024-12-04 21:35:11.895425
Pimienta Negra Entera Maras Gourmet 30g,S/ 5.40,metro,UVA NEGRA,2024-12-04 21:35:11.895425
Pimienta Negra Molida Cuisine & Co Frasco 60g,S/ 9.30,metro,UVA NEGRA,2024-12-04 21:35:11.895425
Cera Negra Autobrillante TeknoWax Doypack 300 ml,S/ 9.60,metro,UVA NEGRA,2024-12-04 21:35:11.895425
Aceitunas Negras Enteras 270g,S/ 9.52,metro,UVA NEGRA,2024-12-04 21:35:11.895425
Pimienta Negra Molida Badia Frasco 7 Onzas,S/ 29.90,metro,UVA NEGRA,2024-12-04 21:35:11.895425
Pimienta Negra Entera Cuisine & Co 50g + Molinillo,S/ 11.60,metro,UVA NEGRA,2024-12-04 21:35:11.895425
Pimienta Negra Entera Cuisine & Co 15g,S/ 2.90,metro,UVA NEGRA,2024-12-04 21:35:11.895425
Pisco Portón Mosto Verde Negra Criolla Botella 750ml,S/ 80.90,metro,UVA NEGRA,2024-12-04 21:35:11.895425
Torta Selva Negra Chocolate 16 Porciones,S/ 62.90,metro,UVA NEGRA,2024-12-04 21:35:11.895425
Pimienta Negra Molida Toña 50g,S/ 9.40,metro,UVA NEGRA,2024-12-04 21:35:11.895425
Cerveza Cusqueña Negra Botella 330ml,S/ 4.90,metro,UVA NEGRA,2024-12-04 21:35:11.895425
Extensión Negra 3 mts con 4 Entradas Kamasa,S/ 23.19,metro,UVA NEGRA,2024-12-04 21:35:11.895425
Parrilla Carbón Krea Carbón Portátil Redonda Negra,S/ 69.90,metro,UVA NEGRA,2024-12-04 21:35:11.895425
Torta Selva Negra con Durazno 20 Porciones,S/ 73.90,metro,UVA NEGRA,2024-12-04 21:35:11.895425
Espumante Brut Tacama Orquídea Negra Botella 750ml,S/ 36.90,metro,UVA NEGRA,2024-12-04 21:35:11.895425
Sixpack Bebida Pulp Arándano Uva Botella 250ml,S/ 7.90,metro,UVA NEGRA,2024-12-04 21:35:11.895425
Bebida con Aloe Vera Sappe Uva Botella 1 L,S/ 17.10,metro,UVA NEGRA,2024-12-04 21:35:11.895425
Papa Negra Andina Agro Selecto 2Kg,S/ 11.50,metro,UVA NEGRA,2024-12-04 21:35:11.895425
Pimienta Negra Molida Toña 18g,S/ 3.70,metro,UVA NEGRA,2024-12-04 21:35:11.895425
Pan Batard con Aceitunas Negras un,S/ 9.90,metro,UVA NEGRA,2024-12-04 21:35:11.895425
Pimienta Negra Entera Badia Frasco con Moledor 2.25 Onzas,S/ 14.10,metro,UVA NEGRA,2024-12-04 21:35:11.895425
Aceitunas Negras Secas Deshuesadas 230g,S/ 10.99,metro,UVA NEGRA,2024-12-04 21:35:11.895425
Parrilla Carbon Beef Maker Kettle Negra XL,S/ 229.00,metro,UVA NEGRA,2024-12-04 21:35:11.895425
Sixpack Bebida Rehidratante Powerade Uva Botella 600ml,S/ 11.40,metro,UVA NEGRA,2024-12-04 21:35:11.895425
Carpeta Vinifan con Sujetador Superior Negra,S/ 8.90,metro,UVA NEGRA,2024-12-04 21:35:11.895425
Sal Himalaya Fossil River Negra Pote 150 gr,S/ 15.90,metro,UVA NEGRA,2024-12-04 21:35:11.895425
Pimienta Negra Molida Badia 113.4g,S/ 22.90,metro,UVA NEGRA,2024-12-04 21:35:11.895425
Jugo de Uva Tinto Aurora Botella 300ml,S/ 8.20,metro,UVA NEGRA,2024-12-04 21:35:11.895425
Aceituna Negra Seca Preparada 305g,S/ 8.90,metro,UVA NEGRA,2024-12-04 21:35:11.895425
Jugo de Uva Concord Kedem Botella 1.89L,S/ 26.90,metro,UVA NEGRA,2024-12-04 21:35:11.895425
Helado Selva Negra Dulce Pasión 650g,S/ 23.50,metro,UVA NEGRA,2024-12-04 21:35:11.895425
Bebida Rehidratante Sporade Uva Botella 500ml,S/ 2.40,metro,UVA NEGRA,2024-12-04 21:35:11.895425
Figura de Acción Marvel Olympus Pantera Negra,S/ 31.90,metro,UVA NEGRA,2024-12-04 21:35:11.895425
Aceitunas Negras en Rodajas 200g,S/ 9.76,metro,UVA NEGRA,2024-12-04 21:35:11.895425
Pimienta Negra Molida La Sazón de Don Benito 30g,S/ 3.20,metro,UVA NEGRA,2024-12-04 21:35:11.895425
Bebida Rehidratante Gatorlit Recover Uva Botella 591ml,S/ 5.50,metro,UVA NEGRA,2024-12-04 21:35:11.895425
Rehidratante Powerade Uva Botella 600ml,S/ 2.40,metro,UVA NEGRA,2024-12-04 21:35:11.895425
Helado Selva Negra Dulce Pasión 5L,S/ 99.90,metro,UVA NEGRA,2024-12-04 21:35:11.895425
Cerveza Cusqueña Negra Lata 355ml,S/ 5.00,metro,UVA NEGRA,2024-12-04 21:35:11.895425
Pimienta Negra Entera Badia Sobre 0.5 Onzas,S/ 4.30,metro,UVA NEGRA,2024-12-04 21:35:11.895425
Vino Tinto Quebranta Tannat Toñuz Corte de Uvas Botella 750ml,S/ 38.90,metro,UVA NEGRA,2024-12-04 21:35:11.895425
Cera en Pasta Emperatriz Negra 300ml,S/ 11.80,metro,UVA NEGRA,2024-12-04 21:35:11.895425
Jugo Mogu Mogu Uva Botella 1L,S/ 16.50,metro,UVA NEGRA,2024-12-04 21:35:11.895425
Pimienta Negra Entera Mccormick 53g,S/ 10.90,metro,UVA NEGRA,2024-12-04 21:35:11.895425
Quinua Negra Vidandina Doypack 454 g,S/ 13.50,metro,UVA NEGRA,2024-12-04 21:35:11.895425
Bebida de Uva Mogu Mogue Botella 320 ml,S/ 5.90,metro,UVA NEGRA,2024-12-04 21:35:11.895425
Té Etiqueta Negra Hornimans Caja 25 Unid,S/ 3.90,metro,UVA NEGRA,2024-12-04 21:35:11.895425
Set 12 Ganchos Krea Metálicos Uvas,S/ 13.99,metro,UVA NEGRA,2024-12-04 21:35:11.895425
Copa Selva Negra Wong,S/ 8.90,metro,UVA NEGRA,2024-12-04 21:35:11.895425
Jugo de Uva Blanco Aurora Botella 1L,S/ 22.50,metro,UVA NEGRA,2024-12-04 21:35:11.895425
Pimienta Negra Entera Toña 18g,S/ 3.70,metro,UVA NEGRA,2024-12-04 21:35:11.895425
Papa Negra Andina Procesada x kg,S/ 4.69 x kg,metro,UVA NEGRA,2024-12-04 21:35:11.895425
Set Pocillos Krea Base Negra 3un,S/ 19.50,metro,UVA NEGRA,2024-12-04 21:35:11.895425
Regaliz Sabor Uva Fini Tubos Ácidos 80g,S/ 4.90,metro,UVA NEGRA,2024-12-04 21:35:11.895425
Jugo de Uva Blanco Aurora Botella 300ml,S/ 65.90,metro,UVA NEGRA,2024-12-04 21:35:11.895425
Pimienta Negra Entera Cuisine & Co Frasco 50g,S/ 11.50,metro,UVA NEGRA,2024-12-04 21:35:11.895425
Torta Selva Negra Choco 6 Porciones,S/ 30.90,metro,UVA NEGRA,2024-12-04 21:35:11.895425
Agenda Layconsa Top Negra 2025,S/ 13.50,metro,UVA NEGRA,2024-12-04 21:35:11.895425
Agenda Layconsa Pocket Negra 2025,S/ 19.90,metro,UVA NEGRA,2024-12-04 21:35:11.895425
Aceitunas Negras Deshuesada Lomas Del Olivar 500G,S/ 17.20,metro,UVA NEGRA,2024-12-04 21:35:11.895425
Destilado de Uvas y Pasas Botella 750 ml,S/ 17.80,metro,UVA NEGRA,2024-12-04 21:35:11.895425
Harina de Maca Negra Doypack 200 g,S/ 29.40,metro,UVA NEGRA,2024-12-04 21:35:11.895425
Pack Party Box Bebida RTD: Uva Danger + Lemon Danger,S/ 23.90,metro,UVA NEGRA,2024-12-04 21:35:11.895425
Picadillo de Aceitunas Negras Maras Gourmet 220g,S/ 12.60,metro,UVA NEGRA,2024-12-04 21:35:11.895425
Aceitunas Negras En Rodajas Lomas Del Olivar 500G,S/ 17.20,metro,UVA NEGRA,2024-12-04 21:35:11.895425
Agenda Layconsa Executive Negra 2025,S/ 15.20,metro,UVA NEGRA,2024-12-04 21:35:11.895425
Caja para Herramienta Top Gan Negra Nro. 13,S/ 21.90,metro,UVA NEGRA,2024-12-04 21:35:11.895425
Agenda Layconsa Classic Negra 2025,S/ 14.90,metro,UVA NEGRA,2024-12-04 21:35:11.895425
Jugo de Uva Blush Kedem Light Botella 1.89L,S/ 26.90,metro,UVA NEGRA,2024-12-04 21:35:11.895425
Bebida Reay to Drink Party Box Uva Danger Lata 355ml,S/ 8.50,metro,UVA NEGRA,2024-12-04 21:35:11.895425
Jugo de Uva Concord Kedem Light Botella 1.89L,S/ 26.90,metro,UVA NEGRA,2024-12-04 21:35:11.895425
Pimienta Negra Molida Sobre 14 g,S/ 1.10,metro,UVA NEGRA,2024-12-04 21:35:11.895425
Pisco Puro Quebranta Paz-Soldán Etiqueta Negra Botella 750ml,S/ 41.90,metro,UVA NEGRA,2024-12-04 21:35:11.895425
