brand,description,price,website,search_term,scrape_timestamp,cantidad,unidad,description_no_unit,price_numeric
Thor,"Comida para Perros THOR Adulto Cl치sico Carne, Pollo, Cerdo Bolsa 25kg",S/ 110.90 5%,vega,CHULETA DE CERDO,2024-12-07 15:24:01.096471,25.0,kg,"Comida para Perros THOR Adulto Cl치sico Carne, Pollo, Cerdo Bolsa",110.9
Thor,"Comida para Perro THOR Adulto Sabor Carne, Pollo y Cerdo Bolsa 2 kg",S/ 14.50,vega,CHULETA DE CERDO,2024-12-07 15:24:01.096471,2.0,kg,"Comida para Perro THOR Adulto Sabor Carne, Pollo y Cerdo Bolsa",14.5
Globo Pop,Chupetes GLOBO POP Sabor Fresa Bolsa 24u 480g x 2u,S/ 15.60,vega,CHULETA DE CERDO,2024-12-07 15:24:01.096471,480.0,g,Chupetes GLOBO POP Sabor Fresa Bolsa 24u  x 2u,15.6
Globo Pop,Chupete GLOBO POP con Chicle Surtido Bolsa 24un,S/ 7.80,vega,CHULETA DE CERDO,2024-12-07 15:24:01.096471,24.0,un,Chupete GLOBO POP con Chicle Surtido Bolsa,7.8
Globo Pop,Chupetes GLOBO POP Ne칩n Bolsa 24u 480g x 2u,S/ 15.00,vega,CHULETA DE CERDO,2024-12-07 15:24:01.096471,480.0,g,Chupetes GLOBO POP Ne칩n Bolsa 24u  x 2u,15.0
Globo Pop,Chupetes GLOBO POP Sabores Surtidos Bolsa 24u 480g x 2u,S/ 15.60,vega,CHULETA DE CERDO,2024-12-07 15:24:01.096471,480.0,g,Chupetes GLOBO POP Sabores Surtidos Bolsa 24u  x 2u,15.6
Colombina,Chupetes COLOMBINETAS Choco Caramel Bolsa 24un,S/ 6.90,vega,CHULETA DE CERDO,2024-12-07 15:24:01.096471,24.0,un,Chupetes COLOMBINETAS Choco Caramel Bolsa,6.9
