brand,description,price,website,search_term,scrape_timestamp
CENTRAL DECCO,VELADOR 2 CAJONES MERLUZA,"S/ 1,769",tottus,MERLUZA,2024-12-07 13:12:46.074899
BRAVERY,Merluza Gatos Esterilizados Lata 70gr,S/ 21.90,tottus,MERLUZA,2024-12-07 13:12:46.074899
BRAVERY,Merluza Gatos Esterilizados Lata 70gr x12und,S/ 108.90,tottus,MERLUZA,2024-12-07 13:12:46.074899
AMITY,Merluza Bacalao Atún Para Gatos Esterilizados Lata80gr,S/ 16.90,tottus,MERLUZA,2024-12-07 13:12:46.074899
BRAVERY,Merluza Gatos Esterilizados Lata 70gr x6und,S/ 58.90,tottus,MERLUZA,2024-12-07 13:12:46.074899
BRAVERY,Comida De Gato Esterilizado Merluza 70 Gr Pack 6 Un,S/ 62.90,tottus,MERLUZA,2024-12-07 13:12:46.074899
AMITY,Merluza Bacalao Atún Gato Esterilizado Lata 80gr 20und,S/ 109.90,tottus,MERLUZA,2024-12-07 13:12:46.074899
AMITY,Comida Húmeda Gato Esterilizad Merluza Atún 80 Gr 6Un,S/ 46,tottus,MERLUZA,2024-12-07 13:12:46.074899
