description,price,website,search_term,scrape_timestamp
Maíz Gigante Original Inka Corn Doypack 500 g,S/ 24.50,metro,MAÍZ REVENTÓN (POP CORN),2024-12-03 19:59:07.848142
Maíz Gigante Inka Corn Original 100g,S/ 5.99,metro,MAÍZ REVENTÓN (POP CORN),2024-12-03 19:59:07.848142
Maiz Gigante con Chocolate Inka Corn 100g,S/ 11.90,metro,MAÍZ REVENTÓN (POP CORN),2024-12-03 19:59:07.848142
Maíz Pop Corn Costeño 500g,S/ 4.00,metro,MAÍZ REVENTÓN (POP CORN),2024-12-03 19:59:07.848142
Maíz Morado Metro x kg,S/ 9.79 x kg,metro,MAÍZ REVENTÓN (POP CORN),2024-12-03 19:59:07.848142
Maíz Pop Corn Cuisine & Co 500g,S/ 3.50,metro,MAÍZ REVENTÓN (POP CORN),2024-12-03 19:59:07.848142
Maíz Pop Corn Bolsa 350 g,S/ 3.80,metro,MAÍZ REVENTÓN (POP CORN),2024-12-03 19:59:07.848142
Maíz Pop Corn Máxima 500g,S/ 4.30,metro,MAÍZ REVENTÓN (POP CORN),2024-12-03 19:59:07.848142
Maíz Dulce en Granos Fruto de Oro 425g,S/ 6.90,metro,MAÍZ REVENTÓN (POP CORN),2024-12-03 19:59:07.848142
Maíz con Miel Vita Pluss Bolsa 140 g,S/ 3.90,metro,MAÍZ REVENTÓN (POP CORN),2024-12-03 19:59:07.848142
Maíz Pop Corn Valle Norte Bolsa 500 g,S/ 5.80,metro,MAÍZ REVENTÓN (POP CORN),2024-12-03 19:59:07.848142
Maíz Pop Corn Tesoro Del Campo Bolsa 500 g,S/ 4.95,metro,MAÍZ REVENTÓN (POP CORN),2024-12-03 19:59:07.848142
Maíz Atómico Andino con Maca Forte Golpe 125g,S/ 3.28,metro,MAÍZ REVENTÓN (POP CORN),2024-12-03 19:59:07.848142
Maíz Chulpi Desgranado Kuski Bolsa 425 g,S/ 14.90,metro,MAÍZ REVENTÓN (POP CORN),2024-12-03 19:59:07.848142
Pop Corn Granos Del Sur,S/ 4.30,metro,MAÍZ REVENTÓN (POP CORN),2024-12-03 19:59:07.848142
Maiz Pop Corn Paisana Bolsa 500 g,S/ 4.40,metro,MAÍZ REVENTÓN (POP CORN),2024-12-03 19:59:07.848142
Pop Corn Chicken Avinka 350g,S/ 15.30,metro,MAÍZ REVENTÓN (POP CORN),2024-12-03 19:59:07.848142
Pop Corn para Microondas Act II Sabor Mantequilla 91g,S/ 4.60,metro,MAÍZ REVENTÓN (POP CORN),2024-12-03 19:59:07.848142
Pop Corn Natural Act II Bolsa 80 g,S/ 4.60,metro,MAÍZ REVENTÓN (POP CORN),2024-12-03 19:59:07.848142
Chupete Globo Pop LED Surtido,S/ 1.20,metro,MAÍZ REVENTÓN (POP CORN),2024-12-03 19:59:07.848142
Chupete Globo Pop Surtido 24un,S/ 8.00,metro,MAÍZ REVENTÓN (POP CORN),2024-12-03 19:59:07.848142
Pop Corn Butter Extra Act II 91g,S/ 4.60,metro,MAÍZ REVENTÓN (POP CORN),2024-12-03 19:59:07.848142
Chupete Globo Pop Neon Renovado Bolsa 24 Unidades,S/ 8.00,metro,MAÍZ REVENTÓN (POP CORN),2024-12-03 19:59:07.848142
Chupetín Globo Pop Sabor Maracuyá 24un,S/ 8.00,metro,MAÍZ REVENTÓN (POP CORN),2024-12-03 19:59:07.848142
Maiz Cuzco Frito y Salado Cuisine&Co Bolsa 100 g,S/ 4.70,metro,MAÍZ REVENTÓN (POP CORN),2024-12-03 19:59:07.848142
Pop Corn Natural Act II Pack 3 Unid,S/ 14.70,metro,MAÍZ REVENTÓN (POP CORN),2024-12-03 19:59:07.848142
Pop Corn Butter Act II Pack 3 Unid,S/ 10.90,metro,MAÍZ REVENTÓN (POP CORN),2024-12-03 19:59:07.848142
Chupete Globo Pop Fresa Bolsa 24 Undiades,S/ 8.00,metro,MAÍZ REVENTÓN (POP CORN),2024-12-03 19:59:07.848142
Pop Corn Butter Light Act II Pack 3 Unid,S/ 10.90,metro,MAÍZ REVENTÓN (POP CORN),2024-12-03 19:59:07.848142
Chupete Globo Pop Leche y Chocolate Bolsa 24 Unidades,S/ 8.00,metro,MAÍZ REVENTÓN (POP CORN),2024-12-03 19:59:07.848142
Barbie Pop Reveal Serie Frutas Chelsea,S/ 69.90,metro,MAÍZ REVENTÓN (POP CORN),2024-12-03 19:59:07.848142
Chupete Globo Pop Yogurt Surtido Bolsa 24 Unidades,S/ 8.00,metro,MAÍZ REVENTÓN (POP CORN),2024-12-03 19:59:07.848142
Chupetes Globo Pop Cereza Acida Bolsa 24 Unidades,S/ 8.00,metro,MAÍZ REVENTÓN (POP CORN),2024-12-03 19:59:07.848142
Chupete Globo Pop Maracuyá 25un,S/ 8.00,metro,MAÍZ REVENTÓN (POP CORN),2024-12-03 19:59:07.848142
Chupete Globo Pop XXL 180 g,S/ 13.90,metro,MAÍZ REVENTÓN (POP CORN),2024-12-03 19:59:07.848142
Chupete Globo Pop Shake 24un.,S/ 7.80,metro,MAÍZ REVENTÓN (POP CORN),2024-12-03 19:59:07.848142
Galletas de Maíz Horneadas Salmas 144g,S/ 8.50,metro,MAÍZ REVENTÓN (POP CORN),2024-12-03 19:59:07.848142
Galletas de Maíz Horneadas Sin Gluten Salmas Sanissimo Caja 360 g,S/ 22.90,metro,MAÍZ REVENTÓN (POP CORN),2024-12-03 19:59:07.848142
Hojuelas de Maíz Kellogg's Corn Flakes 410g,S/ 13.00,metro,MAÍZ REVENTÓN (POP CORN),2024-12-03 19:59:07.848142
Aceite de Canola Cuisine & Co Botella 1 lt,S/ 11.90,metro,MAÍZ REVENTÓN (POP CORN),2024-12-03 19:59:07.848142
Aceite Girasol Huerto Alamein 900ml,S/ 12.80,metro,MAÍZ REVENTÓN (POP CORN),2024-12-03 19:59:07.848142
Twelvepack Galletas de Maíz Salmas Horneadas 18g,S/ 14.90,metro,MAÍZ REVENTÓN (POP CORN),2024-12-03 19:59:07.848142
Cereal de Maíz Corn Flakes 405g,S/ 13.90,metro,MAÍZ REVENTÓN (POP CORN),2024-12-03 19:59:07.848142
Aceite de Girasol Mucho Gussto 900ml,S/ 7.90,metro,MAÍZ REVENTÓN (POP CORN),2024-12-03 19:59:07.848142
Galletas de Maíz Horneadas Salmas Granos y Semillas 126g,S/ 8.50,metro,MAÍZ REVENTÓN (POP CORN),2024-12-03 19:59:07.848142
Tortillas de Maíz Saniito 12un,S/ 10.60,metro,MAÍZ REVENTÓN (POP CORN),2024-12-03 19:59:07.848142
Palitos de Maíz Cheese Tris Cheetos 120g,S/ 5.20,metro,MAÍZ REVENTÓN (POP CORN),2024-12-03 19:59:07.848142
Galletas de Maíz Horneadas Salmitas Caja 80 g,S/ 5.20,metro,MAÍZ REVENTÓN (POP CORN),2024-12-03 19:59:07.848142
Tortillas de Maíz Clásica Cuisine & Co Bolsa 150 g,S/ 4.90,metro,MAÍZ REVENTÓN (POP CORN),2024-12-03 19:59:07.848142
Aceite de Girasol Cuisine & Co 900ml,S/ 12.90,metro,MAÍZ REVENTÓN (POP CORN),2024-12-03 19:59:07.848142
Galletas de Maíz Horneadas Salmas Maíz Morado 126g,S/ 8.50,metro,MAÍZ REVENTÓN (POP CORN),2024-12-03 19:59:07.848142
Aceite De Canola Borges Botella 1 Litro,S/ 16.50,metro,MAÍZ REVENTÓN (POP CORN),2024-12-03 19:59:07.848142
Twopack Aceite de Girasol Monteagle 900ml,S/ 29.00,metro,MAÍZ REVENTÓN (POP CORN),2024-12-03 19:59:07.848142
Galletas de Maíz Horneadas Sin Gluten Salmas Sanissimo Caja 90 g,S/ 8.30,metro,MAÍZ REVENTÓN (POP CORN),2024-12-03 19:59:07.848142
Harina de Maíz Amarillo P.A.N 1kg,S/ 8.50,metro,MAÍZ REVENTÓN (POP CORN),2024-12-03 19:59:07.848142
Aceite De Canola Borges Botella 2 Litros,S/ 28.50,metro,MAÍZ REVENTÓN (POP CORN),2024-12-03 19:59:07.848142
Tortilla de Maíz Tía Rosa 10un.,S/ 12.20,metro,MAÍZ REVENTÓN (POP CORN),2024-12-03 19:59:07.848142
Tortillas de Maíz Picante Cuisine & Co Bolsa 150 g,S/ 4.90,metro,MAÍZ REVENTÓN (POP CORN),2024-12-03 19:59:07.848142
Hojuelas de Maíz Azucaradas Kellogg's Zucaritas 420g,S/ 16.90,metro,MAÍZ REVENTÓN (POP CORN),2024-12-03 19:59:07.848142
Hojuelas de Maíz Corn Flakes Kellogg's 200g,S/ 10.00,metro,MAÍZ REVENTÓN (POP CORN),2024-12-03 19:59:07.848142
Hojuelas de Maíz Corn Flakes Cuisine & Co Caja 500 g,S/ 12.90,metro,MAÍZ REVENTÓN (POP CORN),2024-12-03 19:59:07.848142
"Aros de Maíz, Trigo y Avena Froot Loops Kellogg's 200g",S/ 11.90,metro,MAÍZ REVENTÓN (POP CORN),2024-12-03 19:59:07.848142
Tortillas de Maíz Saniito 8un,S/ 11.60,metro,MAÍZ REVENTÓN (POP CORN),2024-12-03 19:59:07.848142
Aceite Original Mazola Spray Lata 142 g,S/ 24.80,metro,MAÍZ REVENTÓN (POP CORN),2024-12-03 19:59:07.848142
Tamal de Maíz Casa Verde 180g,S/ 5.70,metro,MAÍZ REVENTÓN (POP CORN),2024-12-03 19:59:07.848142
Hojuelas de Maíz Azucaradas Kellogg's Zucaritas 260g,S/ 12.90,metro,MAÍZ REVENTÓN (POP CORN),2024-12-03 19:59:07.848142
Hojuelas de Maíz Corn Flakes Cuisine & Co 200g,S/ 6.90,metro,MAÍZ REVENTÓN (POP CORN),2024-12-03 19:59:07.848142
"Aros de Maíz, Trigo y Avena Froot Loops Kellogg's 350g",S/ 16.90,metro,MAÍZ REVENTÓN (POP CORN),2024-12-03 19:59:07.848142
Talco Dr Zaidman Con Almidón de Maíz Talquera 600 g,S/ 34.20,metro,MAÍZ REVENTÓN (POP CORN),2024-12-03 19:59:07.848142
Cereal de Maíz Azucarado Cuisine & Co Reggae Flakes 480g,S/ 10.90,metro,MAÍZ REVENTÓN (POP CORN),2024-12-03 19:59:07.848142
Tortillas de Maíz Clásica Cuisine & Co Bolsa 65 g,S/ 2.80,metro,MAÍZ REVENTÓN (POP CORN),2024-12-03 19:59:07.848142
Palitos de Maíz Cheese Tris 42g,S/ 2.70,metro,MAÍZ REVENTÓN (POP CORN),2024-12-03 19:59:07.848142
Cerveza Artesanal 7 Vidas Maíz Morado Pale Ale Botella 340ml,S/ 8.00,metro,MAÍZ REVENTÓN (POP CORN),2024-12-03 19:59:07.848142
Palitos de Maíz Cheese Tris Cheetos 44g,S/ 2.50,metro,MAÍZ REVENTÓN (POP CORN),2024-12-03 19:59:07.848142
Talco Dr Zaidman Con Almidón de Maíz Talquera 200 g,S/ 16.30,metro,MAÍZ REVENTÓN (POP CORN),2024-12-03 19:59:07.848142
Aceite de Canola Wesson 1.18L,S/ 38.70,metro,MAÍZ REVENTÓN (POP CORN),2024-12-03 19:59:07.848142
Harina de Maíz Blanco Precocida Doñarepa 1kg,S/ 9.80,metro,MAÍZ REVENTÓN (POP CORN),2024-12-03 19:59:07.848142
Aceite De Girasol Borges Botella 1 L,S/ 14.50,metro,MAÍZ REVENTÓN (POP CORN),2024-12-03 19:59:07.848142
Barra Energética Siete Dragones Aguaymanto & Maíz Morado 5un,S/ 19.90,metro,MAÍZ REVENTÓN (POP CORN),2024-12-03 19:59:07.848142
Sixpack Cerveza de Maíz Tres Cruces Pum Pum Lata 310ml,S/ 19.90,metro,MAÍZ REVENTÓN (POP CORN),2024-12-03 19:59:07.848142
Palitos de Maíz Cuisine & Co 180g,S/ 5.50,metro,MAÍZ REVENTÓN (POP CORN),2024-12-03 19:59:07.848142
Tortillas de Maíz Picante Cuisine & Co Bolsa 65 g,S/ 2.80,metro,MAÍZ REVENTÓN (POP CORN),2024-12-03 19:59:07.848142
Jarabe de Maíz Glucofácil Spitze Botella 680 g,S/ 25.12,metro,MAÍZ REVENTÓN (POP CORN),2024-12-03 19:59:07.848142
Pack x2 Tortilla de Maíz Tía Rosa Paquete 255g,S/ 23.40,metro,MAÍZ REVENTÓN (POP CORN),2024-12-03 19:59:07.848142
Tortilla de Maíz Cuisine & Co Torti Hot 200g,S/ 8.90,metro,MAÍZ REVENTÓN (POP CORN),2024-12-03 19:59:07.848142
Tortillas de Maíz Cuisine & Co Sabor Queso 180g,S/ 7.90,metro,MAÍZ REVENTÓN (POP CORN),2024-12-03 19:59:07.848142
Cereal de Maíz Trix 90g,S/ 5.00,metro,MAÍZ REVENTÓN (POP CORN),2024-12-03 19:59:07.848142
Pack x4 Sixpack Cerveza de Maíz Pum Pum Lata 473ml,S/ 92.90,metro,MAÍZ REVENTÓN (POP CORN),2024-12-03 19:59:07.848142
Maternelle Colchón Standard 67 x 104 cm Maíz,S/ 229.90,metro,MAÍZ REVENTÓN (POP CORN),2024-12-03 19:59:07.848142
Sopa de Maíz Dulce Auga 430g,S/ 19.50,metro,MAÍZ REVENTÓN (POP CORN),2024-12-03 19:59:07.848142
Decohome Silla Ronni Maíz,S/ 797.68,metro,MAÍZ REVENTÓN (POP CORN),2024-12-03 19:59:07.848142
Posicionador con Respiraderos Maíz,S/ 79.90,metro,MAÍZ REVENTÓN (POP CORN),2024-12-03 19:59:07.848142
Almohada de Lactancia Doble Maternelle Maíz Animales,S/ 179.90,metro,MAÍZ REVENTÓN (POP CORN),2024-12-03 19:59:07.848142
Almohada de Lactancia y Maternidad 5 en 1 Maíz,S/ 129.90,metro,MAÍZ REVENTÓN (POP CORN),2024-12-03 19:59:07.848142
Maternelle Colchón Standard 63 x 94 cm Maíz,S/ 209.90,metro,MAÍZ REVENTÓN (POP CORN),2024-12-03 19:59:07.848142
Maternelle Colchón de Cuna 70 x 130 cm Maíz,S/ 429.90,metro,MAÍZ REVENTÓN (POP CORN),2024-12-03 19:59:07.848142
Decohome Sofá 3 Cuerpos Daniel Maíz,"S/ 2,433.94",metro,MAÍZ REVENTÓN (POP CORN),2024-12-03 19:59:07.848142
Decohome Sillón Remma Maíz,"S/ 1,943.06",metro,MAÍZ REVENTÓN (POP CORN),2024-12-03 19:59:07.848142
Decohome Sofá 3 Cuerpos Laurel Maíz,"S/ 2,474.85",metro,MAÍZ REVENTÓN (POP CORN),2024-12-03 19:59:07.848142
Decohome Seccional Izquierda Colobi Maíz,"S/ 3,190.72",metro,MAÍZ REVENTÓN (POP CORN),2024-12-03 19:59:07.848142
Decohome Seccional Derecha Damián Maíz,"S/ 3,190.72",metro,MAÍZ REVENTÓN (POP CORN),2024-12-03 19:59:07.848142
Decohome Seccional Derecha Velmon Maíz,"S/ 3,190.72",metro,MAÍZ REVENTÓN (POP CORN),2024-12-03 19:59:07.848142
Maternelle Colchón de Pack and Play Premium 63 x 94 cm Maíz,S/ 249.90,metro,MAÍZ REVENTÓN (POP CORN),2024-12-03 19:59:07.848142
Maternelle Colchón de Pack and Play Premium 68 x 104 cm Maíz,S/ 269.90,metro,MAÍZ REVENTÓN (POP CORN),2024-12-03 19:59:07.848142
Posicionador con Respiraderos Maternelle Maíz Animales,S/ 79.90,metro,MAÍZ REVENTÓN (POP CORN),2024-12-03 19:59:07.848142
Cojín Ergonómico Portabebé 3 en 1 Maíz Animales,S/ 89.90,metro,MAÍZ REVENTÓN (POP CORN),2024-12-03 19:59:07.848142
Maternelle Cambiador 2 en 1 Maíz,S/ 149.90,metro,MAÍZ REVENTÓN (POP CORN),2024-12-03 19:59:07.848142
Almohadita Antialérgica Infantil 29 x 47 cm Maíz,S/ 34.90,metro,MAÍZ REVENTÓN (POP CORN),2024-12-03 19:59:07.848142
Almohadita Antialérgica para Bebé 22 x 32 cm Maíz,S/ 24.90,metro,MAÍZ REVENTÓN (POP CORN),2024-12-03 19:59:07.848142
Harina de Maiz Blanco Precocida P.A.N Contenido 1 kg,S/ 8.50,metro,MAÍZ REVENTÓN (POP CORN),2024-12-03 19:59:07.848142
Cereal Fruta Aros Maiz Cereal Angel Bolsa 420 g,S/ 16.60,metro,MAÍZ REVENTÓN (POP CORN),2024-12-03 19:59:07.848142
Papa Blanca Yungay Metro x kg,S/ 2.99 x kg,metro,MAÍZ REVENTÓN (POP CORN),2024-12-03 19:59:07.848142
Papa Amarilla Peruanita Procesada Metro x kg,S/ 8.49 x kg,metro,MAÍZ REVENTÓN (POP CORN),2024-12-03 19:59:07.848142
Papa Amarilla Huamantanga Metro x kg,S/ 6.99 x kg,metro,MAÍZ REVENTÓN (POP CORN),2024-12-03 19:59:07.848142
Papa Canchán Procesada Especial x kg,S/ 3.29 x kg,metro,MAÍZ REVENTÓN (POP CORN),2024-12-03 19:59:07.848142
Papa Amarilla Tumbay Procesada x kg,S/ 8.09 x kg,metro,MAÍZ REVENTÓN (POP CORN),2024-12-03 19:59:07.848142
Camote Morado Metro x kg,S/ 2.79 x kg,metro,MAÍZ REVENTÓN (POP CORN),2024-12-03 19:59:07.848142
Camote Morado Meza x kg,S/ 2.79 x kg,metro,MAÍZ REVENTÓN (POP CORN),2024-12-03 19:59:07.848142
Papa Amarilla Tumbay x kg,S/ 8.49 x kg,metro,MAÍZ REVENTÓN (POP CORN),2024-12-03 19:59:07.848142
Camote Amarillo Especial Metro x kg,S/ 2.79 x kg,metro,MAÍZ REVENTÓN (POP CORN),2024-12-03 19:59:07.848142
Papa Blanca Metro x kg,S/ 2.60 x kg,metro,MAÍZ REVENTÓN (POP CORN),2024-12-03 19:59:07.848142
Cereal Corn Flakes Sin Gluten 740g,S/ 20.90,metro,MAÍZ REVENTÓN (POP CORN),2024-12-03 19:59:07.848142
Yuca x kg,S/ 4.49 x kg,metro,MAÍZ REVENTÓN (POP CORN),2024-12-03 19:59:07.848142
Papa Canchán Procesada x kg,S/ 2.96 x kg,metro,MAÍZ REVENTÓN (POP CORN),2024-12-03 19:59:07.848142
Papa Blanca Canchán Procesada x kgs,S/ 1.89 x kg,metro,MAÍZ REVENTÓN (POP CORN),2024-12-03 19:59:07.848142
Papa Huayro Metro x kg,S/ 6.19 x kg,metro,MAÍZ REVENTÓN (POP CORN),2024-12-03 19:59:07.848142
Papa Negra Andina Procesada Metro x kg,S/ 4.49 x kg,metro,MAÍZ REVENTÓN (POP CORN),2024-12-03 19:59:07.848142
Papa Blanca Cocktail x kg,S/ 3.29 x kg,metro,MAÍZ REVENTÓN (POP CORN),2024-12-03 19:59:07.848142
Papa Amarilla Peruanita Cocktail x kg,S/ 6.74 x kg,metro,MAÍZ REVENTÓN (POP CORN),2024-12-03 19:59:07.848142
Papa Amarilla Tumbay Extra Metro x kg,S/ 7.64 x kg,metro,MAÍZ REVENTÓN (POP CORN),2024-12-03 19:59:07.848142
Papa Blanca x kg,S/ 2.79 x kg,metro,MAÍZ REVENTÓN (POP CORN),2024-12-03 19:59:07.848142
Camote Amarillo Agro Selecto 1Kg,S/ 4.75,metro,MAÍZ REVENTÓN (POP CORN),2024-12-03 19:59:07.848142
Papa Amarilla Tumbay Especial Metro x kg,S/ 4.49 x kg,metro,MAÍZ REVENTÓN (POP CORN),2024-12-03 19:59:07.848142
Olluco Especial x Kg,S/ 6.29 x kg,metro,MAÍZ REVENTÓN (POP CORN),2024-12-03 19:59:07.848142
Papa Amarilla Tumbay Procesada x kg,S/ 8.09 x kg,metro,MAÍZ REVENTÓN (POP CORN),2024-12-03 19:59:07.848142
Papa Negra Comcen x kg,S/ 4.49 x kg,metro,MAÍZ REVENTÓN (POP CORN),2024-12-03 19:59:07.848142
Camote Morado Agro Selecto 1Kg,S/ 3.50,metro,MAÍZ REVENTÓN (POP CORN),2024-12-03 19:59:07.848142
Olluco Metro x kg,S/ 6.79 x kg,metro,MAÍZ REVENTÓN (POP CORN),2024-12-03 19:59:07.848142
Papa Canchán Procesada Agro Selecto 1Kg,S/ 3.80,metro,MAÍZ REVENTÓN (POP CORN),2024-12-03 19:59:07.848142
Papa Huayro Comcen x kg,S/ 5.69 x kg,metro,MAÍZ REVENTÓN (POP CORN),2024-12-03 19:59:07.848142
Siu Mai de Cerdo Deli Freeze 12un,S/ 13.99,metro,MAÍZ REVENTÓN (POP CORN),2024-12-03 19:59:07.848142
Papa Yungay Agro Selecto 1Kg,S/ 4.28,metro,MAÍZ REVENTÓN (POP CORN),2024-12-03 19:59:07.848142
Chupetin Mister Pops Extreme Duo Halloween 432g,S/ 9.90,metro,MAÍZ REVENTÓN (POP CORN),2024-12-03 19:59:07.848142
Tinte para Cabello en Crema 30 Tonos Castaños Oscuros de Raíz Sachet 20 g,S/ 11.30,metro,MAÍZ REVENTÓN (POP CORN),2024-12-03 19:59:07.848142
Papa Negra Andina Agro Selecto 1Kg,S/ 5.50,metro,MAÍZ REVENTÓN (POP CORN),2024-12-03 19:59:07.848142
Chicken Pop Redondos Bolsa 300 g,S/ 12.70,metro,MAÍZ REVENTÓN (POP CORN),2024-12-03 19:59:07.848142
Shampoo Amarás Raíces y Puntas 700ml,S/ 17.50,metro,MAÍZ REVENTÓN (POP CORN),2024-12-03 19:59:07.848142
Papa Amarilla Tumbay Agro Selecto 1Kg,S/ 8.50,metro,MAÍZ REVENTÓN (POP CORN),2024-12-03 19:59:07.848142
Sazonador de Pop Corn Sabor Mantequilla Costeño Pops 81g,S/ 11.20,metro,MAÍZ REVENTÓN (POP CORN),2024-12-03 19:59:07.848142
Papa Amarilla Cocktail Comcen 1kg,S/ 5.30,metro,MAÍZ REVENTÓN (POP CORN),2024-12-03 19:59:07.848142
Chupetin Mister Pops Extreme Duo Ácido Dulce 432g,S/ 6.50,metro,MAÍZ REVENTÓN (POP CORN),2024-12-03 19:59:07.848142
Shampoo Amarás Raíces y Puntas Felices 400ml,S/ 11.00,metro,MAÍZ REVENTÓN (POP CORN),2024-12-03 19:59:07.848142
Camote Amarillo x kg,S/ 1.69 x kg,metro,MAÍZ REVENTÓN (POP CORN),2024-12-03 19:59:07.848142
Siu Mai de Pollo Deli Freeze 12un,S/ 13.99,metro,MAÍZ REVENTÓN (POP CORN),2024-12-03 19:59:07.848142
Camote Amarillo Procesado Agro Selecto 2Kg,S/ 10.00,metro,MAÍZ REVENTÓN (POP CORN),2024-12-03 19:59:07.848142
Chupete Mr Pops Halloween Cíclope 432g,S/ 9.90,metro,MAÍZ REVENTÓN (POP CORN),2024-12-03 19:59:07.848142
Acondicionador Amarás Raíces y Puntas 475ml,S/ 12.50,metro,MAÍZ REVENTÓN (POP CORN),2024-12-03 19:59:07.848142
Papa Amarilla Peruanita Procesada x kg,S/ 8.79 x kg,metro,MAÍZ REVENTÓN (POP CORN),2024-12-03 19:59:07.848142
Siu Mai de Pollo Cuisine & Co 16un,S/ 19.99,metro,MAÍZ REVENTÓN (POP CORN),2024-12-03 19:59:07.848142
Chupetin Mister Pops Pintalengua Sabor Uva 432g,S/ 6.50,metro,MAÍZ REVENTÓN (POP CORN),2024-12-03 19:59:07.848142
Siu Mai de Cerdo Cuisine & Co 16un,S/ 19.99,metro,MAÍZ REVENTÓN (POP CORN),2024-12-03 19:59:07.848142
Papa Peruanita Cocktail Agro Selecto Ready 800g,S/ 8.00,metro,MAÍZ REVENTÓN (POP CORN),2024-12-03 19:59:07.848142
Cereal de Quinua Nura Choco Pops 200g,S/ 21.50,metro,MAÍZ REVENTÓN (POP CORN),2024-12-03 19:59:07.848142
Tinte para Cabello en Crema 10 Tonos Intensos Retocador de Raíz Sachet 20 g,S/ 11.30,metro,MAÍZ REVENTÓN (POP CORN),2024-12-03 19:59:07.848142
Papa Peruanita Agro Selecto 1kg,S/ 8.50,metro,MAÍZ REVENTÓN (POP CORN),2024-12-03 19:59:07.848142
Olluco Entero x kg,S/ 6.49 x kg,metro,MAÍZ REVENTÓN (POP CORN),2024-12-03 19:59:07.848142
Cereal Corn Flakes Sin Gluten 180g,S/ 13.40,metro,MAÍZ REVENTÓN (POP CORN),2024-12-03 19:59:07.848142
Papa Huayro Agro Selecto 1Kg,S/ 6.90,metro,MAÍZ REVENTÓN (POP CORN),2024-12-03 19:59:07.848142
Papa Cocktail Blanca Agro Selecto 800g,S/ 6.00,metro,MAÍZ REVENTÓN (POP CORN),2024-12-03 19:59:07.848142
Juguete Preescolar Fisher Price Amigos Poppity Pop,S/ 27.90,metro,MAÍZ REVENTÓN (POP CORN),2024-12-03 19:59:07.848142
Sérum Amarás Raíces y Puntas Felices 60ml,S/ 18.90,metro,MAÍZ REVENTÓN (POP CORN),2024-12-03 19:59:07.848142
Siu Mai de Cerdo Dim Sum 6un,S/ 15.90,metro,MAÍZ REVENTÓN (POP CORN),2024-12-03 19:59:07.848142
Muñeca Barbie Pop Reveal Serie de Frutas Surtido,S/ 109.90,metro,MAÍZ REVENTÓN (POP CORN),2024-12-03 19:59:07.848142
Retocador de Raíces Temporal Castaño Claro Magic Retouch Spray 75 ml,S/ 38.50,metro,MAÍZ REVENTÓN (POP CORN),2024-12-03 19:59:07.848142
Acondicionador Amarás Raíces y Puntas Felices 260ml,S/ 7.50,metro,MAÍZ REVENTÓN (POP CORN),2024-12-03 19:59:07.848142
Retocador Nutrisse Raíz Tono 70,S/ 11.30,metro,MAÍZ REVENTÓN (POP CORN),2024-12-03 19:59:07.848142
Siu Mai de Pollo Dim Sum 6un,S/ 15.90,metro,MAÍZ REVENTÓN (POP CORN),2024-12-03 19:59:07.848142
Cereal Corn Flakes Ángel 650g,S/ 14.30,metro,MAÍZ REVENTÓN (POP CORN),2024-12-03 19:59:07.848142
Cereal de Quinua Nura Caramel Pops 200g,S/ 21.50,metro,MAÍZ REVENTÓN (POP CORN),2024-12-03 19:59:07.848142
Pack x3 Rompecabezas Pop Up Cartas Gabby 24 Piezas,S/ 39.90,metro,MAÍZ REVENTÓN (POP CORN),2024-12-03 19:59:07.848142
Papa Negra Andina Agro Selecto 2Kg,S/ 11.50,metro,MAÍZ REVENTÓN (POP CORN),2024-12-03 19:59:07.848142
Lapicero Tinta Gel Pop Lol Pilot Azul y Rojo,S/ 10.90,metro,MAÍZ REVENTÓN (POP CORN),2024-12-03 19:59:07.848142
Chupete Mini Mr Pops Pintalengua 200g,S/ 6.80,metro,MAÍZ REVENTÓN (POP CORN),2024-12-03 19:59:07.848142
Sazonador Costeño Pops Sabor Queso 64g,S/ 11.20,metro,MAÍZ REVENTÓN (POP CORN),2024-12-03 19:59:07.848142
Siu Mai de Pollo Deli Freeze 24un,S/ 30.90,metro,MAÍZ REVENTÓN (POP CORN),2024-12-03 19:59:07.848142
Pre Shampoo Amarás Raíces y Puntas Felices 300ml,S/ 15.90,metro,MAÍZ REVENTÓN (POP CORN),2024-12-03 19:59:07.848142
Yacón x kg,S/ 8.99 x kg,metro,MAÍZ REVENTÓN (POP CORN),2024-12-03 19:59:07.848142
Retocador de Raíces Castaño Schwarzkopf Spray 120 ml,S/ 37.90,metro,MAÍZ REVENTÓN (POP CORN),2024-12-03 19:59:07.848142
Papa Perricholi Agroselecto 1kg,S/ 4.80,metro,MAÍZ REVENTÓN (POP CORN),2024-12-03 19:59:07.848142
Shampoo Head & Shoulders Crece Fuerte desde la Raíz 650ml,S/ 29.90,metro,MAÍZ REVENTÓN (POP CORN),2024-12-03 19:59:07.848142
Andadera Fisher-Price Corn Popper,S/ 79.90,metro,MAÍZ REVENTÓN (POP CORN),2024-12-03 19:59:07.848142
Acondicionador Head & Shoulders Crece Fuerte desde la Raíz Tubo 300 ml,S/ 19.50,metro,MAÍZ REVENTÓN (POP CORN),2024-12-03 19:59:07.848142
Papa Tricolor Cocktail Agro Selecto 800 g,S/ 7.50,metro,MAÍZ REVENTÓN (POP CORN),2024-12-03 19:59:07.848142
Retocador de Raíces Negro Schwarzkopf Spray 120 ml,S/ 37.90,metro,MAÍZ REVENTÓN (POP CORN),2024-12-03 19:59:07.848142
Tinte para Cabello en Crema 60 Tonos Rubios Oscuros de Raíz Sachet 20 g,S/ 11.30,metro,MAÍZ REVENTÓN (POP CORN),2024-12-03 19:59:07.848142
Siu Mai de Cerdo Deli Freeze 24un,S/ 30.90,metro,MAÍZ REVENTÓN (POP CORN),2024-12-03 19:59:07.848142
Retocador de Raíces Castaño Oscuro Schwarzkopf Spray 120 ml,S/ 37.90,metro,MAÍZ REVENTÓN (POP CORN),2024-12-03 19:59:07.848142
Quitasol Outzen Caño 1.8mt Colores Pop Surtido,S/ 29.94,metro,MAÍZ REVENTÓN (POP CORN),2024-12-03 19:59:07.848142
Pack x3 Rompecabezas Pop Up Cartas 24 Piezas,S/ 39.90,metro,MAÍZ REVENTÓN (POP CORN),2024-12-03 19:59:07.848142
Chocolate Chin Chin Pop Barra 90g,S/ 6.99,metro,MAÍZ REVENTÓN (POP CORN),2024-12-03 19:59:07.848142
Licor 7 Raices Fuerte El Aguajal Botella 750ml,S/ 29.90,metro,MAÍZ REVENTÓN (POP CORN),2024-12-03 19:59:07.848142
Shampoo Head & Shoulders Crece Fuerte desde la Raíz Frasco 375 ml,S/ 19.50,metro,MAÍZ REVENTÓN (POP CORN),2024-12-03 19:59:07.848142
Papa Huamantanga Agro Selecto 1Kg,S/ 7.50,metro,MAÍZ REVENTÓN (POP CORN),2024-12-03 19:59:07.848142
Caramelo Push Pop Sabor Frutos del Bosque 14g,S/ 4.80,metro,MAÍZ REVENTÓN (POP CORN),2024-12-03 19:59:07.848142
Artesco Banderitas Adhesivas Rectangulares Pop Up Sticky Notes Blíster 150 und,S/ 4.00,metro,MAÍZ REVENTÓN (POP CORN),2024-12-03 19:59:07.848142
Caramelo Spring Pop Minions 14g Surtido,S/ 3.30,metro,MAÍZ REVENTÓN (POP CORN),2024-12-03 19:59:07.848142
Papa Negra Andina Procesada x kg,S/ 4.69 x kg,metro,MAÍZ REVENTÓN (POP CORN),2024-12-03 19:59:07.848142
Papa Amarilla Peruanita Agro Selecto 2kg,S/ 17.00,metro,MAÍZ REVENTÓN (POP CORN),2024-12-03 19:59:07.848142
Cepillo de Dientes Colgate Total Active Prevention Suave 2un,S/ 19.90,metro,MAÍZ REVENTÓN (POP CORN),2024-12-03 19:59:07.848142
Lapicero Tinta Gel Pop Lol Pilot 4 Unid,S/ 19.20,metro,MAÍZ REVENTÓN (POP CORN),2024-12-03 19:59:07.848142
Shampoo Head & Shoulders Crece Fuerte desde la Raíz Frasco 1 Lt,S/ 48.90,metro,MAÍZ REVENTÓN (POP CORN),2024-12-03 19:59:07.848142
Ziyaz Silla Fija Grandda Pop,S/ 569.00,metro,MAÍZ REVENTÓN (POP CORN),2024-12-03 19:59:07.848142
Lapicero Tinta Gel Pop Lol Pilot Rojo,S/ 10.30,metro,MAÍZ REVENTÓN (POP CORN),2024-12-03 19:59:07.848142
Bolígrafo Pilot Pop Lol 4un,S/ 19.20,metro,MAÍZ REVENTÓN (POP CORN),2024-12-03 19:59:07.848142
Caja Olego Pop Corn Premium Azul 10un,S/ 6.90,metro,MAÍZ REVENTÓN (POP CORN),2024-12-03 19:59:07.848142
Caja Olego Pop Corn Premium Rojo 10un,S/ 6.90,metro,MAÍZ REVENTÓN (POP CORN),2024-12-03 19:59:07.848142
Stick'n Banderitas Adhesivas Pop Up Lite Pack 20 unid Surtido,S/ 5.60,metro,MAÍZ REVENTÓN (POP CORN),2024-12-03 19:59:07.848142
Papa Blanca Perricholi Procesada Agro Selecto,S/ 9.50,metro,MAÍZ REVENTÓN (POP CORN),2024-12-03 19:59:07.848142
Juego Mesa Pop Up y Memoria Paw Patrol,S/ 49.90,metro,MAÍZ REVENTÓN (POP CORN),2024-12-03 19:59:07.848142
Helado Pop Corn Dulce Pasión 5L,S/ 99.90,metro,MAÍZ REVENTÓN (POP CORN),2024-12-03 19:59:07.848142
Ziyaz Silla Fija Tania Pop,S/ 519.00,metro,MAÍZ REVENTÓN (POP CORN),2024-12-03 19:59:07.848142
Paper Mate Lapiceros Punta Media Flair Candy Pop! Pack 6 unid,S/ 17.57,metro,MAÍZ REVENTÓN (POP CORN),2024-12-03 19:59:07.848142
Ziyaz Sillón Fijo Botero Pop,"S/ 1,499.00",metro,MAÍZ REVENTÓN (POP CORN),2024-12-03 19:59:07.848142
Cepillos para Cabello Conair Color Pops 2un,S/ 32.90,metro,MAÍZ REVENTÓN (POP CORN),2024-12-03 19:59:07.848142
Vino Tinto Malbec Andeluna Raíces Botella 750ml,S/ 55.00,metro,MAÍZ REVENTÓN (POP CORN),2024-12-03 19:59:07.848142
Flotador Bestway Arte POP 70cm,S/ 44.90,metro,MAÍZ REVENTÓN (POP CORN),2024-12-03 19:59:07.848142
Libro Dgeditorial Historias Pop Up Animales,S/ 14.90,metro,MAÍZ REVENTÓN (POP CORN),2024-12-03 19:59:07.848142
Libro Actividades Mis Amigos Pop Up 4 Titulos,S/ 34.99,metro,MAÍZ REVENTÓN (POP CORN),2024-12-03 19:59:07.848142
Libro Cuentos Clasicos Pop-Up 4Tit,S/ 11.99,metro,MAÍZ REVENTÓN (POP CORN),2024-12-03 19:59:07.848142
Baby Pop Up Dinosaurios,S/ 29.99,metro,MAÍZ REVENTÓN (POP CORN),2024-12-03 19:59:07.848142
Baby Pop Up Animales del Mar,S/ 29.99,metro,MAÍZ REVENTÓN (POP CORN),2024-12-03 19:59:07.848142
Baby Pop Up Animales de la Granja,S/ 29.99,metro,MAÍZ REVENTÓN (POP CORN),2024-12-03 19:59:07.848142
Libro Animales Pop Up Peligro en la Jungla,S/ 14.90,metro,MAÍZ REVENTÓN (POP CORN),2024-12-03 19:59:07.848142
