brand,description,price,website,search_term,scrape_timestamp,cantidad,unidad,description_no_unit,price_numeric
Friskies,Comida para Gatos FRISKIES Adulto Selecci贸n Especial Bolsa 7.5kg,S/ 87.00 8%,vega,PEPINO,2024-12-05 12:41:40.161994,7.5,kg,Comida para Gatos FRISKIES Adulto Selecci贸n Especial Bolsa,87.0
Sapolio,Desinfectante Multiuso SAPOLIO Pino Botella 900ml,S/ 5.50,vega,PEPINO,2024-12-05 12:41:40.161994,900.0,ml,Desinfectante Multiuso SAPOLIO Pino Botella,5.5
Vclean,Limpiador VCLEAN Pino Gal贸n 4L,S/ 10.90,vega,PEPINO,2024-12-05 12:41:40.161994,4.0,l,Limpiador VCLEAN Pino Gal贸n,10.9
Vclean,Limpiador VCLEAN Pino Botella 900ml,S/ 3.20,vega,PEPINO,2024-12-05 12:41:40.161994,900.0,ml,Limpiador VCLEAN Pino Botella,3.2
Pinesol,Desinfectante Multiuso PINESOL Pino Botella 900ml,S/ 10.70,vega,PEPINO,2024-12-05 12:41:40.161994,900.0,ml,Desinfectante Multiuso PINESOL Pino Botella,10.7
