unit,description,price,website,search_term,scrape_timestamp
10un,Snacks PET CARE Banana y Pollo Bolsa TMC-46 10...,S/ 10.10 un,plaza_vea,PANCETA (CARNE DE CERDO),2024-12-03 22:20:28.609680
Presentación 1.755 kg aprox.,Tira de Panceta sin Piel REDONDOS Duroc x kg,S/ 39.90 x kg,plaza_vea,PANCETA (CARNE DE CERDO),2024-12-03 22:20:28.609680
Doypack 2un,Comida para Perros RAMBALA Adulto Orejas de Ce...,S/ 9 un,plaza_vea,PANCETA (CARNE DE CERDO),2024-12-03 22:20:28.609680
Pack 2un,Packs Pañales PAMPERS Premium Care + Pañales P...,S/ 145.90 un,plaza_vea,PANCETA (CARNE DE CERDO),2024-12-03 22:20:28.609680
Bandeja 500g,Lasagna de Carne IL PASTIFICIO Bandeja 500g,S/ 31.99 un,plaza_vea,PANCETA (CARNE DE CERDO),2024-12-03 22:20:28.609680
Bolsa 8Kg,Comida para Perros RICOCAN Cachorros Razas Peq...,S/ 76.90 un,plaza_vea,PANCETA (CARNE DE CERDO),2024-12-03 22:20:28.609680
Paquete 86un,Pañales para Bebé PAMPERS Premium Care Talla M...,S/ 88.90 un,plaza_vea,PANCETA (CARNE DE CERDO),2024-12-03 22:20:28.609680
Caja 12un,Wantan de Cerdo DELIFREEZE Caja 12un,S/ 11.90 un,plaza_vea,PANCETA (CARNE DE CERDO),2024-12-03 22:20:28.609680
,Tripack Toalla Húmeda PET CARE Vainilla Bolsa ...,S/ 20.90 un,plaza_vea,PANCETA (CARNE DE CERDO),2024-12-03 22:20:28.609680
,Limpiador de Botellas SCOTCH-BRITE Cero Rayas ...,S/ 13.20 un,plaza_vea,PANCETA (CARNE DE CERDO),2024-12-03 22:20:28.609680
Bolsa 3Kg,Comida para Perros RICOCAN Cachorros Razas Med...,S/ 33.50 un,plaza_vea,PANCETA (CARNE DE CERDO),2024-12-03 22:20:28.609680
Bandeja 200g,Estofado de Carne BELL'S Bandeja 200g,S/ 8.99 un,plaza_vea,PANCETA (CARNE DE CERDO),2024-12-03 22:20:28.609680
Pote 250g,Salsa Artesanal de carne IL PASTIFICIO Pote 25...,S/ 18.30 un,plaza_vea,PANCETA (CARNE DE CERDO),2024-12-03 22:20:28.609680
Bandeja 380g,Lasagna de Carne IL PASTIFICIO Bandeja 380g,S/ 17.99 un,plaza_vea,PANCETA (CARNE DE CERDO),2024-12-03 22:20:28.609680
Presentación 1.2 kg aprox.,Pulpa de Pierna de Cerdo SAN FERNANDO,S/ 35.90 x kg,plaza_vea,PANCETA (CARNE DE CERDO),2024-12-03 22:20:28.609680
Presentación 10 kg aprox.,Pierna de Cerdo Deshuesada Congelada x kg,S/ 18.90 x kg,plaza_vea,PANCETA (CARNE DE CERDO),2024-12-03 22:20:28.609680
,Desodorante para mujer Aerosol LEA Women Dry C...,S/ 10.70 un,plaza_vea,PANCETA (CARNE DE CERDO),2024-12-03 22:20:28.609680
Bolsa 9Kg,"Comida para Gatos MMASKOT Gatitos Sabor Pollo,...",S/ 88.70 un,plaza_vea,PANCETA (CARNE DE CERDO),2024-12-03 22:20:28.609680
Pack 2un,Packs Pañales Desechables PAMPERS Premium Care...,S/ 145.90 un,plaza_vea,PANCETA (CARNE DE CERDO),2024-12-03 22:20:28.609680
Bolsa 6un,Pan Artesanal Congelado PANCITOS DEL SUR Relle...,S/ 24.20 un,plaza_vea,PANCETA (CARNE DE CERDO),2024-12-03 22:20:28.609680
Bolsa 500g,Ravioles de Carne DELLA NONA Bolsa 500g,S/ 21.50 un,plaza_vea,PANCETA (CARNE DE CERDO),2024-12-03 22:20:28.609680
Bolsa 1Kg,Comida para Perros RICOCAN Cachorros Razas Peq...,S/ 12.50 un,plaza_vea,PANCETA (CARNE DE CERDO),2024-12-03 22:20:28.609680
Bolsa 500g,Comida para gatos RICOCAT Gatitos carne pescad...,S/ 8.50 un,plaza_vea,PANCETA (CARNE DE CERDO),2024-12-03 22:20:28.609680
Sobre 50un,Panela Orgánica ONZA Caja 50 Sobres,S/ 10.90 un,plaza_vea,PANCETA (CARNE DE CERDO),2024-12-03 22:20:28.609680
,Pijamas Macetas mujer SINGULAR,S/ 29.90 un,plaza_vea,PANCETA (CARNE DE CERDO),2024-12-03 22:20:28.609680
Presentación 2.6 kg aprox.,Panceta en Tiras sin Hueso y sin Piel SAN FERN...,S/ 43.90 x kg,plaza_vea,PANCETA (CARNE DE CERDO),2024-12-03 22:20:28.609680
Bolsa 1Kg,"Comida para Gatos RICOCAT Adultos Carne, Salmó...",S/ 14.50 un,plaza_vea,PANCETA (CARNE DE CERDO),2024-12-03 22:20:28.609680
,Menestrón con Carne de Res en Semiconserva 750...,S/ 12.90 un,plaza_vea,PANCETA (CARNE DE CERDO),2024-12-03 22:20:28.609680
Bolsa 38un,Pañales HUGGIES Natural Care Pants XG Paquete ...,S/ 41.90 un,plaza_vea,PANCETA (CARNE DE CERDO),2024-12-03 22:20:28.609680
,Enrollado Vegetariano EL CEDRO 1un,S/ 7.50 un,plaza_vea,PANCETA (CARNE DE CERDO),2024-12-03 22:20:28.609680
Doypack 80g,Comida para Perros YAMIS Adulto Rollitos Sabor...,S/ 7 un,plaza_vea,PANCETA (CARNE DE CERDO),2024-12-03 22:20:28.609680
Presentación 1.625 kg aprox.,Pernil de Cerdo REDONDOS Duroc x kg,S/ 25.90 x kg,plaza_vea,PANCETA (CARNE DE CERDO),2024-12-03 22:20:28.609680
Bolsa 400g,Sorrentinos de Carne Ahumada BELL'S Bolsa 400g,S/ 17.90 un,plaza_vea,PANCETA (CARNE DE CERDO),2024-12-03 22:20:28.609680
Caja 5un,Frio Rico D'ONOFRIO Paleta Mini Sabor Maracuyá...,S/ 24.50 un,plaza_vea,PANCETA (CARNE DE CERDO),2024-12-03 22:20:28.609680
Bandeja 1Kg,Lasagna de Carne EL FIORENTINO Bandeja 1kg,S/ 35.90 un,plaza_vea,PANCETA (CARNE DE CERDO),2024-12-03 22:20:28.609680
Pack 2un,Pack Gaseosa INCA KOLA Botella 1L + Empanada d...,S/ 15.90 un,plaza_vea,PANCETA (CARNE DE CERDO),2024-12-03 22:20:28.609680
Bolsa 250g,Chifles Cancha y Carne Seca EL ARTESANO Artich...,S/ 13.90 un,plaza_vea,PANCETA (CARNE DE CERDO),2024-12-03 22:20:28.609680
Caja 12un,Empanaditas de Carne BELL'S Caja 12un,S/ 19.90 un,plaza_vea,PANCETA (CARNE DE CERDO),2024-12-03 22:20:28.609680
Bandeja 500g,Raviolitos DON ITALO de Carne Bandeja 500g,S/ 23.90 un,plaza_vea,PANCETA (CARNE DE CERDO),2024-12-03 22:20:28.609680
Bolsa 500g,Pierna de Cerdo Deshuesada LA FLORENCIA 500g,S/ 24.90 un,plaza_vea,PANCETA (CARNE DE CERDO),2024-12-03 22:20:28.609680
,Enrollado de Pollo EL CEDRO 1un,S/ 7.50 un,plaza_vea,PANCETA (CARNE DE CERDO),2024-12-03 22:20:28.609680
,Parlante Karaoke KUZLER Led Multicolor Arne-10...,S/ 349 un,plaza_vea,PANCETA (CARNE DE CERDO),2024-12-03 22:20:28.609680
Bolsa 6un,Pan Artesanal Congelado PANCITOS DEL SUR Relle...,S/ 24.20 un,plaza_vea,PANCETA (CARNE DE CERDO),2024-12-03 22:20:28.609680
Presentación 1.56 kg aprox.,Picaña de Cerdo REDONDOS Duroc x kg,S/ 37.50 x kg,plaza_vea,PANCETA (CARNE DE CERDO),2024-12-03 22:20:28.609680
Bandeja 500g,Lasagna de Carne EL FIORENTINO Bandeja 500g,S/ 21.40 un,plaza_vea,PANCETA (CARNE DE CERDO),2024-12-03 22:20:28.609680
Pack 2un,Pack Gaseosa COCA COLA Sin Azúcar Botella 1L +...,S/ 15.90 un,plaza_vea,PANCETA (CARNE DE CERDO),2024-12-03 22:20:28.609680
Presentación 0.91 kg aprox.,Baby Back Ribs de Cerdo AGROSUPER,S/ 44.90 x kg,plaza_vea,PANCETA (CARNE DE CERDO),2024-12-03 22:20:28.609680
Bolsa 15Kg,Comida para Perros MIMASKOT Adultos Todas las ...,S/ 99.90 un,plaza_vea,PANCETA (CARNE DE CERDO),2024-12-03 22:20:28.609680
,"Comida para Gatos CAT CHOW Gatitos Carne, Pesc...",S/ 13.50 un,plaza_vea,PANCETA (CARNE DE CERDO),2024-12-03 22:20:28.609680
,Comida para Perros DOG CHOW Adultos todos los ...,S/ 44.60 un,plaza_vea,PANCETA (CARNE DE CERDO),2024-12-03 22:20:28.609680
Frasco 400ml,Shampoo para Gatos PET CARE Frasco 400ml,S/ 13.10 un,plaza_vea,PANCETA (CARNE DE CERDO),2024-12-03 22:20:28.609680
Bolsa 500g,Cappellitti de Carne DELLA NONNA Bolsa 500g,S/ 20.60 un,plaza_vea,PANCETA (CARNE DE CERDO),2024-12-03 22:20:28.609680
,Ravioles con Carne en Salsa Napolitana Bandeja...,S/ 13.90 un,plaza_vea,PANCETA (CARNE DE CERDO),2024-12-03 22:20:28.609680
Bolsa 1.5Kg,Comida para Perros DOG CHOW Cachorros Medianos...,S/ 24.50 un,plaza_vea,PANCETA (CARNE DE CERDO),2024-12-03 22:20:28.609680
Paquete 85g,Alimento Húmedo para Perros PURINA One Adulto ...,S/ 5.90 un,plaza_vea,PANCETA (CARNE DE CERDO),2024-12-03 22:20:28.609680
,Tripack Toalla Húmeda PET CARE Limón Bolsa 50u...,S/ 20.90 un,plaza_vea,PANCETA (CARNE DE CERDO),2024-12-03 22:20:28.609680
Pack 2un,Repuestos para Afeitar Gillette Venus Platinum...,S/ 39.90 un,plaza_vea,PANCETA (CARNE DE CERDO),2024-12-03 22:20:28.609680
,Pack PAMPERS Pañales Premium Care Talla M Paqu...,S/ 145.90 un,plaza_vea,PANCETA (CARNE DE CERDO),2024-12-03 22:20:28.609680
Presentación 0.8 kg aprox.,Baby Back de Cerdo EL BUEN CORTE,S/ 33.90 x kg,plaza_vea,PANCETA (CARNE DE CERDO),2024-12-03 22:20:28.609680
Pack 2un,Packs Pañales Desechables PAMPERS Premium Care...,S/ 145.90 un,plaza_vea,PANCETA (CARNE DE CERDO),2024-12-03 22:20:28.609680
Lata 190g,Comida para Perros RICOCAT Cachorro Todas las ...,S/ 4.50 un,plaza_vea,PANCETA (CARNE DE CERDO),2024-12-03 22:20:28.609680
,Cepillo de Pisos ETERNA Cerda Dura,S/ 19.90 un,plaza_vea,PANCETA (CARNE DE CERDO),2024-12-03 22:20:28.609680
Pack 2un,Pack Gaseosa INCA KOLA Sin Azúcar Botella 1L +...,S/ 15.90 un,plaza_vea,PANCETA (CARNE DE CERDO),2024-12-03 22:20:28.609680
Lata 330g,Comida para Perros THOR Pate de Carne para Cac...,S/ 4.90 un,plaza_vea,PANCETA (CARNE DE CERDO),2024-12-03 22:20:28.609680
,Maceta DECO HOME C/Flores Surt Acuarela Románt...,S/ 2.90 un,plaza_vea,PANCETA (CARNE DE CERDO),2024-12-03 22:20:28.609680
Bolsa 400g,Raviolito Carne Kids IL PASTIFICIO Caja 400g,S/ 18.10 un,plaza_vea,PANCETA (CARNE DE CERDO),2024-12-03 22:20:28.609680
Presentación 8 kg aprox.,Pierna de Cerdo Deshuesada EL BUEN CORTE,S/ 24.90 x kg,plaza_vea,PANCETA (CARNE DE CERDO),2024-12-03 22:20:28.609680
Presentación 0.65 kg aprox.,Tomahawk de Cerdo EL BUEN CORTE,S/ 45.90 x kg,plaza_vea,PANCETA (CARNE DE CERDO),2024-12-03 22:20:28.609680
,Lomito Saltado de Cerdo Duroc REDONDOS Paquete...,S/ 19.90 un,plaza_vea,PANCETA (CARNE DE CERDO),2024-12-03 22:20:28.609680
Bolsa 1Kg,"Comida para Gatos MIMASKOT Adultos Pollo, Carn...",S/ 13.49 un,plaza_vea,PANCETA (CARNE DE CERDO),2024-12-03 22:20:28.609680
,Paleta de Chocolate con Temática Bolsa 1un,S/ 2.90 un,plaza_vea,PANCETA (CARNE DE CERDO),2024-12-03 22:20:28.609680
Presentación 1.1 kg aprox.,Lomito de Cerdo Marinado a la Oriental OTTO KU...,S/ 39.90 x kg,plaza_vea,PANCETA (CARNE DE CERDO),2024-12-03 22:20:28.609680
,Enrollado de Jamón y Queso EL CEDRO 1un,S/ 7.50 un,plaza_vea,PANCETA (CARNE DE CERDO),2024-12-03 22:20:28.609680
,Triple de Queso Huevo y Jamón EL CEDRO 1un,S/ 7.50 un,plaza_vea,PANCETA (CARNE DE CERDO),2024-12-03 22:20:28.609680
Presentación 2.6 kg aprox.,Ribs de Cerdo REDONDOS Duroc x kg,S/ 39.90 x kg,plaza_vea,PANCETA (CARNE DE CERDO),2024-12-03 22:20:28.609680
Doypack 350g,Aderezo para Carne de Cerdo PIKI Doypack 350gr,S/ 7.80 un,plaza_vea,PANCETA (CARNE DE CERDO),2024-12-03 22:20:28.609680
Bandeja 1Kg,Lasagna Rellena de Carne IL PASTIFICIO Bandeja...,S/ 56.99 un,plaza_vea,PANCETA (CARNE DE CERDO),2024-12-03 22:20:28.609680
Bolsa 1Kg,Comida para Gatos MIMASKOT Gatitos Sabor Pollo...,S/ 13.49 un,plaza_vea,PANCETA (CARNE DE CERDO),2024-12-03 22:20:28.609680
Paquete 1un,Máquina de Afeitar GILLETTE VENUS Platinum Car...,S/ 39.90 un,plaza_vea,PANCETA (CARNE DE CERDO),2024-12-03 22:20:28.609680
Caja 1Kg,Lasagna DON ITALO de Carne Caja 1Kg,S/ 59.90 un,plaza_vea,PANCETA (CARNE DE CERDO),2024-12-03 22:20:28.609680
Frasco 200ml,Espuma de Afeitar NIVEA Men Protect & Care Fra...,S/ 33.90 un,plaza_vea,PANCETA (CARNE DE CERDO),2024-12-03 22:20:28.609680
Botella 750ml,Vino Tinto LOS CARDOS Cabernet Sauvignon Botel...,S/ 37.90 un,plaza_vea,PANCETA (CARNE DE CERDO),2024-12-03 22:20:28.609680
Paquete 64un,Pañales para Bebé PAMPERS Premium Care Pants T...,S/ 76.90 un,plaza_vea,PANCETA (CARNE DE CERDO),2024-12-03 22:20:28.609680
,Maceta DECO HOME Negra C/Plan Surt Urbana Indu...,S/ 9.90 un,plaza_vea,PANCETA (CARNE DE CERDO),2024-12-03 22:20:28.609680
,Gourmet Paté con Carne RICOCAT Lata para Gatos...,S/ 4.50 un,plaza_vea,PANCETA (CARNE DE CERDO),2024-12-03 22:20:28.609680
,Set de Témperas ARTESCO 7 Colores Pote 30ml + ...,S/ 7.90 un,plaza_vea,PANCETA (CARNE DE CERDO),2024-12-03 22:20:28.609680
Presentación 0.7 kg aprox.,Chorizo de Cerdo AHUMADOS TAVANCHO x kg,S/ 50.90 x kg,plaza_vea,PANCETA (CARNE DE CERDO),2024-12-03 22:20:28.609680
Pack 2un,Pack Empanada de Carne + Gaseosa COCA COLA Sin...,S/ 4.90 un,plaza_vea,PANCETA (CARNE DE CERDO),2024-12-03 22:20:28.609680
Presentación 0.65 kg aprox.,Tomahawk de Cerdo REDONDOS Duroc x kg,S/ 42.50 x kg,plaza_vea,PANCETA (CARNE DE CERDO),2024-12-03 22:20:28.609680
Frasco 250ml,Laca URBAN CARE Hair Spray Style Guide Frasco ...,S/ 49.90 un,plaza_vea,PANCETA (CARNE DE CERDO),2024-12-03 22:20:28.609680
,Fiambre de Cerdo TULIP Lata 200g,S/ 12.50 un,plaza_vea,PANCETA (CARNE DE CERDO),2024-12-03 22:20:28.609680
,Maceta DECO HOME C/Planta Surt Urbana Industri...,S/ 12.90 un,plaza_vea,PANCETA (CARNE DE CERDO),2024-12-03 22:20:28.609680
Caja 440g,Papa Rellena Cocida Congelada de Carne BELL'S ...,S/ 14.90 un,plaza_vea,PANCETA (CARNE DE CERDO),2024-12-03 22:20:28.609680
Bolsa 9Kg,"Alimento para Gatos SUPERCAT Adulto Pollo, Car...",S/ 79.50 un,plaza_vea,PANCETA (CARNE DE CERDO),2024-12-03 22:20:28.609680
Bolsa 1Kg,Comida para Perros SUPERCAN Cachorros Sabor Ca...,S/ 10.90 un,plaza_vea,PANCETA (CARNE DE CERDO),2024-12-03 22:20:28.609680
Botella 750ml,Vino Tinto LOS CARDOS Malbec Botella 750ml,S/ 37.90 un,plaza_vea,PANCETA (CARNE DE CERDO),2024-12-03 22:20:28.609680
Frasco 198ml,Crema para Peinar HASK Curl Care Frasco 198ml,S/ 46.10 un,plaza_vea,PANCETA (CARNE DE CERDO),2024-12-03 22:20:28.609680
Frasco 100ml,Bálsamo After shave NIVEA Men Protect & Care -...,S/ 28.90 un,plaza_vea,PANCETA (CARNE DE CERDO),2024-12-03 22:20:28.609680
,Colonia para Macotas PET CARE Lemon Botella 17...,S/ 9.80 un,plaza_vea,PANCETA (CARNE DE CERDO),2024-12-03 22:20:28.609680
Botella 750ml,Vino Blanco LOS CARDOS Sauvignon Blanc Botella...,S/ 37.90 un,plaza_vea,PANCETA (CARNE DE CERDO),2024-12-03 22:20:28.609680
Bolsa 1un,Paleta de Chocolate 1un,S/ 3.20 un,plaza_vea,PANCETA (CARNE DE CERDO),2024-12-03 22:20:28.609680
Bolsa un,Toallitas Húmedas PET CARE Mascotas Vainilla P...,S/ 2.30 un,plaza_vea,PANCETA (CARNE DE CERDO),2024-12-03 22:20:28.609680
,Magro de Cerdo TULIP Lata 454g,S/ 42.50 un,plaza_vea,PANCETA (CARNE DE CERDO),2024-12-03 22:20:28.609680
Presentación 0.611 kg aprox.,Entraña Fina de Cerdo EL BUEN CORTE,S/ 39.90 x kg,plaza_vea,PANCETA (CARNE DE CERDO),2024-12-03 22:20:28.609680
Paquete un,Toallitas Húmedas PET CARE Mascotas Limón Paqu...,S/ 2.30 un,plaza_vea,PANCETA (CARNE DE CERDO),2024-12-03 22:20:28.609680
Botella 750ml,Vino Tinto NAVARRO CORREAS Selección Parcelas ...,S/ 59.90 un,plaza_vea,PANCETA (CARNE DE CERDO),2024-12-03 22:20:28.609680
Pack 2un,Packs Pañales Desechables PAMPERS Premium Care...,S/ 145.90 un,plaza_vea,PANCETA (CARNE DE CERDO),2024-12-03 22:20:28.609680
,Cuchillo para Carne TRAMONTINA 8'' Mango Blanc...,S/ 51.90 un,plaza_vea,PANCETA (CARNE DE CERDO),2024-12-03 22:20:28.609680
,Comida para Perros RICOCAN Adulto Carne Bolsa ...,S/ 33.50 un,plaza_vea,PANCETA (CARNE DE CERDO),2024-12-03 22:20:28.609680
Bolsa 1un,Comida para Perro DOG CHOW Adulto todos los ta...,S/ 99.90 un,plaza_vea,PANCETA (CARNE DE CERDO),2024-12-03 22:20:28.609680
Bolsa 130g,Paleta Artesanal PALETAS FACTORY Pie de Limón ...,S/ 8.30 un,plaza_vea,PANCETA (CARNE DE CERDO),2024-12-03 22:20:28.609680
Presentación 1.365 kg aprox.,Lomito Fino de Cerdo OTTO KUNZ,S/ 42.50 x kg,plaza_vea,PANCETA (CARNE DE CERDO),2024-12-03 22:20:28.609680
Pack 2un,Pack Empanada de Carne + Gaseosa INCA KOLA Sin...,S/ 4.90 un,plaza_vea,PANCETA (CARNE DE CERDO),2024-12-03 22:20:28.609680
Paquete 100g,Alimento Húmedo para Perros DOG CHOW Adultos M...,S/ 3.90 un,plaza_vea,PANCETA (CARNE DE CERDO),2024-12-03 22:20:28.609680
Paquete 1un,Paleta Brownie Grande 1un,S/ 5.90 un,plaza_vea,PANCETA (CARNE DE CERDO),2024-12-03 22:20:28.609680
Presentación 1.1 kg aprox.,Lomito de Cerdo Marinado a la Criolla OTTO KUN...,S/ 39.90 x kg,plaza_vea,PANCETA (CARNE DE CERDO),2024-12-03 22:20:28.609680
Bolsa 1Kg,"Alimento para Gatos SUPERCAT Adulto Pollo, Car...",S/ 13 un,plaza_vea,PANCETA (CARNE DE CERDO),2024-12-03 22:20:28.609680
,Set de Témperas ARTESCO Past Pote 20ml Paquete...,S/ 7.70 un,plaza_vea,PANCETA (CARNE DE CERDO),2024-12-03 22:20:28.609680
Bolsa 130g,Paleta Artesanal PALETAS FACTORY Chocolate con...,S/ 8.30 un,plaza_vea,PANCETA (CARNE DE CERDO),2024-12-03 22:20:28.609680
Bolsa 1Kg,Comida para Perros RICOCAN Cachorros Razas Med...,S/ 12.50 un,plaza_vea,PANCETA (CARNE DE CERDO),2024-12-03 22:20:28.609680
,Cuchillo de Cocina TRAMONTINA 8'' Mango Negro,S/ 14.90 un,plaza_vea,PANCETA (CARNE DE CERDO),2024-12-03 22:20:28.609680
,Polo Deportivo Bvd/Manga Cero SINGULAR Mujer P...,S/ 9.90 un,plaza_vea,PANCETA (CARNE DE CERDO),2024-12-03 22:20:28.609680
Bolsa 2Kg,Alimento para Perro PURINA One Adultos Minis y...,S/ 53.90 un,plaza_vea,PANCETA (CARNE DE CERDO),2024-12-03 22:20:28.609680
,Maceta DECO HOME C/Planta Tulipan Acuarela Rom...,S/ 13.90 un,plaza_vea,PANCETA (CARNE DE CERDO),2024-12-03 22:20:28.609680
,Tomatodo PANDITAS Caña Baby 260ml Rosado,S/ 17.90 un,plaza_vea,PANCETA (CARNE DE CERDO),2024-12-03 22:20:28.609680
,Libro PLANETA Eleva Tu Juego Culinario 2024,S/ 69.90 un,plaza_vea,PANCETA (CARNE DE CERDO),2024-12-03 22:20:28.609680
,Comida para Perros RICOCAN Adulto Carne Bolsa ...,S/ 13.10 un,plaza_vea,PANCETA (CARNE DE CERDO),2024-12-03 22:20:28.609680
Bandeja 1un,Ravioles de Carne Sin Lactosa IL PASTIFICIO Ba...,S/ 29.90 un,plaza_vea,PANCETA (CARNE DE CERDO),2024-12-03 22:20:28.609680
Bolsa 1un,Comida para Perro DOG CHOW Adulto todos los ta...,S/ 36.50 un,plaza_vea,PANCETA (CARNE DE CERDO),2024-12-03 22:20:28.609680
Bolsa 130g,Paleta Artesanal PALETAS FACTORY Fresa con Lec...,S/ 8.30 un,plaza_vea,PANCETA (CARNE DE CERDO),2024-12-03 22:20:28.609680
Bolsa 130g,Paleta Artesanal PALETAS FACTORY Lúcuma con Ch...,S/ 8.30 un,plaza_vea,PANCETA (CARNE DE CERDO),2024-12-03 22:20:28.609680
Bolsa 3Kg,Alimento para Perros Cachorros SUPER CAN sabor...,S/ 27.90 un,plaza_vea,PANCETA (CARNE DE CERDO),2024-12-03 22:20:28.609680
Presentación 1.82 kg aprox.,Picaña de Cerdo EL BUEN CORTE,S/ 36.90 x kg,plaza_vea,PANCETA (CARNE DE CERDO),2024-12-03 22:20:28.609680
Doypack 400g,Sal de Maras ONZA Ají Panca Doypack 400g,S/ 8.70 un,plaza_vea,PANCETA (CARNE DE CERDO),2024-12-03 22:20:28.609680
Frasco 80g,Sal de Maras ONZA Ají Panca Molinillo Frasco 8...,S/ 18.90 un,plaza_vea,PANCETA (CARNE DE CERDO),2024-12-03 22:20:28.609680
Bolsa 8Kg,Comida para Perros RICOCAN Cachorros Razas Med...,S/ 76.90 un,plaza_vea,PANCETA (CARNE DE CERDO),2024-12-03 22:20:28.609680
,Set de Cubiertos para Carne VIVA HOME 8pzas,S/ 24.90 un,plaza_vea,PANCETA (CARNE DE CERDO),2024-12-03 22:20:28.609680
,Cuchillo de Cocina TRAMONTINA 6'' Mango Marrón,S/ 13.90 un,plaza_vea,PANCETA (CARNE DE CERDO),2024-12-03 22:20:28.609680
,Cuchillo de Cocina TRAMONTINA 6'' Mango Negro,S/ 12.90 un,plaza_vea,PANCETA (CARNE DE CERDO),2024-12-03 22:20:28.609680
,Botella THERMOS Baby Care 1L (Modelos aleatori...,S/ 48.90 un,plaza_vea,PANCETA (CARNE DE CERDO),2024-12-03 22:20:28.609680
Caja 4un,Empanda BELL'S Carne Caja 4un,S/ 17.90 un,plaza_vea,PANCETA (CARNE DE CERDO),2024-12-03 22:20:28.609680
Frasco ml,Shampoo para Perros Cachorros PET CARE Protecc...,S/ 13.20 un,plaza_vea,PANCETA (CARNE DE CERDO),2024-12-03 22:20:28.609680
,Cepillo y Peine NUBY Cerdas Suaves de Nylon,S/ 29.90 un,plaza_vea,PANCETA (CARNE DE CERDO),2024-12-03 22:20:28.609680
Bolsa 1Kg,Comida para perros MIMASKOT Adultos razas medi...,S/ 11.50 un,plaza_vea,PANCETA (CARNE DE CERDO),2024-12-03 22:20:28.609680
,Ablandador de Carne FACUSA,S/ 26.50 un,plaza_vea,PANCETA (CARNE DE CERDO),2024-12-03 22:20:28.609680
Presentación 1.95 kg aprox.,Baby Back Ribs de Cerdo Importado,S/ 46.90 x kg,plaza_vea,PANCETA (CARNE DE CERDO),2024-12-03 22:20:28.609680
Pote 170g,Mantequilla de Maní LA PURITA Panela Pote 170...,S/ 12.90 un,plaza_vea,PANCETA (CARNE DE CERDO),2024-12-03 22:20:28.609680
Frasco 100ml,Gel URBAN CARE Matte Wax Style Guide Frasco 10...,S/ 34.90 un,plaza_vea,PANCETA (CARNE DE CERDO),2024-12-03 22:20:28.609680
Frasco 200ml,Mousse Capilar URBAN CARE Style Guide Curl Fra...,S/ 49.90 un,plaza_vea,PANCETA (CARNE DE CERDO),2024-12-03 22:20:28.609680
Tubo 150ml,Gel URBAN CARE Style Guide Elastic Curl Frasco...,S/ 34.90 un,plaza_vea,PANCETA (CARNE DE CERDO),2024-12-03 22:20:28.609680
Frasco 350ml,Shampoo URBAN CARE Expert Biotin & Caffeine Fr...,S/ 49.90 un,plaza_vea,PANCETA (CARNE DE CERDO),2024-12-03 22:20:28.609680
Tubo 250ml,Shampoo URBAN CARE Monoi Oil & Ylang Ylang Tub...,S/ 39.90 un,plaza_vea,PANCETA (CARNE DE CERDO),2024-12-03 22:20:28.609680
Tubo 250ml,Shampoo Fórmula Vegana URBAN CARE Ácido Hialur...,S/ 39.90 un,plaza_vea,PANCETA (CARNE DE CERDO),2024-12-03 22:20:28.609680
Frasco 200ml,Shampoo en Seco URBAN CARE Hawaiian Monoi Para...,S/ 49.90 un,plaza_vea,PANCETA (CARNE DE CERDO),2024-12-03 22:20:28.609680
Frasco 200ml,Shampoo en Seco URBAN CARE Paradise Jungle Fra...,S/ 49.90 un,plaza_vea,PANCETA (CARNE DE CERDO),2024-12-03 22:20:28.609680
Frasco 350ml,Shampoo URBAN CARE Bond Plex N°2 Restore Repai...,S/ 59.90 un,plaza_vea,PANCETA (CARNE DE CERDO),2024-12-03 22:20:28.609680
Tubo 250ml,Shampoo URBAN CARE Pure Coconut Tubo 250ml,S/ 39.90 un,plaza_vea,PANCETA (CARNE DE CERDO),2024-12-03 22:20:28.609680
Tubo 250ml,Shampoo Fórmula Vegana URBAN CARE Twisted Curl...,S/ 39.90 un,plaza_vea,PANCETA (CARNE DE CERDO),2024-12-03 22:20:28.609680
Frasco 200ml,Shampoo en Seco URBAN CARE Hello Cherry Berry ...,S/ 49.90 un,plaza_vea,PANCETA (CARNE DE CERDO),2024-12-03 22:20:28.609680
Frasco 200ml,Shampoo en Seco URBAN CARE Coco Frasco 200ml,S/ 49.90 un,plaza_vea,PANCETA (CARNE DE CERDO),2024-12-03 22:20:28.609680
Frasco 150ml,Crema Para Peinar URBAN CARE Monoi Oil & Ylang...,S/ 39.90 un,plaza_vea,PANCETA (CARNE DE CERDO),2024-12-03 22:20:28.609680
Frasco 175ml,Crema Para Peinar URBAN CARE Twisted Curls Fra...,S/ 39.90 un,plaza_vea,PANCETA (CARNE DE CERDO),2024-12-03 22:20:28.609680
Pote 230ml,Crema Para Peinar URBAN CARE Bond Plex N°4 Res...,S/ 59.90 un,plaza_vea,PANCETA (CARNE DE CERDO),2024-12-03 22:20:28.609680
Frasco 75ml,Sérum URBAN CARE Pure Coconut Frasco 75ml,S/ 49.90 un,plaza_vea,PANCETA (CARNE DE CERDO),2024-12-03 22:20:28.609680
Frasco 230ml,Crema Para Peinar URBAN CARE Mask Intensive Tw...,S/ 39.90 un,plaza_vea,PANCETA (CARNE DE CERDO),2024-12-03 22:20:28.609680
Frasco 200ml,Sérum URBAN CARE Hair Tonic Spray Biotin & Caf...,S/ 49.90 un,plaza_vea,PANCETA (CARNE DE CERDO),2024-12-03 22:20:28.609680
Frasco 75ml,Sérum Capilar URBAN CARE Ácido Hialurónico Fra...,S/ 49.90 un,plaza_vea,PANCETA (CARNE DE CERDO),2024-12-03 22:20:28.609680
Frasco 240ml,Crema Capilar URBAN Grow Strong Frasco 240ml,S/ 69.90 un,plaza_vea,PANCETA (CARNE DE CERDO),2024-12-03 22:20:28.609680
Frasco 150ml,Crema Capilar URBAN CARE Pure Coconut Oil in C...,S/ 39.90 un,plaza_vea,PANCETA (CARNE DE CERDO),2024-12-03 22:20:28.609680
Spray 200ml,Sérum Capilar URBAN CARE Bonding Milk N°5 Bond...,S/ 59.90 un,plaza_vea,PANCETA (CARNE DE CERDO),2024-12-03 22:20:28.609680
Frasco 230ml,Mascarilla Capilar URBAN CARE Night Hyaluronic...,S/ 39.90 un,plaza_vea,PANCETA (CARNE DE CERDO),2024-12-03 22:20:28.609680
Spray 150ml,Sérum Capilar URBAN CARE Summer Glow Lightenin...,S/ 49.90 un,plaza_vea,PANCETA (CARNE DE CERDO),2024-12-03 22:20:28.609680
Tubo 250ml,Acondicionador URBAN CARE Pure Coconut & Aloe ...,S/ 39.90 un,plaza_vea,PANCETA (CARNE DE CERDO),2024-12-03 22:20:28.609680
Tubo 200ml,Acondicionador URBAN CARE Biotin & Caffeine Tu...,S/ 49.90 un,plaza_vea,PANCETA (CARNE DE CERDO),2024-12-03 22:20:28.609680
Spray 200ml,Acondicionador URBAN CARE Monoi Oil & Ylang Yl...,S/ 39.90 un,plaza_vea,PANCETA (CARNE DE CERDO),2024-12-03 22:20:28.609680
Tubo 250ml,Acondicionador URBAN CARE Ácido Hialurónico Tu...,S/ 39.90 un,plaza_vea,PANCETA (CARNE DE CERDO),2024-12-03 22:20:28.609680
Tubo 250ml,Acondicionador Restore Repair URBAN CARE Bond ...,S/ 59.90 un,plaza_vea,PANCETA (CARNE DE CERDO),2024-12-03 22:20:28.609680
Tubo 250ml,Acondicionador URBAN CARE Twisted Curls Tubo 2...,S/ 39.90 un,plaza_vea,PANCETA (CARNE DE CERDO),2024-12-03 22:20:28.609680
,Maceta DECO HOME C/Planta Blanca Brisa Natural,S/ 11.90 un,plaza_vea,PANCETA (CARNE DE CERDO),2024-12-03 22:20:28.609680
,Maceta DECO HOME D Color C/Planta Brisa Natura...,S/ 25.90 un,plaza_vea,PANCETA (CARNE DE CERDO),2024-12-03 22:20:28.609680
,Maceta DECO HOME C/Planta Acuarela Romántica,S/ 8.90 un,plaza_vea,PANCETA (CARNE DE CERDO),2024-12-03 22:20:28.609680
,Maceta DECO HOME C/Planta Nnn Selva Mágica,S/ 11.90 un,plaza_vea,PANCETA (CARNE DE CERDO),2024-12-03 22:20:28.609680
,Maceta DECO HOME Colgante Brisa Natural,S/ 26.90 un,plaza_vea,PANCETA (CARNE DE CERDO),2024-12-03 22:20:28.609680
,Maceta DECO HOME C/Planta Alta Selva Mágica,S/ 18.90 un,plaza_vea,PANCETA (CARNE DE CERDO),2024-12-03 22:20:28.609680
,Cojines VIVA HOME Esp Dis3 Planeta,S/ 24.90 un,plaza_vea,PANCETA (CARNE DE CERDO),2024-12-03 22:20:28.609680
,Peluche Paleta Llavero Asst Hello ty And Frien...,S/ 24.90 un,plaza_vea,PANCETA (CARNE DE CERDO),2024-12-03 22:20:28.609680
,Arnés PET STAR Diseño,S/ 19.90 un,plaza_vea,PANCETA (CARNE DE CERDO),2024-12-03 22:20:28.609680
,Arnés PET STAR Diseño Gris para Perros,S/ 19.90 un,plaza_vea,PANCETA (CARNE DE CERDO),2024-12-03 22:20:28.609680
,Mini Mochila SKIP HOP con Arnés Koala,S/ 119 un,plaza_vea,PANCETA (CARNE DE CERDO),2024-12-03 22:20:28.609680
,Pelota de Colores PET CARE para Perros 45468,S/ 9.90 un,plaza_vea,PANCETA (CARNE DE CERDO),2024-12-03 22:20:28.609680
Bolsa 3Kg,Comida para Perros DOG CHOW Cachorros Medianos...,S/ 44.60 un,plaza_vea,PANCETA (CARNE DE CERDO),2024-12-03 22:20:28.609680
,La vida desconocida de Javier Milei - Juan Lui...,S/ 79.90 un,plaza_vea,PANCETA (CARNE DE CERDO),2024-12-03 22:20:28.609680
,Peruanos por Vocación - Jorge Lazarte,S/ 69.90 un,plaza_vea,PANCETA (CARNE DE CERDO),2024-12-03 22:20:28.609680
,El Camino del Libertario - Javier Milei,S/ 89.90 un,plaza_vea,PANCETA (CARNE DE CERDO),2024-12-03 22:20:28.609680
Frasco 175ml,Tratamiento 5 en 1 HASK Curl Care Frasco 175ml,S/ 46.10 un,plaza_vea,PANCETA (CARNE DE CERDO),2024-12-03 22:20:28.609680
Lata 1un,Snack para Gatos YAMIS Sabor a Carne Lata 60g,S/ 10.50 un,plaza_vea,PANCETA (CARNE DE CERDO),2024-12-03 22:20:28.609680
,Paleta para Mezclar CLASS&WORK,S/ 2.50 un,plaza_vea,PANCETA (CARNE DE CERDO),2024-12-03 22:20:28.609680
Lata 290g,Comida para Perros SUPERCAN Cachorro Carne 290...,S/ 5 un,plaza_vea,PANCETA (CARNE DE CERDO),2024-12-03 22:20:28.609680
,Cepillo de Limpieza PANDITAS de Biberones,S/ 14.90 un,plaza_vea,PANCETA (CARNE DE CERDO),2024-12-03 22:20:28.609680
