unit,description,price,website,search_term,scrape_timestamp
,Lavado al seco - Waterless 710 ML,S/ 35 un,plaza_vea,ARVEJA SECA PARTIDA,2024-12-04 00:27:04.770357
,Tobillera/muñequera Ajustable Con Peso Arena S...,S/ 79 un,plaza_vea,ARVEJA SECA PARTIDA,2024-12-04 00:27:04.770357
,Tobillera/muñequera Ajustable Con Peso Arena S...,S/ 25 un,plaza_vea,ARVEJA SECA PARTIDA,2024-12-04 00:27:04.770357
,Tobillera/muñequera Ajustable Con Peso Arena S...,S/ 49 un,plaza_vea,ARVEJA SECA PARTIDA,2024-12-04 00:27:04.770357
,Tobillera/muñequera Ajustable Con Peso Arena S...,S/ 29 un,plaza_vea,ARVEJA SECA PARTIDA,2024-12-04 00:27:04.770357
,Tobillera/muñequera Ajustable Con Peso Arena S...,S/ 79 un,plaza_vea,ARVEJA SECA PARTIDA,2024-12-04 00:27:04.770357
,Swiss Arabian Areej Al Sheila - Fragancia EDP ...,S/ 369 un,plaza_vea,ARVEJA SECA PARTIDA,2024-12-04 00:27:04.770357
,Bolso Kylie con múltiples bolsillos Arena,S/ 79.90 un,plaza_vea,ARVEJA SECA PARTIDA,2024-12-04 00:27:04.770357
,Bolso Mía multiuso porta tablet Arena,S/ 79.90 un,plaza_vea,ARVEJA SECA PARTIDA,2024-12-04 00:27:04.770357
,Saca pelusa VGR V-813 Verde,S/ 79 un,plaza_vea,ARVEJA SECA PARTIDA,2024-12-04 00:27:04.770357
,Saca pelusa VGR V-813 - Rosado,S/ 79 un,plaza_vea,ARVEJA SECA PARTIDA,2024-12-04 00:27:04.770357
,Saca pelusa VGR V-813 - Rosado,S/ 79 un,plaza_vea,ARVEJA SECA PARTIDA,2024-12-04 00:27:04.770357
,Saca pelusa VGR V-813 Verde,S/ 79 un,plaza_vea,ARVEJA SECA PARTIDA,2024-12-04 00:27:04.770357
,Saca pelusa VGR V-813 Verde,S/ 79 un,plaza_vea,ARVEJA SECA PARTIDA,2024-12-04 00:27:04.770357
,Saca pelusa VGR V-813 - Rosado,S/ 79 un,plaza_vea,ARVEJA SECA PARTIDA,2024-12-04 00:27:04.770357
,Nothing Auriculares Nothing Oreja (Abierto) Co...,S/ 929 un,plaza_vea,ARVEJA SECA PARTIDA,2024-12-04 00:27:04.770357
,Arena Para Gato Sonqocat 5kg,S/ 14 un,plaza_vea,ARVEJA SECA PARTIDA,2024-12-04 00:27:04.770357
,Arena Para Gato Granulada Don Leo 5kg,S/ 9 un,plaza_vea,ARVEJA SECA PARTIDA,2024-12-04 00:27:04.770357
,Pack X2 Bolsas De Arena Para Gato Sonqocat De ...,S/ 21 un,plaza_vea,ARVEJA SECA PARTIDA,2024-12-04 00:27:04.770357
,Arena Para Gato Perlada Aroma Lavanda Sonqo Ca...,S/ 16 un,plaza_vea,ARVEJA SECA PARTIDA,2024-12-04 00:27:04.770357
,Pack X2 Bolsas De Arena Para Gato Granulada Do...,S/ 17 un,plaza_vea,ARVEJA SECA PARTIDA,2024-12-04 00:27:04.770357
,Pack X2 Bolsas De Arena Para Gato Perlada Arom...,S/ 26.60 un,plaza_vea,ARVEJA SECA PARTIDA,2024-12-04 00:27:04.770357
,Audífonos Nothing Nothing Oreja (a) Cancelació...,S/ 605 un,plaza_vea,ARVEJA SECA PARTIDA,2024-12-04 00:27:04.770357
,Auriculares Nothing Oreja 2 Audífonos Intraura...,S/ 939 un,plaza_vea,ARVEJA SECA PARTIDA,2024-12-04 00:27:04.770357
,Audífonos Nothing Oreja (palo) Resistente al A...,S/ 415 un,plaza_vea,ARVEJA SECA PARTIDA,2024-12-04 00:27:04.770357
,Set de Mascara y Snorkel Pike Sea Bestway Azul,S/ 33.90 un,plaza_vea,ARVEJA SECA PARTIDA,2024-12-04 00:27:04.770357
,Set de Mascara y Snorkel Pike Sea Bestway Rojo,S/ 33.90 un,plaza_vea,ARVEJA SECA PARTIDA,2024-12-04 00:27:04.770357
,Esterilizador de Biberones 5 en 1 Esteriliza y...,S/ 229 un,plaza_vea,ARVEJA SECA PARTIDA,2024-12-04 00:27:04.770357
,Articulos de Aseo para Gatos Hartz Pala de Are...,S/ 16.90 un,plaza_vea,ARVEJA SECA PARTIDA,2024-12-04 00:27:04.770357
,Gravitrax Starter Kit Set Básico de Punto de P...,S/ 339 un,plaza_vea,ARVEJA SECA PARTIDA,2024-12-04 00:27:04.770357
,Plancha Seca Pesada Clasica I1700,S/ 189 un,plaza_vea,ARVEJA SECA PARTIDA,2024-12-04 00:27:04.770357
,Calzoncillo Reutilizable Para Macho Extra Segu...,S/ 65.90 un,plaza_vea,ARVEJA SECA PARTIDA,2024-12-04 00:27:04.770357
,Set De Herramientas Y Lonchera 2 En 1 SONIC Th...,S/ 64.90 un,plaza_vea,ARVEJA SECA PARTIDA,2024-12-04 00:27:04.770357
,Set de Herramientas y Lonchera 2 en 1 The Hedg...,S/ 65 un,plaza_vea,ARVEJA SECA PARTIDA,2024-12-04 00:27:04.770357
,Arena De Gato Con Bentonina Y Carbon Activado ...,S/ 59.90 un,plaza_vea,ARVEJA SECA PARTIDA,2024-12-04 00:27:04.770357
,Origens Arena Super Premium Con Aroma A Eucali...,S/ 39.90 un,plaza_vea,ARVEJA SECA PARTIDA,2024-12-04 00:27:04.770357
,Sharpie Puntas Surtidas 24Ct,S/ 119.90 un,plaza_vea,ARVEJA SECA PARTIDA,2024-12-04 00:27:04.770357
,Chaleco Frío Refrigerante Contra Golpe De Calo...,S/ 41 un,plaza_vea,ARVEJA SECA PARTIDA,2024-12-04 00:27:04.770357
,Chaleco Frío Refrigerante Contra Golpe De Calo...,S/ 41 un,plaza_vea,ARVEJA SECA PARTIDA,2024-12-04 00:27:04.770357
,Balsamo De Cera De Abeja Para Mascota 40 Gr,S/ 37.90 un,plaza_vea,ARVEJA SECA PARTIDA,2024-12-04 00:27:04.770357
,Calzoncillo Reutilizable Para Macho Extra Segu...,S/ 62 un,plaza_vea,ARVEJA SECA PARTIDA,2024-12-04 00:27:04.770357
,Calzoncillo Reutilizable Para Macho Extra Segu...,S/ 48.90 un,plaza_vea,ARVEJA SECA PARTIDA,2024-12-04 00:27:04.770357
,Calzoncillo Reutilizable Para Macho Extra Segu...,S/ 75.90 un,plaza_vea,ARVEJA SECA PARTIDA,2024-12-04 00:27:04.770357
,Calzoncillo Reutilizable Para Macho Extra Segu...,S/ 54.90 un,plaza_vea,ARVEJA SECA PARTIDA,2024-12-04 00:27:04.770357
,Polo Manga Corta Rising Dragon La Fashion - Ar...,S/ 79 un,plaza_vea,ARVEJA SECA PARTIDA,2024-12-04 00:27:04.770357
,Bozal Máscara para Perros de Cara Plana Talla ...,S/ 99 un,plaza_vea,ARVEJA SECA PARTIDA,2024-12-04 00:27:04.770357
,Bozal Máscara para Perros de Cara Plana Talla ...,S/ 94 un,plaza_vea,ARVEJA SECA PARTIDA,2024-12-04 00:27:04.770357
,Recortador portátil para vellos nasales y orej...,S/ 28 un,plaza_vea,ARVEJA SECA PARTIDA,2024-12-04 00:27:04.770357
,Ventilador USB con Orejas de Gatito para Ofici...,S/ 39.90 un,plaza_vea,ARVEJA SECA PARTIDA,2024-12-04 00:27:04.770357
,Ventilador Espejo Portátil Diseño Paltita,S/ 19.90 un,plaza_vea,ARVEJA SECA PARTIDA,2024-12-04 00:27:04.770357
,Arena para Gato Cute Cat con Bentonita 20kg,S/ 89.90 un,plaza_vea,ARVEJA SECA PARTIDA,2024-12-04 00:27:04.770357
,Bozal Máscara para Perros de Cara Plana Talla ...,S/ 79 un,plaza_vea,ARVEJA SECA PARTIDA,2024-12-04 00:27:04.770357
,Partidor de Pastillas Con Almacenamiento,S/ 25 un,plaza_vea,ARVEJA SECA PARTIDA,2024-12-04 00:27:04.770357
,Arena Sanitaria para Gatitos Sahara Baby Powde...,S/ 150 un,plaza_vea,ARVEJA SECA PARTIDA,2024-12-04 00:27:04.770357
,Banda Shopdisney Para Cabello con Orejas de Mi...,S/ 55 un,plaza_vea,ARVEJA SECA PARTIDA,2024-12-04 00:27:04.770357
,Disco Turbo Diamantado Corte Seco humedo 110mm...,S/ 45 un,plaza_vea,ARVEJA SECA PARTIDA,2024-12-04 00:27:04.770357
,Bolso con Diseño Abeja,S/ 113 un,plaza_vea,ARVEJA SECA PARTIDA,2024-12-04 00:27:04.770357
,Jogger para Mujer Parada111 Ally,S/ 159.90 un,plaza_vea,ARVEJA SECA PARTIDA,2024-12-04 00:27:04.770357
,ARENA MÁGICA CON MOLDES,S/ 39.90 un,plaza_vea,ARVEJA SECA PARTIDA,2024-12-04 00:27:04.770357
,Bozal Máscara para Perros de Cara Plana Talla ...,S/ 54 un,plaza_vea,ARVEJA SECA PARTIDA,2024-12-04 00:27:04.770357
,Bozal Máscara para Perros de Cara Plana Talla ...,S/ 67 un,plaza_vea,ARVEJA SECA PARTIDA,2024-12-04 00:27:04.770357
,Tienda de Juego Didáctico Rompecabezas Fruta P...,S/ 39 un,plaza_vea,ARVEJA SECA PARTIDA,2024-12-04 00:27:04.770357
,Arenero Con Luz Led Para Gatos Contra Bacteria...,S/ 118 un,plaza_vea,ARVEJA SECA PARTIDA,2024-12-04 00:27:04.770357
,Tienda de Juego Didáctico Rompecabezas Fruta P...,S/ 39 un,plaza_vea,ARVEJA SECA PARTIDA,2024-12-04 00:27:04.770357
,Tienda de Juego Didáctico Rompecabezas Fruta P...,S/ 39 un,plaza_vea,ARVEJA SECA PARTIDA,2024-12-04 00:27:04.770357
,Escultura Pareja de Abrazo,S/ 169 un,plaza_vea,ARVEJA SECA PARTIDA,2024-12-04 00:27:04.770357
,Funda Cojin Marble Arena Saten 45x45 cm,S/ 70 un,plaza_vea,ARVEJA SECA PARTIDA,2024-12-04 00:27:04.770357
,LanzaDados Cthulhu 3D GEEKS PERU PLA Seda Mult...,S/ 80 un,plaza_vea,ARVEJA SECA PARTIDA,2024-12-04 00:27:04.770357
,Caja PortaDados 3D GEEKS PERU PLA Seda Multico...,S/ 42 un,plaza_vea,ARVEJA SECA PARTIDA,2024-12-04 00:27:04.770357
,Pareja de Gnomos Muñecos de Navidad Barba y Tr...,S/ 119 un,plaza_vea,ARVEJA SECA PARTIDA,2024-12-04 00:27:04.770357
,Depiladora Inalambrica Philips BRE715 en Seco ...,S/ 419 un,plaza_vea,ARVEJA SECA PARTIDA,2024-12-04 00:27:04.770357
,Gorro Con Oreja Para Natacion - RM,S/ 29 un,plaza_vea,ARVEJA SECA PARTIDA,2024-12-04 00:27:04.770357
,Cool Mat (Manta Refrigerante) Evita Golpe de C...,S/ 80 un,plaza_vea,ARVEJA SECA PARTIDA,2024-12-04 00:27:04.770357
,Cool Mat (Manta Refrigerante) Evita Golpe de C...,S/ 80 un,plaza_vea,ARVEJA SECA PARTIDA,2024-12-04 00:27:04.770357
,Cool Mat (Manta Refrigerante) Evita Golpe de C...,S/ 80 un,plaza_vea,ARVEJA SECA PARTIDA,2024-12-04 00:27:04.770357
,Cool Mat (Manta Refrigerante) Evita Golpe de C...,S/ 80 un,plaza_vea,ARVEJA SECA PARTIDA,2024-12-04 00:27:04.770357
,Cubeta Eficaz de Arena Rosado y Naranja Y+Post...,S/ 129.90 un,plaza_vea,ARVEJA SECA PARTIDA,2024-12-04 00:27:04.770357
,Cool Mat (Manta Refrigerante) Evita Golpe de C...,S/ 80 un,plaza_vea,ARVEJA SECA PARTIDA,2024-12-04 00:27:04.770357
,Arenero Cerrado con Orejas y Pala Cernidora Ro...,S/ 106.90 un,plaza_vea,ARVEJA SECA PARTIDA,2024-12-04 00:27:04.770357
,Antifaz de Sueño con Orejas en Color Gris Y+Ag...,S/ 39.90 un,plaza_vea,ARVEJA SECA PARTIDA,2024-12-04 00:27:04.770357
,Gorro Con Oreja Para Natacion - NZ,S/ 29 un,plaza_vea,ARVEJA SECA PARTIDA,2024-12-04 00:27:04.770357
,Adorno Pareja de Gatos Blanco Marron Satinado ...,S/ 280 un,plaza_vea,ARVEJA SECA PARTIDA,2024-12-04 00:27:04.770357
,Ciclo de vida de la abeja chanitos biologia mo...,S/ 35 un,plaza_vea,ARVEJA SECA PARTIDA,2024-12-04 00:27:04.770357
,Paquete Perdida de Peso Tono Beige Y+Post-it a...,S/ 59.90 un,plaza_vea,ARVEJA SECA PARTIDA,2024-12-04 00:27:04.770357
,Estante Practico para Secar en Acero Y+Gift St...,S/ 63.90 un,plaza_vea,ARVEJA SECA PARTIDA,2024-12-04 00:27:04.770357
,Saca Filo Compacto de Color Rojo Y+Post-it adh...,S/ 47.90 un,plaza_vea,ARVEJA SECA PARTIDA,2024-12-04 00:27:04.770357
,Hongos Seco Shitake 100gr Touku,S/ 20 un,plaza_vea,ARVEJA SECA PARTIDA,2024-12-04 00:27:04.770357
,Hongos Seco Wenyi 1kg Auricula Judae Sofit,S/ 188 un,plaza_vea,ARVEJA SECA PARTIDA,2024-12-04 00:27:04.770357
,Hongos Seco Wenyi 100gr Auricula Judae,S/ 20 un,plaza_vea,ARVEJA SECA PARTIDA,2024-12-04 00:27:04.770357
,Jabón Artesanal de Avena ABI NATURE,S/ 14.90 un,plaza_vea,ARVEJA SECA PARTIDA,2024-12-04 00:27:04.770357
,Set de Cocina Portátil 3 en 1 Mochila y Área d...,S/ 99.99 un,plaza_vea,ARVEJA SECA PARTIDA,2024-12-04 00:27:04.770357
,Pack Manta de Apego y Muñeco Sonaja para Bebés...,S/ 89 un,plaza_vea,ARVEJA SECA PARTIDA,2024-12-04 00:27:04.770357
,Manta de Apego Muñeco de Compañía para Bebés B...,S/ 109 un,plaza_vea,ARVEJA SECA PARTIDA,2024-12-04 00:27:04.770357
,Pack Manta de Apego y Muñeco Sonaja para Bebés...,S/ 89 un,plaza_vea,ARVEJA SECA PARTIDA,2024-12-04 00:27:04.770357
,Cool Mat (Manta Refrigerante) Evita Golpe de C...,S/ 80 un,plaza_vea,ARVEJA SECA PARTIDA,2024-12-04 00:27:04.770357
,Cool Mat (Manta Refrigerante) Evita Golpe de C...,S/ 80 un,plaza_vea,ARVEJA SECA PARTIDA,2024-12-04 00:27:04.770357
,Caja de Arena Facil de Limpiar Amarillo Y+Post...,S/ 193.90 un,plaza_vea,ARVEJA SECA PARTIDA,2024-12-04 00:27:04.770357
,Trio Cerave Rutina Piel Normal A Seca Limpiado...,S/ 169.90 un,plaza_vea,ARVEJA SECA PARTIDA,2024-12-04 00:27:04.770357
,Peluche South Park Cartman 20cm Kidrobot,S/ 89.90 un,plaza_vea,ARVEJA SECA PARTIDA,2024-12-04 00:27:04.770357
,Adorno Pareja un Solo Corazon 23x8x24 cm,S/ 229.90 un,plaza_vea,ARVEJA SECA PARTIDA,2024-12-04 00:27:04.770357
,Adorno Pareja Nuestro Eje Ivory Mate 22x16x25 ...,S/ 350 un,plaza_vea,ARVEJA SECA PARTIDA,2024-12-04 00:27:04.770357
,Comedor Mobiliari + 4 Sillas Arena,"S/ 2,599 un",plaza_vea,ARVEJA SECA PARTIDA,2024-12-04 00:27:04.770357
,Cubeta Compacta de Arena Verde y Plomo Y+Post-...,S/ 129.90 un,plaza_vea,ARVEJA SECA PARTIDA,2024-12-04 00:27:04.770357
,Vestido Corto Casual de Hilo Color Arena,S/ 79 un,plaza_vea,ARVEJA SECA PARTIDA,2024-12-04 00:27:04.770357
,Polo de Hilo Sin Mangas Mujer Color Arena,S/ 45 un,plaza_vea,ARVEJA SECA PARTIDA,2024-12-04 00:27:04.770357
,Carrito Abeja Interactivo para Gatos Juguete I...,S/ 54.99 un,plaza_vea,ARVEJA SECA PARTIDA,2024-12-04 00:27:04.770357
,Vaso con Oreja de 340ML Transparente Y+Banderi...,S/ 99.90 un,plaza_vea,ARVEJA SECA PARTIDA,2024-12-04 00:27:04.770357
,Lampara de Oso para Secar Uñas en Verde Agua Y...,S/ 103.90 un,plaza_vea,ARVEJA SECA PARTIDA,2024-12-04 00:27:04.770357
,Lampara para Secar Esmalte en Rosado Y+Sticker...,S/ 109.90 un,plaza_vea,ARVEJA SECA PARTIDA,2024-12-04 00:27:04.770357
,Caja de Arena Facil de Lavar Celeste Y+Post-it...,S/ 133.90 un,plaza_vea,ARVEJA SECA PARTIDA,2024-12-04 00:27:04.770357
,Peine para Mascotas Saca Pulgas Tono Azul Y+Pa...,S/ 39.90 un,plaza_vea,ARVEJA SECA PARTIDA,2024-12-04 00:27:04.770357
,Trio Cerave Rutina Piel Seca,S/ 175 un,plaza_vea,ARVEJA SECA PARTIDA,2024-12-04 00:27:04.770357
,Arena PREMIUM para gato aroma Limón de 5 Kg co...,S/ 18.90 un,plaza_vea,ARVEJA SECA PARTIDA,2024-12-04 00:27:04.770357
,Arena PREMIUM para gato aroma Bebé de 5 Kg con...,S/ 18.90 un,plaza_vea,ARVEJA SECA PARTIDA,2024-12-04 00:27:04.770357
,Arena PREMIUM para gato aroma Sandia de 5 Kg c...,S/ 18.90 un,plaza_vea,ARVEJA SECA PARTIDA,2024-12-04 00:27:04.770357
,Arena PREMIUM para gato aroma Manzana de 5 Kg ...,S/ 18.90 un,plaza_vea,ARVEJA SECA PARTIDA,2024-12-04 00:27:04.770357
,Arena PREMIUM para gato aroma Rosas de 5 Kg co...,S/ 18.90 un,plaza_vea,ARVEJA SECA PARTIDA,2024-12-04 00:27:04.770357
,Arena PREMIUM para gato aroma Café de 5 Kg con...,S/ 18.90 un,plaza_vea,ARVEJA SECA PARTIDA,2024-12-04 00:27:04.770357
,Trio Cerave Rutina Piel Normal A Seca Limpiado...,S/ 169.90 un,plaza_vea,ARVEJA SECA PARTIDA,2024-12-04 00:27:04.770357
,Trio Cerave Rutina Piel Seca,S/ 175 un,plaza_vea,ARVEJA SECA PARTIDA,2024-12-04 00:27:04.770357
,Trio Cerave Rutina Piel Seca,S/ 175 un,plaza_vea,ARVEJA SECA PARTIDA,2024-12-04 00:27:04.770357
,Trio Cerave Rutian Para Piel Normal A Seca,S/ 209.90 un,plaza_vea,ARVEJA SECA PARTIDA,2024-12-04 00:27:04.770357
,Trio Cerave Rutina Piel Normal A Seca Limpiado...,S/ 169.90 un,plaza_vea,ARVEJA SECA PARTIDA,2024-12-04 00:27:04.770357
,Guirnalda de Luces de 8 Abejas con Luces LED C...,S/ 130.90 un,plaza_vea,ARVEJA SECA PARTIDA,2024-12-04 00:27:04.770357
,Cera de abeja para cuero Bees Max 510gr,S/ 137 un,plaza_vea,ARVEJA SECA PARTIDA,2024-12-04 00:27:04.770357
,Trio Cerave Rutian Para Piel Normal A Seca,S/ 209.90 un,plaza_vea,ARVEJA SECA PARTIDA,2024-12-04 00:27:04.770357
,Trio Cerave Rutian Para Piel Normal A Seca,S/ 209.90 un,plaza_vea,ARVEJA SECA PARTIDA,2024-12-04 00:27:04.770357
,Trio Cerave Rutina Piel Seca,S/ 175 un,plaza_vea,ARVEJA SECA PARTIDA,2024-12-04 00:27:04.770357
,ARENA PARA GATO CATS BEST ORIGINAL 2.10 KG,S/ 40.90 un,plaza_vea,ARVEJA SECA PARTIDA,2024-12-04 00:27:04.770357
,ARENA PARA GATO CATS BEST SMART PELLETS 2.50 K...,S/ 50.90 un,plaza_vea,ARVEJA SECA PARTIDA,2024-12-04 00:27:04.770357
,ARENA PARA GATO CATS BEST UNIVERSAL 5.5 KG,S/ 60.90 un,plaza_vea,ARVEJA SECA PARTIDA,2024-12-04 00:27:04.770357
,ARENA PARA GATO CATS BEST ORIGINAL 4.30 KG,S/ 76.90 un,plaza_vea,ARVEJA SECA PARTIDA,2024-12-04 00:27:04.770357
,ARENA PARA GATO CATS BEST ORIGINAL 8.60 KG,S/ 144.90 un,plaza_vea,ARVEJA SECA PARTIDA,2024-12-04 00:27:04.770357
,ARENA PARA GATO CATS BEST SMART PELLETS 10 KG,S/ 174.90 un,plaza_vea,ARVEJA SECA PARTIDA,2024-12-04 00:27:04.770357
,ARENA PARA GATO CATS BEST SENSITIVE 7.20 KG,S/ 140.90 un,plaza_vea,ARVEJA SECA PARTIDA,2024-12-04 00:27:04.770357
,ARENA PARA GATO CATS BEST SENSITIVE 2.90 KG,S/ 60.90 un,plaza_vea,ARVEJA SECA PARTIDA,2024-12-04 00:27:04.770357
,Caja de Arena Facil de Limpiar Celeste Y+Post-...,S/ 193.90 un,plaza_vea,ARVEJA SECA PARTIDA,2024-12-04 00:27:04.770357
,Caja de Arena Facil de Limpiar en Plomo Y+Post...,S/ 189.90 un,plaza_vea,ARVEJA SECA PARTIDA,2024-12-04 00:27:04.770357
,Caja de Arena Facil de Limpiar en Rosado Y+Pos...,S/ 193.90 un,plaza_vea,ARVEJA SECA PARTIDA,2024-12-04 00:27:04.770357
,Bolso Tote Bag Jane Arena,S/ 62.90 un,plaza_vea,ARVEJA SECA PARTIDA,2024-12-04 00:27:04.770357
,Aretes Pendientes De Drenaje Linfático Perdid...,S/ 39 un,plaza_vea,ARVEJA SECA PARTIDA,2024-12-04 00:27:04.770357
,Adorno Pareja Tu y Yo Dorado Plata 22x07x25 cm...,S/ 320 un,plaza_vea,ARVEJA SECA PARTIDA,2024-12-04 00:27:04.770357
,Adorno Pareja Somos Uno Ivory 18x9x26 cm,S/ 250 un,plaza_vea,ARVEJA SECA PARTIDA,2024-12-04 00:27:04.770357
,Adorno Pareja de elefantes Plata Mate,S/ 199.90 un,plaza_vea,ARVEJA SECA PARTIDA,2024-12-04 00:27:04.770357
,Vestido de Hilo Corto y Casual Color Arena,S/ 79 un,plaza_vea,ARVEJA SECA PARTIDA,2024-12-04 00:27:04.770357
,"Bolsa de arena de peso para estudio, vídeo, so...",S/ 51 un,plaza_vea,ARVEJA SECA PARTIDA,2024-12-04 00:27:04.770357
,Antifaz Gel Diseño Ojos y Orejas Mostaza Y+Pap...,S/ 43.90 un,plaza_vea,ARVEJA SECA PARTIDA,2024-12-04 00:27:04.770357
,Polo de Hilo Sin Mangas Color Arena para Mujer,S/ 45 un,plaza_vea,ARVEJA SECA PARTIDA,2024-12-04 00:27:04.770357
,Aretes Pendientes De Drenaje Linfático Perdida...,S/ 39 un,plaza_vea,ARVEJA SECA PARTIDA,2024-12-04 00:27:04.770357
,Adorno Pareja Somos Uno Blanco 18x9x26 cm,S/ 250 un,plaza_vea,ARVEJA SECA PARTIDA,2024-12-04 00:27:04.770357
,Teclado Mecánico Gamer T-dagger Arena Rainbow ...,S/ 114.90 un,plaza_vea,ARVEJA SECA PARTIDA,2024-12-04 00:27:04.770357
,Sonajero Reloj de Arena con Osito Estimulación...,S/ 49.99 un,plaza_vea,ARVEJA SECA PARTIDA,2024-12-04 00:27:04.770357
,Sillón de Oficina Giratoria Boss Gerente Eco A...,S/ 600 un,plaza_vea,ARVEJA SECA PARTIDA,2024-12-04 00:27:04.770357
,MANOMETRO SECO BERKLIN,S/ 65.90 un,plaza_vea,ARVEJA SECA PARTIDA,2024-12-04 00:27:04.770357
,Antifaz de Sueño con Orejas en Color Rosado Y+...,S/ 39.90 un,plaza_vea,ARVEJA SECA PARTIDA,2024-12-04 00:27:04.770357
,Plancha Vapor y Seco Electrolux Experience ESI...,S/ 199 un,plaza_vea,ARVEJA SECA PARTIDA,2024-12-04 00:27:04.770357
,"LEGO Icons - Centro de flores secas, colección...",S/ 285 un,plaza_vea,ARVEJA SECA PARTIDA,2024-12-04 00:27:04.770357
,Accesorios Oreja de Conejo,S/ 19.90 un,plaza_vea,ARVEJA SECA PARTIDA,2024-12-04 00:27:04.770357
,Afeitadora Recortador Enchen Para Vello Nasal ...,S/ 49 un,plaza_vea,ARVEJA SECA PARTIDA,2024-12-04 00:27:04.770357
,Secadora de cabello Whiteline camel 3 temperat...,S/ 59 un,plaza_vea,ARVEJA SECA PARTIDA,2024-12-04 00:27:04.770357
,Neewer 4 Pack Bolsas De Arena De Alta Resisten...,S/ 160 un,plaza_vea,ARVEJA SECA PARTIDA,2024-12-04 00:27:04.770357
,Llaveros de Pareja Riqueza Lord Tigre Lao Hu 2...,S/ 27 un,plaza_vea,ARVEJA SECA PARTIDA,2024-12-04 00:27:04.770357
,Llaveros de Pareja Proteccion Leon Guardian Fo...,S/ 27 un,plaza_vea,ARVEJA SECA PARTIDA,2024-12-04 00:27:04.770357
,Llaveros de Pareja Abundancia Buey Niu 2pza Fa...,S/ 27 un,plaza_vea,ARVEJA SECA PARTIDA,2024-12-04 00:27:04.770357
,Llaveros de Pareja Riqueza Raton Qian Mo 2pza ...,S/ 27 un,plaza_vea,ARVEJA SECA PARTIDA,2024-12-04 00:27:04.770357
,Llaveros de Pareja Abundancia Dragon Qilin 2pz...,S/ 27 un,plaza_vea,ARVEJA SECA PARTIDA,2024-12-04 00:27:04.770357
,Llaveros de Pareja Salud Leopardo Golden Feng ...,S/ 27 un,plaza_vea,ARVEJA SECA PARTIDA,2024-12-04 00:27:04.770357
,Aretes Pendientes De Drenaje Linfático Perdid...,S/ 39 un,plaza_vea,ARVEJA SECA PARTIDA,2024-12-04 00:27:04.770357
,Aretes Pendientes De Drenaje Linfático Perdida...,S/ 39 un,plaza_vea,ARVEJA SECA PARTIDA,2024-12-04 00:27:04.770357
,Aretes Pendientes De Drenaje Linfático Perdida...,S/ 39 un,plaza_vea,ARVEJA SECA PARTIDA,2024-12-04 00:27:04.770357
,Auriculares JBL Tour Pro 2 - Auriculares inalá...,"S/ 1,899 un",plaza_vea,ARVEJA SECA PARTIDA,2024-12-04 00:27:04.770357
,Auriculares JBL Wave Flex - Auriculares inalám...,S/ 499 un,plaza_vea,ARVEJA SECA PARTIDA,2024-12-04 00:27:04.770357
,Auriculares JBL Endurance Race - Auriculares i...,S/ 499 un,plaza_vea,ARVEJA SECA PARTIDA,2024-12-04 00:27:04.770357
,Almohada para Parejas Memory Foam Descanso de ...,S/ 129 un,plaza_vea,ARVEJA SECA PARTIDA,2024-12-04 00:27:04.770357
,Pistola Arroja Saetas en Color Anaranjado Y+St...,S/ 53.90 un,plaza_vea,ARVEJA SECA PARTIDA,2024-12-04 00:27:04.770357
,Llaveros de Pareja Abundancia Dragon Genbu 2pz...,S/ 27 un,plaza_vea,ARVEJA SECA PARTIDA,2024-12-04 00:27:04.770357
,Cubeta Eficaz de Arena Rosado y Naranja Y+Post...,S/ 129.90 un,plaza_vea,ARVEJA SECA PARTIDA,2024-12-04 00:27:04.770357
,Pelota Masticable con Patitas en Tono Azul Y+P...,S/ 39.90 un,plaza_vea,ARVEJA SECA PARTIDA,2024-12-04 00:27:04.770357
,Arenero para Gatos Compacto para Colocar Arena...,S/ 89.90 un,plaza_vea,ARVEJA SECA PARTIDA,2024-12-04 00:27:04.770357
,Paw De Patada Azul Por Unidad Real Fitenss Pe...,S/ 99 un,plaza_vea,ARVEJA SECA PARTIDA,2024-12-04 00:27:04.770357
,Paw De Patada Rojo Por Unidad Real Fitenss Per...,S/ 99 un,plaza_vea,ARVEJA SECA PARTIDA,2024-12-04 00:27:04.770357
,Paw De Patada Amarillo Por Unidad Real Fitens...,S/ 99 un,plaza_vea,ARVEJA SECA PARTIDA,2024-12-04 00:27:04.770357
,Teclado T-Dagger ARENA RGB T-TGK321P-RGB-SP PI...,S/ 185 un,plaza_vea,ARVEJA SECA PARTIDA,2024-12-04 00:27:04.770357
,Pack Echo Dot 5ta Generación Alexa Deep Sea Az...,S/ 258.80 un,plaza_vea,ARVEJA SECA PARTIDA,2024-12-04 00:27:04.770357
,Teclado T-Dagger ARENA RGB T-TGK321P-RGB-SP PI...,S/ 185 un,plaza_vea,ARVEJA SECA PARTIDA,2024-12-04 00:27:04.770357
,Teclado T-Dagger ARENA Rainbow T-TGK321W-BR WH...,S/ 165 un,plaza_vea,ARVEJA SECA PARTIDA,2024-12-04 00:27:04.770357
,Teclado T-Dagger ARENA RGB T-TGK321B-RGB-SP BL...,S/ 185 un,plaza_vea,ARVEJA SECA PARTIDA,2024-12-04 00:27:04.770357
,Teclado T-Dagger ARENA Rainbow T-TGK321-BR BLA...,S/ 165 un,plaza_vea,ARVEJA SECA PARTIDA,2024-12-04 00:27:04.770357
,Peine de Macotas Saca Pulgas Tono Blanco Y+Pap...,S/ 39.90 un,plaza_vea,ARVEJA SECA PARTIDA,2024-12-04 00:27:04.770357
,Tabla con Patitas Redonda de Tono Madera Y+Pos...,S/ 109.90 un,plaza_vea,ARVEJA SECA PARTIDA,2024-12-04 00:27:04.770357
,Arenero para Gatos Compacto de Arena 40x33x11 ...,S/ 53.90 un,plaza_vea,ARVEJA SECA PARTIDA,2024-12-04 00:27:04.770357
,Tabla con Patitas Redonda de Tono Madera Y+Pos...,S/ 119.90 un,plaza_vea,ARVEJA SECA PARTIDA,2024-12-04 00:27:04.770357
,Base Circular de Madera con Patitas de 39cm,S/ 83.90 un,plaza_vea,ARVEJA SECA PARTIDA,2024-12-04 00:27:04.770357
,Camisa Dexmen Seda Con Diseño Beige,S/ 43 un,plaza_vea,ARVEJA SECA PARTIDA,2024-12-04 00:27:04.770357
,Camisa Dexmen Seda Con Diseño Negro,S/ 43 un,plaza_vea,ARVEJA SECA PARTIDA,2024-12-04 00:27:04.770357
,Camisa Dexmen Seda Con Diseño Blanco,S/ 43 un,plaza_vea,ARVEJA SECA PARTIDA,2024-12-04 00:27:04.770357
,Camisa Dexmen Seda Palmera Celeste,S/ 59 un,plaza_vea,ARVEJA SECA PARTIDA,2024-12-04 00:27:04.770357
,Camisa Dexmen Seda Con Diseño Azul,S/ 43 un,plaza_vea,ARVEJA SECA PARTIDA,2024-12-04 00:27:04.770357
,Body de Manga Larga con Encaje de Seda Lenceri...,S/ 75.90 un,plaza_vea,ARVEJA SECA PARTIDA,2024-12-04 00:27:04.770357
,Neewer 4 Piezas Saco De Arena Que Se Puede Uti...,S/ 165 un,plaza_vea,ARVEJA SECA PARTIDA,2024-12-04 00:27:04.770357
,Saca Filo Compacto de Color Rojo Y+Post-it adh...,S/ 47.90 un,plaza_vea,ARVEJA SECA PARTIDA,2024-12-04 00:27:04.770357
,Base Redonda de Madera con Patitas de 39cm Y+A...,S/ 89.90 un,plaza_vea,ARVEJA SECA PARTIDA,2024-12-04 00:27:04.770357
,Base en Forma Circular con Patitas de 39cm Y+P...,S/ 93.90 un,plaza_vea,ARVEJA SECA PARTIDA,2024-12-04 00:27:04.770357
,Base Circular de Madera con Patitas de 44cm,S/ 93.90 un,plaza_vea,ARVEJA SECA PARTIDA,2024-12-04 00:27:04.770357
,Base en Forma Circular con Patitas de 44cm Y+P...,S/ 103.90 un,plaza_vea,ARVEJA SECA PARTIDA,2024-12-04 00:27:04.770357
,Base de Madera Forma Redonda con Patitas de 39...,S/ 99.90 un,plaza_vea,ARVEJA SECA PARTIDA,2024-12-04 00:27:04.770357
,Base de Madera Forma Redonda con Patitas de 44...,S/ 109.90 un,plaza_vea,ARVEJA SECA PARTIDA,2024-12-04 00:27:04.770357
,Base Redonda de Madera con Patitas de 44cm Y+A...,S/ 99.90 un,plaza_vea,ARVEJA SECA PARTIDA,2024-12-04 00:27:04.770357
,Plancha A Vapor Y Seco Efficient Esi10 + Freid...,S/ 199 un,plaza_vea,ARVEJA SECA PARTIDA,2024-12-04 00:27:04.770357
,Juguete Sonaja Musical Abeja Musical con Luces,S/ 37 un,plaza_vea,ARVEJA SECA PARTIDA,2024-12-04 00:27:04.770357
,Teclado T-Dagger ARENA RGB T-TGK321B-RGB-SP BL...,S/ 185 un,plaza_vea,ARVEJA SECA PARTIDA,2024-12-04 00:27:04.770357
,Teclado T-Dagger ARENA Rainbow T-TGK321-BR BLA...,S/ 165 un,plaza_vea,ARVEJA SECA PARTIDA,2024-12-04 00:27:04.770357
,Teclado T-Dagger ARENA Rainbow T-TGK321W-BR WH...,S/ 165 un,plaza_vea,ARVEJA SECA PARTIDA,2024-12-04 00:27:04.770357
,Sonic X Shadow Generations Playstation 5 Latam,S/ 215 un,plaza_vea,ARVEJA SECA PARTIDA,2024-12-04 00:27:04.770357
,NEEWER 6 Paquete Saco De Arena Negro Tarea Pes...,S/ 260 un,plaza_vea,ARVEJA SECA PARTIDA,2024-12-04 00:27:04.770357
,Audifonos Innovadores con Orejas de Gato Pop I...,S/ 89.90 un,plaza_vea,ARVEJA SECA PARTIDA,2024-12-04 00:27:04.770357
,Plancha de Ropa a Vapor y Seco Experience ESI8...,S/ 209 un,plaza_vea,ARVEJA SECA PARTIDA,2024-12-04 00:27:04.770357
,Maleta Mediana Dukap Royal Arena - RYMAR,S/ 139 un,plaza_vea,ARVEJA SECA PARTIDA,2024-12-04 00:27:04.770357
,Maleta Grande Dukap Royal Arena - RYGAR,S/ 189 un,plaza_vea,ARVEJA SECA PARTIDA,2024-12-04 00:27:04.770357
,LEGO 75390 Meca Ala-X de Luke Skywalker™,S/ 90.30 un,plaza_vea,ARVEJA SECA PARTIDA,2024-12-04 00:27:04.770357
,Short Dexmen Seda Blanco,S/ 49 un,plaza_vea,ARVEJA SECA PARTIDA,2024-12-04 00:27:04.770357
,Short Dexmen Seda Negro,S/ 49 un,plaza_vea,ARVEJA SECA PARTIDA,2024-12-04 00:27:04.770357
,Short Dexmen Seda Celeste,S/ 49 un,plaza_vea,ARVEJA SECA PARTIDA,2024-12-04 00:27:04.770357
,Pack Manta de Apego y Juguete Sonaja Oveja Ant...,S/ 89 un,plaza_vea,ARVEJA SECA PARTIDA,2024-12-04 00:27:04.770357
,Sonic X Shadow Generations Nintendo Switch Lat...,S/ 209 un,plaza_vea,ARVEJA SECA PARTIDA,2024-12-04 00:27:04.770357
,Maletas de Viaje Set de 3 Dukap Royal Arena - ...,S/ 399 un,plaza_vea,ARVEJA SECA PARTIDA,2024-12-04 00:27:04.770357
