unit,description,price,website,search_term,scrape_timestamp
Pack 2un,Pack Aceite Vegetal PRIMOR Premium 900ml Botel...,S/ 18.50 un,plaza_vea,VEGETALES SANCOCHADOS,2024-12-04 00:47:48.125968
Botella 900ml,Aceite Vegetal BELL'S Botella 900ml,S/ 5.80 un,plaza_vea,VEGETALES SANCOCHADOS,2024-12-04 00:47:48.125968
Botella 900ml,Aceite Vegetal PRIMOR Premium Botella 900ml,S/ 9.50 un,plaza_vea,VEGETALES SANCOCHADOS,2024-12-04 00:47:48.125968
Lata 140g,Trozos de Atún PRIMOR en Aceite Vegetal Lata 1...,S/ 5.50 un,plaza_vea,VEGETALES SANCOCHADOS,2024-12-04 00:47:48.125968
Pack 2un,Pack Aceite Vegetal PRIMOR Clásico Botella 900...,S/ 17 un,plaza_vea,VEGETALES SANCOCHADOS,2024-12-04 00:47:48.125968
Lata 140g,Filete de Atún en Aceite Vegetal FLORIDA Lata ...,S/ 5.90 un,plaza_vea,VEGETALES SANCOCHADOS,2024-12-04 00:47:48.125968
Botella 1.8L,Aceite Vegetal PRIMOR Clásico Botella 1.8L,S/ 16.30 un,plaza_vea,VEGETALES SANCOCHADOS,2024-12-04 00:47:48.125968
Botella 900ml,Aceite Vegetal PRIMOR Clásico Botella 900ml,S/ 8.50 un,plaza_vea,VEGETALES SANCOCHADOS,2024-12-04 00:47:48.125968
Lata 140g,Filete de Atún PRIMOR en Aceite Vegetal Lata 1...,S/ 5.90 un,plaza_vea,VEGETALES SANCOCHADOS,2024-12-04 00:47:48.125968
Lata 150g,Filete de Atún CAMPOMAR en Aceite Vegetal Lata...,S/ 5.60 un,plaza_vea,VEGETALES SANCOCHADOS,2024-12-04 00:47:48.125968
Botella 900ml,Aceite Vegetal DELEITE Premium Botella 900ml,S/ 6.20 un,plaza_vea,VEGETALES SANCOCHADOS,2024-12-04 00:47:48.125968
Botella 900ml,Aceite Vegetal COCINERO Botella 900ml,S/ 8 un,plaza_vea,VEGETALES SANCOCHADOS,2024-12-04 00:47:48.125968
Lata 150g,Lomos de Atún en Aceite Vegetal CAMPOMAR Lata ...,S/ 5.80 un,plaza_vea,VEGETALES SANCOCHADOS,2024-12-04 00:47:48.125968
Lata 170g,Sólido de Caballa CAMPOMAR en Aceite Vegetal L...,S/ 5.20 un,plaza_vea,VEGETALES SANCOCHADOS,2024-12-04 00:47:48.125968
Pack 3un,Filete de Atún en Aceite Vegetal FLORIDA Lata ...,S/ 13 un,plaza_vea,VEGETALES SANCOCHADOS,2024-12-04 00:47:48.125968
Lata 150g,Trozos de Atún en Aceite Vegetal CAMPOMAR Lata...,S/ 5.40 un,plaza_vea,VEGETALES SANCOCHADOS,2024-12-04 00:47:48.125968
Lata 170g,Filete de Caballa FRESCOMAR Aceite Vegetal Lat...,S/ 4.80 un,plaza_vea,VEGETALES SANCOCHADOS,2024-12-04 00:47:48.125968
Lata 140g,Filete de Atún en Aceite Vegetal FANNY Lata 14...,S/ 5.90 un,plaza_vea,VEGETALES SANCOCHADOS,2024-12-04 00:47:48.125968
Galonera 5L,Aceite Vegetal BELL'S Galonera 5L,S/ 31.90 un,plaza_vea,VEGETALES SANCOCHADOS,2024-12-04 00:47:48.125968
Lata 140g,Filete de Atún en Aceite Vegetal GLORIA Lata 1...,S/ 6 un,plaza_vea,VEGETALES SANCOCHADOS,2024-12-04 00:47:48.125968
Bolsa 15Kg,Comida para Perros MIMASKOT Adultos Raza Media...,S/ 94.90 un,plaza_vea,VEGETALES SANCOCHADOS,2024-12-04 00:47:48.125968
Lata 140g,Trozos de Atún FLORIDA en Aceite Vegetal Lata ...,S/ 5.80 un,plaza_vea,VEGETALES SANCOCHADOS,2024-12-04 00:47:48.125968
Bolsa 22Kg,"Comida para Perros MIMASKOT Carne, Cereal y Ve...",S/ 133.90 un,plaza_vea,VEGETALES SANCOCHADOS,2024-12-04 00:47:48.125968
Pack 2un,Pack Aceite Vegetal COCINERO Botella 900ml x 2...,S/ 16.10 un,plaza_vea,VEGETALES SANCOCHADOS,2024-12-04 00:47:48.125968
Lata 140g,Trozos de Atún en Aceite Vegetal GLORIA Lata 1...,S/ 5.90 un,plaza_vea,VEGETALES SANCOCHADOS,2024-12-04 00:47:48.125968
Botella 3L,Aceite Vegetal BELL'S Botella 3L,S/ 19.50 un,plaza_vea,VEGETALES SANCOCHADOS,2024-12-04 00:47:48.125968
Bidón 5L,Aceite Vegetal DELEITE Premium Bidón 5L,S/ 35.50 un,plaza_vea,VEGETALES SANCOCHADOS,2024-12-04 00:47:48.125968
Lata 150g,Sólido de Caballa CAMPOMAR en Aceite Vegetal L...,S/ 5.20 un,plaza_vea,VEGETALES SANCOCHADOS,2024-12-04 00:47:48.125968
Bolsa 250g,Piqueo VEGGIE CHIPS MIX Hojuelas de vegetales ...,S/ 8.90 un,plaza_vea,VEGETALES SANCOCHADOS,2024-12-04 00:47:48.125968
Caja 946ml,Bebida Vegetal NATURE'S HEART Origen Caja 946m...,S/ 10.99 un,plaza_vea,VEGETALES SANCOCHADOS,2024-12-04 00:47:48.125968
Lata 170g,Filete de Bonito FRESCOMAR en Aceite Vegetal L...,S/ 4.50 un,plaza_vea,VEGETALES SANCOCHADOS,2024-12-04 00:47:48.125968
Lata 170g,Filete de Atún Claro CAMPOMAR en Aceite Vegeta...,S/ 6.80 un,plaza_vea,VEGETALES SANCOCHADOS,2024-12-04 00:47:48.125968
Lata 170g,Trozos de Atún FRESCOMAR en Aceite Vegetal Lat...,S/ 5.40 un,plaza_vea,VEGETALES SANCOCHADOS,2024-12-04 00:47:48.125968
Galón 5L,Aceite Vegetal PRIMOR Galón 5L,S/ 47.10 un,plaza_vea,VEGETALES SANCOCHADOS,2024-12-04 00:47:48.125968
Lata 170g,Filete de Atún FRESCOMAR Aceite Vegetal Lata 1...,S/ 5.60 un,plaza_vea,VEGETALES SANCOCHADOS,2024-12-04 00:47:48.125968
,Sólido de Atún BELL'S en Aceite Vegetal Lata 1...,S/ 5.60 un,plaza_vea,VEGETALES SANCOCHADOS,2024-12-04 00:47:48.125968
Bolsa 400g,Mix Vegetales Precocidos GREEN FOOD Bolsa 400g,S/ 8.30 un,plaza_vea,VEGETALES SANCOCHADOS,2024-12-04 00:47:48.125968
Lata 140g,Trozos de Atún en Aceite Vegetal A1 Lata 140g,S/ 4.90 un,plaza_vea,VEGETALES SANCOCHADOS,2024-12-04 00:47:48.125968
Lata 140g,Filete de Atún en Aceite Vegetal A1 Lata 140g,S/ 5.30 un,plaza_vea,VEGETALES SANCOCHADOS,2024-12-04 00:47:48.125968
Lata 140g,Trozos de Atún en Aceite Vegetal FANNY Lata 14...,S/ 5.80 un,plaza_vea,VEGETALES SANCOCHADOS,2024-12-04 00:47:48.125968
Botella 900ml,Aceite Vegetal Olivado HUERTO ALAMEIN Botella ...,S/ 14.39 un,plaza_vea,VEGETALES SANCOCHADOS,2024-12-04 00:47:48.125968
Caja 400g,Hamburguesa Vegetal de Finas Hierbas DELLANATU...,S/ 16.90 un,plaza_vea,VEGETALES SANCOCHADOS,2024-12-04 00:47:48.125968
Pack 2un,Pack Trozos de Atún en Aceite Vegetal CAMPOMAR...,S/ 8.80 un,plaza_vea,VEGETALES SANCOCHADOS,2024-12-04 00:47:48.125968
,Concentrado de Bebida de Almendras LA PURITA 1...,S/ 29.90 un,plaza_vea,VEGETALES SANCOCHADOS,2024-12-04 00:47:48.125968
Caja 1L,Bebida Vegetal NOT MILK Low Fat Caja 1L,S/ 15.90 un,plaza_vea,VEGETALES SANCOCHADOS,2024-12-04 00:47:48.125968
,Concentrado de Bebida de Almendras LA PURITA 1...,S/ 12 un,plaza_vea,VEGETALES SANCOCHADOS,2024-12-04 00:47:48.125968
Caja 1L,Crema Vegetal MASTER GOURMET Caja 1L,S/ 17.90 un,plaza_vea,VEGETALES SANCOCHADOS,2024-12-04 00:47:48.125968
Frasco 425g,Conserva VALLE FERTIL Vegetales mixtos Frasco ...,S/ 9.90 un,plaza_vea,VEGETALES SANCOCHADOS,2024-12-04 00:47:48.125968
Caja 120g,Sardina Picante en Aceite Vegetal PALACIO Caja...,S/ 17.60 un,plaza_vea,VEGETALES SANCOCHADOS,2024-12-04 00:47:48.125968
Pack 2un,Pack Panetón BLANCA FLOR Bolsa 900g + Aceite V...,S/ 31 un,plaza_vea,VEGETALES SANCOCHADOS,2024-12-04 00:47:48.125968
,Figura de Acción DRAGON BALL Vegeta Ssj Dios 1...,S/ 54.90 un,plaza_vea,VEGETALES SANCOCHADOS,2024-12-04 00:47:48.125968
,Wok DECO HOME Vegetales Mini Colores Varios,S/ 16.90 un,plaza_vea,VEGETALES SANCOCHADOS,2024-12-04 00:47:48.125968
Botella 1.18L,Aceite Vegetal WESSON Canola Botella 1.18L,S/ 38.70 un,plaza_vea,VEGETALES SANCOCHADOS,2024-12-04 00:47:48.125968
,Pelota VINIBALL Dragon Ball Vegeta PVC,S/ 8.90 un,plaza_vea,VEGETALES SANCOCHADOS,2024-12-04 00:47:48.125968
,Contenedor de Vegetales VIVA HOME,S/ 4.90 un,plaza_vea,VEGETALES SANCOCHADOS,2024-12-04 00:47:48.125968
Pack 2un,Pack Panetón BLANCA FLOR Caja 900g + Aceite Ve...,S/ 34.40 un,plaza_vea,VEGETALES SANCOCHADOS,2024-12-04 00:47:48.125968
Bidón 3L,Aceite Vegetal Premium DELEITE Bidón 3L,S/ 22.40 un,plaza_vea,VEGETALES SANCOCHADOS,2024-12-04 00:47:48.125968
,Figura de Acción DRAGON BALL Vegeta 30cm,S/ 79.90 un,plaza_vea,VEGETALES SANCOCHADOS,2024-12-04 00:47:48.125968
,Escurridor centrífugo de vegetales,S/ 25.90 un,plaza_vea,VEGETALES SANCOCHADOS,2024-12-04 00:47:48.125968
,Carbón Fogon Vegetal Maderas Duras x 3kg,S/ 22.90 un,plaza_vea,VEGETALES SANCOCHADOS,2024-12-04 00:47:48.125968
,Carbón Fogon Vegetal Maderas Duras x 5kg,S/ 35.90 un,plaza_vea,VEGETALES SANCOCHADOS,2024-12-04 00:47:48.125968
,Carbón Fogon Vegetal Maderas Duras x 10kg,S/ 50.90 un,plaza_vea,VEGETALES SANCOCHADOS,2024-12-04 00:47:48.125968
,Set x 2 secadores Vegetales 40x60cm Orange,S/ 16.90 un,plaza_vea,VEGETALES SANCOCHADOS,2024-12-04 00:47:48.125968
,Bolsa Vegetal Verde Cemento 15cm,S/ 16.90 un,plaza_vea,VEGETALES SANCOCHADOS,2024-12-04 00:47:48.125968
,Figura Dragon Ball Vegeta Super Heroe 17Cm,S/ 109.90 un,plaza_vea,VEGETALES SANCOCHADOS,2024-12-04 00:47:48.125968
,Figura Dragon Ball Majin Vegeta 17Cm,S/ 109.90 un,plaza_vea,VEGETALES SANCOCHADOS,2024-12-04 00:47:48.125968
,Figura Dragon Ball Dios Vegeta 12Cm,S/ 59.90 un,plaza_vea,VEGETALES SANCOCHADOS,2024-12-04 00:47:48.125968
,Set De Jardinería Para Bebes Melissa & Doug Co...,S/ 349 un,plaza_vea,VEGETALES SANCOCHADOS,2024-12-04 00:47:48.125968
,Rack Para Vegetales Std,S/ 149 un,plaza_vea,VEGETALES SANCOCHADOS,2024-12-04 00:47:48.125968
,Tarwi en Polvo 500 Gr Fuente de Proteina Veget...,S/ 37 un,plaza_vea,VEGETALES SANCOCHADOS,2024-12-04 00:47:48.125968
,Aceite vegetal de Moringa Brana x 30 ml,S/ 27 un,plaza_vea,VEGETALES SANCOCHADOS,2024-12-04 00:47:48.125968
,Don Fermin con Vegetales 150 Gr,S/ 22 un,plaza_vea,VEGETALES SANCOCHADOS,2024-12-04 00:47:48.125968
,Aceite Vegetal de Ricino BRANA (30ml),S/ 29.70 un,plaza_vea,VEGETALES SANCOCHADOS,2024-12-04 00:47:48.125968
,Aceite vegetal de Rosa Mosqueta Brana x 15 ml,S/ 40 un,plaza_vea,VEGETALES SANCOCHADOS,2024-12-04 00:47:48.125968
,Tarwi con Maca Negra en polvo 500 Gr Fuente de...,S/ 37 un,plaza_vea,VEGETALES SANCOCHADOS,2024-12-04 00:47:48.125968
,Tarwi con Lucuma en Polvo 500 Gr Fuente de Pro...,S/ 37 un,plaza_vea,VEGETALES SANCOCHADOS,2024-12-04 00:47:48.125968
,Aceite vegetal de Semilla de Uva Brana x 30 ml,S/ 27 un,plaza_vea,VEGETALES SANCOCHADOS,2024-12-04 00:47:48.125968
,Spirulina Oriundos Capsulas Vegetales 120 Caps...,S/ 70 un,plaza_vea,VEGETALES SANCOCHADOS,2024-12-04 00:47:48.125968
,Aguaje con Cocona Oriundos Capsula Vegetal 100...,S/ 39 un,plaza_vea,VEGETALES SANCOCHADOS,2024-12-04 00:47:48.125968
,Vida Moringa Oriundos Capsulas Vegetales 120 C...,S/ 39 un,plaza_vea,VEGETALES SANCOCHADOS,2024-12-04 00:47:48.125968
,Curcumix Oriundos Capsulas Vegetales 100x500 m...,S/ 39 un,plaza_vea,VEGETALES SANCOCHADOS,2024-12-04 00:47:48.125968
,Set de Vegetales Bigjigs para Cortar con Gorro...,S/ 130 un,plaza_vea,VEGETALES SANCOCHADOS,2024-12-04 00:47:48.125968
,Escurridor Centrifuga Para Vegetales 5 Galones,S/ 629 un,plaza_vea,VEGETALES SANCOCHADOS,2024-12-04 00:47:48.125968
,Colágeno Vegetal de Cushuro Santa Natura 450 ...,S/ 180 un,plaza_vea,VEGETALES SANCOCHADOS,2024-12-04 00:47:48.125968
,Lata de Fluye de 150g Mezcla de frutas y vege...,S/ 39 un,plaza_vea,VEGETALES SANCOCHADOS,2024-12-04 00:47:48.125968
,Caja de Fluye To Go de 56g Mezcla de frutas y ...,S/ 25 un,plaza_vea,VEGETALES SANCOCHADOS,2024-12-04 00:47:48.125968
,Rociador de aceite vegetal,S/ 28 un,plaza_vea,VEGETALES SANCOCHADOS,2024-12-04 00:47:48.125968
,Sancochador de Huevos Electrico,S/ 42 un,plaza_vea,VEGETALES SANCOCHADOS,2024-12-04 00:47:48.125968
,Funko Pop Dragon Ball GT - Vegeta 1627,S/ 69 un,plaza_vea,VEGETALES SANCOCHADOS,2024-12-04 00:47:48.125968
,Figura Coleccionable Bandai De Dragon Ball Z ...,S/ 120 un,plaza_vea,VEGETALES SANCOCHADOS,2024-12-04 00:47:48.125968
,Escurridor Ideal de Vegetales en Verde Y+Papel...,S/ 93.90 un,plaza_vea,VEGETALES SANCOCHADOS,2024-12-04 00:47:48.125968
,Carbón Vegetal 3lt,S/ 25 un,plaza_vea,VEGETALES SANCOCHADOS,2024-12-04 00:47:48.125968
,Cuchillo Para Vegetales 12.5 Cm PRESS Design,S/ 22.90 un,plaza_vea,VEGETALES SANCOCHADOS,2024-12-04 00:47:48.125968
,Libro Educativo de Vegetales,S/ 49.99 un,plaza_vea,VEGETALES SANCOCHADOS,2024-12-04 00:47:48.125968
,Aceite Vegetal de Rosa Mosqueta BRANA (30ml),S/ 45 un,plaza_vea,VEGETALES SANCOCHADOS,2024-12-04 00:47:48.125968
,Set de 3 Cuchillos para Vegetales,S/ 19.90 un,plaza_vea,VEGETALES SANCOCHADOS,2024-12-04 00:47:48.125968
,Hidrohuerto Starter Kit Hidroponika para 8 veg...,S/ 79 un,plaza_vea,VEGETALES SANCOCHADOS,2024-12-04 00:47:48.125968
,"Cuchillo Para Vegetales 12,5 Cm PRESS Cuchillo...",S/ 16.90 un,plaza_vea,VEGETALES SANCOCHADOS,2024-12-04 00:47:48.125968
,Hidrohuerto Pared Hidroponika 3 para 75 vegeta...,"S/ 1,200 un",plaza_vea,VEGETALES SANCOCHADOS,2024-12-04 00:47:48.125968
,Hidrohuerto Piramidal Hidroponika 4 hasta 180 ...,"S/ 1,800 un",plaza_vea,VEGETALES SANCOCHADOS,2024-12-04 00:47:48.125968
,Hidrohuerto Piramidal Hidroponika 3 hasta 180 ...,"S/ 1,600 un",plaza_vea,VEGETALES SANCOCHADOS,2024-12-04 00:47:48.125968
,Hidrohuerto Pared Hidroponika 3 para 45 vegeta...,S/ 790 un,plaza_vea,VEGETALES SANCOCHADOS,2024-12-04 00:47:48.125968
,Pack Vegetales y Bandeja en Multicolor Y+Agend...,S/ 49.90 un,plaza_vea,VEGETALES SANCOCHADOS,2024-12-04 00:47:48.125968
,Pack Vegetales y Bandeja en Multicolor Y+Agend...,S/ 47.90 un,plaza_vea,VEGETALES SANCOCHADOS,2024-12-04 00:47:48.125968
,Pack Vegetales y Bandeja en Multicolor Y+Agend...,S/ 47.90 un,plaza_vea,VEGETALES SANCOCHADOS,2024-12-04 00:47:48.125968
,Escurridor de Vegetales en Color Blanco Y+Pape...,S/ 59.90 un,plaza_vea,VEGETALES SANCOCHADOS,2024-12-04 00:47:48.125968
,Carbón Vegetal Colorado Bolsa de 3 Kg para Par...,S/ 20 un,plaza_vea,VEGETALES SANCOCHADOS,2024-12-04 00:47:48.125968
,Lata Bravery Pollo y Vegetales para Perros 290...,S/ 29.24 un,plaza_vea,VEGETALES SANCOCHADOS,2024-12-04 00:47:48.125968
,Alimento Congelado para Perros Chescan Pollo V...,S/ 14.30 un,plaza_vea,VEGETALES SANCOCHADOS,2024-12-04 00:47:48.125968
,Alimento Congelado para Perros Chescan Pavo Re...,S/ 19.40 un,plaza_vea,VEGETALES SANCOCHADOS,2024-12-04 00:47:48.125968
,Don Fermin con Vegetales 50 Gr,S/ 7 un,plaza_vea,VEGETALES SANCOCHADOS,2024-12-04 00:47:48.125968
,Figura Coleccionable de Dragon Ball Z Solid Ed...,S/ 139.90 un,plaza_vea,VEGETALES SANCOCHADOS,2024-12-04 00:47:48.125968
,Figura Coleccionable de Dragon Ball Z Solid Ed...,S/ 139.90 un,plaza_vea,VEGETALES SANCOCHADOS,2024-12-04 00:47:48.125968
,Carbón Nebraska de 2 Kilos carbón vegetal de M...,S/ 13 un,plaza_vea,VEGETALES SANCOCHADOS,2024-12-04 00:47:48.125968
,Carbón Nebraska de 3 kilos carbón vegetal de M...,S/ 19.50 un,plaza_vea,VEGETALES SANCOCHADOS,2024-12-04 00:47:48.125968
,Carbón Nebraska de 5 kilos carbón vegetal de M...,S/ 28.50 un,plaza_vea,VEGETALES SANCOCHADOS,2024-12-04 00:47:48.125968
,Carbón Machete de 3 kilos carbón vegetal Shihu...,S/ 25.50 un,plaza_vea,VEGETALES SANCOCHADOS,2024-12-04 00:47:48.125968
,Carbón Machete de 5 kilos carbón vegetal Shihu...,S/ 35.50 un,plaza_vea,VEGETALES SANCOCHADOS,2024-12-04 00:47:48.125968
,Carbón Nebraska de 25 kilos carbón vegetal de ...,S/ 125.50 un,plaza_vea,VEGETALES SANCOCHADOS,2024-12-04 00:47:48.125968
,Carbón Machete de 10 kilos carbón vegetal Shih...,S/ 68.50 un,plaza_vea,VEGETALES SANCOCHADOS,2024-12-04 00:47:48.125968
,Carbón Machete de 25 kilos carbón vegetal Shih...,S/ 165 un,plaza_vea,VEGETALES SANCOCHADOS,2024-12-04 00:47:48.125968
,Carbón Nebraska de 10 kilos carbón vegetal de ...,S/ 52.50 un,plaza_vea,VEGETALES SANCOCHADOS,2024-12-04 00:47:48.125968
,Papel Vegetal 112GR - Pack 50UDS,S/ 39 un,plaza_vea,VEGETALES SANCOCHADOS,2024-12-04 00:47:48.125968
,Polo Niño Dragon Ball Z Vegeta traje Azulino,S/ 60 un,plaza_vea,VEGETALES SANCOCHADOS,2024-12-04 00:47:48.125968
,Polo Dragon Ball Z Vegeta Traje Azulino,S/ 70 un,plaza_vea,VEGETALES SANCOCHADOS,2024-12-04 00:47:48.125968
,Polo Dragon Ball Z Blue Vegeta Azulino,S/ 60 un,plaza_vea,VEGETALES SANCOCHADOS,2024-12-04 00:47:48.125968
,Polo Dragon Ball Z Vegeta Azulino,S/ 65 un,plaza_vea,VEGETALES SANCOCHADOS,2024-12-04 00:47:48.125968
,Comida Para Perro Naturo Salmon Arroz Y Vegeta...,S/ 10.40 un,plaza_vea,VEGETALES SANCOCHADOS,2024-12-04 00:47:48.125968
,Comida Para Perro Naturo Pavo Con Frutas Y Veg...,S/ 17.90 un,plaza_vea,VEGETALES SANCOCHADOS,2024-12-04 00:47:48.125968
,Comida Para Perro Naturo Pato Con Frutas Y Veg...,S/ 17.90 un,plaza_vea,VEGETALES SANCOCHADOS,2024-12-04 00:47:48.125968
,Comida Para Perro Naturo Salmon Con Papa Y Veg...,S/ 18.50 un,plaza_vea,VEGETALES SANCOCHADOS,2024-12-04 00:47:48.125968
,Comida Para Perro Naturo Pollo Frutas Y Vegeta...,S/ 17.90 un,plaza_vea,VEGETALES SANCOCHADOS,2024-12-04 00:47:48.125968
,Comida Para Perro Naturo Pollo Con Papa Y Vege...,S/ 18.50 un,plaza_vea,VEGETALES SANCOCHADOS,2024-12-04 00:47:48.125968
,Comida Para Perro Naturo Mini Pollo Papa Y Veg...,S/ 10.40 un,plaza_vea,VEGETALES SANCOCHADOS,2024-12-04 00:47:48.125968
,Comida Para Perro Naturo Pollo Papa Y Vegetale...,S/ 10.40 un,plaza_vea,VEGETALES SANCOCHADOS,2024-12-04 00:47:48.125968
,Comida Para Perro Naturo Cordero Arroz Y Veget...,S/ 10.40 un,plaza_vea,VEGETALES SANCOCHADOS,2024-12-04 00:47:48.125968
,Picatodo Cortador de Vegetales Inalámbrico Mul...,S/ 27 un,plaza_vea,VEGETALES SANCOCHADOS,2024-12-04 00:47:48.125968
,Funko Pop Dragon Ball Z Majin Vegeta 862,S/ 69.78 un,plaza_vea,VEGETALES SANCOCHADOS,2024-12-04 00:47:48.125968
,Bolso de mano Bottega Veneta para Mujer en Mul...,"S/ 5,809 un",plaza_vea,VEGETALES SANCOCHADOS,2024-12-04 00:47:48.125968
,Cortador de Vegetales Multifunción con Papel,S/ 49.90 un,plaza_vea,VEGETALES SANCOCHADOS,2024-12-04 00:47:48.125968
,Aceite vegetal de Palta Brana x 30 ml,S/ 27 un,plaza_vea,VEGETALES SANCOCHADOS,2024-12-04 00:47:48.125968
,Aceite vegetal de Jojoba Brana x 30 ml,S/ 27 un,plaza_vea,VEGETALES SANCOCHADOS,2024-12-04 00:47:48.125968
,Aceite vegetal de Almendras Brana x 30 ml,S/ 27 un,plaza_vea,VEGETALES SANCOCHADOS,2024-12-04 00:47:48.125968
,Figura de Accion Super Saiyan Vegeta Bandai SH...,S/ 360.56 un,plaza_vea,VEGETALES SANCOCHADOS,2024-12-04 00:47:48.125968
,Figura Super Saiyan God Vegeta Banpresto Maste...,S/ 268.69 un,plaza_vea,VEGETALES SANCOCHADOS,2024-12-04 00:47:48.125968
,Tarwi en Polvo 1.5 Kg Fuente de Proteina Veget...,S/ 97 un,plaza_vea,VEGETALES SANCOCHADOS,2024-12-04 00:47:48.125968
,Mouse pad Dragon Ball Vegeta,S/ 30 un,plaza_vea,VEGETALES SANCOCHADOS,2024-12-04 00:47:48.125968
,Cortador Vegetales Frutas Multifuncional Acero...,S/ 29 un,plaza_vea,VEGETALES SANCOCHADOS,2024-12-04 00:47:48.125968
,Polo de Hombre Idakoos Vegetables Are What Foo...,S/ 59 un,plaza_vea,VEGETALES SANCOCHADOS,2024-12-04 00:47:48.125968
,Gorra Dragon Ball Vegeta Negro,S/ 45 un,plaza_vea,VEGETALES SANCOCHADOS,2024-12-04 00:47:48.125968
,Figura De Accion Tamashii Nations Vegeta Super...,S/ 429.90 un,plaza_vea,VEGETALES SANCOCHADOS,2024-12-04 00:47:48.125968
,Filtro de Leche Vegetal Bamboo Balance,S/ 29 un,plaza_vea,VEGETALES SANCOCHADOS,2024-12-04 00:47:48.125968
,Juguete Masticable de Madera y Esponja Vegetal...,S/ 17.99 un,plaza_vea,VEGETALES SANCOCHADOS,2024-12-04 00:47:48.125968
,Entry Grade Model Kits Ssgss Vegeta New Dragon...,S/ 79.90 un,plaza_vea,VEGETALES SANCOCHADOS,2024-12-04 00:47:48.125968
,Shampoo Capilatis Keratina Vegetal - Frasco 35...,S/ 10.40 un,plaza_vea,VEGETALES SANCOCHADOS,2024-12-04 00:47:48.125968
,Tarwi con Cacao en Polvo 500 Gr Fuente de Prot...,S/ 37 un,plaza_vea,VEGETALES SANCOCHADOS,2024-12-04 00:47:48.125968
,Contenedor Hermético para Vegetales 4 Division...,S/ 59.90 un,plaza_vea,VEGETALES SANCOCHADOS,2024-12-04 00:47:48.125968
,Shampoo Anti-Caída Capilatis Ortiga con Extrac...,S/ 22.90 un,plaza_vea,VEGETALES SANCOCHADOS,2024-12-04 00:47:48.125968
,Juguete Pack de 144 Contadores de Vegetales Ed...,S/ 245 un,plaza_vea,VEGETALES SANCOCHADOS,2024-12-04 00:47:48.125968
,Caja Picadora Trituradora Vegetales,S/ 50 un,plaza_vea,VEGETALES SANCOCHADOS,2024-12-04 00:47:48.125968
,Pack Belleza Caja de Regalo Crema Corporal Pin...,S/ 338 un,plaza_vea,VEGETALES SANCOCHADOS,2024-12-04 00:47:48.125968
,Cuchillo Ondulado de Acero Inoxidable para Pap...,S/ 6.90 un,plaza_vea,VEGETALES SANCOCHADOS,2024-12-04 00:47:48.125968
,Funko Pop Dragon Ball Z Vegeta (Explorer),S/ 79.90 un,plaza_vea,VEGETALES SANCOCHADOS,2024-12-04 00:47:48.125968
,Pack de Tintas Comestible Vegetal Importadas C...,S/ 369.90 un,plaza_vea,VEGETALES SANCOCHADOS,2024-12-04 00:47:48.125968
,Esponja Vegetal Lufa The Ecobag Company,S/ 15 un,plaza_vea,VEGETALES SANCOCHADOS,2024-12-04 00:47:48.125968
,Aceite Vegetal de Jojoba 200ml,S/ 69 un,plaza_vea,VEGETALES SANCOCHADOS,2024-12-04 00:47:48.125968
