unit,description,price,website,search_term,scrape_timestamp
Bolsa 400g,Galletas Bañadas de Chocolate 2 CERRITOS Cacho...,S/ 24.30 un,plaza_vea,GALLINA EVISCERADA,2024-12-03 22:36:56.004627
Pack 2un,Pack Néctar FRUGOS Manzana Caja 235ml Paquete ...,S/ 10.70 un,plaza_vea,GALLINA EVISCERADA,2024-12-03 22:36:56.004627
Caja 200g,Galletas COLOMBINA Feliz Navidad Árbol Caja 20...,S/ 11.50 un,plaza_vea,GALLINA EVISCERADA,2024-12-03 22:36:56.004627
Caja 6un,Galletas con Quinua y Ajonjolí INCASUR Caja 6u...,S/ 9 un,plaza_vea,GALLINA EVISCERADA,2024-12-03 22:36:56.004627
Caja 100g,Galleta Salada TABLA GOURMET Caja 100g,S/ 9.30 un,plaza_vea,GALLINA EVISCERADA,2024-12-03 22:36:56.004627
Pote 240g,Galletas con Chocochips sin Gluten LA FLORENCI...,S/ 19.90 un,plaza_vea,GALLINA EVISCERADA,2024-12-03 22:36:56.004627
Paquete 90g,Galletas RELLENITAS de Fresa Paquete 90g,S/ 2.50 un,plaza_vea,GALLINA EVISCERADA,2024-12-03 22:36:56.004627
Paquete 90g,Galletas RELLENITAS de Chocolate Paquete 90g,S/ 2.50 un,plaza_vea,GALLINA EVISCERADA,2024-12-03 22:36:56.004627
Bolsa 210g,Galletas sin Gluten NOGLUT María Biscuits Bols...,S/ 15.90 un,plaza_vea,GALLINA EVISCERADA,2024-12-03 22:36:56.004627
Pote 320g,Galletas Lengüitas de Gato ANA AVELLANA Pote 3...,S/ 19.90 un,plaza_vea,GALLINA EVISCERADA,2024-12-03 22:36:56.004627
Caja 131.2g,Galletas OREO Navidad Cobertura de Chocolate B...,S/ 6.30 un,plaza_vea,GALLINA EVISCERADA,2024-12-03 22:36:56.004627
Pack 2un,Pack Trozos de Atún en Aceite Vegetal CAMPOMAR...,S/ 8.80 un,plaza_vea,GALLINA EVISCERADA,2024-12-03 22:36:56.004627
Caja 320g,Premezcla para Galletas Chocochip POSTRES EN C...,S/ 9.90 un,plaza_vea,GALLINA EVISCERADA,2024-12-03 22:36:56.004627
Caja 400g,Galletas Surtidas COLOMBINA Navidad Caja 400g,S/ 16.30 un,plaza_vea,GALLINA EVISCERADA,2024-12-03 22:36:56.004627
Caja 40g,Galletas Rellenas de Crema BISCOLATA Mood Caja...,S/ 4.10 un,plaza_vea,GALLINA EVISCERADA,2024-12-03 22:36:56.004627
Caja 200g,Galletas Navideñas SAN JORGE Caja 200g,S/ 7.10 un,plaza_vea,GALLINA EVISCERADA,2024-12-03 22:36:56.004627
Envase 1un,Galleta Decorada Temática,S/ 3.90 un,plaza_vea,GALLINA EVISCERADA,2024-12-03 22:36:56.004627
Paquete 213g,Galletas Napolitanas CUETARA Paquete 213g,S/ 4.90 un,plaza_vea,GALLINA EVISCERADA,2024-12-03 22:36:56.004627
Caja 6un,Galletas con Quinua y Coco Rallado INCASUR Caj...,S/ 9 un,plaza_vea,GALLINA EVISCERADA,2024-12-03 22:36:56.004627
Paquete 195g,Galletas CUETARA Palmeritas Paquete 195g,S/ 3.50 un,plaza_vea,GALLINA EVISCERADA,2024-12-03 22:36:56.004627
Bolsa 130g,Galletas Integrales LIGERITAS Salvado de Trigo...,S/ 9.70 un,plaza_vea,GALLINA EVISCERADA,2024-12-03 22:36:56.004627
Bolsa 96g,Galletas FIELD Charada Paquete 96g,S/ 2.40 un,plaza_vea,GALLINA EVISCERADA,2024-12-03 22:36:56.004627
Bolsa 195g,Galletas sabor Naranja SANTIVERI Sin Gluten Bo...,S/ 17.90 un,plaza_vea,GALLINA EVISCERADA,2024-12-03 22:36:56.004627
Caja 380g,Galletas Integrales FIBRA LIGHT de Salvado Caj...,S/ 11.90 un,plaza_vea,GALLINA EVISCERADA,2024-12-03 22:36:56.004627
Pote 300g,Galletas con Arándanos sin Gluten LA FLORENCIA...,S/ 19.90 un,plaza_vea,GALLINA EVISCERADA,2024-12-03 22:36:56.004627
Paquete 100g,Galletas BAUDUCCO Chocolate Chips Paquete 100g,S/ 6.60 un,plaza_vea,GALLINA EVISCERADA,2024-12-03 22:36:56.004627
Caja 200g,Galletas COLOMBINA Casa Navideña Caja 200g,S/ 13.40 un,plaza_vea,GALLINA EVISCERADA,2024-12-03 22:36:56.004627
Bolsa 95g,Galleta con Chocolate y Maní BON O BON Bolsa 9...,S/ 6.50 un,plaza_vea,GALLINA EVISCERADA,2024-12-03 22:36:56.004627
Paquete 70g,Galletas Integrales FIBRA LIGHT de Salvado de ...,S/ 2.90 un,plaza_vea,GALLINA EVISCERADA,2024-12-03 22:36:56.004627
,Chocolate con Galleta NESTLÉ Sublime Caja 24un,S/ 48.50 un,plaza_vea,GALLINA EVISCERADA,2024-12-03 22:36:56.004627
,Cortador de Galletas DECO HOME Paquete 3un,S/ 5.90 un,plaza_vea,GALLINA EVISCERADA,2024-12-03 22:36:56.004627
Bolsa 220g,Galletas de Agua MINIAGÜITAS tipo Canapé Bolsa...,S/ 17.90 un,plaza_vea,GALLINA EVISCERADA,2024-12-03 22:36:56.004627
Bolsa 150g,Galletas NOGLUT Pepitas de chocolate Bolsa 150...,S/ 19.90 un,plaza_vea,GALLINA EVISCERADA,2024-12-03 22:36:56.004627
Caja 50g,Galletas COLOMBINA Mini Arbolito Caja 50g,S/ 5.79 un,plaza_vea,GALLINA EVISCERADA,2024-12-03 22:36:56.004627
Bandeja 1un,Kit Decora tu Galleta,S/ 22.90 un,plaza_vea,GALLINA EVISCERADA,2024-12-03 22:36:56.004627
Sachet 100g,Ají de Gallina PROVENZAL Sachet 100g,S/ 8.99 un,plaza_vea,GALLINA EVISCERADA,2024-12-03 22:36:56.004627
Caja 430g,Mezcla para Galletas de Avena LA IBÉRICA con C...,S/ 19.10 un,plaza_vea,GALLINA EVISCERADA,2024-12-03 22:36:56.004627
Caja 255g,Galletas COLOMBINA Momentos Caja 255g,S/ 21.10 un,plaza_vea,GALLINA EVISCERADA,2024-12-03 22:36:56.004627
Lata 80g,Galleta NOEL Lata 80g,S/ 17.50 un,plaza_vea,GALLINA EVISCERADA,2024-12-03 22:36:56.004627
Caja 4un,Empanada de Ají de Gallina BELL'S Caja 4un,S/ 18.90 un,plaza_vea,GALLINA EVISCERADA,2024-12-03 22:36:56.004627
Bolsa 185g,Galletas SANTIVERI Choco Chips Bolsa 185g,S/ 19.90 un,plaza_vea,GALLINA EVISCERADA,2024-12-03 22:36:56.004627
Bolsa 100g,Ají de Gallina PERÚ PRIDE Bolsa 100g,S/ 6.39 un,plaza_vea,GALLINA EVISCERADA,2024-12-03 22:36:56.004627
Caja 200g,Galletas COLOMBINA Tren Navideño Caja 200g,S/ 14.40 un,plaza_vea,GALLINA EVISCERADA,2024-12-03 22:36:56.004627
Caja 150g,Galletas COLOMBINA Pesebre Navidad Caja 150g,S/ 11.59 un,plaza_vea,GALLINA EVISCERADA,2024-12-03 22:36:56.004627
Pote 473ml,Helado HÄAGEN DAZS de Crema y Galletas Pote 47...,S/ 29.90 un,plaza_vea,GALLINA EVISCERADA,2024-12-03 22:36:56.004627
Paquete 100g,Galletas BAUDUCCO Chocolate Paquete 100g,S/ 6.60 un,plaza_vea,GALLINA EVISCERADA,2024-12-03 22:36:56.004627
,City Súper Estación Gasolina HOT WHEELS,S/ 179.90 un,plaza_vea,GALLINA EVISCERADA,2024-12-03 22:36:56.004627
,Bandeja para Galletas ILKO 43x29cm,S/ 26.90 un,plaza_vea,GALLINA EVISCERADA,2024-12-03 22:36:56.004627
,Gallina Porta Huevos de Metal VIVA HOME,S/ 24.90 un,plaza_vea,GALLINA EVISCERADA,2024-12-03 22:36:56.004627
Paquete 1un,Galleta Decorada 1un,S/ 3.50 un,plaza_vea,GALLINA EVISCERADA,2024-12-03 22:36:56.004627
Pack 2un,Huevos de Gallina LA CALERA Pardos Jumbo Bande...,S/ 17.49 un,plaza_vea,GALLINA EVISCERADA,2024-12-03 22:36:56.004627
Caja 400g,Galletas Surtiditas ARCOR Tren Navideño Caja 4...,S/ 15.90 un,plaza_vea,GALLINA EVISCERADA,2024-12-03 22:36:56.004627
,Babero DR. BROWN´S con Mordedor Ballenas,S/ 59.90 un,plaza_vea,GALLINA EVISCERADA,2024-12-03 22:36:56.004627
Lata 200g,Galletas COLOMBINA Cookies Lata 200g,S/ 26.89 un,plaza_vea,GALLINA EVISCERADA,2024-12-03 22:36:56.004627
,Piscina Inflable INTEX Ballena c/ Spray,S/ 269 un,plaza_vea,GALLINA EVISCERADA,2024-12-03 22:36:56.004627
,Ballena Silly Spout BRIGHT STARTS,S/ 179 un,plaza_vea,GALLINA EVISCERADA,2024-12-03 22:36:56.004627
,Peluche Galleta de Jengibre 25cm Colección Roj...,S/ 23.96 un,plaza_vea,GALLINA EVISCERADA,2024-12-03 22:36:56.004627
,"Motobomba Werken 0.98L a Gasolina XG10 1"" 1 HP",S/ 429 un,plaza_vea,GALLINA EVISCERADA,2024-12-03 22:36:56.004627
,Galonera para gasolina 10 litros,S/ 68 un,plaza_vea,GALLINA EVISCERADA,2024-12-03 22:36:56.004627
,"Motobomba Werken 3.61L a Gasolina WB30 3"" 6.5 ...",S/ 699 un,plaza_vea,GALLINA EVISCERADA,2024-12-03 22:36:56.004627
,Puerta contraplacada hdf liso natural Alina 40...,S/ 129.90 un,plaza_vea,GALLINA EVISCERADA,2024-12-03 22:36:56.004627
,Puerta contraplacada hdf liso natural Alina 40...,S/ 114.90 un,plaza_vea,GALLINA EVISCERADA,2024-12-03 22:36:56.004627
,Puerta contraplacada hdf liso natural Alina 40...,S/ 94.90 un,plaza_vea,GALLINA EVISCERADA,2024-12-03 22:36:56.004627
,"Motobomba Werken 3.61L a Gasolina WB20 2"" 6.5 ...",S/ 599 un,plaza_vea,GALLINA EVISCERADA,2024-12-03 22:36:56.004627
,Bordeadora a Gasolina GST43 43 cc Black & Deck...,"S/ 1,086 un",plaza_vea,GALLINA EVISCERADA,2024-12-03 22:36:56.004627
,Inflable Ballena Jumbo 157x94 cm,S/ 49.90 un,plaza_vea,GALLINA EVISCERADA,2024-12-03 22:36:56.004627
,Desbrozadora a gasolina 1.2 HP 33 cc,S/ 859 un,plaza_vea,GALLINA EVISCERADA,2024-12-03 22:36:56.004627
,Lámpara Colgante Galia E27 Dorado 5 luces,S/ 204.90 un,plaza_vea,GALLINA EVISCERADA,2024-12-03 22:36:56.004627
,Lámpara Colgante Galia E27 Dorado 3 luces,S/ 154.90 un,plaza_vea,GALLINA EVISCERADA,2024-12-03 22:36:56.004627
,Cocina Empotrable Klimatic Alina 5 Hornillas a...,S/ 899 un,plaza_vea,GALLINA EVISCERADA,2024-12-03 22:36:56.004627
,Colgante de árbol Galleta Jengibre 8cm Colecci...,S/ 7.96 un,plaza_vea,GALLINA EVISCERADA,2024-12-03 22:36:56.004627
,Generador a Gasolina Werken FG2500 2500W,S/ 999 un,plaza_vea,GALLINA EVISCERADA,2024-12-03 22:36:56.004627
,Galonera para gasolina 5 litros,S/ 62.70 un,plaza_vea,GALLINA EVISCERADA,2024-12-03 22:36:56.004627
,Galonera para gasolina 20 litros,S/ 125 un,plaza_vea,GALLINA EVISCERADA,2024-12-03 22:36:56.004627
,Colgante Galia negro y dorado E27,S/ 383 un,plaza_vea,GALLINA EVISCERADA,2024-12-03 22:36:56.004627
Presentación 1 caja rinde 2.23 m²,Baldosa PVC Autoadhesivo Galena Gris 30x60cm 2...,S/ 45.56 x m²,plaza_vea,GALLINA EVISCERADA,2024-12-03 22:36:56.004627
,"Motobomba Werken 3.61L a Gasolina QGZ80-30 3"" ...","S/ 1,299 un",plaza_vea,GALLINA EVISCERADA,2024-12-03 22:36:56.004627
,"Motobomba Werken 3.61L a Gasolina QGZ50-32 2"" ...","S/ 1,369 un",plaza_vea,GALLINA EVISCERADA,2024-12-03 22:36:56.004627
,Puerta hdf lisa blanca Alina 40x75x2.07,S/ 119.90 un,plaza_vea,GALLINA EVISCERADA,2024-12-03 22:36:56.004627
,Puerta hdf lisa blanca Alina 40x85x2.07,S/ 139.90 un,plaza_vea,GALLINA EVISCERADA,2024-12-03 22:36:56.004627
,Puerta hdf lisa blanca Alina 40x65x2.07,S/ 99.90 un,plaza_vea,GALLINA EVISCERADA,2024-12-03 22:36:56.004627
,Generador gasolina 2T 800W Werken,S/ 465 un,plaza_vea,GALLINA EVISCERADA,2024-12-03 22:36:56.004627
,Muñeco Fisher Price Ballena Hora Del Baño,S/ 99.90 un,plaza_vea,GALLINA EVISCERADA,2024-12-03 22:36:56.004627
,Vestido Largo Mujer Paulina Sin Mangas Hypnoti...,S/ 99.95 un,plaza_vea,GALLINA EVISCERADA,2024-12-03 22:36:56.004627
,Pista De Autos Hot Whels City Súper Estación D...,S/ 129.90 un,plaza_vea,GALLINA EVISCERADA,2024-12-03 22:36:56.004627
,Espejo Galena Rectangular,S/ 479.90 un,plaza_vea,GALLINA EVISCERADA,2024-12-03 22:36:56.004627
,Ballena Inflable Montable Intex 3+,S/ 129 un,plaza_vea,GALLINA EVISCERADA,2024-12-03 22:36:56.004627
,Piscina Inflable Intex Ballena Con Spray,S/ 269 un,plaza_vea,GALLINA EVISCERADA,2024-12-03 22:36:56.004627
,Flotador Para Montar Bestway Ballena 1.93M,S/ 119.90 un,plaza_vea,GALLINA EVISCERADA,2024-12-03 22:36:56.004627
,Juego de Mesa 3D Top Toys Gallito Ciego,S/ 90 un,plaza_vea,GALLINA EVISCERADA,2024-12-03 22:36:56.004627
,Vaso Con Cañita Y Asas Para Niño Dr Browns 10 ...,S/ 48.95 un,plaza_vea,GALLINA EVISCERADA,2024-12-03 22:36:56.004627
,Peluche Warmies Gallina Grande,S/ 149.90 un,plaza_vea,GALLINA EVISCERADA,2024-12-03 22:36:56.004627
,Babero Para Bebe Dr Browns Bandana Con Mordedo...,S/ 59.95 un,plaza_vea,GALLINA EVISCERADA,2024-12-03 22:36:56.004627
,Juguete Ballena Silly Spout,S/ 107.40 un,plaza_vea,GALLINA EVISCERADA,2024-12-03 22:36:56.004627
,Medias Largas Diseño Patas de Gallina/Pollo - ...,S/ 14.50 un,plaza_vea,GALLINA EVISCERADA,2024-12-03 22:36:56.004627
,Gallina Hervidora Eléctrica de Huevos,S/ 19 un,plaza_vea,GALLINA EVISCERADA,2024-12-03 22:36:56.004627
,Hervidor De Huevos Duros Al Vapor Eléctrico 7H,S/ 27 un,plaza_vea,GALLINA EVISCERADA,2024-12-03 22:36:56.004627
,Gallina Hervidora Eléctrica de Huevos,S/ 23.90 un,plaza_vea,GALLINA EVISCERADA,2024-12-03 22:36:56.004627
,Medias Largas Diseño Patas de Gallina/Pollo - ...,S/ 14.50 un,plaza_vea,GALLINA EVISCERADA,2024-12-03 22:36:56.004627
,Medias Largas Diseño Patas de Gallina/Pollo - ...,S/ 14.50 un,plaza_vea,GALLINA EVISCERADA,2024-12-03 22:36:56.004627
,Mandala Manta para Playa Salina de Algodón,S/ 54.90 un,plaza_vea,GALLINA EVISCERADA,2024-12-03 22:36:56.004627
,"Galletas Crocantes de Leche, Espinaca y Zanaho...",S/ 24.90 un,plaza_vea,GALLINA EVISCERADA,2024-12-03 22:36:56.004627
,Bandeja Antiadherente Para Galletas 38.5 X 27....,S/ 27.90 un,plaza_vea,GALLINA EVISCERADA,2024-12-03 22:36:56.004627
,Hervidor de Huevos al Vapor en Forma de Gallin...,S/ 30 un,plaza_vea,GALLINA EVISCERADA,2024-12-03 22:36:56.004627
,Canguro para Bebé Ergonómico Ballena 3 en 1 RS,S/ 99 un,plaza_vea,GALLINA EVISCERADA,2024-12-03 22:36:56.004627
,Canguro Para Bebé Ergonómico ALEBAO Ballena 3 ...,S/ 119 un,plaza_vea,GALLINA EVISCERADA,2024-12-03 22:36:56.004627
,Máquina Eléctrica para Hacer Galletas 7 Diseño...,S/ 55.90 un,plaza_vea,GALLINA EVISCERADA,2024-12-03 22:36:56.004627
,Canguro para Bebé Ergonómico Ballena 3 en 1,S/ 99 un,plaza_vea,GALLINA EVISCERADA,2024-12-03 22:36:56.004627
,Molde Cortador de Galletas en Forma de Corazón...,S/ 19 un,plaza_vea,GALLINA EVISCERADA,2024-12-03 22:36:56.004627
,Waflera y Maquina para hacer Galletas con Dise...,S/ 56.90 un,plaza_vea,GALLINA EVISCERADA,2024-12-03 22:36:56.004627
,Cama Ballena Desarmable Madera Capirona 1 Plaz...,S/ 299.99 un,plaza_vea,GALLINA EVISCERADA,2024-12-03 22:36:56.004627
,Juego de Sala Vintage 3 2 Altina Marrón,"S/ 1,899 un",plaza_vea,GALLINA EVISCERADA,2024-12-03 22:36:56.004627
,Juego de Sala Vintage 3 2 1 Altina Turquesa,"S/ 2,049 un",plaza_vea,GALLINA EVISCERADA,2024-12-03 22:36:56.004627
,Cojín Navideño Greeta Otto Casa Galletas Azul,S/ 39.90 un,plaza_vea,GALLINA EVISCERADA,2024-12-03 22:36:56.004627
,Short BBLUBS Ballenas,S/ 39 un,plaza_vea,GALLINA EVISCERADA,2024-12-03 22:36:56.004627
,Sandalias Mujer FOOTLOOSE FLK-002 (35-39) SALI...,S/ 135.20 un,plaza_vea,GALLINA EVISCERADA,2024-12-03 22:36:56.004627
,Babero bandana con mordedor de aprendisaje Bal...,S/ 59.90 un,plaza_vea,GALLINA EVISCERADA,2024-12-03 22:36:56.004627
,Mesa de Tv Moderna Mallini Ventitas Perú Negro...,S/ 599.90 un,plaza_vea,GALLINA EVISCERADA,2024-12-03 22:36:56.004627
,Motobomba autocebante a gasolina 7 HP salida 2...,S/ 765.90 un,plaza_vea,GALLINA EVISCERADA,2024-12-03 22:36:56.004627
,Balanza Digital Kawai Ballena,S/ 39.90 un,plaza_vea,GALLINA EVISCERADA,2024-12-03 22:36:56.004627
,Kit Prensador para Galletas,S/ 39.90 un,plaza_vea,GALLINA EVISCERADA,2024-12-03 22:36:56.004627
,Motobomba A Gasolina 4 Motor Wp40 8hp Modelo: ...,"S/ 1,199 un",plaza_vea,GALLINA EVISCERADA,2024-12-03 22:36:56.004627
,Tapete de Puerta Modelo Ballena Marca Divi,S/ 28 un,plaza_vea,GALLINA EVISCERADA,2024-12-03 22:36:56.004627
,Hidrolavadora a gasolina 214 Bar Ingco GHPW200...,"S/ 1,679.90 un",plaza_vea,GALLINA EVISCERADA,2024-12-03 22:36:56.004627
,Hervidor de Huevos al vapor en Forma de Gallin...,S/ 39 un,plaza_vea,GALLINA EVISCERADA,2024-12-03 22:36:56.004627
,Generador 2500W a Gasolina 4 Tiempos RONIX RH-...,"S/ 1,390 un",plaza_vea,GALLINA EVISCERADA,2024-12-03 22:36:56.004627
,Motosierra 2300W a Gasolina Profesional RONIX ...,S/ 730 un,plaza_vea,GALLINA EVISCERADA,2024-12-03 22:36:56.004627
,Generador 3200W a Gasolina 4 Tiempos RONIX RH-...,"S/ 1,590 un",plaza_vea,GALLINA EVISCERADA,2024-12-03 22:36:56.004627
,Funko Pop Disney - Minnie Mouse Galleta Navide...,S/ 69 un,plaza_vea,GALLINA EVISCERADA,2024-12-03 22:36:56.004627
,Funko Pop Disney - Mickey Mouse Galleta Navide...,S/ 69 un,plaza_vea,GALLINA EVISCERADA,2024-12-03 22:36:56.004627
,Gallina Multifuncional Animal Intelligence Bo...,S/ 99.99 un,plaza_vea,GALLINA EVISCERADA,2024-12-03 22:36:56.004627
,Arnes Andador Caminador para Bebe Diseño Balle...,S/ 67.90 un,plaza_vea,GALLINA EVISCERADA,2024-12-03 22:36:56.004627
,Rotomartillo 1000W 12J a Gasolina 10.5KG SDS M...,"S/ 1,620 un",plaza_vea,GALLINA EVISCERADA,2024-12-03 22:36:56.004627
,Juguete estimulación temprana motricidad fina ...,S/ 69 un,plaza_vea,GALLINA EVISCERADA,2024-12-03 22:36:56.004627
,Martillo Demoledor 1500W 55J 16.4KG a Gasolina...,"S/ 1,720 un",plaza_vea,GALLINA EVISCERADA,2024-12-03 22:36:56.004627
,Juguete estimulación temprana motricidad fina ...,S/ 49 un,plaza_vea,GALLINA EVISCERADA,2024-12-03 22:36:56.004627
,Juguete estimulación temprana motricidad fina ...,S/ 69 un,plaza_vea,GALLINA EVISCERADA,2024-12-03 22:36:56.004627
,Juguete estimulación temprana motricidad fina ...,S/ 49 un,plaza_vea,GALLINA EVISCERADA,2024-12-03 22:36:56.004627
,Canguro Para Bebé Ergonómico Ballena 3 en 1 Az...,S/ 125 un,plaza_vea,GALLINA EVISCERADA,2024-12-03 22:36:56.004627
,Canguro Para Bebé Ergonómico Ballena 3 en 1 Ve...,S/ 125 un,plaza_vea,GALLINA EVISCERADA,2024-12-03 22:36:56.004627
,Canguro Para Bebé Ergonómico Ballena 3 en 1 Gu...,S/ 125 un,plaza_vea,GALLINA EVISCERADA,2024-12-03 22:36:56.004627
,Canguro Para Bebé Ergonómico Ballena 3 en 1 Ro...,S/ 125 un,plaza_vea,GALLINA EVISCERADA,2024-12-03 22:36:56.004627
,Canguro Para Bebé Ergonómico Ballena 3 en 1 Az...,S/ 107 un,plaza_vea,GALLINA EVISCERADA,2024-12-03 22:36:56.004627
,Canguro Para Bebé Ergonómico Ballena 3 en 1 Ve...,S/ 107 un,plaza_vea,GALLINA EVISCERADA,2024-12-03 22:36:56.004627
,Canguro Para Bebé Ergonómico Ballena 3 en 1 Gu...,S/ 107 un,plaza_vea,GALLINA EVISCERADA,2024-12-03 22:36:56.004627
,Canguro Para Bebé Ergonómico Ballena 3 en 1 Ro...,S/ 107 un,plaza_vea,GALLINA EVISCERADA,2024-12-03 22:36:56.004627
,Jabocillera de Ballena en Tono Rosado Y+Post-i...,S/ 46.90 un,plaza_vea,GALLINA EVISCERADA,2024-12-03 22:36:56.004627
,Portajabon Moderna en Forma de Ballena de Colo...,S/ 26.90 un,plaza_vea,GALLINA EVISCERADA,2024-12-03 22:36:56.004627
,CAMAROTE DMUEBLES MALLIN 1 PLAZA CON ROPERO Y ...,"S/ 4,599 un",plaza_vea,GALLINA EVISCERADA,2024-12-03 22:36:56.004627
,Arnes Andador Caminador Diseno Ballena en Verd...,S/ 67.90 un,plaza_vea,GALLINA EVISCERADA,2024-12-03 22:36:56.004627
,Hervidor de Huevos Automatico Gallina hasta 7 ...,S/ 29 un,plaza_vea,GALLINA EVISCERADA,2024-12-03 22:36:56.004627
,Canguro Para Bebé Ergonómico Modelo Ballena 3 ...,S/ 109 un,plaza_vea,GALLINA EVISCERADA,2024-12-03 22:36:56.004627
,Canguro Para Bebé Ergonómico Modelo Ballena 3 ...,S/ 109 un,plaza_vea,GALLINA EVISCERADA,2024-12-03 22:36:56.004627
,Canguro Para Bebé Ergonómico Modelo Ballena 3 ...,S/ 109 un,plaza_vea,GALLINA EVISCERADA,2024-12-03 22:36:56.004627
,Bandeja Antiadherente Para Galletas 43 X 29 X ...,S/ 34.90 un,plaza_vea,GALLINA EVISCERADA,2024-12-03 22:36:56.004627
,Bandeja Antiadherente Para Galletas 47 X 31 X ...,S/ 39.90 un,plaza_vea,GALLINA EVISCERADA,2024-12-03 22:36:56.004627
,Rascador con Apariencia de Ballena Color Marro...,S/ 49.90 un,plaza_vea,GALLINA EVISCERADA,2024-12-03 22:36:56.004627
,Farol Grifo De Gasolina Del Papa Noel La119 Fl...,S/ 225.90 un,plaza_vea,GALLINA EVISCERADA,2024-12-03 22:36:56.004627
,Jabonera Divertida en Forma de Ballena de Colo...,S/ 26.90 un,plaza_vea,GALLINA EVISCERADA,2024-12-03 22:36:56.004627
,Arnes Andador Caminador para Bebe Diseno Balle...,S/ 67.90 un,plaza_vea,GALLINA EVISCERADA,2024-12-03 22:36:56.004627
,Jabonera Minimalista en Forma de Ballena de Co...,S/ 26.90 un,plaza_vea,GALLINA EVISCERADA,2024-12-03 22:36:56.004627
,Horno de Juguete HAPE con Bandeja y Galletas M...,S/ 199 un,plaza_vea,GALLINA EVISCERADA,2024-12-03 22:36:56.004627
,Bandeja De Silicona poner Galletas 36 X 25.5 C...,S/ 30.90 un,plaza_vea,GALLINA EVISCERADA,2024-12-03 22:36:56.004627
,Generador a Gasolina 7500w con Arrancador Elec...,"S/ 3,499.90 un",plaza_vea,GALLINA EVISCERADA,2024-12-03 22:36:56.004627
,Generador a Gasolina 3500w Industrial Total TP...,"S/ 1,689.90 un",plaza_vea,GALLINA EVISCERADA,2024-12-03 22:36:56.004627
,Generador a Gasolina 1200w Total TP115005,S/ 929.90 un,plaza_vea,GALLINA EVISCERADA,2024-12-03 22:36:56.004627
,Molde De Galletas Flor Set 6 Und. PRESS Classi...,S/ 11.90 un,plaza_vea,GALLINA EVISCERADA,2024-12-03 22:36:56.004627
,Molde De Galletas Set 6 Und. PRESS Classic,S/ 7.90 un,plaza_vea,GALLINA EVISCERADA,2024-12-03 22:36:56.004627
,Juguete En Forma De Ballena Para Mascotas,S/ 9.90 un,plaza_vea,GALLINA EVISCERADA,2024-12-03 22:36:56.004627
,Soporte De Galletas Para Vasos,S/ 9.90 un,plaza_vea,GALLINA EVISCERADA,2024-12-03 22:36:56.004627
,Arnes Andador Caminador para Bebe Diseño Balle...,S/ 67.90 un,plaza_vea,GALLINA EVISCERADA,2024-12-03 22:36:56.004627
,"Motobomba Berklin a gasolina 3x3"" 6.5 HP",S/ 958.80 un,plaza_vea,GALLINA EVISCERADA,2024-12-03 22:36:56.004627
,"Motobomba Berklin a gasolina 2x2"" 6.5HP",S/ 765.90 un,plaza_vea,GALLINA EVISCERADA,2024-12-03 22:36:56.004627
,Juguete de Goma en Forma de Galleta Oreo Color...,S/ 29.90 un,plaza_vea,GALLINA EVISCERADA,2024-12-03 22:36:56.004627
,Figuras para Ensamblar de Galletas en Multicol...,S/ 43.90 un,plaza_vea,GALLINA EVISCERADA,2024-12-03 22:36:56.004627
,Juguete en Forma de Galleta Color Negro Y+Pape...,S/ 39.90 un,plaza_vea,GALLINA EVISCERADA,2024-12-03 22:36:56.004627
,Mesa de TV Flotante 45” Paulina Ventitas Home ...,S/ 399 un,plaza_vea,GALLINA EVISCERADA,2024-12-03 22:36:56.004627
,Juguete Divertido de Forma de Galleta Color Ne...,S/ 33.90 un,plaza_vea,GALLINA EVISCERADA,2024-12-03 22:36:56.004627
,Figuras de Galletas en Tono Multicolor Y+Papel...,S/ 49.90 un,plaza_vea,GALLINA EVISCERADA,2024-12-03 22:36:56.004627
,Flotador Compacto en Modelo de Ballena de Colo...,S/ 73.90 un,plaza_vea,GALLINA EVISCERADA,2024-12-03 22:36:56.004627
,Flotador Ballena Bebe de PVC en Color Celeste,S/ 93.90 un,plaza_vea,GALLINA EVISCERADA,2024-12-03 22:36:56.004627
,Motoguadaña Desmalezadora a Gasolina 2 Hp Tota...,S/ 589.90 un,plaza_vea,GALLINA EVISCERADA,2024-12-03 22:36:56.004627
,Máquina de Prensa para Decorar Galletas,S/ 39.90 un,plaza_vea,GALLINA EVISCERADA,2024-12-03 22:36:56.004627
,Cartera Alina Cooperativa Artesanal Mochicas,S/ 111 un,plaza_vea,GALLINA EVISCERADA,2024-12-03 22:36:56.004627
,Flotador con Diseño de Ballena de Vinilo Azul ...,S/ 89.90 un,plaza_vea,GALLINA EVISCERADA,2024-12-03 22:36:56.004627
,Flotador con Diseño de Ballena de PVC Celeste ...,S/ 99.90 un,plaza_vea,GALLINA EVISCERADA,2024-12-03 22:36:56.004627
,Flotador Ballena Vinilo Ligero en Azul Y+Papel...,S/ 93.90 un,plaza_vea,GALLINA EVISCERADA,2024-12-03 22:36:56.004627
,Flotador Ballena PVC Ligero en Celeste Y+Papel...,S/ 103.90 un,plaza_vea,GALLINA EVISCERADA,2024-12-03 22:36:56.004627
,Flotador Ballena de Vinilo Resistente Color Az...,S/ 83.90 un,plaza_vea,GALLINA EVISCERADA,2024-12-03 22:36:56.004627
,Arnes Andador Caminador para Bebe Diseño Balle...,S/ 67.90 un,plaza_vea,GALLINA EVISCERADA,2024-12-03 22:36:56.004627
,Set de 3 Moldes de Galleta,S/ 19.90 un,plaza_vea,GALLINA EVISCERADA,2024-12-03 22:36:56.004627
,"Motobomba a Gasolina 2"" x 2"" 7HP Total TP3202",S/ 739.90 un,plaza_vea,GALLINA EVISCERADA,2024-12-03 22:36:56.004627
,Lámpara de Noche Decorativa 3D Ballena,S/ 700 un,plaza_vea,GALLINA EVISCERADA,2024-12-03 22:36:56.004627
,Molde Cortador de Galletas Cuadrado 5 Piezas,S/ 19 un,plaza_vea,GALLINA EVISCERADA,2024-12-03 22:36:56.004627
,Molde Cortador de Galletas en Forma de Flor 5 ...,S/ 19 un,plaza_vea,GALLINA EVISCERADA,2024-12-03 22:36:56.004627
,Molde Cortador de Galletas en Forma de Estrell...,S/ 19 un,plaza_vea,GALLINA EVISCERADA,2024-12-03 22:36:56.004627
,Molde Cortador de Galletas en Forma Redonda x4...,S/ 19 un,plaza_vea,GALLINA EVISCERADA,2024-12-03 22:36:56.004627
,Batería de Litio Polímero Securitytronix St Al...,S/ 399 un,plaza_vea,GALLINA EVISCERADA,2024-12-03 22:36:56.004627
,Motosierra A gasolina Roman RN5800,S/ 720 un,plaza_vea,GALLINA EVISCERADA,2024-12-03 22:36:56.004627
,"Motosierra a Gasolina 18"" 46cc Industrial Tota...",S/ 519.90 un,plaza_vea,GALLINA EVISCERADA,2024-12-03 22:36:56.004627
,"Motosierra a Gasolina 18"" 46cc Industrial Tota...",S/ 509.90 un,plaza_vea,GALLINA EVISCERADA,2024-12-03 22:36:56.004627
,HERVIDOR ELÉCTRICO PARA 7 HUEVOS GALLINA,S/ 29.90 un,plaza_vea,GALLINA EVISCERADA,2024-12-03 22:36:56.004627
,Canguro Para Bebé Ergonómico ALEBAO Ballena 3 ...,S/ 125 un,plaza_vea,GALLINA EVISCERADA,2024-12-03 22:36:56.004627
,Canguro Para Bebé Ergonómico ALEBAO Ballena 3 ...,S/ 125 un,plaza_vea,GALLINA EVISCERADA,2024-12-03 22:36:56.004627
,Cómoda Moderna Alvina 6 Cajones Negro R&R MUEB...,S/ 939 un,plaza_vea,GALLINA EVISCERADA,2024-12-03 22:36:56.004627
,Cómoda Moderna Alvina 6 Cajones Blanco R&R MUE...,S/ 939 un,plaza_vea,GALLINA EVISCERADA,2024-12-03 22:36:56.004627
,Juguete de Aprendizaje Gallina Inteligente,S/ 59 un,plaza_vea,GALLINA EVISCERADA,2024-12-03 22:36:56.004627
,Motobomba A Gasolina 3 3x3 6.5hp Modelo: Wi-30...,S/ 749 un,plaza_vea,GALLINA EVISCERADA,2024-12-03 22:36:56.004627
,Don Fermin Galletas Especiales Grain Free 50 G...,S/ 7 un,plaza_vea,GALLINA EVISCERADA,2024-12-03 22:36:56.004627
,Don Fermin Galletas Especiales Grain Free 120 ...,S/ 23 un,plaza_vea,GALLINA EVISCERADA,2024-12-03 22:36:56.004627
,Peru Peluches Gallina Pintadita Azul,S/ 79 un,plaza_vea,GALLINA EVISCERADA,2024-12-03 22:36:56.004627
,Motobomba A Gasolina 2 pulgadas 5.5hp,S/ 780 un,plaza_vea,GALLINA EVISCERADA,2024-12-03 22:36:56.004627
,Pet Krewe Unleash The Parade Disfraz de Monstr...,S/ 139.90 un,plaza_vea,GALLINA EVISCERADA,2024-12-03 22:36:56.004627
,Flotador inflable ballena bebe Intex,S/ 79 un,plaza_vea,GALLINA EVISCERADA,2024-12-03 22:36:56.004627
,Medias Taloneras Diseño Patas de Gallina/Pollo...,S/ 14.50 un,plaza_vea,GALLINA EVISCERADA,2024-12-03 22:36:56.004627
,Pet Krewe Unleash The Parade Disfraz de Monstr...,S/ 199.90 un,plaza_vea,GALLINA EVISCERADA,2024-12-03 22:36:56.004627
,Peru Peluches Gallito Corococo,S/ 89 un,plaza_vea,GALLINA EVISCERADA,2024-12-03 22:36:56.004627
,Medias Tobilleras Patas de Pollo Gallina Pack ...,S/ 35.90 un,plaza_vea,GALLINA EVISCERADA,2024-12-03 22:36:56.004627
,Medias Taloneras Diseño Patas de Gallina/Pollo...,S/ 14.50 un,plaza_vea,GALLINA EVISCERADA,2024-12-03 22:36:56.004627
,Medias Taloneras Diseño Patas de Gallina/Pollo...,S/ 14.50 un,plaza_vea,GALLINA EVISCERADA,2024-12-03 22:36:56.004627
,Zapatilla Sport Para Mujer Alina,S/ 119 un,plaza_vea,GALLINA EVISCERADA,2024-12-03 22:36:56.004627
,Generador Monofásico a gasolina 1000w Redbo CL...,S/ 709.90 un,plaza_vea,GALLINA EVISCERADA,2024-12-03 22:36:56.004627
