unit,description,price,website,search_term,scrape_timestamp
,Silla diseño Ali Tela Arena Bonno,S/ 418 un,plaza_vea,ARVEJA SECA PARTIDA,2024-12-04 00:27:04.770357
,Silla diseño Buhl Ii Arena Bonno,S/ 373 un,plaza_vea,ARVEJA SECA PARTIDA,2024-12-04 00:27:04.770357
,Silla de Diseño Decorativa Brent Polipropileno...,S/ 345 un,plaza_vea,ARVEJA SECA PARTIDA,2024-12-04 00:27:04.770357
,Banco Bar Berlin 75cm Arena,S/ 587 un,plaza_vea,ARVEJA SECA PARTIDA,2024-12-04 00:27:04.770357
,Maceta Cerámica Zaia 20 Arena Latte,S/ 42.21 un,plaza_vea,ARVEJA SECA PARTIDA,2024-12-04 00:27:04.770357
,Maceta Cerámica Zaia 15 Arena Latte,S/ 26.01 un,plaza_vea,ARVEJA SECA PARTIDA,2024-12-04 00:27:04.770357
,Tomacorriente Duplex Universal Lt Arena Matix ...,S/ 60 un,plaza_vea,ARVEJA SECA PARTIDA,2024-12-04 00:27:04.770357
,Cojín de terraza Arena 40x40,S/ 34.90 un,plaza_vea,ARVEJA SECA PARTIDA,2024-12-04 00:27:04.770357
,Sombrilla lateral Avea Giro 360° 290cm Blanco,S/ 599 un,plaza_vea,ARVEJA SECA PARTIDA,2024-12-04 00:27:04.770357
,Cojín decorativo 45x45cm Honeycumb Arena,S/ 36.80 un,plaza_vea,ARVEJA SECA PARTIDA,2024-12-04 00:27:04.770357
,Silla Teca con brazos tipo Madera,S/ 59.90 un,plaza_vea,ARVEJA SECA PARTIDA,2024-12-04 00:27:04.770357
,Tanque de agua Arena Promart 600 litros + Kit ...,S/ 499 un,plaza_vea,ARVEJA SECA PARTIDA,2024-12-04 00:27:04.770357
,Tanque de agua Arena Promart 2700 litros + Kit...,"S/ 1,199 un",plaza_vea,ARVEJA SECA PARTIDA,2024-12-04 00:27:04.770357
,"Serrucho de Poda para Pertiga 14"" Bahco",S/ 95.90 un,plaza_vea,ARVEJA SECA PARTIDA,2024-12-04 00:27:04.770357
,Reja de seguridad de MDF plegable para bebés y...,S/ 149.90 un,plaza_vea,ARVEJA SECA PARTIDA,2024-12-04 00:27:04.770357
,Piscina Inflable Cuadrada Bestway Sea Captain ...,S/ 199.90 un,plaza_vea,ARVEJA SECA PARTIDA,2024-12-04 00:27:04.770357
,Arena sanitaria envase de 4kg Limón,S/ 59.80 un,plaza_vea,ARVEJA SECA PARTIDA,2024-12-04 00:27:04.770357
,Arena sanitaria envase de 4kg Lavanda,S/ 59.80 un,plaza_vea,ARVEJA SECA PARTIDA,2024-12-04 00:27:04.770357
,Tijera de altura pertiga Combisystem,S/ 474.90 un,plaza_vea,ARVEJA SECA PARTIDA,2024-12-04 00:27:04.770357
,Shampoo cosmético Avena 70ml,S/ 47.50 un,plaza_vea,ARVEJA SECA PARTIDA,2024-12-04 00:27:04.770357
,Aspirador en húmedo y seco Gas LSFC Bosch,"S/ 2,839 un",plaza_vea,ARVEJA SECA PARTIDA,2024-12-04 00:27:04.770357
,Urinario Seco Urrea,S/ 933 un,plaza_vea,ARVEJA SECA PARTIDA,2024-12-04 00:27:04.770357
,"Hoja Montaraz para madera seca y verde 30""",S/ 13.90 un,plaza_vea,ARVEJA SECA PARTIDA,2024-12-04 00:27:04.770357
,Lavatorio Sena Blanco Urrea,S/ 229 un,plaza_vea,ARVEJA SECA PARTIDA,2024-12-04 00:27:04.770357
,Pedestal Sena Blanco Urrea,S/ 110.50 un,plaza_vea,ARVEJA SECA PARTIDA,2024-12-04 00:27:04.770357
,Interruptor T/riel 2x50a,S/ 32.90 un,plaza_vea,ARVEJA SECA PARTIDA,2024-12-04 00:27:04.770357
,Interruptor T/riel 3x32a,S/ 69.90 un,plaza_vea,ARVEJA SECA PARTIDA,2024-12-04 00:27:04.770357
,Interruptor T/riel 3x25a,S/ 69.90 un,plaza_vea,ARVEJA SECA PARTIDA,2024-12-04 00:27:04.770357
,Interruptor T/riel 3x50a,S/ 69.90 un,plaza_vea,ARVEJA SECA PARTIDA,2024-12-04 00:27:04.770357
,Interruptor T/riel 2x25a,S/ 25.90 un,plaza_vea,ARVEJA SECA PARTIDA,2024-12-04 00:27:04.770357
,Interruptor T/riel 2x32a,S/ 25.90 un,plaza_vea,ARVEJA SECA PARTIDA,2024-12-04 00:27:04.770357
,Interruptor T/riel 2x63a,S/ 34.90 un,plaza_vea,ARVEJA SECA PARTIDA,2024-12-04 00:27:04.770357
,Interruptor T/riel 3x63a,S/ 69.90 un,plaza_vea,ARVEJA SECA PARTIDA,2024-12-04 00:27:04.770357
,Interruptor T/riel 3x20a,S/ 69.90 un,plaza_vea,ARVEJA SECA PARTIDA,2024-12-04 00:27:04.770357
,Interruptor T/riel 3x80a,S/ 259.90 un,plaza_vea,ARVEJA SECA PARTIDA,2024-12-04 00:27:04.770357
,Interruptor T/riel 3x15a,S/ 69.90 un,plaza_vea,ARVEJA SECA PARTIDA,2024-12-04 00:27:04.770357
,Interruptor T/riel 3x100a,S/ 259.90 un,plaza_vea,ARVEJA SECA PARTIDA,2024-12-04 00:27:04.770357
,Interruptor diferencial 2x25a,S/ 79 un,plaza_vea,ARVEJA SECA PARTIDA,2024-12-04 00:27:04.770357
,Interruptor diferencial 2x40a,S/ 118.90 un,plaza_vea,ARVEJA SECA PARTIDA,2024-12-04 00:27:04.770357
,Maceta con Plato Inca Arena 28.5x24cm,S/ 49.90 un,plaza_vea,ARVEJA SECA PARTIDA,2024-12-04 00:27:04.770357
,Maceta con Plato Egipcio Arena 31x29cm,S/ 69.90 un,plaza_vea,ARVEJA SECA PARTIDA,2024-12-04 00:27:04.770357
,Lubricante cadena seco Bike WD-40,S/ 19.90 un,plaza_vea,ARVEJA SECA PARTIDA,2024-12-04 00:27:04.770357
,Lubricante seco de grafito 5.50oz,S/ 45.90 un,plaza_vea,ARVEJA SECA PARTIDA,2024-12-04 00:27:04.770357
,Lubricante en seco 9.30oz,S/ 50.90 un,plaza_vea,ARVEJA SECA PARTIDA,2024-12-04 00:27:04.770357
Presentación 1 caja rinde 2.22 m²,Piso Laminado AC3 8 mm Teca Caja:2.22 m2,S/ 42.75 x m²,plaza_vea,ARVEJA SECA PARTIDA,2024-12-04 00:27:04.770357
,Moldura reductora Teca 12x44x900mm,S/ 23.50 un,plaza_vea,ARVEJA SECA PARTIDA,2024-12-04 00:27:04.770357
,Moldura T Tecal 10x44x900mm,S/ 23.50 un,plaza_vea,ARVEJA SECA PARTIDA,2024-12-04 00:27:04.770357
,"Abrazadera de 1/2"" con oreja de 2mm x4 unidade...",S/ 2.80 un,plaza_vea,ARVEJA SECA PARTIDA,2024-12-04 00:27:04.770357
,"Abrazadera de 3"" con 2 orejas de 2mm",S/ 4.10 un,plaza_vea,ARVEJA SECA PARTIDA,2024-12-04 00:27:04.770357
,"Abrazadera de 3"" con oreja de 2mm",S/ 4 un,plaza_vea,ARVEJA SECA PARTIDA,2024-12-04 00:27:04.770357
,"Abrazadera de 1/4"" con oreja de 0.9mm",S/ 0.60 un,plaza_vea,ARVEJA SECA PARTIDA,2024-12-04 00:27:04.770357
,"Abrazadera de 1 1/4"" con 2 orejas de 2mm",S/ 1.70 un,plaza_vea,ARVEJA SECA PARTIDA,2024-12-04 00:27:04.770357
,"Abrazadera de 3/4"" con oreja de.2mm x4 unidade...",S/ 3.40 un,plaza_vea,ARVEJA SECA PARTIDA,2024-12-04 00:27:04.770357
,"Abrazadera de 3/4"" con 2 orejas de 2mm",S/ 1.10 un,plaza_vea,ARVEJA SECA PARTIDA,2024-12-04 00:27:04.770357
,"Abrazadera de 1 1/2"" con oreja de 2mm",S/ 2.20 un,plaza_vea,ARVEJA SECA PARTIDA,2024-12-04 00:27:04.770357
,"Abrazadera de 1"" con 2 orejas de 2 mm",S/ 1.30 un,plaza_vea,ARVEJA SECA PARTIDA,2024-12-04 00:27:04.770357
,"Abrazadera de 1/2"" con oreja de 2mm",S/ 0.90 un,plaza_vea,ARVEJA SECA PARTIDA,2024-12-04 00:27:04.770357
,"Abrazadera de 2 1/2"" con oreja de 2mm",S/ 3.40 un,plaza_vea,ARVEJA SECA PARTIDA,2024-12-04 00:27:04.770357
,"Abrazadera de 2"" con oreja de 2mm",S/ 2.40 un,plaza_vea,ARVEJA SECA PARTIDA,2024-12-04 00:27:04.770357
,"Abrazadera de 2 1/2"" con 2 orejas de 2mm",S/ 3.50 un,plaza_vea,ARVEJA SECA PARTIDA,2024-12-04 00:27:04.770357
,"Abrazadera de 1 1/2"" con 2 orejas de 2mm",S/ 2.30 un,plaza_vea,ARVEJA SECA PARTIDA,2024-12-04 00:27:04.770357
,"Abrazadera de 2"" con 2 orejas de 2mm",S/ 2.90 un,plaza_vea,ARVEJA SECA PARTIDA,2024-12-04 00:27:04.770357
,"Abrazadera de 1/2"" con 2 orejas de 2mm",S/ 0.90 un,plaza_vea,ARVEJA SECA PARTIDA,2024-12-04 00:27:04.770357
,"Abrazadera de 3/4"" con oreja de 2mm",S/ 1 un,plaza_vea,ARVEJA SECA PARTIDA,2024-12-04 00:27:04.770357
,"Abrazadera de 4"" con 2 orejas de 2mm",S/ 4 un,plaza_vea,ARVEJA SECA PARTIDA,2024-12-04 00:27:04.770357
,Reja de seguridad a presión para bebés y masco...,S/ 290 un,plaza_vea,ARVEJA SECA PARTIDA,2024-12-04 00:27:04.770357
,Tablero de Melamina Duratex 7x8D 18mm Arena,S/ 183.70 un,plaza_vea,ARVEJA SECA PARTIDA,2024-12-04 00:27:04.770357
,Llave de Lavatorio Machimpex Arena Baja Plata ...,S/ 13.90 un,plaza_vea,ARVEJA SECA PARTIDA,2024-12-04 00:27:04.770357
,Aplique Arena 40 cm E27,S/ 39.90 un,plaza_vea,ARVEJA SECA PARTIDA,2024-12-04 00:27:04.770357
,Puntas con parada de profundidad PZ2 x2u,S/ 13.90 un,plaza_vea,ARVEJA SECA PARTIDA,2024-12-04 00:27:04.770357
,Tanque Deca Omega Plus Blanco,S/ 100 un,plaza_vea,ARVEJA SECA PARTIDA,2024-12-04 00:27:04.770357
,Placa ciega Arena Bticino,S/ 11.13 un,plaza_vea,ARVEJA SECA PARTIDA,2024-12-04 00:27:04.770357
,Tomacorriente universal doble Arena Bticino,S/ 24.90 un,plaza_vea,ARVEJA SECA PARTIDA,2024-12-04 00:27:04.770357
,Interruptor doble Arena Bticino,S/ 31.50 un,plaza_vea,ARVEJA SECA PARTIDA,2024-12-04 00:27:04.770357
,Toma schuko 16A Arena Bticino,S/ 34 un,plaza_vea,ARVEJA SECA PARTIDA,2024-12-04 00:27:04.770357
,Tomacorriente duplex universal LT Arena Bticin...,S/ 41.90 un,plaza_vea,ARVEJA SECA PARTIDA,2024-12-04 00:27:04.770357
,Toma teléfono RJ11 Arena Bticino,S/ 3.90 un,plaza_vea,ARVEJA SECA PARTIDA,2024-12-04 00:27:04.770357
,Tomacorriente universal simple Arena Bticino,S/ 23.70 un,plaza_vea,ARVEJA SECA PARTIDA,2024-12-04 00:27:04.770357
,Toma RJ-45 CAT6 Arena Bticino,S/ 33.60 un,plaza_vea,ARVEJA SECA PARTIDA,2024-12-04 00:27:04.770357
,Lija al agua y al seco A275 228x280MM P80,S/ 2.70 un,plaza_vea,ARVEJA SECA PARTIDA,2024-12-04 00:27:04.770357
,Lija al agua y al seco A275 228x280mm P150,S/ 2.40 un,plaza_vea,ARVEJA SECA PARTIDA,2024-12-04 00:27:04.770357
,Adorno niño con oveja 21cm,S/ 15.92 un,plaza_vea,ARVEJA SECA PARTIDA,2024-12-04 00:27:04.770357
,Juego alicate saca seguro 4 piezas,S/ 61.90 un,plaza_vea,ARVEJA SECA PARTIDA,2024-12-04 00:27:04.770357
,Protector para oreja EY23-1Y,S/ 22.90 un,plaza_vea,ARVEJA SECA PARTIDA,2024-12-04 00:27:04.770357
,Protector para oreja EI23-1R,S/ 23.90 un,plaza_vea,ARVEJA SECA PARTIDA,2024-12-04 00:27:04.770357
,Disco diamantado para pulir 115mm seco,S/ 45.90 un,plaza_vea,ARVEJA SECA PARTIDA,2024-12-04 00:27:04.770357
,Aceite de Teca Varathane 3.785 litros litros,S/ 351.90 un,plaza_vea,ARVEJA SECA PARTIDA,2024-12-04 00:27:04.770357
,Mesa De Juegos Little Tikes Spinning Seas Wate...,S/ 189 un,plaza_vea,ARVEJA SECA PARTIDA,2024-12-04 00:27:04.770357
,Polo Hombre Ponle Arena Hypnotic,S/ 29.95 un,plaza_vea,ARVEJA SECA PARTIDA,2024-12-04 00:27:04.770357
,Arena Mágina Kinetic Sand Bolsita De 57 Gramos...,S/ 3.46 un,plaza_vea,ARVEJA SECA PARTIDA,2024-12-04 00:27:04.770357
,Playset Cat Excava Y Construye Con 2 Vehiculos...,S/ 77.94 un,plaza_vea,ARVEJA SECA PARTIDA,2024-12-04 00:27:04.770357
,"Mesa De Actividades Para Niños Dolu Arena, Agu...",S/ 79.96 un,plaza_vea,ARVEJA SECA PARTIDA,2024-12-04 00:27:04.770357
,Muneca Barbie Fashionista Surtida Fbr37,S/ 59.90 un,plaza_vea,ARVEJA SECA PARTIDA,2024-12-04 00:27:04.770357
,Playset Cat Excava Y Construye Con 2 Vehiculos...,S/ 47.97 un,plaza_vea,ARVEJA SECA PARTIDA,2024-12-04 00:27:04.770357
,Adorno De Árbol Navidad Blanca Estrella Rejas ...,S/ 8.47 un,plaza_vea,ARVEJA SECA PARTIDA,2024-12-04 00:27:04.770357
,Blusa Hypnotic Mujer Manga Larga Abeja,S/ 69.96 un,plaza_vea,ARVEJA SECA PARTIDA,2024-12-04 00:27:04.770357
,Vestido Largo Amc Mujer Abeja,S/ 149 un,plaza_vea,ARVEJA SECA PARTIDA,2024-12-04 00:27:04.770357
,Blusa Hypnotic Mujer Manga Larga Sea,S/ 79.95 un,plaza_vea,ARVEJA SECA PARTIDA,2024-12-04 00:27:04.770357
,Polo Para Niña Circus Basta Abeja,S/ 14.95 un,plaza_vea,ARVEJA SECA PARTIDA,2024-12-04 00:27:04.770357
,Blusa Para Niña Circus Manga Larga Abeja,S/ 59.95 un,plaza_vea,ARVEJA SECA PARTIDA,2024-12-04 00:27:04.770357
,Ropa De Baño Para Bebé Niña Baby Circus Abeja ...,S/ 59.95 un,plaza_vea,ARVEJA SECA PARTIDA,2024-12-04 00:27:04.770357
,Luminaria Colg Ravena Blanco Rectangular,S/ 425.12 un,plaza_vea,ARVEJA SECA PARTIDA,2024-12-04 00:27:04.770357
,Velas Art Amphora Color Arena Cristal,S/ 100.60 un,plaza_vea,ARVEJA SECA PARTIDA,2024-12-04 00:27:04.770357
,Luminaria Colgante Ravena Blanco Circular,"S/ 2,309.19 un",plaza_vea,ARVEJA SECA PARTIDA,2024-12-04 00:27:04.770357
,Vestido Para Bebe Niña Baby Circus Abeja Fp Ma...,S/ 59.95 un,plaza_vea,ARVEJA SECA PARTIDA,2024-12-04 00:27:04.770357
,Vestido Para Bebe Niña Baby Circus Abeja Fp Ma...,S/ 59.95 un,plaza_vea,ARVEJA SECA PARTIDA,2024-12-04 00:27:04.770357
,Florero Niveles Arena 17cm,S/ 29.97 un,plaza_vea,ARVEJA SECA PARTIDA,2024-12-04 00:27:04.770357
,Blusa Para Bebe Niña Baby Circus Manga Larga A...,S/ 49.95 un,plaza_vea,ARVEJA SECA PARTIDA,2024-12-04 00:27:04.770357
,Blusa Para Teen Niña Zubito Silk Shinny,S/ 49.95 un,plaza_vea,ARVEJA SECA PARTIDA,2024-12-04 00:27:04.770357
,Mini Figura Stitch Surtida 46260,S/ 10.95 un,plaza_vea,ARVEJA SECA PARTIDA,2024-12-04 00:27:04.770357
,Mini Figura Disney Surtida 33300,S/ 10.95 un,plaza_vea,ARVEJA SECA PARTIDA,2024-12-04 00:27:04.770357
,"Maleta Dura Sandor 2.0 24"" Mediana Avena",S/ 649 un,plaza_vea,ARVEJA SECA PARTIDA,2024-12-04 00:27:04.770357
,"Maleta Dura Sandor 2.0 28"" Grande Avena",S/ 749 un,plaza_vea,ARVEJA SECA PARTIDA,2024-12-04 00:27:04.770357
,"Maleta Dura Sandor 2.0 19"" Cabina Avena",S/ 549 un,plaza_vea,ARVEJA SECA PARTIDA,2024-12-04 00:27:04.770357
,Gimnasio Para Bebes Fisher Price Piano Patada ...,S/ 289.90 un,plaza_vea,ARVEJA SECA PARTIDA,2024-12-04 00:27:04.770357
,Mochila Skip Hop Con Arnes Zoo Abeja,S/ 69.96 un,plaza_vea,ARVEJA SECA PARTIDA,2024-12-04 00:27:04.770357
,Polo Para Niña Circus Pitas Abeja Peach,S/ 9.95 un,plaza_vea,ARVEJA SECA PARTIDA,2024-12-04 00:27:04.770357
,Set De Juego Kinetic Sand Caja De Arena Verde,S/ 79.95 un,plaza_vea,ARVEJA SECA PARTIDA,2024-12-04 00:27:04.770357
,Set De Juego Kinetic Sand Caja De Arena Morado,S/ 79.95 un,plaza_vea,ARVEJA SECA PARTIDA,2024-12-04 00:27:04.770357
,Arena Magica Kinetic Sand Verde,S/ 69.95 un,plaza_vea,ARVEJA SECA PARTIDA,2024-12-04 00:27:04.770357
,Arena Magica Kinetic Sand Morado,S/ 69.95 un,plaza_vea,ARVEJA SECA PARTIDA,2024-12-04 00:27:04.770357
,Arena Magica Kinetic Sand Azul,S/ 69.95 un,plaza_vea,ARVEJA SECA PARTIDA,2024-12-04 00:27:04.770357
,Set De Juego Kinetic Sand Fabrica De Arena,S/ 59.95 un,plaza_vea,ARVEJA SECA PARTIDA,2024-12-04 00:27:04.770357
,Cheeky Hypnotic Print Patitas,S/ 10.97 un,plaza_vea,ARVEJA SECA PARTIDA,2024-12-04 00:27:04.770357
,Juguete Gabbys Dollhouse Orejas De Gato,S/ 29.95 un,plaza_vea,ARVEJA SECA PARTIDA,2024-12-04 00:27:04.770357
,Vaso para Bebé Nuby Easy Sip Celeste con Rojo,S/ 27.95 un,plaza_vea,ARVEJA SECA PARTIDA,2024-12-04 00:27:04.770357
,Vaso para Bebé Nuby 9 Onzas/27Oml 0% Bpa Azul,S/ 27.95 un,plaza_vea,ARVEJA SECA PARTIDA,2024-12-04 00:27:04.770357
,Pista De Juguete Hot Wheels Arena Demolición T...,S/ 109.90 un,plaza_vea,ARVEJA SECA PARTIDA,2024-12-04 00:27:04.770357
,Orejas Mágicas Musicales Gabbys Dollhouse,S/ 69.90 un,plaza_vea,ARVEJA SECA PARTIDA,2024-12-04 00:27:04.770357
,Set De Chupones Dr Browns Tigre Y Abejas 6-18M,S/ 48.95 un,plaza_vea,ARVEJA SECA PARTIDA,2024-12-04 00:27:04.770357
,Set De Chupones Dr Browns Conejo Y Abejas 0-6M,S/ 48.95 un,plaza_vea,ARVEJA SECA PARTIDA,2024-12-04 00:27:04.770357
,Pista De Juguete Hot Wheels Arena De Demolició...,S/ 109.90 un,plaza_vea,ARVEJA SECA PARTIDA,2024-12-04 00:27:04.770357
,Pista De Juguete Hot Wheels Arena De Demolició...,S/ 109.90 un,plaza_vea,ARVEJA SECA PARTIDA,2024-12-04 00:27:04.770357
,Pista De Juguete Hot Wheels Arena Demolición D...,S/ 109.90 un,plaza_vea,ARVEJA SECA PARTIDA,2024-12-04 00:27:04.770357
,Peluche Warmies Oveja Grande,S/ 149.90 un,plaza_vea,ARVEJA SECA PARTIDA,2024-12-04 00:27:04.770357
,Juego De Comedor Ravena 6 Sillas,"S/ 4,799 un",plaza_vea,ARVEJA SECA PARTIDA,2024-12-04 00:27:04.770357
,Depiladora en húmedo y seco Philips BRE710/00,S/ 449.90 un,plaza_vea,ARVEJA SECA PARTIDA,2024-12-04 00:27:04.770357
,Pista Mounstro Tormenta Arena Teamsterz,S/ 79.90 un,plaza_vea,ARVEJA SECA PARTIDA,2024-12-04 00:27:04.770357
,Juguete Gatea Y Persigue Abeja,S/ 229 un,plaza_vea,ARVEJA SECA PARTIDA,2024-12-04 00:27:04.770357
,Practipañal Secos - Bolsa 20 UN,S/ 7.50 un,plaza_vea,ARVEJA SECA PARTIDA,2024-12-04 00:27:04.770357
,Protector Solar La Roche Posay Anthelios UVMun...,S/ 114.90 un,plaza_vea,ARVEJA SECA PARTIDA,2024-12-04 00:27:04.770357
,Protector Solar La Roche Posay Anthelios UVMun...,S/ 114.59 un,plaza_vea,ARVEJA SECA PARTIDA,2024-12-04 00:27:04.770357
,Protector Solar Facial Eucerin Oil Control Toq...,S/ 99.90 un,plaza_vea,ARVEJA SECA PARTIDA,2024-12-04 00:27:04.770357
,Pañales Adultos Talla M Secos Premium - Bolsa ...,S/ 67.90 un,plaza_vea,ARVEJA SECA PARTIDA,2024-12-04 00:27:04.770357
,Pañales para Adultos Secos Premium Talla G - B...,S/ 67.90 un,plaza_vea,ARVEJA SECA PARTIDA,2024-12-04 00:27:04.770357
,Pañales para Adultos Secos Active Talla M - Bo...,S/ 49.50 un,plaza_vea,ARVEJA SECA PARTIDA,2024-12-04 00:27:04.770357
,Pañales para Adultos Secos Pants Talla G - Bol...,S/ 29.90 un,plaza_vea,ARVEJA SECA PARTIDA,2024-12-04 00:27:04.770357
,Juego de 76 piezas machos y tarrajas saca rosc...,S/ 186.90 un,plaza_vea,ARVEJA SECA PARTIDA,2024-12-04 00:27:04.770357
,Manga de Brazo Proteccion UV Seda Protectora N...,S/ 29 un,plaza_vea,ARVEJA SECA PARTIDA,2024-12-04 00:27:04.770357
,Cera de abeja para madera 100G,S/ 33.90 un,plaza_vea,ARVEJA SECA PARTIDA,2024-12-04 00:27:04.770357
,Bravery Alimento Seco Gato Adulto Esterilizado...,S/ 96.90 un,plaza_vea,ARVEJA SECA PARTIDA,2024-12-04 00:27:04.770357
,Plancha Alisadora Remington Silk Profesional S...,S/ 209 un,plaza_vea,ARVEJA SECA PARTIDA,2024-12-04 00:27:04.770357
,Jabón de Glicerina Avena - Barra 100 G,S/ 2.50 un,plaza_vea,ARVEJA SECA PARTIDA,2024-12-04 00:27:04.770357
,Seguro Para Bicicletas/ Moto/Carriolas/Rejas S...,S/ 19 un,plaza_vea,ARVEJA SECA PARTIDA,2024-12-04 00:27:04.770357
,Protector de Cama Secos Extra Grande,S/ 18.90 un,plaza_vea,ARVEJA SECA PARTIDA,2024-12-04 00:27:04.770357
,Toallas Húmedas para Adultos Secos - Bolsa 64 ...,S/ 15.90 un,plaza_vea,ARVEJA SECA PARTIDA,2024-12-04 00:27:04.770357
,Pañales para Adultos Secos Active Talla G - Bo...,S/ 54.90 un,plaza_vea,ARVEJA SECA PARTIDA,2024-12-04 00:27:04.770357
,Cera de abeja para madera 200G,S/ 65 un,plaza_vea,ARVEJA SECA PARTIDA,2024-12-04 00:27:04.770357
,Pañales para Adultos Secos Pants Talla M - Bol...,S/ 29.90 un,plaza_vea,ARVEJA SECA PARTIDA,2024-12-04 00:27:04.770357
,Protector Solar Niños Eucerin Sensitive Protec...,S/ 126 un,plaza_vea,ARVEJA SECA PARTIDA,2024-12-04 00:27:04.770357
,Loción Hidratante CeraVe para Piel Seca - Fras...,S/ 99.60 un,plaza_vea,ARVEJA SECA PARTIDA,2024-12-04 00:27:04.770357
,Termómetro Ambiental Cuenta Ovejas,S/ 49 un,plaza_vea,ARVEJA SECA PARTIDA,2024-12-04 00:27:04.770357
,Cera de abeja para madera Bees Max 510G,S/ 135 un,plaza_vea,ARVEJA SECA PARTIDA,2024-12-04 00:27:04.770357
,Malla de Seguridad Plegable Portátil y Resiste...,S/ 69.90 un,plaza_vea,ARVEJA SECA PARTIDA,2024-12-04 00:27:04.770357
,Maquina Parrila Para Yoguis Hot Dogs y Chorizo...,S/ 69.90 un,plaza_vea,ARVEJA SECA PARTIDA,2024-12-04 00:27:04.770357
,Smart Card Reader Lector Usb Dni Electronico B...,S/ 39.99 un,plaza_vea,ARVEJA SECA PARTIDA,2024-12-04 00:27:04.770357
,Malla de Seguridad Plegable Portátil y Resiste...,S/ 89.90 un,plaza_vea,ARVEJA SECA PARTIDA,2024-12-04 00:27:04.770357
,Arena para Gatos Granulada con Carbón Activado...,S/ 10 un,plaza_vea,ARVEJA SECA PARTIDA,2024-12-04 00:27:04.770357
,Protector Solar Corporal Eucerin Crema-Gel Toq...,S/ 114.70 un,plaza_vea,ARVEJA SECA PARTIDA,2024-12-04 00:27:04.770357
,Plancha Alisadora Remington Wet2Straight S27A ...,S/ 155 un,plaza_vea,ARVEJA SECA PARTIDA,2024-12-04 00:27:04.770357
,"Google Nest Hub (2.ª generación, arena)",S/ 499 un,plaza_vea,ARVEJA SECA PARTIDA,2024-12-04 00:27:04.770357
,Sonic Frontiers Nintendo Switch Euro,S/ 179 un,plaza_vea,ARVEJA SECA PARTIDA,2024-12-04 00:27:04.770357
,Sonic Origins Plus Nintendo Switch Latam,S/ 165 un,plaza_vea,ARVEJA SECA PARTIDA,2024-12-04 00:27:04.770357
,Arena para Gatos Tipo Perlas con Carbón Activa...,S/ 12 un,plaza_vea,ARVEJA SECA PARTIDA,2024-12-04 00:27:04.770357
,Collar para Parejas de Escalera al Cielo Doram...,S/ 49.90 un,plaza_vea,ARVEJA SECA PARTIDA,2024-12-04 00:27:04.770357
,Arena para Gatos Tipo Perlas Aromatizada Manza...,S/ 14 un,plaza_vea,ARVEJA SECA PARTIDA,2024-12-04 00:27:04.770357
,Forever Artic Sea 60 Capsulas,S/ 169 un,plaza_vea,ARVEJA SECA PARTIDA,2024-12-04 00:27:04.770357
,Arena Para Gatos Perlas Bolsa X 20kg - 100% Ab...,S/ 44 un,plaza_vea,ARVEJA SECA PARTIDA,2024-12-04 00:27:04.770357
,Malla de Seguridad Plegable Portátil y Resiste...,S/ 59.90 un,plaza_vea,ARVEJA SECA PARTIDA,2024-12-04 00:27:04.770357
,Shampoo para Perro Hipoalergénico Vetlinex Ave...,S/ 20 un,plaza_vea,ARVEJA SECA PARTIDA,2024-12-04 00:27:04.770357
,Cera de abeja para madera Bees Max 310G,S/ 86 un,plaza_vea,ARVEJA SECA PARTIDA,2024-12-04 00:27:04.770357
,Audifonos Con Cable X2 Pro Con Aislamiento De ...,S/ 53.89 un,plaza_vea,ARVEJA SECA PARTIDA,2024-12-04 00:27:04.770357
,36 Hilo Tubino Colores Surtidas Hilos para Cos...,S/ 79 un,plaza_vea,ARVEJA SECA PARTIDA,2024-12-04 00:27:04.770357
,Pad Mouse Primus 32x27cm Edicion Star Wars Man...,S/ 49.90 un,plaza_vea,ARVEJA SECA PARTIDA,2024-12-04 00:27:04.770357
,Arena PREMIUM para gato aroma Lavanda de 5 Kg ...,S/ 18.90 un,plaza_vea,ARVEJA SECA PARTIDA,2024-12-04 00:27:04.770357
,Juego Sonic Superstars Nintendo Switch Latam,S/ 205 un,plaza_vea,ARVEJA SECA PARTIDA,2024-12-04 00:27:04.770357
,Bravery Alimento Seco Para Gato Adulto Pollo 2...,S/ 93.90 un,plaza_vea,ARVEJA SECA PARTIDA,2024-12-04 00:27:04.770357
,Aspiradora Sopladora para Seco y Húmedo 1200W ...,S/ 472.90 un,plaza_vea,ARVEJA SECA PARTIDA,2024-12-04 00:27:04.770357
,Audifonos Para Computadora Usb Con Cable Cance...,S/ 88 un,plaza_vea,ARVEJA SECA PARTIDA,2024-12-04 00:27:04.770357
,Afeitadora AquaTouch Philips S1223/41 Seco y H...,S/ 199 un,plaza_vea,ARVEJA SECA PARTIDA,2024-12-04 00:27:04.770357
,Dispensador de Cereal y Alimentos Secos,S/ 69.90 un,plaza_vea,ARVEJA SECA PARTIDA,2024-12-04 00:27:04.770357
,Shampoo Seco en Espuma para Perros y Gatos Pet...,S/ 26.90 un,plaza_vea,ARVEJA SECA PARTIDA,2024-12-04 00:27:04.770357
,Pañales para Adultos Secos Clásico Talla G - B...,S/ 23.90 un,plaza_vea,ARVEJA SECA PARTIDA,2024-12-04 00:27:04.770357
,Arena Sanitaria Para Gatos Bolsa X 20kg Granul...,S/ 39 un,plaza_vea,ARVEJA SECA PARTIDA,2024-12-04 00:27:04.770357
,Shampoo Hipoalergénico para Perros y Gatos Fru...,S/ 21.90 un,plaza_vea,ARVEJA SECA PARTIDA,2024-12-04 00:27:04.770357
,Batería Seca Recargable 12V 7A Dimax BAT-12V7A...,S/ 79 un,plaza_vea,ARVEJA SECA PARTIDA,2024-12-04 00:27:04.770357
,Medias Algodón Socks Abeja Rayas negro amarill...,S/ 18.90 un,plaza_vea,ARVEJA SECA PARTIDA,2024-12-04 00:27:04.770357
,Jabón Líquido Mossy Avena - Frasco 500 ML,S/ 5.50 un,plaza_vea,ARVEJA SECA PARTIDA,2024-12-04 00:27:04.770357
,Caja de Arena Smartpet Esfera Talla Única,S/ 99.90 un,plaza_vea,ARVEJA SECA PARTIDA,2024-12-04 00:27:04.770357
,Faja Body Reloj de Arena con Broches Reduce Me...,S/ 79.90 un,plaza_vea,ARVEJA SECA PARTIDA,2024-12-04 00:27:04.770357
,Calefactor Eléctrico para Sauna Seca Modelo SA...,"S/ 3,800 un",plaza_vea,ARVEJA SECA PARTIDA,2024-12-04 00:27:04.770357
,Jean Básico Cintura Dalia para Mujer Parada 11...,S/ 69.90 un,plaza_vea,ARVEJA SECA PARTIDA,2024-12-04 00:27:04.770357
,Depiladora en Humedo y Seco Philips BRE652_00 ...,S/ 654 un,plaza_vea,ARVEJA SECA PARTIDA,2024-12-04 00:27:04.770357
,Pantalon Pitillo Hombre Parada 111 Figo,S/ 119.90 un,plaza_vea,ARVEJA SECA PARTIDA,2024-12-04 00:27:04.770357
,Pack 2 Miel de Abeja La Poderosa 1 Kg,S/ 80 un,plaza_vea,ARVEJA SECA PARTIDA,2024-12-04 00:27:04.770357
,Bravery Alimento Seco Gato Adulto Esterilizado...,S/ 244 un,plaza_vea,ARVEJA SECA PARTIDA,2024-12-04 00:27:04.770357
,Jean Básico Cintura Laly para Mujer Parada 111,S/ 79.90 un,plaza_vea,ARVEJA SECA PARTIDA,2024-12-04 00:27:04.770357
,Cera de abeja para cuero 85G,S/ 36 un,plaza_vea,ARVEJA SECA PARTIDA,2024-12-04 00:27:04.770357
,Maquina RAF Para Hacer Yoguis Parrila Hot Dogs...,S/ 69.90 un,plaza_vea,ARVEJA SECA PARTIDA,2024-12-04 00:27:04.770357
,Crema Corporal Coco y Avena 450Gr y 150Gr,S/ 29.90 un,plaza_vea,ARVEJA SECA PARTIDA,2024-12-04 00:27:04.770357
,Arena De Gato Viva Verde Vida Descomplicada 4K...,S/ 71.90 un,plaza_vea,ARVEJA SECA PARTIDA,2024-12-04 00:27:04.770357
,Shampoo Avena Coloidal y Aloe Vera Naturcien p...,S/ 23.53 un,plaza_vea,ARVEJA SECA PARTIDA,2024-12-04 00:27:04.770357
,Alisadora Babyliss BABNT9564TPE Nano Titanium ...,S/ 349 un,plaza_vea,ARVEJA SECA PARTIDA,2024-12-04 00:27:04.770357
,Jabón de Avena 80g - La Cooper,S/ 15.90 un,plaza_vea,ARVEJA SECA PARTIDA,2024-12-04 00:27:04.770357
,Jean Básico Recto Hombre Richard Parada 111,S/ 89.90 un,plaza_vea,ARVEJA SECA PARTIDA,2024-12-04 00:27:04.770357
,Rasurador Afeitador Depilador Nariz Oreja Ceja...,S/ 12 un,plaza_vea,ARVEJA SECA PARTIDA,2024-12-04 00:27:04.770357
,Loción Hidratante Eucerin pH5 Piel Seca y Sens...,S/ 117.90 un,plaza_vea,ARVEJA SECA PARTIDA,2024-12-04 00:27:04.770357
,Jabón De Avena Dr. Zaidman - Barra 80 G,S/ 3.90 un,plaza_vea,ARVEJA SECA PARTIDA,2024-12-04 00:27:04.770357
,Molino de Café Eléctrico Frutos Secos Condimen...,S/ 49.90 un,plaza_vea,ARVEJA SECA PARTIDA,2024-12-04 00:27:04.770357
,Protector Solar Corporal Spray Eucerin Transpa...,S/ 101.90 un,plaza_vea,ARVEJA SECA PARTIDA,2024-12-04 00:27:04.770357
,Chaleco de Peso Everlast 10 kg de Arena,S/ 72 un,plaza_vea,ARVEJA SECA PARTIDA,2024-12-04 00:27:04.770357
,Fruta Partida Playland Madera Set 7,S/ 108.40 un,plaza_vea,ARVEJA SECA PARTIDA,2024-12-04 00:27:04.770357
,Pack x 2 Waterless Lavado al Seco Wips 1 Galón,S/ 220 un,plaza_vea,ARVEJA SECA PARTIDA,2024-12-04 00:27:04.770357
,Waterless Lavado al Seco Wips 1 Galón + All P...,S/ 220 un,plaza_vea,ARVEJA SECA PARTIDA,2024-12-04 00:27:04.770357
,Vestido BBLUBS Ovejas,S/ 95 un,plaza_vea,ARVEJA SECA PARTIDA,2024-12-04 00:27:04.770357
,Jabón Artesanal Shaya Almendra y Miel - Piel S...,S/ 15 un,plaza_vea,ARVEJA SECA PARTIDA,2024-12-04 00:27:04.770357
,Jabón Artesanal Shaya Avena y Arroz,S/ 15 un,plaza_vea,ARVEJA SECA PARTIDA,2024-12-04 00:27:04.770357
,Jabón Artesanal Shaya Avena,S/ 15 un,plaza_vea,ARVEJA SECA PARTIDA,2024-12-04 00:27:04.770357
,Juguete para Perros Multipet Sea Shammies Cang...,S/ 49.90 un,plaza_vea,ARVEJA SECA PARTIDA,2024-12-04 00:27:04.770357
,Juguete para Perros Multipet Sea Shammies Pez ...,S/ 49.90 un,plaza_vea,ARVEJA SECA PARTIDA,2024-12-04 00:27:04.770357
,Taza My Sign con Diseño Oveja Viajera 11onz,S/ 29 un,plaza_vea,ARVEJA SECA PARTIDA,2024-12-04 00:27:04.770357
,Vincha BBLUBS Arena Beige,S/ 23 un,plaza_vea,ARVEJA SECA PARTIDA,2024-12-04 00:27:04.770357
,Lavado al seco - Waterless 1 GL,S/ 110 un,plaza_vea,ARVEJA SECA PARTIDA,2024-12-04 00:27:04.770357
