unit,description,price,website,search_term,scrape_timestamp
,Desmalezadora Desbrozadora a Gasolina 30cc 1.2...,S/ 439.90 un,plaza_vea,GALLINA EVISCERADA,2024-12-03 22:36:56.004627
,Accesorio de bebe Caminador 2 en 1 Generico Ba...,S/ 90 un,plaza_vea,GALLINA EVISCERADA,2024-12-03 22:36:56.004627
,"Cortadora de Concreto de 18"" a Gasolina 13HP M...","S/ 4,680 un",plaza_vea,GALLINA EVISCERADA,2024-12-03 22:36:56.004627
,Generador Monofásico a Gasolina 2200w Redbo FS...,"S/ 1,309.90 un",plaza_vea,GALLINA EVISCERADA,2024-12-03 22:36:56.004627
,"Motobomba 4"" x 4"" a Gasolina Redbo WP-40","S/ 1,279.90 un",plaza_vea,GALLINA EVISCERADA,2024-12-03 22:36:56.004627
,"Motobomba 3"" x 3"" a Gasolina Redbo WP-30",S/ 694.90 un,plaza_vea,GALLINA EVISCERADA,2024-12-03 22:36:56.004627
,Cortadores de Galletas Molde Reposteria Doble ...,S/ 19.90 un,plaza_vea,GALLINA EVISCERADA,2024-12-03 22:36:56.004627
,Ahoyador de Tierra a Gasolina 1600W Makute EA5...,S/ 739.90 un,plaza_vea,GALLINA EVISCERADA,2024-12-03 22:36:56.004627
,Escritorio para Pared Gaelia Ventitas Home Neg...,S/ 345 un,plaza_vea,GALLINA EVISCERADA,2024-12-03 22:36:56.004627
,Tela Plana Diseño Galletas Jengibre Arbol Bast...,S/ 75 un,plaza_vea,GALLINA EVISCERADA,2024-12-03 22:36:56.004627
,Tela Plana Diseño Galletas Jengibre Arbol Bast...,S/ 75 un,plaza_vea,GALLINA EVISCERADA,2024-12-03 22:36:56.004627
,Tela Plana Diseño Galletas Jengibre Arbol Bast...,S/ 75 un,plaza_vea,GALLINA EVISCERADA,2024-12-03 22:36:56.004627
,Tela Plana Diseño Galleta Jengibre Vestido Cor...,S/ 75 un,plaza_vea,GALLINA EVISCERADA,2024-12-03 22:36:56.004627
,Tela Plana Diseño Galleta Jengibre 110x94cm Jo...,S/ 75 un,plaza_vea,GALLINA EVISCERADA,2024-12-03 22:36:56.004627
,Peluche Llavero BTS Shooky Brown Cookie 1pza,S/ 22 un,plaza_vea,GALLINA EVISCERADA,2024-12-03 22:36:56.004627
,Molde Antiadherente para 06 Muffins Galletas C...,S/ 42.90 un,plaza_vea,GALLINA EVISCERADA,2024-12-03 22:36:56.004627
,Recibidor Cuadrado Alina color Negro TU MESITA,S/ 819.99 un,plaza_vea,GALLINA EVISCERADA,2024-12-03 22:36:56.004627
,Recibidor Cuadrado Alina color Blanco TU MESIT...,S/ 819.99 un,plaza_vea,GALLINA EVISCERADA,2024-12-03 22:36:56.004627
,Vestido Navideño Galleta de Jengibre con Gorro...,S/ 39 un,plaza_vea,GALLINA EVISCERADA,2024-12-03 22:36:56.004627
,Vestido Navideño Galleta de Jengibre con Gorro...,S/ 36 un,plaza_vea,GALLINA EVISCERADA,2024-12-03 22:36:56.004627
,Traje Enterizo Navideño Galleta de Jengibre pa...,S/ 59 un,plaza_vea,GALLINA EVISCERADA,2024-12-03 22:36:56.004627
,Traje Enterizo Navideño Galleta de Jengibre pa...,S/ 55 un,plaza_vea,GALLINA EVISCERADA,2024-12-03 22:36:56.004627
,Traje Enterizo Navideño Galleta de Jengibre pa...,S/ 51 un,plaza_vea,GALLINA EVISCERADA,2024-12-03 22:36:56.004627
,Traje Enterizo Navideño Galleta de Jengibre pa...,S/ 48 un,plaza_vea,GALLINA EVISCERADA,2024-12-03 22:36:56.004627
,Traje Enterizo Navideño Galleta de Jengibre pa...,S/ 44 un,plaza_vea,GALLINA EVISCERADA,2024-12-03 22:36:56.004627
,Juguete Navideño de tela Galleta de Jengibre ...,S/ 33.50 un,plaza_vea,GALLINA EVISCERADA,2024-12-03 22:36:56.004627
,Mochila Fumigadora 25 Litros con motor a gasol...,"S/ 1,129.90 un",plaza_vea,GALLINA EVISCERADA,2024-12-03 22:36:56.004627
,Rejilla Para Enfriar Postres Galletas Reposter...,S/ 26 un,plaza_vea,GALLINA EVISCERADA,2024-12-03 22:36:56.004627
,Sandalias para Mujer FOOTLOOSE FLK-002 PU,S/ 135.20 un,plaza_vea,GALLINA EVISCERADA,2024-12-03 22:36:56.004627
,Sandalias para Mujer FOOTLOOSE FLK-001 PU,S/ 135.20 un,plaza_vea,GALLINA EVISCERADA,2024-12-03 22:36:56.004627
,Molde Antiadherente para 06 Muffins Galletas C...,S/ 12.90 un,plaza_vea,GALLINA EVISCERADA,2024-12-03 22:36:56.004627
,Canguro Para Bebé Ergonómico Ballena 3 en 1,S/ 139 un,plaza_vea,GALLINA EVISCERADA,2024-12-03 22:36:56.004627
,Infusor de Té Modelo Aurela de Ballena,S/ 35 un,plaza_vea,GALLINA EVISCERADA,2024-12-03 22:36:56.004627
,Molde Antiadherente para 06 Muffins Galletas C...,S/ 12.90 un,plaza_vea,GALLINA EVISCERADA,2024-12-03 22:36:56.004627
,Molde Antiadherente para 06 Muffins Galletas C...,S/ 12.90 un,plaza_vea,GALLINA EVISCERADA,2024-12-03 22:36:56.004627
,Molde Antiadherente para 06 Muffins Galletas C...,S/ 12.90 un,plaza_vea,GALLINA EVISCERADA,2024-12-03 22:36:56.004627
,Banquito Porta Macetero de Madera Alpina Cuadr...,S/ 125 un,plaza_vea,GALLINA EVISCERADA,2024-12-03 22:36:56.004627
,Sofa 3 Cuerpos Galia Gris Modelarq,"S/ 2,759 un",plaza_vea,GALLINA EVISCERADA,2024-12-03 22:36:56.004627
,Sofa 3 Cuerpos Galia Beige Modelarq,"S/ 2,979 un",plaza_vea,GALLINA EVISCERADA,2024-12-03 22:36:56.004627
,Sofa 3 Cuerpos Galia Marron Modelarq,"S/ 3,019 un",plaza_vea,GALLINA EVISCERADA,2024-12-03 22:36:56.004627
,Jabonera en Forma de Ballena Porta Jabón Azul,S/ 8.90 un,plaza_vea,GALLINA EVISCERADA,2024-12-03 22:36:56.004627
,Juguete Pelota Dispensadora de Galletas para P...,S/ 20 un,plaza_vea,GALLINA EVISCERADA,2024-12-03 22:36:56.004627
,Llave de Lavatorio Alina St-01,S/ 55 un,plaza_vea,GALLINA EVISCERADA,2024-12-03 22:36:56.004627
,Llave de Lavatorio Alina St-02,S/ 55 un,plaza_vea,GALLINA EVISCERADA,2024-12-03 22:36:56.004627
,Llave de Lavatorio Alina St-03,S/ 55 un,plaza_vea,GALLINA EVISCERADA,2024-12-03 22:36:56.004627
,Librero Alcina DIBA Muebles,S/ 639.99 un,plaza_vea,GALLINA EVISCERADA,2024-12-03 22:36:56.004627
,Dormitorio 2 Plz Alcina Hys,"S/ 2,099 un",plaza_vea,GALLINA EVISCERADA,2024-12-03 22:36:56.004627
,Protector de Cargador Apple 20w -MONSTRUO COME...,S/ 39.90 un,plaza_vea,GALLINA EVISCERADA,2024-12-03 22:36:56.004627
,Maquina Tostadora para Diseñar Galletas Negro,S/ 93 un,plaza_vea,GALLINA EVISCERADA,2024-12-03 22:36:56.004627
,Generador a Gasolina Eléctrico Karcher PCG 3/1...,"S/ 2,499.90 un",plaza_vea,GALLINA EVISCERADA,2024-12-03 22:36:56.004627
,Maquina de Galletas Raf,S/ 148.90 un,plaza_vea,GALLINA EVISCERADA,2024-12-03 22:36:56.004627
,Waflera Tostadora para Galletas Caseras Negro,S/ 119 un,plaza_vea,GALLINA EVISCERADA,2024-12-03 22:36:56.004627
,Maquina Tostadora para Galletas Caseras Negro,S/ 179 un,plaza_vea,GALLINA EVISCERADA,2024-12-03 22:36:56.004627
,Maquina Electrica para Tostara Galletas Negro,S/ 89 un,plaza_vea,GALLINA EVISCERADA,2024-12-03 22:36:56.004627
,Gallina Hervidora Eléctrica de Huevos,S/ 23.90 un,plaza_vea,GALLINA EVISCERADA,2024-12-03 22:36:56.004627
,Galletas Crocantes y Horneadas para Perros tod...,S/ 24.90 un,plaza_vea,GALLINA EVISCERADA,2024-12-03 22:36:56.004627
,Tomatodo Modelo Galleta Portátil Kawai Capacid...,S/ 39.90 un,plaza_vea,GALLINA EVISCERADA,2024-12-03 22:36:56.004627
,Velador Minimalista Dallina Duna/Negro TU MESI...,S/ 325 un,plaza_vea,GALLINA EVISCERADA,2024-12-03 22:36:56.004627
,Juego de Sala Alto Hogar Vintage Altina 3 1 1 ...,"S/ 1,849 un",plaza_vea,GALLINA EVISCERADA,2024-12-03 22:36:56.004627
,Juego de Sala 3 2 Altina Alto Hogar Gris,"S/ 1,799 un",plaza_vea,GALLINA EVISCERADA,2024-12-03 22:36:56.004627
,Juego de Sala Alto Hogar Vintage Altina 3 1 1 ...,"S/ 1,849 un",plaza_vea,GALLINA EVISCERADA,2024-12-03 22:36:56.004627
,Juego de Sala 3 2 1 Altina Alto Hogar Vintage ...,"S/ 1,999 un",plaza_vea,GALLINA EVISCERADA,2024-12-03 22:36:56.004627
,Juego de Sala Alto Hogar Vintage Altina 3 1 1 ...,"S/ 1,849 un",plaza_vea,GALLINA EVISCERADA,2024-12-03 22:36:56.004627
,Juego de Sala 3 2 1 Altina Alto Hogar Vintage ...,"S/ 1,999 un",plaza_vea,GALLINA EVISCERADA,2024-12-03 22:36:56.004627
,Juego de Sala 3 2 1 Altina Alto Hogar Vintage ...,"S/ 1,999 un",plaza_vea,GALLINA EVISCERADA,2024-12-03 22:36:56.004627
,Juego de Sala 3 2 1 Altina Alto Hogar Vintage ...,"S/ 1,999 un",plaza_vea,GALLINA EVISCERADA,2024-12-03 22:36:56.004627
,Juego de Sala 3 2 Altina Alto Hogar Turquesa,"S/ 1,799 un",plaza_vea,GALLINA EVISCERADA,2024-12-03 22:36:56.004627
,Juego de Sala Alto Hogar Vintage Altina 3 1 1 ...,"S/ 1,849 un",plaza_vea,GALLINA EVISCERADA,2024-12-03 22:36:56.004627
,Juego de Sala 3 2 1 Altina Alto Hogar Vintage ...,"S/ 1,999 un",plaza_vea,GALLINA EVISCERADA,2024-12-03 22:36:56.004627
,Juego de Sala 3 2 Altina Alto Hogar Marrón,"S/ 1,799 un",plaza_vea,GALLINA EVISCERADA,2024-12-03 22:36:56.004627
,Juego de Sala 3 2 Altina Alto Hogar Beige,"S/ 1,799 un",plaza_vea,GALLINA EVISCERADA,2024-12-03 22:36:56.004627
,Juego de Sala 3 2 Altina Alto Hogar Negro,"S/ 1,799 un",plaza_vea,GALLINA EVISCERADA,2024-12-03 22:36:56.004627
,Flotador Ballena Divertida,S/ 239.99 un,plaza_vea,GALLINA EVISCERADA,2024-12-03 22:36:56.004627
,Mesa de Centro Halina Negro DIBA Muebles,S/ 409.99 un,plaza_vea,GALLINA EVISCERADA,2024-12-03 22:36:56.004627
,Comoda Galia Blanco DIBA Muebles,S/ 889.99 un,plaza_vea,GALLINA EVISCERADA,2024-12-03 22:36:56.004627
,Polo de Hombre Idakoos The World Revolves Arou...,S/ 59 un,plaza_vea,GALLINA EVISCERADA,2024-12-03 22:36:56.004627
,Polo de Hombre Idakoos Salinas Athletic Appliq...,S/ 59 un,plaza_vea,GALLINA EVISCERADA,2024-12-03 22:36:56.004627
,Polo de Hombre Idakoos Salinas,S/ 59 un,plaza_vea,GALLINA EVISCERADA,2024-12-03 22:36:56.004627
,Maquina Horno Portatil para Hacer Galletas de ...,S/ 59.90 un,plaza_vea,GALLINA EVISCERADA,2024-12-03 22:36:56.004627
,Sofá de 2 cuerpos Albina Home Premium Turquesa,"S/ 2,199 un",plaza_vea,GALLINA EVISCERADA,2024-12-03 22:36:56.004627
,Sofá de 2 cuerpos Albina Home Premium Rosado,"S/ 2,199 un",plaza_vea,GALLINA EVISCERADA,2024-12-03 22:36:56.004627
,Sofá de 2 cuerpos Albina Home Premium Negro,"S/ 2,199 un",plaza_vea,GALLINA EVISCERADA,2024-12-03 22:36:56.004627
,Sofá de 2 cuerpos Albina Home Premium Crema,"S/ 2,199 un",plaza_vea,GALLINA EVISCERADA,2024-12-03 22:36:56.004627
,Sofá de 2 cuerpos Albina Home Premium Celeste,"S/ 2,199 un",plaza_vea,GALLINA EVISCERADA,2024-12-03 22:36:56.004627
,Sofá de 2 cuerpos Albina Home Premium Beige,"S/ 2,199 un",plaza_vea,GALLINA EVISCERADA,2024-12-03 22:36:56.004627
,Sofá de 2 cuerpos Albina Home Premium Azul Rey,"S/ 2,199 un",plaza_vea,GALLINA EVISCERADA,2024-12-03 22:36:56.004627
,Sofá de 2 cuerpos Albina Home Premium Aqua,"S/ 2,199 un",plaza_vea,GALLINA EVISCERADA,2024-12-03 22:36:56.004627
,Hervidor de Huevos para 7 huevos gallinita,S/ 37 un,plaza_vea,GALLINA EVISCERADA,2024-12-03 22:36:56.004627
,Tomatodo Modelo Galleta Portátil Kawai Capacid...,S/ 39.90 un,plaza_vea,GALLINA EVISCERADA,2024-12-03 22:36:56.004627
,Tomatodo Modelo Galleta Portátil Kawai Capacid...,S/ 39.90 un,plaza_vea,GALLINA EVISCERADA,2024-12-03 22:36:56.004627
,Tomatodo Modelo Galleta Portátil Kawai Capacid...,S/ 39.90 un,plaza_vea,GALLINA EVISCERADA,2024-12-03 22:36:56.004627
,Jabonera Ballena Porta Jabón,S/ 7.99 un,plaza_vea,GALLINA EVISCERADA,2024-12-03 22:36:56.004627
,Combo Hervidor de Huevos en Forma de Gallina +...,S/ 48.90 un,plaza_vea,GALLINA EVISCERADA,2024-12-03 22:36:56.004627
,Sandwichera con Placas + Hervidor De 7Huevos g...,S/ 119 un,plaza_vea,GALLINA EVISCERADA,2024-12-03 22:36:56.004627
,Jabonera en Forma de Ballena,S/ 29.90 un,plaza_vea,GALLINA EVISCERADA,2024-12-03 22:36:56.004627
,Jabonera en Forma de Ballena Porta Jabón Rosad...,S/ 8.90 un,plaza_vea,GALLINA EVISCERADA,2024-12-03 22:36:56.004627
,Pañal de Tela Algodón de Bambú Elinfant AI2 Ba...,S/ 39.90 un,plaza_vea,GALLINA EVISCERADA,2024-12-03 22:36:56.004627
,Pañal de Tela Algodón de Bambú Elinfant AI2 Ba...,S/ 39.90 un,plaza_vea,GALLINA EVISCERADA,2024-12-03 22:36:56.004627
,Juguete de Goma para Perros/Gatos Galleta Oreo,S/ 16 un,plaza_vea,GALLINA EVISCERADA,2024-12-03 22:36:56.004627
,Mesa de Tv Moderna Mallini Ventitas Perú Rover...,S/ 599.90 un,plaza_vea,GALLINA EVISCERADA,2024-12-03 22:36:56.004627
,Mesa de Tv Moderna Mallini Ventitas Perú Blanc...,S/ 579.90 un,plaza_vea,GALLINA EVISCERADA,2024-12-03 22:36:56.004627
,Polo de Hombre Idakoos I Love Alina Colorful H...,S/ 59 un,plaza_vea,GALLINA EVISCERADA,2024-12-03 22:36:56.004627
,Polo de Hombre Idakoos I Love Alaina Bicolor H...,S/ 59 un,plaza_vea,GALLINA EVISCERADA,2024-12-03 22:36:56.004627
,Polo para Hombre Idakoos Tallinn Hashtag,S/ 59 un,plaza_vea,GALLINA EVISCERADA,2024-12-03 22:36:56.004627
,Velador Industrial Walina Ventitas Perú Océano...,S/ 599.90 un,plaza_vea,GALLINA EVISCERADA,2024-12-03 22:36:56.004627
,Vestido Navideño Galleta de Jengibre para Perr...,S/ 48 un,plaza_vea,GALLINA EVISCERADA,2024-12-03 22:36:56.004627
,Combo Hervidor de Huevos Forma Gallina + Licua...,S/ 59.90 un,plaza_vea,GALLINA EVISCERADA,2024-12-03 22:36:56.004627
,Flotador Para Montar Ballena Bestway 193cm,S/ 89.90 un,plaza_vea,GALLINA EVISCERADA,2024-12-03 22:36:56.004627
,Warmies Gallina Grande,S/ 149.90 un,plaza_vea,GALLINA EVISCERADA,2024-12-03 22:36:56.004627
,Juguete Pelota Dispensadora de Galletas para P...,S/ 25 un,plaza_vea,GALLINA EVISCERADA,2024-12-03 22:36:56.004627
,Cómoda Moderna Yvie 5 Compartimientos Ventitas...,S/ 799.90 un,plaza_vea,GALLINA EVISCERADA,2024-12-03 22:36:56.004627
,Juguete Apila y Atornilla Gallina Goula,S/ 176 un,plaza_vea,GALLINA EVISCERADA,2024-12-03 22:36:56.004627
,Rompecabezas de Baño Quut Ballenas Q171027,S/ 70 un,plaza_vea,GALLINA EVISCERADA,2024-12-03 22:36:56.004627
,Galletas Proteicas Applied Nutrition 12unid Do...,S/ 139.90 un,plaza_vea,GALLINA EVISCERADA,2024-12-03 22:36:56.004627
,Galletas Proteicas Applied Nutrition 12 unid C...,S/ 139.90 un,plaza_vea,GALLINA EVISCERADA,2024-12-03 22:36:56.004627
,Juguete Pelota Dispensadora de Galletas para P...,S/ 24 un,plaza_vea,GALLINA EVISCERADA,2024-12-03 22:36:56.004627
,Arnés Caminador 2 en 1 Ballena Primeros Pasos ...,S/ 49 un,plaza_vea,GALLINA EVISCERADA,2024-12-03 22:36:56.004627
,Canguro Para Bebé Ergonómico Generico Ballena ...,S/ 99 un,plaza_vea,GALLINA EVISCERADA,2024-12-03 22:36:56.004627
,Canguro Para Bebé Ergonómico Generico Ballena ...,S/ 199 un,plaza_vea,GALLINA EVISCERADA,2024-12-03 22:36:56.004627
,Canguro Para Bebé Ergonómico Ballena 3 en 1 RS,S/ 99 un,plaza_vea,GALLINA EVISCERADA,2024-12-03 22:36:56.004627
,Bloques Educativos Conectores Modelo Galleta,S/ 31.90 un,plaza_vea,GALLINA EVISCERADA,2024-12-03 22:36:56.004627
,Caja Musical Elvis Presley - Cant Help Falling...,S/ 55 un,plaza_vea,GALLINA EVISCERADA,2024-12-03 22:36:56.004627
,Rombecabezas Scratch Ballena x 60 piezas Conto...,S/ 80 un,plaza_vea,GALLINA EVISCERADA,2024-12-03 22:36:56.004627
,Rombecabezas mini Scratch Ballenas x 31 piezas...,S/ 45 un,plaza_vea,GALLINA EVISCERADA,2024-12-03 22:36:56.004627
,Tajador Westmark de Queso Slicer Gallant,S/ 69.90 un,plaza_vea,GALLINA EVISCERADA,2024-12-03 22:36:56.004627
,Moldes de Galletas Westmark Para Borde de Taza,S/ 49.90 un,plaza_vea,GALLINA EVISCERADA,2024-12-03 22:36:56.004627
,Set de Moldes Westmark Para Galletas de Pascua...,S/ 49.90 un,plaza_vea,GALLINA EVISCERADA,2024-12-03 22:36:56.004627
,Set de Moldes Westmark para Galletas de Animal...,S/ 49.90 un,plaza_vea,GALLINA EVISCERADA,2024-12-03 22:36:56.004627
,Arnés Caminador 2 en 1 Primeros Pasos Guinda G...,S/ 49 un,plaza_vea,GALLINA EVISCERADA,2024-12-03 22:36:56.004627
,Arnés Caminador 2 en 1 Primeros Pasos Generico...,S/ 49 un,plaza_vea,GALLINA EVISCERADA,2024-12-03 22:36:56.004627
,Juego de Mesa Gallito Ciego Stretch Strong Mon...,S/ 90 un,plaza_vea,GALLINA EVISCERADA,2024-12-03 22:36:56.004627
,Fumigador con motor a gasolina 2T 25L TC5343 T...,S/ 986.90 un,plaza_vea,GALLINA EVISCERADA,2024-12-03 22:36:56.004627
,Juego de Sala Vintage 3 2 1 Altina Alto Hogar,"S/ 2,049 un",plaza_vea,GALLINA EVISCERADA,2024-12-03 22:36:56.004627
,Sofá Altina 3 Cuerpos Alto Hogar,"S/ 1,450 un",plaza_vea,GALLINA EVISCERADA,2024-12-03 22:36:56.004627
,Juego de Sala Alto Hogar Altina 3 1 1,"S/ 1,899 un",plaza_vea,GALLINA EVISCERADA,2024-12-03 22:36:56.004627
,Mochila Klip Xtreme Gallant Para Laptop 14 Pre...,S/ 159 un,plaza_vea,GALLINA EVISCERADA,2024-12-03 22:36:56.004627
,Mochila Klip Xtreme Gallant Para Laptop 14 Pre...,S/ 169 un,plaza_vea,GALLINA EVISCERADA,2024-12-03 22:36:56.004627
,Arnés Caminador 2 en 1 Primeros Pasos Turquesa...,S/ 49 un,plaza_vea,GALLINA EVISCERADA,2024-12-03 22:36:56.004627
,Flotador Intex Inflable Ballena Orca,S/ 89 un,plaza_vea,GALLINA EVISCERADA,2024-12-03 22:36:56.004627
,Biberón Boca Ancha Ninet Sésamo Monstruo Come-...,S/ 24.20 un,plaza_vea,GALLINA EVISCERADA,2024-12-03 22:36:56.004627
,Biberón Ninet Sésamo Monstruo Come-Galletas Az...,S/ 24 un,plaza_vea,GALLINA EVISCERADA,2024-12-03 22:36:56.004627
,Hervidor Gallina de Huevos,S/ 24.90 un,plaza_vea,GALLINA EVISCERADA,2024-12-03 22:36:56.004627
,Flotador Intex Inflable Ballena Orca,S/ 99 un,plaza_vea,GALLINA EVISCERADA,2024-12-03 22:36:56.004627
,Pijama BBLUBS Ballenas Rosadas M/L,S/ 85 un,plaza_vea,GALLINA EVISCERADA,2024-12-03 22:36:56.004627
,Pijama BBLUBS Ballenas Azules M/L,S/ 85 un,plaza_vea,GALLINA EVISCERADA,2024-12-03 22:36:56.004627
,Pijama BBLUBS Blanco Ballenas M/L,S/ 85 un,plaza_vea,GALLINA EVISCERADA,2024-12-03 22:36:56.004627
,Vestido BBLUBS Ballenas,S/ 95 un,plaza_vea,GALLINA EVISCERADA,2024-12-03 22:36:56.004627
,Babero BBLUBS Rosa Ballenas,S/ 25 un,plaza_vea,GALLINA EVISCERADA,2024-12-03 22:36:56.004627
,Bolsa de Silicona para Todo Tipo de Masa como ...,S/ 14.90 un,plaza_vea,GALLINA EVISCERADA,2024-12-03 22:36:56.004627
,Canguro para Bebé Ergonómico Ballena 3 en 1 CL,S/ 99 un,plaza_vea,GALLINA EVISCERADA,2024-12-03 22:36:56.004627
,Canguro para Bebé Ergonómico Ballena 3 en 1 RJ,S/ 99 un,plaza_vea,GALLINA EVISCERADA,2024-12-03 22:36:56.004627
,Kit de Cepillo para Cabello Condor mas Peine G...,S/ 20.90 un,plaza_vea,GALLINA EVISCERADA,2024-12-03 22:36:56.004627
,Kit de Cepillo para Cabello Condor mas Peine G...,S/ 20.90 un,plaza_vea,GALLINA EVISCERADA,2024-12-03 22:36:56.004627
,Dispensador de Galletas para Gatos,S/ 34.30 un,plaza_vea,GALLINA EVISCERADA,2024-12-03 22:36:56.004627
,Set de 18 cortadores Wilton de Galletas,S/ 47 un,plaza_vea,GALLINA EVISCERADA,2024-12-03 22:36:56.004627
,Mega Espatula para Galletas Wilton Rojo,S/ 32 un,plaza_vea,GALLINA EVISCERADA,2024-12-03 22:36:56.004627
,Pantalón BBLUBS Galletas,S/ 45 un,plaza_vea,GALLINA EVISCERADA,2024-12-03 22:36:56.004627
,Hervidor de Huevos Eléctrico Gallina,S/ 27 un,plaza_vea,GALLINA EVISCERADA,2024-12-03 22:36:56.004627
,Mini Hervidor de Huevos en Forma de Gallina,S/ 65.90 un,plaza_vea,GALLINA EVISCERADA,2024-12-03 22:36:56.004627
,Hervidor Eléctrico para 7 Huevos en Forma de G...,S/ 69.90 un,plaza_vea,GALLINA EVISCERADA,2024-12-03 22:36:56.004627
,Gallina Hervidor Automatica Pollo Hierve Huevo...,S/ 26 un,plaza_vea,GALLINA EVISCERADA,2024-12-03 22:36:56.004627
,Sofá Altina 3 Cuerpos Gris,"S/ 1,450 un",plaza_vea,GALLINA EVISCERADA,2024-12-03 22:36:56.004627
,Hervidor De Huevos Duros Al Vapor Eléctrico 7H,S/ 27 un,plaza_vea,GALLINA EVISCERADA,2024-12-03 22:36:56.004627
,Títere Gallina Beleduc 40084 de Tela,S/ 60 un,plaza_vea,GALLINA EVISCERADA,2024-12-03 22:36:56.004627
