unit,description,price,website,search_term,scrape_timestamp
Botella 750ml,Vino Tinto VIÑA VIEJA Gran Borgoña Semi Seco B...,S/ 21.90 un,plaza_vea,ARVEJA SECA PARTIDA,2024-12-04 00:27:04.770357
Paquete 6un,Bandas Depilatorias Corporales DEPILÉ Piel Sec...,S/ 20.60 un,plaza_vea,ARVEJA SECA PARTIDA,2024-12-04 00:27:04.770357
Bolsa 8Kg,Alimento Seco para Perros DOGUI Cachorros 8kg,S/ 68.50 un,plaza_vea,ARVEJA SECA PARTIDA,2024-12-04 00:27:04.770357
Bolsa 170g,Chía Avena GRANO DE ORO Hojuelas Precocidas Bo...,S/ 2.90 un,plaza_vea,ARVEJA SECA PARTIDA,2024-12-04 00:27:04.770357
Paquete 38un,Pañales para Bebé BABYSEC Súper Premium XXG Pa...,S/ 50.90 un,plaza_vea,ARVEJA SECA PARTIDA,2024-12-04 00:27:04.770357
Bandeja 750ml,Espumante PANAKA Semi Seco Botella 750ml,S/ 10.90 un,plaza_vea,ARVEJA SECA PARTIDA,2024-12-04 00:27:04.770357
Bolsa 80g,Harina de Avena BELL'S Sabor a Fresa Bolsa 80g,S/ 1.20 un,plaza_vea,ARVEJA SECA PARTIDA,2024-12-04 00:27:04.770357
Frasco 400ml,Jabon Liquido AROMASENSE Avena Frasco 400ml,S/ 14.50 un,plaza_vea,ARVEJA SECA PARTIDA,2024-12-04 00:27:04.770357
,Pizarra CLASS&WORK Borrado en Seco DDM,S/ 14.90 un,plaza_vea,ARVEJA SECA PARTIDA,2024-12-04 00:27:04.770357
Lata 425g,Arvejas FRUTO DE ORO Lata 425g,S/ 5.90 un,plaza_vea,ARVEJA SECA PARTIDA,2024-12-04 00:27:04.770357
Bolsa 13g,Hongos Secos TOÑA Bolsa 13g,S/ 3.40 un,plaza_vea,ARVEJA SECA PARTIDA,2024-12-04 00:27:04.770357
Frasco 295ml,Crema Corporal CETAPHIL Pro Piel Seca Frasco 2...,S/ 105 un,plaza_vea,ARVEJA SECA PARTIDA,2024-12-04 00:27:04.770357
Paquete 8un,Toallas Femeninas Seca ALWAYS Talla M Paquete ...,S/ 7.90 un,plaza_vea,ARVEJA SECA PARTIDA,2024-12-04 00:27:04.770357
Botella 750ml,Vino Blanco E. COPELLO Moscato Semi Seco Botel...,S/ 14.90 un,plaza_vea,ARVEJA SECA PARTIDA,2024-12-04 00:27:04.770357
Presentación 0.55 kg aprox.,Queso Paria con Orégano EL ARTESANO,S/ 38.45,plaza_vea,ARVEJA SECA PARTIDA,2024-12-04 00:27:04.770357
,Crema Corporal NIVEA Soft Milk (Piel Seca) - F...,S/ 36.90 un,plaza_vea,ARVEJA SECA PARTIDA,2024-12-04 00:27:04.770357
Caja 400g,Galletas Surtidas COLOMBINA Navidad Caja 400g,S/ 16.30 un,plaza_vea,ARVEJA SECA PARTIDA,2024-12-04 00:27:04.770357
Presentación 0.55 kg aprox.,Queso Paria EL ARTESANO,S/ 38.45,plaza_vea,ARVEJA SECA PARTIDA,2024-12-04 00:27:04.770357
,Crema Corporal NIVEA Milk Nutritiva (Piel Extr...,S/ 23.90 un,plaza_vea,ARVEJA SECA PARTIDA,2024-12-04 00:27:04.770357
Caja 20un,Caja Curitas Transpiel Surtidas 20un,S/ 8.90 un,plaza_vea,ARVEJA SECA PARTIDA,2024-12-04 00:27:04.770357
Paquete 68un,Pañales para Bebé BABYSEC Premium M Paquete 68...,S/ 50.90 un,plaza_vea,ARVEJA SECA PARTIDA,2024-12-04 00:27:04.770357
Paquete 42un,Pañales para Bebé BABYSEC Súper Premium XG Paq...,S/ 50.90 un,plaza_vea,ARVEJA SECA PARTIDA,2024-12-04 00:27:04.770357
Sobre 10g,Hongos Secos 4 ESTACIONES Sobre 10g,S/ 4.20 un,plaza_vea,ARVEJA SECA PARTIDA,2024-12-04 00:27:04.770357
Doypack 300g,Hojuelas de Avena con Semilla MILLER'S Vive Do...,S/ 7.90 un,plaza_vea,ARVEJA SECA PARTIDA,2024-12-04 00:27:04.770357
,Chocotejas y Tejas Surtidas HELENA Caja 180g,S/ 31 un,plaza_vea,ARVEJA SECA PARTIDA,2024-12-04 00:27:04.770357
Botella 750ml,Vino Tinto E. COPELLO Tinto Semi Seco Botella ...,S/ 14.90 un,plaza_vea,ARVEJA SECA PARTIDA,2024-12-04 00:27:04.770357
Frasco 400ml,Crema Corporal para Bebé JOHNSON'S BABY Líquid...,S/ 36.50 un,plaza_vea,ARVEJA SECA PARTIDA,2024-12-04 00:27:04.770357
Frasco 150ml,Desodorante para mujer Spray NIVEA Invisible B...,S/ 13.90 un,plaza_vea,ARVEJA SECA PARTIDA,2024-12-04 00:27:04.770357
,Pan de Molde con Avena ORNO Bolsa 600g,S/ 13.90 un,plaza_vea,ARVEJA SECA PARTIDA,2024-12-04 00:27:04.770357
Bolsa 270g,Avena Instantánea BELL'S Chocolate Bolsa 270g,S/ 7.50 un,plaza_vea,ARVEJA SECA PARTIDA,2024-12-04 00:27:04.770357
Paquete 58un,Pañales HUGGIES Hiper Active Sec Talla G Paque...,S/ 52.50 un,plaza_vea,ARVEJA SECA PARTIDA,2024-12-04 00:27:04.770357
,Crema Corporal NIVEA Soft Milk (Piel Seca) - F...,S/ 23.90 un,plaza_vea,ARVEJA SECA PARTIDA,2024-12-04 00:27:04.770357
Frasco 1100g,Miel de Abeja CALLEJÓN DE HUAYLAS Silvestre Fr...,S/ 62.50 un,plaza_vea,ARVEJA SECA PARTIDA,2024-12-04 00:27:04.770357
Bolsa 250g,Chifles Cancha y Carne Seca EL ARTESANO Artich...,S/ 13.90 un,plaza_vea,ARVEJA SECA PARTIDA,2024-12-04 00:27:04.770357
Paquete 58un,Pañales para Bebé BABYSEC Premium G Paquete 58...,S/ 50.90 un,plaza_vea,ARVEJA SECA PARTIDA,2024-12-04 00:27:04.770357
Bolsa 150g,Queso Oveja Curado MARQUES DEL CASTILLO con tr...,S/ 26.50 un,plaza_vea,ARVEJA SECA PARTIDA,2024-12-04 00:27:04.770357
Presentación 0.25 kg aprox.,Queso Manchego de Oveja SPANISH CHESSE,S/ 32.48,plaza_vea,ARVEJA SECA PARTIDA,2024-12-04 00:27:04.770357
Spray 177ml,Loción Sea Spray SUM BUM Texturizing Frasco 17...,S/ 74.90 un,plaza_vea,ARVEJA SECA PARTIDA,2024-12-04 00:27:04.770357
Doypack 500g,Avena Mix MAMALAMA Aguaymanto Linaza Doypack 5...,S/ 17.90 un,plaza_vea,ARVEJA SECA PARTIDA,2024-12-04 00:27:04.770357
Botella 750ml,Espumante Clásico OCUCAJE Semi Seco Botella 75...,S/ 15.50 un,plaza_vea,ARVEJA SECA PARTIDA,2024-12-04 00:27:04.770357
Botella 750ml,Vino Tinto NAVARRO CORREAS Partida Limitada Bo...,S/ 44.90 un,plaza_vea,ARVEJA SECA PARTIDA,2024-12-04 00:27:04.770357
Frasco 1L,Jabón Líquido SIMOND'S Glicerina Avena Frasco ...,S/ 40.90 un,plaza_vea,ARVEJA SECA PARTIDA,2024-12-04 00:27:04.770357
Botella 750ml,Vino Rosé OCUCAJE Rosé Semi Seco Botella 750ml,S/ 15.90 un,plaza_vea,ARVEJA SECA PARTIDA,2024-12-04 00:27:04.770357
Paquete 150g,Queso de Oveja Curado MARQUÉS DEL CASTILLO Paq...,S/ 19.90 un,plaza_vea,ARVEJA SECA PARTIDA,2024-12-04 00:27:04.770357
Vaso 45g,Avena Instantánea de Chocolate BELL'S Vaso 45g,S/ 3.50 un,plaza_vea,ARVEJA SECA PARTIDA,2024-12-04 00:27:04.770357
Doypack 500g,Avena Mix MAMALAMA Cranberry con Chía Doypack ...,S/ 17.90 un,plaza_vea,ARVEJA SECA PARTIDA,2024-12-04 00:27:04.770357
Paquete 62un,Pañales para Bebé BABYSEC Premium Talla P Paqu...,S/ 40.90 un,plaza_vea,ARVEJA SECA PARTIDA,2024-12-04 00:27:04.770357
Doypack 240g,Avena NATURANDES 7 Semillas Doypack 240g,S/ 9.60 un,plaza_vea,ARVEJA SECA PARTIDA,2024-12-04 00:27:04.770357
,Orejas de Gato GABBYS DOLLHOUSE 6067373,S/ 19.90 un,plaza_vea,ARVEJA SECA PARTIDA,2024-12-04 00:27:04.770357
Botella 750ml,Licor MR JIGGER Triple Sec Botella 750ml,S/ 39.90 un,plaza_vea,ARVEJA SECA PARTIDA,2024-12-04 00:27:04.770357
Empaque 1un,Seda Dental REACH Regular 50mts,S/ 14.80 un,plaza_vea,ARVEJA SECA PARTIDA,2024-12-04 00:27:04.770357
,Adorno DECO HOME Caja Surtida,S/ 5.90 un,plaza_vea,ARVEJA SECA PARTIDA,2024-12-04 00:27:04.770357
Lata 241g,Conserva VALLE FERTIL Arvejitas verdes Lata 24...,S/ 7.60 un,plaza_vea,ARVEJA SECA PARTIDA,2024-12-04 00:27:04.770357
Caja 1L,Bebida de Avena ORASI UHT Caja 1L,S/ 16.10 un,plaza_vea,ARVEJA SECA PARTIDA,2024-12-04 00:27:04.770357
Botella 750ml,Vino Tinto VIÑA VIEJA Malbec Semi Seco Botella...,S/ 21.90 un,plaza_vea,ARVEJA SECA PARTIDA,2024-12-04 00:27:04.770357
Botella 750ml,Ron FLOR DE CAÑA Extra Seco 4 años Botella 750...,S/ 43.90 un,plaza_vea,ARVEJA SECA PARTIDA,2024-12-04 00:27:04.770357
Botella 480g,Sirope sabor a Miel de Abeja SPITZE Botella 48...,S/ 12.90 un,plaza_vea,ARVEJA SECA PARTIDA,2024-12-04 00:27:04.770357
Frasco 300g,Miel de Abeja CALLEJÓN DE HUAYLAS Floración Si...,S/ 22.10 un,plaza_vea,ARVEJA SECA PARTIDA,2024-12-04 00:27:04.770357
Botella 750ml,Espumante TACAMA Semi Seco Celebración Botella...,S/ 34.90 un,plaza_vea,ARVEJA SECA PARTIDA,2024-12-04 00:27:04.770357
Caja 400un,Avena Mix Mango y Chocolate +NUTRI Co Caja 400...,S/ 29.90 un,plaza_vea,ARVEJA SECA PARTIDA,2024-12-04 00:27:04.770357
,Arena Magic Color Setx12 + Moldes STANDFORD 11...,S/ 21.50 un,plaza_vea,ARVEJA SECA PARTIDA,2024-12-04 00:27:04.770357
Lata 425g,Conserva VALLE FERTIL Arvejitas verdes Lata 42...,S/ 9.90 un,plaza_vea,ARVEJA SECA PARTIDA,2024-12-04 00:27:04.770357
Botella 750ml,Vino Tinto TABERNERO Tuyo Borgoña Semi Seco Bo...,S/ 16.90 un,plaza_vea,ARVEJA SECA PARTIDA,2024-12-04 00:27:04.770357
,Partido de Baloncesto HUANGER 707-112,S/ 14.90 un,plaza_vea,ARVEJA SECA PARTIDA,2024-12-04 00:27:04.770357
Vaso 45g,Avena Instantánea de Frutos Rojos BELL'S Vaso ...,S/ 3.50 un,plaza_vea,ARVEJA SECA PARTIDA,2024-12-04 00:27:04.770357
Caja 430g,Mezcla para Galletas de Avena LA IBÉRICA con C...,S/ 19.10 un,plaza_vea,ARVEJA SECA PARTIDA,2024-12-04 00:27:04.770357
Pote 65g,Hojuelas de Avena Instantánea DYFFERENT Canela...,S/ 4.90 un,plaza_vea,ARVEJA SECA PARTIDA,2024-12-04 00:27:04.770357
Doypack 600g,Avena Proteína NATURANDES Doypack 600g,S/ 26.90 un,plaza_vea,ARVEJA SECA PARTIDA,2024-12-04 00:27:04.770357
Botella 1.5L,Vino Tinto VIÑA VIEJA Gran Borgoña Semi Seco B...,S/ 34 un,plaza_vea,ARVEJA SECA PARTIDA,2024-12-04 00:27:04.770357
Frasco 700g,Miel de Abeja Pura HUAGAL Oxapampa Frasco 700g,S/ 61.90 un,plaza_vea,ARVEJA SECA PARTIDA,2024-12-04 00:27:04.770357
Bolsa 7.5Kg,Alimento Seco para Gatos FRISKIES Adultos Mar ...,S/ 105.50 un,plaza_vea,ARVEJA SECA PARTIDA,2024-12-04 00:27:04.770357
,Chocotejas Surtidas HELENA Caja 180g,S/ 33.50 un,plaza_vea,ARVEJA SECA PARTIDA,2024-12-04 00:27:04.770357
Frasco 800ml,Crema para Bebé JOHNSON'S BABY Avena Botella 8...,S/ 55.10 un,plaza_vea,ARVEJA SECA PARTIDA,2024-12-04 00:27:04.770357
Pack 2un,Pack BABYSEC Pañales para Bebé Premium XG Paqu...,S/ 125.80 un,plaza_vea,ARVEJA SECA PARTIDA,2024-12-04 00:27:04.770357
Frasco 50ml,Desodorante para mujer Roll On NIVEA Invisible...,S/ 14.50 un,plaza_vea,ARVEJA SECA PARTIDA,2024-12-04 00:27:04.770357
,Orejas Mágicas Musicales GABBY'S DOLLHOUSE 606...,S/ 49.90 un,plaza_vea,ARVEJA SECA PARTIDA,2024-12-04 00:27:04.770357
Botella 750ml,Espumante CHANDON Demi Sec Botella 750ml,S/ 59.90 un,plaza_vea,ARVEJA SECA PARTIDA,2024-12-04 00:27:04.770357
Botella 750ml,Vino Tinto HACIENDA CASA INKA Semi Seco Botell...,S/ 12.90 un,plaza_vea,ARVEJA SECA PARTIDA,2024-12-04 00:27:04.770357
Frasco 500g,Miel de Abeja CALLEJÓN DE HUAYLAS Floración Si...,S/ 36.50 un,plaza_vea,ARVEJA SECA PARTIDA,2024-12-04 00:27:04.770357
Frasco 400ml,Shampoo HERBAL ESSENCES Bio:Renew 6X Aloe & Se...,S/ 33.90 un,plaza_vea,ARVEJA SECA PARTIDA,2024-12-04 00:27:04.770357
Paquete 150g,"Queso de Vaca, Oveja y Cabra MARQUÉS DEL CASTI...",S/ 19.90 un,plaza_vea,ARVEJA SECA PARTIDA,2024-12-04 00:27:04.770357
Botella 700ml,Licor BARDINET Triple Sec naranja Botella 700m...,S/ 60.90 un,plaza_vea,ARVEJA SECA PARTIDA,2024-12-04 00:27:04.770357
Vaso 45g,Avena Instantánea de Manzana y Canela BELL'S V...,S/ 3.50 un,plaza_vea,ARVEJA SECA PARTIDA,2024-12-04 00:27:04.770357
Bolsa 1Kg,Alimento Seco para Gatos FRISKIES Gatitos Poll...,S/ 19.90 un,plaza_vea,ARVEJA SECA PARTIDA,2024-12-04 00:27:04.770357
Botella 750ml,Vino Tinto E. COPELLO Borgoña Semi Seco Botell...,S/ 14.90 un,plaza_vea,ARVEJA SECA PARTIDA,2024-12-04 00:27:04.770357
,Vela Con Tapa DECO HOME Surtida Acuar Rom,S/ 5.90 un,plaza_vea,ARVEJA SECA PARTIDA,2024-12-04 00:27:04.770357
,Crema Facial POND'S Clarant B3 Piel Seca Frasc...,S/ 25.90 un,plaza_vea,ARVEJA SECA PARTIDA,2024-12-04 00:27:04.770357
,Arena Sanitaria MIMASKOT Bolsa 10Kg,S/ 26.90 un,plaza_vea,ARVEJA SECA PARTIDA,2024-12-04 00:27:04.770357
Frasco 500g,Miel de Abeja Pura HUAGAL Oxapampa Frasco 500g,S/ 45 un,plaza_vea,ARVEJA SECA PARTIDA,2024-12-04 00:27:04.770357
Sachet 58g,"Arroz con Pollo, Seco o Aguadito PROVENZAL Sac...",S/ 8.90 un,plaza_vea,ARVEJA SECA PARTIDA,2024-12-04 00:27:04.770357
Doypack 350g,Avena MILLER'S en Hojuelas sabor Natural Doypa...,S/ 6.50 un,plaza_vea,ARVEJA SECA PARTIDA,2024-12-04 00:27:04.770357
Botella 750ml,Vino Rosé E. COPELLO Semi Seco Botella 750ml,S/ 14.90 un,plaza_vea,ARVEJA SECA PARTIDA,2024-12-04 00:27:04.770357
Pack 2un,Pack HERBAL ESSENCES Bio:Renew Aloe & Sea Kelp...,S/ 51.90 un,plaza_vea,ARVEJA SECA PARTIDA,2024-12-04 00:27:04.770357
Bolsa 8Kg,Alimento Seco para Perros DOGUI Adultos 8kg,S/ 68.50 un,plaza_vea,ARVEJA SECA PARTIDA,2024-12-04 00:27:04.770357
Botella 750ml,Vino Tinto OCUCAJE Borgoña Semi Seco Botella 7...,S/ 15.90 un,plaza_vea,ARVEJA SECA PARTIDA,2024-12-04 00:27:04.770357
Tetrapack 200ml,Crema Batida ASTURIANA Tetrapack 200ml,S/ 9.99 un,plaza_vea,ARVEJA SECA PARTIDA,2024-12-04 00:27:04.770357
Doypack 300g,Hojuelas de Avena con Semilla MILLER'S Vive co...,S/ 7.90 un,plaza_vea,ARVEJA SECA PARTIDA,2024-12-04 00:27:04.770357
Pote 65g,Hojuelas de Avena Instantánea DYFFERENT Coco P...,S/ 4.90 un,plaza_vea,ARVEJA SECA PARTIDA,2024-12-04 00:27:04.770357
,Tejas Surtidas HELENA Caja 180g,S/ 31 un,plaza_vea,ARVEJA SECA PARTIDA,2024-12-04 00:27:04.770357
Pack 2un,Avena Mix MAMALAMA Cacao + Maca do 500g,S/ 20.70 un,plaza_vea,ARVEJA SECA PARTIDA,2024-12-04 00:27:04.770357
Pote 65g,Hojuelas de Avena Instantánea DYFFERENT Cranbe...,S/ 4.90 un,plaza_vea,ARVEJA SECA PARTIDA,2024-12-04 00:27:04.770357
Frasco 122g,Shampoo HASK en Seco Charcoal Frasco 122ml,S/ 47.40 un,plaza_vea,ARVEJA SECA PARTIDA,2024-12-04 00:27:04.770357
,Juego de Mesa SCRABBLE Original Mattel Colabor...,S/ 119.90 un,plaza_vea,ARVEJA SECA PARTIDA,2024-12-04 00:27:04.770357
,Chocotejas Surtidas HELENA Caja 300g,S/ 56.90 un,plaza_vea,ARVEJA SECA PARTIDA,2024-12-04 00:27:04.770357
Bolsa 170g,Avena Precocida BELL'S Bolsa 170g,S/ 2.79 un,plaza_vea,ARVEJA SECA PARTIDA,2024-12-04 00:27:04.770357
Botella 750ml,Cava CODORNÍU Clásico Semi Sec Botella 750ml,S/ 49.90 un,plaza_vea,ARVEJA SECA PARTIDA,2024-12-04 00:27:04.770357
Botella 750ml,Cava PERELADA Semi Sec Botella 750ml,S/ 64.90 un,plaza_vea,ARVEJA SECA PARTIDA,2024-12-04 00:27:04.770357
Botella 750ml,Vino Tinto OVEJA BLACK Malbec Botella 750ml,S/ 39.90 un,plaza_vea,ARVEJA SECA PARTIDA,2024-12-04 00:27:04.770357
,Crema Corporal SIMOND'S Dermocream Avenas Orgá...,S/ 39.90 un,plaza_vea,ARVEJA SECA PARTIDA,2024-12-04 00:27:04.770357
Bolsa 3Kg,Alimento Seco para Perros DOGUI Adultos 3kg,S/ 31 un,plaza_vea,ARVEJA SECA PARTIDA,2024-12-04 00:27:04.770357
Frasco ml,Espuma Antipulgas para Perros BOBBY Baño Seco ...,S/ 11.90 un,plaza_vea,ARVEJA SECA PARTIDA,2024-12-04 00:27:04.770357
Paquete 48un,Pañales para Bebé BABYSEC Premium XG Paquete 4...,S/ 50.90 un,plaza_vea,ARVEJA SECA PARTIDA,2024-12-04 00:27:04.770357
Doypack 400g,Avena Mix AMARU FOODS Chocoplátano Doypack 400...,S/ 9.90 un,plaza_vea,ARVEJA SECA PARTIDA,2024-12-04 00:27:04.770357
Botella 750ml,Espumante E. COPELLO Semi Seco Botella 750ml,S/ 18.90 un,plaza_vea,ARVEJA SECA PARTIDA,2024-12-04 00:27:04.770357
,Crema Facial POND'S Clarant B3 Piel Seca Frasc...,S/ 35.90 un,plaza_vea,ARVEJA SECA PARTIDA,2024-12-04 00:27:04.770357
,Manualidades ARTI CREATIVO Arena MágIca Sandy ...,S/ 64.90 un,plaza_vea,ARVEJA SECA PARTIDA,2024-12-04 00:27:04.770357
,Rama DEO HOME Surtida 55cm,S/ 3.90 un,plaza_vea,ARVEJA SECA PARTIDA,2024-12-04 00:27:04.770357
Caja 600g,Panetón Artesanal con Frutos Secos LA FLORENCI...,S/ 24.90 un,plaza_vea,ARVEJA SECA PARTIDA,2024-12-04 00:27:04.770357
Bolsa 1.5Kg,Alimento Seco para Perros DOGUI Adultos 1.5kg,S/ 15.50 un,plaza_vea,ARVEJA SECA PARTIDA,2024-12-04 00:27:04.770357
Frasco 340ml,Crema Corporal SIMOND'S Mi Primera Crema Avena...,S/ 32.90 un,plaza_vea,ARVEJA SECA PARTIDA,2024-12-04 00:27:04.770357
,Tejas Surtidas HELENA Caja 300g,S/ 56.90 un,plaza_vea,ARVEJA SECA PARTIDA,2024-12-04 00:27:04.770357
Frasco 120g,Polen de Abeja HUAGAL Multifloral Oxapampa Fra...,S/ 24.90 un,plaza_vea,ARVEJA SECA PARTIDA,2024-12-04 00:27:04.770357
Caja 400un,Avena Mix Frutos Rojos +NUTRI Co Caja 400g,S/ 29.90 un,plaza_vea,ARVEJA SECA PARTIDA,2024-12-04 00:27:04.770357
Doypack 300g,Hojuelas de Avena con Semilla MILLER'S Vive co...,S/ 7.90 un,plaza_vea,ARVEJA SECA PARTIDA,2024-12-04 00:27:04.770357
,Juguete De Playa De Arena 14Pcs,S/ 9.90 un,plaza_vea,ARVEJA SECA PARTIDA,2024-12-04 00:27:04.770357
,Arena Sanitaria MIMASKOT Bolsa 5Kg,S/ 14.90 un,plaza_vea,ARVEJA SECA PARTIDA,2024-12-04 00:27:04.770357
Frasco 340ml,Jabón Líquido SIMOND'S Mi Primer Jabón Micelar...,S/ 27.90 un,plaza_vea,ARVEJA SECA PARTIDA,2024-12-04 00:27:04.770357
Paquete 6un,Banda Depilatoria Corporal VEET Cera Fría Piel...,S/ 42.20 un,plaza_vea,ARVEJA SECA PARTIDA,2024-12-04 00:27:04.770357
Caja 180g,Chocolate LA IBÉRICA PASTILLAS SURTIDAS De lec...,S/ 34.80 un,plaza_vea,ARVEJA SECA PARTIDA,2024-12-04 00:27:04.770357
Paquete 180g,"Barra de Avena, Quinua y Nibs VITALMAX Paquete...",S/ 14.40 un,plaza_vea,ARVEJA SECA PARTIDA,2024-12-04 00:27:04.770357
Bolsa 3Kg,Alimento Seco para Perros DOGUI Cachorros 3kg,S/ 31 un,plaza_vea,ARVEJA SECA PARTIDA,2024-12-04 00:27:04.770357
,Arena Magica Natural Setx6 + Moldes STANDFORD ...,S/ 29.50 un,plaza_vea,ARVEJA SECA PARTIDA,2024-12-04 00:27:04.770357
Frasco 500g,Miel CALLEJÓN DE HUAYLAS Miel de Abejas y Euca...,S/ 40.50 un,plaza_vea,ARVEJA SECA PARTIDA,2024-12-04 00:27:04.770357
,Bolsa de Arena OXFORD 5Kg,S/ 141.90 un,plaza_vea,ARVEJA SECA PARTIDA,2024-12-04 00:27:04.770357
,Bolsa de Arena OXFORD 10Kg,S/ 207.90 un,plaza_vea,ARVEJA SECA PARTIDA,2024-12-04 00:27:04.770357
,Bolsa de Arena OXFORD 20Kg,S/ 286.90 un,plaza_vea,ARVEJA SECA PARTIDA,2024-12-04 00:27:04.770357
,Bolsa de Arena OXFORD 15Kg,S/ 185.90 un,plaza_vea,ARVEJA SECA PARTIDA,2024-12-04 00:27:04.770357
,Bolígrafos PILOT Tinta Seca BP-S Blíster 4un,S/ 15.10 un,plaza_vea,ARVEJA SECA PARTIDA,2024-12-04 00:27:04.770357
,Pentacombo IMACO Licuadora + Olla arrocera + H...,S/ 299 un,plaza_vea,ARVEJA SECA PARTIDA,2024-12-04 00:27:04.770357
Frasco 200ml,Shampoo en Seco URBAN CARE Hawaiian Monoi Para...,S/ 49.90 un,plaza_vea,ARVEJA SECA PARTIDA,2024-12-04 00:27:04.770357
Frasco 200ml,Shampoo en Seco URBAN CARE Paradise Jungle Fra...,S/ 49.90 un,plaza_vea,ARVEJA SECA PARTIDA,2024-12-04 00:27:04.770357
Frasco 200ml,Shampoo en Seco URBAN CARE Hello Cherry Berry ...,S/ 49.90 un,plaza_vea,ARVEJA SECA PARTIDA,2024-12-04 00:27:04.770357
Frasco 200ml,Shampoo en Seco URBAN CARE Coco Frasco 200ml,S/ 49.90 un,plaza_vea,ARVEJA SECA PARTIDA,2024-12-04 00:27:04.770357
Botella 750ml,Vino Tinto OVEJA BLACK Blend Botella 750ml,S/ 39.90 un,plaza_vea,ARVEJA SECA PARTIDA,2024-12-04 00:27:04.770357
Botella 750ml,Vino Tinto OVEJA BLACK Cabernet Sauvignon Bote...,S/ 39.90 un,plaza_vea,ARVEJA SECA PARTIDA,2024-12-04 00:27:04.770357
Botella 750ml,Vino Tinto OVEJA BLACK Malbec Botella 750ml,S/ 64.90 un,plaza_vea,ARVEJA SECA PARTIDA,2024-12-04 00:27:04.770357
Doypack 200g,"Fortificante Smuti +NUTRICO Sabor a Avena, Cho...",S/ 14.90 un,plaza_vea,ARVEJA SECA PARTIDA,2024-12-04 00:27:04.770357
,Vela Con Tapa DECO HOME Surtida Brisa Natural,S/ 13.90 un,plaza_vea,ARVEJA SECA PARTIDA,2024-12-04 00:27:04.770357
,Arena Apaga El Fuego HOT WHEELS,S/ 149.90 un,plaza_vea,ARVEJA SECA PARTIDA,2024-12-04 00:27:04.770357
,Radio Control Abeja NUOJIA TOYS 128A-33,S/ 49.90 un,plaza_vea,ARVEJA SECA PARTIDA,2024-12-04 00:27:04.770357
,Sanguinaccio con Frutos Secos LA GENOVESA 220g,S/ 13.90 un,plaza_vea,ARVEJA SECA PARTIDA,2024-12-04 00:27:04.770357
,Bolsa de Arena de Entrenmiento MU GROUP 814782,S/ 19.90 un,plaza_vea,ARVEJA SECA PARTIDA,2024-12-04 00:27:04.770357
,Mordedor PLAYGRO Abeja 2pcs,S/ 29 un,plaza_vea,ARVEJA SECA PARTIDA,2024-12-04 00:27:04.770357
Display 54g,Gomitas Surtidas FUN DIPPERZ Display 54g,S/ 6.90 un,plaza_vea,ARVEJA SECA PARTIDA,2024-12-04 00:27:04.770357
Frasco 295ml,Jabón Corporal Líquido CETHAPHIL Pro Piel Seca...,S/ 110.90 un,plaza_vea,ARVEJA SECA PARTIDA,2024-12-04 00:27:04.770357
,Partido de Baloncesto HUANGER 707-110,S/ 12.90 un,plaza_vea,ARVEJA SECA PARTIDA,2024-12-04 00:27:04.770357
Bolsa 1.5Kg,Alimento Seco para Perros DOGUI Cachorros 1.5k...,S/ 15.50 un,plaza_vea,ARVEJA SECA PARTIDA,2024-12-04 00:27:04.770357
Caja 150g,Queso Oveja con Aceite EL GRAN CARDENAL Paquet...,S/ 24.90 un,plaza_vea,ARVEJA SECA PARTIDA,2024-12-04 00:27:04.770357
,Libro de Cocina INSTANT Crips Mini,S/ 99 un,plaza_vea,ARVEJA SECA PARTIDA,2024-12-04 00:27:04.770357
,Pista de Juguete HOT WHEELS Arena de Demolició...,S/ 109.90 un,plaza_vea,ARVEJA SECA PARTIDA,2024-12-04 00:27:04.770357
Pack 3un,Pack Avena QUAKER Tradicional Bolsa 900g Paque...,S/ 39 un,plaza_vea,ARVEJA SECA PARTIDA,2024-12-04 00:27:04.770357
,Pista de Juguete HOT WHEELS Monster Trucks Are...,S/ 149.90 un,plaza_vea,ARVEJA SECA PARTIDA,2024-12-04 00:27:04.770357
,Sacapuntas ARTESCO Pastello c/ Saca Puntas de ...,S/ 5 un,plaza_vea,ARVEJA SECA PARTIDA,2024-12-04 00:27:04.770357
Caja 400un,Avena Mix Manzana y Canela +NUTRI Co Caja 400g,S/ 29.90 un,plaza_vea,ARVEJA SECA PARTIDA,2024-12-04 00:27:04.770357
Doypack 400g,Avena Mix AMARU FOODS Lucumango Doypack 400g,S/ 9.90 un,plaza_vea,ARVEJA SECA PARTIDA,2024-12-04 00:27:04.770357
,Juguete Gatea y Persigue SKIP HOP Abeja,S/ 229 un,plaza_vea,ARVEJA SECA PARTIDA,2024-12-04 00:27:04.770357
Paquete 44un,Pañales para Bebé BABYSEC Premium XXG Paquete ...,S/ 50.90 un,plaza_vea,ARVEJA SECA PARTIDA,2024-12-04 00:27:04.770357
,Deshumedecedor Bola Seca + Recambio 400 g.,S/ 37 un,plaza_vea,ARVEJA SECA PARTIDA,2024-12-04 00:27:04.770357
,Plancha Record seca Classic,S/ 62 un,plaza_vea,ARVEJA SECA PARTIDA,2024-12-04 00:27:04.770357
,Reloj de Arena Retro Cristal con Soporte Mader...,S/ 17.94 un,plaza_vea,ARVEJA SECA PARTIDA,2024-12-04 00:27:04.770357
,Reja de seguridad de aluminio plegable para be...,S/ 299 un,plaza_vea,ARVEJA SECA PARTIDA,2024-12-04 00:27:04.770357
,Pintura pisos y azulejos base Beige Arena 946m...,S/ 89.90 un,plaza_vea,ARVEJA SECA PARTIDA,2024-12-04 00:27:04.770357
,Reloj de arena decorativo de vidrio Colección ...,S/ 15.96 un,plaza_vea,ARVEJA SECA PARTIDA,2024-12-04 00:27:04.770357
,Tubo visor de tanque 2700L Nicoll,S/ 39.90 un,plaza_vea,ARVEJA SECA PARTIDA,2024-12-04 00:27:04.770357
,Tanque de agua Arena Promart 1100 litros + Kit...,S/ 699 un,plaza_vea,ARVEJA SECA PARTIDA,2024-12-04 00:27:04.770357
,Reloj de Arena Retro Premium con Soporte Mader...,S/ 35.94 un,plaza_vea,ARVEJA SECA PARTIDA,2024-12-04 00:27:04.770357
,Bouquet flores secas Casa de Aves Orange,S/ 7.47 un,plaza_vea,ARVEJA SECA PARTIDA,2024-12-04 00:27:04.770357
,Reja de seguridad de MDF plegable para bebés y...,S/ 159.90 un,plaza_vea,ARVEJA SECA PARTIDA,2024-12-04 00:27:04.770357
,COMBO Tanque Deca Omega Plus Blanco + Taza Dec...,S/ 129 un,plaza_vea,ARVEJA SECA PARTIDA,2024-12-04 00:27:04.770357
,Manometro a presión Seco 0 a 6 BAR Giro,S/ 6.90 un,plaza_vea,ARVEJA SECA PARTIDA,2024-12-04 00:27:04.770357
,Pertiga aluminio 5mt,S/ 584 un,plaza_vea,ARVEJA SECA PARTIDA,2024-12-04 00:27:04.770357
,Pertiga aluminio 3m,S/ 439 un,plaza_vea,ARVEJA SECA PARTIDA,2024-12-04 00:27:04.770357
,Cortina de tela Arena 140x250cm,S/ 64.90 un,plaza_vea,ARVEJA SECA PARTIDA,2024-12-04 00:27:04.770357
,"Recortador de barba, nariz, oreja y cejas Trav...",S/ 99 un,plaza_vea,ARVEJA SECA PARTIDA,2024-12-04 00:27:04.770357
,Deshumedecedor Mini Bola Seca Dúo Bouquet,S/ 29.90 un,plaza_vea,ARVEJA SECA PARTIDA,2024-12-04 00:27:04.770357
,"Cerrojo con oreja Zincado 5/8""x8""",S/ 29.40 un,plaza_vea,ARVEJA SECA PARTIDA,2024-12-04 00:27:04.770357
,"Colgador Oreja 1""",S/ 0.40 un,plaza_vea,ARVEJA SECA PARTIDA,2024-12-04 00:27:04.770357
,Codo de oreja met 1/2 cpvc - agua caliente,S/ 4.90 un,plaza_vea,ARVEJA SECA PARTIDA,2024-12-04 00:27:04.770357
,Espejo para baño Sebas 56 x 38 cm,S/ 57.50 un,plaza_vea,ARVEJA SECA PARTIDA,2024-12-04 00:27:04.770357
,Protector lavadora/Seca cabezal c/cierre hasta...,S/ 110 un,plaza_vea,ARVEJA SECA PARTIDA,2024-12-04 00:27:04.770357
,Protector lavadora/Seca cabezal c/cierre hasta...,S/ 94.90 un,plaza_vea,ARVEJA SECA PARTIDA,2024-12-04 00:27:04.770357
,Protector lavadora/Sec universal c/cierre hast...,S/ 96.30 un,plaza_vea,ARVEJA SECA PARTIDA,2024-12-04 00:27:04.770357
,Protector lavadora/Sec universal c/cierre hast...,S/ 85.80 un,plaza_vea,ARVEJA SECA PARTIDA,2024-12-04 00:27:04.770357
,Juego de alicates saca seguros x4 piezas,S/ 76.90 un,plaza_vea,ARVEJA SECA PARTIDA,2024-12-04 00:27:04.770357
,"Llave saca filtro metálica 3 1/2""",S/ 27.90 un,plaza_vea,ARVEJA SECA PARTIDA,2024-12-04 00:27:04.770357
,Cuerdas elásticas surtidas,S/ 34.90 un,plaza_vea,ARVEJA SECA PARTIDA,2024-12-04 00:27:04.770357
,Silla de Diseño Decorativo Gales + Uv Arena - ...,S/ 754 un,plaza_vea,ARVEJA SECA PARTIDA,2024-12-04 00:27:04.770357
,Silla de Diseño Decorativo Obi Arena Bonno,S/ 296 un,plaza_vea,ARVEJA SECA PARTIDA,2024-12-04 00:27:04.770357
,Silla de Diseño Decorativo Brent Arena Bonno -...,"S/ 1,120 un",plaza_vea,ARVEJA SECA PARTIDA,2024-12-04 00:27:04.770357
,Banco Fijo para Bar Misuri Polipropileno Arena...,S/ 338 un,plaza_vea,ARVEJA SECA PARTIDA,2024-12-04 00:27:04.770357
,COMBO Bticino: 10 Tomacorrientes Universal Dob...,S/ 319 un,plaza_vea,ARVEJA SECA PARTIDA,2024-12-04 00:27:04.770357
,COMBO Bticino: 5 Tomacorrientes Universal Dobl...,S/ 159.50 un,plaza_vea,ARVEJA SECA PARTIDA,2024-12-04 00:27:04.770357
Presentación 1 caja rinde 2.5 m²,Piso Vinílico Spc Sena Marrón 0.5x22.5x123.5cm...,S/ 71.96 x m²,plaza_vea,ARVEJA SECA PARTIDA,2024-12-04 00:27:04.770357
Presentación 1 caja rinde 2.5 m²,Piso Vinílico Spc Sena Gris 0.5x22.5x123.5cm 2...,S/ 71.96 x m²,plaza_vea,ARVEJA SECA PARTIDA,2024-12-04 00:27:04.770357
,Vincha Surtida Muñecos Navideños Colección Roj...,S/ 4.76 un,plaza_vea,ARVEJA SECA PARTIDA,2024-12-04 00:27:04.770357
Presentación 1 caja rinde 0.09 m²,Fachaleta Spazio Arena 60x15cm 0.36m2,S/ 554.44 x m²,plaza_vea,ARVEJA SECA PARTIDA,2024-12-04 00:27:04.770357
,Set x 50 Bolas Surtidas Doradas de Árbol Colec...,S/ 19.96 un,plaza_vea,ARVEJA SECA PARTIDA,2024-12-04 00:27:04.770357
Presentación 1 caja rinde 1.44 m²,Piso Gress Marmolizado Calacata Sebas Blanco V...,S/ 36.90 x m²,plaza_vea,ARVEJA SECA PARTIDA,2024-12-04 00:27:04.770357
Presentación 1 caja rinde 1.44 m²,Piso Marmolizado Gris Seda 60x60cm 1.44m2 Oran...,S/ 45.90 x m²,plaza_vea,ARVEJA SECA PARTIDA,2024-12-04 00:27:04.770357
,Silla diseño Fija Kiro Arena Bonno,S/ 201 un,plaza_vea,ARVEJA SECA PARTIDA,2024-12-04 00:27:04.770357
,Valvula Tipo Flotador Nicoll,S/ 49.90 un,plaza_vea,ARVEJA SECA PARTIDA,2024-12-04 00:27:04.770357
