description,price,website,search_term,scrape_timestamp
Pavo Entero Redondos x kg,S/ 14.90 x kg,metro,PAVO EVISCERADO,2024-12-06 18:02:07.123709
Pavo Entero Congelado San Fernando x kg,S/ 15.40 x kg,metro,PAVO EVISCERADO,2024-12-06 18:02:07.123709
Pavo Entero con Menudencia Cuisine & Co x kg,S/ 12.80 x kg,metro,PAVO EVISCERADO,2024-12-06 18:02:07.123709
Pavo Entero con Menudencia Cuisine & Co 8kg aprox,S/ 99.90,metro,PAVO EVISCERADO,2024-12-06 18:02:07.123709
Pavo Entero con Menudencia Redondos 8kg aprox,S/ 110.00,metro,PAVO EVISCERADO,2024-12-06 18:02:07.123709
Pavo Entero con Menudencia San Fernando  8kg aprox,S/ 119.00,metro,PAVO EVISCERADO,2024-12-06 18:02:07.123709
Pechuga de Pavita en Trozos San Fernando x Kg,S/ 18.99 x kg,metro,PAVO EVISCERADO,2024-12-06 18:02:07.123709
Rodaja Especial de Pavita San Fernando kg,S/ 24.20 x kg,metro,PAVO EVISCERADO,2024-12-06 18:02:07.123709
Guiso de Pechuga de Pavita San Fernando x kg,S/ 22.70 x kg,metro,PAVO EVISCERADO,2024-12-06 18:02:07.123709
Medallón de Muslo de Pavita San Fernando x kg,S/ 23.99 x kg,metro,PAVO EVISCERADO,2024-12-06 18:02:07.123709
Jamón de Pechuga de Pavo Braedt Balance Paquete 200 g,S/ 14.87,metro,PAVO EVISCERADO,2024-12-06 18:02:07.123709
Alimento Rambala Barf Natural para Perro Pollo Pavo,S/ 15.20,metro,PAVO EVISCERADO,2024-12-06 18:02:07.123709
Felix Alimento Húmedo para Gatos Paté de Pavo y Menudencias Lata 156 gr,S/ 7.00,metro,PAVO EVISCERADO,2024-12-06 18:02:07.123709
Chuleta de Pechuga de Pavita San Fernando x kg,S/ 29.90 x kg,metro,PAVO EVISCERADO,2024-12-06 18:02:07.123709
Guiso de Pechuga de Pavita x kg,S/ 21.70 x kg,metro,PAVO EVISCERADO,2024-12-06 18:02:07.123709
Brazuelo de Pavita San Fernando x kg,S/ 13.20 x kg,metro,PAVO EVISCERADO,2024-12-06 18:02:07.123709
Jamón de Pavo Braedt 480g,S/ 19.97,metro,PAVO EVISCERADO,2024-12-06 18:02:07.123709
Jamón de Pavo Braedt Paquete 200 g,S/ 13.50,metro,PAVO EVISCERADO,2024-12-06 18:02:07.123709
Alimento BARF Natural para Perros Rambala Pavo Res,S/ 17.00,metro,PAVO EVISCERADO,2024-12-06 18:02:07.123709
Pechuga de Pavita San Fernando x kg,S/ 21.50 x kg,metro,PAVO EVISCERADO,2024-12-06 18:02:07.123709
Alimento Rambala Natural Barf Pavo Hipoalergénico,S/ 18.90,metro,PAVO EVISCERADO,2024-12-06 18:02:07.123709
Ricocat Paté para Gatos Adultos Pavo e Hígado Lata 330 gr,S/ 8.40,metro,PAVO EVISCERADO,2024-12-06 18:02:07.123709
Rodaja Casera de Pavita San Fernando x kg,S/ 10.40 x kg,metro,PAVO EVISCERADO,2024-12-06 18:02:07.123709
Alimento Rambala Natural para Perros Cordero Pavo,S/ 18.90,metro,PAVO EVISCERADO,2024-12-06 18:02:07.123709
Hot Dog de Pavo Braedt Balance 250g,S/ 9.90,metro,PAVO EVISCERADO,2024-12-06 18:02:07.123709
Rodajas de Brazuelo Pavita San Fernando kg,S/ 15.70 x kg,metro,PAVO EVISCERADO,2024-12-06 18:02:07.123709
Fancy Feast Goulash Pavo Pouch 85g,S/ 5.90,metro,PAVO EVISCERADO,2024-12-06 18:02:07.123709
Filete de Pechuga de Pavita San Fernando x kg,S/ 33.90 x kg,metro,PAVO EVISCERADO,2024-12-06 18:02:07.123709
Pechuga de Pavo Especial Cuisine & Co x kg,S/ 19.90 x kg,metro,PAVO EVISCERADO,2024-12-06 18:02:07.123709
Aderezo para Hornear Pavo / Cerdo caja 220 g,S/ 7.50,metro,PAVO EVISCERADO,2024-12-06 18:02:07.123709
Pierna Ahumada de Pavo San Fernando x kg,S/ 37.50 x kg,metro,PAVO EVISCERADO,2024-12-06 18:02:07.123709
Milanesa de Pavo San Fernando Bolsa 4 Unid / 415 g,S/ 17.80,metro,PAVO EVISCERADO,2024-12-06 18:02:07.123709
Jamón de Pechuga de Pavo Casa Europa Paquete 200 g,S/ 14.80,metro,PAVO EVISCERADO,2024-12-06 18:02:07.123709
Jamón de Pechuga de Pavo Zimmermann Paquete 150 g,S/ 16.50,metro,PAVO EVISCERADO,2024-12-06 18:02:07.123709
Enrollado de Pavo Delizzia San Fernando x un,S/ 46.90,metro,PAVO EVISCERADO,2024-12-06 18:02:07.123709
Alimento Húmedo para Gatos Felix Sabor a Pavo,S/ 4.50,metro,PAVO EVISCERADO,2024-12-06 18:02:07.123709
Aderezo Para Pavo El Olivar 500 g,S/ 13.90,metro,PAVO EVISCERADO,2024-12-06 18:02:07.123709
Jamón de Pechuga de Pavo Suiza 180g,S/ 15.90,metro,PAVO EVISCERADO,2024-12-06 18:02:07.123709
Paté Super Cat Adultos Sabor Hígado y Pavo 180g,S/ 5.00,metro,PAVO EVISCERADO,2024-12-06 18:02:07.123709
Pechuga de Pavo Horneado en Lonjas San Fernando 460g,S/ 22.25,metro,PAVO EVISCERADO,2024-12-06 18:02:07.123709
Pechuga de Pavo Horneada San Fernando x kg,S/ 52.00 x kg,metro,PAVO EVISCERADO,2024-12-06 18:02:07.123709
Filete de Pierna de Pavita San Fernando x kg,S/ 24.80 x kg,metro,PAVO EVISCERADO,2024-12-06 18:02:07.123709
Hamburguesas de Pavo Natural Home 600g,S/ 15.99,metro,PAVO EVISCERADO,2024-12-06 18:02:07.123709
Jamón de Pechuga de Pavo Braedt Paquete 200 g,S/ 17.50,metro,PAVO EVISCERADO,2024-12-06 18:02:07.123709
Jamón de Pechuga de Pavo Ahumado Braedt Paquete 200 g,S/ 19.50,metro,PAVO EVISCERADO,2024-12-06 18:02:07.123709
Hot Dog de Pavo Braedt Balance Paquete 500 g,S/ 19.50,metro,PAVO EVISCERADO,2024-12-06 18:02:07.123709
Pechuga de Pavo a la Criolla Ahuma 500g,S/ 59.90,metro,PAVO EVISCERADO,2024-12-06 18:02:07.123709
Aderezo de Pavo Cuisine & Co 500g,S/ 11.90,metro,PAVO EVISCERADO,2024-12-06 18:02:07.123709
Aderezo de Pavo Arezzo 500g,S/ 9.50,metro,PAVO EVISCERADO,2024-12-06 18:02:07.123709
Aderezo para Pavo Piki 350g,S/ 10.00,metro,PAVO EVISCERADO,2024-12-06 18:02:07.123709
Jamón de Pechuga de Pavo Salchichería Alemana 200g,S/ 15.90,metro,PAVO EVISCERADO,2024-12-06 18:02:07.123709
Pet's Republic Natural Treats Strips de Pavo Frasco 88 gr,S/ 24.99,metro,PAVO EVISCERADO,2024-12-06 18:02:07.123709
Pechuga de Pavo Criollo 500g,S/ 39.90,metro,PAVO EVISCERADO,2024-12-06 18:02:07.123709
Alimento Rambala parte de Gato Pavo Jurel 500g,S/ 12.20,metro,PAVO EVISCERADO,2024-12-06 18:02:07.123709
Jamón de Pavo Otto Kunz x kg,S/ 77.00 x kg,metro,PAVO EVISCERADO,2024-12-06 18:02:07.123709
Delicias en Salsa Super Cat Adultos Sabor Pavo 190g,S/ 5.00,metro,PAVO EVISCERADO,2024-12-06 18:02:07.123709
Drummets de Pavita San Fernando x kg,S/ 16.60 x kg,metro,PAVO EVISCERADO,2024-12-06 18:02:07.123709
Aderezo para Pavo Cuisine & Co 250g,S/ 6.90,metro,PAVO EVISCERADO,2024-12-06 18:02:07.123709
Jamón de Pechuga de Pavo Braedt x kg,S/ 98.00 x kg,metro,PAVO EVISCERADO,2024-12-06 18:02:07.123709
Aderezo de Pavo Cuisine & Co 250g,S/ 7.90,metro,PAVO EVISCERADO,2024-12-06 18:02:07.123709
Jamón de Pechuag de Pavo Ahumado Salchichería Alemana 200g,S/ 17.90,metro,PAVO EVISCERADO,2024-12-06 18:02:07.123709
Filetitos en Salsa Ricocat Adultos Sabor Pavo 190g,S/ 4.50,metro,PAVO EVISCERADO,2024-12-06 18:02:07.123709
Jamón de Pavo Ahumado Braedt x kg,S/ 109.00 x kg,metro,PAVO EVISCERADO,2024-12-06 18:02:07.123709
Flotador Bestway Pavo Real 183cm,S/ 159.90,metro,PAVO EVISCERADO,2024-12-06 18:02:07.123709
Jamón de Pavo Braedt x kg,S/ 66.00 x kg,metro,PAVO EVISCERADO,2024-12-06 18:02:07.123709
Delicias Pechuga de Pavo y Vacuno Dentitoy 4un,S/ 8.60,metro,PAVO EVISCERADO,2024-12-06 18:02:07.123709
Aderezo de Pavo Cuisine & Co 1kg,S/ 22.90,metro,PAVO EVISCERADO,2024-12-06 18:02:07.123709
Premios para Perros Rambala Christmas Treats Pavo y Camote 100g,S/ 31.99,metro,PAVO EVISCERADO,2024-12-06 18:02:07.123709
Paño Absorbente Tradicional Virutex 20un,S/ 17.90,metro,PAVO EVISCERADO,2024-12-06 18:02:07.123709
Paño Reutilizable Duramax Scott 1un,S/ 13.50,metro,PAVO EVISCERADO,2024-12-06 18:02:07.123709
Paño Reutilizable Duramax Scott 3un,S/ 19.90,metro,PAVO EVISCERADO,2024-12-06 18:02:07.123709
Paño Reutilizable Duramax Scott 2un,S/ 14.00,metro,PAVO EVISCERADO,2024-12-06 18:02:07.123709
Paño Absorvente Scotch Brite 9un,S/ 22.00,metro,PAVO EVISCERADO,2024-12-06 18:02:07.123709
Limpiador Pato para Inodoro Discos Activos Lavanda Repuesto 36ml,S/ 9.50,metro,PAVO EVISCERADO,2024-12-06 18:02:07.123709
Paño de Microfibra Scotch-Brite Súper Paño Multiuso 4un.,S/ 16.40,metro,PAVO EVISCERADO,2024-12-06 18:02:07.123709
Limpiador Pato Líquido Desinfectante para Inodoro Gel Marina 500ml,S/ 17.60,metro,PAVO EVISCERADO,2024-12-06 18:02:07.123709
Paño Secatodo Multiusos Scotch-Brite 14un,S/ 21.60,metro,PAVO EVISCERADO,2024-12-06 18:02:07.123709
Limpiador Pato para Inodoro Discos Activos Lavanda con un Aplicador 36ml,S/ 12.40,metro,PAVO EVISCERADO,2024-12-06 18:02:07.123709
Paño Scotch-Brite Súper Absorbente 4un.,S/ 16.40,metro,PAVO EVISCERADO,2024-12-06 18:02:07.123709
Paño Esponja Súper Absorbente Home Care 6un,S/ 13.20,metro,PAVO EVISCERADO,2024-12-06 18:02:07.123709
Limpiador Pato para Inodoro Discos Activos Cítrico Repuesto 36ml,S/ 9.50,metro,PAVO EVISCERADO,2024-12-06 18:02:07.123709
Destructor de Sarro Pato 710ml,S/ 17.90,metro,PAVO EVISCERADO,2024-12-06 18:02:07.123709
Paños Esponja Súper Absorbente Home Care Paquete de 3 Unidades,S/ 8.30,metro,PAVO EVISCERADO,2024-12-06 18:02:07.123709
Limpiador Pato Tanque Pastilla Marina 3pack 120g,S/ 23.20,metro,PAVO EVISCERADO,2024-12-06 18:02:07.123709
Limpiador Pato Líquido Desinfectante para Inodoro Gel Pino 500ml,S/ 17.60,metro,PAVO EVISCERADO,2024-12-06 18:02:07.123709
Paño de Microfibra Home Care 4 unid,S/ 13.90,metro,PAVO EVISCERADO,2024-12-06 18:02:07.123709
Paños Esponja Súper Absorbente Home Care Paquete de 12 Unidades,S/ 22.20,metro,PAVO EVISCERADO,2024-12-06 18:02:07.123709
Paños Multiusos Home Care 3un,S/ 7.50,metro,PAVO EVISCERADO,2024-12-06 18:02:07.123709
Limpiador Pato Inodoro Pastilla Adhesiva Lavanda 30g,S/ 7.80,metro,PAVO EVISCERADO,2024-12-06 18:02:07.123709
Palo para Escobas Virutex Surtido,S/ 6.20,metro,PAVO EVISCERADO,2024-12-06 18:02:07.123709
Paño Multiuso Home Care Paquete de 12 Unidades,S/ 15.90,metro,PAVO EVISCERADO,2024-12-06 18:02:07.123709
Paño Krea Toalla 40x60cm Cuadros,S/ 4.50,metro,PAVO EVISCERADO,2024-12-06 18:02:07.123709
Paño de Microfibra Home Care 2un,S/ 6.20,metro,PAVO EVISCERADO,2024-12-06 18:02:07.123709
Paño Ultra Limpiador Home Care Paquete de 6 Unidades,S/ 8.20,metro,PAVO EVISCERADO,2024-12-06 18:02:07.123709
Limpiador para Inodoro Pato Discos Activos Cítrico con Aplicador 36ml,S/ 12.40,metro,PAVO EVISCERADO,2024-12-06 18:02:07.123709
Paño Microfibra Para Cocina y Vidrio Home Care Pack 3 Unidades,S/ 13.80,metro,PAVO EVISCERADO,2024-12-06 18:02:07.123709
Paños Multiusos Home Care 6un,S/ 11.40,metro,PAVO EVISCERADO,2024-12-06 18:02:07.123709
Paño de Limpieza Multiuso Virutex 6un,S/ 8.90,metro,PAVO EVISCERADO,2024-12-06 18:02:07.123709
Limpiador Pato Tanque Pastilla Marina 1 Repuesto 40g,S/ 12.40,metro,PAVO EVISCERADO,2024-12-06 18:02:07.123709
Paño Ultra Limpiador Home Care Paquete de 3 Unidades,S/ 4.90,metro,PAVO EVISCERADO,2024-12-06 18:02:07.123709
Paño Velour Krea 40x60cm Diseño Surtido,S/ 2.40,metro,PAVO EVISCERADO,2024-12-06 18:02:07.123709
Paño Krea Abrillantador,S/ 2.80,metro,PAVO EVISCERADO,2024-12-06 18:02:07.123709
Limpiador Pato Tanque Pastilla Marina 2pack 80g,S/ 18.10,metro,PAVO EVISCERADO,2024-12-06 18:02:07.123709
Paño Microfibra Para Vidrios Home Care Pack 3 Unidades,S/ 13.30,metro,PAVO EVISCERADO,2024-12-06 18:02:07.123709
Discos para Inodoro Pato Discos Activos Combo Frutal 6un + Aplicador,S/ 12.30,metro,PAVO EVISCERADO,2024-12-06 18:02:07.123709
Paño Microfibra Multiuso Home Care 3un.,S/ 13.40,metro,PAVO EVISCERADO,2024-12-06 18:02:07.123709
Paño de Microfibra para Cocina Home Care 3un,S/ 13.40,metro,PAVO EVISCERADO,2024-12-06 18:02:07.123709
Paño Secatodo Multiusos Scotch-Brite 4un,S/ 15.10,metro,PAVO EVISCERADO,2024-12-06 18:02:07.123709
Limpiador en Gel para Inodoro Pato Combo Frutal 500ml,S/ 17.40,metro,PAVO EVISCERADO,2024-12-06 18:02:07.123709
Limpiador en Gel para Inodoro Pato Laberinto Floral 500ml,S/ 17.40,metro,PAVO EVISCERADO,2024-12-06 18:02:07.123709
Paño Krea Microfibra Diseño Surtido,S/ 3.50,metro,PAVO EVISCERADO,2024-12-06 18:02:07.123709
Paño Secatodo Multiusos Scotch-Brite 8un,S/ 18.10,metro,PAVO EVISCERADO,2024-12-06 18:02:07.123709
Discos para Inodoro Pato Discos Activos Laberinto Floral 6un + Aplicador,S/ 12.30,metro,PAVO EVISCERADO,2024-12-06 18:02:07.123709
Paño Krea Velour 40x60cm Diseño Surtido,S/ 5.50,metro,PAVO EVISCERADO,2024-12-06 18:02:07.123709
Paño para Piso con Ojal Virutex 42 x 90 cm,S/ 14.60,metro,PAVO EVISCERADO,2024-12-06 18:02:07.123709
Paños con Silicona para Cueros PorFin 30un,S/ 18.60,metro,PAVO EVISCERADO,2024-12-06 18:02:07.123709
Paño Krea Jacquard 38x63cm Surtido,S/ 7.50,metro,PAVO EVISCERADO,2024-12-06 18:02:07.123709
Paño Dobby Krea Líneas,S/ 3.20,metro,PAVO EVISCERADO,2024-12-06 18:02:07.123709
Paño de Cocina Krea Fiesta Navidad 2024,S/ 11.10,metro,PAVO EVISCERADO,2024-12-06 18:02:07.123709
Paño Antibacterial Cobre Virutex x14,S/ 16.90,metro,PAVO EVISCERADO,2024-12-06 18:02:07.123709
