description,price,website,search_term,scrape_timestamp
Refresco Instantáneo Sabores de Mi Tierra Chicha Morada Sobre 15 g,S/ 1.20,metro,REFRESCO ENVASADO (FLUIDO),2024-12-06 19:41:10.302651
Refresco Instantáneo Sabor Naranja Sobre 15 g,S/ 1.20,metro,REFRESCO ENVASADO (FLUIDO),2024-12-06 19:41:10.302651
Refresco Instantáneo Umsha Frutísimos Sabor Chicha Morada 20g,S/ 1.60,metro,REFRESCO ENVASADO (FLUIDO),2024-12-06 19:41:10.302651
Refresco Instantáneo Sabores de Mi Tierra Limonada Sobre 15 g,S/ 1.20,metro,REFRESCO ENVASADO (FLUIDO),2024-12-06 19:41:10.302651
Refresco Instantáneo Sabor Maracuyá Sobre 15 g,S/ 1.20,metro,REFRESCO ENVASADO (FLUIDO),2024-12-06 19:41:10.302651
Refresco Instantáneo Toronja Clight Sobre Doble 14 g,S/ 2.30,metro,REFRESCO ENVASADO (FLUIDO),2024-12-06 19:41:10.302651
Refresco Instantáneo Sabores de Mi Tierra Mango Criollo Sobre 15 g,S/ 1.20,metro,REFRESCO ENVASADO (FLUIDO),2024-12-06 19:41:10.302651
Refresco Instantáneo Sabor Piña Sobre 15 g,S/ 1.20,metro,REFRESCO ENVASADO (FLUIDO),2024-12-06 19:41:10.302651
Refresco Instantáneo Sabores de Mi Tierra Emoliente Sobre 15 g,S/ 1.20,metro,REFRESCO ENVASADO (FLUIDO),2024-12-06 19:41:10.302651
Refresco Instantáneo Umsha Frutísimos Sabor Naranja 20g,S/ 1.60,metro,REFRESCO ENVASADO (FLUIDO),2024-12-06 19:41:10.302651
Refresco Instantáneo Umsha Frutísimos Sabor Maracuyá 20g,S/ 1.60,metro,REFRESCO ENVASADO (FLUIDO),2024-12-06 19:41:10.302651
Fluido Facial Día Nivea Luminous 630° Anti Manchas FPS50 40ml,S/ 54.54,metro,REFRESCO ENVASADO (FLUIDO),2024-12-06 19:41:10.302651
Fluido Nivea Luminous Anti Manchas Tono Medio FPS30 40ml,S/ 55.74,metro,REFRESCO ENVASADO (FLUIDO),2024-12-06 19:41:10.302651
Salsa de Ají Amarillo Envasado 550 g,S/ 18.10,metro,REFRESCO ENVASADO (FLUIDO),2024-12-06 19:41:10.302651
Gelatina Bebible Umsha Frutísimos Sabor Fresa 20g,S/ 1.60,metro,REFRESCO ENVASADO (FLUIDO),2024-12-06 19:41:10.302651
Bebida en Polvo Clight Sin Calorías Sabor Piña 14g,S/ 2.30,metro,REFRESCO ENVASADO (FLUIDO),2024-12-06 19:41:10.302651
Bebida en Polvo Clight Sin Calorías Sabor Naranja 14g,S/ 2.30,metro,REFRESCO ENVASADO (FLUIDO),2024-12-06 19:41:10.302651
Concentrado de Chicha Morada Naturale 250ml,S/ 4.60,metro,REFRESCO ENVASADO (FLUIDO),2024-12-06 19:41:10.302651
Chicha Morada Naturale Botella 1 L,S/ 7.90,metro,REFRESCO ENVASADO (FLUIDO),2024-12-06 19:41:10.302651
Bebida en Polvo Clight Sin Calorías Sabor Fresa 14g,S/ 2.30,metro,REFRESCO ENVASADO (FLUIDO),2024-12-06 19:41:10.302651
Chicha Morada Naturale Botella 1.9 L,S/ 13.90,metro,REFRESCO ENVASADO (FLUIDO),2024-12-06 19:41:10.302651
Bebida en Polvo Clight Sin Calorías Sabor Mandarina 14g,S/ 2.30,metro,REFRESCO ENVASADO (FLUIDO),2024-12-06 19:41:10.302651
Gelatina Bebible Umsha Frutísimos Sabor Piña 20g,S/ 1.60,metro,REFRESCO ENVASADO (FLUIDO),2024-12-06 19:41:10.302651
Bebida en Polvo Clight Sin Calorías Sabor Limón 14g,S/ 2.30,metro,REFRESCO ENVASADO (FLUIDO),2024-12-06 19:41:10.302651
Salsa Culantrito con Espinaca Envasado 550 g,S/ 15.20,metro,REFRESCO ENVASADO (FLUIDO),2024-12-06 19:41:10.302651
Tripack Bebida Instantánea Clight Sin Calorías Sabor Fresa 14g,S/ 5.00,metro,REFRESCO ENVASADO (FLUIDO),2024-12-06 19:41:10.302651
Ajo en Pasta Envasado 550 g,S/ 31.90,metro,REFRESCO ENVASADO (FLUIDO),2024-12-06 19:41:10.302651
Chicha Morada Gloria Botella 3 L,S/ 7.90,metro,REFRESCO ENVASADO (FLUIDO),2024-12-06 19:41:10.302651
Gelatina Bebible Umsha Frutísimos Sabor Naranja 20g,S/ 1.60,metro,REFRESCO ENVASADO (FLUIDO),2024-12-06 19:41:10.302651
Concentrado de Emoliente Naturale 250ml,S/ 4.60,metro,REFRESCO ENVASADO (FLUIDO),2024-12-06 19:41:10.302651
Tripack Bebida Instantánea Clight Sin Calorías Sabor Piña 14g,S/ 5.00,metro,REFRESCO ENVASADO (FLUIDO),2024-12-06 19:41:10.302651
Chicha Morada Naturale Botella 500 ml,S/ 4.60,metro,REFRESCO ENVASADO (FLUIDO),2024-12-06 19:41:10.302651
Tripack Bebida Instantánea Clight Sin Calorías Sabor Mandarina 14g,S/ 5.00,metro,REFRESCO ENVASADO (FLUIDO),2024-12-06 19:41:10.302651
Chicha Morada Cuisine & Co 1L,S/ 5.90,metro,REFRESCO ENVASADO (FLUIDO),2024-12-06 19:41:10.302651
Chicha Morada Selva Botella 900ml,S/ 7.90,metro,REFRESCO ENVASADO (FLUIDO),2024-12-06 19:41:10.302651
Tripack Bebida Instantánea Clight Sin Calorías Sabor Naranja 14g,S/ 5.00,metro,REFRESCO ENVASADO (FLUIDO),2024-12-06 19:41:10.302651
Bebida Casera Gloria Chicha Morada Botella 320ml,S/ 1.90,metro,REFRESCO ENVASADO (FLUIDO),2024-12-06 19:41:10.302651
Jugo de Naranja Florida's Nature Lata 340ml,S/ 5.90,metro,REFRESCO ENVASADO (FLUIDO),2024-12-06 19:41:10.302651
Chicha Morada Gloria Botella 400 ml,S/ 1.70,metro,REFRESCO ENVASADO (FLUIDO),2024-12-06 19:41:10.302651
Tripack Bebida Instantánea Clight Sin Calorías Sabor Toronja 14g,S/ 5.00,metro,REFRESCO ENVASADO (FLUIDO),2024-12-06 19:41:10.302651
Tripack Bebida Instantánea Clight Sin Calorías Sabor Limón 14g,S/ 5.00,metro,REFRESCO ENVASADO (FLUIDO),2024-12-06 19:41:10.302651
Cebada Instantánea Ecco 12g,S/ 1.00,metro,REFRESCO ENVASADO (FLUIDO),2024-12-06 19:41:10.302651
Bebida Chicha Morada Don Fidel 1.9L,S/ 14.90,metro,REFRESCO ENVASADO (FLUIDO),2024-12-06 19:41:10.302651
Chicha Morada Cuisine & Co 500ml,S/ 3.60,metro,REFRESCO ENVASADO (FLUIDO),2024-12-06 19:41:10.302651
Chicha Morada Selva Botella 300ml,S/ 4.20,metro,REFRESCO ENVASADO (FLUIDO),2024-12-06 19:41:10.302651
Casas&Cosas Cuchara para Refresco 30 cm,S/ 11.99,metro,REFRESCO ENVASADO (FLUIDO),2024-12-06 19:41:10.302651
Bebida Instantánea Umsha Chicha Morada 13g,S/ 1.00,metro,REFRESCO ENVASADO (FLUIDO),2024-12-06 19:41:10.302651
Jugo de Manzana Florida's Nature Lata 340ml,S/ 5.90,metro,REFRESCO ENVASADO (FLUIDO),2024-12-06 19:41:10.302651
Bebida Chicha Morada Don Fidel 500ml,S/ 4.90,metro,REFRESCO ENVASADO (FLUIDO),2024-12-06 19:41:10.302651
Bebida Frugos del Valle Sabor Chicha Morada Botella 300ml,S/ 2.30,metro,REFRESCO ENVASADO (FLUIDO),2024-12-06 19:41:10.302651
Bebida Instantánea Umsha Fresa 13g,S/ 1.00,metro,REFRESCO ENVASADO (FLUIDO),2024-12-06 19:41:10.302651
Jugo de Frutas Florida's Premium Fruit Splash Lata 340ml,S/ 5.90,metro,REFRESCO ENVASADO (FLUIDO),2024-12-06 19:41:10.302651
Pollo Entero Fresco Metro x kg,S/ 8.40 x kg,metro,REFRESCO ENVASADO (FLUIDO),2024-12-06 19:41:10.302651
Pollo Fresco con Menudencia San Fernando x Kg,S/ 8.70 x kg,metro,REFRESCO ENVASADO (FLUIDO),2024-12-06 19:41:10.302651
Queso Mozzarella Bonlé bola 250 g,S/ 13.00,metro,REFRESCO ENVASADO (FLUIDO),2024-12-06 19:41:10.302651
Queso Fresco Bonlé x kg,S/ 29.20 x kg,metro,REFRESCO ENVASADO (FLUIDO),2024-12-06 19:41:10.302651
Queso Fresco Light Cuisine & Co x kg,S/ 29.60 x kg,metro,REFRESCO ENVASADO (FLUIDO),2024-12-06 19:41:10.302651
Queso Fresco Cuisine & Co x kg,S/ 29.60 x kg,metro,REFRESCO ENVASADO (FLUIDO),2024-12-06 19:41:10.302651
Queso Fresco Sin Lactosa Laive x kg,S/ 32.64 x kg,metro,REFRESCO ENVASADO (FLUIDO),2024-12-06 19:41:10.302651
Queso Fresco Laive x kg,S/ 31.84 x kg,metro,REFRESCO ENVASADO (FLUIDO),2024-12-06 19:41:10.302651
Aguaymanto Fresco Pelado 200g,S/ 3.89,metro,REFRESCO ENVASADO (FLUIDO),2024-12-06 19:41:10.302651
Bonito Entero x kg,S/ 6.90 x kg,metro,REFRESCO ENVASADO (FLUIDO),2024-12-06 19:41:10.302651
Queso Fresco Laive Sbelt Laive x kg,S/ 32.32 x kg,metro,REFRESCO ENVASADO (FLUIDO),2024-12-06 19:41:10.302651
Queso Mozzarella Laive Light 250g,S/ 12.50,metro,REFRESCO ENVASADO (FLUIDO),2024-12-06 19:41:10.302651
Trucha Entera Eviscerada x kg,S/ 18.90 x kg,metro,REFRESCO ENVASADO (FLUIDO),2024-12-06 19:41:10.302651
Queso Fresco Oquendo 250g,S/ 7.12,metro,REFRESCO ENVASADO (FLUIDO),2024-12-06 19:41:10.302651
Queso Mozzarella en Tajadas Braedt 180g,S/ 12.50,metro,REFRESCO ENVASADO (FLUIDO),2024-12-06 19:41:10.302651
Filete de Salmón Fresco x kg,S/ 64.90 x kg,metro,REFRESCO ENVASADO (FLUIDO),2024-12-06 19:41:10.302651
Queso Cottage Plusa pote 225 g,S/ 11.30,metro,REFRESCO ENVASADO (FLUIDO),2024-12-06 19:41:10.302651
Queso Mozzarella Laive 250g,S/ 12.50,metro,REFRESCO ENVASADO (FLUIDO),2024-12-06 19:41:10.302651
Queso Fresco Gloria Molde 400 g,S/ 30.32 x kg,metro,REFRESCO ENVASADO (FLUIDO),2024-12-06 19:41:10.302651
Queso Fresco Gloria x kg molde 250 g aprox,S/ 30.64 x kg,metro,REFRESCO ENVASADO (FLUIDO),2024-12-06 19:41:10.302651
Detergente en Polvo Sapolio Aros de Poder Fresco Limón 2kg,S/ 18.90,metro,REFRESCO ENVASADO (FLUIDO),2024-12-06 19:41:10.302651
Queso Fresco Artesanal Laive x kg,S/ 29.84 x kg,metro,REFRESCO ENVASADO (FLUIDO),2024-12-06 19:41:10.302651
Detergente en Polvo Sapolio Aros de Poder Fresco Limón 750g,S/ 8.50,metro,REFRESCO ENVASADO (FLUIDO),2024-12-06 19:41:10.302651
Chorizo Parrillero Fresco Braedt Paquete 500 g,S/ 15.21,metro,REFRESCO ENVASADO (FLUIDO),2024-12-06 19:41:10.302651
Queso Mozzarella Ligth Cuisine & Co Rallado 200g,S/ 14.90,metro,REFRESCO ENVASADO (FLUIDO),2024-12-06 19:41:10.302651
Queso Mozzarella Cuisine & Co Rallado 200g,S/ 14.90,metro,REFRESCO ENVASADO (FLUIDO),2024-12-06 19:41:10.302651
Bonito Entero Congelado x kg,S/ 6.90 x kg,metro,REFRESCO ENVASADO (FLUIDO),2024-12-06 19:41:10.302651
Detergente en Polvo Sapolio Aros de Poder Fresco Limón 4kg,S/ 33.00,metro,REFRESCO ENVASADO (FLUIDO),2024-12-06 19:41:10.302651
Queso Cottage Cuisine & Co 227g,S/ 11.50,metro,REFRESCO ENVASADO (FLUIDO),2024-12-06 19:41:10.302651
Queso Mozzarella en Tajadas Laive 180g,S/ 11.90,metro,REFRESCO ENVASADO (FLUIDO),2024-12-06 19:41:10.302651
Queso Fresco Pasteurizado Laive x kg,S/ 30.76 x kg,metro,REFRESCO ENVASADO (FLUIDO),2024-12-06 19:41:10.302651
Trucha Deshuesada x kg,S/ 30.90 x kg,metro,REFRESCO ENVASADO (FLUIDO),2024-12-06 19:41:10.302651
Jabón Líquido Antibacterial Aval Fresco Eucalipto 800ml,S/ 12.90,metro,REFRESCO ENVASADO (FLUIDO),2024-12-06 19:41:10.302651
Toallitas Desinfectantes Clorox Expert Aroma Fresco 60un,S/ 20.20,metro,REFRESCO ENVASADO (FLUIDO),2024-12-06 19:41:10.302651
Queso Tipo Mozzarella Oquendo Molde 250 g,S/ 12.60,metro,REFRESCO ENVASADO (FLUIDO),2024-12-06 19:41:10.302651
Queso Fresco Andino Plusa x kg,S/ 34.80 x kg,metro,REFRESCO ENVASADO (FLUIDO),2024-12-06 19:41:10.302651
Queso Mozzarella Ligth Cuisine & Co Bola 200g,S/ 13.60,metro,REFRESCO ENVASADO (FLUIDO),2024-12-06 19:41:10.302651
Higos Frescos Metro x kg,S/ 17.99 x kg,metro,REFRESCO ENVASADO (FLUIDO),2024-12-06 19:41:10.302651
Queso Mozzarella Cuisine & Co Bola 200g,S/ 13.60,metro,REFRESCO ENVASADO (FLUIDO),2024-12-06 19:41:10.302651
Queso Fresco Cuisine & Co x kg,S/ 30.00 x kg,metro,REFRESCO ENVASADO (FLUIDO),2024-12-06 19:41:10.302651
Queso Ricotta Duman 250g,S/ 9.30,metro,REFRESCO ENVASADO (FLUIDO),2024-12-06 19:41:10.302651
Pejerrey Limpio x kg,S/ 31.50 x kg,metro,REFRESCO ENVASADO (FLUIDO),2024-12-06 19:41:10.302651
Queso Fresco Light Laive Sbelt x kg,S/ 30.80 x kg,metro,REFRESCO ENVASADO (FLUIDO),2024-12-06 19:41:10.302651
Queso Fresco De Vaca Light Duman x kg,S/ 50.32 x kg,metro,REFRESCO ENVASADO (FLUIDO),2024-12-06 19:41:10.302651
Trucha Entera Eviscerada Cuisine & Co 700g,S/ 22.90,metro,REFRESCO ENVASADO (FLUIDO),2024-12-06 19:41:10.302651
Queso Mozzarella Cuisine & Co Tajadas 150g,S/ 9.90,metro,REFRESCO ENVASADO (FLUIDO),2024-12-06 19:41:10.302651
Jabón Líquido Antibacterial Aval Fresco Eucalipto 400ml,S/ 10.60,metro,REFRESCO ENVASADO (FLUIDO),2024-12-06 19:41:10.302651
Queso Cottage Delice 227g,S/ 13.20,metro,REFRESCO ENVASADO (FLUIDO),2024-12-06 19:41:10.302651
Queso Mozzarella Gloria en Tajadas 180g,S/ 11.60,metro,REFRESCO ENVASADO (FLUIDO),2024-12-06 19:41:10.302651
Pack Nivea Luminous 630 Anti Manchas: Sérum 30ml + Fluido 40ml,S/ 113.28,metro,REFRESCO ENVASADO (FLUIDO),2024-12-06 19:41:10.302651
Queso Fresco Ecologic 400g,S/ 16.56,metro,REFRESCO ENVASADO (FLUIDO),2024-12-06 19:41:10.302651
Romero Fresco Ecologic 30g,S/ 3.30,metro,REFRESCO ENVASADO (FLUIDO),2024-12-06 19:41:10.302651
Queso Mozzarella Especial Duman Rallado 200g,S/ 12.50,metro,REFRESCO ENVASADO (FLUIDO),2024-12-06 19:41:10.302651
Queso Fresco de Cabra Duman x Kg,S/ 77.52 x kg,metro,REFRESCO ENVASADO (FLUIDO),2024-12-06 19:41:10.302651
Jabón Líquido Antibacterial Aval Fresco Eucalipto 1L,S/ 15.90,metro,REFRESCO ENVASADO (FLUIDO),2024-12-06 19:41:10.302651
Tequeños Rellenos con Queso Fresco Cuisine & Co 12un.,S/ 16.99,metro,REFRESCO ENVASADO (FLUIDO),2024-12-06 19:41:10.302651
Queso Fresco Light Cuisine & Co x kg,S/ 29.20 x kg,metro,REFRESCO ENVASADO (FLUIDO),2024-12-06 19:41:10.302651
Queso Mozzarella Delice Bocconcini Fior di Latte 530g,S/ 18.20,metro,REFRESCO ENVASADO (FLUIDO),2024-12-06 19:41:10.302651
Queso Mozzarella Milkunz x kg,S/ 58.50 x kg,metro,REFRESCO ENVASADO (FLUIDO),2024-12-06 19:41:10.302651
Queso Mozzarella Duman 250g,S/ 14.20,metro,REFRESCO ENVASADO (FLUIDO),2024-12-06 19:41:10.302651
Palitos de Queso Mozzarella Delice 180g,S/ 16.40,metro,REFRESCO ENVASADO (FLUIDO),2024-12-06 19:41:10.302651
Queso Mozzarella Braedt x kg,S/ 63.90 x kg,metro,REFRESCO ENVASADO (FLUIDO),2024-12-06 19:41:10.302651
Jurel Entero,S/ 15.50 x kg,metro,REFRESCO ENVASADO (FLUIDO),2024-12-06 19:41:10.302651
Dátiles Frescos El Dátil Bandeja 150 gr,S/ 10.59,metro,REFRESCO ENVASADO (FLUIDO),2024-12-06 19:41:10.302651
Queso Bocconcini Mini Fior di Latte Duman Doypack 125 g,S/ 12.70,metro,REFRESCO ENVASADO (FLUIDO),2024-12-06 19:41:10.302651
Tollo de Leche Entero,S/ 21.90 x kg,metro,REFRESCO ENVASADO (FLUIDO),2024-12-06 19:41:10.302651
Cabrilla Entera,S/ 20.00 x kg,metro,REFRESCO ENVASADO (FLUIDO),2024-12-06 19:41:10.302651
Tipo Mozzarella Delichizz 250g,S/ 10.80,metro,REFRESCO ENVASADO (FLUIDO),2024-12-06 19:41:10.302651
