description,price,website,search_term,scrape_timestamp
Maíz Pop Corn Costeño 500g,S/ 4.00,metro,MAÍZ SECO CANCHA,2024-12-06 17:26:34.865856
Maíz Morado Metro x kg,S/ 9.79 x kg,metro,MAÍZ SECO CANCHA,2024-12-06 17:26:34.865856
Maíz Pop Corn Cuisine & Co 500g,S/ 3.50,metro,MAÍZ SECO CANCHA,2024-12-06 17:26:34.865856
Maíz Pop Corn Bolsa 350 g,S/ 3.80,metro,MAÍZ SECO CANCHA,2024-12-06 17:26:34.865856
Maíz Pop Corn Máxima 500g,S/ 4.30,metro,MAÍZ SECO CANCHA,2024-12-06 17:26:34.865856
Maíz Dulce en Granos Fruto de Oro 425g,S/ 6.90,metro,MAÍZ SECO CANCHA,2024-12-06 17:26:34.865856
Maíz Gigante Original Inka Corn Doypack 500 g,S/ 24.50,metro,MAÍZ SECO CANCHA,2024-12-06 17:26:34.865856
Cancha Chulpi Salada Cuisine & Co Bolsa 100 g,S/ 3.90,metro,MAÍZ SECO CANCHA,2024-12-06 17:26:34.865856
Maíz con Miel Vita Pluss Bolsa 140 g,S/ 3.90,metro,MAÍZ SECO CANCHA,2024-12-06 17:26:34.865856
Cancha Chulpi Villa Natura 150g,S/ 7.90,metro,MAÍZ SECO CANCHA,2024-12-06 17:26:34.865856
Maíz Gigante Inka Corn Original 100g,S/ 5.99,metro,MAÍZ SECO CANCHA,2024-12-06 17:26:34.865856
Maíz Pop Corn Tesoro Del Campo Bolsa 500 g,S/ 4.95,metro,MAÍZ SECO CANCHA,2024-12-06 17:26:34.865856
Maíz Pop Corn Valle Norte Bolsa 500 g,S/ 5.80,metro,MAÍZ SECO CANCHA,2024-12-06 17:26:34.865856
Maíz Atómico Andino con Maca Forte Golpe 125g,S/ 3.70,metro,MAÍZ SECO CANCHA,2024-12-06 17:26:34.865856
Maíz Chulpi Desgranado Kuski Bolsa 425 g,S/ 14.90,metro,MAÍZ SECO CANCHA,2024-12-06 17:26:34.865856
Seco de Res con Frejoles Nadú Criollo Bandeja 390 gr,S/ 14.90,metro,MAÍZ SECO CANCHA,2024-12-06 17:26:34.865856
Seco de Pollo con Arroz Blanco Cuisine & Co 400g,S/ 10.56,metro,MAÍZ SECO CANCHA,2024-12-06 17:26:34.865856
Seco de Res con Arroz Blanco Cuisine & Co 400g,S/ 13.90,metro,MAÍZ SECO CANCHA,2024-12-06 17:26:34.865856
Maiz Cuzco Frito y Salado Cuisine&Co Bolsa 100 g,S/ 4.70,metro,MAÍZ SECO CANCHA,2024-12-06 17:26:34.865856
Maiz Pop Corn Paisana Bolsa 500 g,S/ 4.40,metro,MAÍZ SECO CANCHA,2024-12-06 17:26:34.865856
Maiz Gigante con Chocolate Inka Corn 100g,S/ 11.90,metro,MAÍZ SECO CANCHA,2024-12-06 17:26:34.865856
Alimento para Perros Adultos Ricocan Mediano Grande Cordero 15kg,S/ 109.90,metro,MAÍZ SECO CANCHA,2024-12-06 17:26:34.865856
Alimento para Gatitos Cat Chow Esterilizado 8 kg,S/ 116.50,metro,MAÍZ SECO CANCHA,2024-12-06 17:26:34.865856
Alimento Dog Chow para Perros Adultos Tamaño Mediano 15kg,S/ 164.90,metro,MAÍZ SECO CANCHA,2024-12-06 17:26:34.865856
Durazno en Mitades Metro Lata 820g,S/ 5.76,metro,MAÍZ SECO CANCHA,2024-12-06 17:26:34.865856
Ricocan Alimento para Perros Adultos Raza Pequeña Cordero y Cereales Bolsa 15 Kg,S/ 109.90,metro,MAÍZ SECO CANCHA,2024-12-06 17:26:34.865856
Duraznos en Almíbar Cuisine & Co 820g,S/ 6.00,metro,MAÍZ SECO CANCHA,2024-12-06 17:26:34.865856
Alimento para Gatos Adultos Cat Chow Delimix 8kg,S/ 116.50,metro,MAÍZ SECO CANCHA,2024-12-06 17:26:34.865856
Ricocat Alimento para Gatos Adultos Esterilizados Bolsa 9 Kg,S/ 89.90,metro,MAÍZ SECO CANCHA,2024-12-06 17:26:34.865856
Ricocat Alimento para Gatos Adultos Festival de Sabores Bolsa 9 Kg,S/ 89.90,metro,MAÍZ SECO CANCHA,2024-12-06 17:26:34.865856
Frutos de Secos Cocktail Premium Villa Natura 150g,S/ 8.90,metro,MAÍZ SECO CANCHA,2024-12-06 17:26:34.865856
Galletas de Maíz Horneadas Salmas 144g,S/ 8.50,metro,MAÍZ SECO CANCHA,2024-12-06 17:26:34.865856
Duraznos en Almíbar Dos Caballos 820g,S/ 9.20,metro,MAÍZ SECO CANCHA,2024-12-06 17:26:34.865856
Ricocan Adulto Multi Todas las Razas 15kg,S/ 109.90,metro,MAÍZ SECO CANCHA,2024-12-06 17:26:34.865856
Alimento para Perros Adultos Mimaskot Cordero Medianos y Grandes 15kg,S/ 97.90,metro,MAÍZ SECO CANCHA,2024-12-06 17:26:34.865856
"Ricocat Alimento para Gatos Adultos Pollo, Sardina y Salmón 9kg",S/ 89.90,metro,MAÍZ SECO CANCHA,2024-12-06 17:26:34.865856
Alimento para Perros Adultos Mimaskot Carnes Medianos y Grandes 15kg,S/ 97.90,metro,MAÍZ SECO CANCHA,2024-12-06 17:26:34.865856
Hojuelas de Maíz Kellogg's Corn Flakes 410g,S/ 13.00,metro,MAÍZ SECO CANCHA,2024-12-06 17:26:34.865856
Aceite de Canola Cuisine & Co Botella 1 lt,S/ 11.90,metro,MAÍZ SECO CANCHA,2024-12-06 17:26:34.865856
Galletas de Maíz Horneadas Sin Gluten Salmas Sanissimo Caja 360 g,S/ 22.90,metro,MAÍZ SECO CANCHA,2024-12-06 17:26:34.865856
Alimento para Perros Dog Chow Longevidad 8kg,S/ 103.90,metro,MAÍZ SECO CANCHA,2024-12-06 17:26:34.865856
Pasas Morenas Cuisine&Co 150g,S/ 4.50,metro,MAÍZ SECO CANCHA,2024-12-06 17:26:34.865856
Vino Tinto Santiago Queirolo Borgoña Semi Seco Pack 2 Botellas 750 ml,S/ 30.50,metro,MAÍZ SECO CANCHA,2024-12-06 17:26:34.865856
Premium Cocktail Sin Maní Original Vallealto 150g,S/ 10.80,metro,MAÍZ SECO CANCHA,2024-12-06 17:26:34.865856
Frutos de Secos Cocktail Premium Villa Natura 250g,S/ 14.90,metro,MAÍZ SECO CANCHA,2024-12-06 17:26:34.865856
Ricocan Alimento para Perros Adultos Edad Avanzada Bolsa 15 Kg,S/ 109.90,metro,MAÍZ SECO CANCHA,2024-12-06 17:26:34.865856
Alimento Seco Dog Chow Cachorro Medianos y Grandes 15Kg,S/ 170.00,metro,MAÍZ SECO CANCHA,2024-12-06 17:26:34.865856
Ricocat Cachorro Carne Pescado Leche 9Kg,S/ 89.90,metro,MAÍZ SECO CANCHA,2024-12-06 17:26:34.865856
Alimento para Gatos Adultos Selección Especial Bolsa 7.5 Kg,S/ 110.90,metro,MAÍZ SECO CANCHA,2024-12-06 17:26:34.865856
Cocktail de Frutas en Almíbar Cuisine & Co Lata 820 gr,S/ 7.12,metro,MAÍZ SECO CANCHA,2024-12-06 17:26:34.865856
Mix de Nueces y Frutas Cuisine&Co Pote 200 g,S/ 11.20,metro,MAÍZ SECO CANCHA,2024-12-06 17:26:34.865856
Alimento para Perros Mimaskot Adultos Raza Pequeña 15kg,S/ 97.90,metro,MAÍZ SECO CANCHA,2024-12-06 17:26:34.865856
Aceite Girasol Huerto Alamein 900ml,S/ 12.80,metro,MAÍZ SECO CANCHA,2024-12-06 17:26:34.865856
Twelvepack Galletas de Maíz Salmas Horneadas 18g,S/ 14.90,metro,MAÍZ SECO CANCHA,2024-12-06 17:26:34.865856
Nueces Peladas Cuisine & Co 90g,S/ 9.20,metro,MAÍZ SECO CANCHA,2024-12-06 17:26:34.865856
Almendras Cuisine&Co Pote 100 g,S/ 8.90,metro,MAÍZ SECO CANCHA,2024-12-06 17:26:34.865856
Pecana Pelada Villa Natura 60g,S/ 6.90,metro,MAÍZ SECO CANCHA,2024-12-06 17:26:34.865856
Maní Frito Salado x kg,S/ 32.00 x kg,metro,MAÍZ SECO CANCHA,2024-12-06 17:26:34.865856
Pasas Morenas x kg,S/ 27.00 x kg,metro,MAÍZ SECO CANCHA,2024-12-06 17:26:34.865856
Alimento Seco para Gatos Friskies Sensaciones Marinas 7.5kg,S/ 95.00,metro,MAÍZ SECO CANCHA,2024-12-06 17:26:34.865856
Alimento para Perros Dog Chow Control de Peso 8kg,S/ 103.90,metro,MAÍZ SECO CANCHA,2024-12-06 17:26:34.865856
Alimento para Gatos Esterilizados Bolsa 3 kg,S/ 65.90,metro,MAÍZ SECO CANCHA,2024-12-06 17:26:34.865856
Alimento para Perros Adulto Pet's Fun Cereales y Carne 15kg,S/ 84.90,metro,MAÍZ SECO CANCHA,2024-12-06 17:26:34.865856
Cereal de Maíz Corn Flakes 405g,S/ 13.90,metro,MAÍZ SECO CANCHA,2024-12-06 17:26:34.865856
Pecanas Peladas Cuisine&Co Pote 100 g,S/ 13.70,metro,MAÍZ SECO CANCHA,2024-12-06 17:26:34.865856
Piñas en Rodajas Cuisine & Co 565g,S/ 5.52,metro,MAÍZ SECO CANCHA,2024-12-06 17:26:34.865856
Vino Tinto Borgoña Queirolo Semi Seco Botella 750ml,S/ 15.50,metro,MAÍZ SECO CANCHA,2024-12-06 17:26:34.865856
Ricocat Adulto Atún Sardina Trucha 9Kg,S/ 89.90,metro,MAÍZ SECO CANCHA,2024-12-06 17:26:34.865856
Aceite de Girasol Mucho Gussto 900ml,S/ 7.90,metro,MAÍZ SECO CANCHA,2024-12-06 17:26:34.865856
Maní Salado Cuisine & Co 200g,S/ 6.60,metro,MAÍZ SECO CANCHA,2024-12-06 17:26:34.865856
Ricocan Alimento para Perros Cachorros Raza Pequeña Carne y Leche Bolsa 15 Kg,S/ 109.90,metro,MAÍZ SECO CANCHA,2024-12-06 17:26:34.865856
Vino Rosé Blend Gran Reserva Tabernero Semi Seco Botella 750ml,S/ 16.50,metro,MAÍZ SECO CANCHA,2024-12-06 17:26:34.865856
Berry Crunch Original Vallealto 250g,S/ 10.20,metro,MAÍZ SECO CANCHA,2024-12-06 17:26:34.865856
Ricocan Alimento para Perros Cachorros Raza Mediana / Grande Carne y Leche Bolsa 15 Kg,S/ 109.90,metro,MAÍZ SECO CANCHA,2024-12-06 17:26:34.865856
Ricocan Alimento para Perros Adultos Raza Pequeña Cordero y Cereales Bolsa 3 Kg,S/ 28.50,metro,MAÍZ SECO CANCHA,2024-12-06 17:26:34.865856
Espumante Semi Seco Tabernero Especial Botella 750ml,S/ 14.90,metro,MAÍZ SECO CANCHA,2024-12-06 17:26:34.865856
Alimento para Gatos Adultos Pescado Bolsa 8 Kg,S/ 116.50,metro,MAÍZ SECO CANCHA,2024-12-06 17:26:34.865856
Galletas de Maíz Horneadas Salmas Granos y Semillas 126g,S/ 8.50,metro,MAÍZ SECO CANCHA,2024-12-06 17:26:34.865856
Alimento para Gatos Esterilizados Purina One Pollo y Salmón 2kg,S/ 74.10,metro,MAÍZ SECO CANCHA,2024-12-06 17:26:34.865856
Alimento Seco Zeus adulto 25kg,S/ 107.90,metro,MAÍZ SECO CANCHA,2024-12-06 17:26:34.865856
Tortillas de Maíz Saniito 12un,S/ 10.60,metro,MAÍZ SECO CANCHA,2024-12-06 17:26:34.865856
Maní Recubierto Granuts Kraks Oriental 180g,S/ 6.50,metro,MAÍZ SECO CANCHA,2024-12-06 17:26:34.865856
Cocktail de Nueces Villa Natura 250g,S/ 11.90,metro,MAÍZ SECO CANCHA,2024-12-06 17:26:34.865856
Duraznos en Almíbar Aconcagua 820g,S/ 8.72,metro,MAÍZ SECO CANCHA,2024-12-06 17:26:34.865856
Mix de Frutos Secos con Arándanos Granuts 180g,S/ 9.50,metro,MAÍZ SECO CANCHA,2024-12-06 17:26:34.865856
Almendras Naturales x kg,S/ 85.00 x kg,metro,MAÍZ SECO CANCHA,2024-12-06 17:26:34.865856
Pecana Pelada x kg,S/ 149.00 x kg,metro,MAÍZ SECO CANCHA,2024-12-06 17:26:34.865856
Alimento para Perros Adultos Mimaskot Estofado de Carne 15kg,S/ 97.90,metro,MAÍZ SECO CANCHA,2024-12-06 17:26:34.865856
Pasas Morenas Vallealto 150g,S/ 3.80,metro,MAÍZ SECO CANCHA,2024-12-06 17:26:34.865856
Hongo Seco Cuisine & Co 10g,S/ 2.90,metro,MAÍZ SECO CANCHA,2024-12-06 17:26:34.865856
Nutrican Alimento para Perros Adultos Nutrición Total Bolsa 15 Kg,S/ 82.90,metro,MAÍZ SECO CANCHA,2024-12-06 17:26:34.865856
Berry Mix Original Vallealto 150g,S/ 10.10,metro,MAÍZ SECO CANCHA,2024-12-06 17:26:34.865856
Alimento Purina One Esterilizados One Pollo Y Salmon 6kg,S/ 189.90,metro,MAÍZ SECO CANCHA,2024-12-06 17:26:34.865856
"Ricocat Alimento para Gatos Adultos Carne, Salmón y Leche Bolsa 9 Kg",S/ 89.90,metro,MAÍZ SECO CANCHA,2024-12-06 17:26:34.865856
Alimento para Perros Cachorros Mimaskot Carnes y Pollo Medianos y Grandes 15kg,S/ 97.90,metro,MAÍZ SECO CANCHA,2024-12-06 17:26:34.865856
Alimento Seco Mimaskot Adultos Sabor a Carnes 22 Kg,S/ 142.90,metro,MAÍZ SECO CANCHA,2024-12-06 17:26:34.865856
Vino Tinto Borgoña Viña Vieja Semi Seco Botella 2L,S/ 29.90,metro,MAÍZ SECO CANCHA,2024-12-06 17:26:34.865856
Galletas de Maíz Horneadas Salmitas Caja 80 g,S/ 5.20,metro,MAÍZ SECO CANCHA,2024-12-06 17:26:34.865856
Guindón Sin Pepa Cuisine & Co 150g,S/ 9.50,metro,MAÍZ SECO CANCHA,2024-12-06 17:26:34.865856
Alimento para Perros Adultos Tamaño Pequeño / Mini Bolsa 8 Kg,S/ 103.90,metro,MAÍZ SECO CANCHA,2024-12-06 17:26:34.865856
Mix de Frutos Secos con Arándanos Granuts 50g,S/ 3.70,metro,MAÍZ SECO CANCHA,2024-12-06 17:26:34.865856
DOG CHOW ALTA PROTEINA ADULTO 7.5KG,S/ 101.50,metro,MAÍZ SECO CANCHA,2024-12-06 17:26:34.865856
Palitos de Maíz Cheese Tris Cheetos 120g,S/ 5.20,metro,MAÍZ SECO CANCHA,2024-12-06 17:26:34.865856
Maní Tostado Villa Natura 200g,S/ 7.70,metro,MAÍZ SECO CANCHA,2024-12-06 17:26:34.865856
"Thor Alimento para Perros Adultos Carne, Hígado y Cereales Bolsa 10 Kg",S/ 58.00,metro,MAÍZ SECO CANCHA,2024-12-06 17:26:34.865856
Tortillas de Maíz Clásica Cuisine & Co Bolsa 150 g,S/ 4.90,metro,MAÍZ SECO CANCHA,2024-12-06 17:26:34.865856
Mix Up Vallealto 150g,S/ 7.40,metro,MAÍZ SECO CANCHA,2024-12-06 17:26:34.865856
Vino Tinto Borgoña Tabernero Semi Seco Botella 750ml,S/ 16.50,metro,MAÍZ SECO CANCHA,2024-12-06 17:26:34.865856
Cocktail de Nueces Original Vallealto 150g,S/ 7.80,metro,MAÍZ SECO CANCHA,2024-12-06 17:26:34.865856
Alimento Ricocat para Gatos Adultos Festival de Sabores 3 Kg,S/ 36.50,metro,MAÍZ SECO CANCHA,2024-12-06 17:26:34.865856
Alimentoen Seco Dog Chow Adulto Medianos y Grandes 8Kg,S/ 103.90,metro,MAÍZ SECO CANCHA,2024-12-06 17:26:34.865856
Supercat Adultos Delicias Pollo Carne Atún Sardina 9Kg,S/ 84.90,metro,MAÍZ SECO CANCHA,2024-12-06 17:26:34.865856
Semillas de Calabaza Cuisine&Co Pote 200 g,S/ 11.50,metro,MAÍZ SECO CANCHA,2024-12-06 17:26:34.865856
Habas Fritas Cuisine&Co Bolsa 100 g,S/ 5.50,metro,MAÍZ SECO CANCHA,2024-12-06 17:26:34.865856
Pasas Morenas Cuisine&Co Pote 250 g,S/ 7.90,metro,MAÍZ SECO CANCHA,2024-12-06 17:26:34.865856
Maní Karinto Crocante Salado 200g,S/ 7.99,metro,MAÍZ SECO CANCHA,2024-12-06 17:26:34.865856
Vino Tinto Blend Reserva Queirolo Magdalena Semi Seco Botella 750ml,S/ 15.50,metro,MAÍZ SECO CANCHA,2024-12-06 17:26:34.865856
Galletas de Maíz Horneadas Salmas Maíz Morado 126g,S/ 8.50,metro,MAÍZ SECO CANCHA,2024-12-06 17:26:34.865856
Aceite de Girasol Cuisine & Co 900ml,S/ 12.90,metro,MAÍZ SECO CANCHA,2024-12-06 17:26:34.865856
"Thor Alimento para Perros Adultos Carne, Hígado y Cereales Bolsa 25 Kg",S/ 133.50,metro,MAÍZ SECO CANCHA,2024-12-06 17:26:34.865856
