brand,description,price,website,search_term,scrape_timestamp
HUERTO DEL EDEN,Infusión de Hierba Luisa Huerto Del Edén con 100 filtrantes,S/ 7.90,tottus,HIERBAS PARA INFUSIONES,2024-12-04 13:59:18.030006
HUERTO DEL EDEN,Infusión de Hierba Luisa Huerto del Edén - 25 filtrantes,S/ 2.20,tottus,HIERBAS PARA INFUSIONES,2024-12-04 13:59:18.030006
WAWASANA,Infusión Hierbas Andinas Gripal 12 Filtrantes,S/ 4.90,tottus,HIERBAS PARA INFUSIONES,2024-12-04 13:59:18.030006
,Infusión Hierbas Natures Heart Surtipack Caja x 80 Sobres,S/ 36,tottus,HIERBAS PARA INFUSIONES,2024-12-04 13:59:18.030006
BIGELOW BENEFITS,Infusión Rose Mint 18 Unidades,S/ 21.20,tottus,HIERBAS PARA INFUSIONES,2024-12-04 13:59:18.030006
