description,price,website,search_term,scrape_timestamp
Limón x kg,S/ 2.99 x kg,metro,LIMÓN,2024-12-05 15:54:16.337263
Limón Sutil x kg,S/ 2.99 x kg,metro,LIMÓN,2024-12-05 15:54:16.337263
Limón Tahiti Metro x kg,S/ 3.99 x kg,metro,LIMÓN,2024-12-05 15:54:16.337263
Limón Sútil x kg,S/ 2.99 x kg,metro,LIMÓN,2024-12-05 15:54:16.337263
Limón Eureka x kg,S/ 5.30 x kg,metro,LIMÓN,2024-12-05 15:54:16.337263
Limón Tahíti x kg,S/ 4.19 x kg,metro,LIMÓN,2024-12-05 15:54:16.337263
Gaseosa Sprite Lima Limón Botella 3L,S/ 6.90,metro,LIMÓN,2024-12-05 15:54:16.337263
Gelatina Sabor Limón Diet Universal 19g,S/ 3.70,metro,LIMÓN,2024-12-05 15:54:16.337263
"Bebida De Naranja, Mandarina y Limón Citrus Punch Tampico Botella 3.78 lt",S/ 10.63,metro,LIMÓN,2024-12-05 15:54:16.337263
Gelatina Universal de Limón Sobre 130g,S/ 3.99,metro,LIMÓN,2024-12-05 15:54:16.337263
Sixpack Galleta con Crema Casino Pie de Limón 43g,S/ 5.00,metro,LIMÓN,2024-12-05 15:54:16.337263
"Bebida De Naranja, Mandarina y Limón Citrus Punch Tampico Botella 3L",S/ 7.10,metro,LIMÓN,2024-12-05 15:54:16.337263
Sixpack Bebida San Luis Sabor Limón Botella 625ml,S/ 11.00,metro,LIMÓN,2024-12-05 15:54:16.337263
Bebida de Agua San Luis Sabor Limón Botella 1.5L,S/ 3.90,metro,LIMÓN,2024-12-05 15:54:16.337263
Caramelos Arcor Limón Bolsa 390 g,S/ 10.20,metro,LIMÓN,2024-12-05 15:54:16.337263
Caramelos Ambrosoli Cocoroko Limón 350g,S/ 7.70,metro,LIMÓN,2024-12-05 15:54:16.337263
Gaseosa Sprite Lima Limón Botella 2.25L,S/ 6.40,metro,LIMÓN,2024-12-05 15:54:16.337263
Bebida en Polvo Clight Sin Calorías Sabor Limón 14g,S/ 2.30,metro,LIMÓN,2024-12-05 15:54:16.337263
Bebida de Té Verde Sabor Limón Leaf Tea Botella 400 ml,S/ 1.70,metro,LIMÓN,2024-12-05 15:54:16.337263
Bebida de Agua San Luis Sabor Limón Botella 625ml,S/ 2.20,metro,LIMÓN,2024-12-05 15:54:16.337263
Chicles Sin Azúcar Trident Splash Sabor Fresa y Limón 9un,S/ 3.60,metro,LIMÓN,2024-12-05 15:54:16.337263
Pack x2 Chicle Sin Azúcar Trident X Splash Sabor Fresa y Limón 44.6g,S/ 14.00,metro,LIMÓN,2024-12-05 15:54:16.337263
Sixpack Gaseosa Sprite Lima Limón Botella 500ml,S/ 13.50,metro,LIMÓN,2024-12-05 15:54:16.337263
Sixpack Agua Sin Gas Sabor Limón San Luis Botella 625ml,S/ 11.00,metro,LIMÓN,2024-12-05 15:54:16.337263
Sardinas Palacio del Oriente con Limón en Aceite de Oliva Lata 125 g,S/ 17.40,metro,LIMÓN,2024-12-05 15:54:16.337263
Gaseosa Sprite Lima Limón Botella 500ml,S/ 2.70,metro,LIMÓN,2024-12-05 15:54:16.337263
Galletas Sabor a Limón Colombina Casita de Navidad 50g Surtido,S/ 5.40,metro,LIMÓN,2024-12-05 15:54:16.337263
"Bebida De Naranja, Mandarina y Limón Citrus Punch Tampico Botella 1.87 lt",S/ 7.10,metro,LIMÓN,2024-12-05 15:54:16.337263
Bebida de Té Verde Sabor Limón Free Tea Botella 500ml,S/ 2.70,metro,LIMÓN,2024-12-05 15:54:16.337263
"Bebida De Naranja, Mandarina y Limón Citrus Punch Tampico Botella 500 ml",S/ 1.70,metro,LIMÓN,2024-12-05 15:54:16.337263
"Bebida De Naranja, Mandarina y Limón Citrus Punch Tampico Botella 1.5 lt",S/ 4.00,metro,LIMÓN,2024-12-05 15:54:16.337263
Exprimidor de Limón Polinplast,S/ 4.99,metro,LIMÓN,2024-12-05 15:54:16.337263
Gelatina en Polvo Royal Sabor Limón 160g,S/ 5.20,metro,LIMÓN,2024-12-05 15:54:16.337263
Té Verde con Limón Wawasana 50un,S/ 16.90,metro,LIMÓN,2024-12-05 15:54:16.337263
Exprimidor de Limón Ilko,S/ 5.90,metro,LIMÓN,2024-12-05 15:54:16.337263
Quita Esmalte Family Care Aroma Limón 70ml,S/ 5.90,metro,LIMÓN,2024-12-05 15:54:16.337263
Papas Nativas Fritas Tiyapuy Sabor Limón y Pimienta 142g,S/ 6.50,metro,LIMÓN,2024-12-05 15:54:16.337263
Alfajor de Pie de Limón Nestlé el Manjar 14un.,S/ 14.31,metro,LIMÓN,2024-12-05 15:54:16.337263
Fourpack Bebida Ready to Drink Corona Tropical Limón & Toronja Lata 355ml,S/ 19.90,metro,LIMÓN,2024-12-05 15:54:16.337263
Tripack Toallitas Humedas para Mascota Pet Care Limón 50un,S/ 23.70,metro,LIMÓN,2024-12-05 15:54:16.337263
Caramelos Cuisine & Co Candy Fun Sabor Limón 100un,S/ 5.90,metro,LIMÓN,2024-12-05 15:54:16.337263
Maní Oriental Granuts Kraks Sabor Limón 180g,S/ 6.50,metro,LIMÓN,2024-12-05 15:54:16.337263
Chicle Sin Azúcar Trident X Splash Fresa y Limón 23un,S/ 8.90,metro,LIMÓN,2024-12-05 15:54:16.337263
Pack x33 Suplemento Nutricional Efervescente Magnesol Sabor Limón 5g,S/ 36.50,metro,LIMÓN,2024-12-05 15:54:16.337263
Bebida Chilcano de Pisco Piscano Limón Botella 275ml,S/ 5.90,metro,LIMÓN,2024-12-05 15:54:16.337263
Sardinas al Limón en Aceite Vegetal Vigilante 120g,S/ 16.60,metro,LIMÓN,2024-12-05 15:54:16.337263
Pack Queirolo: Vino Borgoña 2un + Chilcano Limón,S/ 32.90,metro,LIMÓN,2024-12-05 15:54:16.337263
Helado Sabor Pye de Limón Dulce Pasión 650g,S/ 23.50,metro,LIMÓN,2024-12-05 15:54:16.337263
Bebida Ready to Drink Portón Chilcano Sabor Limón Lata 355ml,S/ 8.00,metro,LIMÓN,2024-12-05 15:54:16.337263
Tripack Bebida Instantánea Clight Sin Calorías Sabor Limón 14g,S/ 5.00,metro,LIMÓN,2024-12-05 15:54:16.337263
"Bebida De Naranja, Mandarina y Limón Citrus Punch Tampico Botella 600 ml",S/ 2.99,metro,LIMÓN,2024-12-05 15:54:16.337263
Té Frío Sabor Limón Don Simon 1.5L,S/ 8.99,metro,LIMÓN,2024-12-05 15:54:16.337263
Mat Pets Refrescante Limón 50cm,S/ 24.90,metro,LIMÓN,2024-12-05 15:54:16.337263
Tripack Doritos Dinamita Limón Taquero 80g,S/ 12.00,metro,LIMÓN,2024-12-05 15:54:16.337263
Doritos Dinamita Limón 35g,S/ 2.50,metro,LIMÓN,2024-12-05 15:54:16.337263
Exprimidor de Limón Krea Metal,S/ 4.40,metro,LIMÓN,2024-12-05 15:54:16.337263
Exprimidor de Limón Primavera,S/ 11.49,metro,LIMÓN,2024-12-05 15:54:16.337263
Twopack Gelatina en Polvo Royal Sabor Limón 160g,S/ 10.40,metro,LIMÓN,2024-12-05 15:54:16.337263
Exprimidor De Limón Metal,S/ 23.73,metro,LIMÓN,2024-12-05 15:54:16.337263
Sazonador Pimienta y Limón Badía Frasco 184 g,S/ 20.70,metro,LIMÓN,2024-12-05 15:54:16.337263
Kekes Sabor Limón Mr Brownie 8un,S/ 14.90,metro,LIMÓN,2024-12-05 15:54:16.337263
Pet Care Toallitas Húmedas para Mascotas Aroma Limón Paquete 50 unid,S/ 9.90,metro,LIMÓN,2024-12-05 15:54:16.337263
Bebida Chilcano de Pisco Piscano Limón Lata 473ml,S/ 6.90,metro,LIMÓN,2024-12-05 15:54:16.337263
Helado Momenti Gelato Pie de Limón 120ml,S/ 9.90,metro,LIMÓN,2024-12-05 15:54:16.337263
Infusión Limón y Jengibre Lipton 10un,S/ 11.80,metro,LIMÓN,2024-12-05 15:54:16.337263
Postre de Limón Personal,S/ 9.90,metro,LIMÓN,2024-12-05 15:54:16.337263
Helado Peziduri Sabor Pie de Limón 900ml,S/ 19.90,metro,LIMÓN,2024-12-05 15:54:16.337263
Quita Esmalte Family Care Aroma Limón 175ml,S/ 10.90,metro,LIMÓN,2024-12-05 15:54:16.337263
Infusión Sabor Limón y Frambuesa Twinings 10un.,S/ 19.20,metro,LIMÓN,2024-12-05 15:54:16.337263
Té Verde con Limón Wawasana 20un,S/ 9.90,metro,LIMÓN,2024-12-05 15:54:16.337263
Kombucha Veda Kión y Limón Botella 260ml,S/ 10.75,metro,LIMÓN,2024-12-05 15:54:16.337263
Chicle Sin Azúcar Trident X Splash Fresa y Limón 9un,S/ 3.50,metro,LIMÓN,2024-12-05 15:54:16.337263
Bebida Rehidratante Powerade Limón Botella 600ml,S/ 2.40,metro,LIMÓN,2024-12-05 15:54:16.337263
Pet Care Toallitas Húmedas para Mascotas Aroma Limón Paquete 10 unid,S/ 2.30,metro,LIMÓN,2024-12-05 15:54:16.337263
Bebida Ready to Drink Queirolo Chilcano de Pisco Limón Botella 275ml,S/ 6.90,metro,LIMÓN,2024-12-05 15:54:16.337263
Sour de Limón Santiago Queirolo Botella 700ml,S/ 19.90,metro,LIMÓN,2024-12-05 15:54:16.337263
Bebida Ready to Drink Tabernero Sour Limón Botella 700ml,S/ 19.90,metro,LIMÓN,2024-12-05 15:54:16.337263
Bebida Ready to Drink Piscano Sour Sabor Limón Botella 700ml,S/ 24.50,metro,LIMÓN,2024-12-05 15:54:16.337263
Set Jarra y Exprimidor Basa de Limón Top 2.8L,S/ 14.90,metro,LIMÓN,2024-12-05 15:54:16.337263
Pack Doritos Dinamita: Flamin Hot 80g + Limón Taquero 80g,S/ 8.50,metro,LIMÓN,2024-12-05 15:54:16.337263
Cóctel Montesierpe Sour de Limón Lata 473 ml,S/ 10.50,metro,LIMÓN,2024-12-05 15:54:16.337263
Ron Blanco Bacardí Limón Botella 750ml,S/ 54.90,metro,LIMÓN,2024-12-05 15:54:16.337263
Pie de Limón Jar Momenti 120g,S/ 17.90,metro,LIMÓN,2024-12-05 15:54:16.337263
Ron Saborizado Cartavio Limón Botella 750ml,S/ 25.90,metro,LIMÓN,2024-12-05 15:54:16.337263
Bebida Ready to Drink Chilcano Bar Limón Botella 275ml,S/ 5.90,metro,LIMÓN,2024-12-05 15:54:16.337263
Pie de Limón Denky,S/ 35.90,metro,LIMÓN,2024-12-05 15:54:16.337263
Helado Momenti Gelato Pie de Limón 500ml,S/ 32.90,metro,LIMÓN,2024-12-05 15:54:16.337263
Teja de Limón Helena 30g,S/ 5.99,metro,LIMÓN,2024-12-05 15:54:16.337263
Exprimidor de Limón Plástico,S/ 13.93,metro,LIMÓN,2024-12-05 15:54:16.337263
Bebida Ready to Drink Chilcano Bar Limón Lata 310ml,S/ 7.50,metro,LIMÓN,2024-12-05 15:54:16.337263
Helado Pye de Limón Dulce Pasión 5L,S/ 99.90,metro,LIMÓN,2024-12-05 15:54:16.337263
Exprimidor de Limón Basa Surtido,S/ 7.99,metro,LIMÓN,2024-12-05 15:54:16.337263
Papel de Seda Escarchado 50 x 70cm Benji 5un. Verde Limón,S/ 4.90,metro,LIMÓN,2024-12-05 15:54:16.337263
Folder Artesco Doble Tapa Oficio Verde Limón,S/ 6.90,metro,LIMÓN,2024-12-05 15:54:16.337263
Vinifan Folder Doble Tapa A4 Verde Limón,S/ 6.90,metro,LIMÓN,2024-12-05 15:54:16.337263
Folder Doble Tapa Oficio Vinifan Verde Limón,S/ 6.90,metro,LIMÓN,2024-12-05 15:54:16.337263
Piscano Zero Limón,S/ 5.90,metro,LIMÓN,2024-12-05 15:54:16.337263
Twopack Doritos Dinamita Limón Taquero 80g,S/ 8.50,metro,LIMÓN,2024-12-05 15:54:16.337263
Free Tea Limon Light Six Pack Botella 450 ml c u,S/ 12.90,metro,LIMÓN,2024-12-05 15:54:16.337263
YOG. GRIEGO PIE DE LIMON LAIVE VASO 115G,S/ 2.00,metro,LIMÓN,2024-12-05 15:54:16.337263
Té Negro Free Tea Limon Botella 500 ml,S/ 2.70,metro,LIMÓN,2024-12-05 15:54:16.337263
Free Tea Limon Light Frasco Vidrio 450 ml,S/ 2.70,metro,LIMÓN,2024-12-05 15:54:16.337263
Free Tea Limon Frasco Vidrio 450 ml,S/ 2.70,metro,LIMÓN,2024-12-05 15:54:16.337263
Free Tea Limon Six Pack Botella 450 ml c u,S/ 12.90,metro,LIMÓN,2024-12-05 15:54:16.337263
Marshmellows Mr. Mallo Limones Bolsa 100 g,S/ 2.90,metro,LIMÓN,2024-12-05 15:54:16.337263
Exprimidor de Limon Krea Metal,S/ 17.49,metro,LIMÓN,2024-12-05 15:54:16.337263
Exprimidor Krea de Limones Ristras,S/ 5.80,metro,LIMÓN,2024-12-05 15:54:16.337263
Agua Socosani Saborizada Limon Botella 500 ml,S/ 1.99,metro,LIMÓN,2024-12-05 15:54:16.337263
Exprimidor de Limones Betty Crocker,S/ 7.20,metro,LIMÓN,2024-12-05 15:54:16.337263
Organizador para Vegetales Limon Bynd,S/ 8.39,metro,LIMÓN,2024-12-05 15:54:16.337263
Lavavajillas Líquido Home Care Limón 4L,S/ 21.90,metro,LIMÓN,2024-12-05 15:54:16.337263
Detergente en Polvo Ace Limón 4kg,S/ 44.90,metro,LIMÓN,2024-12-05 15:54:16.337263
Lavavajillas Líquido Ayudín Limón y Sábila 1.2L,S/ 18.50,metro,LIMÓN,2024-12-05 15:54:16.337263
Twopack Detergente en Polvo Ace Limón 4kg,S/ 86.90,metro,LIMÓN,2024-12-05 15:54:16.337263
Lavavajillas Lima Limón Sapolio Frasco 1250 ml,S/ 13.90,metro,LIMÓN,2024-12-05 15:54:16.337263
Lavavajilla en Pasta Sapolio Limón 800g,S/ 6.00,metro,LIMÓN,2024-12-05 15:54:16.337263
Lavavajillas en Pasta Home Care Limón 800g,S/ 5.50,metro,LIMÓN,2024-12-05 15:54:16.337263
Lavavajillas Líquido Ayudín Limón y Sábila 640ml,S/ 12.90,metro,LIMÓN,2024-12-05 15:54:16.337263
Lavavajilla Líquido Home Care Limón 500ml,S/ 4.90,metro,LIMÓN,2024-12-05 15:54:16.337263
Jabón para Ropa Bolívar Limón 380g,S/ 5.70,metro,LIMÓN,2024-12-05 15:54:16.337263
