description,price,website,search_term,scrape_timestamp
Arándano Blueberry 500 g,S/ 14.99,metro,ARÁNDANOS,2024-12-05 16:02:35.456730
Arándano Intipa Foods Bandeja 150 g,S/ 4.70,metro,ARÁNDANOS,2024-12-05 16:02:35.456730
Arándano Hortifrut 300g,S/ 10.99,metro,ARÁNDANOS,2024-12-05 16:02:35.456730
Arándano Entero Congelado El Frutero 1kg,S/ 21.50,metro,ARÁNDANOS,2024-12-05 16:02:35.456730
"Arándanos, Fresas, Zarzamoras, Cerezas y Frambuesas Congeladas Berries Del Perú Bolsa 350 g",S/ 16.90,metro,ARÁNDANOS,2024-12-05 16:02:35.456730
"Arándanos, Zarzamoras y Frambuesas Congeladas Berries Del Perú Bolsa 350 g",S/ 16.29,metro,ARÁNDANOS,2024-12-05 16:02:35.456730
Arándanos Congelados Berries del Perú 1kg,S/ 18.45,metro,ARÁNDANOS,2024-12-05 16:02:35.456730
"Arándanos, Fresas, Zarzamoras y Cerezas Congeladas Berries Del Perú Bolsa 350 g",S/ 15.90,metro,ARÁNDANOS,2024-12-05 16:02:35.456730
Arándanos Congelados Fest 500g,S/ 7.49,metro,ARÁNDANOS,2024-12-05 16:02:35.456730
Arándanos Congelados Berries Del Perú Bolsa 350g,S/ 10.42,metro,ARÁNDANOS,2024-12-05 16:02:35.456730
Yogurt Griego Descremado con Arándano Danlac Frasco 900g,S/ 16.90,metro,ARÁNDANOS,2024-12-05 16:02:35.456730
Yogurt Griego Vakimu Arándano 1 Kg,S/ 13.44,metro,ARÁNDANOS,2024-12-05 16:02:35.456730
"Mix de Arándano, Fresa y Frambuesa El Frutero 1kg",S/ 15.74,metro,ARÁNDANOS,2024-12-05 16:02:35.456730
Yogurt Vakimu +Pro Arándano 500g,S/ 12.08,metro,ARÁNDANOS,2024-12-05 16:02:35.456730
Yogurt Batido con Trozos de Arándano Laive Griego 120g,S/ 2.50,metro,ARÁNDANOS,2024-12-05 16:02:35.456730
Barra de Cereal Cereal Bar Arándanos 12un,S/ 6.60,metro,ARÁNDANOS,2024-12-05 16:02:35.456730
Mix de Frutos Secos con Arándanos Granuts 180g,S/ 9.50,metro,ARÁNDANOS,2024-12-05 16:02:35.456730
Mix de Frutos Secos con Arándanos Granuts 50g,S/ 3.70,metro,ARÁNDANOS,2024-12-05 16:02:35.456730
Yogurt Vakimu +Pro Arándano 160g,S/ 4.88,metro,ARÁNDANOS,2024-12-05 16:02:35.456730
Yogurt Griego Tigo Con Arándano y Chía Balde 1 Kg,S/ 16.00,metro,ARÁNDANOS,2024-12-05 16:02:35.456730
"Jugo de Arándano, Uva y Manzana Bio Botella 300ml",S/ 3.60,metro,ARÁNDANOS,2024-12-05 16:02:35.456730
Yogurt Griego Descremado con Arándano Danlac Frasco 420g,S/ 11.90,metro,ARÁNDANOS,2024-12-05 16:02:35.456730
"Yogurt Griego con Arándano, Chía y Granola Tigo Premium 175g",S/ 6.30,metro,ARÁNDANOS,2024-12-05 16:02:35.456730
Yogurt Gloria Actibio Sabor Pitahaya Mango y Arándano Botella 950ml,S/ 6.70,metro,ARÁNDANOS,2024-12-05 16:02:35.456730
Mermelada de Arándano Light Casa Verde 180g,S/ 12.90,metro,ARÁNDANOS,2024-12-05 16:02:35.456730
Yogurt Bebible Tigo Griego Arándano con Chía 1.6kg,S/ 19.50,metro,ARÁNDANOS,2024-12-05 16:02:35.456730
Mermelada de Arándano y Mango Casa Verde 210g,S/ 9.00,metro,ARÁNDANOS,2024-12-05 16:02:35.456730
Yogurt Griego Vakimu Arándano 160g,S/ 4.40,metro,ARÁNDANOS,2024-12-05 16:02:35.456730
Galletas Baby Mum-Mum Arándano Caja 50 gr,S/ 13.95,metro,ARÁNDANOS,2024-12-05 16:02:35.456730
Bebida de Arándanos Light Ocean Spray Botella 1.89L,S/ 26.90,metro,ARÁNDANOS,2024-12-05 16:02:35.456730
Jabón Líquido Ballerina Yogurt Arándanos 750ml,S/ 9.90,metro,ARÁNDANOS,2024-12-05 16:02:35.456730
Yogurt Smoothie Arándano Chía Cuisine & Co Botella 980g,S/ 8.90,metro,ARÁNDANOS,2024-12-05 16:02:35.456730
Mermelada Diet Arándanos Sin Gluten Helios Frasco 280 g,S/ 22.90,metro,ARÁNDANOS,2024-12-05 16:02:35.456730
Jabón Líquido Family Care Arándano y Yogurt 400ml,S/ 8.50,metro,ARÁNDANOS,2024-12-05 16:02:35.456730
Puré de Frutas Orgánico Manzana y Arándano AMA Pouch 90 g,S/ 4.90,metro,ARÁNDANOS,2024-12-05 16:02:35.456730
Sixpack Bebida Pulp Arándano Uva Botella 250ml,S/ 7.90,metro,ARÁNDANOS,2024-12-05 16:02:35.456730
Bebida de Jugo de Arándano L'Onda Botella 500ml,S/ 5.30,metro,ARÁNDANOS,2024-12-05 16:02:35.456730
Yogurt Bebible Ecologic Sabor Arándano 1L,S/ 10.70,metro,ARÁNDANOS,2024-12-05 16:02:35.456730
Snack Rice Puff Baby Mum Mum Fresa y Arándanos 50g,S/ 15.90,metro,ARÁNDANOS,2024-12-05 16:02:35.456730
Agua de Piña con Arándanos Light Golden 1L,S/ 11.99,metro,ARÁNDANOS,2024-12-05 16:02:35.456730
Helado para Perros Sabor Arándanos y Sandía Yogy 100g,S/ 6.99,metro,ARÁNDANOS,2024-12-05 16:02:35.456730
Jugo de Arándanos Kedem Botella 1.89L,S/ 21.90,metro,ARÁNDANOS,2024-12-05 16:02:35.456730
Yogurt Griego Vakimu Arándanos y Granola 178g,S/ 5.28,metro,ARÁNDANOS,2024-12-05 16:02:35.456730
Yogurt Bebible Tigo Sabor Arándano con Chía Botella 800g,S/ 9.90,metro,ARÁNDANOS,2024-12-05 16:02:35.456730
Mezcla de Arándanos Cuisine&Co Pote 200 g,S/ 12.30,metro,ARÁNDANOS,2024-12-05 16:02:35.456730
Galletas de Chocolate Blanco y Arándanos Rojos Merba Bolsa 200 g,S/ 9.90,metro,ARÁNDANOS,2024-12-05 16:02:35.456730
Compota de Arándano con Quinua Casa Verde 120g,S/ 4.99,metro,ARÁNDANOS,2024-12-05 16:02:35.456730
Muesli con Arándanos Kellogg's 275g,S/ 25.90,metro,ARÁNDANOS,2024-12-05 16:02:35.456730
Agua de Piña con Arándanos Light Golden 485ml,S/ 6.49,metro,ARÁNDANOS,2024-12-05 16:02:35.456730
Pulpa de Arándano Congelada Natifut 250g,S/ 9.04,metro,ARÁNDANOS,2024-12-05 16:02:35.456730
Dulce Untable de Arándanos 200g,S/ 8.90,metro,ARÁNDANOS,2024-12-05 16:02:35.456730
Vinagre de Sidra de Manzana con Miel y Arándanos Botella 500 ml,S/ 19.90,metro,ARÁNDANOS,2024-12-05 16:02:35.456730
Tripack Agua de Piña Light con Arándanos Golden Botella 485ml,S/ 13.00,metro,ARÁNDANOS,2024-12-05 16:02:35.456730
Compota Smiley Kids Manzana + Plátano + Arándano 90g,S/ 4.90,metro,ARÁNDANOS,2024-12-05 16:02:35.456730
Yogurt Bebible Tigo Griego Arándano con Chía Botella 285g,S/ 4.10,metro,ARÁNDANOS,2024-12-05 16:02:35.456730
Barras de Quinua Qfoods Chocolate con Arándano 8un,S/ 22.10,metro,ARÁNDANOS,2024-12-05 16:02:35.456730
Yogurt Tipo Griego con Arándano & Chía Tigo 160g,S/ 4.20,metro,ARÁNDANOS,2024-12-05 16:02:35.456730
Yogurt Tipo Griego Tigo Arándano con Chía 500g,S/ 11.10,metro,ARÁNDANOS,2024-12-05 16:02:35.456730
Torta de Pistachos con Arándanos y Castañas Dulce Pasión,S/ 83.90,metro,ARÁNDANOS,2024-12-05 16:02:35.456730
Torta Naked de Arándanos 6 Porciones,S/ 21.90,metro,ARÁNDANOS,2024-12-05 16:02:35.456730
Tarta de Arándanos Personal,S/ 8.50,metro,ARÁNDANOS,2024-12-05 16:02:35.456730
Helado de Arándanos y Camu Camu Sanúa 473ml,S/ 31.10,metro,ARÁNDANOS,2024-12-05 16:02:35.456730
Macerado de Arándanos Carnaval Botella 750ml,S/ 54.90,metro,ARÁNDANOS,2024-12-05 16:02:35.456730
Torta Naked Arándanos 10 Porciones,S/ 49.90,metro,ARÁNDANOS,2024-12-05 16:02:35.456730
Galletas Gnawlers Salmón&arándanos,S/ 13.90,metro,ARÁNDANOS,2024-12-05 16:02:35.456730
Galletas Gnawlers Yogurt&arándanos,S/ 13.90,metro,ARÁNDANOS,2024-12-05 16:02:35.456730
Mermelada de Arandano Diet Crema & Nata frasco 330 g,S/ 33.90,metro,ARÁNDANOS,2024-12-05 16:02:35.456730
