brand,description,price,website,search_term,scrape_timestamp
Cheetos,Piqueos CHEETOS Queso Picante Bolsa 180g,S/ 4.20,vega,QUESO MANTECOSO,2024-12-05 12:26:51.467647
Pringles,Papas PRINGLES Queso Lata 109g,S/ 8.90,vega,QUESO MANTECOSO,2024-12-05 12:26:51.467647
Ritz,Galleta RITZ Sabor a Queso 30g Paquete 6u,S/ 5.20,vega,QUESO MANTECOSO,2024-12-05 12:26:51.467647
Chizito,CHIZITOS Fiesta Queso Bolsa 190 gr,S/ 6.50,vega,QUESO MANTECOSO,2024-12-05 12:26:51.467647
Doritos,Tortillas de Maíz DORITOS Queso Atrevido Bolsa 90g,S/ 4.20,vega,QUESO MANTECOSO,2024-12-05 12:26:51.467647
Cheetos,CHEETOS Sabot a Queso Horneados Bolsa 90 gr,S/ 4.20,vega,QUESO MANTECOSO,2024-12-05 12:26:51.467647
