brand,description,price,website,search_term,scrape_timestamp
Pringles,Papas PRINGLES Original Lata 104g,S/ 8.90,vega,PAPA COLOR,2024-12-05 13:02:23.141918
PAPI RICAS,Papas PAPI RICAS Sabor Picante Bolsa 70gr,S/ 2.80,vega,PAPA COLOR,2024-12-05 13:02:23.141918
Lays,Papas LAYS Cl치sicas Bolsa 210gr,S/ 7.00,vega,PAPA COLOR,2024-12-05 13:02:23.141918
Vega,Papas al Hilo VEGA Bolsa 150gr,S/ 5.20,vega,PAPA COLOR,2024-12-05 13:02:23.141918
Pringles,Papas PRINGLES Sour & Cream Lata 109g,S/ 8.90,vega,PAPA COLOR,2024-12-05 13:02:23.141918
Pringles,Papas PRINGLES Queso Lata 109g,S/ 8.90,vega,PAPA COLOR,2024-12-05 13:02:23.141918
Vega,Papa seca VEGA Bolsa 400g,S/ 4.30,vega,PAPA COLOR,2024-12-05 13:02:23.141918
PAPI RICAS,Papas PAPI RICAS Sabor Picante Bolsa 28gr,S/ 1.50,vega,PAPA COLOR,2024-12-05 13:02:23.141918
Lays,Papas LAYS Ondas Picantes Bolsa 140g,S/ 5.90,vega,PAPA COLOR,2024-12-05 13:02:23.141918
INKA CHIPS,Papas INKA CHIPS Sabor Jalape침o 135g,S/ 7.80,vega,PAPA COLOR,2024-12-05 13:02:23.141918
Lays,Papas LAYS Cl치sicas Bolsa 150g,S/ 5.80,vega,PAPA COLOR,2024-12-05 13:02:23.141918
RIKY TOK,Papas RIKY TOK Ondas Picantes Bolsa 180g,S/ 5.70,vega,PAPA COLOR,2024-12-05 13:02:23.141918
Timonel,Papa Seca TIMONEL Bolsa 400gr,S/ 5.10,vega,PAPA COLOR,2024-12-05 13:02:23.141918
RIKY TOK,Papas RIKY TOK Ondas Naturales Bolsa 30g,S/ 1.00,vega,PAPA COLOR,2024-12-05 13:02:23.141918
INKA CHIPS,Papas Fritas INKA CHIPS BBQ y Cebolla Bolsa 135g,S/ 7.80,vega,PAPA COLOR,2024-12-05 13:02:23.141918
RIKY TOK,Papas RIKY TOK Ondas Picantes Bolsa 30g,S/ 1.00,vega,PAPA COLOR,2024-12-05 13:02:23.141918
INKA CHIPS,Papas Fritas INKA CHIPS Bolsa 135g,S/ 7.80,vega,PAPA COLOR,2024-12-05 13:02:23.141918
PAPI RICAS,Papas PAPI RICAS Sabor Pollo a la Brasa Bolsa 70gr,S/ 2.80,vega,PAPA COLOR,2024-12-05 13:02:23.141918
PAPI RICAS,Papas PAPI RICAS Sabor Natural 70gr,S/ 2.80,vega,PAPA COLOR,2024-12-05 13:02:23.141918
Lays,Papas LAYS Cl치sicas Bolsa 38g,S/ 2.40,vega,PAPA COLOR,2024-12-05 13:02:23.141918
