description,price,website,search_term,scrape_timestamp
Goma en Barra Uhu Stic 21 gr,S/ 7.91,wong,GOMA DE MASCAR,2024-12-04 20:17:23.129384
UHU Goma en Barra Stic 40 g,S/ 13.20,wong,GOMA DE MASCAR,2024-12-04 20:17:23.129384
Vinifan Goma en Barra Forte 40 g,S/ 4.60,wong,GOMA DE MASCAR,2024-12-04 20:17:23.129384
Goma en Barra Vinifan Circular Naranja Forte 40g,S/ 3.90,wong,GOMA DE MASCAR,2024-12-04 20:17:23.129384
Goma Pegafan Pote 200 ml,S/ 3.30,wong,GOMA DE MASCAR,2024-12-04 20:17:23.129384
Goma en Barra Triangular Easy 25 gr,S/ 4.10,wong,GOMA DE MASCAR,2024-12-04 20:17:23.129384
Gomas Grissly Gusanos 80g,S/ 3.00,wong,GOMA DE MASCAR,2024-12-04 20:17:23.129384
Gomas Grissly Delfin 80g,S/ 3.00,wong,GOMA DE MASCAR,2024-12-04 20:17:23.129384
Goma en Barra Pegafan 36 gr,S/ 3.80,wong,GOMA DE MASCAR,2024-12-04 20:17:23.129384
Artesco Goma en Barra Stick Magic Tubo 25 g,S/ 5.20,wong,GOMA DE MASCAR,2024-12-04 20:17:23.129384
Goma Líquida Doble Aplicador Pilot,S/ 6.10,wong,GOMA DE MASCAR,2024-12-04 20:17:23.129384
Goma en Barra Vinifan Circular Pastel Forte 40g,S/ 3.90,wong,GOMA DE MASCAR,2024-12-04 20:17:23.129384
Goma en Barra Artesco Power Sticky 40g,S/ 5.00,wong,GOMA DE MASCAR,2024-12-04 20:17:23.129384
Artesco Goma en Barra Sticky Tubo 21 g,S/ 3.40,wong,GOMA DE MASCAR,2024-12-04 20:17:23.129384
Gomas Grissly Osos 80g,S/ 3.00,wong,GOMA DE MASCAR,2024-12-04 20:17:23.129384
GOMA PULPOS BOLSA 80G,S/ 4.90,wong,GOMA DE MASCAR,2024-12-04 20:17:23.129384
Goma Eva Adhesiva Fantasía Carpaccio 50x65cm Surtido,S/ 7.50,wong,GOMA DE MASCAR,2024-12-04 20:17:23.129384
Goma Artesco en Barra Sticky Neon 21gr Surtido,S/ 2.80,wong,GOMA DE MASCAR,2024-12-04 20:17:23.129384
Gomas Frutales Extreme 35 g,S/ 1.10,wong,GOMA DE MASCAR,2024-12-04 20:17:23.129384
Gomas Frutillas Ácidas 500 g,S/ 12.70,wong,GOMA DE MASCAR,2024-12-04 20:17:23.129384
Artesco Goma en Barra Sticky Tubo 40 g,S/ 4.60,wong,GOMA DE MASCAR,2024-12-04 20:17:23.129384
Artesco Goma en Barra Sticky Power Clear Tubo 21 g,S/ 4.40,wong,GOMA DE MASCAR,2024-12-04 20:17:23.129384
Goma Crayola Escarchada Bl 5 un.,S/ 9.40,wong,GOMA DE MASCAR,2024-12-04 20:17:23.129384
Gomas Fini San Valentín 75g Surtido,S/ 10.90,wong,GOMA DE MASCAR,2024-12-04 20:17:23.129384
Marshmallow con Cobertura Sabor Chocolate Olé Olé 50un,S/ 7.90,wong,GOMA DE MASCAR,2024-12-04 20:17:23.129384
Jarabe de Goma Cuisine & Co 750ml,S/ 14.90,wong,GOMA DE MASCAR,2024-12-04 20:17:23.129384
Gomitas Ambrosoli Frugel 430g,S/ 14.90,wong,GOMA DE MASCAR,2024-12-04 20:17:23.129384
Gomitas Ambrosoli Ambrosia Bolsa 480 g,S/ 12.20,wong,GOMA DE MASCAR,2024-12-04 20:17:23.129384
Marshmellows Mr. Mallo American BBQ Bolsa 250 g,S/ 4.90,wong,GOMA DE MASCAR,2024-12-04 20:17:23.129384
Jarabe de Goma Espumante Vargas Botella 750 ml,S/ 15.50,wong,GOMA DE MASCAR,2024-12-04 20:17:23.129384
Marshmellows Tropical Bolsa 255 g,S/ 13.30,wong,GOMA DE MASCAR,2024-12-04 20:17:23.129384
Olé Olé Festival de Sabores 45un,S/ 7.90,wong,GOMA DE MASCAR,2024-12-04 20:17:23.129384
Gomitas Ambrosito 90g,S/ 3.40,wong,GOMA DE MASCAR,2024-12-04 20:17:23.129384
Marshmellows Ambrosoli Mellows Bolsa 230 g,S/ 6.20,wong,GOMA DE MASCAR,2024-12-04 20:17:23.129384
Gomitas Masticables Sour Patch Kids 340g,S/ 29.90,wong,GOMA DE MASCAR,2024-12-04 20:17:23.129384
Gomitas Trolli Sour Glow Worms 100g,S/ 5.90,wong,GOMA DE MASCAR,2024-12-04 20:17:23.129384
Marshmallow Rocky Mountain Mini 150g,S/ 7.70,wong,GOMA DE MASCAR,2024-12-04 20:17:23.129384
Jarabe de Goma Vargas Chavalier750 ml,S/ 18.50,wong,GOMA DE MASCAR,2024-12-04 20:17:23.129384
Gomitas Ambrosoli Flipy 480g,S/ 11.50,wong,GOMA DE MASCAR,2024-12-04 20:17:23.129384
Gomitas Trolli Sharks 100g,S/ 5.90,wong,GOMA DE MASCAR,2024-12-04 20:17:23.129384
Jarabe de Goma Light Cuisine & Co Botella 750ml,S/ 14.90,wong,GOMA DE MASCAR,2024-12-04 20:17:23.129384
Gomitas Trolli Classic Bears 100g,S/ 5.90,wong,GOMA DE MASCAR,2024-12-04 20:17:23.129384
Marshmellows Tropical Mini Bolsa 100 g,S/ 6.70,wong,GOMA DE MASCAR,2024-12-04 20:17:23.129384
Chicle Sin Azúcar Menta Polar Wrigley's Extra Caja 15 unid,S/ 6.70,wong,GOMA DE MASCAR,2024-12-04 20:17:23.129384
Gomitas Ácidas Sabores Surtidos Fini Gusanos Ácidos 90g,S/ 4.90,wong,GOMA DE MASCAR,2024-12-04 20:17:23.129384
Marshmallows Cuisine & Co 283g,S/ 9.90,wong,GOMA DE MASCAR,2024-12-04 20:17:23.129384
Gomitas Masticables Surtidas Swedish Fish Mini Tropical 226g,S/ 19.90,wong,GOMA DE MASCAR,2024-12-04 20:17:23.129384
Gomitas Menta 2 Cerritos 150g,S/ 10.20,wong,GOMA DE MASCAR,2024-12-04 20:17:23.129384
Marshmellows Millows Unicornio 50un,S/ 10.70,wong,GOMA DE MASCAR,2024-12-04 20:17:23.129384
Pack Finca Rotondo: Gran Pisco + Jarabe de Goma + Shaker + Vaso,S/ 42.90,wong,GOMA DE MASCAR,2024-12-04 20:17:23.129384
Gomitas Trolli Octopus 100g,S/ 5.90,wong,GOMA DE MASCAR,2024-12-04 20:17:23.129384
Gomitas Mogul Extreme Sandía 80g,S/ 4.60,wong,GOMA DE MASCAR,2024-12-04 20:17:23.129384
Malvaviscos Bañados con Chocolate Conguitos 2 Cerritos Bolsa 200 gr,S/ 17.20,wong,GOMA DE MASCAR,2024-12-04 20:17:23.129384
Juguete Pets Fun Goma Hamburguesa,S/ 3.99,wong,GOMA DE MASCAR,2024-12-04 20:17:23.129384
Gomitas Frutales 2 Cerritos Bolsa 125 gr,S/ 10.20,wong,GOMA DE MASCAR,2024-12-04 20:17:23.129384
Marshmallows Millows Cilindro Bolsa 145 g,S/ 5.00,wong,GOMA DE MASCAR,2024-12-04 20:17:23.129384
Marshmellows Colombina Millows Navidad 145g,S/ 4.40,wong,GOMA DE MASCAR,2024-12-04 20:17:23.129384
Marshmellows Mr. Mallo Fresas Bolsa 100 g,S/ 2.90,wong,GOMA DE MASCAR,2024-12-04 20:17:23.129384
Plato Pet's Fun Goma y Acero Doble Nude 440ml,S/ 11.90,wong,GOMA DE MASCAR,2024-12-04 20:17:23.129384
Jarabe de Goma Espumante Burgos Botella 750 ml,S/ 17.90,wong,GOMA DE MASCAR,2024-12-04 20:17:23.129384
Marshmallow Millows Fresa Bolsa 290g,S/ 10.90,wong,GOMA DE MASCAR,2024-12-04 20:17:23.129384
Mix de Gomitas Trolli Gummi Lunch 77.5g,S/ 9.20,wong,GOMA DE MASCAR,2024-12-04 20:17:23.129384
Gomitas Sabor Fresa y Nata Fini Besos 90g,S/ 4.90,wong,GOMA DE MASCAR,2024-12-04 20:17:23.129384
Gomitas Fini Little Mix 165g,S/ 12.90,wong,GOMA DE MASCAR,2024-12-04 20:17:23.129384
Marshmellows Mr. Mallo Watermelons Bolsa 100 g,S/ 2.90,wong,GOMA DE MASCAR,2024-12-04 20:17:23.129384
Gomitas Amos 4D Frutas 90g,S/ 5.90,wong,GOMA DE MASCAR,2024-12-04 20:17:23.129384
Marshmallows Rocky Mountain Mega 340g,S/ 16.90,wong,GOMA DE MASCAR,2024-12-04 20:17:23.129384
Juguete Pets Fun Pelota Goma,S/ 8.90,wong,GOMA DE MASCAR,2024-12-04 20:17:23.129384
Gomitas Ambrosoli Ambrosito Ácido 90g,S/ 3.20,wong,GOMA DE MASCAR,2024-12-04 20:17:23.129384
Marshmallow Rocky Mountain Clásicos 150g,S/ 7.70,wong,GOMA DE MASCAR,2024-12-04 20:17:23.129384
Gomitas Ambrosoli Gusanos Ácidos 480g,S/ 11.50,wong,GOMA DE MASCAR,2024-12-04 20:17:23.129384
Gomitas Ambrosoli Caliptus Mix 90g,S/ 3.20,wong,GOMA DE MASCAR,2024-12-04 20:17:23.129384
Marshmellows Tropical 255g,S/ 13.30,wong,GOMA DE MASCAR,2024-12-04 20:17:23.129384
Gomitas Sabor Plátano Fini Bananitos 90g,S/ 4.90,wong,GOMA DE MASCAR,2024-12-04 20:17:23.129384
Gomitas Amos 4D Dinosaurios 90g,S/ 5.90,wong,GOMA DE MASCAR,2024-12-04 20:17:23.129384
Gomitas Grissly Aros Acid 78g,S/ 3.00,wong,GOMA DE MASCAR,2024-12-04 20:17:23.129384
Gomitas Sabores Surtidos Fini Ositos 90g,S/ 4.90,wong,GOMA DE MASCAR,2024-12-04 20:17:23.129384
Figura Strech Goma Stumble Guys 15cm,S/ 39.90,wong,GOMA DE MASCAR,2024-12-04 20:17:23.129384
Chicle Sin Azúcar Classic Bubble Wrigley's Extra Caja 15 unid,S/ 6.70,wong,GOMA DE MASCAR,2024-12-04 20:17:23.129384
Gomitas Ambrosoli Donas Play 70g,S/ 3.20,wong,GOMA DE MASCAR,2024-12-04 20:17:23.129384
Gomitas Masticables Swedish Fish Mini 340g,S/ 29.90,wong,GOMA DE MASCAR,2024-12-04 20:17:23.129384
Gomitas Sin Gluten Fruit Bowl Jelly Bean Bolsa 99 g,S/ 19.50,wong,GOMA DE MASCAR,2024-12-04 20:17:23.129384
Chicle Sabor Sandía Fini Sandía Ácida 80g,S/ 4.90,wong,GOMA DE MASCAR,2024-12-04 20:17:23.129384
Caja Sorpresa Arcor Halloween Sorpresa Dinos 100g,S/ 11.30,wong,GOMA DE MASCAR,2024-12-04 20:17:23.129384
Gomitas Amos 4D Bloques 90g,S/ 5.90,wong,GOMA DE MASCAR,2024-12-04 20:17:23.129384
Marshmellows Tropical Bolsa 100 g,S/ 6.70,wong,GOMA DE MASCAR,2024-12-04 20:17:23.129384
Jarabe de Goma Light Bizarro 500ml,S/ 15.90,wong,GOMA DE MASCAR,2024-12-04 20:17:23.129384
Marshmallow Rocky Mountain Clásicos 300g,S/ 14.90,wong,GOMA DE MASCAR,2024-12-04 20:17:23.129384
Cuchara de Goma Krea Helado,S/ 2.40,wong,GOMA DE MASCAR,2024-12-04 20:17:23.129384
Gomitas Mogul Extreme Tutti Frutti 80g,S/ 4.60,wong,GOMA DE MASCAR,2024-12-04 20:17:23.129384
Marshmallows Millows Margarita Bolsa 145 g,S/ 5.00,wong,GOMA DE MASCAR,2024-12-04 20:17:23.129384
Marshmellows Mr. Mallo Limones Bolsa 100 g,S/ 2.90,wong,GOMA DE MASCAR,2024-12-04 20:17:23.129384
Gomitas Fini Wild Strawberries 165g,S/ 12.90,wong,GOMA DE MASCAR,2024-12-04 20:17:23.129384
Marshmallow Rocky Mountain Mini Fruit 150g,S/ 7.70,wong,GOMA DE MASCAR,2024-12-04 20:17:23.129384
Gomitas Mogul Dientes 500g,S/ 14.00,wong,GOMA DE MASCAR,2024-12-04 20:17:23.129384
Regaliz Sabor Fresa y Nata Fini Tubos Ácidos 80g,S/ 4.90,wong,GOMA DE MASCAR,2024-12-04 20:17:23.129384
Marsmallows Sabor Vainilla Fini Trenza Tricolor 250g,S/ 13.40,wong,GOMA DE MASCAR,2024-12-04 20:17:23.129384
Juguete Pets Fun Goma Zeta,S/ 10.90,wong,GOMA DE MASCAR,2024-12-04 20:17:23.129384
Scotch Topes de Goma Transparentes 12un,S/ 15.90,wong,GOMA DE MASCAR,2024-12-04 20:17:23.129384
Marshmellows Fini Boo 250g,S/ 12.90,wong,GOMA DE MASCAR,2024-12-04 20:17:23.129384
Juguete Pet's Fun Goma Boomerang Tenis,S/ 11.00,wong,GOMA DE MASCAR,2024-12-04 20:17:23.129384
Gomitas Amos 4D Cupcakes 90g,S/ 5.90,wong,GOMA DE MASCAR,2024-12-04 20:17:23.129384
Gomitas Trolli Mini Burger 90g,S/ 9.80,wong,GOMA DE MASCAR,2024-12-04 20:17:23.129384
Juguete Pets Fun Goma Hueso Dental,S/ 8.90,wong,GOMA DE MASCAR,2024-12-04 20:17:23.129384
Marshmallows Millows Surtidos Bolsa 145 g,S/ 5.00,wong,GOMA DE MASCAR,2024-12-04 20:17:23.129384
Gomitas Amos 4D Ácidas Building Sticks 90g,S/ 5.90,wong,GOMA DE MASCAR,2024-12-04 20:17:23.129384
Marshmallows Millows Conejos Bolsa 145 g,S/ 5.00,wong,GOMA DE MASCAR,2024-12-04 20:17:23.129384
Regaliz Fini Cono Surtido 105g,S/ 11.90,wong,GOMA DE MASCAR,2024-12-04 20:17:23.129384
Paleta de Marshmallow Chin Chin Choco Paletón Navidad 10un,S/ 15.90,wong,GOMA DE MASCAR,2024-12-04 20:17:23.129384
Juguete Pets Fun Goma Café,S/ 8.90,wong,GOMA DE MASCAR,2024-12-04 20:17:23.129384
Gomitas Sabor Mora Fini Moras 90g,S/ 4.90,wong,GOMA DE MASCAR,2024-12-04 20:17:23.129384
Regaliz Sabor Fresa y Nata Fini Tubos 80g,S/ 4.90,wong,GOMA DE MASCAR,2024-12-04 20:17:23.129384
Gomitas Fini Red Sensation 165g,S/ 12.90,wong,GOMA DE MASCAR,2024-12-04 20:17:23.129384
Regaliz Sabor Frutas Silvestres y Nata Fini Tubos Ácidos 80g,S/ 4.90,wong,GOMA DE MASCAR,2024-12-04 20:17:23.129384
Juguete Pet's Fun Goma Donut,S/ 5.00,wong,GOMA DE MASCAR,2024-12-04 20:17:23.129384
Regaliz Sabor Uva Fini Tubos Ácidos 80g,S/ 4.90,wong,GOMA DE MASCAR,2024-12-04 20:17:23.129384
Plato Pet's Fun Goma y Acero Doble Celeste 440ml,S/ 11.90,wong,GOMA DE MASCAR,2024-12-04 20:17:23.129384
Gomitas Mogul Moras 80g,S/ 4.60,wong,GOMA DE MASCAR,2024-12-04 20:17:23.129384
Juguete Pets Fun Goma Pastel,S/ 10.90,wong,GOMA DE MASCAR,2024-12-04 20:17:23.129384
Marshmellows Mr. Mallo Manzanas Bolsa 100 g,S/ 2.90,wong,GOMA DE MASCAR,2024-12-04 20:17:23.129384
