description,price,website,search_term,scrape_timestamp
Morcilla La Charcutería de Lima 2un,S/ 15.40,wong,LIZA,2024-12-04 19:00:11.601935
Chorizo Artesanal con Miel de Maple La Charcutería de Lima 4un,S/ 33.90,wong,LIZA,2024-12-04 19:00:11.601935
Limas de madera para Uñas Limader Paquete 12 unidades,S/ 6.99,wong,LIZA,2024-12-04 19:00:11.601935
Pijama Navideña para Mujer Lima Basics Talla L,S/ 79.90,wong,LIZA,2024-12-04 19:00:11.601935
Pijama Navideña para Mujer Lima Basics Talla M,S/ 79.90,wong,LIZA,2024-12-04 19:00:11.601935
Lima en Bloque 4 Lados QVS Buffing,S/ 9.90,wong,LIZA,2024-12-04 19:00:11.601935
Pijama Navideña para Hombre Lima Basics Talla XL,S/ 79.90,wong,LIZA,2024-12-04 19:00:11.601935
Lima para Uñas de Cartón Manicure,S/ 5.30,wong,LIZA,2024-12-04 19:00:11.601935
Lima de Pedicure QVS Ceramic Stone,S/ 17.20,wong,LIZA,2024-12-04 19:00:11.601935
Ligas para Cabello Talla M Scünci Paquete 18 unid Negro,S/ 7.20,wong,LIZA,2024-12-04 19:00:11.601935
Pijama Navideña Infantil Lima Basics Talla 6,S/ 59.90,wong,LIZA,2024-12-04 19:00:11.601935
Mix Charcutero La Charcutería de Lima 6un,S/ 48.50,wong,LIZA,2024-12-04 19:00:11.601935
Chorizo Artesanal con Cerveza La Charcutería de Lima 4un,S/ 33.90,wong,LIZA,2024-12-04 19:00:11.601935
Pijama Navideña Infantil Lima Basics Talla 8,S/ 59.90,wong,LIZA,2024-12-04 19:00:11.601935
Pijama Navideña para Bebé Lima Basics Talla 24M,S/ 49.90,wong,LIZA,2024-12-04 19:00:11.601935
Sally Hansen Lima de Uñas Hard As Nails,S/ 10.20,wong,LIZA,2024-12-04 19:00:11.601935
Pijama Navideña para Mujer Lima Basics Talla S,S/ 79.90,wong,LIZA,2024-12-04 19:00:11.601935
Pijama Navideña Teens Lima Basics Talla 16,S/ 69.90,wong,LIZA,2024-12-04 19:00:11.601935
Lima 7 Pasos + Removedor de Cutículas Limader,S/ 9.50,wong,LIZA,2024-12-04 19:00:11.601935
Lima de Uñas Limader Agua Acolchada,S/ 5.30,wong,LIZA,2024-12-04 19:00:11.601935
Ligas para Cabello Talla M Scünci Paquete 18 unid Marrón,S/ 7.20,wong,LIZA,2024-12-04 19:00:11.601935
Lima QVS Compacto Saphire,S/ 9.90,wong,LIZA,2024-12-04 19:00:11.601935
Ligas Alleanza Caja 1/4 de Libra,S/ 4.40,wong,LIZA,2024-12-04 19:00:11.601935
Pijama Navideña Infantil Lima Basics Talla 4,S/ 59.90,wong,LIZA,2024-12-04 19:00:11.601935
Pijama Navideña Infantil Lima Basics Talla 2,S/ 59.90,wong,LIZA,2024-12-04 19:00:11.601935
Ligas para Cabello Goody 10un,S/ 6.10,wong,LIZA,2024-12-04 19:00:11.601935
Lima para Uñas de Metal Manicure,S/ 3.80,wong,LIZA,2024-12-04 19:00:11.601935
Bandana Navideña para Mascota Lima Basics Talla L,S/ 14.90,wong,LIZA,2024-12-04 19:00:11.601935
Lima Deshidratada Go Barman 25g,S/ 19.90,wong,LIZA,2024-12-04 19:00:11.601935
Ligas de Cabello Scunci Deportivas 14un,S/ 14.30,wong,LIZA,2024-12-04 19:00:11.601935
Limas de Uñas Limader 2 un,S/ 7.10,wong,LIZA,2024-12-04 19:00:11.601935
Lima de Uña QVS Sharpers 2 un,S/ 13.40,wong,LIZA,2024-12-04 19:00:11.601935
Chorizo Artesanal con Finas Hierbas La Charcutería de Lima 4un,S/ 33.90,wong,LIZA,2024-12-04 19:00:11.601935
Pijama Navideña Teens Lima Basics Talla 14,S/ 69.90,wong,LIZA,2024-12-04 19:00:11.601935
Pijama Navideña Teens Lima Basics Talla 10,S/ 69.90,wong,LIZA,2024-12-04 19:00:11.601935
Pijama Navideña para Mujer Lima Basics Talla XL,S/ 79.90,wong,LIZA,2024-12-04 19:00:11.601935
Pijama Navideña Teens Lima Basics Talla 12,S/ 69.90,wong,LIZA,2024-12-04 19:00:11.601935
Pijama Navideña para Bebé Lima Basics Talla 3M,S/ 49.90,wong,LIZA,2024-12-04 19:00:11.601935
Bandana Navideña para Mascota Lima Basics Talla S,S/ 14.90,wong,LIZA,2024-12-04 19:00:11.601935
Tizas Crayola Jumbo Lavable 12 un.,S/ 22.30,wong,LIZA,2024-12-04 19:00:11.601935
Pijama Navideña para Bebé Lima Basics Talla 12M,S/ 49.90,wong,LIZA,2024-12-04 19:00:11.601935
Pijama Navideña para Bebé Lima Basics Talla 6M,S/ 49.90,wong,LIZA,2024-12-04 19:00:11.601935
Pijama Navideña para Bebé Lima Basics Talla 9M,S/ 49.90,wong,LIZA,2024-12-04 19:00:11.601935
Ligas Foggy para Cabello 4un,S/ 4.90,wong,LIZA,2024-12-04 19:00:11.601935
Lavavajillas Ayudín Lima Limón 1.2L,S/ 18.50,wong,LIZA,2024-12-04 19:00:11.601935
Gaseosa Sprite Lima Limón Botella 3L,S/ 6.90,wong,LIZA,2024-12-04 19:00:11.601935
Gaseosa Sprite Lima Limón Botella 2.25L,S/ 6.40,wong,LIZA,2024-12-04 19:00:11.601935
Lavavajillas Lima Limón Sapolio Frasco 1250 ml,S/ 13.90,wong,LIZA,2024-12-04 19:00:11.601935
Gaseosa Sprite Lima Limón Botella 500ml,S/ 2.70,wong,LIZA,2024-12-04 19:00:11.601935
Lavavajillas Líquido Ayudín Lima Limón 640ml,S/ 12.90,wong,LIZA,2024-12-04 19:00:11.601935
Smartphone Motorola G85 5G 256Gb+8Gb Verde Lima,S/ 999.00,wong,LIZA,2024-12-04 19:00:11.601935
Papa en Hojuelas Inka Chips Finas Hierbas y Lima 115g,S/ 8.20,wong,LIZA,2024-12-04 19:00:11.601935
Sixpack Gaseosa Sprite Lima Limón Botella 500ml,S/ 13.50,wong,LIZA,2024-12-04 19:00:11.601935
Fourpack Cerveza Artesanal Barbarían Lima Botella 330ml,S/ 29.90,wong,LIZA,2024-12-04 19:00:11.601935
Kit de Tizas para el Cabello Fashion Angels Unicornio Mágico,S/ 99.99,wong,LIZA,2024-12-04 19:00:11.601935
Krea Sabana Lisa Queen 400H Algodon Blanco,S/ 219.90,wong,LIZA,2024-12-04 19:00:11.601935
Café Orgánico Molido Blue Llama Sumaq Lima Doypack 284 g,S/ 38.50,wong,LIZA,2024-12-04 19:00:11.601935
Smartphone ZTE Blade A54 Lila,S/ 339.00,wong,LIZA,2024-12-04 19:00:11.601935
Juego de Sábanas Krea Lisas 144 Hilos Blanco Queen,S/ 129.90,wong,LIZA,2024-12-04 19:00:11.601935
Juego de Sábana Krea Lisa 2 Plazas 400 Hilos Algodón Blanco,S/ 209.90,wong,LIZA,2024-12-04 19:00:11.601935
Manta Krea Polar Lisa 120x150cm Surtido,S/ 6.50,wong,LIZA,2024-12-04 19:00:11.601935
Manta Krea Sherpa Lisa 125x150cm Surtido,S/ 17.90,wong,LIZA,2024-12-04 19:00:11.601935
Sabana Krea Lisa Queen Plaza 180 H Polialgodón Blanco,S/ 139.90,wong,LIZA,2024-12-04 19:00:11.601935
Krea Sabana Lisa King 400H Algodon Blanco,S/ 229.90,wong,LIZA,2024-12-04 19:00:11.601935
Juego de Sábanas Krea Lisas 144 Hilos Blanco 2 Plazas,S/ 109.90,wong,LIZA,2024-12-04 19:00:11.601935
Sábanas 1.5 Plazas Krea Lisa 132H Aqua Oscuro,S/ 79.90,wong,LIZA,2024-12-04 19:00:11.601935
Funda Cojin Lisa 40x40cm,S/ 14.00,wong,LIZA,2024-12-04 19:00:11.601935
Set 12 Esferas Krea 6cm Lila Navidad 2024,S/ 6.00,wong,LIZA,2024-12-04 19:00:11.601935
Frazada Krea Sherpa Lisa 2 Plazas Surtido,S/ 39.90,wong,LIZA,2024-12-04 19:00:11.601935
Exfoliante Corporal Coco y Lima Tree Hut Pote 510 g,S/ 69.10,wong,LIZA,2024-12-04 19:00:11.601935
Sabana Krea Lisa Queen Plaza 144H Polialgodón Cielo,S/ 129.90,wong,LIZA,2024-12-04 19:00:11.601935
Pack 20 Velas Krea T-Light Lila,S/ 10.19,wong,LIZA,2024-12-04 19:00:11.601935
Set 4 Esferas Krea 8cm Lila Navidad 2024,S/ 3.60,wong,LIZA,2024-12-04 19:00:11.601935
Juego de Sábanas Krea Lisa 2 Plazas 180 Hilos Policotton Blanco,S/ 129.90,wong,LIZA,2024-12-04 19:00:11.601935
Set 16 Esferas Krea 4cm Lila Navidad 2024,S/ 4.00,wong,LIZA,2024-12-04 19:00:11.601935
Juego de Sábanas Krea Lisas 1.5 Plazas 144 Hilos Blanco,S/ 89.90,wong,LIZA,2024-12-04 19:00:11.601935
Frazada Krea Sherpa Lisa 1.5 Plaza Surtido,S/ 28.90,wong,LIZA,2024-12-04 19:00:11.601935
Set 8 Esferas Krea 7cm Lila Navidad 2024,S/ 6.00,wong,LIZA,2024-12-04 19:00:11.601935
Manta Polar Lisa 120x150cm 1/2 Surtido,S/ 14.90,wong,LIZA,2024-12-04 19:00:11.601935
Krea Vasos Alto Líneas Lisas 480 ml 6 unid,S/ 16.99,wong,LIZA,2024-12-04 19:00:11.601935
Juego de Sábanas Krea King Plaza Lisa Algodón Blanco,S/ 105.00,wong,LIZA,2024-12-04 19:00:11.601935
Set de Tizas Cra Z Art para Pintar el Pelo,S/ 79.90,wong,LIZA,2024-12-04 19:00:11.601935
Esfera Krea Calada Lila Palacio Navidad 2024,S/ 2.00,wong,LIZA,2024-12-04 19:00:11.601935
Lick Mat Pet's Fun 18.5x15.5cm Lila,S/ 9.90,wong,LIZA,2024-12-04 19:00:11.601935
Jabón Líquido Ballerina Antibacterial Coco y Lima 750ml,S/ 11.50,wong,LIZA,2024-12-04 19:00:11.601935
Juego de Sábanas Krea Lisa 1.5 Plaza 180 Hilos Policotton Blanco,S/ 99.90,wong,LIZA,2024-12-04 19:00:11.601935
Juego de Sábanas Krea Lisas 132 Hilos Blanco Queen,S/ 109.90,wong,LIZA,2024-12-04 19:00:11.601935
Mat Radost Lila Liso,S/ 29.95,wong,LIZA,2024-12-04 19:00:11.601935
Sabana Krea Lisa 2 Plazas Microfibra 75Gsm Surtido,S/ 49.90,wong,LIZA,2024-12-04 19:00:11.601935
Sabana Krea Lisa 1.5 Plazas Microfibra 75Gsm Surtido,S/ 39.90,wong,LIZA,2024-12-04 19:00:11.601935
Manta Polar Lisa 120x150cm Surtido,S/ 14.90,wong,LIZA,2024-12-04 19:00:11.601935
Sabana Krea Lisa Queen Plaza 144H Polialgodón Rosado,S/ 129.90,wong,LIZA,2024-12-04 19:00:11.601935
Vela Krea Votiva Aroma Lila,S/ 2.99,wong,LIZA,2024-12-04 19:00:11.601935
Bebedero Pet's Fun Portátil Lila 380ml,S/ 21.90,wong,LIZA,2024-12-04 19:00:11.601935
Jarra Krea Loza,S/ 10.20,wong,LIZA,2024-12-04 19:00:11.601935
Juego de Sábanas Krea Lisa 2 Plazas 300 Hilos Algodón Blanco,S/ 179.90,wong,LIZA,2024-12-04 19:00:11.601935
Botella Thermos Deportiva Verde Lima 950ml,S/ 26.59,wong,LIZA,2024-12-04 19:00:11.601935
Manta Krea Polar Lisa 120x150cm Surtido,S/ 6.50,wong,LIZA,2024-12-04 19:00:11.601935
Sábanas 1.5 Plazas Krea Lisa 144H Rosado,S/ 89.90,wong,LIZA,2024-12-04 19:00:11.601935
Sábanas 1.5 Plazas Krea Lisa 144H Cielo,S/ 89.90,wong,LIZA,2024-12-04 19:00:11.601935
Sabana Krea Lisa Queen Plaza Microfibra 75Gsm Surtido,S/ 59.90,wong,LIZA,2024-12-04 19:00:11.601935
Sabana Krea Lisa 2 Plazas 144H Polialgodón Rosado,S/ 109.90,wong,LIZA,2024-12-04 19:00:11.601935
Sixpack Cerveza Cristal Alianza Lima Lata 355ml,S/ 22.90,wong,LIZA,2024-12-04 19:00:11.601935
Vela Krea Pilar 9cm Lila,S/ 11.39,wong,LIZA,2024-12-04 19:00:11.601935
Vela Krea Votiva Vaso Vidrio Lila,S/ 4.79,wong,LIZA,2024-12-04 19:00:11.601935
Sabana Krea Lisa 2 Plazas Aqua Oscuro 132H Polialgodón,S/ 89.90,wong,LIZA,2024-12-04 19:00:11.601935
Sazonador Pimienta Lima Badia 184g,S/ 20.10,wong,LIZA,2024-12-04 19:00:11.601935
Sábanas Queen Krea Lisa 132H Plaza Aqua Oscuro,S/ 109.90,wong,LIZA,2024-12-04 19:00:11.601935
Juguete para Perros Pet Care Soga Lila,S/ 12.09,wong,LIZA,2024-12-04 19:00:11.601935
Frazada Krea Polar Lisa 1.5 Plaza Surtido,S/ 13.90,wong,LIZA,2024-12-04 19:00:11.601935
Cartulina Sadipal Lila,S/ 3.10,wong,LIZA,2024-12-04 19:00:11.601935
Libreta de Apuntes A5 Minerva con Liga 96 hojas,S/ 19.00,wong,LIZA,2024-12-04 19:00:11.601935
Papel de Seda 50 x 70cm Benji 5un. Lila,S/ 2.50,wong,LIZA,2024-12-04 19:00:11.601935
Velas de Cumpleaños Glitter Rayas y Puntos Lila Paquete 6 unid,S/ 3.50,wong,LIZA,2024-12-04 19:00:11.601935
Libreta Artesco Glitter con Liga Morning,S/ 22.90,wong,LIZA,2024-12-04 19:00:11.601935
Juego de Sábanas Krea Lisas 132 Hilos Blanco 1.5 Plazas,S/ 79.90,wong,LIZA,2024-12-04 19:00:11.601935
Set de Limas QVS Emery Boards 10 un,S/ 7.99,wong,LIZA,2024-12-04 19:00:11.601935
Papel de Regalo DG Regalos Snoopy Lila,S/ 4.90,wong,LIZA,2024-12-04 19:00:11.601935
Vela Krea Pilar 15cm Lila,S/ 20.29,wong,LIZA,2024-12-04 19:00:11.601935
Vela Krea Redonda Lila,S/ 8.99,wong,LIZA,2024-12-04 19:00:11.601935
