description,price,website,search_term,scrape_timestamp
Manzana Verde x kg,S/ 8.16 x kg,wong,MANZANA DELICIA,2024-12-04 19:28:40.428358
Manzana Roja x kg,S/ 7.59 x kg,wong,MANZANA DELICIA,2024-12-04 19:28:40.428358
Manzana Pink Lady x kg,S/ 8.99 x kg,wong,MANZANA DELICIA,2024-12-04 19:28:40.428358
Manzana Royal Gala x kg,S/ 8.99 x kg,wong,MANZANA DELICIA,2024-12-04 19:28:40.428358
Manzana Israel x kg,S/ 3.82 x kg,wong,MANZANA DELICIA,2024-12-04 19:28:40.428358
Manzana Fuji x kg,S/ 7.19 x kg,wong,MANZANA DELICIA,2024-12-04 19:28:40.428358
Manzana Rayada Wong x kg,S/ 3.82 x kg,wong,MANZANA DELICIA,2024-12-04 19:28:40.428358
Manzana Americana Verde x kg,S/ 8.83 x kg,wong,MANZANA DELICIA,2024-12-04 19:28:40.428358
Manzanas Deshidratadas Wel-B 12g,S/ 8.70,wong,MANZANA DELICIA,2024-12-04 19:28:40.428358
Manzana Deshidratada Natifrut x kg,S/ 189.00 x kg,wong,MANZANA DELICIA,2024-12-04 19:28:40.428358
Supercat Delicias Gatitos Pollo Pescado 3Kg,S/ 36.00,wong,MANZANA DELICIA,2024-12-04 19:28:40.428358
Delicias Pechuga de Pavo y Vacuno Dentitoy 4un,S/ 8.60,wong,MANZANA DELICIA,2024-12-04 19:28:40.428358
Delicias en Salsa Sabor Atún Supercat,S/ 5.00,wong,MANZANA DELICIA,2024-12-04 19:28:40.428358
Delicias en Salsa Super Cat Adultos Sabor Pavo 190g,S/ 5.00,wong,MANZANA DELICIA,2024-12-04 19:28:40.428358
Supercat Delicias Gatitos Pollo Pescado 1Kg,S/ 13.50,wong,MANZANA DELICIA,2024-12-04 19:28:40.428358
Delicias en Salsa Super Cat Adultos Sabor Carne 190g,S/ 5.00,wong,MANZANA DELICIA,2024-12-04 19:28:40.428358
Delicias en Salsa Sabor Pescado Cachorro Supercat,S/ 5.00,wong,MANZANA DELICIA,2024-12-04 19:28:40.428358
Delicias Pechuga de Pato y Vacuno Dentitoy 4un,S/ 8.60,wong,MANZANA DELICIA,2024-12-04 19:28:40.428358
Pera Packhams x kg,S/ 7.99 x kg,wong,MANZANA DELICIA,2024-12-04 19:28:40.428358
Sixpack Bebida con Gas San Luis Manzana Botella 625ml,S/ 13.20,wong,MANZANA DELICIA,2024-12-04 19:28:40.428358
Lavavajilla Líquida Sapolio Manzana 1.25 L,S/ 13.90,wong,MANZANA DELICIA,2024-12-04 19:28:40.428358
Sixpack Bebida con Gas San Luis Manzana Botella 625ml,S/ 13.20,wong,MANZANA DELICIA,2024-12-04 19:28:40.428358
Vinagre de Sidra de Manzana Orgánico Bragg Botella 946 ml,S/ 37.90,wong,MANZANA DELICIA,2024-12-04 19:28:40.428358
Membrillo x kg,S/ 12.59 x kg,wong,MANZANA DELICIA,2024-12-04 19:28:40.428358
Suavizante de Telas Suavitel Cuidado Superior Frescura de Manzana 2.3L,S/ 18.90,wong,MANZANA DELICIA,2024-12-04 19:28:40.428358
Jabón Líquido para Manos Palmolive Flor de Manzana & Gardenia 800ml,S/ 15.30,wong,MANZANA DELICIA,2024-12-04 19:28:40.428358
Vinagre de Sidra de Manzana Orgánico Bragg Botella 473 ml,S/ 22.90,wong,MANZANA DELICIA,2024-12-04 19:28:40.428358
Bebida Con Gas San Luis Manzana Botella 625ml,S/ 2.20,wong,MANZANA DELICIA,2024-12-04 19:28:40.428358
Sixpack Bebida de Manzana Frugos del Valle Caja 235ml,S/ 7.90,wong,MANZANA DELICIA,2024-12-04 19:28:40.428358
Bebida de Manzana Frugos del Valle Caja 1.5L,S/ 5.50,wong,MANZANA DELICIA,2024-12-04 19:28:40.428358
Lavavajilla en Pasta Sapolio Manzana 800g,S/ 6.00,wong,MANZANA DELICIA,2024-12-04 19:28:40.428358
Lavavajillas Líquido Eco House Manzana 900ml,S/ 17.50,wong,MANZANA DELICIA,2024-12-04 19:28:40.428358
Vinagre de Manzana Frasco 500 ml,S/ 11.90,wong,MANZANA DELICIA,2024-12-04 19:28:40.428358
Shampoo Head & Shoulders Manzana Fresh 375ml,S/ 19.50,wong,MANZANA DELICIA,2024-12-04 19:28:40.428358
Torta Delicia de Fresa Dulce Pasión 16 Porciones,S/ 59.92,wong,MANZANA DELICIA,2024-12-04 19:28:40.428358
"Granola Crosoy Manzana, Canela y Pecanas 380g",S/ 14.40,wong,MANZANA DELICIA,2024-12-04 19:28:40.428358
Galleta de Arroz Baby Mum-Mum Manzana Caja 50 gr,S/ 14.10,wong,MANZANA DELICIA,2024-12-04 19:28:40.428358
Puré de Manzana Cuisine&Co Frasco 850 g,S/ 9.90,wong,MANZANA DELICIA,2024-12-04 19:28:40.428358
Lavavajillas Líquido La Oca Manzana Verde 1L,S/ 17.90,wong,MANZANA DELICIA,2024-12-04 19:28:40.428358
Ambientador Glade Aerosol Manzana Canela 400ml,S/ 10.90,wong,MANZANA DELICIA,2024-12-04 19:28:40.428358
Vinagre de Sidra de Manzana De Nigris Botella 1 Lt,S/ 19.90,wong,MANZANA DELICIA,2024-12-04 19:28:40.428358
Puré de Frutas Orgánico Manzana AMA Pouch 90 g,S/ 4.90,wong,MANZANA DELICIA,2024-12-04 19:28:40.428358
Barras de Cereales Cereal Bar Manzana y Canela 12un,S/ 6.90,wong,MANZANA DELICIA,2024-12-04 19:28:40.428358
"Sixpack Galletas +Nutri Co Quinua Manzana, Avena y Canela 30g",S/ 16.20,wong,MANZANA DELICIA,2024-12-04 19:28:40.428358
Ambientador Glade Aceites Naturales Manzana y Canela 3 repuestos 63ml,S/ 46.30,wong,MANZANA DELICIA,2024-12-04 19:28:40.428358
Bebida De Manzana Naturale Botella 1 Litro,S/ 7.90,wong,MANZANA DELICIA,2024-12-04 19:28:40.428358
Muesli con Manzana Kellogg's 275g,S/ 25.90,wong,MANZANA DELICIA,2024-12-04 19:28:40.428358
"Jugo de Arándano, Uva y Manzana Bio Botella 300ml",S/ 3.80,wong,MANZANA DELICIA,2024-12-04 19:28:40.428358
Jugo de Manzana Langers Botella 64 Onzas,S/ 22.40,wong,MANZANA DELICIA,2024-12-04 19:28:40.428358
Jugo de Manzana y Camu Camu Bio Botella 300ml,S/ 3.80,wong,MANZANA DELICIA,2024-12-04 19:28:40.428358
Vinagre de Manzana Perú Pride Botella 500 ml,S/ 12.70,wong,MANZANA DELICIA,2024-12-04 19:28:40.428358
Aromatizador Glade Cubo Manzana Canela,S/ 11.00,wong,MANZANA DELICIA,2024-12-04 19:28:40.428358
Bebida Rehidratante Suerox Manzana Botella 630ml,S/ 6.50,wong,MANZANA DELICIA,2024-12-04 19:28:40.428358
Vinagre de Sidra de Manzana Orgánico De Nigris Botella 500 ml,S/ 12.90,wong,MANZANA DELICIA,2024-12-04 19:28:40.428358
Vinagre de Manzana Olivos Del Sur Botella 500 ml,S/ 15.20,wong,MANZANA DELICIA,2024-12-04 19:28:40.428358
Ambientador Glade Aceites Naturales Manzana Canela 2 repuestos 42ml,S/ 33.90,wong,MANZANA DELICIA,2024-12-04 19:28:40.428358
Gaseosa Fanta Beetlejuice Manzana Verde Botella 500ml,S/ 2.70,wong,MANZANA DELICIA,2024-12-04 19:28:40.428358
Compota Smiley Kids Manzana y Ciruela 90g,S/ 4.90,wong,MANZANA DELICIA,2024-12-04 19:28:40.428358
Avena Instantánea con Manzana y Canela Sin Gluten Dyfferent Pote 65 g,S/ 5.80,wong,MANZANA DELICIA,2024-12-04 19:28:40.428358
Lavavajilla Líquida Sapolio Manzana Frasco 750 ml,S/ 9.50,wong,MANZANA DELICIA,2024-12-04 19:28:40.428358
Keke de Manzana + Gaseosa Botella 1.5L,S/ 18.32,wong,MANZANA DELICIA,2024-12-04 19:28:40.428358
Keke de Manzana con Canela 8 Porciones,S/ 16.72,wong,MANZANA DELICIA,2024-12-04 19:28:40.428358
Avena Con Manzana Instantánea Santa Catalina Bolsa 150 g,S/ 5.90,wong,MANZANA DELICIA,2024-12-04 19:28:40.428358
"Infusión Manzanilla, Canela y Manzana Twinings Caja 10 Unidades",S/ 19.90,wong,MANZANA DELICIA,2024-12-04 19:28:40.428358
Bebida de Manzana L'Onda Botella 1.89L,S/ 16.80,wong,MANZANA DELICIA,2024-12-04 19:28:40.428358
Lavavajillas en Pasta Home Care Manzana 800g,S/ 3.90,wong,MANZANA DELICIA,2024-12-04 19:28:40.428358
Agua Socosani Saborizada Manzana Botella 500 ml,S/ 2.00,wong,MANZANA DELICIA,2024-12-04 19:28:40.428358
Pack x2 Sixpack Bebida de Manzana Frugos del Valle Caja 235ml,S/ 14.50,wong,MANZANA DELICIA,2024-12-04 19:28:40.428358
Jugo de Manzana Florida's Nature Lata 340ml,S/ 5.90,wong,MANZANA DELICIA,2024-12-04 19:28:40.428358
Ambientador Glade en Gel bolsa Manzana Canela 30g,S/ 4.30,wong,MANZANA DELICIA,2024-12-04 19:28:40.428358
Puré de Frutas Orgánico Manzana y Arándano AMA Pouch 90 g,S/ 4.90,wong,MANZANA DELICIA,2024-12-04 19:28:40.428358
Ambientador Glade Toque Manzana Canela 2 repuestos 18gr,S/ 17.00,wong,MANZANA DELICIA,2024-12-04 19:28:40.428358
Compota Smiley Kids Manzana + Plátano + Arándano 90g,S/ 4.90,wong,MANZANA DELICIA,2024-12-04 19:28:40.428358
Jugo de Manzana Kedem Light Botella 1.89L,S/ 16.90,wong,MANZANA DELICIA,2024-12-04 19:28:40.428358
Ambientador Glade Automático en Aerosol Aparato Manzana y Canela 175g,S/ 52.20,wong,MANZANA DELICIA,2024-12-04 19:28:40.428358
Ambientador Glade Automático en Aerosol Repuesto Manzana y Canela 175g,S/ 36.80,wong,MANZANA DELICIA,2024-12-04 19:28:40.428358
Shampoo Head & Shoulders Manzana Fresh 650ml,S/ 29.90,wong,MANZANA DELICIA,2024-12-04 19:28:40.428358
Bebida de Manzana Frugos del Valle Caja 970ml,S/ 3.90,wong,MANZANA DELICIA,2024-12-04 19:28:40.428358
Puré de Frutas Orgánico Manzana y Plátano AMA Pouch 90 g,S/ 4.90,wong,MANZANA DELICIA,2024-12-04 19:28:40.428358
Snack de Manzana Deshidratada Snack Fruits 50g,S/ 9.60,wong,MANZANA DELICIA,2024-12-04 19:28:40.428358
"Bebida de Manzana, Aguaje y Cocona Bio Botella 300ml",S/ 3.80,wong,MANZANA DELICIA,2024-12-04 19:28:40.428358
Compota de Manzana Gerber 113g,S/ 5.10,wong,MANZANA DELICIA,2024-12-04 19:28:40.428358
Vinagre de Manzana Kemal Kükrer 500ml,S/ 17.90,wong,MANZANA DELICIA,2024-12-04 19:28:40.428358
Granola Dyfferent Sabor Manzana Canela 250g,S/ 19.60,wong,MANZANA DELICIA,2024-12-04 19:28:40.428358
Galletas de Pie de Manzana Merba 225g,S/ 9.90,wong,MANZANA DELICIA,2024-12-04 19:28:40.428358
Compota de Manzana Agú 113g,S/ 4.10,wong,MANZANA DELICIA,2024-12-04 19:28:40.428358
"Bebida de Manzana, Aguaymanto y Carambola Bio Amayu Botella 300ml",S/ 3.80,wong,MANZANA DELICIA,2024-12-04 19:28:40.428358
Torta Delicia de Fresa Dulce Pasión 10 Porciones,S/ 51.92,wong,MANZANA DELICIA,2024-12-04 19:28:40.428358
Jugo Ama Manzana Mango Tetra 200ml,S/ 6.60,wong,MANZANA DELICIA,2024-12-04 19:28:40.428358
Jugo Ama Manzana Arándano Tetra 200ml,S/ 6.60,wong,MANZANA DELICIA,2024-12-04 19:28:40.428358
Avena Instantánea Cuisine & Co Manzana y Canela 45g,S/ 5.90,wong,MANZANA DELICIA,2024-12-04 19:28:40.428358
Nopal Flax Manzana 454 g,S/ 44.90,wong,MANZANA DELICIA,2024-12-04 19:28:40.428358
Ambientador Glade Aceites Naturales Manzana Canela + 1 repuesto 21ml,S/ 29.10,wong,MANZANA DELICIA,2024-12-04 19:28:40.428358
Sidra The Good Cider Manzana Botella 750ml,S/ 28.90,wong,MANZANA DELICIA,2024-12-04 19:28:40.428358
Twopack Bebida de Manzana Frugos del Valle Caja 1.5L,S/ 9.90,wong,MANZANA DELICIA,2024-12-04 19:28:40.428358
Puré de Frutas Orgánico Manzana y Mango AMA Pouch 90 g,S/ 4.90,wong,MANZANA DELICIA,2024-12-04 19:28:40.428358
Snack Rice Puff Baby Mum Mum Manzana y Plátano 50g,S/ 15.90,wong,MANZANA DELICIA,2024-12-04 19:28:40.428358
Torta Delicia de Fresa 6 Porciones,S/ 38.90,wong,MANZANA DELICIA,2024-12-04 19:28:40.428358
Jugo de Manzana Kedem Botella 1.89L,S/ 16.90,wong,MANZANA DELICIA,2024-12-04 19:28:40.428358
Tripack Bebida de Manzana Frugos del Valle Caja 1.5L,S/ 14.90,wong,MANZANA DELICIA,2024-12-04 19:28:40.428358
Strudel de Manzana 8 Porciones,S/ 32.90,wong,MANZANA DELICIA,2024-12-04 19:28:40.428358
Shampoo & Body Wash Attitude Natural Care Manzana 473ml,S/ 70.00,wong,MANZANA DELICIA,2024-12-04 19:28:40.428358
Torta Delicia de Moka 10 Porciones,S/ 26.90,wong,MANZANA DELICIA,2024-12-04 19:28:40.428358
Tartaleta de Manzana Personal Denky,S/ 8.20,wong,MANZANA DELICIA,2024-12-04 19:28:40.428358
Ambientador Glade en Vela Manzana y Canela 96g,S/ 24.10,wong,MANZANA DELICIA,2024-12-04 19:28:40.428358
Jugo de Fruta AMA Manzana Durazno Caja 200ml,S/ 6.40,wong,MANZANA DELICIA,2024-12-04 19:28:40.428358
Compota de Manzana Heinz Frasco 113 g,S/ 5.80,wong,MANZANA DELICIA,2024-12-04 19:28:40.428358
Pack Olivos del Sur: Aceite de Oliva 200ml + Vinagre de Manzana 100ml,S/ 36.00,wong,MANZANA DELICIA,2024-12-04 19:28:40.428358
Vinagre de Sidra de Manzana con Miel y Cúrcuma Botella 500 ml,S/ 24.90,wong,MANZANA DELICIA,2024-12-04 19:28:40.428358
Bebida de Manzana Naturale Botella 500 ml,S/ 4.90,wong,MANZANA DELICIA,2024-12-04 19:28:40.428358
Bebida Frugos Fresh Manzana Botella 500ml,S/ 1.60,wong,MANZANA DELICIA,2024-12-04 19:28:40.428358
Twopack Bebida de Manzana Frugos del Valle Caja 1L,S/ 7.50,wong,MANZANA DELICIA,2024-12-04 19:28:40.428358
Puré de Manzana Lorenzo 120g,S/ 4.00,wong,MANZANA DELICIA,2024-12-04 19:28:40.428358
Puré de Manzana D'Marco Frasco 900 g,S/ 11.50,wong,MANZANA DELICIA,2024-12-04 19:28:40.428358
Bebida Manzana Con Aloe Sappe Frasco 300 ml,S/ 6.60,wong,MANZANA DELICIA,2024-12-04 19:28:40.428358
Puré de Manzana Cuisine & Co 1kg,S/ 18.90,wong,MANZANA DELICIA,2024-12-04 19:28:40.428358
Pita Chips Manzana Wong Caja 90 g,S/ 10.90,wong,MANZANA DELICIA,2024-12-04 19:28:40.428358
Pera Red D'anjou x kg,S/ 8.49 x kg,wong,MANZANA DELICIA,2024-12-04 19:28:40.428358
Vinagre de Sidra de Manzana con Miel y Arándanos Botella 500 ml,S/ 19.90,wong,MANZANA DELICIA,2024-12-04 19:28:40.428358
Puré de Manzana Cuisine & Co 500g,S/ 11.50,wong,MANZANA DELICIA,2024-12-04 19:28:40.428358
