description,price,website,search_term,scrape_timestamp
Lenteja Bebé Cuisine & Co 500g,S/ 4.90,wong,MENESTRAS SANCOCHADAS,2024-12-04 20:37:41.020017
Lenteja Costeño 500g,S/ 5.40,wong,MENESTRAS SANCOCHADAS,2024-12-04 20:37:41.020017
Quinua Cuisine & Co 500g,S/ 9.30,wong,MENESTRAS SANCOCHADAS,2024-12-04 20:37:41.020017
Lenteja Bebé Tesoro Del Campo Bolsa 500 g,S/ 5.50,wong,MENESTRAS SANCOCHADAS,2024-12-04 20:37:41.020017
Maíz Pop Corn Costeño 500g,S/ 4.00,wong,MENESTRAS SANCOCHADAS,2024-12-04 20:37:41.020017
Quinua Costeño 500g,S/ 9.89,wong,MENESTRAS SANCOCHADAS,2024-12-04 20:37:41.020017
Frijol Canario Cuisine & Co 500g,S/ 8.40,wong,MENESTRAS SANCOCHADAS,2024-12-04 20:37:41.020017
Frijol Canario Costeño 500g,S/ 9.00,wong,MENESTRAS SANCOCHADAS,2024-12-04 20:37:41.020017
Arveja Partida Costeño 500g,S/ 3.80,wong,MENESTRAS SANCOCHADAS,2024-12-04 20:37:41.020017
Trigo Mote Tesoro Del Campo Bolsa 500 g,S/ 3.90,wong,MENESTRAS SANCOCHADAS,2024-12-04 20:37:41.020017
Garbanzos Cuisine & Co 500g,S/ 5.40,wong,MENESTRAS SANCOCHADAS,2024-12-04 20:37:41.020017
Frijol Panamito Cuisine & Co Bolsa 500 gr,S/ 5.60,wong,MENESTRAS SANCOCHADAS,2024-12-04 20:37:41.020017
Maíz Pop Corn Cuisine & Co 500g,S/ 4.70,wong,MENESTRAS SANCOCHADAS,2024-12-04 20:37:41.020017
Garbanzo Costeño 500g,S/ 6.80,wong,MENESTRAS SANCOCHADAS,2024-12-04 20:37:41.020017
Trigo Mote Costeño 500g,S/ 4.60,wong,MENESTRAS SANCOCHADAS,2024-12-04 20:37:41.020017
Frijol Red Kidney Cuisine & Co Bolsa 500 gr,S/ 6.30,wong,MENESTRAS SANCOCHADAS,2024-12-04 20:37:41.020017
Quinua Tesoro Del Campo Bolsa 500 g,S/ 10.25,wong,MENESTRAS SANCOCHADAS,2024-12-04 20:37:41.020017
Frijol Canario Valle Norte Bolsa 500 g,S/ 8.80,wong,MENESTRAS SANCOCHADAS,2024-12-04 20:37:41.020017
Pallar Cuisine & Co Bolsa 500 gr,S/ 6.90,wong,MENESTRAS SANCOCHADAS,2024-12-04 20:37:41.020017
Quinua Perlada Selecta Incasur Bolsa 250 gr,S/ 11.20,wong,MENESTRAS SANCOCHADAS,2024-12-04 20:37:41.020017
Frijol Canario Tesoro Del Campo Bolsa 500 g,S/ 9.00,wong,MENESTRAS SANCOCHADAS,2024-12-04 20:37:41.020017
Lenteja Cuisine & Co 500g,S/ 4.90,wong,MENESTRAS SANCOCHADAS,2024-12-04 20:37:41.020017
Pallar Costeño 500g,S/ 7.20,wong,MENESTRAS SANCOCHADAS,2024-12-04 20:37:41.020017
Frijol Negro Costeño 500g,S/ 6.99,wong,MENESTRAS SANCOCHADAS,2024-12-04 20:37:41.020017
Lentejas Bebé Bolsa 500 g,S/ 6.50,wong,MENESTRAS SANCOCHADAS,2024-12-04 20:37:41.020017
Quinua Perlada Superior Incasur Bolsa 250 gr,S/ 9.50,wong,MENESTRAS SANCOCHADAS,2024-12-04 20:37:41.020017
Maíz Pop Corn Tesoro Del Campo Bolsa 500 g,S/ 5.00,wong,MENESTRAS SANCOCHADAS,2024-12-04 20:37:41.020017
Arveja Verde Tesoro Del Campo Bolsa 500 g,S/ 4.30,wong,MENESTRAS SANCOCHADAS,2024-12-04 20:37:41.020017
Papa Seca Tesoro Del Campo Bolsa 500 g,S/ 8.30,wong,MENESTRAS SANCOCHADAS,2024-12-04 20:37:41.020017
Frijol Red Kidney Costeño 500g,S/ 6.80,wong,MENESTRAS SANCOCHADAS,2024-12-04 20:37:41.020017
Papa Seca Costeño 500g,S/ 8.70,wong,MENESTRAS SANCOCHADAS,2024-12-04 20:37:41.020017
Frijol Panamito Costeño 500g,S/ 6.20,wong,MENESTRAS SANCOCHADAS,2024-12-04 20:37:41.020017
Quinua Tricolor Orgánica Vidaandina Bolsa 454 g,S/ 19.50,wong,MENESTRAS SANCOCHADAS,2024-12-04 20:37:41.020017
Quinua Perlada Nativa Incasur Bolsa 250 gr,S/ 11.90,wong,MENESTRAS SANCOCHADAS,2024-12-04 20:37:41.020017
Garbanzos en Conserva Essential Everyday 425g,S/ 12.00,wong,MENESTRAS SANCOCHADAS,2024-12-04 20:37:41.020017
Frejol Negro Cuisine & Co 500g,S/ 6.50,wong,MENESTRAS SANCOCHADAS,2024-12-04 20:37:41.020017
Trigo Mote Cuisine & Co 500g,S/ 3.90,wong,MENESTRAS SANCOCHADAS,2024-12-04 20:37:41.020017
Arveja Cuisine & Co 500g,S/ 3.99,wong,MENESTRAS SANCOCHADAS,2024-12-04 20:37:41.020017
Garbanzos Tesoro Del Campo Bolsa 500 g,S/ 7.40,wong,MENESTRAS SANCOCHADAS,2024-12-04 20:37:41.020017
Frijol Castilla Costeño 500g,S/ 6.00,wong,MENESTRAS SANCOCHADAS,2024-12-04 20:37:41.020017
Quinua Blanca Orgánica Vidandina Doypack 454 g,S/ 19.50,wong,MENESTRAS SANCOCHADAS,2024-12-04 20:37:41.020017
Pallar Tesoro Del Campo Bolsa 500 g,S/ 8.20,wong,MENESTRAS SANCOCHADAS,2024-12-04 20:37:41.020017
Quinua tricolor Vida & Quinua Bolsa 454 g,S/ 15.50,wong,MENESTRAS SANCOCHADAS,2024-12-04 20:37:41.020017
Lenteja Tesoro Del Campo Bolsa 500 g,S/ 5.85,wong,MENESTRAS SANCOCHADAS,2024-12-04 20:37:41.020017
Frijol Panamito Tesoro Del Campo Bolsa 500 g,S/ 6.90,wong,MENESTRAS SANCOCHADAS,2024-12-04 20:37:41.020017
Garbanzos Bolsa 500 g,S/ 7.90,wong,MENESTRAS SANCOCHADAS,2024-12-04 20:37:41.020017
Frejoles Casa Verde Listos para Comer 750 g,S/ 15.70,wong,MENESTRAS SANCOCHADAS,2024-12-04 20:37:41.020017
Maíz Pop Corn Valle Norte Bolsa 500 g,S/ 6.40,wong,MENESTRAS SANCOCHADAS,2024-12-04 20:37:41.020017
Garbanzos en Salmuera Cuisine & Co 425g,S/ 8.80,wong,MENESTRAS SANCOCHADAS,2024-12-04 20:37:41.020017
Morón Costeño 500g,S/ 5.30,wong,MENESTRAS SANCOCHADAS,2024-12-04 20:37:41.020017
Frijol Castilla Tesoro Del Campo Bolsa 500 g,S/ 6.80,wong,MENESTRAS SANCOCHADAS,2024-12-04 20:37:41.020017
Quinua Blanca Vidandina Doypack 454 g,S/ 15.50,wong,MENESTRAS SANCOCHADAS,2024-12-04 20:37:41.020017
Frijoles Van Camp's Pork and Beans C/Cerdo y Arvejas Lata 16 Onzas,S/ 13.30,wong,MENESTRAS SANCOCHADAS,2024-12-04 20:37:41.020017
Lentejas Casa Verde Listas para Comer 750 g,S/ 13.60,wong,MENESTRAS SANCOCHADAS,2024-12-04 20:37:41.020017
Papa Seca Cuisine & Co 500g,S/ 6.10,wong,MENESTRAS SANCOCHADAS,2024-12-04 20:37:41.020017
Lentejón Cuisine & Co 500g,S/ 5.70,wong,MENESTRAS SANCOCHADAS,2024-12-04 20:37:41.020017
Quinua Roja Vidandina Doypack 454 g,S/ 13.30,wong,MENESTRAS SANCOCHADAS,2024-12-04 20:37:41.020017
Arveja Verde Valle Norte Bolsa 500 g,S/ 4.90,wong,MENESTRAS SANCOCHADAS,2024-12-04 20:37:41.020017
Quinua Perlada Gourmet Incasur Bolsa 250 gr,S/ 11.90,wong,MENESTRAS SANCOCHADAS,2024-12-04 20:37:41.020017
Frejoles Negros en Conserva Essential Everyday 425g,S/ 12.00,wong,MENESTRAS SANCOCHADAS,2024-12-04 20:37:41.020017
Frijoles Negros Lorenzo 425g,S/ 8.20,wong,MENESTRAS SANCOCHADAS,2024-12-04 20:37:41.020017
Frijol Red Kidney Tesoro Del Campo Bolsa 500 g,S/ 7.70,wong,MENESTRAS SANCOCHADAS,2024-12-04 20:37:41.020017
Frijoles Canarios Lorenzo 425g,S/ 8.90,wong,MENESTRAS SANCOCHADAS,2024-12-04 20:37:41.020017
Lentejón Costeño 500g,S/ 6.90,wong,MENESTRAS SANCOCHADAS,2024-12-04 20:37:41.020017
Maíz Mote Sierra Exportadora Desgranado Bolsa 425 g,S/ 14.90,wong,MENESTRAS SANCOCHADAS,2024-12-04 20:37:41.020017
Frijoles Negros en Conserva Valle Fértil 439g,S/ 9.70,wong,MENESTRAS SANCOCHADAS,2024-12-04 20:37:41.020017
Frijoles con Tocino Cuisine & Co 425g,S/ 8.80,wong,MENESTRAS SANCOCHADAS,2024-12-04 20:37:41.020017
Maíz Chulpi Desgranado Kuski Bolsa 425 g,S/ 16.30,wong,MENESTRAS SANCOCHADAS,2024-12-04 20:37:41.020017
Frejoles Negros Goya Lata 439g,S/ 15.50,wong,MENESTRAS SANCOCHADAS,2024-12-04 20:37:41.020017
Quinua Negra Vidandina Doypack 454 g,S/ 15.50,wong,MENESTRAS SANCOCHADAS,2024-12-04 20:37:41.020017
Quinua Orgánica Ecoandino 200g,S/ 15.40,wong,MENESTRAS SANCOCHADAS,2024-12-04 20:37:41.020017
Frejoles Rojos Pequeños Goya Lata 439g,S/ 17.60,wong,MENESTRAS SANCOCHADAS,2024-12-04 20:37:41.020017
Lenteja Valle Norte Bolsa 500 g,S/ 6.30,wong,MENESTRAS SANCOCHADAS,2024-12-04 20:37:41.020017
Quinua Casa Verde Bicolor Lista para Cocinar 375 g,S/ 11.90,wong,MENESTRAS SANCOCHADAS,2024-12-04 20:37:41.020017
Frijoles Colorados Lorenzo 425g,S/ 8.90,wong,MENESTRAS SANCOCHADAS,2024-12-04 20:37:41.020017
Frejoles Pintos Goya Lata 439g,S/ 15.50,wong,MENESTRAS SANCOCHADAS,2024-12-04 20:37:41.020017
Lentejón Tesoro Del Campo Bolsa 500 g,S/ 6.40,wong,MENESTRAS SANCOCHADAS,2024-12-04 20:37:41.020017
Lentejas Preparadas Cuisine & Co 425g,S/ 9.10,wong,MENESTRAS SANCOCHADAS,2024-12-04 20:37:41.020017
Chuño Blanco Kuski Bolsa 425 g,S/ 17.90,wong,MENESTRAS SANCOCHADAS,2024-12-04 20:37:41.020017
Conserva para Untar Duw Jamón Endiablado El Original 115g,S/ 12.50,wong,MENESTRAS SANCOCHADAS,2024-12-04 20:37:41.020017
Frijol Guinda Costeño 500g,S/ 6.60,wong,MENESTRAS SANCOCHADAS,2024-12-04 20:37:41.020017
Frijoles con Tocino Valle Fértil Salsa de Tomate VF 454 g,S/ 9.70,wong,MENESTRAS SANCOCHADAS,2024-12-04 20:37:41.020017
Quinua Roja Orgánica Vidaandina Bolsa 454 g,S/ 19.50,wong,MENESTRAS SANCOCHADAS,2024-12-04 20:37:41.020017
Maíz Cancha Sierra Exportadora Desgranado Bolsa 425 g,S/ 11.30,wong,MENESTRAS SANCOCHADAS,2024-12-04 20:37:41.020017
Quinua Negra Orgánica Vidaandina Bolsa 454 g,S/ 19.50,wong,MENESTRAS SANCOCHADAS,2024-12-04 20:37:41.020017
Frejol Canario Essential Everyday 425g,S/ 12.00,wong,MENESTRAS SANCOCHADAS,2024-12-04 20:37:41.020017
Conserva para Untar Duw Jamón Endiablado El Original 54g,S/ 8.50,wong,MENESTRAS SANCOCHADAS,2024-12-04 20:37:41.020017
Arveja Partida Máxima 500g,S/ 3.50,wong,MENESTRAS SANCOCHADAS,2024-12-04 20:37:41.020017
Tamal De Maiz Casa Verde,S/ 7.90,wong,MENESTRAS SANCOCHADAS,2024-12-04 20:37:41.020017
Frejoles Rojos Pequeños en Salsa Goya Lata 425g,S/ 15.40,wong,MENESTRAS SANCOCHADAS,2024-12-04 20:37:41.020017
Ganbanzos Valle Fértil 439 g,S/ 9.70,wong,MENESTRAS SANCOCHADAS,2024-12-04 20:37:41.020017
Pallares en Salmuera Cuisine & Co 425g,S/ 8.80,wong,MENESTRAS SANCOCHADAS,2024-12-04 20:37:41.020017
Quinua Roja Orgánica Tiyapuy Doypack 340 g,S/ 8.80,wong,MENESTRAS SANCOCHADAS,2024-12-04 20:37:41.020017
Sopa de Frejoles Negros Goya Lata 425g,S/ 17.50,wong,MENESTRAS SANCOCHADAS,2024-12-04 20:37:41.020017
Picadillo de Carne Jamonilla Tulip 200g,S/ 10.50,wong,MENESTRAS SANCOCHADAS,2024-12-04 20:37:41.020017
Salchichas sin Piel Tulip 125g,S/ 10.50,wong,MENESTRAS SANCOCHADAS,2024-12-04 20:37:41.020017
Tamal De Quinua Casa Verde - Tam.Quinua Casa,S/ 8.10,wong,MENESTRAS SANCOCHADAS,2024-12-04 20:37:41.020017
Tamal De Alcachofa Casa Verde,S/ 8.10,wong,MENESTRAS SANCOCHADAS,2024-12-04 20:37:41.020017
Frejoles Aderezados Casa Verde 360g,S/ 8.20,wong,MENESTRAS SANCOCHADAS,2024-12-04 20:37:41.020017
Quinua Blanca Orgánica Tiyapuy Doypack 340 g,S/ 8.80,wong,MENESTRAS SANCOCHADAS,2024-12-04 20:37:41.020017
Magro de Cerdo Cocido Tulip 454g,S/ 42.50,wong,MENESTRAS SANCOCHADAS,2024-12-04 20:37:41.020017
Garbanzos Casa Verde 340g,S/ 7.50,wong,MENESTRAS SANCOCHADAS,2024-12-04 20:37:41.020017
Quinua Tricolor Orgánica Tiyapuy Doypack 340 g,S/ 8.80,wong,MENESTRAS SANCOCHADAS,2024-12-04 20:37:41.020017
Frejoles Carita Goya Lata 439g,S/ 13.40,wong,MENESTRAS SANCOCHADAS,2024-12-04 20:37:41.020017
Garbanzos Lorenzo 425g,S/ 8.80,wong,MENESTRAS SANCOCHADAS,2024-12-04 20:37:41.020017
Quinua Blanca Incatrail 100g,S/ 5.80,wong,MENESTRAS SANCOCHADAS,2024-12-04 20:37:41.020017
Lentejas Lorenzo 425g,S/ 7.80,wong,MENESTRAS SANCOCHADAS,2024-12-04 20:37:41.020017
Frijoles Pintos Lorenzo 425g,S/ 8.90,wong,MENESTRAS SANCOCHADAS,2024-12-04 20:37:41.020017
Quinua Tricolor Orgánica América Orgánica 340g,S/ 19.90,wong,MENESTRAS SANCOCHADAS,2024-12-04 20:37:41.020017
Quinua Blanca en Granos América Orgánica 340g,S/ 20.90,wong,MENESTRAS SANCOCHADAS,2024-12-04 20:37:41.020017
Lentejas Aderezadas Casa Verde 360g,S/ 7.50,wong,MENESTRAS SANCOCHADAS,2024-12-04 20:37:41.020017
Sancochado de Osobuco Nacional x kg,S/ 22.50 x kg,wong,MENESTRAS SANCOCHADAS,2024-12-04 20:37:41.020017
Sancochado Punta de Pecho x kg,S/ 24.90 x kg,wong,MENESTRAS SANCOCHADAS,2024-12-04 20:37:41.020017
Sancochado de Pescuezo x kg,S/ 25.90 x kg,wong,MENESTRAS SANCOCHADAS,2024-12-04 20:37:41.020017
Sancochado de Osobuco Nacional Porcionado x kg,S/ 25.90 x kg,wong,MENESTRAS SANCOCHADAS,2024-12-04 20:37:41.020017
Sancochado Punta de Pecho Nacional x kg,S/ 24.90 x kg,wong,MENESTRAS SANCOCHADAS,2024-12-04 20:37:41.020017
Sancochado de Pescuezo Nacional x kg,S/ 25.90 x kg,wong,MENESTRAS SANCOCHADAS,2024-12-04 20:37:41.020017
Verduras para Menestrón Wong Bandeja 700gr,S/ 20.00,wong,MENESTRAS SANCOCHADAS,2024-12-04 20:37:41.020017
Costillar Parrillero Wong Premium x kg,S/ 24.90 x kg,wong,MENESTRAS SANCOCHADAS,2024-12-04 20:37:41.020017
Huevito de Codorniz Sancochado Bolsa 250 g,S/ 10.99,wong,MENESTRAS SANCOCHADAS,2024-12-04 20:37:41.020017
