description,price,website,search_term,scrape_timestamp
Alas de Pollo Artisan x Kg. Libre de Antibióticos,S/ 27.50 x kg,wong,ALAS DE POLLO,2024-12-04 18:41:02.887317
Alas Pollo Congeladas San Fernando x kg,S/ 16.30 x kg,wong,ALAS DE POLLO,2024-12-04 18:41:02.887317
Alas con Punta de Pollo Natural x kg,S/ 14.90 x kg,wong,ALAS DE POLLO,2024-12-04 18:41:02.887317
Pechuga con Ala de Pollo x kg,S/ 14.50 x kg,wong,ALAS DE POLLO,2024-12-04 18:41:02.887317
Piernitas de Alas de Pollo x kg,S/ 14.90 x kg,wong,ALAS DE POLLO,2024-12-04 18:41:02.887317
Pechuga de Pollo con Alas Congelada San Fernando x kg,S/ 18.30 x kg,wong,ALAS DE POLLO,2024-12-04 18:41:02.887317
