description,price,website,search_term,scrape_timestamp
Quinua Blanca Precocida Guva 500g,S/ 9.19,wong,UVA BLANCA,2024-12-04 19:32:05.863002
Incienso Black Boles D'Olor Edition entre Uvas Y Naranjos,S/ 25.90,wong,UVA BLANCA,2024-12-04 19:32:05.863002
Ají Panca Deshidratado Guva 100g,S/ 9.00,wong,UVA BLANCA,2024-12-04 19:32:05.863002
Pack Simoniz: Silicona Protector UV 3 Aroma Fresa Frasco 400 ml + Limpiador Renovador de Llantas Llantax Frasco 400 ml,S/ 37.99,wong,UVA BLANCA,2024-12-04 19:32:05.863002
Sally Hansen Esmalte de Uñas Blanco Secado Rápido Insta Dri 113 White on Time,S/ 24.30,wong,UVA BLANCA,2024-12-04 19:32:05.863002
Quitasol Outzen twist-In 1.8Mt Eco Uv+ Azul,S/ 37.80,wong,UVA BLANCA,2024-12-04 19:32:05.863002
Sally Hansen Esmalte de Uñas Blanco Miracle Gel 450 Get Mod,S/ 46.90,wong,UVA BLANCA,2024-12-04 19:32:05.863002
