description,price,website,search_term,scrape_timestamp
Duraznos En Almíbar Wong Lata 820 g,S/ 8.50,wong,DURAZNO EN CONSERVA,2024-12-04 19:40:11.428920
Duraznos en Almíbar Cuisine & Co 820g,S/ 7.90,wong,DURAZNO EN CONSERVA,2024-12-04 19:40:11.428920
Duraznos en Almíbar Dos Caballos 820g,S/ 11.50,wong,DURAZNO EN CONSERVA,2024-12-04 19:40:11.428920
Duraznos en Almíbar Aconcagua 820g,S/ 10.90,wong,DURAZNO EN CONSERVA,2024-12-04 19:40:11.428920
Duraznos Deshidratados Wel-B 14g,S/ 8.70,wong,DURAZNO EN CONSERVA,2024-12-04 19:40:11.428920
Duraznos en Mitades Pulp 820g,S/ 11.00,wong,DURAZNO EN CONSERVA,2024-12-04 19:40:11.428920
