description,brand,price,website,search_term,scrape_timestamp
Galletas GLACITAS Bañadas con Sabor a Choconieve Paquete 6un,VICTORIA GLACITAS,S/ 4.90,vivanda,GALLETAS BAÑADAS,2024-12-05 21:34:00.490782
Galletas CHOCO ¡BUM! Bañadas con Sabor a Chocolate Paquete 6un,VICTORIA,S/ 4.80,vivanda,GALLETAS BAÑADAS,2024-12-05 21:34:00.490782
Galletas GLACITAS Bañadas con Sabor a Toffee Paquete 6un,VICTORIA GLACITAS,S/ 4.90,vivanda,GALLETAS BAÑADAS,2024-12-05 21:34:00.490782
Galletas PICARAS Fresa Pasión Bañadas en Chocolate Paquete 6un,PICARAS,S/ 6.00,vivanda,GALLETAS BAÑADAS,2024-12-05 21:34:00.490782
Galletas GLACITAS Bañadas con Sabor a Fresa Paquete 6un,VICTORIA GLACITAS,S/ 4.90,vivanda,GALLETAS BAÑADAS,2024-12-05 21:34:00.490782
