description,brand,price,website,search_term,scrape_timestamp
Ají Verde,VIVANDA,S/ 5.49,vivanda,AJÍ ROCOTO MOLIDO,2024-12-05 22:27:45.467294
Rocoto x un,VIVANDA,S/ 1.39,vivanda,AJÍ ROCOTO MOLIDO,2024-12-05 22:27:45.467294
Ají Panca en Pasta TRESA Frasco 205g,TRESA,S/ 6.89,vivanda,AJÍ ROCOTO MOLIDO,2024-12-05 22:27:45.467294
Ají Amarillo en Pasta TRESA Frasco 205g,TRESA,S/ 5.49,vivanda,AJÍ ROCOTO MOLIDO,2024-12-05 22:27:45.467294
Ají Marisol Seco BELL'S FRESCOS Bandeja 100g,BELL'S FRESCOS,S/ 7.99,vivanda,AJÍ ROCOTO MOLIDO,2024-12-05 22:27:45.467294
Ají amarillo PIKI Molido Doypack 120g,PIKI,S/ 2.90,vivanda,AJÍ ROCOTO MOLIDO,2024-12-05 22:27:45.467294
Ají Pollero CASA VERDE Doypack 75g,CASA VERDE,S/ 4.70,vivanda,AJÍ ROCOTO MOLIDO,2024-12-05 22:27:45.467294
Ají Panca Seco BELL'S FRESCOS Bandeja 100g,BELL'S FRESCOS,S/ 8.50,vivanda,AJÍ ROCOTO MOLIDO,2024-12-05 22:27:45.467294
Ají panca PIKI Molido Doypack 120Gr,PIKI,S/ 2.90,vivanda,AJÍ ROCOTO MOLIDO,2024-12-05 22:27:45.467294
Ají de Pollo,VIVANDA,S/ 9.90,vivanda,AJÍ ROCOTO MOLIDO,2024-12-05 22:27:45.467294
Ají Panca BELL'S Molido Sobre 15g,BELL'S,S/ 1.59,vivanda,AJÍ ROCOTO MOLIDO,2024-12-05 22:27:45.467294
Ají Jalapeño BELL'S,BELL'S,S/ 5.99,vivanda,AJÍ ROCOTO MOLIDO,2024-12-05 22:27:45.467294
Queso Helado EL ROCOTO Pote 1L,EL ROCOTO,S/ 42.90,vivanda,AJÍ ROCOTO MOLIDO,2024-12-05 22:27:45.467294
Ají Amarillo BELL'S Molido Sobre 10g,BELL'S,S/ 1.59,vivanda,AJÍ ROCOTO MOLIDO,2024-12-05 22:27:45.467294
Ají Criollo BELL'S Doypack 200ml,BELL'S,S/ 5.90,vivanda,AJÍ ROCOTO MOLIDO,2024-12-05 22:27:45.467294
Ají de Gallina PERÚ PRIDE Bolsa 100g,PERU PRIDE,S/ 6.39,vivanda,AJÍ ROCOTO MOLIDO,2024-12-05 22:27:45.467294
Ají WALIBI Criollo Doypack 200Gr,WALIBI,S/ 7.60,vivanda,AJÍ ROCOTO MOLIDO,2024-12-05 22:27:45.467294
Ají de Gallina PROVENZAL Sachet 100g,PROVENZAL,S/ 9.00,vivanda,AJÍ ROCOTO MOLIDO,2024-12-05 22:27:45.467294
Ají Criollo LIBBY´S Doypack 380g,LIBBY S,S/ 14.00,vivanda,AJÍ ROCOTO MOLIDO,2024-12-05 22:27:45.467294
Ají Criollo LIBBY'S Doypack 85g,LIBBY S,S/ 3.60,vivanda,AJÍ ROCOTO MOLIDO,2024-12-05 22:27:45.467294
Ají Criollo BELL'S Doypack 400g,BELL'S,S/ 7.20,vivanda,AJÍ ROCOTO MOLIDO,2024-12-05 22:27:45.467294
Ají Criollo TERRAZA GRILL Doypack 200g,TERRAZA GRILL,S/ 10.20,vivanda,AJÍ ROCOTO MOLIDO,2024-12-05 22:27:45.467294
Ajo PIKI Molido Doypack 350Gr,PIKI,S/ 12.10,vivanda,AJÍ ROCOTO MOLIDO,2024-12-05 22:27:45.467294
Ajo Molido PIKI Doypack 120g,PIKI,S/ 2.90,vivanda,AJÍ ROCOTO MOLIDO,2024-12-05 22:27:45.467294
Ajo KARIÑO Molido Frasco 40Gr,KARINO,S/ 8.30,vivanda,AJÍ ROCOTO MOLIDO,2024-12-05 22:27:45.467294
Ajo Molido BELL’S Frasco 215g,BELL'S,S/ 9.50,vivanda,AJÍ ROCOTO MOLIDO,2024-12-05 22:27:45.467294
Tapenade Ají Limo OLIVOS DEL SUR Frasco 260g,OLIVOS DEL SUR,S/ 14.70,vivanda,AJÍ ROCOTO MOLIDO,2024-12-05 22:27:45.467294
Lunch Ají de Pollo LA FLORENCIA 450g,LA FLORENCIA,S/ 12.90,vivanda,AJÍ ROCOTO MOLIDO,2024-12-05 22:27:45.467294
Comino BELL'S Molido Sobre 18g,BELL'S,S/ 3.19,vivanda,AJÍ ROCOTO MOLIDO,2024-12-05 22:27:45.467294
Café Molido SELLO ROJO Tradición Bolsa 425g,SELLO ROJO,S/ 25.10,vivanda,AJÍ ROCOTO MOLIDO,2024-12-05 22:27:45.467294
Café Tostado y Molido CAFETAL Selecto Doypack 454g,CAFETAL,S/ 24.00,vivanda,AJÍ ROCOTO MOLIDO,2024-12-05 22:27:45.467294
Comino KARIÑO Molido Frasco 40Gr,KARINO,S/ 6.10,vivanda,AJÍ ROCOTO MOLIDO,2024-12-05 22:27:45.467294
Crema ALACENA Tarí Base de Ají Doypack 400g,TARÍ,S/ 13.50,vivanda,AJÍ ROCOTO MOLIDO,2024-12-05 22:27:45.467294
Crema de Rocoto ALACENA Uchucuta Doypack 400g,ALACENA,S/ 13.50,vivanda,AJÍ ROCOTO MOLIDO,2024-12-05 22:27:45.467294
Café Molido VILLA RICA Grano Molido Gourmet Bolsa 250g,PUMA,S/ 28.90,vivanda,AJÍ ROCOTO MOLIDO,2024-12-05 22:27:45.467294
Pan Molido BELL'S Bolsa 250g,BELL'S,S/ 4.79,vivanda,AJÍ ROCOTO MOLIDO,2024-12-05 22:27:45.467294
Pan Molido Clásico BIMBO Bolsa 250g,BIMBO,S/ 6.30,vivanda,AJÍ ROCOTO MOLIDO,2024-12-05 22:27:45.467294
Salsa PIKI Ají amarillo molido Doypack 350g,PIKI,S/ 12.50,vivanda,AJÍ ROCOTO MOLIDO,2024-12-05 22:27:45.467294
Salsa PIKI Ají panca molido Doypack 350g,PIKI,S/ 12.50,vivanda,AJÍ ROCOTO MOLIDO,2024-12-05 22:27:45.467294
Café Molido ZENA Descafeinado Doypack 250g,ZENA,S/ 29.40,vivanda,AJÍ ROCOTO MOLIDO,2024-12-05 22:27:45.467294
Sazonador Ají Panca BELL'S Paquete 6un,BELL'S,S/ 2.09,vivanda,AJÍ ROCOTO MOLIDO,2024-12-05 22:27:45.467294
Conserva CALE Aceitunas al ají Frasco 185g,CALE,S/ 13.00,vivanda,AJÍ ROCOTO MOLIDO,2024-12-05 22:27:45.467294
Café Molido SELLO ROJO Tradición Bolsa 850g,SELLO ROJO,S/ 47.00,vivanda,AJÍ ROCOTO MOLIDO,2024-12-05 22:27:45.467294
Café Tostado Molido ALTOMAYO Gourmet Bolsa 450g,ALTOMAYO,S/ 35.80,vivanda,AJÍ ROCOTO MOLIDO,2024-12-05 22:27:45.467294
Café Molido ZENA Espresso Gourmet Bolsa 250g,ZENA,S/ 26.70,vivanda,AJÍ ROCOTO MOLIDO,2024-12-05 22:27:45.467294
Café Molido ARTIDORO RODRIGUEZ Cajamarca Bolsa 250g,ARTIDORO,S/ 34.80,vivanda,AJÍ ROCOTO MOLIDO,2024-12-05 22:27:45.467294
Salsa Rocoto Parrillero SPITZE Frasco 200g,SPITZE,S/ 11.40,vivanda,AJÍ ROCOTO MOLIDO,2024-12-05 22:27:45.467294
Salsa Ají Parrillero EL CHARRUA Frasco 200g,EL CHARRUA,S/ 15.20,vivanda,AJÍ ROCOTO MOLIDO,2024-12-05 22:27:45.467294
Salsa de Ají Amarillo TRESA Frasco 370g,TRESA,S/ 6.90,vivanda,AJÍ ROCOTO MOLIDO,2024-12-05 22:27:45.467294
Crema de Rocoto ALACENA Uchucuta Doypack 85g,ALACENA,S/ 4.50,vivanda,AJÍ ROCOTO MOLIDO,2024-12-05 22:27:45.467294
