description,price,website,search_term,scrape_timestamp
Alas Pollo Congeladas San Fernando x kg,S/ 16.30 x kg,metro,ALAS DE POLLO,2024-12-07 19:52:13.886432
Ala Media de de Pollo Redondos x kg,S/ 17.50 x kg,metro,ALAS DE POLLO,2024-12-07 19:52:13.886432
Ala Entera de Pollo Redondos x kg,S/ 14.90 x kg,metro,ALAS DE POLLO,2024-12-07 19:52:13.886432
Alas con Punta de Pollo Natural x kg,S/ 14.90 x kg,metro,ALAS DE POLLO,2024-12-07 19:52:13.886432
Alas de Pollo Artisan x Kg. Libre de Antibióticos,S/ 27.50 x kg,metro,ALAS DE POLLO,2024-12-07 19:52:13.886432
Pechuga de Pollo con Alas Congelada San Fernando x kg,S/ 18.30 x kg,metro,ALAS DE POLLO,2024-12-07 19:52:13.886432
